"1612.01765","Aljo\v{s}a Peperko","Aljo\v{s}a Peperko","Bounds on the joint and generalized spectral radius of Hadamard
  geometric mean of bounded sets of positive kernel operators","arXiv admin note: text overlap with arXiv:1612.01767",,,,"math.SP","http://arxiv.org/licenses/nonexclusive-distrib/1.0/","  Let $\Psi _1, \ldots \Psi _m$ be bounded sets of positive kernel operators on
a Banach function space $L$. We prove that for the generalized spectral radius
$\rho$ and the joint spectral radius $\hat{\rho}$ the inequalities $$\rho
\left(\Psi _1 ^{\left( \frac{1}{m} \right)} \circ \cdots \circ \Psi _m ^{\left(
\frac{1}{m} \right)} \right) \le \rho (\Psi _1 \Psi _2 \cdots \Psi _m)
^{\frac{1}{m}},$$ $$\hat{\rho} \left(\Psi _1 ^{\left( \frac{1}{m} \right)}
\circ \cdots \circ \Psi _m ^{\left( \frac{1}{m} \right)} \right) \le \hat{\rho}
(\Psi _1 \Psi _2 \cdots \Psi _m) ^{\frac{1}{m}}$$ hold, where $\Psi _1 ^{\left(
\frac{1}{m} \right)} \circ \cdots \circ \Psi _m ^{\left( \frac{1}{m} \right)}$
denotes the Hadamard (Schur) geometric mean of the sets $\Psi _1, \ldots , \Psi
_m$.
","[{""version"":""v1"",""created"":""Tue, 6 Dec 2016 11:38:20 GMT""}]","2017-01-05"
"1612.01766","Magnus Carlson","Magnus Carlson, Tomer M. Schlank","The unramified inverse Galois problem and cohomology rings of totally
  imaginary number fields","35 pages, comments welcome!",,,,"math.NT math.AT","http://arxiv.org/licenses/nonexclusive-distrib/1.0/","  We employ methods from homotopy theory to define new obstructions to
solutions of embedding problems. By using these novel obstructions we study
embedding problems with non-solvable kernel. We apply these obstructions to
study the unramified inverse Galois problem. That is, we show that our methods
can be used to determine that certain groups cannot be realized as the Galois
groups of unramified extensions of certain number fields. To demonstrate the
power of our methods, we give an infinite family of totally imaginary quadratic
number fields such that $\text{Aut}(\text{PSL}(2,q^2))$ for $q$ an odd prime
power, cannot be realized as an unramified Galois group over $K,$ but its
maximal solvable quotient can. To prove this result, we determine the ring
structure of the \'etale cohomology ring $H^*(\text{Spec
}\mathcal{O}_K;\mathbb{Z}/ 2\mathbb{Z})$ where $\mathcal{O}_K$ is the ring of
integers of an arbitrary totally imaginary number field $K.$
","[{""version"":""v1"",""created"":""Tue, 6 Dec 2016 11:49:16 GMT""},{""version"":""v2"",""created"":""Fri, 7 Jul 2017 11:31:23 GMT""},{""version"":""v3"",""created"":""Sun, 19 Nov 2017 20:13:12 GMT""}]","2017-11-21"
"1612.01767","Aljo\v{s}a Peperko","Aljo\v{s}a Peperko","Inequalities on the spectral radius, operator norm and numerical radius
  of Hadamard weighted geometric mean of positive kernel operators","arXiv admin note: text overlap with arXiv:1612.01765",,,,"math.SP math.FA","http://arxiv.org/licenses/nonexclusive-distrib/1.0/","  Recently, several authors have proved inequalities on the spectral radius
$\rho$, operator norm $\|\cdot\|$ and numerical radius of Hadamard products and
ordinary products of non-negative matrices that define operators on sequence
spaces, or of Hadamard geometric mean and ordinary products of positive kernel
operators on Banach function spaces. In the present article we generalize and
refine several of these results. In particular, we show that for a Hadamard
geometric mean $A ^{\left( \frac{1}{2} \right)} \circ B ^{\left( \frac{1}{2}
\right)}$ of positive kernel operators $A$ and $B$ on a Banach function space
$L$, we have $$ \rho \left(A^{(\frac{1}{2})} \circ B^{(\frac{1}{2})} \right)
\le \rho \left((AB)^{(\frac{1}{2})} \circ
(BA)^{(\frac{1}{2})}\right)^{\frac{1}{2}} \le \rho (AB)^{\frac{1}{2}}.$$ In the
special case $L=L^2(X, \mu)$ we also prove that $$\|A^{(\frac{1}{2})} \circ
B^{(\frac{1}{2})} \| \le \rho \left ( (A^* B ) ^{(\frac{1}{2})}\circ (B ^*
A)^{(\frac{1}{2})}\right)^{\frac{1}{2}} \le \rho (A^* B )^{\frac{1}{2}}.$$
","[{""version"":""v1"",""created"":""Tue, 6 Dec 2016 11:53:29 GMT""}]","2017-01-05"
"1612.01768","Gianmarco Manzini","G. Manzini, K. Lipnikov, J. D. Moulton, M. Shashkov","Convergence analysis of the mimetic finite difference method for
  elliptic problems with staggered discretization of the diffusion coefficients",,,,"Los Alamos Technical Report LA-UR-16-28012","math.NA","http://arxiv.org/licenses/nonexclusive-distrib/1.0/","  We study the convergence of the new family of mimetic finite difference
schemes for linear diffusion problems recently proposed in [38]. In contrast to
the conventional approach, the diffusion coefficient enters both the primary
mimetic operator, i.e., the discrete divergence, and the inner product in the
space of gradients. The diffusion coefficient is therefore evaluated on
different mesh locations, i.e., inside mesh cells and on mesh faces. Such a
staggered discretization may provide the exibility necessary for future
development of efficient numerical schemes for nonlinear problems, especially
for problems with degenerate coefficients. These new mimetic schemes preserve
symmetry and positive-definiteness of the continuum problem, which allow us to
use efficient algebraic solvers such as the preconditioned Conjugate Gradient
method. We show that these schemes are inf-sup stable and establish a priori
error estimates for the approximation of the scalar and vector solution fields.
Numerical examples confirm the convergence analysis and the effectiveness of
the method in providing accurate approximations.
","[{""version"":""v1"",""created"":""Tue, 6 Dec 2016 11:53:43 GMT""}]","2016-12-07"
"1612.01769","Alberto Giacomello Ph. D.","Matteo Amabili, Alberto Giacomello, Simone Meloni, and Carlo Massimo
  Casciola","Unraveling the Salvinia paradox: design principles for submerged
  superhydrophobicity",,"Advanced Materials Interfaces, 2: 1500248 (2015)","10.1002/admi.201500248",,"cond-mat.soft","http://creativecommons.org/licenses/by-nc-sa/4.0/","  The complex structure of the Salvinia molesta is investigated via rare event
molecular dynamics simulations. Results show that a hydrophilic/hydrophobic
patterning together with a re-entrant geometry control the free energy barriers
for bubble nucleation and for the Cassie-Wenzel transition. This natural
paradigm is translated into simple macroscopic design criteria for engineering
robust superhydrophobicity in submerged applications.
","[{""version"":""v1"",""created"":""Tue, 6 Dec 2016 11:56:27 GMT""}]","2016-12-07"
"1612.01770","Lutz Bornmann Dr.","Lutz Bornmann and Robin Haunschild","Measuring field-normalized impact of papers on specific societal groups:
  An altmetrics study based on Mendeley data","In press at Research Evaluation",,"10.1093/reseval/rvx005",,"cs.DL","http://arxiv.org/licenses/nonexclusive-distrib/1.0/","  Bibliometrics is successful in measuring impact, because the target is
clearly defined: the publishing scientist who is still active and working.
Thus, citations are a target-oriented metric which measures impact on science.
In contrast, societal impact measurements based on altmetrics are as a rule
intended to measure impact in a broad sense on all areas of society (e.g.
science, culture, politics, and economics). This tendency is especially
reflected in the efforts to design composite indicators (e.g. the Altmetric
attention score). We deem appropriate that not only the impact measurement
using citations is target-oriented (citations measure the impact of papers on
scientists), but also the measurement of impact using altmetrics. Impact
measurements only make sense, if the target group - the recipient of academic
papers - is clearly defined. Thus, we extend in this study the field-normalized
reader impact indicator proposed by us in an earlier study, which is based on
Mendeley data (the mean normalized reader score, MNRS), to a target-oriented
field-normalized impact indicator (e.g., MNRS_ED measures reader impact on the
sector of educational donation, i.e., teaching). This indicator can show - as
demonstrated in empirical examples - the ability of journals, countries, and
academic institutions to publish papers which are below or above the average
impact of papers on a specific sector in society (e.g., the educational or
teaching sector). For example, the method allows to measure the impact of
scientific papers on students - controlling for the field in which the papers
have been published and their publication year.
","[{""version"":""v1"",""created"":""Tue, 6 Dec 2016 11:59:45 GMT""},{""version"":""v2"",""created"":""Tue, 21 Feb 2017 16:12:40 GMT""}]","2017-07-04"
"1612.01771","Alberto Giacomello Ph. D.","Matteo Amabili, Emanuele Lisi, Alberto Giacomello, and Carlo Massimo
  Casciola","Wetting and cavitation pathways on nanodecorated surfaces",,"Soft matter, 12(12), 3046-3055 (2016)","10.1039/C5SM02794B",,"cond-mat.soft","http://creativecommons.org/licenses/by-nc-sa/4.0/","  In this contribution we study wetting and nucleation of vapor bubbles on
nanodecorated surfaces via free energy molecular dynamics simulations. The
results shed light on the stability of superhydrophobicity in submerged
surfaces with nanoscale corrugations. The re-entrant geometry of the cavities
under investigation is capable of sustaining a confined vapor phase within the
surface roughness (Cassie state) both for hydrophobic and hydrophilic
combinations of liquid and solid. The atomistic system is of nanometric size;
on this scale thermally activated events can play an important role ultimately
determining the lifetime of the Cassie state. Such superhydrophobic state can
break down by full wetting of the texture at large pressures (Cassie-Wenzel
transition) or by nucleating a vapor bubble at negative pressures (cavitation).
Specialized rare event techniques show that several pathways for wetting and
cavitation are possible, due to the complex surface geometry. The related free
energy barriers are of the order of 100 k_B T and vary with pressure. The
atomistic results are found to be in semi-quantitative accord with macroscopic
capillarity theory. However, the latter is not capable of capturing the density
fluctuations, which determine the destabilization of the confined liquid phase
at negative pressures (liquid spinodal).
","[{""version"":""v1"",""created"":""Tue, 6 Dec 2016 12:12:21 GMT""}]","2016-12-07"
"1612.01772","Tim Hulshof","Tim Hulshof and Asaf Nachmias","Slightly subcritical hypercube percolation","38 pages",,,,"math.PR math.CO","http://arxiv.org/licenses/nonexclusive-distrib/1.0/","  We study bond percolation on the hypercube $\{0,1\}^m$ in the slightly
subcritical regime where $p = p_c (1-\varepsilon_m)$ and $\varepsilon_m = o(1)$
but $\varepsilon_m \gg 2^{-m/3}$ and study the clusters of largest volume and
diameter. We establish that with high probability the largest component has
cardinality $\Theta\left(\varepsilon_m^{-2} \log(\varepsilon_m^3 2^m)\right)$,
that the maximal diameter of all clusters is $(1+o(1)) \varepsilon_m^{-1}
\log(\varepsilon_m^3 2^m)$, and that the maximal mixing time of all clusters is
$\Theta\left(\varepsilon_m^{-3} \log^2(\varepsilon_m^3 2^m)\right)$.
  These results hold in different levels of generality, and in particular, some
of the estimates hold for various classes of graphs such as high-dimensional
tori, expanders of high degree and girth, products of complete graphs, and
infinite lattices in high dimensions.
","[{""version"":""v1"",""created"":""Tue, 6 Dec 2016 12:13:03 GMT""}]","2016-12-07"
"1612.01773","Anna Kiriliouk","Anna Kiriliouk and Holger Rootz\'en and Johan Segers and Jennifer L.
  Wadsworth","Peaks over thresholds modelling with multivariate generalized Pareto
  distributions",,,,,"stat.ME stat.AP","http://arxiv.org/licenses/nonexclusive-distrib/1.0/","  When assessing the impact of extreme events, it is often not just a single
component, but the combined behaviour of several components which is important.
Statistical modelling using multivariate generalized Pareto (GP) distributions
constitutes the multivariate analogue of univariate peaks over thresholds
modelling, which is widely used in finance and engineering. We develop general
methods for construction of multivariate GP distributions and use them to
create a variety of new statistical models. A censored likelihood procedure is
proposed to make inference on these models, together with a threshold selection
procedure, goodness-of-fit diagnostics, and a computationally tractable
strategy for model selection. The models are fitted to returns of stock prices
of four UK-based banks and to rainfall data in the context of landslide risk
estimation. Supplementary materials and codes are available online.
","[{""version"":""v1"",""created"":""Tue, 6 Dec 2016 12:14:59 GMT""},{""version"":""v2"",""created"":""Tue, 6 Feb 2018 09:46:57 GMT""}]","2018-02-07"
"1612.01774","Walter Pogosov","W. V. Pogosov, D. S. Shapiro, L. V. Bork, A. I. Onishchenko","Exact solution for the inhomogeneous Dicke model in the canonical
  ensemble: thermodynamical limit and finite-size corrections","19 pages, extended version, accepted for publication in Nuclear
  Physics B","Nuclear Physics B 919 (2017) 218","10.1016/j.nuclphysb.2017.03.027",,"cond-mat.stat-mech quant-ph","http://arxiv.org/licenses/nonexclusive-distrib/1.0/","  We consider an exactly solvable inhomogeneous Dicke model which describes an
interaction between a disordered ensemble of two-level systems with single mode
boson field. The existing method for evaluation of Richardson-Gaudin equations
in the thermodynamical limit is extended to the case of Bethe equations in
Dicke model. Using this extension, we present expressions both for the ground
state and lowest excited states energies as well as leading-order finite-size
corrections to these quantities for an arbitrary distribution of individual
spin energies. We then evaluate these quantities for an equally-spaced
distribution (constant density of states). In particular, we study evolution of
the spectral gap and other related quantities. We also reveal regions on the
phase diagram, where finite-size corrections are of particular importance.
","[{""version"":""v1"",""created"":""Tue, 6 Dec 2016 12:19:17 GMT""},{""version"":""v2"",""created"":""Mon, 27 Mar 2017 05:44:24 GMT""}]","2017-04-03"
"1612.01775","Haibo Li","Hai-Bo Li","Prospects for rare and forbidden hyperon decays at BESIII","8 pages, 8 tables, add more references and corrections; many typos
  fixed; erratum added: https://doi.org/10.1007/s11467-019-0910-7","Front. Phys. 12(5), 121301 (2017)","10.1007/s11467-017-0691-9",,"hep-ex hep-ph","http://arxiv.org/licenses/nonexclusive-distrib/1.0/","  The study of hyperon decays at the Beijing Electron Spectrometer III (BESIII)
is proposed to investigate the events of $J/\psi$ decay into hyperon pairs,
which provide a pristine experimental environment at the Beijing
Electron--Positron Collider II. About $10^{6}$--$10^8$ hyperons, i.e.,
$\Lambda$, $\Sigma$, $\Xi$, and $\Omega$, will be produced in the $J/\psi$ and
$\psi(2S)$ decays with the proposed data samples at BESIII. Based on these
samples, the measurement sensitivity of the branching fractions of the hyperon
decays is in the range of $10^{-5}$--$10^{-8}$. In addition, with the known
center-of-mass energy and ""tag technique,"" rare decays and decays with
invisible final states can be probed.
","[{""version"":""v1"",""created"":""Tue, 6 Dec 2016 12:20:54 GMT""},{""version"":""v2"",""created"":""Thu, 8 Dec 2016 02:56:07 GMT""},{""version"":""v3"",""created"":""Tue, 13 Dec 2016 03:18:01 GMT""},{""version"":""v4"",""created"":""Tue, 14 Mar 2017 19:18:54 GMT""},{""version"":""v5"",""created"":""Thu, 11 May 2017 00:25:52 GMT""},{""version"":""v6"",""created"":""Thu, 18 May 2017 07:53:25 GMT""},{""version"":""v7"",""created"":""Fri, 7 Jun 2019 08:10:58 GMT""}]","2019-06-10"
"1612.01776","Maarten Solleveld","Maarten Solleveld","On completions of Hecke algebras","Second, abridged version. The argument for the preservation of
  temperedness in the first version was incomplete. To repair this, the new
  paragraphs 1.2, 2.2 and 3.2 were written and arguments in the proof of
  Theorem 3.4 were worked out further","pp. 207--262 in: Representations of Reductive p-adic Groups, A.-M.
  Aubert, M. Mishra, A. Roche, S. Spallone (eds.), Progress in Mathematics 328,
  Birkh\""auser, 2019",,,"math.RT","http://arxiv.org/licenses/nonexclusive-distrib/1.0/","  Let G be a reductive p-adic group and let H(G)^s be a Bernstein block of the
Hecke algebra of G. We consider two important topological completions of
H(G)^s: a direct summand S(G)^s of the Harish-Chandra--Schwartz algebra of G
and a two-sided ideal C*_r (G)^s of the reduced C*-algebra of G. These are
useful for the study of all tempered smooth G-representations.
  We suppose that H(G)^s is Morita equivalent to an affine Hecke algebra H(R,q)
-- as is known in many cases. The latter algebra also has a Schwartz completion
S(R,q) and a C*-completion C*_r (R,q), both defined in terms of the underlying
root datum R and the parameters q.
  We prove that, under some mild conditions, a Morita equivalence between
H(G)^s and H(R,q) extends to Morita equivalences between S(G)^s and S(R,q), and
between C*_r (G)^s and C*_r (R,q). We also check that our conditions are
fulfilled in all known cases of such Morita equivalences between Hecke
algebras. This is applied to compute the topological K-theory of the reduced
C*-algebra of a classical p-adic group.
","[{""version"":""v1"",""created"":""Tue, 6 Dec 2016 12:29:16 GMT""},{""version"":""v2"",""created"":""Tue, 21 Nov 2017 17:51:09 GMT""}]","2020-09-08"
"1612.01777","Santi Peris","Diogo Boito, Maarten Golterman, Kim Maltman and Santiago Peris","$\alpha_s$ in 2016 from the (revised) ALEPH data for $\tau$ decay","Contribution to ICHEP 2016. 6 pages, 3 figures",,,,"hep-ph hep-lat","http://arxiv.org/licenses/nonexclusive-distrib/1.0/","  We summarize a comparison of the two strategies which are currently available
in the literature for determining the value of $\alpha_s(m_\tau)$. We will
refer to these as the truncated Operator Product Expansion model and the
Duality Violation model. After describing the main features of both approaches,
we explain why the former fails to pass crucial tests. The latter, on the other
hand, passes all the tests known up to date and, therefore, should be currently
considered the only reliable method.
","[{""version"":""v1"",""created"":""Tue, 6 Dec 2016 12:30:19 GMT""}]","2016-12-07"
"1612.01778","Johannes Zierenberg","Johannes Zierenberg and Katharina Tholen and Wolfhard Janke","Effect of grafting on the binding transition of two flexible polymers","10 pages, 6 figures, submitted to Eur. Phys. J Spec. Topics","Eur. Phys. J. Special Topics 226, 683 (2017)","10.1140/epjst/e2016-60317-2",,"cond-mat.soft cond-mat.stat-mech","http://arxiv.org/licenses/nonexclusive-distrib/1.0/","  We investigate the binding transition of two flexible polymers grafted to a
steric surface with closeby end points. While free polymers show a
discontinuous transition, grafting to a steric flat surface leads to a
continuous binding transition. This is supported by results from Metropolis and
parallel multicanonical simulations. A combination of canonical and
microcanonical analyses reveals that the change in transition order can be
understood in terms of the reduced translational entropy of the unbound
high-temperature phase upon grafting.
","[{""version"":""v1"",""created"":""Tue, 6 Dec 2016 12:31:18 GMT""}]","2017-04-07"
"1612.01779","Michael M\""uger","Michael M\""uger","On Ikehara type Tauberian theorems with $O(x^\gamma)$ remainders","A serious mistake in the first version was corrected and everything
  rewritten, including new material and a conjecture. 6 pages","Abh. Math. Semin. Univer. Hamburg 88, 209-216 (2018)",,,"math.CA","http://arxiv.org/licenses/nonexclusive-distrib/1.0/","  Motivated by analytic number theory, we explore remainder versions of
Ikehara's Tauberian theorem yielding power law remainder terms. More precisely,
for $f:[1,\infty)\rightarrow{\mathbb R}$ non-negative and non-decreasing we
prove $f(x)-x=O(x^\gamma)$ with $\gamma<1$ under certain assumptions on $f$. We
state a conjecture concerning the weakest natural assumptions and show that we
cannot hope for more.
","[{""version"":""v1"",""created"":""Tue, 6 Dec 2016 12:32:19 GMT""},{""version"":""v2"",""created"":""Thu, 15 Dec 2016 15:25:33 GMT""}]","2019-10-29"
"1612.01780","Jonathan Thurgood","J.O. Thurgood and D. Tsiklauri","Particle-in-cell simulations of the relaxation of electron beams in
  inhomogeneous solar wind plasmas","Animations can be found at
  https://jonathanthurgood.wordpress.com/myresearch/thurgood-and-tsiklauri-2016-movies/","Journal of Plasma Physics, Volume 82, Issue 6 December 2016,
  905820604","10.1017/S0022377816000970",,"physics.plasm-ph astro-ph.SR physics.space-ph","http://arxiv.org/licenses/nonexclusive-distrib/1.0/","  Previous theoretical considerations of electron beam relaxation in
inhomogeneous plasmas have indicated that the effects of the irregular solar
wind may account for the poor agreement of homogeneous modelling with the
observations. Quasi-linear theory and Hamiltonian models based on Zakharov's
equations have indicated that when a level of density fluctuations is above a
given threshold, density irregularities act to de-resonate the beam-plasma
interaction, restricting Langmuir wave growth on the expense of beam energy.
This work presents the first fully kinetic particle-in-cell (PIC) simulations
of beam relaxation under the influence of density irregularities. We aim to
independently determine the influence of background inhomogeneity on the
beam-plasma system, and to test theoretical predictions and alternative models
using a fully kinetic treatment. We carry out 1D PIC simulations of a
bump-on-tail unstable electron beam in the presence of increasing levels of
background inhomogeneity using the fully electromagnetic, relativistic EPOCH
PIC code. We find that in the case of homogeneous background plasma density,
Langmuir wave packets are generated at the resonant condition and then
quasi-liear relaxation leads to a dynamic increase of wavenumbers generated. No
electron acceleration is seen - unlike in the inhomogeneous experiments, all of
which produce high-energy electrons. For the inhomogeneous experiments we also
observe the generation of backwards propagating Langmuir waves, which is shown
directly to be due to the refraction of the packets off the density gradients.
Our fully kinetic PIC simulations broadly confirm the findings of quasi-linear
theory and the Hamiltonian model based on Zakharov's equations. Strong density
fluctuations modify properties of excited Langmuir waves altering their
dispersion properties.
","[{""version"":""v1"",""created"":""Tue, 6 Dec 2016 12:32:55 GMT""},{""version"":""v2"",""created"":""Wed, 14 Dec 2016 14:15:37 GMT""}]","2016-12-15"
"1612.01781","Matthias Ruf","Matthias Ruf","On the continuity of functionals defined on partitions","5 pages",,,,"math.FA","http://arxiv.org/licenses/nonexclusive-distrib/1.0/","  We characterize the continuity of prototypical functionals acting on finite
Caccioppoli partitions. In the spirit of the classical Reshetnyak continuity
theorem for measures that can be used to prove continuity of surface-type
functionals defined on single sets of finite perimeter we show that in the
multiphase case continuity is equivalent to convergence of the perimeter of the
jump set.
","[{""version"":""v1"",""created"":""Tue, 6 Dec 2016 12:35:27 GMT""}]","2016-12-07"
"1612.01782","Hideaki Fujiwara","Hideaki Fujiwara, Ryuji Morishima, Takuya Fujiyoshi, and Takuya
  Yamashita","Seasonal variation of radial brightness contrast of Saturn's rings
  viewed in mid-infrared by Subaru/COMICS","8 pages, 6 figures, accepted for publication in Astronomy &
  Astrophysics","A&A 599, A29 (2017)","10.1051/0004-6361/201527529",,"astro-ph.EP","http://arxiv.org/licenses/nonexclusive-distrib/1.0/","  Aims. To investigate the mid-infrared (MIR) characteristics of Saturn's
rings. Methods. We collected and analyzed MIR high spatial resolution images of
Saturn's rings obtained in January 2008 and April 2005 with COMICS mounted on
Subaru Telescope, and investigated the spatial variation in the surface
brightness of the rings in multiple bands in the MIR. We also composed the
spectral energy distributions (SEDs) of the C, B, and A rings and the Cassini
Division, and estimated the temperatures of the rings from the SEDs assuming
the optical depths. Results. We find that the C ring and the Cassini Division
were warmer than the B and A rings in 2008, which could be accounted for by
their lower albedos, lower optical depths, and smaller self-shadowing effect.
We also find that the C ring and the Cassini Division were considerably
brighter than the B and A rings in the MIR in 2008 and the radial contrast of
the ring brightness is the inverse of that in 2005, which is interpreted as a
result of a seasonal effect with changing elevations of the sun and observer
above the ring plane.
","[{""version"":""v1"",""created"":""Tue, 6 Dec 2016 12:45:19 GMT""}]","2017-03-01"
