"1612.01536","Madalena Lemos","Madalena Lemos, Pedro Liendo, Carlo Meneghelli, Vladimir Mitev","Bootstrapping $\mathcal{N}=3$ superconformal theories","54 pages (43 plus five appendices), 7 figures; v2: improvements for
  clarity",,"10.1007/JHEP04(2017)032","DESY 16-237, MITP/16-132","hep-th","http://arxiv.org/licenses/nonexclusive-distrib/1.0/","  We initiate the bootstrap program for $\mathcal{N}=3$ superconformal field
theories (SCFTs) in four dimensions. The problem is considered from two fronts:
the protected subsector described by a $2d$ chiral algebra, and crossing
symmetry for half-BPS operators whose superconformal primaries parametrize the
Coulomb branch of $\mathcal{N}=3$ theories. With the goal of describing a
protected subsector of a family of $\mathcal{N}=3$ SCFTs, we propose a new $2d$
chiral algebra with super Virasoro symmetry that depends on an arbitrary
parameter, identified with the central charge of the theory. Turning to the
crossing equations, we work out the superconformal block expansion and apply
standard numerical bootstrap techniques in order to constrain the CFT data. We
obtain bounds valid for any theory but also, thanks to input from the chiral
algebra results, we are able to exclude solutions with $\mathcal{N}=4$
supersymmetry, allowing us to zoom in on a specific $\mathcal{N}=3$ SCFT.
","[{""version"":""v1"",""created"":""Mon, 5 Dec 2016 21:00:06 GMT""},{""version"":""v2"",""created"":""Wed, 8 Feb 2017 10:00:09 GMT""}]","2017-04-26"
"1612.01537","Norberto Castro Rodriguez","N. Castro, L. Fossati, S. Hubrig, S. P. J\""arvinen, N. Przybilla,
  M.-F. Nieva, I. Ilyin, T. A. Carroll, M. Sch\""oller, N. Langer, F. R. N.
  Schneider, S. Sim\'on-D\'iaz, T. Morel, K. Butler and the BOB collaboration","B field in OB stars (BOB): The outstandingly strong magnetic field in
  the evolved He-strong star CPD-62 2124","Accepted for publication in A&A","A&A 597, L6 (2017)","10.1051/0004-6361/201629751",,"astro-ph.SR","http://arxiv.org/licenses/nonexclusive-distrib/1.0/","  The origin and evolution of magnetism in OB stars is far from being well
understood. With approximately 70 magnetic OB stars known, any new object with
unusual characteristics may turn out to be a key piece of the puzzle. We report
the detection of an exceptionally strong magnetic field in the He-strong B2IV
star CPD-62 2124. Spectropolarimetric FORS2 and HARPSpol observations were
analysed by two independent teams and procedures, concluding on a strong
longitudinal magnetic field of approximately 5.2 kG. The quantitative
characterisation of the stellar atmosphere yields an effective temperature of
23650$\pm$250 K, a surface gravity of 3.95$\pm$0.10 dex and a surface helium
fraction of 0.35$\pm$0.02 by number. The metal composition is in agreement with
the cosmic abundance standard, except for Mg, Si and S, which are slightly
non-solar. The strong and broad ($\sim$300 km/s) disc-like emission displayed
by the H$\alpha$ line suggests a centrifugal magnetosphere supported by the
strong magnetic field. Our results imply that CPD-62 2124 is an early B-type
star hosting one of the strongest magnetic fields discovered to date, and one
of the most evolved He-strong stars known, with a fractional main-sequence
lifetime of approximately 0.6.
","[{""version"":""v1"",""created"":""Mon, 5 Dec 2016 21:00:06 GMT""}]","2017-01-04"
"1612.01538","Anna Miotello","Anna Miotello, Ewine F. van Dishoeck, Jonathan P. Williams, Megan
  Ansdell, Greta Guidi, Michiel Hogerheijde, Carlo F. Manara, Marco Tazzari,
  Leonardo Testi, Nienke van der Marel, and Sierk van Terwisga","Lupus disks with faint CO isotopologues: low gas/dust or large carbon
  depletion?","11 pages, 9 figures, A&A accepted","A&A 599, A113 (2017)","10.1051/0004-6361/201629556",,"astro-ph.SR astro-ph.GA","http://arxiv.org/licenses/nonexclusive-distrib/1.0/","  An era has started in which gas and dust can be observed independently in
protoplanetary disks, thanks to the recent surveys with ALMA. The first
near-complete high-resolution disk survey in both dust and gas in a single
star-forming region has been carried out in Lupus, finding surprisingly low
gas/dust ratios. The goal of this work is to fully exploit CO isotopologues
observations in Lupus, comparing them with physical-chemical model results, in
order to obtain gas masses for a large number of disks. We have employed
physical-chemical models to analyze continuum and CO isotopologues observations
of Lupus disks, including isotope-selective processes and freeze-out. Employing
also the ALMA 13CO-only detections, disk gas masses have been calculated for a
total of 34 sources, expanding the sample of 10 disks studied by Ansdell et al.
(2016), where also C18O was detected. We confirm that overall gas-masses are
very low, often smaller than 1 $M_{\rm J}$, if volatile carbon is not depleted.
Accordingly, global gas/dust ratios predominantly between 1 and 10. Low
CO-based gas masses and gas/dust ratios may indicate rapid loss of gas, or
alternatively chemical evolution, e.g. via sequestering of carbon from CO to
more complex molecules, or carbon locked up in larger bodies. Current ALMA
observations cannot distinguish between these two hypotheses. We have simulated
both scenarios, but chemical model results do not allow us to rule out one of
the two. Assuming that all Lupus disks have evolved mainly due to viscous
processes over the past few Myr, the observed correlation between the current
mass accretion rate and dust mass found by Manara et al. (2016) implies a
constant gas-to-dust ratio, which is close to 100 based on the observed $M_{\rm
disk}/\dot{M}_{\rm acc}$ ratio. This in turn points to a scenario in which
carbon depletion is responsible for the low CO isotopologue line luminosities.
","[{""version"":""v1"",""created"":""Mon, 5 Dec 2016 21:00:07 GMT""}]","2017-03-08"
"1612.01539","Hamish Clark","Hamish A. Clark, Pat Scott, Roberto Trotta, Geraint F. Lewis","Dark matter substructure cannot explain properties of the Fermi Galactic
  Centre excess","14 pages, 4 figures","JCAP 07 (2018) 060","10.1088/1475-7516/2018/07/060",,"astro-ph.HE astro-ph.CO hep-ph","http://arxiv.org/licenses/nonexclusive-distrib/1.0/","  An excess of gamma rays has been identified at the centre of the Milky Way,
and annihilation of dark matter has been posited as a potential source. This
hypothesis faces significant challenges: difficulty characterizing
astrophysical backgrounds, the need for a non-trivial adiabatic contraction of
the inner part of the Milky Way's dark matter halo, and recent observations of
photon clustering, which suggest that the majority of the excess is due to
unresolved point sources. Here we point out that the apparent point-like nature
of the emission rules out the dark matter interpretation of the excess
entirely. Attempting to model the emission with dark matter point sources
either worsens the problem with the inner slope, requires an unrealistically
large minihalo fraction toward the Galactic Centre, or overproduces the
observed emission at higher latitudes.
","[{""version"":""v1"",""created"":""Mon, 5 Dec 2016 21:00:10 GMT""},{""version"":""v2"",""created"":""Thu, 19 Oct 2017 11:51:19 GMT""},{""version"":""v3"",""created"":""Thu, 9 Aug 2018 12:22:26 GMT""},{""version"":""v4"",""created"":""Sun, 2 Sep 2018 08:44:48 GMT""}]","2018-09-05"
"1612.01540","Jan Vysoky","Branislav Jurco, Jan Vysoky","Courant Algebroid Connections and String Effective Actions","Proceedings of Tohoku Forum for Creativity, Special volume:
  Noncommutative Geometry and Physics IV",,,,"math-ph hep-th math.DG math.MP","http://arxiv.org/licenses/nonexclusive-distrib/1.0/","  Courant algebroids are a natural generalization of quadratic Lie algebras,
appearing in various contexts in mathematical physics. A connection on a
Courant algebroid gives an analogue of a covariant derivative compatible with a
given fiber-wise metric. Imposing further conditions resembling standard
Levi-Civita connections, one obtains a class of connections whose curvature
tensor in certain cases gives a new geometrical description of equations of
motion of low energy effective action of string theory. Two examples are given.
One is the so called symplectic gravity, the second one is an application to
the the so called heterotic reduction. All necessary definitions, propositions
and theorems are given in a detailed and self-contained way.
","[{""version"":""v1"",""created"":""Mon, 5 Dec 2016 21:00:12 GMT""}]","2016-12-07"
"1612.01541","Sthitadhi Roy","Leda Bucciantini, Sthitadhi Roy, Sota Kitamura, and Takashi Oka","Emergent Weyl nodes and Fermi arcs in a Floquet Weyl semimetal","4 pages, 5 figures + references + supplementary material","Phys. Rev. B 96, 041126 (2017)","10.1103/PhysRevB.96.041126",,"cond-mat.mes-hall cond-mat.str-el","http://arxiv.org/licenses/nonexclusive-distrib/1.0/","  When a Dirac semimetal is subject to a circularly polarized laser, it is
predicted that the Dirac cone splits into two Weyl nodes and a nonequilibrium
transient state called the Floquet Weyl semimetal is realized. We focus on the
previously unexplored low-frequency regime, where the upper and lower Dirac
bands resonantly couple with each other through multi-photon processes, which
is a realistic situation in solid state ultrafast pump-probe experiments. We
find a series of new Weyl nodes emerging in pairs when the Floquet replica
bands hybridize with each other. The nature of the Floquet Weyl semimetal with
regard to the number, locations, and monopole charges of these Weyl nodes is
highly tunable with the amplitude and frequency of the light. We derive an
effective low energy theory using Brillouin-Wigner expansion and further
regularize the theory on a cubic lattice. The monopole charges obtained from
the low-energy Hamiltonian can be reconciled with the number of Fermi arcs on
the lattice which we find numerically.
","[{""version"":""v1"",""created"":""Mon, 5 Dec 2016 21:00:23 GMT""}]","2017-08-02"
"1612.01542","Samuel Lederer","Samuel Lederer, Yoni Schattner, Erez Berg, Steven A. Kivelson","Superconductivity and non-Fermi liquid behavior near a nematic quantum
  critical point",,"PNAS 114, 4905 (2017)","10.1073/pnas.1620651114",,"cond-mat.str-el","http://arxiv.org/licenses/nonexclusive-distrib/1.0/","  Using determinantal quantum Monte Carlo, we compute the properties of a
lattice model with spin $\frac 1 2$ itinerant electrons tuned through a quantum
phase transition to an Ising nematic phase. The nematic fluctuations induce
superconductivity with a broad dome in the superconducting $T_c$ enclosing the
nematic quantum critical point. For temperatures above $T_c$, we see strikingly
non-Fermi liquid behavior, including a ""nodal - anti nodal dichotomy""
reminiscent of that seen in several transition metal oxides. In addition, the
critical fluctuations have a strong effect on the low frequency optical
conductivity, resulting in behavior consistent with ""bad metal"" phenomenology.
","[{""version"":""v1"",""created"":""Mon, 5 Dec 2016 21:00:34 GMT""},{""version"":""v2"",""created"":""Mon, 6 Mar 2017 19:26:37 GMT""}]","2017-05-24"
"1612.01543","Yoojin Choi","Yoojin Choi, Mostafa El-Khamy, and Jungwon Lee","Towards the Limit of Network Quantization","Published as a conference paper at ICLR 2017",,,,"cs.CV cs.LG cs.NE","http://arxiv.org/licenses/nonexclusive-distrib/1.0/","  Network quantization is one of network compression techniques to reduce the
redundancy of deep neural networks. It reduces the number of distinct network
parameter values by quantization in order to save the storage for them. In this
paper, we design network quantization schemes that minimize the performance
loss due to quantization given a compression ratio constraint. We analyze the
quantitative relation of quantization errors to the neural network loss
function and identify that the Hessian-weighted distortion measure is locally
the right objective function for the optimization of network quantization. As a
result, Hessian-weighted k-means clustering is proposed for clustering network
parameters to quantize. When optimal variable-length binary codes, e.g.,
Huffman codes, are employed for further compression, we derive that the network
quantization problem can be related to the entropy-constrained scalar
quantization (ECSQ) problem in information theory and consequently propose two
solutions of ECSQ for network quantization, i.e., uniform quantization and an
iterative solution similar to Lloyd's algorithm. Finally, using the simple
uniform quantization followed by Huffman coding, we show from our experiments
that the compression ratios of 51.25, 22.17 and 40.65 are achievable for LeNet,
32-layer ResNet and AlexNet, respectively.
","[{""version"":""v1"",""created"":""Mon, 5 Dec 2016 21:04:17 GMT""},{""version"":""v2"",""created"":""Mon, 13 Nov 2017 19:44:32 GMT""}]","2017-11-15"
"1612.01544","Serena Manti","Serena Manti, Simona Gallerani, Andrea Ferrara, Bradley Greig, Chiara
  Feruglio","Quasar UV luminosity function evolution up to z=8","11 pages, 6 figures, 1 table; MNRAS accepted",,"10.1093/mnras/stw3168",,"astro-ph.GA","http://arxiv.org/licenses/nonexclusive-distrib/1.0/","  We study the redshift evolution of the quasar UV Luminosity Function (LF) for
0.5 < z < 6.5, by collecting the most up to date observational data and, in
particular, the recently discovered population of faint AGNs. We fit the QSO LF
using either a double power-law or a Schechter function, finding that both
forms provide good fits to the data. We derive empirical relations for the LF
parameters as a function of redshift and, based on these results, predict the
quasar UV LF at z=8. From the inferred LF evolution, we compute the redshift
evolution of the QSO/AGN comoving ionizing emissivity and hydrogen
photoionization rate. If faint AGNs are included, the contribution of quasars
to reionization increases substantially. However, their level of contribution
critically depends on the detailed shape of the QSO LF, which can be
constrained by efficient searches of high-z quasars. To this aim, we predict
the expected (i) number of z>6 quasars detectable by ongoing and future NIR
surveys (as EUCLID and WFIRST), and (ii) number counts for a single
radio-recombination line observation with SKA-MID (FoV = 0.49 deg^2) as a
function of the Hnalpha flux density, at 0<z<8. These surveys (even at z<6)
will be fundamental to better constrain the role of quasars as reionization
sources.
","[{""version"":""v1"",""created"":""Mon, 5 Dec 2016 21:04:34 GMT""}]","2017-01-18"
"1612.01545","Daniel Goddard","Daniel Goddard (ICG Portsmouth), Daniel Thomas (ICG Portsmouth),
  Claudia Maraston (ICG Portsmouth), Kyle Westfall (UC Santa Cruz), James
  Etherington (ICG Portsmouth), Rogerio Riffel (Universidade Federal do Rio
  Grande do Sul), Nicolas D. Mallmann (Universidade Federal do Rio Grande do
  Sul), Zheng Zheng (NAOC), Maria Argudo-Fernandez (Antofagasta), Matthew A.
  Bershady (Wisconsin-Madison), Kevin Bundy (UC Santa Cruz), Niv Drory
  (University of Texas at Austin), David R. Law (Space Telescope), Renbin Yan
  (Kentucky), David Wake (Open University), Anne-Marie Weijmans (St Andrews),
  Dmitry Bizyaev (Apache Point Observatory), Joel R. Brownstein (Utah), Richard
  R. Lane (Pontificia Universidad Cat\'olica de Chile), Roberto Maiolino
  (Cambridge), Karen L. Masters (ICG Portsmouth), Michael R. Merrifield
  (Nottingham), Christian Nitschelm (Antofagasta), Kaike Pan (Apache Point
  Observatory), Alexandre Roman-Lopes (Universidad de La Serena), Thaisa
  Storchi-Bergmann (Universidade Federal do Rio Grande do Sul)","SDSS-IV MaNGA: stellar population gradients as a function of galaxy
  environment","14 pages, 8 figures, 4 tables. MNRAS in press",,"10.1093/mnras/stw2719",,"astro-ph.GA","http://arxiv.org/licenses/nonexclusive-distrib/1.0/","  We study the internal radial gradients of stellar population properties
within $1.5\;R_{\rm e}$ and analyse the impact of galaxy environment. We use a
representative sample of 721 galaxies with masses ranging between
$10^{9}\;M_{\odot}$ to $10^{11.5}\;M_{\odot}$ from the SDSS-IV survey MaNGA. We
split this sample by morphology into early-type and late-type galaxies. Using
the full spectral fitting code FIREFLY, we derive the light and mass-weighted
stellar population properties age and metallicity, and calculate the gradients
of these properties. We use three independent methods to quantify galaxy
environment, namely the $N^{th}$ nearest neighbour, the tidal strength
parameter $Q$ and distinguish between central and satellite galaxies. In our
analysis, we find that early-type galaxies generally exhibit shallow
light-weighted age gradients in agreement with the literature and mass-weighted
median age gradients tend to be slightly positive. Late-type galaxies, instead,
have negative light-weighted age gradients. We detect negative metallicity
gradients in both early and late-type galaxies that correlate with galaxy mass,
with the gradients being steeper and the correlation with mass being stronger
in late-types. We find, however, that stellar population gradients, for both
morphological classifications, have no significant correlation with galaxy
environment for all three characterisations of environment. Our results suggest
that galaxy mass is the main driver of stellar population gradients in both
early and late-type galaxies, and any environmental dependence, if present at
all, must be very subtle.
","[{""version"":""v1"",""created"":""Mon, 5 Dec 2016 21:04:45 GMT""}]","2016-12-14"
"1612.01546","Daniel Goddard","Daniel Goddard (ICG Portsmouth), Daniel Thomas (ICG Portsmouth),
  Claudia Maraston (ICG Portsmouth), Kyle B. Westfall (UC Santa Cruz), James
  Etherington (ICG Portsmouth), Rogerio Riffel (Universidade Federal do Rio
  Grande do Sul), Nicolas D. Mallmann (Universidade Federal do Rio Grande do
  Sul), Zheng Zheng (NAOC), Maria Argudo-Fernandez (Antofagasta), Jianhui Lian
  (ICG Portsmouth), Matthew A. Bershady (Wisconsin-Madison), Kevin Bundy (UC
  Santa Cruz), Niv Drory (University of Texas at Austin), David R. Law (Space
  Telescope), Renbin Yan (Kentucky), David Wake (Open University), Anne-Marie
  Weijmans (St Andrews), Dmitry Bizyaev (Apache Point Observatory), Joel R.
  Brownstein (Utah), Richard R. Lane (Pontificia Universidad Cat\'olica de
  Chile), Roberto Maiolino (Cambridge), Karen L. Masters (ICG Portsmouth),
  Michael R. Merrifield (Nottingham), Christian Nitschelm (Antofagasta), Kaike
  Pan (Apache Point Observatory), Alexandre Roman-Lopes (Universidad de La
  Serena), Thaisa Storchi-Bergmann (Universidade Federal do Rio Grande do Sul),
  Donald P. Schneider (Penn State)","SDSS-IV MaNGA: Spatially resolved star formation histories in galaxies
  as a function of galaxy mass and type","31 pages, 22 figures, 5 tables. Resubmitted to MNRAS including
  referees comments",,"10.1093/mnras/stw3371",,"astro-ph.GA","http://arxiv.org/licenses/nonexclusive-distrib/1.0/","  We study the internal gradients of stellar population properties within
$1.5\;R_{\rm e}$ for a representative sample of 721 galaxies with stellar
masses ranging between $10^{9}\;M_{\odot}$ to $10^{11.5}\;M_{\odot}$ from the
SDSS-IV MaNGA IFU survey. Through the use of our full spectral fitting code
FIREFLY, we derive light and mass-weighted stellar population properties and
their radial gradients, as well as full star formation and metal enrichment
histories. We also quanfify the impact that different stellar population models
and full spectral fitting routines have on the derived stellar population
properties, and the radial gradient measurements. In our analysis, we find that
age gradients tend to be shallow for both early-type and late-type galaxies.
{\em Mass-weighted} age gradients of early-types are positive ($\sim 0.09\;
{\rm dex}/R_{\rm e}$) pointing to ""outside-in"" progression of star formation,
while late-type galaxies have negative {\em light-weighted} age gradients
($\sim -0.11\; {\rm dex}/R_{\rm e}$), suggesting an ""inside-out"" formation of
discs. We detect negative metallicity gradients in both early and late-type
galaxies, but these are significantly steeper in late-types, suggesting that
radial dependence of chemical enrichment processes and the effect of gas inflow
and metal transport are far more pronounced in discs. Metallicity gradients of
both morphological classes correlate with galaxy mass, with negative
metallicity gradients becoming steeper with increasing galaxy mass. The
correlation with mass is stronger for late-type galaxies, with a slope of
$d(\nabla [Z/H])/d(\log M)\sim -0.2\pm 0.05\;$, compared to $d(\nabla
[Z/H])/d(\log M)\sim -0.05\pm 0.05\;$ for early-types. This result suggests
that the merger history plays a relatively small role in shaping metallicity
gradients of galaxies.
","[{""version"":""v1"",""created"":""Mon, 5 Dec 2016 21:05:53 GMT""}]","2017-01-18"
"1612.01547","Michael Geracie","Michael Geracie","Transport in Superfluid Mixtures","17 pages, 3 figures","Phys. Rev. B 95, 134510 (2017)","10.1103/PhysRevB.95.134510",,"cond-mat.other cond-mat.supr-con hep-th","http://arxiv.org/licenses/nonexclusive-distrib/1.0/","  We present a general method for constructing effective field theories for
non-relativistic superfluids, generalizing the previous approaches of Greiter,
Witten, and Wilczek, and Son and Wingate to the case of several superfluids in
solution. We investigate transport in mixtures with broken parity and find a
parity odd ""Hall drag"" in the presence of independent motion as well as a
pinning of mass, charge, and energy to sites of nonzero relative velocity. Both
effects have a simple geometric interpretation in terms of the signed volumes
and directed areas of various sub-complexes of a ""velocity polyhedron"": the
convex hull formed by the endpoints of the velocity vectors of a superfluid
mixture. We also provide a simple quasi-one-dimensional model that exhibits
non-zero Hall drag.
","[{""version"":""v1"",""created"":""Mon, 5 Dec 2016 21:07:45 GMT""}]","2017-04-19"
"1612.01548","Yahya Alavirad","Yahya Alavirad, David Clarke, Amit Nag, Jay D. Sau","$\mathbb{Z}_3$ parafermionic zero modes without Andreev backscattering
  from the $2/3$ fractional quantum Hall state","4 pages, 3 figures, 5 pages of supplementary material","Phys. Rev. Lett. 119, 217701 (2017)","10.1103/PhysRevLett.119.217701",,"cond-mat.mes-hall","http://arxiv.org/licenses/nonexclusive-distrib/1.0/","  Parafermionic zero modes are a novel set of excitations displaying
non-Abelian statistics somewhat richer than that of Majorana modes. These modes
are predicted to occur when nearby fractional quantum Hall edge states are
gapped by an interposed superconductor. Despite substantial experimental
progress, we argue that the necessary crossed Andreev reflection in this
arrangement is a challenging milestone to reach. We propose a superconducting
quantum dot array structure on a fractional quantum Hall edge that can lead to
parafermionic zero modes from coherent superconducting forward scattering on a
quantum Hall edge. Such coherent forward scattering has already been
demonstrated in recent experiments. We show that for a spin-singlet
superconductor interacting with loops of spin unpolarized $2/3$ fractional
quantum edge, even an array size of order ten should allow one to
systematically tune into a parafermionic degeneracy.
","[{""version"":""v1"",""created"":""Mon, 5 Dec 2016 21:09:28 GMT""}]","2017-11-29"
"1612.01549","Patricia Bessiere Dr","Patricia S Bessiere, Clive N Tadhunter, Cristina Ramos Almeida,
  Montserrat Villar-Martin, Antonio Cabrera-Lavers","Young stellar populations in type II quasars: timing the onset of star
  formation and nuclear activity","Accepted for publication in MNRAS, 22 pages with an additional 11
  page appendix, 31 Figures","MNRAS, 466, 388 (2017)","10.1093/mnras/stw3175",,"astro-ph.GA","http://arxiv.org/licenses/nonexclusive-distrib/1.0/","  Despite the emerging morphological evidence that luminous quasar-like AGN are
triggered in galaxy mergers, the natures of the triggering mergers and the
order of events in the triggering sequence remain uncertain. In this work, we
present a detailed study of the stellar populations of the host galaxies of 21
type II quasars, with the aim of understanding the sequence of events between
the onset of the merger, the triggering of the associated starburst and the
initiation of the quasar activity. To this end, we model high quality, wide
spectral coverage, intermediate resolution optical spectra of the type II
quasars. We find that of the 21 objects, the higher-order Balmer absorption
lines, characteristic of young stellar populations (YSP) , are directly
detected in ~62% of the sample. We also fit these spectra using a number of
combinations of stellar and/or power-law components, representative of viable
formation histories, as well as including the possibility of scattered AGN
light. We find that 90 % of the type II quasar host galaxies require the
inclusion of a YSP to adequately model their spectra, whilst 71 % of the sample
require the inclusion of a YSP with age < 100 Myr. Since the ages of the YSP in
most type II quasar host galaxies are comparable with the expected lifetimes of
the AGN activity, these results provide strong evidence that the quasars are
triggered close to the peaks of the merger-induced starbursts.
","[{""version"":""v1"",""created"":""Mon, 5 Dec 2016 21:12:39 GMT""}]","2017-02-13"
