"1612.01655","Xin Yang","Xin Yang, Lequan Yu, Lingyun Wu, Yi Wang, Dong Ni, Jing Qin, Pheng-Ann
  Heng","Fine-grained Recurrent Neural Networks for Automatic Prostate
  Segmentation in Ultrasound Images","To appear in AAAI Conference 2017",,,,"cs.CV","http://arxiv.org/licenses/nonexclusive-distrib/1.0/","  Boundary incompleteness raises great challenges to automatic prostate
segmentation in ultrasound images. Shape prior can provide strong guidance in
estimating the missing boundary, but traditional shape models often suffer from
hand-crafted descriptors and local information loss in the fitting procedure.
In this paper, we attempt to address those issues with a novel framework. The
proposed framework can seamlessly integrate feature extraction and shape prior
exploring, and estimate the complete boundary with a sequential manner. Our
framework is composed of three key modules. Firstly, we serialize the static 2D
prostate ultrasound images into dynamic sequences and then predict prostate
shapes by sequentially exploring shape priors. Intuitively, we propose to learn
the shape prior with the biologically plausible Recurrent Neural Networks
(RNNs). This module is corroborated to be effective in dealing with the
boundary incompleteness. Secondly, to alleviate the bias caused by different
serialization manners, we propose a multi-view fusion strategy to merge shape
predictions obtained from different perspectives. Thirdly, we further implant
the RNN core into a multiscale Auto-Context scheme to successively refine the
details of the shape prediction map. With extensive validation on challenging
prostate ultrasound images, our framework bridges severe boundary
incompleteness and achieves the best performance in prostate boundary
delineation when compared with several advanced methods. Additionally, our
approach is general and can be extended to other medical image segmentation
tasks, where boundary incompleteness is one of the main challenges.
","[{""version"":""v1"",""created"":""Tue, 6 Dec 2016 03:56:07 GMT""}]","2016-12-07"
"1612.01656","Adrian Buzatu","Adrian Buzatu","ATLAS SM VH(bb) Run-2 Search","4 pages, 4 figures, Proceedings for the 38th International Conference
  on High Energy Physics, Chicago, IL, USA, 03 - 10 Aug 2016,
  http://cds.cern.ch/record/2231600",,,,"hep-ex","http://arxiv.org/licenses/nonexclusive-distrib/1.0/","  The Higgs boson discovered at the LHC in 2012 has been observed coupling
directly to $W$ and $Z$ bosons and to $\tau$ leptons, and indirectly to top
quarks. In order to probe whether it is indeed the particle predicted by the
Standard Model, direct couplings of the Higgs boson to quarks must also be
measured. The Higgs boson decays most often to a pair of bottom quarks (with a
branching ratio of 58%). When the Higgs boson is produced alone in gluon-gluon
fusion, the signal in this decay mode is overwhelmed by the regular multi-jet
background. By requiring the Higgs boson to be produced in association with a
vector boson $V$ ($W$ or $Z$), which is further required to decay leptonically,
data events can be selected using charged-lepton or missing transverse energy
triggers. The Tevatron experiments presented combined results showing evidence
for the $VH(b\bar{b})$ process at a significance level of about 3 standard
deviations, while the combined LHC results from Run-1 data show a 2.6 standard
deviation evidence for the $H\rightarrow b\bar{b}$ decay mode. In this poster,
the ATLAS $VH(b\bar{b})$ search using Run-2 data is summarised.
","[{""version"":""v1"",""created"":""Tue, 6 Dec 2016 03:58:18 GMT""}]","2016-12-07"
"1612.01657","Yang Yang","Ruicong Xu, Yang Yang, Yadan Luo, Fumin Shen, Zi Huang, Heng Tao Shen","Binary Subspace Coding for Query-by-Image Video Retrieval",,,,,"cs.MM cs.CV","http://arxiv.org/licenses/nonexclusive-distrib/1.0/","  The query-by-image video retrieval (QBIVR) task has been attracting
considerable research attention recently. However, most existing methods
represent a video by either aggregating or projecting all its frames into a
single datum point, which may easily cause severe information loss. In this
paper, we propose an efficient QBIVR framework to enable an effective and
efficient video search with image query. We first define a
similarity-preserving distance metric between an image and its orthogonal
projection in the subspace of the video, which can be equivalently transformed
to a Maximum Inner Product Search (MIPS) problem.
  Besides, to boost the efficiency of solving the MIPS problem, we propose two
asymmetric hashing schemes, which bridge the domain gap of images and videos.
The first approach, termed Inner-product Binary Coding (IBC), preserves the
inner relationships of images and videos in a common Hamming space. To further
improve the retrieval efficiency, we devise a Bilinear Binary Coding (BBC)
approach, which employs compact bilinear projections instead of a single large
projection matrix. Extensive experiments have been conducted on four real-world
video datasets to verify the effectiveness of our proposed approaches as
compared to the state-of-the-arts.
","[{""version"":""v1"",""created"":""Tue, 6 Dec 2016 04:01:17 GMT""}]","2016-12-07"
"1612.01658","Georgios L. Stamokostas","Georgios L. Stamokostas, Panteleimon E. Lapas, and Gregory A. Fiete","Thermal conductivity of local moment models with strong spin-orbit
  coupling","29 pages, 17 figures","Phys. Rev. B 95, 064410 (2017)","10.1103/PhysRevB.95.064410",,"cond-mat.mes-hall","http://arxiv.org/licenses/nonexclusive-distrib/1.0/","  We study the magnetic and lattice contributions to the thermal conductivity
of electrically insulating strongly spin-orbit coupled magnetically ordered
phases on a two-dimensional honeycomb lattice using the Kitaev-Heisenberg
model. Depending on model parameters, such as the relative strength of the
spin-orbit induced anisotropic coupling, a number of magnetically ordered
phases are possible. In this work, we study two distinct regimes of thermal
transport depending on whether the characteristic energy of the phonons or the
magnons dominates, and focus on two different relaxation mechanisms, boundary
scattering and magnon-phonon scattering. For spatially anisotropic magnetic
phases, the thermal conductivity tensor can be highly anisotropic when the
magnetic energy scale dominates, since the magnetic degrees of freedom dominate
the thermal transport for temperatures well below the magnetic transition
temperature. In the opposite limit in which the phonon energy scale dominates,
the thermal conductivity will be nearly isotropic, reflecting the isotropic (at
low temperatures) phonon dispersion assumed for the honeycomb lattice. We
further discuss the extent to which thermal transport properties are influenced
by strong spin-orbit induced anisotropic coupling in the local moment regime of
insulating magnetic phases. The developed methodology can be applied to any 2D
magnon-phonon system, and more importantly to systems where an analytical
Bogoliubov transformation cannot be found and magnon bands are not necessarily
isotropic.
","[{""version"":""v1"",""created"":""Tue, 6 Dec 2016 04:28:26 GMT""}]","2017-02-20"
"1612.01659","Neil Lutz","Neil Lutz","Fractal Intersections and Products via Algorithmic Dimension",,,,,"cs.CC math.MG","http://arxiv.org/licenses/nonexclusive-distrib/1.0/","  Algorithmic fractal dimensions quantify the algorithmic information density
of individual points and may be defined in terms of Kolmogorov complexity. This
work uses these dimensions to bound the classical Hausdorff and packing
dimensions of intersections and Cartesian products of fractals in Euclidean
spaces. This approach shows that two prominent, fundamental results about the
dimension of Borel or analytic sets also hold for arbitrary sets.
","[{""version"":""v1"",""created"":""Tue, 6 Dec 2016 04:34:16 GMT""},{""version"":""v2"",""created"":""Mon, 16 Jan 2017 19:32:12 GMT""},{""version"":""v3"",""created"":""Fri, 15 Nov 2019 04:14:20 GMT""},{""version"":""v4"",""created"":""Wed, 27 Nov 2019 22:45:10 GMT""},{""version"":""v5"",""created"":""Tue, 5 Jan 2021 02:49:56 GMT""},{""version"":""v6"",""created"":""Mon, 1 Mar 2021 00:31:16 GMT""}]","2021-03-02"
"1612.01660","Sergey Dubovichenko","Sergey Dubovichenko, Nataliya Burkova, Albert Dzhazairov-Kakhramanov","Radiative 3He(2H,g)5Li capture at low deuterium energy","13p., 6 fig., 31 ref., 4 tab","Russ. Phys. Jour. 2017. V.60. P.935-945","10.1007/s11182-017-1162-z","APHI-2016-3","nucl-th","http://arxiv.org/licenses/nonexclusive-distrib/1.0/","  The results are presented on the total cross sections, astrophysical
S-factor, reaction rate of the deuteron radiative capture on 3He at the
temperatures from 0.03 up to 3 T9 calculated in the framework of the potential
cluster model with the forbidden states coming from the classification of the
orbital states by the Young diagrams. Within the used model and exploited Young
diagram classification made it possible to reproduce the general features of
the available experimental data on the cross section and reconstructed
astrophysical S-factor in the energy range from 200 keV up to 1.4 MeV. The
parametrization of the obtained reaction rate has been found and been compared
with some other actual reactions with light clusters.
","[{""version"":""v1"",""created"":""Tue, 6 Dec 2016 04:38:04 GMT""},{""version"":""v2"",""created"":""Wed, 7 Dec 2016 01:20:54 GMT""}]","2017-11-27"
"1612.01661","Qinglin He","Qing Lin He, Gen Yin, Luyan Yu, Alexander J. Grutter, Lei Pan, Xufeng
  Kou, Xiaoyu Che, Guoqiang Yu, Tianxiao Nie, Bin Zhang, Qiming Shao, Koichi
  Murata, Xiaodan Zhu, Yabin Fan, Xiaodong Han, Brian J. Kirby, and Kang L.
  Wang","Topological transitions induced by antiferromagnetism in a thin-film
  topological insulator",,"Phys. Rev. Lett. 121, 096802 (2018)","10.1103/PhysRevLett.121.096802",,"cond-mat.mes-hall","http://arxiv.org/licenses/nonexclusive-distrib/1.0/","  Ferromagnetism in topological insulators (TIs) opens a topologically
non-trivial exchange band gap, providing an exciting platform to manipulate the
topological order through an external magnetic field. Here, we experimentally
show that the surface of an antiferromagnetic thin film can independently
control the topological order of the top and the bottom surface states of a TI
thin film through proximity couplings. During the magnetization reversal in a
field scan, two intermediate spin configurations stem from unsynchronized
magnetic switchings of the top and the bottom AFM/TI interfaces. These magnetic
configurations are shown to result in new topological phases with non-zero
Chern numbers for each surface, introducing two counter-propagating chiral edge
modes inside the exchange gap. This change in the number of transport channels,
as the result of the topological transitions, induces antisymmetric
magneto-resistance spikes during the magnetization reversal. With the high Neel
ordering temperature provided by the antiferromagnetic layers, the signature of
the induced topological transition persists in transport measurements up to a
temperature of around 90 K, a factor of three over the Curie temperature in a
typical magnetically doped TI thin film.
","[{""version"":""v1"",""created"":""Tue, 6 Dec 2016 04:47:05 GMT""}]","2018-09-12"
"1612.01662","K Ranjith","K. Ranjith","A slip wave solution in anti-plane elasticity","In Press, in Geophysical Journal International, 2016",,"10.1093/gji/ggw464",,"physics.geo-ph cond-mat.mtrl-sci","http://arxiv.org/licenses/nonexclusive-distrib/1.0/","  It is shown that a slip wave solution exists for anti-plane sliding of an
elastic layer on an elastic half-space. It is a companion solution to the
well-known Love wave solution.
","[{""version"":""v1"",""created"":""Tue, 6 Dec 2016 04:51:46 GMT""}]","2017-02-01"
"1612.01663","Yi Xu","Yi Xu, Haiqin Yang, Lijun Zhang, Tianbao Yang","Efficient Non-oblivious Randomized Reduction for Risk Minimization with
  Improved Excess Risk Guarantee",,,,,"cs.LG","http://arxiv.org/licenses/nonexclusive-distrib/1.0/","  In this paper, we address learning problems for high dimensional data.
Previously, oblivious random projection based approaches that project high
dimensional features onto a random subspace have been used in practice for
tackling high-dimensionality challenge in machine learning. Recently, various
non-oblivious randomized reduction methods have been developed and deployed for
solving many numerical problems such as matrix product approximation, low-rank
matrix approximation, etc. However, they are less explored for the machine
learning tasks, e.g., classification. More seriously, the theoretical analysis
of excess risk bounds for risk minimization, an important measure of
generalization performance, has not been established for non-oblivious
randomized reduction methods. It therefore remains an open problem what is the
benefit of using them over previous oblivious random projection based
approaches. To tackle these challenges, we propose an algorithmic framework for
employing non-oblivious randomized reduction method for general empirical risk
minimizing in machine learning tasks, where the original high-dimensional
features are projected onto a random subspace that is derived from the data
with a small matrix approximation error. We then derive the first excess risk
bound for the proposed non-oblivious randomized reduction approach without
requiring strong assumptions on the training data. The established excess risk
bound exhibits that the proposed approach provides much better generalization
performance and it also sheds more insights about different randomized
reduction approaches. Finally, we conduct extensive experiments on both
synthetic and real-world benchmark datasets, whose dimension scales to
$O(10^7)$, to demonstrate the efficacy of our proposed approach.
","[{""version"":""v1"",""created"":""Tue, 6 Dec 2016 04:58:45 GMT""}]","2016-12-07"
"1612.01664","Qingxin Meng","Qingxin Meng, Yang Shen, Peng Shi","On the existence of optimal controls for backward stochastic partial
  differential equations",,,,,"math.OC","http://arxiv.org/licenses/nonexclusive-distrib/1.0/","  This paper is concerned with the existence of optimal controls for backward
stochastic partial differential equations with random coefficients, in which
the control systems are represented in an abstract evolution form, i.e.
backward stochastic evolution equations. Under some growth and monotonicity
conditions on the coefficients and suitable assumptions on the Hamiltonian
function, the existence of the optimal control boils down to proving the
uniqueness and existence of a solution to the stochastic Hamiltonian system,
i.e. a fully coupled forward-backward stochastic evolution equation. Using some
a prior estimates, we prove the uniqueness and existence via the method of
continuation. Two examples of linear-quadratic control are solved to
demonstrate our results.
","[{""version"":""v1"",""created"":""Tue, 6 Dec 2016 05:02:01 GMT""}]","2016-12-07"
"1612.01665","Maki Nagura","Yasuhiko Kitada and Maki Nagura","The first Pontrjagin classes of homotopy complex projective spaces","14 pages",,,,"math.GT","http://arxiv.org/licenses/nonexclusive-distrib/1.0/","  Let $M^{2n}$ be a closed smooth manifold homotopy equivalent to the complex
projective space $\mathbb{C}P(n)$. The purpose of this paper is to show that
when $n$ is even, the difference of the first Pontrjagin classes between
$M^{2n}$ and $\mathbb{C}P(n)$ is divisible by 16.
","[{""version"":""v1"",""created"":""Tue, 6 Dec 2016 05:11:55 GMT""}]","2016-12-07"
"1612.01666","Atsushi Ono","Atsushi Ono, Hiroshi Hashimoto, Sumio Ishihara","Optical suppression of electron motion in low-dimensional correlated
  electron system","7 pages, 4 figures","Phys. Rev. B 95, 085123 (2017)","10.1103/PhysRevB.95.085123",,"cond-mat.str-el","http://arxiv.org/licenses/nonexclusive-distrib/1.0/","  Suppression of electron motion under an alternating current (AC) electric
field is examined in a one-dimensional Hubbard model. Utilizing three
complementary calculation methods, it is found unambiguously that magnitudes of
the kinetic-energy suppressions are influenced sensitively by the Coulomb
interaction as well as the electron density. The phase and frequency in the AC
field do not bring about major effects. The results are interpreted as a
combined effect of the Coulomb interaction and the AC field, and provide a
guiding principle for the photocontrol of correlated electron motion.
","[{""version"":""v1"",""created"":""Tue, 6 Dec 2016 05:15:45 GMT""}]","2017-03-01"
"1612.01667","Senthil Kannan M.T.","M.T. Senthil Kannan, Bharat Kumar, M. Balasubramaniam, B. K. Agrawal,
  and S. K. Patra","Ternary fission within the temperature dependent relativistic mean field
  approach",,"Phys. Rev. C 95, 064613 (2017)","10.1103/PhysRevC.95.064613",,"nucl-th","http://arxiv.org/licenses/nonexclusive-distrib/1.0/","  For the first time, we apply the temperature dependent relativistic mean
field (TRMF) model to study the ternary fission of heavy nucleus using level
density approach. The probability of yields of a particular fragment is
obtained by evaluating the convolution integrals which employ the excitation
energy and the level density parameter for a given temperature calculated
within the TRMF formalism. To illustrate, we have considered the ternary
fissions in 252Cf, 242Pu and 236U with fixed third fragment A3 = 48Ca, 20O and
16O respectively. The relative yields are studied for the temperatures T = 1, 2
and 3 MeV. For the comparison, the relative yields are also calculated from the
single particle energies of the finite range droplet model (FRDM). In general,
the larger phase space for the ternary fragmentation is observed indicating
that such fragmentations are most probable ones. For T = 2 and 3 MeV, the Sn +
Ni + Ca is the most probable combination for the nucleus 252Cf. However, for
the nuclei 242Pu and 236U, the maximum fragmentation yields at T = 2 MeV differ
from those at T = 3 MeV. For T = 3 MeV, the closed shell (Z = 8) light mass
fragments with its corresponding partners has larger yield values. But, at T =
2 MeV Si/P/S are favorable fragments with the corresponding partners. It is
noticed that the symmetric binary fragmentation along with the fixed third
fragment for 242Pu and 236U are also favored at T = 1 MeV. The temperature
dependence of the nuclear shape and the single particle energies are also
discussed.
","[{""version"":""v1"",""created"":""Tue, 6 Dec 2016 05:18:05 GMT""}]","2017-06-28"
"1612.01668","Rajeshwari Majumdar","Rajeshwari Majumdar and Suman Majumdar","Necessary and Sufficient Condition for Asymptotic Standard Normality of
  the Two Sample Pivot","The intended focus of this paper was the asymptotic distribution of
  the two sample pivot. To obtain that distribution, we had to develop CLT
  results that ended up constituting about two-thirds of the paper. This caused
  some dilution of the intended focus and the CLT results got buried. To
  enhance wider dissemination of the results, we are replacing it by
  arXiv:1710.07275 and arXiv:1710.08051",,,,"math.ST stat.TH","http://arxiv.org/licenses/nonexclusive-distrib/1.0/","  The asymptotic solution to the problem of comparing the means of two
heteroscedastic populations, based on two random samples from the populations,
hinges on the pivot underpinning the construction of the confidence interval
and the test statistic being asymptotically standard Normal. The pivot is known
to converge to the standard Normal distribution if the two samples are
independent and the ratio of the sample sizes converges to a finite positive
number. We show, without any restriction on the asymptotic behavior of the
ratio of the sample sizes, that Cesaro convergence of the sequence of cross
sample correlation coefficients to 0 is necessary and sufficient for the
aforesaid pivotal convergence. We also obtain, without any assumption on the
cross sample dependence structure, that both iterated limits of the pivot are
standard Normal and if the joint distribution of the standardized sample means
converges to a spherically symmetric distribution, then that distribution must
be bivariate standard Normal.
","[{""version"":""v1"",""created"":""Tue, 6 Dec 2016 05:22:16 GMT""},{""version"":""v2"",""created"":""Sun, 18 Dec 2016 06:13:40 GMT""},{""version"":""v3"",""created"":""Sun, 6 Aug 2017 17:39:12 GMT""},{""version"":""v4"",""created"":""Fri, 22 Sep 2017 23:55:22 GMT""},{""version"":""v5"",""created"":""Wed, 25 Oct 2017 01:33:57 GMT""}]","2017-10-26"
"1612.01669","Jonghwan Mun","Jonghwan Mun, Paul Hongsuck Seo, Ilchae Jung, Bohyung Han","MarioQA: Answering Questions by Watching Gameplay Videos",,,,,"cs.CV","http://arxiv.org/licenses/nonexclusive-distrib/1.0/","  We present a framework to analyze various aspects of models for video
question answering (VideoQA) using customizable synthetic datasets, which are
constructed automatically from gameplay videos. Our work is motivated by the
fact that existing models are often tested only on datasets that require
excessively high-level reasoning or mostly contain instances accessible through
single frame inferences. Hence, it is difficult to measure capacity and
flexibility of trained models, and existing techniques often rely on ad-hoc
implementations of deep neural networks without clear insight into datasets and
models. We are particularly interested in understanding temporal relationships
between video events to solve VideoQA problems; this is because reasoning
temporal dependency is one of the most distinct components in videos from
images. To address this objective, we automatically generate a customized
synthetic VideoQA dataset using {\em Super Mario Bros.} gameplay videos so that
it contains events with different levels of reasoning complexity. Using the
dataset, we show that properly constructed datasets with events in various
complexity levels are critical to learn effective models and improve overall
performance.
","[{""version"":""v1"",""created"":""Tue, 6 Dec 2016 05:23:52 GMT""},{""version"":""v2"",""created"":""Sun, 13 Aug 2017 07:49:55 GMT""}]","2017-08-15"
"1612.01670","Takashige Sekiguchi","Takashige Sekiguchi and Katsuya Ishiguro","Abelian spatial string tension in finite temperature SU(2) gauge theory","18 pages, 17 figures. Accepted for publication at IJMPA","Int. J. Mod. Phys. A31, 1650149 (2016)","10.1142/S0217751X16501499",,"hep-lat","http://arxiv.org/licenses/nonexclusive-distrib/1.0/","  We investigate Abelian and monopole contributions to spatial string tension
in the deconfined phase of finite temperature SU(2) gauge theory without
imposing any gauge fixing conditions. Lattice calculations of non-Abelian and
Abelian spatial string tensions from the Wilson action at gauge coupling
$\beta=2.74$ and lattice volume $24^3\times{N_t}$ $(N_{t}=\left\{
24,8,6,4,2)\right\}$ show that these string tensions agree with each other
within error bars at any adopted value of $N_t$, which implies Abelian
dominance. From measurements of non-Abelian, Abelian, and monopole forces that
arise from the corresponding spatial string tension, furthermore, we find the
tendency that the monopole contribution to the spatial string tension can be
almost as large as the non-Abelian and Abelian ones. The temperature dependence
of the calculated non-Abelian and Abelian spatial string tensions allows us to
conclude that the concept of dimensional reduction holds both for non-Abelian
and Abelian sectors at temperatures higher than twice the critical temperature.
","[{""version"":""v1"",""created"":""Tue, 6 Dec 2016 05:35:22 GMT""}]","2016-12-07"
"1612.01671","Ravishankar Sundararaman","Ravishankar Sundararaman and Yuan Ping","First-principles electrostatic potentials for reliable alignment at
  interfaces and defects",,"J. Chem. Phys. 146, 104109 (2017)","10.1063/1.4978238",,"physics.chem-ph cond-mat.mtrl-sci","http://arxiv.org/licenses/nonexclusive-distrib/1.0/","  Alignment of electrostatic potential between different atomic configurations
is necessary for first-principles calculations of band offsets across
interfaces and formation energies of charged defects. However, strong
oscillations of this potential at the atomic scale make alignment challenging,
especially when atomic geometries change considerably from bulk to the vicinity
of defects and interfaces. We introduce a method to suppress these strong
oscillations by eliminating the deep wells in the potential at each atom. We
demonstrate that this method considerably improves the system-size convergence
of a wide range of first-principles predictions that depend on alignment of
electrostatic potentials, including band offsets at solid-liquid interfaces,
and formation energies of charged vacancies in solids and at solid surfaces in
vacuum. Finally, we use this method in conjunction with continuum solvation
theories to investigate energetics of charged vacancies at solid-liquid
interfaces. We find that for the example of an NaCl (001) surface in water,
solvation reduces the formation energy of charged vacancies by 0.5 eV:
calculation of this important effect was previously impractical due to
computational cost in molecular-dynamics methods.
","[{""version"":""v1"",""created"":""Tue, 6 Dec 2016 05:38:59 GMT""},{""version"":""v2"",""created"":""Mon, 27 Feb 2017 22:07:43 GMT""}]","2017-03-21"
