"1612.02396","James Atkinson","James H. Atkinson, Adeline D. Fournet, Lakshmi Bhaskaran, Yuri
  Myasoedov, Eli Zeldov, Enrique del Barco, Stephen Hill, George Christou, and
  Jonathan R. Friedman","Effects of uniaxial pressure on the quantum tunneling of magnetization
  in a high-symmetry Mn12 single-molecule magnet","18 pages, 7 figures, version accepted by Phys. Rev. B",,"10.1103/PhysRevB.95.184403",,"cond-mat.mes-hall cond-mat.other","http://arxiv.org/licenses/nonexclusive-distrib/1.0/","  The symmetry of single-molecule magnets dictates their spin quantum dynamics,
influencing how such systems relax via quantum tunneling of magnetization
(QTM). By reducing a system's symmetry, through the application of a magnetic
field or uniaxial pressure, these dynamics can be modified. We report
measurements of the magnetization dynamics of a crystalline sample of the
high-symmetry [Mn12O12(O2CMe)16(MeOH)4]MeOH single-molecule magnet as a
function of uniaxial pressure applied either parallel or perpendicular to the
sample's ""easy"" magnetization axis. At temperatures between 1.8 and 3.3 K,
magnetic hysteresis loops exhibit the characteristic steplike features that
signal the occurrence of QTM. After applying uniaxial pressure to the sample in
situ, both the magnitude and field position of the QTM steps changed. The step
magnitudes were observed to grow as a function of pressure in both arrangements
of pressure, while pressure applied along (perpendicular to) the sample's easy
axis caused the resonant-tunneling fields to increase (decrease). These
observations were compared with simulations in which the system's Hamiltonian
parameters were changed. From these comparisons, we determined that parallel
pressure induces changes to the second-order axial anisotropy parameter as well
as either the fourth-order axial or fourth-order transverse parameter, or to
both. In addition, we find that pressure applied perpendicular to the easy axis
induces a rhombic anisotropy E ~ D/2000 per kbar that can be understood as
deriving from a symmetry-breaking distortion of the molecule.
","[{""version"":""v1"",""created"":""Wed, 7 Dec 2016 20:07:43 GMT""},{""version"":""v2"",""created"":""Thu, 9 Mar 2017 00:26:22 GMT""},{""version"":""v3"",""created"":""Sun, 7 May 2017 00:13:30 GMT""}]","2017-05-09"
"1612.02397","Gabriel Monz\'on","Gabriel Monz\'on","Anisotropic interpolation error estimate for arbitrary quadrilateral
  isoparametric elements","The final publication is available at link.springer.com",,,,"math.NA cs.NA","http://arxiv.org/licenses/nonexclusive-distrib/1.0/","  The aim of this paper is to show that, for any $p \in [1,\infty)$, the
$W^{1,p}$-anisotropic interpolation error estimate holds on quadrilateral
isoparametric elements verifying the maximum angle condition ($MAC$) and the
property of comparable lengths for opposite sides ($clos$), i.e., on all those
quadrilaterals with interior angles uniformly bounded away from $\pi$ and with
both pairs of opposite sides having comparable lengths.
  For rectangular elements our interpolation error estimate agrees with the
usual one whereas for perturbations of rectangles (the most general
quadrilateral elements previously considered as far as we know) our result has
some advantages with respect to the pre-existing ones: the interpolation error
estimate that we proved is written by using two neighboring sides of the
element instead of the sides of the unknown perturbed rectangle and, on the
other hand, conditions $MAC$ and $clos$ are much simpler requirements to verify
and with a clearer geometrical sense than those involved in the definition of
perturbations of a rectangle.
","[{""version"":""v1"",""created"":""Wed, 7 Dec 2016 20:12:20 GMT""},{""version"":""v2"",""created"":""Tue, 14 Feb 2017 13:21:22 GMT""},{""version"":""v3"",""created"":""Fri, 20 Sep 2019 15:44:07 GMT""}]","2019-09-23"
"1612.02398","No\'e Lugaz","No\'e Lugaz, Manuela Temmer, Yuming Wang, Charles J. Farrugia","The Interaction of Successive Coronal Mass Ejections: A Review","44pages, 12 Figures, accepted by Solar Physics",,"10.1007/s11207-017-1091-6",,"physics.space-ph","http://arxiv.org/licenses/nonexclusive-distrib/1.0/","  We present a review of the different aspects associated with the interaction
of successive CMEs in the corona and inner heliosphere, focusing on the
initiation of series of CMEs, their interaction in the heliosphere, the
particle acceleration associated with successive CMEs, and the effect of
compound events on Earth's magnetosphere. The two main mechanisms resulting in
the eruption of series of CMEs are sympathetic eruptions and homologous
eruptions. The interaction of successive CMEs has been observed remotely in
coronagraphs and heliospheric imagers, and inferred from in situ measurements.
It is associated with magnetic reconnection, momentum exchange, the propagation
of a fast magnetosonic shock through a magnetic ejecta and changes in CME
expansion. The presence of a CME a few hours before a fast eruption is
connected with higher fluxes of SEPs, while CME-CME interaction occurring in
the corona is often associated with unusual radio bursts. Higher suprathermal
population, enhanced turbulence and wave activity, stronger shocks, and
shock-shock or shock-CME interaction have been proposed as physical mechanisms
to explain these SEP events. When measured in situ, CME-CME interaction may be
associated with relatively well organized multiple-magnetic cloud events,
instances of shocks propagating through a previous magnetic ejecta or more
complex ejecta. The compression of a CME by another and the propagation of a
shock inside a magnetic ejecta can lead to extreme values of the southward
magnetic field, sometimes associated with large values of the dynamic pressure.
This can result in intense geomagnetic storms, but also trigger substorms and
large earthward motions of the magnetopause, potentially associated with
changes in the outer radiation belts. Future measurements by Solar Probe+ and
Solar Orbiter may shed light on the evolution of CMEs as they interact.
","[{""version"":""v1"",""created"":""Wed, 7 Dec 2016 20:16:25 GMT""},{""version"":""v2"",""created"":""Tue, 14 Mar 2017 18:32:11 GMT""}]","2017-04-05"
"1612.02399","Chiara Toldo","Ruben Monten, Chiara Toldo","Black holes with halos","33 pages, 6 figures, v2: typos fixed, references added","Class.Quant.Grav. 35 (2018) no.3, 035001","10.1088/1361-6382/aa9db8",,"hep-th","http://arxiv.org/licenses/nonexclusive-distrib/1.0/","  We present new AdS4 black hole solutions in N = 2 gauged supergravity coupled
to vector and hypermultiplets. We focus on a particular consistent truncation
of M-theory on the homogeneous Sasaki-Einstein seven-manifold M111,
characterized by the presence of one Betti vector multiplet. We numerically
construct static and spherically symmetric black holes with electric and
magnetic charges, corresponding to M2 and M5 branes wrapping non-contractible
cycles of the internal manifold. These configurations have nonzero temperature
and are moreover surrounded by a massive vector field halo. For these solutions
we verify the first law of black hole mechanics and we analyze the
thermodynamics and phase transitions in the canonical ensemble, interpreting
the process in the corresponding dual field theory.
","[{""version"":""v1"",""created"":""Wed, 7 Dec 2016 20:23:17 GMT""},{""version"":""v2"",""created"":""Tue, 6 Jun 2017 19:00:47 GMT""}]","2018-11-20"
"1612.02400","Vincenzo Ambrosio","Vincenzo Ambrosio, Hichem Hajaiej","Multiple solutions for a class of nonhomogeneous fractional
  Schr\""odinger equations in $\mathbb{R}^{N}$",,"J. Dynam. Differential Equations 30 (2018), no. 3, 1119--1143","10.1007/s10884-017-9590-6",,"math.AP","http://arxiv.org/licenses/nonexclusive-distrib/1.0/","  This paper is concerned with the following fractional Schr\""odinger equation
\begin{equation*} \left\{ \begin{array}{ll} (-\Delta)^{s} u+u= k(x)f(u)+h(x)
\mbox{ in } \mathbb{R}^{N}\\ u\in H^{s}(\R^{N}), \, u>0 \mbox{ in }
\mathbb{R}^{N}, \end{array} \right. \end{equation*} where $s\in (0,1)$, $N>
2s$, $(-\Delta)^{s}$ is the fractional Laplacian, $k$ is a bounded positive
function, $h\in L^{2}(\mathbb{R}^{N})$, $h\not \equiv 0$ is nonnegative and $f$
is either asymptotically linear or superlinear at infinity.\\ By using the
$s$-harmonic extension technique and suitable variational methods, we prove the
existence of at least two positive solutions for the problem under
consideration, provided that $|h|_{2}$ is sufficiently small.
","[{""version"":""v1"",""created"":""Wed, 7 Dec 2016 20:23:33 GMT""},{""version"":""v2"",""created"":""Sun, 5 Mar 2017 17:06:40 GMT""}]","2018-09-06"
"1612.02401","Benjamin Ummenhofer","Benjamin Ummenhofer, Huizhong Zhou, Jonas Uhrig, Nikolaus Mayer, Eddy
  Ilg, Alexey Dosovitskiy, Thomas Brox","DeMoN: Depth and Motion Network for Learning Monocular Stereo","Camera ready version for CVPR 2017. Supplementary material included.
  Project page:
  http://lmb.informatik.uni-freiburg.de/people/ummenhof/depthmotionnet/",,"10.1109/CVPR.2017.596",,"cs.CV","http://arxiv.org/licenses/nonexclusive-distrib/1.0/","  In this paper we formulate structure from motion as a learning problem. We
train a convolutional network end-to-end to compute depth and camera motion
from successive, unconstrained image pairs. The architecture is composed of
multiple stacked encoder-decoder networks, the core part being an iterative
network that is able to improve its own predictions. The network estimates not
only depth and motion, but additionally surface normals, optical flow between
the images and confidence of the matching. A crucial component of the approach
is a training loss based on spatial relative differences. Compared to
traditional two-frame structure from motion methods, results are more accurate
and more robust. In contrast to the popular depth-from-single-image networks,
DeMoN learns the concept of matching and, thus, better generalizes to
structures not seen during training.
","[{""version"":""v1"",""created"":""Wed, 7 Dec 2016 20:26:53 GMT""},{""version"":""v2"",""created"":""Tue, 11 Apr 2017 09:14:10 GMT""}]","2018-01-18"
"1612.02402","Helge Ruddat","Travis Mandel and Helge Ruddat","Descendant log Gromov-Witten invariants for toric varieties and tropical
  curves","40 pages, 4 figures, final version, to appear in Trans. Amer. Math.
  Soc",,,,"math.AG","http://arxiv.org/licenses/nonexclusive-distrib/1.0/","  Using degeneration techniques, we prove the correspondence of tropical curve
counts and log Gromov-Witten invariants with general incidence and psi-class
conditions in toric varieties for genus zero curves and all non-superabundant
higher-genus situations. We also relate the log invariants to the ordinary
ones, in particular explaining the appearance of negative multiplicities in the
descendant correspondence result of Mark Gross.
","[{""version"":""v1"",""created"":""Wed, 7 Dec 2016 20:26:56 GMT""},{""version"":""v2"",""created"":""Wed, 4 Apr 2018 17:52:09 GMT""},{""version"":""v3"",""created"":""Fri, 28 Jun 2019 21:00:10 GMT""}]","2019-07-02"
"1612.02403","Ranbir Singh","Ranbir Singh and Bedangadas Mohanty","Identification of Jet-like events using a Multiplicity Detector","6 pages, 11 figures",,,,"hep-ex nucl-ex","http://arxiv.org/licenses/nonexclusive-distrib/1.0/","  We present a method for studying the detection of jets in high energy
hadronic collisions using multiplicity detector in forward rapidities. Such a
study enhances the physics scope of multiplicity detectors at forward
rapidities in LHC. At LHC energies the jets may be produced with significant
cross section in forward rapidities. A multi resolution wavelet analysis
technique can locate the spatial position of jets due to its feature of
space-scale locality. The discrete wavelet proves to be very effective in
probing physics simultaneously at different locations in phase space and at
different scales to identify jet-like events. The key feature this analysis
exploits is the difference in particle density in localized regions of the
detector due to jet-like and underlying events. We find that this method has a
significant sensitivity towards detecting jet position and its size. The jets
can be found with the efficiency and purity of the order of 46%.
","[{""version"":""v1"",""created"":""Wed, 7 Dec 2016 20:29:20 GMT""}]","2016-12-08"
"1612.02404","Konrad Aguilar","Konrad Aguilar","AF algebras in the quantum Gromov-Hausdorff propinquity space","32 pages. Some clarifications made - especially in section 4. This
  article, in part, generalizes results from arXiv:1511.07114 and was
  originally part of arXiv:1608.07016v1, which was split due to length",,,"BCSim-2016-s03","math.OA math.FA","http://arxiv.org/licenses/nonexclusive-distrib/1.0/","  For unital AF algebras with faithful tracial states, we provide criteria for
convergence in the quantum Gromov-Hausdorff propinquity. For any unital AF
algebra, we introduce new Leibniz Lip-norms using quotient norms. Next, we show
that any unital AF algebra is the limit of its defining inductive sequence of
finite dimensional C*-algebras in quantum propinquity given any Lip-norm
defined on the inductive sequence. We also establish sufficient conditions for
when a *-isomorphism between two AF algebras produces a quantum isometry in the
context of various Lip-norms.
","[{""version"":""v1"",""created"":""Wed, 7 Dec 2016 20:30:17 GMT""},{""version"":""v2"",""created"":""Wed, 9 Aug 2017 17:54:40 GMT""}]","2017-08-10"
"1612.02405","Maud Delattre","Maud Delattre and Marie-Anne Poursat","An iterative algorithm for joint covariate and random effect selection
  in mixed effects models",,,,,"stat.ME","http://arxiv.org/licenses/nonexclusive-distrib/1.0/","  We consider joint selection of fixed and random effects in general
mixed-effects models. The interpretation of estimated mixed-effects models is
challenging since changing the structure of one set of effects can lead to
different choices of important covariates in the model. We propose a stepwise
selection algorithm to perform simultaneous selection of the fixed and random
effects. It is based on BIC-type criteria whose penalties are adapted to
mixed-effects models. The proposed procedure performs model selection in both
linear and nonlinear models. It should be used in the low-dimension setting
where the number of covariates and the number of random effects are moderate
with respect to the total number of observations. The performance of the
algorithm is assessed via a simulation study, that includes also a comparative
study with alternatives when available in the literature. The use of the method
is illustrated in the clinical study of an antibiotic agent kinetics.
","[{""version"":""v1"",""created"":""Wed, 7 Dec 2016 20:30:23 GMT""},{""version"":""v2"",""created"":""Wed, 6 Mar 2019 13:04:55 GMT""},{""version"":""v3"",""created"":""Tue, 25 Feb 2020 13:01:29 GMT""}]","2020-02-26"
"1612.02406","Stefan Ivanov","Stefan Ivanov and Alexander Petkov","The qc Yamabe problem on non-spherical quaternionic contact manifolds","31 pages, no figures. arXiv admin note: text overlap with
  arXiv:0807.0465 by other authors",,,,"math.DG","http://arxiv.org/licenses/nonexclusive-distrib/1.0/","  It is shown that the qc Yamabe problem has a solution on any compact qc
manifold which is non-locally qc equivalent to the standard 3-Sasakian sphere.
Namely, it is proved that on a compact non-locally spherical qc manifold there
exists a qc conformal qc structure with constant qc scalar curvature
","[{""version"":""v1"",""created"":""Wed, 7 Dec 2016 20:32:01 GMT""}]","2016-12-08"
"1612.02407","Marta Strzelecka","Rafa{\l} Lata{\l}a, Marta Strzelecka","Comparison of weak and strong moments for vectors with independent
  coordinates","15 pages","Mathematika 64 (2018) 211-229","10.1112/S0025579317000432",,"math.PR math.MG","http://arxiv.org/licenses/nonexclusive-distrib/1.0/","  We show that for $p\ge 1$, the $p$-th moment of suprema of linear
combinations of independent centered random variables are comparable with the
sum of the first moment and the weak $p$-th moment provided that $2q$-th and
$q$-th integral moments of these variables are comparable for all $ q \ge 2$.
The latest condition turns out to be necessary in the i.i.d. case.
","[{""version"":""v1"",""created"":""Wed, 7 Dec 2016 20:37:11 GMT""}]","2018-02-21"
"1612.02408","Yifeng Sun","Yifeng Sun and Che Ming Ko","Study of chiral vortical and magnetic effects in the anomalous transport
  model","7 pages, 7 figures","Phys. Rev. C 95, 034909 (2017)","10.1103/PhysRevC.95.034909",,"nucl-th","http://arxiv.org/licenses/nonexclusive-distrib/1.0/","  We extend our recent study of chiral magnetic effect in relativistic heavy
ion collisions based on an anomalous transport model by including also the
chiral vortical effect. We find that although vorticities in the chirally
restored quark matter, which result from the large angular momentum in
non-central collisions, can generate an axial charge dipole moment in the
transverse plane of a heavy ion collision, it does not produce a difference in
the eccentricities of negatively and positively charged particles. As a result,
including the chiral vortical effect alone cannot lead to a splitting between
the elliptic flows of negatively and positively charged particles. On the other
hand, negatively and positively charged particles do develop a splitting in
their elliptic flows if the effect due to a strong and long-lived magnetic
field is also included. However, to have a positive slope in the dependence of
the elliptic flow splitting on the charge asymmetry of the quark matter, as
seen in experiments, requires the neglect of the effect of the Lorentz force.
In this case, an elliptic flow splitting appears even at vanishing charge
asymmetry.
","[{""version"":""v1"",""created"":""Wed, 7 Dec 2016 20:38:39 GMT""}]","2017-03-29"
"1612.02409","Thomas Salez","Ren\'e Ledesma-Alonso, Elie Rapha\""el, Thomas Salez, Philippe
  Tordjeman, and Dominique Legendre","Van der Waals interaction between a moving nano-cylinder and a liquid
  thin film",,"Soft Matter, 13 3822 (2017)",,,"cond-mat.mes-hall cond-mat.mtrl-sci cond-mat.soft physics.flu-dyn physics.ins-det","http://arxiv.org/licenses/nonexclusive-distrib/1.0/","  We study the static and dynamic interaction between a horizontal cylindrical
nano-probe and a thin liquid film. The effects of the physical and geometrical
parameters, with a special focus on the film thickness, the probe speed, and
the distance between the probe and the free surface are analyzed. Deformation
profiles have been computed numerically from a Reynolds lubrication equation,
coupled to a modified Young-Laplace equation, which takes into account the
probe/liquid and the liquid/substrate non-retarded van der Waals interactions.
We have found that the film thickness and the probe speed have a significant
effect on the threshold separation distance below which the jump-to-contact
instability is triggered. These results encourage the use of horizontal
cylindrical nano-probes to scan thin liquid films, in order to determine either
the physical or geometrical properties of the latter, through the measurement
of interaction forces.
","[{""version"":""v1"",""created"":""Wed, 7 Dec 2016 20:40:48 GMT""}]","2017-06-05"
"1612.02410","Alexander Nazarov","E.D. Galkovskii and A.I. Nazarov","A general trace formula for the differential operator on a segment with
  the last coefficient perturbed by a finite signed measure","20 pages",,,,"math.SP","http://arxiv.org/licenses/nonexclusive-distrib/1.0/","  A first order trace formula is obtained for a regular differential operator
perturbed by a finite signed measure multiplication operator.
","[{""version"":""v1"",""created"":""Wed, 7 Dec 2016 20:41:26 GMT""}]","2016-12-08"
"1612.02412","Otfried Cheong","Sang Won Bae, Mark de Berg, Otfried Cheong, Joachim Gudmundsson,
  Christos Levcopoulos","Shortcuts for the Circle","An extended abstract appeared in ISAAC 2017",,,,"math.MG cs.CG","http://arxiv.org/licenses/nonexclusive-distrib/1.0/","  Let $C$ be the unit circle in $\mathbb{R}^2$. We can view $C$ as a plane
graph whose vertices are all the points on $C$, and the distance between any
two points on $C$ is the length of the smaller arc between them. We consider a
graph augmentation problem on $C$, where we want to place $k\geq 1$
\emph{shortcuts} on $C$ such that the diameter of the resulting graph is
minimized.
  We analyze for each $k$ with $1\leq k\leq 7$ what the optimal set of
shortcuts is. Interestingly, the minimum diameter one can obtain is not a
strictly decreasing function of~$k$. For example, with seven shortcuts one
cannot obtain a smaller diameter than with six shortcuts. Finally, we prove
that the optimal diameter is $2 + \Theta(1/k^{\frac{2}{3}})$ for any~$k$.
","[{""version"":""v1"",""created"":""Wed, 7 Dec 2016 20:44:21 GMT""},{""version"":""v2"",""created"":""Wed, 25 Oct 2017 03:36:15 GMT""}]","2017-10-26"
"1612.02413","Amir H. Safavi-Naeini","Christopher J. Sarabalis, Yanni D. Dahmani, Rishi N. Patel, Jeff T.
  Hill, Amir H. Safavi-Naeini","Release-free silicon-on-insulator cavity optomechanics","5 pages, 3 figures",,,,"physics.optics","http://arxiv.org/licenses/nonexclusive-distrib/1.0/","  We demonstrate optically coupled nanomechanical resonators fabricated on
silicon-on-insulator. Silicon fin waveguides are used to control the dispersion
of mechanical waves and engineer localized resonances by modulation of the fin
properties. A photonic crystal cavity is designed to localize laser light near
the fin and the mechanical motion is read out and modified by radiation
pressure back-action. We expect devices and systems made from similar
structures to enable co-integration of signal transduction and processing
capabilities via electronic, photonic, and phononic degrees freedom in a single
scalable platform.
","[{""version"":""v1"",""created"":""Wed, 7 Dec 2016 20:48:24 GMT""}]","2016-12-08"
"1612.02414","Jacob Kegerreis","Jacob A. Kegerreis, Vincent R. Eke, Richard J. Massey, Simon K.
  Beaumont, Rick C. Elphic, Luis F. Teodoro","Evidence for a Localised Source of the Argon in the Lunar Exosphere","Published in JGR: Planets. 19 pages, 10 figures","Journal of Geophysical Research: Planets, Early View 26 October
  2017","10.1002/2017JE005352",,"astro-ph.EP","http://arxiv.org/licenses/nonexclusive-distrib/1.0/","  We perform the first tests of various proposed explanations for observed
features of the Moon's argon exosphere, including models of: spatially varying
surface interactions; a source that reflects the lunar near-surface potassium
distribution; and temporally varying cold trap areas. Measurements from the
Lunar Atmosphere and Dust Environment Explorer (LADEE) and the Lunar Atmosphere
Composition Experiment (LACE) are used to test whether these models can
reproduce the data. The spatially varying surface interactions hypothesized in
previous work cannot reproduce the persistent argon enhancement observed over
the western maria. They also fail to match the observed local time of the
near-sunrise peak in argon density, which is the same for the highland and mare
regions, and is well reproduced by simple surface interactions with a
ubiquitous desorption energy of 28 kJ/mol. A localised source can explain the
observations, with a trade-off between an unexpectedly localised source or an
unexpectedly brief lifetime of argon atoms in the exosphere. To match the
observations, a point-like source requires source and loss rates of
~$1.9\times10^{21}$ atoms/s. A more diffuse source, weighted by the
near-surface potassium, requires much higher rates of ~$1.1\times10^{22}$
atoms/s, corresponding to a mean lifetime of just 1.4 lunar days. We do not
address the mechanism for producing a localised source, but demonstrate that
this appears to be the only model that can reproduce the observations. Large,
seasonally varying cold traps could explain the long-term fluctuation in the
global argon density observed by LADEE, but not that by LACE.
","[{""version"":""v1"",""created"":""Wed, 7 Dec 2016 20:49:03 GMT""},{""version"":""v2"",""created"":""Tue, 31 Oct 2017 18:00:03 GMT""}]","2017-11-02"
"1612.02415","Asher Auel","Asher Auel and Marcello Bernardara","Cycles, derived categories, and rationality","54 pages, comments welcome!","in Surveys on Recent Developments in Algebraic Geometry,
  Proceedings of Symposia in Pure Mathematics, vol. 95, Amer. Math. Soc.,
  Providence, RI, 2017, pp. 199-266",,,"math.AG","http://arxiv.org/licenses/nonexclusive-distrib/1.0/","  Our main goal is to give a sense of recent developments in the (stable)
rationality problem from the point of view of unramified cohomology and
0-cycles as well as derived categories and semiorthogonal decompositions, and
how these perspectives intertwine and reflect each other. In particular, in the
case of algebraic surfaces, we explain the relationship between Bloch's
conjecture, Chow-theoretic decompositions of the diagonal, categorical
representability, and the existence of phantom subcategories of the derived
category.
","[{""version"":""v1"",""created"":""Wed, 7 Dec 2016 20:50:29 GMT""}]","2020-08-03"
