"1612.02601","Marco Di Liberto","M. Di Liberto, A. Recati, I. Carusotto, C. Menotti","Two-body bound and edge states in the extended SSH Bose-Hubbard model","12 pages, 8 figures; Submitted to EPJ Special Topics, Quantum Gases
  and Quantum Coherence","Eur. Phys. J. Special Topics 226, 2751 (2017)","10.1140/epjst/e2016-60388-y",,"cond-mat.quant-gas","http://arxiv.org/licenses/nonexclusive-distrib/1.0/","  We study the bosonic two-body problem in a Su-Schrieffer-Heeger dimerized
chain with on-site and nearest-neighbor interactions. We find two classes of
bound states. The first, similar to the one induced by on-site interactions,
has its center of mass on the strong link, whereas the second, existing only
thanks to nearest-neighbors interactions, is centered on the weak link. We
identify energy crossings between these states and analyse them using exact
diagonalization and perturbation theory. In the presence of open boundary
conditions, novel strongly-localized edge-bound states appear in the spectrum
as a consequence of the interplay between lattice geometry, on-site and
nearest-neighbor interactions. Contrary to the case of purely on-site
interactions, such EBS persist even in the strongly interacting regime.
","[{""version"":""v1"",""created"":""Thu, 8 Dec 2016 11:22:31 GMT""},{""version"":""v2"",""created"":""Mon, 9 Jan 2017 16:08:38 GMT""}]","2017-09-19"
"1612.02602","Hans Feldmeier","Hans Feldmeier, Thomas Neff","Nuclear Clustering in Fermionic Molecular Dynamics",,,,,"nucl-th","http://arxiv.org/licenses/nonexclusive-distrib/1.0/","  Clustering plays an important role in the structure of nuclei, especially for
light nuclei in the $p$-shell. In nuclear cluster models these degrees of
freedom are introduced explicitly. In the Resonating Group Method or in the
Generator Coordinate Method the clusters are built from individual nucleons
interacting via an effective nucleon-nucleon interaction; the total wave
function is antisymmetrized. Fermionic Molecular Dynamics (FMD) goes beyond
pure cluster models. It is a microscopic many-body approach using a Gaussian
wave packet basis that includes the harmonic oscillator shell model and
Brink-type cluster model wave functions as special cases. Clustering is not
imposed but appears dynamically in the calculations. The importance of
clustering for the understanding of bound states, resonances and scattering
states is illustrated with examples discussing the charge radii of the Neon
isotopes, the $^3$He($\alpha$,$\gamma$)$^7$Be capture reaction and the cluster
states in the $^{12}$C continuum.
","[{""version"":""v1"",""created"":""Thu, 8 Dec 2016 11:34:20 GMT""}]","2016-12-09"
"1612.02603","Atsushi Ooka","Atsushi Ooka and Suyong Eum and Shingo Ata and Masayuki Murata","Compact CAR: Low-Overhead Cache Replacement Policy for an ICN Router","15 pages, 29 figures, submitted to Computer Communications",,,,"cs.NI","http://arxiv.org/licenses/nonexclusive-distrib/1.0/","  Information-centric networking (ICN) has gained attention from network
research communities due to its capability of efficient content dissemination.
In-network caching function in ICN plays an important role to achieve the
design motivation. However, many researchers on in-network caching have focused
on where to cache rather than how to cache: the former is known as contents
deployment in the network and the latter is known as cache replacement in an
ICN element. Although, the cache replacement has been intensively researched in
the context of web-caching and content delivery network previously, the
conventional approaches cannot be directly applied to ICN due to the fine
granularity of cacheable items in ICN, which eventually changes the access
patterns.
  In this paper, we argue that ICN requires a novel cache replacement algorithm
to fulfill the requirements in the design of high performance ICN element.
Then, we propose a novel cache replacement algorithm to satisfy the
requirements named Compact CLOCK with Adaptive Replacement (Compact CAR), which
can reduce the consumption of cache memory to one-tenth compared to
conventional approaches.
","[{""version"":""v1"",""created"":""Thu, 8 Dec 2016 11:38:26 GMT""}]","2016-12-09"
"1612.02604","Alexander Schmeding","Alexander Schmeding","Manifolds of absolutely continuous curves and the square root velocity
  framework","29 pages, preliminary version, comments welcome",,,,"math.DG","http://arxiv.org/licenses/nonexclusive-distrib/1.0/","  A classical result in Riemannian geometry states that the absolutely
continuous curves into a (finite-dimensional) Riemannian manifold form an
infinite-dimensional manifold. In the present paper this construction and
related results are generalised to absolutely continuous curves with values in
a strong Riemannian manifolds. As an application we consider extensions of the
square root velocity transform (SRVT) framework for shape analysis.
Computations in this framework frequently lead to curves which leave the shape
space (of smooth curves), and are only contained in a completion. In the vector
valued case, this extends the SRVT to a space of absolutely continuous curves.
We investigate the situation for shape spaces of manifold valued (absolutely
continuous) curves.
","[{""version"":""v1"",""created"":""Thu, 8 Dec 2016 11:46:48 GMT""}]","2016-12-09"
"1612.02605","Philip Bachman","Philip Bachman and Alessandro Sordoni and Adam Trischler","Towards Information-Seeking Agents","Under review for ICLR 2017",,,,"cs.LG","http://arxiv.org/licenses/nonexclusive-distrib/1.0/","  We develop a general problem setting for training and testing the ability of
agents to gather information efficiently. Specifically, we present a collection
of tasks in which success requires searching through a partially-observed
environment, for fragments of information which can be pieced together to
accomplish various goals. We combine deep architectures with techniques from
reinforcement learning to develop agents that solve our tasks. We shape the
behavior of these agents by combining extrinsic and intrinsic rewards. We
empirically demonstrate that these agents learn to search actively and
intelligently for new information to reduce their uncertainty, and to exploit
information they have already acquired.
","[{""version"":""v1"",""created"":""Thu, 8 Dec 2016 11:47:01 GMT""}]","2016-12-09"
"1612.02606","Abel Gawel","Abel Gawel, Mina Kamel, Tonci Novkovic, Jakob Widauer, Dominik
  Schindler, Benjamin Pfyffer von Altishofen, Roland Siegwart, Juan Nieto","Aerial Picking and Delivery of Magnetic Objects with MAVs","under review for the IEEE International Conference on Robotics and
  Automation (ICRA) 2017",,,,"cs.RO","http://arxiv.org/licenses/nonexclusive-distrib/1.0/","  Autonomous delivery of goods using a MAV is a difficult problem, as it poses
high demand on the MAV's control, perception and manipulation capabilities.
This problem is especially challenging if the exact shape, location and
configuration of the objects are unknown. In this paper, we report our findings
during the development and evaluation of a fully integrated system that is
energy efficient and enables MAVs to pick up and deliver objects with partly
ferrous surface of varying shapes and weights. This is achieved by using a
novel combination of an electro-permanent magnetic gripper with a passively
compliant structure and integration with detection, control and servo
positioning algorithms. The system's ability to grasp stationary and moving
objects was tested, as well as its ability to cope with different shapes of the
object and external disturbances. We show that such a system can be
successfully deployed in scenarios where an object with partly ferrous parts
needs to be gripped and placed in a predetermined location.
","[{""version"":""v1"",""created"":""Thu, 8 Dec 2016 11:54:51 GMT""}]","2016-12-09"
"1612.02607","Yonatan Harpaz","Yonatan Harpaz, Joost Nuiten, Matan Prasma","Tangent categories of algebras over operads","The section concerning stabilization of model categories was
  separated into an independent paper, appearing now as arXiv:1802.08031",,,,"math.AT","http://arxiv.org/licenses/nonexclusive-distrib/1.0/","  Associated to a presentable $\infty$-category $\mathcal{C}$ and an object $X
\in \mathcal{C}$ is the tangent $\infty$-category $\mathcal{T}_X\mathcal{C}$,
consisting of parameterized spectrum objects over $X$. This gives rise to a
cohomology theory, called Quillen cohomology, whose category of coefficients is
$\mathcal{T}_X\mathcal{C}$. When $\mathcal{C}$ consists of algebras over a nice
$\infty$-operad in a stable $\infty$-category, $\mathcal{T}_X\mathcal{C}$ is
equivalent to the $\infty$-category of operadic modules, by work of
Basterra--Mandell, Schwede and Lurie. In this paper we develop the
model-categorical counterpart of this identification and extend it to the case
of algebras over an enriched operad, taking values in a model category which is
not necessarily stable. This extended comparison can be used, for example, to
identify the cotangent complex of enriched categories, an application we take
up in a subsequent paper.
","[{""version"":""v1"",""created"":""Thu, 8 Dec 2016 11:58:43 GMT""},{""version"":""v2"",""created"":""Mon, 26 Feb 2018 14:09:12 GMT""}]","2018-02-27"
"1612.02608","Yonatan Harpaz","Yonatan Harpaz, Joost Nuiten, Matan Prasma","The abstract cotangent complex and Quillen cohomology of enriched
  categories",,,"10.1112/topo.12074",,"math.AT","http://arxiv.org/licenses/nonexclusive-distrib/1.0/","  In his fundamental work, Quillen developed the theory of the cotangent
complex as a universal abelian derived invariant, and used it to define and
study a canonical form of cohomology, encompassing many known cohomology
theories. Additional cohomology theories, such as generalized cohomology of
spaces and topological Andr\'e-Quillen cohomology, can be accommodated by
considering a spectral version of the cotangent complex. Recent work of Lurie
established a comprehensive $\infty$-categorical analogue of the cotangent
complex formalism using stabilization of $\infty$-categories. In this paper we
study the spectral cotangent complex while working in Quillen's model
categorical setting. Our main result gives new and explicit computations of the
cotangent complex and Quillen cohomology of enriched categories. For this we
make essential use of previous work, which identifies the tangent categories of
operadic algebras in unstable model categories. In particular, we present the
cotangent complex of an $\infty$-category as a spectrum valued functor on its
twisted arrow category, and consider the associated obstruction theory in some
examples of interest.
","[{""version"":""v1"",""created"":""Thu, 8 Dec 2016 12:04:37 GMT""}]","2018-08-01"
"1612.02609","Edouard Boujo","Edouard Boujo, Alexey Denisov, Bruno Schuermans and Nicolas Noiray","Quantifying acoustic damping using flame chemiluminescence","14 pages, 6 figures (+2 supp.)","Journal of Fluid Mechanics (2016), vol. 808, pp. 245-257","10.1017/jfm.2016.663",,"physics.flu-dyn","http://arxiv.org/licenses/nonexclusive-distrib/1.0/","  Thermoacoustic instabilities in gas turbines and aeroengine combustors falls
within the category of complex systems. They can be described
phenomenologically using nonlinear stochastic differential equations, which
constitute the grounds for output-only model-based system identification. It
has been shown recently that one can extract the governing parameters of the
instabilities, namely the linear growth rate and the nonlinear component of the
thermoacoustic feedback, using dynamic pressure time series only. This is
highly relevant for practical systems, which cannot be actively controlled due
to a lack of cost-effective actuators. The thermoacoustic stability is given by
the linear growth rate, which results from the combination of the acoustic
damping and the coherent feedback from the flame. In this paper, it is shown
that it is possible to quantify the acoustic damping of the system, and thus to
separate its contribution to the linear growth rate from the one of the flame.
This is achieved by post-processing in a simple way simultaneously acquired
chemiluminescence and acoustic pressure data. It provides an additional
approach to further unravel from observed time series the key mechanisms
governing the system dynamics. This straightforward method is illustrated here
using experimental data from a combustion chamber operated at several linearly
stable and unstable operating conditions.
","[{""version"":""v1"",""created"":""Thu, 8 Dec 2016 12:09:30 GMT""}]","2016-12-09"
"1612.02610","Dong Li Mr.","Dong Li","Statistical properties of the Bipolar Magnetic Regions","19 pages, 12 figures, and 2 tables, accepted for publication in RAA",,"10.1088/1674-4527/17/5/40",,"astro-ph.SR","http://creativecommons.org/licenses/by/4.0/","  Using the observations from Michelson Doppler Imager (MDI) onboard Solar and
Heliospheric Observatory (SOHO), we develop a computational algorithm to
automatically identify the bipolar magnetic regions (BMRs) in the active
regions, and then study their statistical properties. The individual magnetic
(positive or negative) pole of the BMR is determined from the region with an
absolute strength above 55 G and with an area above 250 pixel^2 (495 Mm^2),
while a BMR is identified as a pair of positive and negative poles with a
shortest area-weight distance between them. Based on this method, 2234 BMRs are
identified from the MDI synoptic magnetograms between the Carrington Rotation
1909 (1996 May 06) and 2104 (2010 December 10). 1005 of them are located in the
northern hemisphere, while the other 1229 are in the southern hemisphere.We
find that the BMR paraments (e.g., latitudes, separations, fragments, and
strength) are similar to those of active regions (ARs). Moreover, based on the
maximum likelihood estimation (MLE)method, the frequency distributions of these
BMRs occurrence as functions of area size and magnetic flux exhibit a power-law
behavior. We also find that their orientation angles follow the Hale's Polarity
Laws and deviate slightly to the solar equator direction. Consistent with the
previous findings, we obtain the orientation angles dependence on the latitudes
for the normal BMRs during the 23rd solar cycle. The north-south asymmetry of
these BMRs is also detected here.
","[{""version"":""v1"",""created"":""Thu, 8 Dec 2016 12:10:02 GMT""}]","2017-05-10"
"1612.02611","Ortwin Hess","Nuttawut Kongsuwan, Angela Demetriadou, Rohit Chikkaraddy, Felix Benz,
  Vladimir A. Turek, Ulrich F. Keyser, Jeremy J. Baumberg and Ortwin Hess","Suppressed Quenching and Strong Coupling of Purcell-Enhanced
  Single-Molecule Emission in Plasmonic Nanocavities",,,,,"physics.optics","http://arxiv.org/licenses/nonexclusive-distrib/1.0/","  An emitter in the vicinity of a metal nanostructure is quenched by its decay
through non-radiative channels, leading to the belief in a zone of inactivity
for emitters placed within $<$10nm of a plasmonic nanostructure. Here we
demonstrate that in tightly-coupled plasmonic resonators forming nanocavities
""quenching is quenched"" due to plasmon mixing. Unlike isolated nanoparticles,
plasmonic nanocavities show mode hybridization which massively enhances emitter
excitation and decay via radiative channels. This creates ideal conditions for
realizing single-molecule strong-coupling with plasmons, evident in dynamic
Rabi-oscillations and experimentally confirmed by laterally dependent emitter
placement through DNA-origami.
","[{""version"":""v1"",""created"":""Thu, 8 Dec 2016 12:10:56 GMT""},{""version"":""v2"",""created"":""Wed, 22 Feb 2017 00:00:27 GMT""}]","2017-02-23"
"1612.02612","Marc Andre Heller","Ursula Carow-Watamura, Marc Andre Heller, Noriaki Ikeda, Tomokazu
  Kaneko and Satoshi Watamura","Off-Shell Covariantization of Algebroid Gauge Theories","24 pages, typos corrected, one reference added","Prog Theor Exp Phys (2017)","10.1093/ptep/ptx100","TU-1035","hep-th math-ph math.MP","http://arxiv.org/licenses/nonexclusive-distrib/1.0/","  We present a generalized method to construct field strengths and gauge
symmetries, which yield a Yang-Mills type action with Lie n-algebroid gauge
symmetry. The procedure makes use of off-shell covariantization in a
supergeometric setting. We apply this method to the system of a 1-form gauge
field and scalar fields with Lie n-algebroid gauge symmetry. We work out some
characteristic examples.
","[{""version"":""v1"",""created"":""Thu, 8 Dec 2016 12:12:26 GMT""},{""version"":""v2"",""created"":""Tue, 10 Jan 2017 08:19:39 GMT""}]","2019-12-06"
"1612.02613","Ju-Jun Xie","Xu Zhang, Ju-Jun Xie, and Xurong Chen","Faddeev fixed center approximation to $\pi \bar{K} K^*$ system and the
  $\pi_1(1600)$","6 pages, 5 figures. To match the published version in PRD","Phys. Rev. D 95, 056014 (2017)","10.1103/PhysRevD.95.056014",,"hep-ph hep-ex nucl-ex nucl-th","http://arxiv.org/licenses/nonexclusive-distrib/1.0/","  We investigate the three-body system of $\pi \bar{K} K^*$ by using the
fixed-center approximation to the Faddeev equation, taking the interaction
between $\pi$ and $\bar{K}$, $\pi$ and $K^*$, and $\bar{K}$ and $K^*$ from the
chiral unitary approach. The study is made assuming scattering of a $\pi$ on a
$\bar{K} K^*$ cluster, which is known to generate the $f_1(1285)$ state. The
resonant structure around $1650$ MeV shows up in the modulus squared of the
$\pi$-$(\bar{K} K^*)_{f_1(1285)}$ scattering amplitude and suggests that a
$\pi$-$(\bar{K} K^*)_{f_1(1285)}$ state, with ""exotic"" quantum numbers $J^{PC}
= 1^{-+}$, can be formed. This state can be identified as the observed
$\pi_1(1600)$ resonance. We suggest that this is the origin of the present
$\pi_1(1600)$ resonance and propose to look at the $\pi f_1(1285)$ mode in
future experiments to clarify the issue.
","[{""version"":""v1"",""created"":""Thu, 8 Dec 2016 12:15:02 GMT""},{""version"":""v2"",""created"":""Mon, 12 Dec 2016 15:34:51 GMT""},{""version"":""v3"",""created"":""Thu, 9 Mar 2017 09:07:33 GMT""}]","2017-03-22"
"1612.02614","Yuta Takahashi","Yuta Takahashi, Toshikaze Kariyado, Yasuhiro Hatsugai","Edge states of mechanical diamond and its topological origin","9 pages, 7 figures","New J. Phys. 19 035003 (2017)","10.1088/1367-2630/aa5edb",,"cond-mat.mes-hall","http://arxiv.org/licenses/nonexclusive-distrib/1.0/","  A mechanical diamond, a classical mechanics of a spring-mass model arrayed on
a diamond lattice, is discussed topologically. Its frequency dispersion
possesses an intrinsic nodal structure in the three-dimensional Brillouin zone
(BZ) protected by the chiral symmetry. Topological changes of the line nodes
are demonstrated associated with modification of the tension. The line nodes
projected into two-dimensional BZ form loops which are characterized by the
quantized Zak phases by 0 and $\pi$. With boundaries, edge states are discussed
in relation to the Zak phases and winding numbers. It establishes a bulk-edge
correspondence of the mechanical diamond.
","[{""version"":""v1"",""created"":""Thu, 8 Dec 2016 12:16:44 GMT""}]","2018-01-22"
"1612.02615","Berangere Delourme","B\'erang\`ere Delourme, Patrick Joly (POEMS), Elizaveta Vasilevskaya","Existence of guided waves due to a lineic perturbation of a 3D periodic
  medium","in Applied Mathematics Letters, Elsevier, 2016",,"10.1016/j.aml.2016.11.017",,"math.NA math.SP","http://arxiv.org/licenses/nonexclusive-distrib/1.0/","  In this note, we exhibit a three dimensional structure that permits to guide
waves. This structure is obtained by a geometrical perturbation of a 3D
periodic domain that consists of a three dimensional grating of equi-spaced
thin pipes oriented along three orthogonal directions. Homogeneous Neumann
boundary conditions are imposed on the boundary of the domain. The diameter of
the section of the pipes, of order $\epsilon$ \textgreater{} 0, is supposed to
be small. We prove that, for $\epsilon$ small enough, shrinking the section of
one line of the grating by a factor of $\sqrt$ $\mu$ (0 \textless{} $\mu$
\textless{} 1) creates guided modes that propagate along the perturbed line.
Our result relies on the asymptotic analysis (with respect to $\epsilon$) of
the spectrum of the Laplace-Neumann operator in this structure. Indeed, as
$\epsilon$ tends to 0, the domain tends to a periodic graph, and the spectrum
of the associated limit operator can be computed explicitly.
","[{""version"":""v1"",""created"":""Thu, 8 Dec 2016 12:21:43 GMT""}]","2016-12-09"
"1612.02616","Arvind","Jaskaran Singh and Kishor Bharti and Arvind","Quantum key distribution protocol based on contextuality monogamy","Minor Changes New proof added","Phys. Rev. A 95, 062333 (2017)","10.1103/PhysRevA.95.062333",,"quant-ph","http://arxiv.org/licenses/nonexclusive-distrib/1.0/","  The security of quantum key distribution protocols hinges upon features of
physical systems that are uniquely quantum in nature. We explore the role of
quantumness as qualified by quantum contextuality, in quantum key distribution
schemes. We present a new quantum key distribution protocol whose security
depends uponthe KCBS inequality and contextuality monogamy. We explicitly
calculate the key rate, error rate introduced between Alice-Bob communication
due to the presence of Eve, and the information-gain by Eve. This protocol
provides a new framework for quantum key distribution which has conceptual and
practical advantages over other quantum protocols.
","[{""version"":""v1"",""created"":""Thu, 8 Dec 2016 12:21:48 GMT""},{""version"":""v2"",""created"":""Thu, 15 Dec 2016 08:52:37 GMT""},{""version"":""v3"",""created"":""Mon, 19 Jun 2017 04:11:15 GMT""}]","2017-07-04"
"1612.02617","Murray Batchelor","Francisco C Alcaraz, Murray T Batchelor and Zi-Zhong Liu","Energy spectrum and critical exponents of the free parafermion $Z_N$
  spin chain","8 pages, 1 figure, minor changes, connection to hypergeometric
  function","J. Phys. A: Math. Theor. 50, 16LT03 (2017)","10.1088/1751-8121/aa645a",,"cond-mat.stat-mech cond-mat.str-el hep-th math-ph math.MP","http://arxiv.org/licenses/nonexclusive-distrib/1.0/","  Results are given for the ground state energy and excitation spectrum of a
simple $N$-state $Z_N$ spin chain described by free parafermions. The model is
non-Hermitian for $N \ge 3$ with a real ground state energy and a complex
excitation spectrum. Although having a simpler Hamiltonian than the
superintegrable chiral Potts model, the model is seen to share some properties
with it, e.g., the specific heat exponent $\alpha=1-2/N$ and the anisotropic
correlation length exponents $\nu_\parallel =1$ and $\nu_\perp=2/N$.
","[{""version"":""v1"",""created"":""Thu, 8 Dec 2016 12:23:16 GMT""},{""version"":""v2"",""created"":""Mon, 27 Feb 2017 21:11:35 GMT""}]","2017-03-24"
"1612.02618","Ulrich Ebling","Ulrich Ebling and Andr\'e Eckardt","Spin relaxation in a one-dimensional large-spin degenerate Fermi gas","11 pages, 6 figures, improved abstract, modified appendix format",,,,"cond-mat.quant-gas","http://arxiv.org/licenses/nonexclusive-distrib/1.0/","  In this work, we study the dynamics of an atomic harmonically trapped
large-spin Fermi gas in one dimension (1D). We investigate the interplay of
different collision processes. Coherent spin oscillations, driven by
spin-changing forward scattering are captured by a mean-field description and
scale linearly with density regardless of the dimension of the system.
Conversely, ""incoherent"" collision processes which e.g. lead to the damping of
spin oscillations, behave differently. In the usual three-dimensional (3D)
case, the rate of incoherent processes increases faster with density than
mean-field effects, but in 1D it increases slower. This means, that in the 1D
case, incoherent collisions become more important at lower densities. We study
these effects by deriving and integrating a quantum Boltzmann equation. We
demonstrate that the well known fact that in one dimension, interaction-induced
correlations become more dominant at low densities can be observed in
far-from-equilibrium spin dynamics.
","[{""version"":""v1"",""created"":""Thu, 8 Dec 2016 12:26:13 GMT""},{""version"":""v2"",""created"":""Mon, 12 Dec 2016 14:49:28 GMT""}]","2016-12-13"
"1612.02619","Jerome Bolte","J\'er\^ome Bolte (TSE), Adrien Blanchet (GREMAQ)","A family of functional inequalities: Lojasiewicz inequalities and
  displacement convex functions",,,,,"math.AP","http://arxiv.org/licenses/nonexclusive-distrib/1.0/","  For displacement convex functionals in the probability space equip\-ped with
the Monge-Kantorovich metric we prove the equivalence between the gradient and
functional type \L oja\-sie\-wicz inequalities. \chg{We also discuss the more
general case of $\lambda$-convex functions and we provide a general convergence
theorem for the corresponding gradient dynamics. Specialising our results to
the Boltzmann entropy, we recover Otto-Villani's theorem asserting the
equivalence between logarithmic Sobolev and Talagrand's inequalities. The
choice of power-type entropies shows a new equivalence between
Gagliardo-Nirenberg inequality and a nonlinear Talagrand inequality. Some
nonconvex results and other types of equivalences are discussed.
","[{""version"":""v1"",""created"":""Thu, 8 Dec 2016 12:26:32 GMT""},{""version"":""v2"",""created"":""Thu, 22 Dec 2016 08:05:12 GMT""},{""version"":""v3"",""created"":""Thu, 23 Feb 2017 14:14:07 GMT""},{""version"":""v4"",""created"":""Fri, 19 Jan 2018 15:20:37 GMT""},{""version"":""v5"",""created"":""Mon, 8 Oct 2018 13:58:34 GMT""}]","2018-10-09"
