"1612.02304","Matthias Ludewig","Matthias Ludewig","Asymptotic Expansions and Conformal Covariance of the Mass of Conformal
  Differential Operators","38 pages, fixed a mistake in proof of Lemma 7.6","Annals of Global Analysis and Geometry, October 2017, Volume 52,
  Issue 3, pp 237-268","10.1007/s10455-017-9556-2",,"math.DG math.AP","http://arxiv.org/licenses/nonexclusive-distrib/1.0/","  We give an explicit description of the full asymptotic expansion of the
Schwartz kernel of the complex powers of $m$-Laplace type operators $L$ on
compact Riemannian manifolds in terms of Riesz distributions. The constant term
in this asymptotic expansion turns turns out to be given by the local zeta
function of $L$. In particular, the constant term in the asymptotic expansion
of the Green's function $L^{-1}$ is often called the mass of $L$, which (in
case that $L$ is the Yamabe operator) is an important invariant, namely a
positive multiple of the ADM mass of a certain asymptotically flat manifold
constructed out of the given data. We show that for general conformally
invariant $m$-Laplace operators $L$ (including the GJMS operators), this mass
is a conformal invariant in the case that the dimension of $M$ is odd and that
$\ker L = 0$, and we give a precise description of the failure of the conformal
invariance in the case that these conditions are not satisfied.
","[{""version"":""v1"",""created"":""Wed, 7 Dec 2016 16:04:25 GMT""},{""version"":""v2"",""created"":""Mon, 23 Jan 2017 16:06:42 GMT""},{""version"":""v3"",""created"":""Thu, 30 Mar 2017 08:22:39 GMT""},{""version"":""v4"",""created"":""Wed, 26 Apr 2017 20:34:56 GMT""}]","2022-01-19"
"1612.02305","Denis Davydov","Denis Davydov and Tymofiy Gerasimov and Jean-Paul Pelteret and Paul
  Steinmann","On the $h$-adaptive PUM and the $hp$-adaptive FEM approaches applied to
  PDEs in quantum mechanics",,,,,"physics.comp-ph","http://arxiv.org/licenses/nonexclusive-distrib/1.0/","  In this paper the $h$-adaptive partition-of-unity method and the $h$- and
$hp$-adaptive finite element method are applied to partial differential
equations arising in quantum mechanics, namely, the Schr\""odinger equation with
Coulomb and harmonic potentials, and the Poisson problem. Implementational
details of the partition-of-unity method related to enforcing continuity with
hanging nodes and the degeneracy of the basis are discussed. The
partition-of-unity method is equipped with an a posteriori error estimator,
thus enabling implementation of error-controlled adaptive mesh refinement
strategies. To that end, local interpolation error estimates are derived for
the partition-of-unity method enriched with a class of exponential functions.
The results are the same as for the finite element method and thereby admit the
usage of standard residual error indicators. The efficiency of the $h$-adaptive
partition-of-unity method is compared to the $h$- and $hp$-adaptive finite
element method. The latter is implemented by adopting the analyticity estimate
from Legendre coefficients. An extension of this approach to multiple solution
vectors is proposed. Numerical results confirm the remarkable accuracy of the
$h$-adaptive partition-of-unity approach. In case of the Hydrogen atom, the
$h$-adaptive linear partition-of-unity method was found to be comparable to the
$hp$-adaptive finite element method for the target eigenvalue accuracy of
$10^{-3}$.
","[{""version"":""v1"",""created"":""Wed, 7 Dec 2016 16:05:45 GMT""}]","2016-12-08"
"1612.02306","Alexis Reymbaut","A. Reymbaut, A.-M. Gagnon, D. Bergeron, and A.-M. S. Tremblay","Maximum entropy analytic continuation for frequency-dependent transport
  coefficients with non-positive spectral weight","12 pages, 8 figures","Phys. Rev. B 95, 121104 (2017)","10.1103/PhysRevB.95.121104",,"cond-mat.str-el","http://arxiv.org/licenses/nonexclusive-distrib/1.0/","  The computation of transport coefficients, even in linear response, is a
major challenge for theoretical methods that rely on analytic continuation of
correlations functions obtained numerically in Matsubara space. While maximum
entropy methods can be used for certain correlation functions, this is not
possible in general, important examples being the Seebeck, Hall, Nernst and
Reggi-Leduc coefficients. Indeed, positivity of the spectral weight on the
positive real-frequency axis is not guaranteed in these cases. The spectral
weight can even be complex in the presence of broken time-reversal symmetry.
Various workarounds, such as the neglect of vertex corrections or the study of
the infinite frequency or Kelvin limits have been proposed. Here, we show that
one can define auxiliary response functions that allow to extract the desired
real-frequency susceptibilities from maximum entropy methods in the most
general multiorbital cases with no particular symmetry. As a benchmark case, we
study the longitudinal thermoelectric response and corresponding Onsager
coefficient in the single-band two-dimensional Hubbard model treated with
dynamical mean-field theory (DMFT) and continuous-time quantum Monte Carlo
(CTQMC). We thereby extend to transport coefficients the maximum entropy
analytic continuation with auxiliary functions (MaxEntAux method), developed
for the study of the superconducting pairing dynamics of correlated materials.
","[{""version"":""v1"",""created"":""Wed, 7 Dec 2016 16:07:10 GMT""},{""version"":""v2"",""created"":""Fri, 17 Mar 2017 04:14:11 GMT""}]","2017-03-22"
"1612.02307","Omid Abari","Omid Abari, Hariharan Rahul, Dina Katabi","Over-the-air Function Computation in Sensor Networks","8 pages",,,,"cs.NI","http://arxiv.org/licenses/nonexclusive-distrib/1.0/","  Many sensor applications are interested in computing a function over
measurements (e.g., sum, average, max) as opposed to collecting all sensor
data. Today, such data aggregation is done in a cluster-head. Sensor nodes
transmit their values sequentially to a cluster-head node, which calculates the
aggregation function and forwards it to the base station. In contrast, this
paper explores the possibility of computing a desired function over the air. We
devise a solution that enables sensors to transmit coherently over the wireless
medium so that the cluster-head directly receives the value of the desired
function. We present analysis and preliminary results that demonstrate that
such a design yield a large improvement in network throughput.
","[{""version"":""v1"",""created"":""Wed, 7 Dec 2016 16:07:30 GMT""}]","2016-12-08"
"1612.02308","Maria Julia Redondo","Maria Julia Redondo and Lucrecia Roman","Comparison morphisms between two projective resolutions of monomial
  algebras","Final version to appear in Revista de la Union Matematica Argentina;
  36 pages",,,,"math.RA","http://arxiv.org/licenses/nonexclusive-distrib/1.0/","  We construct comparison morphisms between two well-known projective
resolutions of a monomial algebra $A$: the bar resolution and Bardzell's
resolution; the first one is used to define the cup product and the Lie bracket
on the Hochschild cohomology $HH^*(A)$ and the second one has been shown to be
an efficient tool for computations of these cohomology groups. The constructed
comparison morphisms allow us to show that the cup product restricted to even
degrees of the Hochschild cohomology has a very simple description. Moreover,
for $A=k Q/I$ a monomial algebra such that $dim_k \ e_i A e_j = 1$ whenever
there exists an arrow $\alpha: i \to j \in Q_1$, we describe the Lie action of
the Lie algebra $HH^1(A)$ on $HH^{\ast}(A)$.
","[{""version"":""v1"",""created"":""Wed, 7 Dec 2016 16:08:34 GMT""},{""version"":""v2"",""created"":""Wed, 5 Jul 2017 16:40:47 GMT""}]","2017-07-06"
"1612.02309","Michael Gr\""obner","Michael Gr\""obner, Philipp Weinmann, Emil Kirilov, Hanns-Christoph
  N\""agerl","Degenerate Raman sideband cooling of 39K",,"Phys. Rev. A 95, 033412 (2017)","10.1103/PhysRevA.95.033412",,"cond-mat.quant-gas physics.atom-ph","http://arxiv.org/licenses/nonexclusive-distrib/1.0/","  We report on the first realization of sub-Doppler laser cooling of 39K atoms
using degenerate 3D Raman sideband cooling. We take advantage of the
well-resolved excited hyperfine states on the D1 optical transition to produce
spin polarized samples with $1.4 \times 10^8$ atoms at temperatures of 1.8
$\mu$K. The phase-space densities are $\geq 10^{-4}$, which significantly
improves the initial conditions for a subsequent evaporative cooling step. The
presented cooling technique using the D1 line can be adapted to other atomic
species and is applicable to high-resolution imaging schemes in far
off-resonant optical lattices.
","[{""version"":""v1"",""created"":""Wed, 7 Dec 2016 16:12:34 GMT""},{""version"":""v2"",""created"":""Wed, 29 Mar 2017 10:43:06 GMT""}]","2017-03-30"
"1612.02310","Ji Feng","Ji Feng, Qingsheng Zhu, Jinlong Huang, Lijun Yang","Extend natural neighbor: a novel classification method with
  self-adaptive neighborhood parameters in different stages","10 pages, 2 figures, 2 tables",,,,"cs.AI cs.LG","http://arxiv.org/licenses/nonexclusive-distrib/1.0/","  Various kinds of k-nearest neighbor (KNN) based classification methods are
the bases of many well-established and high-performance pattern-recognition
techniques, but both of them are vulnerable to their parameter choice.
Essentially, the challenge is to detect the neighborhood of various data sets,
while utterly ignorant of the data characteristic. This article introduces a
new supervised classification method: the extend natural neighbor (ENaN)
method, and shows that it provides a better classification result without
choosing the neighborhood parameter artificially. Unlike the original KNN based
method which needs a prior k, the ENaNE method predicts different k in
different stages. Therefore, the ENaNE method is able to learn more from
flexible neighbor information both in training stage and testing stage, and
provide a better classification result.
","[{""version"":""v1"",""created"":""Wed, 7 Dec 2016 16:13:52 GMT""}]","2016-12-08"
"1612.02311","Reinhard Schwienhorst","Reinhard Schwienhorst (on behalf of the CDF and D0 Collaborations)","Selected Topics from Top Mass Measurements at the Tevatron","5 pages, presented at Top2016",,,"CONF-16-615-PPD","hep-ex","http://arxiv.org/licenses/nonexclusive-distrib/1.0/","  The most recent results of the top-quark mass measurements at the Tevatron at
Fermilab are presented. Data were collected in proton-antiproton collisions at
sqrt{s}=1.96 TeV by the CDF and D0 experiments. Top quark mass measurements in
the lepton+jets, dilepton and alljet final states as well as their combination
and the extraction of the mass from the cross-section measurement are
presented.
","[{""version"":""v1"",""created"":""Wed, 7 Dec 2016 16:14:40 GMT""}]","2016-12-30"
"1612.02312","Alet Roux","Alet Roux and Tomasz Zastawniak","Game options with gradual exercise and cancellation under proportional
  transaction costs",,,,,"q-fin.PR math.PR","http://arxiv.org/licenses/nonexclusive-distrib/1.0/","  Game (Israeli) options in a multi-asset market model with proportional
transaction costs are studied in the case when the buyer is allowed to exercise
the option and the seller has the right to cancel the option gradually at a
mixed (or randomised) stopping time, rather than instantly at an ordinary
stopping time. Allowing gradual exercise and cancellation leads to increased
flexibility in hedging, and hence tighter bounds on the option price as
compared to the case of instantaneous exercise and cancellation. Algorithmic
constructions for the bid and ask prices, and the associated superhedging
strategies and optimal mixed stopping times for both exercise and cancellation
are developed and illustrated. Probabilistic dual representations for bid and
ask prices are also established.
","[{""version"":""v1"",""created"":""Wed, 7 Dec 2016 16:16:48 GMT""}]","2016-12-08"
"1612.02313","Daniil Evtushinsky","D. V. Evtushinsky, M. Aichhorn, Y. Sassa, Z.-H. Liu, J. Maletz,
  T.Wolf, A. N.Yaresko, S. Biermann, S. V. Borisenko, B.Buchner","Direct observation of dispersive lower Hubbard band in iron-based
  superconductor FeSe",,,,,"cond-mat.supr-con cond-mat.str-el","http://arxiv.org/licenses/nonexclusive-distrib/1.0/","  Electronic correlations were long suggested not only to be responsible for
the complexity of many novel materials, but also to form essential
prerequisites for their intriguing properties. Electronic behavior of
iron-based superconductors is far from conventional, while the reason for that
is not yet understood. Here we present a combined study of the electronic
spectrum in the iron-based superconductor FeSe by means of angle-resolved
photoemission spectroscopy (ARPES) and dynamical mean field theory (DMFT). Both
methods in unison reveal strong deviations of the spectrum from single-electron
approximation for the whole 3$d$ band of iron: not only the well separated
coherent and incoherent parts of the spectral weight are observed, but also a
noticeable dispersion of the lower Hubbard band (LHB) is clearly present. This
way we demonstrate correlations of the most puzzling intermediate coupling
strength in iron superconductors.
","[{""version"":""v1"",""created"":""Wed, 7 Dec 2016 16:18:58 GMT""}]","2016-12-08"
"1612.02314","Martin Pielot","Martin Pielot and Luz Rello","Productive, Anxious, Lonely - 24 Hours Without Push Notifications",,,"10.1145/3098279.3098526",,"cs.HC","http://arxiv.org/licenses/nonexclusive-distrib/1.0/","  We report from the Do Not Disturb Challenge where 30 volunteers disabled
notification alerts for 24 hours across all devices. The effect of the absence
of notifications on the participants was isolated through an experimental study
design: we compared self-reported feedback from the day without notifications
against a baseline day. The evidence indicates that notifications have locked
us in a dilemma: without notifications, participants felt less distracted and
more productive. But, they also felt no longer able to be as responsive as
expected, which made some participants anxious. And, they felt less connected
with one's social group. In contrast to previous reports, about two third of
the participants expressed the intention to change how they manage
notifications. Two years later, half of the participants are still following
through with their plans.
","[{""version"":""v1"",""created"":""Wed, 7 Dec 2016 16:23:33 GMT""},{""version"":""v2"",""created"":""Tue, 4 Jul 2017 05:40:59 GMT""},{""version"":""v3"",""created"":""Wed, 5 Jul 2017 07:19:27 GMT""}]","2017-07-06"
"1612.02315","Adam Kapelner","Abba M. Krieger, David Azriel and Adam Kapelner","Nearly Random Designs with Greatly Improved Balance","21 pages, 3 figures, 3 tables",,,,"math.ST stat.TH","http://arxiv.org/licenses/nonexclusive-distrib/1.0/","  We present a new experimental design procedure that divides a set of
experimental units into two groups so that the two groups are balanced on a
prespecified set of covariates and being almost as random as complete
randomization. Under complete randomization, the difference in covariate
balance as measured by the standardized average between treatment and control
will be $O_p(n^{-1/2})$. If the sample size is not too large this may be
material. In this article, we present an algorithm which greedily switches
assignment pairs. Resultant designs produce balance of the much lower order
$O_p(n^{-3})$ for one covariate. However, our algorithm creates assignments
which are, strictly speaking, non-random. We introduce two metrics which
capture departures from randomization: one in the style of entropy and one in
the style of standard error and demonstrate our assignments are nearly as
random as complete randomization in terms of both measures. The results are
extended to more than one covariate, simulations are provided to illustrate the
results and statistical inference under our design is discussed. We provide an
open source R package available on CRAN called GreedyExperimentalDesign which
generates designs according to our algorithm.
","[{""version"":""v1"",""created"":""Wed, 7 Dec 2016 16:25:29 GMT""}]","2016-12-08"
"1612.02316","G. S. Bisnovatyi-Kogan","G.S. Bisnovatyi-Kogan, A.S. Pozanenko","Can flaring stars explain the annihilation line from the Galaxy bulge?",,,,,"astro-ph.HE","http://arxiv.org/licenses/nonexclusive-distrib/1.0/","  Electron-positron annihilation line from a Galactic center direction was
discovered by the balloon-borne germanium gamma-ray telescope, and confirmed by
OSSE experiment of CGRO mission. Extensive observations by INTEGRAL observatory
permit to determine properties of the annihilation line from Galactic bulge.
Possible sources of $e^{+}$ already discussed are supernovae explosions,
microquasars, gamma-ray bursts, tidal disruption events, activity near black
hole of Sgr A*, $e^{+}$ generation by subrelativistic cosmic rays, or even dark
matter. One remarkable feature of the line emission is an absence of resolved
point like sources. Any model should take into account this feature. We
consider flares of low-mass stars as a possible cumulative $e^{+}$ source of
the observed annihilation line from the bulge. Our estimations show that
$e^{+}$ production by numerous flaring stars in Galaxy bulge can be
significant, or even the main source of $e^{+}$ responsible for the
annihilation line observed from the central part of our Galaxy.
","[{""version"":""v1"",""created"":""Wed, 7 Dec 2016 16:25:49 GMT""}]","2016-12-08"
"1612.02317","Ganzhao Yuan","Ganzhao Yuan, Wei-Shi Zheng, Bernard Ghanem","A Matrix Splitting Method for Composite Function Minimization",,,,,"math.OC","http://arxiv.org/licenses/nonexclusive-distrib/1.0/","  Composite function minimization captures a wide spectrum of applications in
both computer vision and machine learning. It includes bound constrained
optimization and cardinality regularized optimization as special cases. This
paper proposes and analyzes a new Matrix Splitting Method (MSM) for minimizing
composite functions. It can be viewed as a generalization of the classical
Gauss-Seidel method and the Successive Over-Relaxation method for solving
linear systems in the literature. Incorporating a new Gaussian elimination
procedure, the matrix splitting method achieves state-of-the-art performance.
For convex problems, we establish the global convergence, convergence rate, and
iteration complexity of MSM, while for non-convex problems, we prove its global
convergence. Finally, we validate the performance of our matrix splitting
method on two particular applications: nonnegative matrix factorization and
cardinality regularized sparse coding. Extensive experiments show that our
method outperforms existing composite function minimization techniques in term
of both efficiency and efficacy.
","[{""version"":""v1"",""created"":""Wed, 7 Dec 2016 16:29:18 GMT""}]","2016-12-08"
"1612.02318","Jean-Sebastien Gagnon","Jean-Sebastien Gagnon, David Hochberg, Juan Perez-Mercader","Effects of spatial and temporal noise on a cubic-autocatalytic
  reaction-diffusion model","10 pages, 6 figures","Phys. Rev. E 95, 032106 (2017)","10.1103/PhysRevE.95.032106",,"cond-mat.other","http://arxiv.org/licenses/nonexclusive-distrib/1.0/","  We characterize the influence that external noise, with both spatial and
temporal correlations, has on the scale dependence of the reaction parameters
of a cubic autocatalytic reaction diffusion (CARD) system. Interpreting the
CARD model as a primitive reaction scheme for a living system, the results
indicate that power-law correlations in environmental fluctuations can either
decrease or increase the rates of nutrient decay and the rate of autocatalysis
(replication) on small spatial and temporal scales.
","[{""version"":""v1"",""created"":""Wed, 7 Dec 2016 16:34:08 GMT""}]","2017-03-08"
"1612.02319","Matias Blana Diaz","Matias Blana (1), Christopher Wegg (1), Ortwin Gerhard (1), Peter
  Erwin (1), Matthieu Portail (1), Michael Opitsch (1,2,3), Roberto Saglia
  (1,2), Ralf Bender (1,2) ((1) MPE Garching, (2) USM Munich, (3) Excellence
  Cluster Universe Garching)","Andromeda chained to the Box -- Dynamical Models for M31: Bulge & Bar","20 pages, 13 figures, 1 table. Accepted for publication in MNRAS","Mon Not R Astron Soc (2017) 466 (4): 4279-4298","10.1093/mnras/stw3294",,"astro-ph.GA","http://arxiv.org/licenses/nonexclusive-distrib/1.0/","  Andromeda is our nearest neighbouring disk galaxy and a prime target for
detailed modelling of the evolutionary processes that shape galaxies. We
analyse the nature of M31's triaxial bulge with an extensive set of N-body
models, which include Box/Peanut (B/P) bulges as well as initial classical
bulges (ICBs). Comparing with IRAC 3.6$\mu m$ data, only one model matches
simultaneously all the morphological properties of M31's bulge, and requires an
ICB and a B/P bulge with 1/3 and 2/3 of the total bulge mass respectively. We
find that our pure B/P bulge models do not show concentrations high enough to
match the S\'ersic index ($n$) and the effective radius of M31's bulge.
Instead, the best model requires an ICB component with mass $M^{\rm
ICB}=1.1\times10^{10}{\rm M_{\odot}}$ and three-dimensional half-mass radius
$r_{\rm half}^{\rm ICB}$=0.53 kpc (140 arcsec). The B/P bulge component has a
mass of $M^{\rm B/P}=2.2\times10^{10}{\rm M_{\odot}}$ and a half-mass radius of
$r_{\rm half}^{\rm B/P}$=1.3 kpc (340 arcsec). The model's B/P bulge extends to
$r^{\rm B/P}$=3.2 kpc (840 arcsec) in the plane of the disk, as does M31's
bulge. In this composite bulge model, the ICB component explains the velocity
dispersion drop observed in the centre within $R<$190 pc (50 arcsec), while the
B/P bulge component reproduces the observed rapid rotation and the kinematic
twist of the observed zero velocity line. This model's pattern speed is
$\Omega_p$=38 km/s/kpc, placing corotation at $r_{\rm cor}$=5.8 kpc (1500
arcsec). The outer Lindblad resonance (OLR) is then at $r_{\rm OLR}$=10.4kpc,
near the 10kpc-ring of M31, suggesting that this structure may be related to
the bar's OLR. By comparison with an earlier snapshot, we estimate that M31's
thin bar extends to $r_{\rm bar}^{\rm thin}\sim$4.0 kpc (1000 arcsec) in the
disk plane, and in projection extends to $R_{\rm bar}^{\rm thin}\sim$2.3 kpc
(600 arcsec).
","[{""version"":""v1"",""created"":""Wed, 7 Dec 2016 16:35:46 GMT""},{""version"":""v2"",""created"":""Thu, 15 Dec 2016 18:43:19 GMT""}]","2017-04-12"
"1612.02320","Muris Sarajli\'c","Muris Sarajli\'c, Liang Liu, and Ove Edfors","An Energy Efficiency Perspective on Massive MIMO Quantization","To be published in Proceedings of 50th Asilomar Conference on
  Signals, Systems and Computers",,,,"cs.IT math.IT","http://arxiv.org/licenses/nonexclusive-distrib/1.0/","  One of the basic aspects of Massive MIMO (MaMi) that is in the focus of
current investigations is its potential of using low-cost and energy-efficient
hardware. It is often claimed that MaMi will allow for using analog-to-digital
converters (ADCs) with very low resolutions and that this will result in
overall improvement of energy efficiency. In this contribution, we perform a
parametric energy efficiency analysis of MaMi uplink for the entire base
station receiver system with varying ADC resolutions. The analysis shows that,
for a wide variety of system parameters, ADCs with intermediate bit resolutions
(4 - 10 bits) are optimal in energy efficiency sense, and that using very low
bit resolutions results in degradation of energy efficiency.
","[{""version"":""v1"",""created"":""Wed, 7 Dec 2016 16:42:15 GMT""}]","2016-12-08"
"1612.02321","Lingfu Zhang","Vadim Gorin, Lingfu Zhang","Interlacing adjacent levels of $\beta$--Jacobi corners processes","v2: final journal version to appear in PTRF",,,,"math.PR math-ph math.CO math.MP math.QA math.RT","http://arxiv.org/licenses/nonexclusive-distrib/1.0/","  We study the asymptotics of the global fluctuations for the difference
between two adjacent levels in the $\beta$--Jacobi corners process (multilevel
and general $\beta$ extension of the classical Jacobi ensemble of random
matrices). The limit is identified with the derivative of the $2d$ Gaussian
Free Field. Our main tools are integral forms for the (Macdonald-type)
difference operators originating from the shuffle algebra.
","[{""version"":""v1"",""created"":""Wed, 7 Dec 2016 16:42:15 GMT""},{""version"":""v2"",""created"":""Sun, 24 Dec 2017 18:07:20 GMT""}]","2017-12-27"
"1612.02322","Irene Sabadini","Fabrizio Colombo, Irene Sabadini, Franciscus Sommen","On the Bargmann-Radon transform in the monogenic setting",,,"10.1016/j.geomphys.2017.06.008",,"math.CV","http://arxiv.org/licenses/nonexclusive-distrib/1.0/","  In this paper we introduce and study a Bargmann-Radon transform on the real
monogenic Bargmann module. This transform is defined as the projection of the
real Bargmann module on the closed submodule of monogenic functions spanned by
the monogenic plane waves. We prove that this projection can be written in
integral form in terms the so-called Bargmann-Radon kernel. Moreover, we have a
characterization formula for the Bargmann-Radon transform of a function in the
real Bargmann module in terms of its complex extension and then its restriction
to the nullcone in $\mathbb C^m$. We also show that the formula holds for the
Szeg\H{o}-Radon transform that we introduced in [4] (see list of references).
Finally, we define the dual transform and we provide an inversion formula.
","[{""version"":""v1"",""created"":""Wed, 7 Dec 2016 16:42:56 GMT""}]","2017-09-13"
