"1612.02499","Takahito Todoroki","Takahito Todoroki (for the STAR collaboration)","Quarkonium measurements via the di-muon decay channel in $\rm p$+$\rm p$
  and $\rm Au$+$\rm Au$ collisions with the STAR experiment","Proceedings for Strangeness in Quark Matter 2016, UC Berkeley, 27
  June to 1 July 2016",,"10.1088/1742-6596/779/1/012040",,"nucl-ex","http://arxiv.org/licenses/nonexclusive-distrib/1.0/","  We present the first $J/\psi$ and $\Upsilon$ measurements in the di-muon
decay channel at mid-rapidity at RHIC using the newly installed Muon Telescope
Detector. In p$+$p collisions at $\sqrt{s}=500$~GeV, inclusive $J/\psi$ cross
section can be described by CGC+NRQCD and NLO NRQCD model calculations for
$0<p_T<20$~GeV/$c$. In Au$+$Au collisions at $\sqrt{s_{NN}}=200$~GeV, we
observe (i) clear $J/\psi$ suppression indicating dissociation; (ii) $J/\psi$
$R_{AA}$ can be qualitatively described by transport models including
dissociation and regeneration with a tension at high $p_T$; and (iii) hint of
less melting of $\Upsilon(2S+3S)$ relative to $\Upsilon(1S)$ at RHIC compared
to that at LHC.
","[{""version"":""v1"",""created"":""Thu, 8 Dec 2016 00:51:47 GMT""}]","2019-08-13"
"1612.02500","Stephen Simons","Stephen Simons","Quasidense monotone multifunctions","24 pages",,,,"math.FA","http://arxiv.org/licenses/nonexclusive-distrib/1.0/","  In this paper, we discuss quasidense multifunctions from a Banach space into
its dual, and use the two sum theorems proved in a previous paper to give
various characterizations of quasidensity. We investigate the Fitzpatrick
extension of such a multifunction. We prove that, for closed monotone
multifunctions, quasidensity implies type (FPV) and strong maximality, and that
quasidensity is equivalent to type (FP). This version differs from Version 3 in
that a few minor errors have been corrected.
","[{""version"":""v1"",""created"":""Thu, 8 Dec 2016 00:54:29 GMT""},{""version"":""v2"",""created"":""Mon, 12 Dec 2016 16:13:14 GMT""},{""version"":""v3"",""created"":""Tue, 24 Jan 2017 13:05:40 GMT""},{""version"":""v4"",""created"":""Mon, 10 Jul 2017 03:53:03 GMT""}]","2017-07-11"
"1612.02501","Mahboubeh Asgari-Targhi Dr","Adriaan A. van Ballegooijen, Mahboubeh Asgari-Targhi","Direct and Inverse Cascades in the Acceleration Region of the Fast Solar
  Wind",,,"10.3847/1538-4357/835/1/10",,"astro-ph.SR physics.space-ph","http://arxiv.org/licenses/nonexclusive-distrib/1.0/","  Alfv\'{e}n waves are believed to play an important role in the heating and
acceleration of the fast solar wind emanating from coronal holes. Nonlinear
interactions between the dominant ${\bf z}_{+}$ waves and minority ${\bf
z}_{-}$ waves have the potential to transfer wave energy either to smaller
perpendicular scales (""direct cascade"") or to larger scales (""inverse
cascade""). In this paper we use reduced magnetohydrodynamic (RMHD) simulations
to investigate how the cascade rates $\epsilon_{\pm}$ depend on perpendicular
wavenumber and radial distance from Sun center. For models with a smooth
background atmosphere we find that an inverse cascade ($\epsilon_{+} < 0$)
occurs for the dominant waves at radii between 1.4 and 2.5 $R_\odot$ and
dimensionless wavenumbers in the inertial range ($15 < a_\perp < 44$), and a
direct cascade ($\epsilon_{+} > 0$) occurs elsewhere. For a model with density
fluctuations there are multiple regions with inverse cascade. In both cases the
cascade rate $\epsilon_{+}$ varies significantly with perpendicular wavenumber,
indicating that the cacsade is a highly non-local process. As a result of the
inverse cascades, the enery dissipation rates are much lower than expected from
a phenomenological model, and are insufficient to maintain the temperature of
the background atmosphere. We conclude that RMHD models are unable to reproduce
the observed properties of the fast solar wind.
","[{""version"":""v1"",""created"":""Thu, 8 Dec 2016 01:01:03 GMT""}]","2017-01-25"
"1612.02502","Kohei Yoshimatsu","K. Yoshimatsu, O. Sakata, and A. Ohtomo","Superconductivity in higher titanium oxides","25 pages, 4 figures in main text, 14 pages, 11 figures in
  supplemental information","Scientific Reports 7, 12544 (2017)","10.1038/s41598-017-12815-4",,"cond-mat.mtrl-sci cond-mat.str-el cond-mat.supr-con","http://arxiv.org/licenses/nonexclusive-distrib/1.0/","  Recent renewal of the highest transition temperature in a conventional
superconductor of the sulfer hydride attracts much attention to exploring
simple compounds with the lighter elements, situated in unconventional
conditions. We report the discovery of superconductivity in simple oxides of
Ti4O7 and g-Ti3O5 in a thin-film form having deliberately tuned epitaxial
structures and off-stoichiometry. These higher titanium oxides join in a class
of simple-oxide superconductors, and g-Ti3O5 now holds the highest
superconducting transition temperature of 7.1 kelvin among them. The mechanism
behind the superconductivity is discussed on the basis of electrical
measurements and theoretical predictions. We conclude that superconductivity
arises from unstabilized bipolaronic insulating states.
","[{""version"":""v1"",""created"":""Thu, 8 Dec 2016 01:04:05 GMT""}]","2022-05-11"
"1612.02503","Mahmoud Abo Khamis","Mahmoud Abo Khamis, Hung Q. Ngo, Dan Suciu","What do Shannon-type Inequalities, Submodular Width, and Disjunctive
  Datalog have to do with one another?",,,,,"cs.DB cs.DS cs.IT math.IT","http://arxiv.org/licenses/nonexclusive-distrib/1.0/","  Recent works on bounding the output size of a conjunctive query with
functional dependencies and degree constraints have shown a deep connection
between fundamental questions in information theory and database theory. We
prove analogous output bounds for disjunctive datalog rules, and answer several
open questions regarding the tightness and looseness of these bounds along the
way. Our bounds are intimately related to Shannon-type information
inequalities. We devise the notion of a ""proof sequence"" of a specific class of
Shannon-type information inequalities called ""Shannon flow inequalities"". We
then show how such a proof sequence can be interpreted as symbolic instructions
guiding an algorithm called ""PANDA"", which answers disjunctive datalog rules
within the time that the size bound predicted. We show that PANDA can be used
as a black-box to devise algorithms matching precisely the fractional hypertree
width and the submodular width runtimes for aggregate and conjunctive queries
with functional dependencies and degree constraints.
  Our results improve upon known results in three ways. First, our bounds and
algorithms are for the much more general class of disjunctive datalog rules, of
which conjunctive queries are a special case. Second, the runtime of PANDA
matches precisely the submodular width bound, while the previous algorithm by
Marx has a runtime that is polynomial in this bound. Third, our bounds and
algorithms work for queries with input cardinality bounds, functional
dependencies, and degree constraints.
  Overall, our results show a deep connection between three seemingly unrelated
lines of research; and, our results on proof sequences for Shannon flow
inequalities might be of independent interest.
","[{""version"":""v1"",""created"":""Thu, 8 Dec 2016 01:06:40 GMT""},{""version"":""v2"",""created"":""Sun, 18 Dec 2016 08:10:36 GMT""},{""version"":""v3"",""created"":""Sat, 25 Mar 2017 23:18:03 GMT""},{""version"":""v4"",""created"":""Wed, 1 Nov 2017 07:13:09 GMT""}]","2017-11-02"
"1612.02504","Soichiro Isoyama","Ryuichi Fujita, Soichiro Isoyama, Alexandre Le Tiec, Hiroyuki Nakano,
  Norichika Sago, Takahiro Tanaka","Hamiltonian Formulation of the Conservative Self-Force Dynamics in the
  Kerr Geometry","55 pages, 0 figures, matches the published version","Class. Quantum Grav. 34 134001 (2017)","10.1088/1361-6382/aa7342","KUNS-2648,YITP-16-122","gr-qc","http://arxiv.org/licenses/nonexclusive-distrib/1.0/","  We formulate a Hamiltonian description of the orbital motion of a point
particle in Kerr spacetime for generic (eccentric, inclined) orbits, which
accounts for the effects of the conservative part of the gravitational
self-force. This formulation relies on a description of the particle's motion
as geodesic in a certain smooth effective spacetime, in terms of (generalized)
action-angle variables. Clarifying the role played by the gauge freedom in the
Hamiltonian dynamics, we extract the gauge-invariant information contained in
the conservative self-force. We also propose a possible gauge choice for which
the orbital dynamics can be described by an effective Hamiltonian, written
solely in terms of the action variables. As an application of our Hamiltonian
formulation in this gauge, we derive the conservative self-force correction to
the orbital frequencies of Kerr innermost stable spherical (inclined or
circular) orbits. This gauge choice also allows us to establish a ""first law of
mechanics"" for black-hole-particle binary systems, at leading order beyond the
test-mass approximation.
","[{""version"":""v1"",""created"":""Thu, 8 Dec 2016 01:11:13 GMT""},{""version"":""v2"",""created"":""Thu, 8 Jun 2017 20:52:50 GMT""}]","2017-06-12"
"1612.02505","Monika Gamza","Monika Barbara Gam\.za, Roman Gumeniuk, Ulrich Burkhardt, Walter
  Schnelle, Helge Rosner, Andreas Leithe-Jasper, and Andrzej \'Slebarski","Coexistence of magnetic order and valence fluctuations in the Kondo
  lattice system Ce$_2$Rh$_3$Sn$_5$","12 pages with 10 figures (main manuscript) and 2 pages with 2 figures
  (supplementary information)","Phys. Rev. B 95, 165142 (2017)","10.1103/PhysRevB.95.165142",,"cond-mat.str-el","http://arxiv.org/licenses/nonexclusive-distrib/1.0/","  We report on the electronic band structure, structural, magnetic and thermal
properties of Ce$_2$Rh$_3$Sn$_5$. Ce $L_{\mathrm{III}}$-edge XAS spectra give
direct evidence for an intermediate valence behaviour. Thermodynamic
measurements reveal magnetic transitions at $T_{\mathrm{N1}}\approx$ 2.9 K and
$T_{\mathrm{N2}}\approx$ 2.4 K. Electrical resistivity shows behaviour typical
for Kondo lattices. The coexistence of magnetic order and valence fluctuations
in a Kondo lattice system we attribute to a peculiar crystal structure in which
Ce ions occupy two distinct lattice sites. Analysis of the structural features
of Ce$_2$Rh$_3$Sn$_5$, together with results of electronic band structure
calculations and thermodynamic data indicate that Ce2 ions are in an
intermediate valence state with the ground state electronic configuration close
to 4$f^0$, whereas Ce1 ions are trivalent (4$f^1$) and contribute to the low
temperature magnetic ordering. Thus, our joined experimental and theoretical
investigations classify Ce$_2$Rh$_3$Sn$_5$ as a multivalent charge-ordered
system.
","[{""version"":""v1"",""created"":""Thu, 8 Dec 2016 01:26:57 GMT""},{""version"":""v2"",""created"":""Thu, 27 Apr 2017 23:36:24 GMT""}]","2017-05-03"
"1612.02506","Martin Benning","Martin Benning, Marta M. Betcke, Matthias J. Ehrhardt, Carola-Bibiane
  Sch\""onlieb","Gradient descent in a generalised Bregman distance framework","Conference proceedings of '2016 Geometric Numerical Integration and
  its Applications Maths Conference at La Trobe University, Melbourne
  Australia', MI Lecture Notes series of Kyushu University, six pages, one
  figure, program code: https://doi.org/10.17863/CAM.6714",,,,"math.OC","http://arxiv.org/licenses/nonexclusive-distrib/1.0/","  We discuss a special form of gradient descent that in the literature has
become known as the so-called linearised Bregman iteration. The idea is to
replace the classical (squared) two norm metric in the gradient descent setting
with a generalised Bregman distance, based on a more general proper, convex and
lower semi-continuous functional. Gradient descent as well as the entropic
mirror descent by Nemirovsky and Yudin are special cases, as is a specific form
of non-linear Landweber iteration introduced by Bachmayr and Burger. We are
going to analyse the linearised Bregman iteration in a setting where the
functional we want to minimise is neither necessarily Lipschitz-continuous (in
the classical sense) nor necessarily convex, and establish a global convergence
result under the additional assumption that the functional we wish to minimise
satisfies the so-called Kurdyka-{\L}ojasiewicz property.
","[{""version"":""v1"",""created"":""Thu, 8 Dec 2016 01:43:48 GMT""},{""version"":""v2"",""created"":""Tue, 27 Dec 2016 17:14:41 GMT""}]","2016-12-28"
"1612.02507","Jan-Torge Schindler","J.-T. Schindler, Elizabeth M. Green, W. David Arnett","Asteroseismic Constraints on the Models of Hot B Subdwarfs: Convective
  Helium-Burning Cores","10 pages, 3 figures, proceedings of the Joint TASC2 - KASC9 Workshop
  - SPACEINN - HELAS8 Conference ""Seismology of the Sun and the Distant Stars
  2016"". To be published by the EPJ Web of Conferences",,"10.1051/epjconf/201716004001",,"astro-ph.SR","http://arxiv.org/licenses/nonexclusive-distrib/1.0/","  Asteroseismology of non-radial pulsations in Hot B Subdwarfs (sdB stars)
offers a unique view into the interior of core-helium-burning stars.
Ground-based and space-borne high precision light curves allow for the analysis
of pressure and gravity mode pulsations to probe the structure of sdB stars
deep into the convective core. As such asteroseismological analysis provides an
excellent opportunity to test our understanding of stellar evolution. In light
of the newest constraints from asteroseismology of sdB and red clump stars,
standard approaches of convective mixing in 1D stellar evolution models are
called into question. The problem lies in the current treatment of overshooting
and the entrainment at the convective boundary. Unfortunately no consistent
algorithm of convective mixing exists to solve the problem, introducing
uncertainties to the estimates of stellar ages. Three dimensional simulations
of stellar convection show the natural development of an overshooting region
and a boundary layer. In search for a consistent prescription of convection in
one dimensional stellar evolution models, guidance from three dimensional
simulations and asteroseismological results is indispensable.
","[{""version"":""v1"",""created"":""Thu, 8 Dec 2016 01:51:14 GMT""}]","2017-11-08"
"1612.02508","Graeme Wilkin","Oscar Garcia-Prada and Graeme Wilkin","Action of the mapping class group on character varieties and Higgs
  bundles","25 pages. Some typos corrected. Final version to appear in Documenta
  Mathematica",,,,"math.AG math-ph math.DG math.MP","http://arxiv.org/licenses/nonexclusive-distrib/1.0/","  We consider the action of a finite subgroup of the mapping class group
$Mod(S)$ of an oriented compact surface $S$ of genus $g \geq 2$ on the moduli
space $\mathcal{R}(S,G)$ of representations of $\pi_1(S)$ in a connected
semisimple real Lie group $G$. Kerckhoff's solution of the Nielsen realization
problem ensures the existence of an element $J$ in the Teichm\""uller space of
$S$ for which $\Gamma$ can be realised as a subgroup of the group of
automorphisms of $X=(S,J)$ which are holomorphic or antiholomorphic. We
identify the fixed points of the action of $\Gamma$ on $\mathcal{R}(S,G)$ in
terms of $G$-Higgs bundles on $X$ equipped with a certain twisted
$\Gamma$-equivariant structure, where the twisting involves abelian and
non-abelian group cohomology simultaneously. When the kernel of the isotropy
representation of the maximal compact subgroup of $G$ is trivial, the fixed
points can be described in terms of familiar objects on $Y=X/\Gamma^+$, where
$\Gamma^+ \subset \Gamma$ is the maximal subgroup of $\Gamma$ consisting of
holomorphic automorphisms of $X$. If $\Gamma=\Gamma^+$ one obtains actual
$\Gamma$-equivariant $G$-Higgs bundles on $X$, which in turn correspond with
parabolic Higgs bundles on $Y=X/\Gamma$ (this generalizes work of Nasatyr \&
Steer for $G=SL(2,\mathbb{R})$ and Boden, Andersen & Grove and Furuta & Steer
for $G=SU(n)$). If on the other hand $\Gamma$ has antiholomorphic
automorphisms, the objects on $Y=X/\Gamma^+$ correspond with pseudoreal
parabolic Higgs bundles. This is a generalization in the parabolic setup of the
pseudoreal Higgs bundles studied by the first author in collaboration with
Biswas & Hurtubise.
","[{""version"":""v1"",""created"":""Thu, 8 Dec 2016 01:53:43 GMT""},{""version"":""v2"",""created"":""Fri, 16 Aug 2019 14:05:56 GMT""},{""version"":""v3"",""created"":""Mon, 11 May 2020 09:54:19 GMT""},{""version"":""v4"",""created"":""Tue, 30 Jun 2020 12:48:30 GMT""}]","2020-07-01"
"1612.02509","Ayushi Sinha","Ayushi Sinha, Michael Kazhdan","Geodesics using Waves: Computing Distances using Wave Propagation","10 pages, 14 figures",,,,"cs.CG cs.GR","http://arxiv.org/licenses/nonexclusive-distrib/1.0/","  In this paper, we present a new method for computing approximate geodesic
distances. We introduce the wave method for approximating geodesic distances
from a point on a manifold mesh. Our method involves the solution of two linear
systems of equations. One system of equations is solved repeatedly to propagate
the wave on the entire mesh, and one system is solved once after wave
propagation is complete in order to compute the approximate geodesic distances
up to an additive constant. However, these systems need to be pre-factored only
once, and can be solved efficiently at each iteration. All of our tests
required approximately between 300 and 400 iterations, which were completed in
a few seconds. Therefore, this method can approximate geodesic distances
quickly, and the approximation is highly accurate.
","[{""version"":""v1"",""created"":""Thu, 8 Dec 2016 01:57:47 GMT""}]","2016-12-09"
"1612.02510","Sofia  Wallstr\""om","Sofia Wallstrom, E. Lagadec, S. Muller, J. H. Black, N. L. J. Cox, R.
  Galvan-Madrid, K. Justtanont, S. Longmore, H. Olofsson, R. D. Oudmaijer, G.
  Quintana-Lacaci, R. Szczerba, W. Vlemmings, H. van Winckel, A. Zijlstra","ALMA Compact Array observations of the Fried Egg nebula: Evidence for
  large-scale asymmetric mass-loss from the yellow hypergiant IRAS 17163-3907","Accepted for publication in A&A. 8 pages, 7 figures, plus appendix",,"10.1051/0004-6361/201628416",,"astro-ph.SR astro-ph.GA","http://arxiv.org/licenses/nonexclusive-distrib/1.0/","  Yellow hypergiants are rare and represent a fast evolutionary stage of
massive evolved stars. That evolutionary phase is characterised by a very
intense mass loss, the understanding of which is still very limited. Here we
report ALMA Compact Array observations of a 50$""$-mosaic toward the Fried Egg
nebula, around one of the few Galactic yellow hypergiants IRAS 17163-3907. The
emission from the $^{12}$CO J=2-1 line, H30$\alpha$ recombination line, and
continuum is imaged at a resolution of $\sim$8$""$, revealing the morphology of
the molecular environment around the star. The continuum emission is unresolved
and peaks at the position of the star. The radio recombination line H30$\alpha$
shows unresolved emission at the star, with an approximately gaussian spectrum
centered on a velocity of 21$\pm$3~km/s with a width of 57$\pm$6~km/s. In
contrast, the CO 2-1 emission is complex and decomposes into several components
beyond the contamination from interstellar gas in the line of sight. The CO
spectrum toward the star is a broad plateau, centered at the systemic velocity
of +18 km/s and with an expansion velocity of 100$\pm$10 km/s. Assuming
isotropic and constant mass-loss, we estimate a mass-loss rate of 8$\pm$1.5
$\times10^{-5}$~M$_\odot$ yr$^{-1}$. At a radius of 25$""$ from the star, we
detect CO emission associated with the dust ring previously imaged by {\it
Herschel}. The kinematics of this ring, however, is not consistent with an
expanding shell, but show a velocity gradient of $v_{sys} \pm$20 km/s. In
addition, we find a puzzling bright feature radially connecting the star to the
CO ring, at a velocity of +40 km/s relative to the star. This spur feature may
trace a unidirectional ejection event from the star. Our ACA observations
reveal the complex morphology around IRAS 17163 and illustrate the
breakthroughs that ALMA will bring to the field of massive stellar evolution.
","[{""version"":""v1"",""created"":""Thu, 8 Dec 2016 02:12:52 GMT""}]","2017-01-18"
"1612.02511","Kyu Jung Bae","Kyu Jung Bae, Howard Baer, Koichi Hamaguchi, and Kazunori Nakayama","Affleck-Dine Leptogenesis with Varying Peccei-Quinn Scale","1+21 pages, 1 figure",,"10.1007/JHEP02(2017)017","CTPU-16-44, UT-16-37, IPMU-16-0190","hep-ph","http://arxiv.org/licenses/nonexclusive-distrib/1.0/","  The Affleck-Dine leptogenesis scenario along the LHu flat direction is
reconsidered. It is known that successful Affleck-Dine leptogenesis requires
that the lightest neutrino mass is extremely small. This situation can be
significantly relaxed if the neutrino mass in the early universe is different
from the present one. We consider a supersymmetric
Dine-Fischler-Srednicki-Zhitnitsky (DFSZ) type model, which provides a solution
to the strong CP problem and generates a SUSY mu-term and right-handed neutrino
masses. If the PQ scale during lepton number generation is much larger than the
present value, leptogenesis is very efficient so that enough baryon number can
be generated without introducing a hierarchically small neutrino mass. The
final baryon asymmetry is related to the mu-term, and hence linked to the level
of electroweak fine-tuning. We also show the PQ breaking scalar dynamics that
keeps a large PQ breaking scale during inflation and lepton number generation.
The mu-term generating superpotential plays an important role for preserving
the lepton asymmetry during saxion oscillation. In this scenario, the axion
isocurvature perturbation is naturally suppressed.
","[{""version"":""v1"",""created"":""Thu, 8 Dec 2016 02:18:47 GMT""}]","2017-03-08"
"1612.02512","Haiqing Xu","Zhongjian Lin and Haiqing Xu","Estimation of social-influence-dependent peer pressures in a large
  network game","Econometric Society Summer Meeting 2014, Texas Econometrics Camp 2014",,"10.1111/ectj.12102",,"stat.ME","http://arxiv.org/licenses/nonexclusive-distrib/1.0/","  Research on peer effects in sociology has been focused for long on social
influence power to investigate the social foundations for social interactions.
This paper extends Xu(2011)'s large--network--based game model by allowing for
social-influence-dependent peer effects. In a large network, we use the
Katz--Bonacich centrality to measure individuals' social influences. To solve
the computational burden when the data come from the equilibrium of a large
network, we extend Aguirregabiria and Mira (2007)'s nested pseudo likelihood
estimation (NPLE) approach to our large network game model. Using the Add
Health dataset, we investigate peer effects on conducting dangerous behaviors
of high school students. Our results show that peer effects are statistically
significant and positive. Moreover, a student benefits more (statistically
significant at the 5% level) from her conformity, or equivalently, pays more
for her disobedience, in terms of peer pressures, if friends have higher
social-influence status.
","[{""version"":""v1"",""created"":""Thu, 8 Dec 2016 02:21:09 GMT""}]","2018-03-20"
"1612.02513","Hang Duong Viet","Viet-Hang Duong, Yuan-Shan Lee, Bach-Tung Pham, Seksan
  Mathulaprangsan, Pham The Bao, and Jia-Ching Wang","Complex Matrix Factorization for Face Recognition","4 pages,3 figures,4 tables",,,,"cs.CV","http://arxiv.org/licenses/nonexclusive-distrib/1.0/","  This work developed novel complex matrix factorization methods for face
recognition; the methods were complex matrix factorization (CMF), sparse
complex matrix factorization (SpaCMF), and graph complex matrix factorization
(GraCMF). After real-valued data are transformed into a complex field, the
complex-valued matrix will be decomposed into two matrices of bases and
coefficients, which are derived from solutions to an optimization problem in a
complex domain. The generated objective function is the real-valued function of
the reconstruction error, which produces a parametric description. Factorizing
the matrix of complex entries directly transformed the constrained optimization
problem into an unconstrained optimization problem. Additionally, a complex
vector space with N dimensions can be regarded as a 2N-dimensional real vector
space. Accordingly, all real analytic properties can be exploited in the
complex field. The ability to exploit these important characteristics motivated
the development herein of a simpler framework that can provide better
recognition results. The effectiveness of this framework will be clearly
elucidated in later sections in this paper.
","[{""version"":""v1"",""created"":""Thu, 8 Dec 2016 02:42:20 GMT""}]","2016-12-09"
