"1612.07553","Robert Schaback","Licia Lenarduzzi and Robert Schaback","Adaptive Approximation of Functions with Discontinuities",,,,,"math.NA","http://arxiv.org/licenses/nonexclusive-distrib/1.0/","  One of the basic principles of Approximation Theory is that the quality of
approximations increase with the smoothness of the function to be approximated.
Functions that are smooth in certain subdomains will have good approximations
in those subdomains, and these {\em sub-approximations} can possibly be
calculated efficiently in parallel, as long as the subdomains do not overlap.
This paper proposes a class of algorithms that first calculate
sub-approximations on non-overlapping subdomains, then extend the subdomains as
much as possible and finally produce a global solution on the given domain by
letting the subdomains fill the whole domain. Consequently, there will be no
Gibbs phenomenon along the boundaries of the subdomains. Throughout, the
algorithm works for fixed scattered input data of the function itself, not on
spectral data, and it does not resample.
","[{""version"":""v1"",""created"":""Thu, 22 Dec 2016 11:48:33 GMT""}]","2016-12-23"
"1612.07554","Charles Batty","Charles J.K. Batty and Felix Geyer","Lower bounds for unbounded operators and semigroups","This is the authors' accepted version of the paper. It will be
  published in due course in the Journal of Operator Theory",,,,"math.FA math.DS","http://arxiv.org/licenses/nonexclusive-distrib/1.0/","  Let $A$ be an unbounded operator on a Banach space $X$. It is sometimes
useful to improve the operator $A$ by extending it to an operator $B$ on a
larger Banach space $Y$ with smaller spectrum. It would be preferable to do
this with some estimates for the resolvent of $B$, and also to extend bounded
operators related to $A$, for example a semigroup generated by $A$. When $X$ is
a Hilbert space, one may also want $Y$ to be Hilbert space. Results of this
type for bounded operators have been given by Arens, Read, M\""uller and Badea,
and we give some extensions of their results to unbounded operators and we
raise some open questions. A related problem is to improve properties of a
$C_0$-semigroup satisfying lower bounds by extending it to a $C_0$-group on a
larger space or by finding left-inverses. Results of this type for Hilbert
spaces have been obtained by Louis and Wexler, and by Zwart, and we give some
additional results.
","[{""version"":""v1"",""created"":""Thu, 22 Dec 2016 11:50:29 GMT""},{""version"":""v2"",""created"":""Wed, 12 Apr 2017 10:12:06 GMT""}]","2017-04-13"
"1612.07555","J. G. Wolff","J Gerard Wolff","The SP Theory of Intelligence as a Foundation for the Development of a
  General, Human-Level Thinking Machine",,,,,"cs.AI","http://arxiv.org/licenses/nonexclusive-distrib/1.0/","  This paper summarises how the ""SP theory of intelligence"" and its realisation
in the ""SP computer model"" simplifies and integrates concepts across artificial
intelligence and related areas, and thus provides a promising foundation for
the development of a general, human-level thinking machine, in accordance with
the main goal of research in artificial general intelligence.
  The key to this simplification and integration is the powerful concept of
""multiple alignment"", borrowed and adapted from bioinformatics. This concept
has the potential to be the ""double helix"" of intelligence, with as much
significance for human-level intelligence as has DNA for biological sciences.
  Strengths of the SP system include: versatility in the representation of
diverse kinds of knowledge; versatility in aspects of intelligence (including:
strengths in unsupervised learning; the processing of natural language; pattern
recognition at multiple levels of abstraction that is robust in the face of
errors in data; several kinds of reasoning (including: one-step `deductive'
reasoning; chains of reasoning; abductive reasoning; reasoning with
probabilistic networks and trees; reasoning with 'rules'; nonmonotonic
reasoning and reasoning with default values; Bayesian reasoning with
'explaining away'; and more); planning; problem solving; and more); seamless
integration of diverse kinds of knowledge and diverse aspects of intelligence
in any combination; and potential for application in several areas (including:
helping to solve nine problems with big data; helping to develop human-level
intelligence in autonomous robots; serving as a database with intelligence and
with versatility in the representation and integration of several forms of
knowledge; serving as a vehicle for medical knowledge and as an aid to medical
diagnosis; and several more).
","[{""version"":""v1"",""created"":""Thu, 22 Dec 2016 11:50:47 GMT""}]","2016-12-23"
"1612.07556","Kosuke Nagashio","Nan Fang, Kosuke Nagashio and Akira Toriumi","Experimental detection of active defects in few layers MoS2 through
  random telegraphic signals analysis observed in its FET characteristics",,"2D mater. 2017, 4, 015035","10.1088/2053-1583/aa50c4",,"cond-mat.mtrl-sci","http://arxiv.org/licenses/nonexclusive-distrib/1.0/","  Transition-metal dichalcogenides (TMDs), such as molybdenum disulfide (MoS2),
are expected to be promising for next generation device applications. The
existence of sulfur vacancies formed in MoS2, however, will potentially make
devices unstable and problematic. Random telegraphic signals (RTSs) have often
been studied in small area Si metal-oxide-semiconductor field-effect
transistors (MOSFETs) to identify the carrier capture and emission processes at
defects. In this paper, we have systemically analyzed RTSs observed in
atomically thin layer MoS2 FETs. Several types of RTSs have been analyzed. One
is the simple on/off type of telegraphic signals, the second is multilevel
telegraphic signals with a superposition of the simple signals, and the third
is multilevel telegraphic signals that are correlated with each other. The last
one is discussed from the viewpoint of the defect-defect interaction in MoS2
FETs with a weak screening in atomically confined two-dimensional electron-gas
systems. Furthermore, the position of defects causing RTSs has also been
investigated by preparing MoS2 FETs with multi-probes. The electron beam was
locally irradiated to intentionally generate defects in the MoS2 channel. It is
clearly demonstrated that the MoS2 channel is one of the RTS origins. RTS
analysis enables us to analyze the defect dynamics of TMD devices.
","[{""version"":""v1"",""created"":""Thu, 22 Dec 2016 11:52:31 GMT""}]","2016-12-23"
"1612.07557","Kosuke Nagashio","Yoshiaki Hattori, Takashi Taniguchi, Kenji Watanabe, and Kosuke
  Nagashio","Comparison of device structures for the dielectric breakdown measurement
  of hexagonal boron nitride",,"APL, 2016, 109, 253111","10.1063/1.4972555",,"cond-mat.mtrl-sci","http://arxiv.org/licenses/nonexclusive-distrib/1.0/","  Improving the film quality in the synthesis of large-area hexagonal boron
nitride films (h-BN) for two-dimensional material devices remains a great
challenge. The measurement of electrical breakdown dielectric strength (EBD) is
one of the most important methods to elucidate the insulating quality of h-BN.
In this work, the EBD of high quality exfoliated single-crystal h-BN was
investigated using three different electrode structures under different
environmental conditions to determine the ideal electrode structure and
environment for EBD measurement. A systematic investigation revealed that EBD
is not sensitive to contact force or electrode area but strongly depends on the
relative humidity during measurement. Once the measurement environment is
properly managed, it was found that the EBD values are consistent within
experimental error regardless of the electrode structure, which enables the
evaluation of the crystallinity of synthesized h-BN at the microscopic and
macroscopic level by utilizing the three different electrode structures
properly for different purposes.
","[{""version"":""v1"",""created"":""Thu, 22 Dec 2016 11:55:50 GMT""}]","2017-01-04"
"1612.07558","Wout Van Alphen","Giovanni Lombardi and Wout Van Alphen and Sergei N. Klimin and Jacques
  Tempere","Snake instability of dark solitons across the BEC-BCS crossover: an
  effective field theory perspective",,,"10.1103/PhysRevA.96.033609",,"cond-mat.quant-gas","http://arxiv.org/licenses/nonexclusive-distrib/1.0/","  In the present article the snake instability mechanism for dark solitons in
superfluid Fermi gases is studied in the context of a recently developed
effective field theory [Eur. Phys. J. B 88, 122 (2015)]. This theoretical
treatment has proven to be suitable to study stable dark solitons in quasi-1D
setups across the BEC-BCS crossover. In this manuscript the nodal plane of the
stable soliton solution is perturbed by adding a transverse modulation. The
numerical solution of the system of coupled nonlinear differential equations
describing the amplitude of the perturbation leads to the instability spectra
which are calculated for a wide range of interaction regimes and compared to
other theoretical predictions. The maximum transverse size that the atomic
cloud can have in order to preserve the stability is estimated, and the effects
of spin-imbalance on this critical length are examined, revealing a
stabilization of the soliton with increasing imbalance.
","[{""version"":""v1"",""created"":""Thu, 22 Dec 2016 11:57:47 GMT""}]","2017-10-11"
"1612.07559","A. Yu. Ignatiev","A. Yu. Ignatiev","Approach for modelling quantum-mechanical collapse","28 pages, 5 figures, much expanded companion paper to arXiv:1204.3373
  [quant-ph]",,,,"quant-ph gr-qc hep-th nlin.CD","http://arxiv.org/licenses/nonexclusive-distrib/1.0/","  A long-standing quantum-mechanical puzzle is whether the collapse of the wave
function is a real physical process or simply an epiphenomenon. This puzzle
lies at the heart of the measurement problem. One way to choose between the
alternatives is to assume that one or the other is correct and attempt to draw
physical, observable consequences which then could be empirically verified or
ruled out. As a working hypothesis, we propose simple models of collapse as a
real physical process for direct binary symmetric measurements made on one
particle. This allows one to construct irreversible unstable Schr\""odinger
equations capable of describing continuously the process of collapse induced by
the interaction of the quantum system with the measuring device. Due to unknown
initial conditions the collapse outcome remains unpredictable so no
contradictions with quantum mechanics arise. Our theoretical framework predicts
a finite time-scale of the collapse and links with experiment. Sensitive probes
of the collapse dynamics could be done using Bose-Einstein condensates,
ultracold neutrons or ultrafast optics. If confirmed, the formulation could be
relevant to the transition from quantum fluctuations to classical
inhomogeneities in early cosmology and to establishing the ultimate limits on
the speed of quantum computation and information processing.
","[{""version"":""v1"",""created"":""Thu, 22 Dec 2016 11:58:41 GMT""}]","2016-12-23"
"1612.07560","Krzysztof Krupinski","Krzysztof Krupinski and Anand Pillay","Amenability, definable groups, and automorphism groups",,,,,"math.LO math.DS math.GN","http://arxiv.org/licenses/nonexclusive-distrib/1.0/","  We prove several theorems relating amenability of groups in various
categories (discrete, definable, topological, automorphism group) to
model-theoretic invariants (quotients by connected components, Lascar Galois
group, G-compactness, ...). For example, if $M$ is a countable,
$\omega$-categorical structure and $Aut(M)$ is amenable, as a topological
group, then the Lascar Galois group $Gal_{L}(T)$ of the theory $T$ of $M$ is
compact, Hausdorff (also over any finite set of parameters), that is $T$ is
G-compact. An essentially special case is that if $Aut(M)$ is extremely
amenable, then $Gal_{L}(T)$ is trivial, so, by a theorem of Lascar, the theory
$T$ can be recovered from its category $Mod(T)$ of models. On the side of
definable groups, we prove for example that if $G$ is definable in a model $M$,
and $G$ is definably amenable, then the connected components ${G^{*}}^{00}_{M}$
and ${G^{*}}^{000}_{M}$ coincide, answering positively a question from an
earlier paper of the authors.
  We also take the opportunity to further develop the model-theoretic approach
to topological dynamics, obtaining for example some new invariants for
topological groups, as well as allowing a uniform approach to the theorems
above and the various categories.
","[{""version"":""v1"",""created"":""Thu, 22 Dec 2016 12:03:48 GMT""},{""version"":""v2"",""created"":""Wed, 9 Jan 2019 20:37:41 GMT""}]","2019-01-11"
"1612.07561","Robin Ristl","Robin Ristl, Dong Xi, Ekkehard Glimm, Martin Posch","Optimal exact tests for multiple binary endpoints",,"Computational Statistics and Data Analysis 122 (2018) 1-17","10.1016/j.csda.2018.01.001",,"stat.ME","http://arxiv.org/licenses/nonexclusive-distrib/1.0/","  In confirmatory clinical trials with small sample sizes, hypothesis tests
based on asymptotic distributions are often not valid and exact non-parametric
procedures are applied instead. However, the latter are based on discrete test
statistics and can become very conservative, even more so, if adjustments for
multiple testing as the Bonferroni correction are applied. We propose improved
exact multiple testing procedures for the setting where two parallel groups are
compared in multiple binary endpoints. Based on the joint conditional
distribution of test statistics of Fisher's exact tests, optimal rejection
regions for intersection hypotheses tests are constructed. To efficiently
search the large space of possible rejection regions, we propose an
optimization algorithm based on constrained optimization and integer linear
programming. Depending on the optimization objective, the optimal test yields
maximal power under a specific alternative, maximal exhaustion of the nominal
type I error rate, or the largest possible rejection region controlling the
type I error rate. Applying the closed testing principle, we construct
optimized multiple testing procedures with strong familywise error rate
control. Furthermore, we propose a greedy algorithm for nearly optimal tests,
which is computationally more efficient. We numerically compare the
unconditional power of the optimized procedure with alternative approaches and
illustrate the optimal tests with a clinical trial example in a rare disease.
","[{""version"":""v1"",""created"":""Thu, 22 Dec 2016 12:05:09 GMT""}]","2018-02-22"
"1612.07562","Prasenjit Karmakar","Prasenjit Karmakar, Shalabh Bhatnagar","On the function approximation error for risk-sensitive reinforcement
  learning","Improved the bound in Theorem V.4",,,,"cs.LG","http://arxiv.org/licenses/nonexclusive-distrib/1.0/","  In this paper we obtain several informative error bounds on function
approximation for the policy evaluation algorithm proposed by Basu et al. when
the aim is to find the risk-sensitive cost represented using exponential
utility. The main idea is to use classical Bapat's inequality and to use
Perron-Frobenius eigenvectors (exists if we assume irreducible Markov chain) to
get the new bounds. The novelty of our approach is that we use the
irreduciblity of Markov chain to get the new bounds whereas the earlier work by
Basu et al. used spectral variation bound which is true for any matrix. We also
give examples where all our bounds achieve the ""actual error"" whereas the
earlier bound given by Basu et al. is much weaker in comparison. We show that
this happens due to the absence of difference term in the earlier bound which
is always present in all our bounds when the state space is large.
Additionally, we discuss how all our bounds compare with each other. As a
corollary of our main result we provide a bound between largest eigenvalues of
two irreducibile matrices in terms of the matrix entries.
","[{""version"":""v1"",""created"":""Thu, 22 Dec 2016 12:05:29 GMT""},{""version"":""v10"",""created"":""Sun, 14 Oct 2018 06:01:20 GMT""},{""version"":""v11"",""created"":""Tue, 16 Oct 2018 16:48:38 GMT""},{""version"":""v12"",""created"":""Tue, 15 Jan 2019 19:43:06 GMT""},{""version"":""v13"",""created"":""Fri, 15 Feb 2019 12:59:43 GMT""},{""version"":""v14"",""created"":""Thu, 28 Mar 2019 15:10:52 GMT""},{""version"":""v15"",""created"":""Tue, 22 Oct 2019 14:48:35 GMT""},{""version"":""v2"",""created"":""Tue, 27 Dec 2016 03:22:28 GMT""},{""version"":""v3"",""created"":""Fri, 24 Feb 2017 15:35:03 GMT""},{""version"":""v4"",""created"":""Thu, 2 Mar 2017 11:44:54 GMT""},{""version"":""v5"",""created"":""Thu, 29 Jun 2017 11:19:13 GMT""},{""version"":""v6"",""created"":""Sun, 2 Jul 2017 15:47:10 GMT""},{""version"":""v7"",""created"":""Wed, 5 Jul 2017 14:01:42 GMT""},{""version"":""v8"",""created"":""Tue, 11 Jul 2017 12:14:48 GMT""},{""version"":""v9"",""created"":""Sun, 7 Oct 2018 10:13:02 GMT""}]","2019-10-23"
"1612.07563","Robert Schaback","Maryam Mohammadi and Robert Schaback","On the Fractional Derivatives of Radial Basis Functions",,,,,"math.NA","http://arxiv.org/licenses/nonexclusive-distrib/1.0/","  The paper provides the fractional integrals and derivatives of the
Rie\-mann-Liouville and Caputo type for the five kinds of radial basis
functions (RBFs), including the powers, Gaussian, multiquadric, Matern and
thin-plate splines, in one dimension. It allows to use high order numerical
methods for solving fractional differential equations. The results are tested
by solving two fractional differential equations. The first one is a fractional
ODE which is solved by the RBF collocation method and the second one is a
fractional PDE which is solved by the method of lines based on the spatial
trial spaces spanned by the Lagrange basis associated to the RBFs.
","[{""version"":""v1"",""created"":""Thu, 22 Dec 2016 12:09:47 GMT""}]","2016-12-23"
"1612.07564","Alexandre Correia","Alexandre C. M. Correia","Stellar and planetary Cassini states","8 pages, 6 figures","Astronomy & Astrophysics, 582, A69 (2015)","10.1051/0004-6361/201525939",,"astro-ph.EP astro-ph.SR math.DS","http://arxiv.org/licenses/nonexclusive-distrib/1.0/","  Cassini states correspond to equilibria of the spin axis of a body when its
orbit is perturbed. They were initially described for satellites, but the spin
axis of stars and planets undergoing strong dissipation can also evolve into
some equilibria. For small satellites, the rotational angular momentum is
usually much smaller than the total angular momentum, so classical methods for
finding Cassini states rely on this approximation. Here we present a more
general approach, which is valid for the secular quadrupolar non-restricted
problem with spin. Our method is still valid when the precession rate and the
mutual inclination of the orbits are not constant. Therefore, it can be used to
study stars with close-in companions, or planets with heavy satellites, like
the Earth-Moon system.
","[{""version"":""v1"",""created"":""Thu, 22 Dec 2016 12:10:58 GMT""}]","2016-12-23"
"1612.07565","Tadashi Okazaki","Tadashi Okazaki, Douglas J. Smith","Mock Modular Index of M2-M5 Brane System","47 pages, 8 figures; v2: references added","Phys. Rev. D 96, 026017 (2017)","10.1103/PhysRevD.96.026017","DCPT-16/63; NCTS-TH/1611","hep-th math.AG math.NT math.RT","http://arxiv.org/licenses/nonexclusive-distrib/1.0/","  We present BPS indices of the supergroup WZW models that live on intersecting
M2-M5 brane systems. They can encode data of the stretched M2-branes between
M5-branes and count the BPS states. They are generally expressed in terms of
mock theta functions via the Kac-Wakimoto character formula of the affine Lie
superalgebra. We give an explicit expression of the index for the
$PSL(2|2)_{k=1}$ WZW model in terms of the second order multi-variable
Appell-Lerch sum. It indicates that wall-crossing occurs in the BPS state
counting due to the $C$-field on the M5-branes.
","[{""version"":""v1"",""created"":""Thu, 22 Dec 2016 12:11:57 GMT""},{""version"":""v2"",""created"":""Tue, 17 Jan 2017 01:01:51 GMT""}]","2017-07-25"
"1612.07566","Doroteya Vasileva Lyubenova","Diana Kjurkchieva, Doroteya Vasileva, Dinko Dimitrov","Light curve solutions of 12 eccentric Kepler binaries and analysis of
  their out-of-eclipse variability","Accepted for publication in Astronomical Journal",,"10.3847/0004-6256/152/6/189",,"astro-ph.SR","http://arxiv.org/licenses/nonexclusive-distrib/1.0/","  The eccentricity, periastron angle, orbital inclination, mass ratio, stellar
temperatures and relative stellar radii of 12 eclipsing eccentric binaries were
determined on the basis of Kepler data. The analysis of their out-of-eclipse
variability led to the following results: (i) KIC 10490980 exhibits rotational
(spot-type) variability; (ii) Four new heartbeat stars were found: KIC 9344623
and KIC 10296163, which have wide tidally induced light humps and KIC 9119405
and KIC 9673173, which have narrow ""W-shape"" features; (iii) KIC 4932691 shows
oscillations with approximately the 18th harmonic of the orbital period. We
established that the eccentric Kepler binaries fall below the envelope
P(1-e^2)^{3/2} = 5 days on the period-eccentricity diagram and that there is a
surprising lack of eccentric binaries with periods of 25-35 days.
","[{""version"":""v1"",""created"":""Thu, 22 Dec 2016 12:14:07 GMT""}]","2016-12-28"
"1612.07567","Juan Carlos Degollado","Claudia Moreno, Juan Carlos Degollado and Dario Nunez","Gravitational and electromagnetic signatures of accretion into a charged
  black hole","17 pages, 9 figures",,"10.1007/s10714-017-2244-5",,"gr-qc","http://arxiv.org/licenses/nonexclusive-distrib/1.0/","  We present the derivation and the solutions to the coupled electromagnetic
and gravitational perturbations with sources in a charged black hole
background. We work in the so called ghost gauge and consider as source of the
perturbations the infall of radial currents. In this way, we study a system in
which it is provoked a response involving both, gravitational and
electromagnetic waves, which allows us to analyze the dependence between them.
We solve numerically the wave equations that describe both signals,
characterize the waveforms and study the relation between the input parameters
of the infalling matter with those of the gravitational and electromagnetic
responses.
","[{""version"":""v1"",""created"":""Thu, 22 Dec 2016 12:20:05 GMT""}]","2017-06-21"
"1612.07568","Mingming Liu","Yingqi Gu, Mingming Liu, Joe Naoum-Sawaya, Emanuele Crisostomi,
  Giovanni Russo, Robert Shorten","Pedestrian-Aware Engine Management Strategies for Plug-in Hybrid
  Electric Vehicles",,,,,"cs.SY","http://creativecommons.org/licenses/by-nc-sa/4.0/","  Electric Vehicles (EVs) and Plug-in Hybrid Electric Vehicles (PHEVs) are
increasingly being seen as a means of mitigating the pressing concerns of
traffic-related pollution. While hybrid vehicles are usually designed with the
objective of minimising fuel consumption, in this paper we propose engine
management strategies that also take into account environmental effects of the
vehicles to pedestrians outside of the vehicles. Specifically, we present
optimisation based engine energy management strategies for PHEVs, that attempt
to minimise the environmental impact of pedestrians along the route of the
vehicle, while taking account of route dependent uncertainties. We implement
the proposed approach in a real PHEV, and evaluate the performance in a
hardware-in-the-loop platform. A variety of simulation results are given to
illustrate the efficacy of our proposed approach.
","[{""version"":""v1"",""created"":""Thu, 22 Dec 2016 12:20:21 GMT""},{""version"":""v2"",""created"":""Thu, 6 Apr 2017 11:30:42 GMT""}]","2017-04-07"
"1612.07569","Yuya Matsumoto","Yuya Matsumoto","Degeneration of K3 surfaces with non-symplectic automorphisms","v2: 15 pages, a section on compactification of moduli spaces added,
  presentation improved / v3: 16 pages, minor changes / v4: 15 pages, accepted
  version",,,,"math.AG math.NT","http://arxiv.org/licenses/nonexclusive-distrib/1.0/","  We prove that a K3 surface with an automorphism acting on the global
$2$-forms by a primitive $m$-th root of unity, $m \neq 1,2,3,4,6$, does not
degenerate (assuming the existence of the so-called Kulikov models). A key
result used to prove this is the rationality of the actions of automorphisms on
the graded quotients of the weight filtration of the $l$-adic cohomology groups
of the surface.
","[{""version"":""v1"",""created"":""Thu, 22 Dec 2016 12:21:48 GMT""},{""version"":""v2"",""created"":""Sat, 20 Jan 2018 16:40:33 GMT""},{""version"":""v3"",""created"":""Tue, 19 Jan 2021 17:17:04 GMT""},{""version"":""v4"",""created"":""Sun, 20 Feb 2022 14:55:18 GMT""}]","2022-02-22"
