"1612.07319","Filiberto Ares","F. Ares, J. G. Esteve, F. Falceto, A. R. de Queiroz","Entanglement entropy and M\""obius transformations for critical fermionic
  chains","38 pages, 8 figures. Final version published in JSTAT. Typos
  corrected, references updated","J. Stat. Mech. (2017) 063104","10.1088/1742-5468/aa71dc",,"quant-ph cond-mat.stat-mech hep-th math-ph math.MP","http://arxiv.org/licenses/nonexclusive-distrib/1.0/","  Entanglement entropy may display a striking new symmetry under M\""obius
transformations. This symmetry was analysed in our previous work for the case
of a non-critical (gapped) free homogeneous fermionic chain invariant under
parity and charge conjugation. In the present work we extend and analyse this
new symmetry in several directions. First, we show that the above mentioned
symmetry also holds when parity and charge conjugation invariance are broken.
Second we extend this new symmetry to the case of critical (gapless) theories.
Our results are further supported by numerical analysis. For some particular
cases, analytical demonstrations show the validity of the extended symmetry. We
finally discuss the intriguing parallelism of this new symmetry and space-time
conformal transformations.
","[{""version"":""v1"",""created"":""Wed, 21 Dec 2016 19:16:23 GMT""},{""version"":""v2"",""created"":""Mon, 26 Jun 2017 18:25:50 GMT""}]","2018-10-03"
"1612.07320","Elodie Choquet","\'E. Choquet, J. Milli, Z. Wahhaj, R. Soummer, A. Roberge, J.-C.
  Augereau, M. Booth, O. Absil, A. Boccaletti, C. H. Chen, J. H. Debes, C. del
  Burgo, W. R. F. Dent, S. Ertel, J. H. Girard, E. Gofas-Salas, D. A.
  Golimowski, C. A. G\'omez Gonz\'alez, J. B. Hagan, P. Hibon, D. C. Hines, G.
  M. Kennedy, A.-M. Lagrange, L. Matr\`a, D. Mawet, D. Mouillet, M. N'Diaye, M.
  D. Perrin, C. Pinte, L. Pueyo, A. Rajan, G. Schneider, S. Wolff, M. Wyatt","First scattered-light images of the gas-rich debris disk around 49 Ceti","Accepted for publication in ApJL. 7 pages, 4 figures",,"10.3847/2041-8213/834/2/L12",,"astro-ph.EP","http://arxiv.org/licenses/nonexclusive-distrib/1.0/","  We present the first scattered-light images of the debris disk around 49
ceti, a ~40 Myr A1 main sequence star at 59 pc, famous for hosting two massive
dust belts as well as large quantities of atomic and molecular gas. The outer
disk is revealed in reprocessed archival Hubble Space Telescope NICMOS F110W
images, as well as new coronagraphic H band images from the Very Large
Telescope SPHERE instrument. The disk extends from 1.1"" (65 AU) to 4.6"" (250
AU), and is seen at an inclination of 73degr, which refines previous
measurements at lower angular resolution. We also report no companion detection
larger than 3 M_Jup at projected separations beyond 20 AU from the star
(0.34""). Comparison between the F110W and H-band images is consistent with a
grey color of 49 ceti's dust, indicating grains larger than >2microns. Our
photometric measurements indicate a scattering efficiency / infrared excess
ratio of 0.2-0.4, relatively low compared to other characterized debris disks.
We find that 49 ceti presents morphological and scattering properties very
similar to the gas-rich HD 131835 system. From our constraint on the disk
inclination we find that the atomic gas previously detected in absorption must
extend to the inner disk, and that the latter must be depleted of CO gas.
Building on previous studies, we propose a schematic view of the system
describing the dust and gas structure around 49 ceti and hypothetic scenarios
for the gas nature and origin.
","[{""version"":""v1"",""created"":""Wed, 21 Dec 2016 21:00:01 GMT""}]","2017-01-18"
"1612.07321","Yuqian Liu","Yu-Qian Liu, Maryam Modjaz, Federica B. Bianco","Analyzing the Largest Spectroscopic Dataset of Hydrogen-Poor
  Super-Luminous Supernovae","Released all code and data products on our github pages
  (https://github.com/nyusngroup/SESNspectraLib and
  https://github.com/nyusngroup/SESNtemple). Accepted by ApJ. 15 pages, 7
  figures, 3 tables. No major changes, but more references & discussion",,"10.3847/1538-4357/aa7f74",,"astro-ph.HE astro-ph.SR","http://arxiv.org/licenses/nonexclusive-distrib/1.0/","  Super-luminous supernovae (SLSNe) are tremendously luminous explosions whose
power sources and progenitors are highly debated. Broad-lined SNe Ic (SNe
Ic-bl) are the only type of SNe that are connected with long-duration gamma ray
bursts (GRBs). Studying the spectral similarity and difference between the
populations of hydrogen-poor SLSNe (SLSNe Ic) and of hydrogen-poor
stripped-envelope core-collapse SNe, in particular SNe Ic and SNe Ic-bl, can
provide crucial observations to test predictions of theories based on various
power source models and progenitor models. In this paper, we collected all of
the published optical spectra of 32 SLSNe Ic, 21 SNe Ic-bl, as well as 17 SNe
Ic, quantified their spectral features, constructed average spectra, and
compared them in a systematic way using new tools we have developed. We find
that SLSNe Ic and SNe Ic-bl, including those connected with GRBs, have
comparable widths for their spectral features and average absorption velocities
at all phases. Thus, our findings strengthen the connection between SLSNe Ic
and GRBs. In particular, SLSNe Ic have average \FeII absorption velocities of
$-15,000 +/- 2,600$ \kms~at 10 days after peak, which are higher than those of
SNe Ic by $\sim7,000$ \kms~on average. SLSNe Ic also have significantly broader
\FeII lines than SNe Ic. Moreover, we find that such high absorption and width
velocities of SLSNe Ic may be hard to explain by the interaction model, and
none of 13 SLSNe Ic with measured absorption velocities spanning over 10 days
has a convincing flat velocity-evolution, which is inconsistent with the
magnetar model in one dimension. Lastly, we compare SN 2011kl, the first SN
connected with an ultra-long GRB, with the mean spectrum of SLSNe Ic and of SNe
Ic-bl.
","[{""version"":""v1"",""created"":""Wed, 21 Dec 2016 21:00:01 GMT""},{""version"":""v2"",""created"":""Fri, 30 Jun 2017 20:04:30 GMT""}]","2017-08-23"
"1612.07322","Meiert W. Grootes","M.W. Grootes, R.J. Tuffs, C.C. Popescu, P. Norberg, A.S.G. Robotham,
  J. Liske, E. Andrae, I.K. Baldry, M. Gunawardhana, L.S. Kelvin, B.F. Madore,
  M. Seibert, E.N. Taylor, M. Alpaslan, M.J.I. Brown, M.E. Cluver, S.P. Driver,
  J. Bland-Hawthorn, B.W. Holwerda, A.M. Hopkins, A.R. Lopez-Sanchez, J.
  Loveday, M. Rushton","Galaxy And Mass Assembly (GAMA): Gas Fuelling of Spiral Galaxies in the
  Local Universe I. - The Effect of the Group Environment on Star Formation in
  Spiral Galaxies","Accepted for publication in AJ; 40 pages, 27 figures (8 full page), 6
  tables, 5 appendices (10 pages), data in figures available in machine
  readable format from journal (or author on demand)",,"10.3847/1538-3881/153/3/111",,"astro-ph.GA astro-ph.CO","http://arxiv.org/licenses/nonexclusive-distrib/1.0/","  Abridged - We quantify the effect of the galaxy group environment (for 12.5 <
log(M_group/Msun) < 14.0) on the star formation rates of the
(morphologically-selected) population of disk-dominated local Universe spiral
galaxies (z < 0.13) with stellar masses log(M*/Msun) > 9.5. Within this
population, we find that, while a small minority of group satellites are
strongly quenched, the group centrals, and the large majority of satellites
exhibit levels of SFR indistinguishable from ungrouped ""field"" galaxies of the
same M*, albeit with a higher scatter, and for all M*. Modelling these results,
we deduce that disk-dominated satellites continue to be characterized by a
rapid cycling of gas into and out of their ISM at rates similar to those
operating prior to infall, with the on-going fuelling likely sourced from the
group intrahalo medium (IHM) on Mpc scales, rather than from the
circum-galactic medium on 100kpc scales. Consequently, the color-density
relation of the galaxy population as a whole would appear to be primarily due
to a change in the mix of disk- and spheroid-dominated morphologies in the
denser group environment compared to the field, rather than to a reduced
propensity of the IHM in higher mass structures to cool and accrete onto
galaxies. We also suggest that the inferred substantial accretion of IHM gas by
satellite disk-dominated galaxies will lead to a progressive reduction in their
specific angular momentum, thereby representing an efficient secular mechanism
to transform morphology from star-forming disk-dominated types to more passive
spheroid-dominated types.
","[{""version"":""v1"",""created"":""Wed, 21 Dec 2016 21:00:02 GMT""}]","2017-02-22"
"1612.07323","Matthew Lippert","Niko Jokela, Matti Jarvinen, Matthew Lippert","Holographic sliding stripes","37 pages, 8 figures; v2: minor clarifications, published version","Phys. Rev. D 95, 086006 (2017)","10.1103/PhysRevD.95.086006","HIP-2016-40/TH","hep-th cond-mat.str-el","http://arxiv.org/licenses/nonexclusive-distrib/1.0/","  Holographic models provide unique laboratories to investigate non-linear
physics of transport in inhomogeneous systems. We provide a detailed account of
both DC and AC conductivities in a defect CFT with spontaneous stripe order.
The spatial symmetry is broken at large chemical potential and the resulting
ground state is a combination of a spin and charge density wave. An
infinitesimal applied electric field across the stripes will cause the stripes
to slide over the underlying density of smeared impurities, a phenomenon which
can be associated with the Goldstone mode for the spontaneously broken
translation symmetry. We show that the presence of a spatially modulated
background magnetization current thwarts the expression of some DC
conductivities in terms of horizon data.
","[{""version"":""v1"",""created"":""Wed, 21 Dec 2016 21:00:02 GMT""},{""version"":""v2"",""created"":""Fri, 24 Mar 2017 02:01:35 GMT""}]","2017-04-19"
"1612.07324","Subir Sachdev","Sean A. Hartnoll, Andrew Lucas, and Subir Sachdev","Holographic quantum matter","178 pages, 43 figures; Draft of a review article for hep-th and
  cond-mat readers, comments welcome; (v2) added clarifications and references;
  expanded version, with exercises, published as a book by MIT Press:
  https://mitpress.mit.edu/books/holographic-quantum-matter",,,,"hep-th cond-mat.str-el","http://arxiv.org/licenses/nonexclusive-distrib/1.0/","  We present a review of theories of states of quantum matter without
quasiparticle excitations. Solvable examples of such states are provided
through a holographic duality with gravitational theories in an emergent
spatial dimension. We review the duality between gravitational backgrounds and
the various states of quantum matter which live on the boundary. We then
describe quantum matter at a fixed commensurate density (often described by
conformal field theories), and also compressible quantum matter with variable
density, providing an extensive discussion of transport in both cases. We
present a unified discussion of the holographic theory of transport with memory
matrix and hydrodynamic methods, allowing a direct connection to experimentally
realized quantum matter. We also explore other important challenges in
non-quasiparticle physics, including symmetry broken phases such as
superconductors and non-equilibrium dynamics.
","[{""version"":""v1"",""created"":""Wed, 21 Dec 2016 21:00:03 GMT""},{""version"":""v2"",""created"":""Mon, 6 Mar 2017 00:52:08 GMT""},{""version"":""v3"",""created"":""Tue, 20 Mar 2018 16:40:17 GMT""}]","2018-03-21"
"1612.07325","Andrew Lipnicky","Andrew Lipnicky and Sukanya Chakrabarti","Is the vast polar structure of dwarf galaxies a serious problem for
  lambda cold dark matter?","14 pages, 6 figures, accepted for publication in Monthly Notices of
  the Royal Astronomical Society. Replacement: expanded discussion, grammar
  corrected, accepted version of text",,"10.1093/mnras/stx286",,"astro-ph.GA","http://arxiv.org/licenses/nonexclusive-distrib/1.0/","  The dwarf galaxies around the Milky Way are distributed in a so-called vast
polar structure (VPOS) that may be in conflict with Lambda CDM simulations.
Here, we seek to determine if the VPOS poses a serious challenge to the Lambda
cold dark matter paradigm on galactic scales. Specifically, we investigate if
the VPOS remains coherent as a function of time. Using the measured Hubble
Space Telescope (HST) proper motions and associated uncertainties, we integrate
the orbits of the classical Milky Way satellites backwards in time and find
that the structure disperses well before a dynamical time. We also examine in
particular Leo I and Leo II using their most recent proper motion data, both of
which have extreme kinematic properties, but these satellites do not appear to
drive the polar fit that is seen at the present day. We have studied the effect
of the uncertainties on the HST proper motions on the coherence of the VPOS as
a function of time. We find that 8 of the 11 classical dwarfs have reliable
proper motions; for these 8, the VPOS also loses significance in less than a
dynamical time, indicating that the VPOS is not a dynamically stable structure.
Obtaining more accurate proper motion measurements of Ursa Minor, Sculptor, and
Carina would bolster these conclusions.
","[{""version"":""v1"",""created"":""Wed, 21 Dec 2016 21:00:03 GMT""},{""version"":""v2"",""created"":""Mon, 13 Mar 2017 16:57:10 GMT""}]","2017-03-14"
"1612.07326","Toshiki Saito","Toshiki Saito, Daisuke Iono, Cong K. Xu, Kazimierz Sliwa, Junko Ueda,
  Daniel Espada, Hiroyuki Kaneko, Sabine K\""onig, Kouichiro Nakanishi, Minju
  Lee, Min S. Yun, Susanne Aalto, John E. Hibbard, Takuji Yamashita, Kentaro
  Motohara, and Ryohei Kawabe","Spatially resolved CO SLED of the Luminous Merger Remnant NGC 1614 with
  ALMA","20 pages, 19 figures, 2 tables, accepted for publication in ApJ",,"10.3847/1538-4357/835/2/174",,"astro-ph.GA","http://arxiv.org/licenses/nonexclusive-distrib/1.0/","  We present high-resolution (1"".0) Atacama Large Millimeter/submillimeter
Array (ALMA) observations of CO (1-0) and CO (2- 1) rotational transitions
toward the nearby IR-luminous merger NGC 1614 supplemented with ALMA archival
data of CO (3-2), and CO (6-5) transitions. The CO (6-5) emission arises from
the starburst ring (central 590 pc in radius), while the lower-$J$ CO lines are
distributed over the outer disk ($\sim$ 3.3 kpc in radius). Radiative transfer
and photon dominated region (PDR) modeling reveal that the starburst ring has a
single warmer gas component with more intense far-ultraviolet radiation field
($n_{\rm{H_2}}$ $\sim$ 10$^{4.6}$ cm$^{-3}$, $T_{\rm{kin}}$ $\sim$ 42 K, and
$G_{\rm{0}}$ $\sim$ 10$^{2.7}$) relative to the outer disk ($n_{\rm{H_2}}$
$\sim$ 10$^{5.1}$ cm$^{-3}$, $T_{\rm{kin}}$ $\sim$ 22 K, and $G_{\rm{0}}$
$\sim$ 10$^{0.9}$). A two-phase molecular interstellar medium with a warm and
cold ($>$ 70 K and $\sim$ 19 K) component is also an applicable model for the
starburst ring. A possible source for heating the warm gas component is
mechanical heating due to stellar feedback rather than PDR. Furthermore, we
find evidence for non-circular motions along the north-south optical bar in the
lower-$J$ CO images, suggesting a cold gas inflow. We suggest that star
formation in the starburst ring is sustained by the bar-driven cold gas inflow,
and starburst activities radiatively and mechanically power the CO excitation.
The absence of a bright active galactic nucleus can be explained by a scenario
that cold gas accumulating on the starburst ring is exhausted as the fuel for
star formation, or is launched as an outflow before being able to feed to the
nucleus.
","[{""version"":""v1"",""created"":""Wed, 21 Dec 2016 21:00:03 GMT""}]","2017-02-08"
"1612.07327","Tianci Zhou","Tianci Zhou, David J. Luitz","Operator entanglement entropy of the time evolution operator in chaotic
  systems","18 pages, 14 figures. Revised version has added a refined argument
  and numerical evidence for the deficit value in the disordered Heisenberg
  model","Phys. Rev. B 95, 094206 (2017)","10.1103/PhysRevB.95.094206",,"cond-mat.stat-mech","http://arxiv.org/licenses/nonexclusive-distrib/1.0/","  We study the growth of the operator entanglement entropy (EE) of the time
evolution operator in chaotic, many-body localized and Floquet systems. In the
random field Heisenberg model we find a universal power law growth of the
operator EE at weak disorder, a logarithmic growth at strong disorder, and
extensive saturation values in both cases. In a Floquet spin model, the
saturation value after an initial linear growth is identical to the value of a
random unitary operator (the Page value). We understand these properties by
mapping the operator EE to a global quench problem evolved with a similar
parent-Hamiltonian in an enlarged Hilbert space with the same chaotic, MBL and
Floquet properties as the original Hamiltonian. The scaling and saturation
properties reflect the spreading of the state EE of the corresponding time
evolution. We conclude that the EE of the evolution operator should
characterize the propagation of information in these systems.
","[{""version"":""v1"",""created"":""Wed, 21 Dec 2016 21:00:04 GMT""},{""version"":""v2"",""created"":""Thu, 23 Mar 2017 20:03:17 GMT""}]","2017-03-27"
"1612.07328","Luis Anchordoqui","Luis A. Anchordoqui, Haim Goldberg, and Thomas J. Weiler","Strange fireball as an explanation of the muon excess in Auger data","To be published in PRD","Phys. Rev. D 95, 063005 (2017)","10.1103/PhysRevD.95.063005",,"hep-ph astro-ph.HE","http://arxiv.org/licenses/nonexclusive-distrib/1.0/","  We argue that ultrahigh energy cosmic ray collisions in the Earth atmosphere
can probe the strange quark density of the nucleon. These collisions have
center-of-mass energies \agt 10^{4.6} A GeV, where A \geq 14 is the nuclear
baryon number. We hypothesize the formation of a deconfined thermal fireball
which undergoes a sudden hadronization. At production the fireball has a very
high matter density and consists of gluons and two flavors of light quarks
(u,d). Because the fireball is formed in the baryon-rich projectile
fragmentation region, the high baryochemical potential damps the production of
u \bar u and d \bar d pairs, resulting in gluon fragmentation mainly into s
\bar s. The strange quarks then become much more abundant and upon
hadronization the relative density of strange hadrons is significantly enhanced
over that resulting from a hadron gas. Assuming the momentum distribution
functions can be approximated by Fermi-Dirac and Bose-Einstein statistics, we
estimate a kaon-to-pion ratio of about 3 and expect a similar (total)
baryon-to-pion ratio. We show that, if this were the case, the excess of
strange hadrons would suppress the fraction of energy which is transferred to
decaying \pi^0's by about 20\%, yielding a \sim 40\% enhancement of the muon
content in atmospheric cascades, in agreement with recent data reported by the
Pierre Auger Collaboration.
","[{""version"":""v1"",""created"":""Wed, 21 Dec 2016 21:00:04 GMT""},{""version"":""v2"",""created"":""Fri, 30 Dec 2016 03:08:22 GMT""},{""version"":""v3"",""created"":""Tue, 21 Feb 2017 22:43:44 GMT""},{""version"":""v4"",""created"":""Sat, 3 Aug 2019 14:18:47 GMT""}]","2019-08-06"
"1612.07329","Radoslaw Ryblewski","Leonardo Tinti, Amaresh Jaiswal and Radoslaw Ryblewski","Quasiparticle second-order viscous hydrodynamics from kinetic theory","10 pages, 3 figures, version published in Phys. Rev. D","Phys. Rev. D 95, 054007 (2017)","10.1103/PhysRevD.95.054007",,"nucl-th hep-ph","http://arxiv.org/licenses/nonexclusive-distrib/1.0/","  We present the derivation of second-order relativistic viscous hydrodynamics
from an effective Boltzmann equation for a system consisting of quasiparticles
of a single species. We consider temperature-dependent masses of the
quasiparticles and devise a thermodynamically-consistent framework to formulate
second-order evolution equations for shear and bulk viscous pressure
corrections. The main advantage of this formulation is that one can
consistently implement realistic equation of state of the medium within the
framework of kinetic theory. Specializing to the case of one-dimensional
purely-longitudinal boost-invariant expansion, we study the effect of this new
formulation on viscous hydrodynamic evolution of strongly-interacting matter
formed in relativistic heavy-ion collisions.
","[{""version"":""v1"",""created"":""Wed, 21 Dec 2016 21:00:06 GMT""},{""version"":""v2"",""created"":""Mon, 13 Mar 2017 10:46:10 GMT""}]","2017-03-15"
"1612.07330","Christophe Vuillot","Earl T. Campbell and Barbara M. Terhal and Christophe Vuillot","Roads towards fault-tolerant universal quantum computation","A concise review paper. 9 pages + references. V2 includes a
  correction to Fig1b which had gates Z^b and X^{a+c} interchanged. This
  version is the one before review and editing by Nature","Nature volume 549, pages 172-179 (14 September 2017)","10.1038/nature23460",,"quant-ph","http://arxiv.org/licenses/nonexclusive-distrib/1.0/","  Current experiments are taking the first steps toward noise-resilient logical
qubits. Crucially, a quantum computer must not merely store information, but
also process it. A fault-tolerant computational procedure ensures that errors
do not multiply and spread. This review compares the leading proposals for
promoting a quantum memory to a quantum processor. We compare magic state
distillation, color code techniques and other alternative ideas, paying
attention to relative resource demands. We discuss the several no-go results
which hold for low-dimensional topological codes and outline the potential
rewards of using high-dimensional quantum (LDPC) codes in modular
architectures.
","[{""version"":""v1"",""created"":""Wed, 21 Dec 2016 21:00:07 GMT""},{""version"":""v2"",""created"":""Mon, 12 Nov 2018 15:51:55 GMT""}]","2018-11-13"
"1612.07331","Luigi Seveso","Luigi Seveso, Matteo G. A. Paris","Can quantum probes satisfy the weak equivalence principle?","close to published version","Annals of Physics, Volume 380, May 2017, Pages 213-223","10.1016/j.aop.2017.03.021",,"gr-qc quant-ph","http://arxiv.org/licenses/nonexclusive-distrib/1.0/","  We address the question whether quantum probes in a gravitational field can
be considered as test particles obeying the weak equivalence principle (WEP). A
formulation of the WEP is proposed which applies also in the quantum regime,
while maintaining the physical content of its classical counterpart. Such
formulation requires the introduction of a gravitational field not to modify
the Fisher information about the mass of a freely-falling probe, extractable
through measurements of its position. We discover that, while in a uniform
field quantum probes satisfy our formulation of the WEP exactly, gravity
gradients can encode nontrivial information about the particle's mass in its
wavefunction, leading to violations of the WEP.
","[{""version"":""v1"",""created"":""Wed, 21 Dec 2016 21:01:29 GMT""},{""version"":""v2"",""created"":""Wed, 17 May 2017 15:46:33 GMT""}]","2017-05-18"
"1612.07332","Brian Metzger","Brian D. Metzger, Ken J. Shen, Nicholas C. Stone","Secular Dimming of KIC 8462852 Following its Consumption of a Planet","10 pages, accepted to MNRAS",,"10.1093/mnras/stx823",,"astro-ph.SR astro-ph.EP","http://arxiv.org/licenses/nonexclusive-distrib/1.0/","  The Kepler-field star KIC 8462852, an otherwise apparently ordinary F3
main-sequence star, showed several highly unusual dimming events of variable
depth and duration. Adding to the mystery was the discovery that KIC 8462852
faded by 14% from 1890 to 1989, as well as by another 3% over the 4 year Kepler
mission. Following an initial suggestion by Wright & Sigurdsson, we propose
that the secular dimming behavior is the result of the inspiral of a planetary
body or bodies into KIC 8462852, which took place ~10 to 1e4 years ago
(depending on the planet mass). Gravitational energy released as the body
inspirals into the outer layers of the star caused a temporary and unobserved
brightening, from which the stellar flux is now returning to the quiescent
state. The transient dimming events could then be due to obscuration by
planetary debris from an earlier partial disruption of the same inspiraling
bodies, or due to evaporation and out-gassing from a tidally detached moon
system. Alternatively, the dimming events could arise from a large number of
bodies comet- or planetesimal-mass bodies placed onto high eccentricity orbits
by the same mechanism (e.g. Lidov-Kozai oscillations due to the outer M-dwarf
companion) responsible for driving the more massive planets into KIC 8462852.
The required high occurrence rate of KIC 8462852-like systems which have
undergone recent major planet inspiral event(s) is the greatest challenge to
the model, placing large lower limits on the mass of planetary systems
surrounding F stars and/or requiring an unlikely probability to catch KIC
8462852 in its current state.
","[{""version"":""v1"",""created"":""Wed, 21 Dec 2016 21:01:41 GMT""},{""version"":""v2"",""created"":""Mon, 3 Apr 2017 00:31:45 GMT""}]","2017-05-31"
