"1612.07432","Radu Laza","Radu Laza and Kieran O'Grady","GIT versus Baily-Borel compactification for quartic K3 surfaces","48 pages. Submitted to the Proceedings of the Abel Symposium. The
  second paper in our study of the birational geometry of certain locally
  symmetric varieties of Type IV. Version 2: minor revision of v1; the case of
  hyperelliptic quartics will be discussed elsewhere",,,,"math.AG","http://arxiv.org/licenses/nonexclusive-distrib/1.0/","  Looijenga has introduced new compactifications of locally symmetric varieties
that give a complete understanding of the period map from the GIT moduli space
of plane sextics to the Baily-Borel compactification of the moduli space
polarized K3's of degree 2, and also of the period map of cubic fourfolds. On
the other hand, the period map of the GIT moduli space of quartic surfaces is
significantly more subtle. In our previous paper, we introduced a
Hassett-Keel-Looijenga program for certain locally symmetric varieties of Type
IV. As a consequence, we gave a complete conjectural decomposition into a
product of elementary birational modifications of the period map for the GIT
moduli spaces of quartic surfaces.
  The purpose of this note is to provide compelling evidence in favor of our
program. Specifically, we propose a matching between the arithmetic strata in
the period space and suitable strata of the GIT moduli spaces of quartic
surfaces. We then partially verify that the proposed matching actually holds.
","[{""version"":""v1"",""created"":""Thu, 22 Dec 2016 03:37:33 GMT""},{""version"":""v2"",""created"":""Wed, 8 Nov 2017 15:57:45 GMT""}]","2017-11-09"
"1612.07433","Harishchandra Dubey","Rakesh K. Lenka, Rabindra K. Barik, Noopur Gupta, Syed Mohd Ali, Amiya
  Rath, Harishchandra Dubey","Comparative Analysis of SpatialHadoop and GeoSpark for Geospatial Big
  Data Analytics","6 pages, 7 figures,table1",,,,"cs.DC cs.CY","http://arxiv.org/licenses/nonexclusive-distrib/1.0/","  In this digitalised world where every information is stored, the data a are
growing exponentially. It is estimated that data are doubles itself every two
years. Geospatial data are one of the prime contributors to the big data
scenario. There are numerous tools of the big data analytics. But not all the
big data analytics tools are capabilities to handle geospatial big data. In the
present paper, it has been discussed about the recent two popular open source
geospatial big data analytical tools i.e. Spatial- Hadoop and GeoSpark which
can be used for analysis and process the geospatial big data in efficient
manner. It has compared the architectural view of SpatialHadoop and GeoSpark.
Through the architectural comparison, it has also summarised the merits and
demerits of these tools according the execution times and volume of the data
which has been used.
","[{""version"":""v1"",""created"":""Thu, 22 Dec 2016 03:46:11 GMT""},{""version"":""v2"",""created"":""Tue, 21 Feb 2017 21:48:57 GMT""}]","2017-02-23"
"1612.07434","Adam Greenberg","Adam H. Greenberg, Jean-Luc Margot, Ashok K. Verma, Patrick A. Taylor,
  Shantanu P. Naidu, Marina. Brozovic, Lance A. M. Benner","Asteroid 1566 Icarus's size, shape, orbit, and Yarkovsky drift from
  radar observations","19 pages, 6 figures. The Astronomical Journal, in press",,"10.3847/1538-3881/153/3/108",,"astro-ph.EP","http://arxiv.org/licenses/nonexclusive-distrib/1.0/","  Near-Earth asteroid (NEA) 1566 Icarus ($a=1.08$ au, $e=0.83$,
$i=22.8^{\circ}$) made a close approach to Earth in June 2015 at 22 lunar
distances (LD). Its detection during the 1968 approach (16 LD) was the first in
the history of asteroid radar astronomy. A subsequent approach in 1996 (40 LD)
did not yield radar images. We describe analyses of our 2015 radar observations
of Icarus obtained at the Arecibo Observatory and the DSS-14 antenna at
Goldstone. These data show that the asteroid is a moderately flattened spheroid
with an equivalent diameter of 1.44 km with 18% uncertainties, resolving
long-standing questions about the asteroid size. We also solve for Icarus' spin
axis orientation ($\lambda=270^{\circ}\pm10^{\circ},
\beta=-81^{\circ}\pm10^{\circ}$), which is not consistent with the estimates
based on the 1968 lightcurve observations. Icarus has a strongly specular
scattering behavior, among the highest ever measured in asteroid radar
observations, and a radar albedo of $\sim$2\%, among the lowest ever measured
in asteroid radar observations. The low cross-section suggests a high-porosity
surface, presumably related to Icarus' cratering, spin, and thermal histories.
Finally, we present the first use of our orbit determination software for the
generation of observational ephemerides, and we demonstrate its ability to
determine subtle perturbations on NEA orbits by measuring Icarus'
orbit-averaged drift in semi-major axis ($(-4.62\pm0.48) \times 10^{-4}$ au/My,
or $\sim$60 m per revolution). Our Yarkovsky rate measurement resolves a
discrepancy between two published rates that did not include the 2015 radar
astrometry.
","[{""version"":""v1"",""created"":""Thu, 22 Dec 2016 03:49:06 GMT""},{""version"":""v2"",""created"":""Wed, 11 Jan 2017 19:33:27 GMT""},{""version"":""v3"",""created"":""Fri, 13 Jan 2017 15:56:48 GMT""}]","2017-02-15"
"1612.07435","Mihailo Stojnic","Mihailo Stojnic","Partial $\ell_1$ optimization in random linear systems -- phase
  transitions and large deviations","arXiv admin note: text overlap with arXiv:1612.06361,
  arXiv:1612.06835",,,,"math.OC cs.IT math.IT math.PR","http://arxiv.org/licenses/nonexclusive-distrib/1.0/","  $\ell_1$ optimization is a well known heuristic often employed for solving
various forms of sparse linear problems. In this paper we look at its a variant
that we refer to as the \emph{partial} $\ell_1$ and discuss its mathematical
properties when used for solving linear under-determined systems of equations.
We will focus on large random systems and discuss the phase transition (PT)
phenomena and how they connect to the large deviation principles (LDP). Using a
variety of probabilistic and geometric techniques that we have developed in
recent years we will first present general guidelines that conceptually fully
characterize both, the PTs and the LDPs. After that we will put an emphasis on
providing a collection of explicit analytical solutions to all of the
underlying mathematical problems. As a nice bonus to the developed concepts,
the forms of the analytical solutions will, in our view, turn out to be fairly
elegant as well.
","[{""version"":""v1"",""created"":""Thu, 22 Dec 2016 04:05:02 GMT""}]","2016-12-23"
"1612.07436","Mihailo Stojnic","Mihailo Stojnic","Partial $\ell_1$ optimization in random linear systems -- finite
  dimensions","arXiv admin note: text overlap with arXiv:1612.06344",,,,"math.OC cs.IT math.IT math.PR","http://arxiv.org/licenses/nonexclusive-distrib/1.0/","  In this paper we provide a complementary set of results to those we present
in our companion work \cite{Stojnicl1HidParasymldp} regarding the behavior of
the so-called partial $\ell_1$ (a variant of the standard $\ell_1$ heuristic
often employed for solving under-determined systems of linear equations). As is
well known through our earlier works
\cite{StojnicICASSP10knownsupp,StojnicTowBettCompSens13}, the partial $\ell_1$
also exhibits the phase-transition (PT) phenomenon, discovered and well
understood in the context of the standard $\ell_1$ through Donoho's and our own
works \cite{DonohoPol,DonohoUnsigned,StojnicCSetam09,StojnicUpper10}.
\cite{Stojnicl1HidParasymldp} goes much further though and, in addition to the
determination of the partial $\ell_1$'s phase-transition curves (PT curves)
(which had already been done in
\cite{StojnicICASSP10knownsupp,StojnicTowBettCompSens13}), provides a
substantially deeper understanding of the PT phenomena through a study of the
underlying large deviations principles (LDPs). As the PT and LDP phenomena are
by their definitions related to large dimensional settings, both sets of our
works, \cite{StojnicICASSP10knownsupp,StojnicTowBettCompSens13} and
\cite{Stojnicl1HidParasymldp}, consider what is typically called the asymptotic
regime. In this paper we move things in a different direction and consider
finite dimensional scenarios. Basically, we provide explicit performance
characterizations for any given collection of systems/parameters dimensions. We
do so for two different variants of the partial $\ell_1$, one that we call
exactly the partial $\ell_1$ and another one, possibly a bit more practical,
that we call the hidden partial $\ell_1$.
","[{""version"":""v1"",""created"":""Thu, 22 Dec 2016 04:17:33 GMT""}]","2016-12-23"
"1612.07437","Daniel Jaschke","Daniel Jaschke, Kenji Maeda, Joseph D. Whalen, Michael L. Wall, and
  Lincoln D. Carr","Critical Phenomena and Kibble-Zurek Scaling in the Long-Range Quantum
  Ising Chain",,"New Journal of Physics, 19, 033032 (2017)","10.1088/1367-2630/aa65bc",,"cond-mat.quant-gas cond-mat.stat-mech quant-ph","http://arxiv.org/licenses/nonexclusive-distrib/1.0/","  We investigate an extension of the quantum Ising model in one spatial
dimension including long-range $1 / r^{\alpha}$ interactions in its statics and
dynamics with possible applications from heteronuclear polar molecules in
optical lattices to trapped ions described by two-state spin systems. We
introduce the statics of the system via both numerical techniques with finite
size and infinite size matrix product states and a theoretical approaches using
a truncated Jordan-Wigner transformation for the ferromagnetic and
antiferromagnetic case and show that finite size effects have a crucial role
shifting the quantum critical point of the external field by fifteen percent
between thirty-two and around five-hundred spins. We numerically study the
Kibble-Zurek hypothesis in the long-range quantum Ising model with Matrix
Product States. A linear quench of the external field through the quantum
critical point yields a power-law scaling of the defect density as a function
of the total quench time. For example, the increase of the defect density is
slower for longer-range models and the critical exponent changes by twenty-five
per cent. Our study emphasizes the importance of such long-range interactions
in statics and dynamics that could point to similar phenomena in a different
setup of dynamical systems or for other models.
","[{""version"":""v1"",""created"":""Thu, 22 Dec 2016 04:17:54 GMT""},{""version"":""v2"",""created"":""Wed, 13 Sep 2017 22:51:13 GMT""}]","2017-09-15"
"1612.07438","V Girish","V. Girish, Shyam N. Tandon, S. Sriram, Amit Kumar and Joe Postma","Mapping Distortion of Detectors in UVIT Onboard AstroSat Observatory","16 pages, 12 figures, Accepted for publication in Experimental
  Astronomy",,"10.1007/s10686-016-9520-3",,"astro-ph.IM","http://arxiv.org/licenses/nonexclusive-distrib/1.0/","  Ultraviolet Imaging Telescope (UVIT) is one of the payloads onboard AstroSat,
India's first multi-wavelength Astronomy mission. UVIT is primarily designed to
make high resolution images in wide field, in three wavelength channels
simultaneously: FUV (130 - 180 nm), NUV (200 - 300 nm) and VIS (320 - 550 nm).
The intensified imagers used in UVIT suffer from distortions, and a correction
is necessary for these to achieve good astrometry. In this article we describe
the methodology and calculations used to estimate the distortions in ground
calibrations.
","[{""version"":""v1"",""created"":""Thu, 22 Dec 2016 04:19:36 GMT""}]","2017-02-08"
"1612.07439","Jie Peng","Hao Yan, Owen Carmichael, Debashis Paul and Jie Peng","Estimating fiber orientation distribution from diffusion MRI with
  spherical needlets",,,,,"stat.AP","http://arxiv.org/licenses/nonexclusive-distrib/1.0/","  We present a novel method for estimation of the fiber orientation
distribution (FOD) function based on diffusion-weighted Magnetic Resonance
Imaging (D-MRI) data. We formulate the problem of FOD estimation as a
regression problem through spherical deconvolution and a sparse representation
of the FOD by a spherical needlets basis that form a multi-resolution tight
frame for spherical functions. This sparse representation allows us to estimate
FOD by an $l_1$-penalized regression under a non-negativity constraint. The
resulting convex optimization problem is solved by an alternating direction
method of multipliers (ADMM) algorithm. The proposed method leads to a
reconstruction of the FODs that is accurate, has low variability and preserves
sharp features. Through extensive experiments, we demonstrate the effectiveness
and favorable performance of the proposed method compared with two existing
methods. Particularly, we show the ability of the proposed method in
successfully resolving fiber crossing at small angles and in automatically
identifying isotropic diffusion. We also apply the proposed method to real 3T
D-MRI data sets of healthy elderly individuals. The results show realistic
descriptions of crossing fibers that are more accurate and less noisy than
competing methods even with a relatively small number of gradient directions.
","[{""version"":""v1"",""created"":""Thu, 22 Dec 2016 04:29:43 GMT""}]","2016-12-23"
"1612.07440","Alireza Qaiumzadeh","Alireza Qaiumzadeh, Hans Skarsv{\aa}g, Cecilia Holmqvist, and Arne
  Brataas","Spin Superfluidity in Biaxial Antiferromagnetic Insulators","5.5 pages, 4 figures","Phys. Rev. Lett. 118, 137201 (2017)","10.1103/PhysRevLett.118.137201",,"cond-mat.mes-hall","http://arxiv.org/licenses/nonexclusive-distrib/1.0/","  Antiferromagnets may exhibit spin superfluidity since the dipole interaction
is weak. We seek to establish that this phenomenon occurs in insulators such as
NiO, which is a good spin conductor according to previous studies. We
investigate nonlocal spin transport in a planar antiferromagnetic insulator
with a weak uniaxial anisotropy. The anisotropy hinders spin superfluidity by
creating a substantial threshold that the current must overcome. Nevertheless,
we show that applying a high magnetic field removes this obstacle near the
spin-flop transition of the antiferromagnet. Importantly, the spin
superfluidity can then persist across many micrometers, even in dirty samples.
","[{""version"":""v1"",""created"":""Thu, 22 Dec 2016 04:41:36 GMT""},{""version"":""v2"",""created"":""Wed, 29 Mar 2017 17:51:58 GMT""}]","2017-03-30"
"1612.07441","Sanyasi Rao Bobbili","B. S. Rao, A. Moorti, J. A. Chakera, P. A. Naik, and P. D. Gupta","Quasi-monoenergetic electron beams from laser plasma acceleration using
  nitrogen gas jet","14 pages, 5 figures","Plasma Physics and Controlled Fusion 2017","10.1088/1361-6587/aa69f3",,"physics.plasm-ph","http://arxiv.org/licenses/nonexclusive-distrib/1.0/","  An experimental investigation on laser plasma acceleration of electrons has
been carried out using 3 TW, 45 fs duration titanium sapphire laser pulse
interaction with nitrogen gas jet at intensity of 2x10^18 W/cm^2. We have
observed stable generation of well collimated electron beam with divergence and
pointing variation ~ 10 mrad from the nitrogen gas jet plasma at an optimum
plasma density around 3x10^19 cm^-3. The energy spectrum of the electron beam
was quasi-monoenergetic with average peak energy and charge around 25 MeV and
30 pC respectively. The results will be useful for better understanding and
control of ionization injection and laser wakefield acceleration of electrons
in high-Z gases and also to develop practical laser wakefield accelerators for
various applications including injectors for high energy accelerators.
","[{""version"":""v1"",""created"":""Thu, 22 Dec 2016 05:07:08 GMT""}]","2018-06-25"
"1612.07442","Bohdan Senyuk","Bohdan Senyuk, David Glugla, Ivan I. Smalyukh","Rotational and translational diffusion of anisotropic gold nanoparticles
  in liquid crystals controlled by varying surface anchoring",,"Phys. Rev. E 88, 062507 (2013)","10.1103/PhysRevE.88.062507",,"cond-mat.soft cond-mat.mtrl-sci","http://arxiv.org/licenses/nonexclusive-distrib/1.0/","  We study translational and rotational diffusion of anisotropic gold
nanoparticles (NPs) dispersed in the bulk of a nematic liquid crystal fluid
host. Experimental data reveal strong anisotropy of translational diffusion
with respect to the uniform far-field director, which is dependent on shape and
surface functionalization of colloids as well as on their ground-state
alignment. For example, elongated NPs aligned parallel to the far-field
director translationally diffuse more rapidly along the director whereas
diffusion of NPs oriented normal to the director is faster in the direction
perpendicular to it while they are also undergoing elasticity-constrained
rotational diffusion. To understand physical origins of these rich diffusion
properties of anisotropic nanocolloids in uniaxially anisotropic nematic fluid
media, we compare them to diffusion of prolate and oblate ellipsoidal particles
in isotropic fluids as well as to diffusion of shape-isotropic particles in
nematic fluids. We also show that surface functionalization of NPs with
photosensitive azobenzene groups allows for in situ control of their
diffusivity through trans-cis isomerization that changes surface anchoring.
","[{""version"":""v1"",""created"":""Thu, 22 Dec 2016 05:08:53 GMT""}]","2016-12-23"
"1612.07443","Bohdan Senyuk","Bohdan Senyuk, Julian S. Evans, Paul J. Ackerman, Taewoo Lee, Pramit
  Manna, Leonid Vigderman, Eugene R. Zubarev, Jao van de Lagemaat, Ivan I.
  Smalyukh","Shape-dependent oriented trapping and scaffolding of plasmonic
  nanoparticles by topological defects for self-assembly of colloidal dimers in
  liquid crystals",,"Nano Letters 12, 955-963 (2012)","10.1021/nl204030t",,"cond-mat.soft cond-mat.mtrl-sci physics.optics","http://arxiv.org/licenses/nonexclusive-distrib/1.0/","  We demonstrate scaffolding of plasmonic nanoparticles by topological defects
induced by colloidal microspheres to match their surface boundary conditions
with a uniform far-field alignment in a liquid crystal host. Displacing
energetically costly liquid crystal regions of reduced order, anisotropic
nanoparticles with concave or convex shapes not only stably localize in defects
but also self-orient with respect to the microsphere surface. Using laser
tweezers, we manipulate the ensuing nanoparticle-microsphere colloidal dimers,
probing the strength of elastic binding and demonstrating self-assembly of
hierarchical colloidal superstructures such as chains and arrays.
","[{""version"":""v1"",""created"":""Thu, 22 Dec 2016 05:14:32 GMT""}]","2016-12-23"
"1612.07444","Bohdan Senyuk","Bohdan Senyuk, Natnael Behabtu, Benjamin G. Pacheco, Taewoo Lee,
  Gabriel Ceriotti, James M. Tour, Matteo Pasquali, Ivan I. Smalyukh","Nonlinear photoluminescence imaging of isotropic and liquid crystalline
  dispersions of graphene oxide",,"ACS Nano 6, 8060 (2012)","10.1021/nn302644r",,"cond-mat.mtrl-sci cond-mat.soft physics.optics","http://arxiv.org/licenses/nonexclusive-distrib/1.0/","  We report a visible-range nonlinear photoluminescence (PL) from graphene
oxide (GO) flakes excited by near-infrared femtosecond laser light. PL
intensity has nonlinear dependence on the laser power, implying a multiphoton
excitation process, and also strongly depends on a linear polarization
orientation of excitation light, being at maximum when it is parallel to
flakes. We show that PL can be used for a fully three-dimensional label-free
imaging of isotropic, nematic, and lamellar liquid crystalline dispersions of
GO flakes in water. This nonlinear PL is of interest for applications in direct
label-free imaging of composite materials and study of orientational ordering
in mesomorphic phases formed by these flakes, as well as in biomedical and
sensing applications utilizing GO.
","[{""version"":""v1"",""created"":""Thu, 22 Dec 2016 05:19:01 GMT""}]","2016-12-23"
"1612.07445","Tran-Vu Khanh","Tran Vu Khanh and Andrew Raich","The Kohn-Laplace equation on abstract CR manifolds: Global regularity","29 pages",,,,"math.CV","http://arxiv.org/licenses/nonexclusive-distrib/1.0/","  Let $M$ be a compact, pseudoconvex-oriented, $(2n+1)$-dimensional, abstract
CR manifold of hypersurface type, $n\geq 2$. We prove the following:
  (i) If $M$ admits a strictly CR-plurisubharmonic function on $(0,q_0)$-forms,
then the complex Green operator $G_q$ exists and is continuous on
$L^2_{0,q}(M)$ for degrees $q_0\le q\le n-q_0$. In the case that $q_0=1$, we
also establish continuity for $G_0$ and $G_n$. Additionally, the
$\bar\partial_b$-equation on $M$ can be solved in $C^\infty(M)$.
  (ii) If $M$ satisfies ""a weak compactness property"" on $(0,q_0)$-forms, then
$G_q$ is a continuous operator on $H^s_{0,q}(M)$ and is therefore globally
regular on $M$ for degrees $q_0\le q\le n-q_0$; and also for the top degrees
$q=0$ and $q=n$ in the case $q_0=1$.
  We also introduce the notion of a ""plurisubharmonic CR manifold"" and show
that it generalizes the notion of ""plurisubharmonic defining function"" for a a
domain in $\mathbb C^N$ and implies that $M$ satisfies the weak compactness
property.
","[{""version"":""v1"",""created"":""Thu, 22 Dec 2016 05:26:28 GMT""}]","2016-12-23"
"1612.07446","Tran-Vu Khanh","Tran Vu Khanh","The Kohn-Laplace equation on abstract CR manifolds: Local regularity","51 pages",,,,"math.CV","http://arxiv.org/licenses/nonexclusive-distrib/1.0/","  The purpose of this paper is to establish local regularity of the solution
operator to the Kohn-Laplace equation, called the complex Green operator, on
abstract CR manifolds of hypersurface type. For a cut-off function $\sigma$, we
introduce the $\sigma$-superlogarithmic property, a potential theoretical
condition on CR manifolds. We prove that if the given datum is smooth on an
open set containing the support of $\sigma$ then the solution is smooth on the
interior of $\{x\in M:\sigma(x)=1\}$. Furthermore, we also study the smoothness
of the integral kernel of the complex Green operator.
","[{""version"":""v1"",""created"":""Thu, 22 Dec 2016 05:35:56 GMT""}]","2016-12-23"
"1612.07447","Pradip Kumar","Neha Gupta and Pradip Kumar","Induced monoidal structure from the functor",,,,,"math.CT","http://creativecommons.org/publicdomain/zero/1.0/","  Let $\mathcal{B}$ be a subcategory of a given category $\mathcal{D}$. Let
$\mathcal{B}$ has monoidal structure. In this article, we discuss when can one
extend the monoidal structure of $\mathcal{B}$ to $\mathcal{D}$ such that
$\mathcal{B}$ becomes a sub monoidal category of monoidal category
$\mathcal{D}$. Examples are discussed, and in particular, in an example of loop
space, we elaborated all results discussed in this article.
","[{""version"":""v1"",""created"":""Thu, 22 Dec 2016 05:37:50 GMT""}]","2016-12-23"
"1612.07448","Lingjiao Chen","Lingjiao Chen, Arun Kumar, Jeffrey Naughton, Jignesh M. Patel","Towards Linear Algebra over Normalized Data",,,,,"cs.DB","http://arxiv.org/licenses/nonexclusive-distrib/1.0/","  Providing machine learning (ML) over relational data is a mainstream
requirement for data analytics systems. While almost all the ML tools require
the input data to be presented as a single table, many datasets are
multi-table, which forces data scientists to join those tables first, leading
to data redundancy and runtime waste. Recent works on ""factorized"" ML mitigate
this issue for a few specific ML algorithms by pushing ML through joins. But
their approaches require a manual rewrite of ML implementations. Such piecemeal
methods create a massive development overhead when extending such ideas to
other ML algorithms. In this paper, we show that it is possible to mitigate
this overhead by leveraging a popular formal algebra to represent the
computations of many ML algorithms: linear algebra. We introduce a new logical
data type to represent normalized data and devise a framework of algebraic
rewrite rules to convert a large set of linear algebra operations over
denormalized data into operations over normalized data. We show how this
enables us to automatically ""factorize"" several popular ML algorithms, thus
unifying and generalizing several prior works. We prototype our framework in
the popular ML environment R and an industrial R-over-RDBMS tool. Experiments
with both synthetic and real normalized data show that our framework also
yields significant speed-ups, up to 36x on real data.
","[{""version"":""v1"",""created"":""Thu, 22 Dec 2016 05:41:27 GMT""},{""version"":""v2"",""created"":""Sat, 24 Dec 2016 04:28:16 GMT""},{""version"":""v3"",""created"":""Thu, 29 Dec 2016 01:25:30 GMT""},{""version"":""v4"",""created"":""Sun, 1 Jan 2017 01:25:21 GMT""},{""version"":""v5"",""created"":""Sat, 15 Apr 2017 04:20:30 GMT""},{""version"":""v6"",""created"":""Tue, 27 Jun 2017 02:05:09 GMT""}]","2017-06-28"
