"1602.04420","Bolun Xu","Bolun Xu, Yury Dvorkin, Daniel S. Kirschen, C. A. Silva-Monroy,
  Jean-Paul Watson","A Comparison of Policies on the Participation of Storage in U.S.
  Frequency Regulation Markets","This paper will be presented in IEEE PES General Meeting 2016",,,,"math.OC cs.SY","http://arxiv.org/licenses/nonexclusive-distrib/1.0/","  Because energy storage systems have better ramping characteristics than
traditional generators, their participation in frequency regulation should
facilitate the balancing of load and generation. However, they cannot sustain
their output indefinitely. System operators have therefore implemented new
frequency regulation policies to take advantage of the fast ramps that energy
storage systems can deliver while alleviating the problems associated with
their limited energy capacity. This paper contrasts several U.S. policies that
directly affect the participation of energy storage systems in frequency
regulation and compares the revenues that the owners of such systems might
achieve under each policy.
","[{""version"":""v1"",""created"":""Sun, 14 Feb 2016 06:25:54 GMT""},{""version"":""v2"",""created"":""Tue, 16 Feb 2016 04:58:51 GMT""}]","2016-02-20"
"1602.04421","Yitong Yin","Mingmou Liu, Xiaoyin Pan, Yitong Yin","Randomized approximate nearest neighbor search with limited adaptivity",,,,,"cs.DS","http://arxiv.org/licenses/nonexclusive-distrib/1.0/","  We study the fundamental problem of approximate nearest neighbor search in
$d$-dimensional Hamming space $\{0,1\}^d$. We study the complexity of the
problem in the famous cell-probe model, a classic model for data structures. We
consider algorithms in the cell-probe model with limited adaptivity, where the
algorithm makes $k$ rounds of parallel accesses to the data structure for a
given $k$. For any $k\ge 1$, we give a simple randomized algorithm solving the
approximate nearest neighbor search using $k$ rounds of parallel memory
accesses, with $O(k(\log d)^{1/k})$ accesses in total. We also give a more
sophisticated randomized algorithm using $O(k+(\frac{1}{k}\log d)^{O(1/k)})$
memory accesses in $k$ rounds for large enough $k$. Both algorithms use data
structures of size polynomial in $n$, the number of points in the database.
  For the lower bound, we prove an $\Omega(\frac{1}{k}(\log d)^{1/k})$ lower
bound for the total number of memory accesses required by any randomized
algorithm solving the approximate nearest neighbor search within
$k\le\frac{\log\log d}{2\log\log\log d}$ rounds of parallel memory accesses on
any data structures of polynomial size. This lower bound shows that our first
algorithm is asymptotically optimal for any constant round $k$. And our second
algorithm approaches the asymptotically optimal tradeoff between rounds and
memory accesses, in a sense that the lower bound of memory accesses for any
$k_1$ rounds can be matched by the algorithm within $k_2=O(k_1)$ rounds. In the
extreme, for some large enough $k=\Theta\left(\frac{\log\log d}{\log\log\log
d}\right)$, our second algorithm matches the $\Theta\left(\frac{\log\log
d}{\log\log\log d}\right)$ tight bound for fully adaptive algorithms for
approximate nearest neighbor search due to Chakrabarti and Regev.
","[{""version"":""v1"",""created"":""Sun, 14 Feb 2016 06:36:17 GMT""}]","2016-02-16"
"1602.04422","Chunhua Shen","Peng Wang, Lingqiao Liu, Chunhua Shen, Anton van den Hengel, Heng Tao
  Shen","Hi Detector, What's Wrong with that Object? Identifying Irregular Object
  From Images by Modelling the Detection Score Distribution","10 pages",,,,"cs.CV","http://arxiv.org/licenses/nonexclusive-distrib/1.0/","  In this work, we study the challenging problem of identifying the irregular
status of objects from images in an ""open world"" setting, that is,
distinguishing the irregular status of an object category from its regular
status as well as objects from other categories in the absence of ""irregular
object"" training data. To address this problem, we propose a novel approach by
inspecting the distribution of the detection scores at multiple image regions
based on the detector trained from the ""regular object"" and ""other objects"".
The key observation motivating our approach is that for ""regular object"" images
as well as ""other objects"" images, the region-level scores follow their own
essential patterns in terms of both the score values and the spatial
distributions while the detection scores obtained from an ""irregular object""
image tend to break these patterns. To model this distribution, we propose to
use Gaussian Processes (GP) to construct two separate generative models for the
case of the ""regular object"" and the ""other objects"". More specifically, we
design a new covariance function to simultaneously model the detection score at
a single region and the score dependencies at multiple regions. We finally
demonstrate the superior performance of our method on a large dataset newly
proposed in this paper.
","[{""version"":""v1"",""created"":""Sun, 14 Feb 2016 06:39:05 GMT""}]","2016-02-16"
"1602.04423","Vladislav Malyshkin","Vladislav Gennadievich Malyshkin","Market Dynamics. On Supply and Demand Concepts",,,,,"q-fin.EC q-fin.CP","http://arxiv.org/licenses/nonexclusive-distrib/1.0/","  The disbalance of Supply and Demand is typically considered as the driving
force of the markets. However, the measurement or estimation of Supply and
Demand at price different from the execution price is not possible even after
the transaction. An approach in which Supply and Demand are always matched, but
the rate $I=dv/dt$ (number of units traded per unit time) of their matching
varies, is proposed. The state of the system is determined not by a price $p$,
but by a probability distribution defined as the square of a wavefunction
$\psi(p)$. The equilibrium state $\psi^{[H]}$ is postulated to be the one
giving maximal $I$ and obtained from maximizing the matching rate functional
$<I\psi^2(p)>/<\psi^2(p)>$, i.e. solving the dynamic equation of the form
""future price tend to the value maximizing the number of shares traded per unit
time"". An application of the theory in a quasi--stationary case is
demonstrated. This transition from Supply and Demand concept to Liquidity
Deficit concept, described by the matching rate $I$, allows to operate only
with observable variables, and have a theory applicable to practical problems.
","[{""version"":""v1"",""created"":""Sun, 14 Feb 2016 06:39:16 GMT""}]","2016-02-16"
"1602.04424","Theodoros Katsaounis","Theodoros Katsaounis and Dimitrios Mitsotakis","On the reflection of solitons of the nonlinear Schrodinger equation",,,,,"math.NA","http://arxiv.org/licenses/nonexclusive-distrib/1.0/","  In this paper we perform a numerical study on the interesting phenomenon of
soliton reflection of solid walls. We consider the 2D nonlinear Schrodinger
equation as the underlying mathematical model and we use an implicit-explicit
type Crank-Nicolson finite element scheme for its numerical solution. After
verifying the perfect reflection of the solitons on a vertical wall, we present
the imperfect reflection of a dark soliton on a diagonal wall.
","[{""version"":""v1"",""created"":""Sun, 14 Feb 2016 07:27:14 GMT""},{""version"":""v2"",""created"":""Mon, 23 May 2016 11:39:20 GMT""},{""version"":""v3"",""created"":""Thu, 8 Sep 2016 11:38:31 GMT""}]","2016-09-09"
"1602.04425","Efim Rozenbaum","Efim B. Rozenbaum and Victor Galitski","Dynamical Localization of Coupled Relativistic Kicked Rotors","12 pages, 13 figures, accepted for publication in Phys. Rev. B, Vol.
  95 (2017)","Phys. Rev. B 95, 064303 (2017)","10.1103/PhysRevB.95.064303",,"cond-mat.dis-nn","http://arxiv.org/licenses/nonexclusive-distrib/1.0/","  A periodically driven rotor is a prototypical model that exhibits a
transition to chaos in the classical regime and dynamical localization (related
to Anderson localization) in the quantum regime. In a recent work [Phys. Rev. B
94, 085120 (2016)], A. C. Keser et al. considered a many-body generalization of
coupled quantum kicked rotors, and showed that in the special integrable linear
case, dynamical localization survives interactions. By analogy with many-body
localization, the phenomenon was dubbed dynamical many-body localization. In
the present work, we study nonintegrable models of single and coupled quantum
relativistic kicked rotors (QRKRs) that bridge the gap between the conventional
quadratic rotors and the integrable linear models. For a single QRKR, we
supplement the recent analysis of the angular-momentum-space dynamics with a
study of the spin dynamics. Our analysis of two and three coupled QRKRs along
with the proved localization in the many-body linear model indicate that
dynamical localization exists in few-body systems. Moreover, the relation
between QRKR and linear rotor models implies that dynamical many-body
localization can exist in generic, nonintegrable many-body systems. And
localization can generally result from a complicated interplay between Anderson
mechanism and limiting integrability, since the many-body linear model is a
high-angular-momentum limit of many-body QRKRs. We also analyze the dynamics of
two coupled QRKRs in the highly unusual superballistic regime and find that the
resonance conditions are relaxed due to interactions. Finally, we propose
experimental realizations of the QRKR model in cold atoms in optical lattices.
","[{""version"":""v1"",""created"":""Sun, 14 Feb 2016 07:27:18 GMT""},{""version"":""v2"",""created"":""Fri, 27 Jan 2017 23:21:09 GMT""}]","2017-02-07"
"1602.04426","Nicolas Boumal","Afonso S. Bandeira, Nicolas Boumal, Vladislav Voroninski","On the low-rank approach for semidefinite programs arising in
  synchronization and community detection","22 pages, Proceedings of The 29th Conference on Learning Theory
  (COLT), New York, NY, June 23-26, 2016",,,,"math.OC","http://arxiv.org/licenses/nonexclusive-distrib/1.0/","  To address difficult optimization problems, convex relaxations based on
semidefinite programming are now common place in many fields. Although solvable
in polynomial time, large semidefinite programs tend to be computationally
challenging. Over a decade ago, exploiting the fact that in many applications
of interest the desired solutions are low rank, Burer and Monteiro proposed a
heuristic to solve such semidefinite programs by restricting the search space
to low-rank matrices. The accompanying theory does not explain the extent of
the empirical success. We focus on Synchronization and Community Detection
problems and provide theoretical guarantees shedding light on the remarkable
efficiency of this heuristic.
","[{""version"":""v1"",""created"":""Sun, 14 Feb 2016 07:27:59 GMT""},{""version"":""v2"",""created"":""Fri, 27 May 2016 22:49:16 GMT""}]","2016-05-31"
"1602.04427","Zheng Xu","Zheng Xu and Douglas Burdick and Louiqa Raschid","Exploiting Lists of Names for Named Entity Identification of Financial
  Institutions from Unstructured Documents",,,,,"cs.CL","http://arxiv.org/licenses/nonexclusive-distrib/1.0/","  There is a wealth of information about financial systems that is embedded in
document collections. In this paper, we focus on a specialized text extraction
task for this domain. The objective is to extract mentions of names of
financial institutions, or FI names, from financial prospectus documents, and
to identify the corresponding real world entities, e.g., by matching against a
corpus of such entities. The tasks are Named Entity Recognition (NER) and
Entity Resolution (ER); both are well studied in the literature. Our
contribution is to develop a rule-based approach that will exploit lists of FI
names for both tasks; our solution is labeled Dict-based NER and Rank-based ER.
Since the FI names are typically represented by a root, and a suffix that
modifies the root, we use these lists of FI names to create specialized root
and suffix dictionaries. To evaluate the effectiveness of our specialized
solution for extracting FI names, we compare Dict-based NER with a general
purpose rule-based NER solution, ORG NER. Our evaluation highlights the
benefits and limitations of specialized versus general purpose approaches, and
presents additional suggestions for tuning and customization for FI name
extraction. To our knowledge, our proposed solutions, Dict-based NER and
Rank-based ER, and the root and suffix dictionaries, are the first attempt to
exploit specialized knowledge, i.e., lists of FI names, for rule-based NER and
ER.
","[{""version"":""v1"",""created"":""Sun, 14 Feb 2016 07:31:28 GMT""},{""version"":""v2"",""created"":""Tue, 7 Jun 2016 06:33:34 GMT""}]","2016-06-08"
"1602.04428","Yuxin Xue","Yuxin Xue and Yasushi Suto","Difficulty in Formation of Counter-orbiting Hot Jupiters from
  Near-coplanar Hierarchical Triple Systems: A Sub-stellar Perturber","accepted for publication in ApJ",,"10.3847/0004-637X/820/1/55",,"astro-ph.EP","http://arxiv.org/licenses/nonexclusive-distrib/1.0/","  Among a hundred transiting planets with a measured projected spin-orbit angle
{\lambda}, several systems are suggested to be counter-orbiting. While they may
be due to the projection effect, the mechanism to produce a counter-orbiting
planet is not established. A promising scenario for the counter-orbiting
planets is the extreme eccentricity evolution in near-coplanar hierarchical
triple systems with eccentric inner and outer or- bits. We examine this
scenario in detail by performing a series of systematic numerical simulations,
and consider the possibility of forming hot Jupiters, especially counter-
orbiting one under this mechanism with a distant sub-stellar perturber. We
incorporate quadrupole and octupole secular gravitational interaction between
the two orbits, and also short-range forces (correction for general relativity,
star and inner planetary tide and rotational distortion) simultaneously. We
find that most of systems are tidally disrupted and that a small fraction of
survived planets turns out to be prograde. The formation of counter-orbiting
hot Jupiters in this scenario is possible only in a very restricted parameter
region, and thus very unlikely in practice.
","[{""version"":""v1"",""created"":""Sun, 14 Feb 2016 07:39:19 GMT""}]","2016-03-23"
"1602.04429","Barbara Kaltenbacher","Kristian Bredies and Barbara Kaltenbacher and Elena Resmerita","The least error method for sparse solution reconstruction",,,"10.1088/0266-5611/32/9/094001",,"math.NA","http://arxiv.org/licenses/nonexclusive-distrib/1.0/","  This work deals with a regularization method enforcing solution sparsity of
linear ill-posed problems by appropriate discretization in the image space.
Namely, we formulate the so called least error method in an $\ell^1$ setting
and perform the convergence analysis by choosing the discretization level
according to an a priori rule, as well as two a posteriori rules, via the
discrepancy principle and the monotone error rule, respectively. Depending on
the setting, linear or sublinear convergence rates in the $\ell^1$-norm are
obtained under a source condition yielding sparsity of the solution. A part of
the study is devoted to analyzing the structure of the approximate solutions
and of the involved source elements.
","[{""version"":""v1"",""created"":""Sun, 14 Feb 2016 08:20:10 GMT""}]","2016-08-03"
"1602.04430","Anil Yadav dr","Anil Kumar Yadav","A transitioning universe with anisotropic dark energy","7 pages, 2 figure panels","Astrophys. Space Sci 361, 276 (2016)","10.1007/s10509-016-2862-5",,"gr-qc","http://arxiv.org/licenses/nonexclusive-distrib/1.0/","  In this paper, we present a model of transitioning universe with minimal
interaction between perfect fluid and anisotropic dark energy in Bianchi I
space-time. The two sources are assumed to minimally interacted and therefore
their energy momentum tensors are conserved separately. The explicit expression
for average scale factor are considered in hybrid form that gives time varying
deceleration parameter which describes both the early and late time physical
features of universe. We also discuss the physical and geometrical properties
of the model derived in this paper. The solution is interesting physically as
it explain accelerating universe as well as singularity free universe.
","[{""version"":""v1"",""created"":""Sun, 14 Feb 2016 08:32:07 GMT""}]","2016-08-19"
"1602.04431","Vikram  Singh","Vikash Mishra, Vikram Singh","Distributed Query Processing Plans generation using Teacher Learner
  Based Optimization","12 pages","International Journal of Information Processing,9(4),
  46-60,2015,ISSN : 0973-8215",,,"cs.DB","http://arxiv.org/licenses/nonexclusive-distrib/1.0/","  With the growing popularity, the number of data sources and the amount of
data has been growing very fast in recent years. The distribution of
operational data on disperse data sources impose a challenge on processing user
queries. In such database systems, the database relations required by a query
to answer may be stored at multiple sites. This leads to an exponential
increase in the number of possible equivalent or alternatives of a user query.
Though it is not computationally reasonable to explore exhaustively all
possible query plans in a large search space, thus a strategy is requisite to
produce optimal query plans in distributed database systems. The query plan
with most cost-effective option for query processing is measured necessary and
must be generated for a given query. This paper attempts to generate such
optimal query plans using a parameter less optimization technique
Teaching-Learner Based Optimization(TLBO). The TLBO algorithm was experiential
to go one better than the other optimization algorithms for the multi objective
unconstrained and constrained benchmark problems. Experimental comparisons of
TLBO based optimal plan generation with the multiobjective genetic algorithm
based distributed query plan generation algorithm shows that for higher number
of relations, the TLBO based algorithm is able to generate comparatively better
quality Top K query plans.
","[{""version"":""v1"",""created"":""Sun, 14 Feb 2016 08:44:29 GMT""}]","2016-02-16"
"1602.04432","Andre Nies","Andre Nies","Logic Blog 2015f",,,,,"math.LO","http://arxiv.org/licenses/nonexclusive-distrib/1.0/","  The 2015 Logic Blog contains a large variety of results connected to logic,
some of them unlikely to be submitted to a journal. For the first time there is
a group theory part. There are results in higher randomness, and in computable
ergodic theory.
","[{""version"":""v1"",""created"":""Sun, 14 Feb 2016 09:25:35 GMT""}]","2016-02-16"
"1602.04433","Mingsheng Long","Mingsheng Long, Han Zhu, Jianmin Wang, Michael I. Jordan","Unsupervised Domain Adaptation with Residual Transfer Networks","30th Conference on Neural Information Processing Systems (NIPS 2016),
  Barcelona, Spain",,,,"cs.LG","http://arxiv.org/licenses/nonexclusive-distrib/1.0/","  The recent success of deep neural networks relies on massive amounts of
labeled data. For a target task where labeled data is unavailable, domain
adaptation can transfer a learner from a different source domain. In this
paper, we propose a new approach to domain adaptation in deep networks that can
jointly learn adaptive classifiers and transferable features from labeled data
in the source domain and unlabeled data in the target domain. We relax a
shared-classifier assumption made by previous methods and assume that the
source classifier and target classifier differ by a residual function. We
enable classifier adaptation by plugging several layers into deep network to
explicitly learn the residual function with reference to the target classifier.
We fuse features of multiple layers with tensor product and embed them into
reproducing kernel Hilbert spaces to match distributions for feature
adaptation. The adaptation can be achieved in most feed-forward models by
extending them with new residual layers and loss functions, which can be
trained efficiently via back-propagation. Empirical evidence shows that the new
approach outperforms state of the art methods on standard domain adaptation
benchmarks.
","[{""version"":""v1"",""created"":""Sun, 14 Feb 2016 09:47:30 GMT""},{""version"":""v2"",""created"":""Thu, 16 Feb 2017 07:56:49 GMT""}]","2017-02-17"
"1602.04434","Andreas Loukas","Andreas Loukas and Damien Foucard","Frequency Analysis of Temporal Graph Signals","5 pages, 3 figures",,,,"cs.LG cs.SY stat.ML","http://arxiv.org/licenses/nonexclusive-distrib/1.0/","  This letter extends the concept of graph-frequency to graph signals that
evolve with time. Our goal is to generalize and, in fact, unify the familiar
concepts from time- and graph-frequency analysis. To this end, we study a joint
temporal and graph Fourier transform (JFT) and demonstrate its attractive
properties. We build on our results to create filters which act on the joint
(temporal and graph) frequency domain, and show how these can be used to
perform interference cancellation. The proposed algorithms are distributed,
have linear complexity, and can approximate any desired joint filtering
objective.
","[{""version"":""v1"",""created"":""Sun, 14 Feb 2016 09:48:56 GMT""}]","2016-02-17"
"1602.04435","Denis Sidorov","A. Zhukov, D. Sidorov and A. Foley","Random Forest Based Approach for Concept Drift Handling",,,,,"cs.AI cs.LG math.ST stat.TH","http://arxiv.org/licenses/nonexclusive-distrib/1.0/","  Concept drift has potential in smart grid analysis because the socio-economic
behaviour of consumers is not governed by the laws of physics. Likewise there
are also applications in wind power forecasting. In this paper we present
decision tree ensemble classification method based on the Random Forest
algorithm for concept drift. The weighted majority voting ensemble aggregation
rule is employed based on the ideas of Accuracy Weighted Ensemble (AWE) method.
Base learner weight in our case is computed for each sample evaluation using
base learners accuracy and intrinsic proximity measure of Random Forest. Our
algorithm exploits both temporal weighting of samples and ensemble pruning as a
forgetting strategy. We present results of empirical comparison of our method
with original random forest with incorporated ""replace-the-looser"" forgetting
andother state-of-the-art concept-drfit classifiers like AWE2.
","[{""version"":""v1"",""created"":""Sun, 14 Feb 2016 09:58:39 GMT""}]","2016-02-16"
"1602.04436","Andreas Loukas","Elvin Isufi and Andreas Loukas and Andrea Simonetto and Geert Leus","Autoregressive Moving Average Graph Filtering",,"IEEE Transactions on Signal Processing, vol. 67 (2), pages 274 -
  288, 2017","10.1109/TSP.2016.2614793",,"cs.LG cs.SY stat.ML","http://arxiv.org/licenses/nonexclusive-distrib/1.0/","  One of the cornerstones of the field of signal processing on graphs are graph
filters, direct analogues of classical filters, but intended for signals
defined on graphs. This work brings forth new insights on the distributed graph
filtering problem. We design a family of autoregressive moving average (ARMA)
recursions, which (i) are able to approximate any desired graph frequency
response, and (ii) give exact solutions for tasks such as graph signal
denoising and interpolation. The design philosophy, which allows us to design
the ARMA coefficients independently from the underlying graph, renders the ARMA
graph filters suitable in static and, particularly, time-varying settings. The
latter occur when the graph signal and/or graph are changing over time. We show
that in case of a time-varying graph signal our approach extends naturally to a
two-dimensional filter, operating concurrently in the graph and regular time
domains. We also derive sufficient conditions for filter stability when the
graph and signal are time-varying. The analytical and numerical results
presented in this paper illustrate that ARMA graph filters are practically
appealing for static and time-varying settings, as predicted by theoretical
derivations.
","[{""version"":""v1"",""created"":""Sun, 14 Feb 2016 10:14:54 GMT""},{""version"":""v2"",""created"":""Wed, 21 Sep 2016 14:34:07 GMT""}]","2017-09-18"
