"1602.04217","Derek Thompson","Sivaram K. Narayan, Daniel Sievewright, Derek Thompson","Complex Symmetric Composition Operators on $H^2$","8 pages",,"10.1016/j.jmaa.2016.05.046",,"math.CV math.FA","http://arxiv.org/licenses/nonexclusive-distrib/1.0/","  In this paper, we find complex symmetric composition operators on the
classical Hardy space whose symbols are linear-fractional but not automorphic.
In doing so, we answer a recent question of Noor, and partially answer the
original problem posed by Garcia and Hammond.
","[{""version"":""v1"",""created"":""Sun, 14 Feb 2016 01:16:46 GMT""}]","2017-05-17"
"1602.04218","Derek Thompson","Mahsa Fatehi, Mahmood Haji Shaabani, Derek Thompson","Quasinormal and hyponormal weighted composition operators on $H^2$ and
  $A^2_{\alpha}$ with linear fractional compositional symbol","11 pages",,"10.1007/s11785-017-0683-3",,"math.FA math.CV","http://arxiv.org/licenses/nonexclusive-distrib/1.0/","  In this paper, we study quasinormal and hyponormal composition operators \W
with linear fractional compositional symbol $\ph$ on the Hardy and weighted
Bergman spaces. We characterize the quasinormal composition operators induced
on $H^{2}$ and $A_{\alpha}^{2}$ by these maps and many such weighted
composition operators, showing that they are necessarily normal in all known
cases. We eliminate several possibilities for hyponormal weighted composition
operators but also give new examples of hyponormal weighted composition
operators on $H^2$ which are not quasinormal.
","[{""version"":""v1"",""created"":""Sun, 14 Feb 2016 01:16:27 GMT""}]","2017-05-17"
"1602.04351","Shaohui Wang","Shaohui Wang, Bing Wei","Multiplicative Zagreb indices of k-trees",,"Discrete Applied Mathematics, 180 (2015), 168-175",,,"math.CO","http://arxiv.org/licenses/nonexclusive-distrib/1.0/","  Let G be a graph with vertex set V (G) and edge set E(G). The first
generalized multiplicative Zagreb index of G is M_1(G) and the second
multiplicative Zagreb index is M_2(G). The multiplicative Zagreb indices have
been the focus of considerable research in computational chemistry dating back
to Narumi and Katayama in 1980s. In this paper, we generalize Narumi-Katayama
index and the first multiplicative index, where c = 1, 2, respectively, and
extend the results of Gutman to the generalized tree, the k-tree, where the
results of Gutman are for k = 1. Additionally, we characterize the extremal
graphs and determine the exact bounds of these indices of k-trees, which attain
the lower and upper bounds.
","[{""version"":""v1"",""created"":""Sat, 13 Feb 2016 16:15:34 GMT""}]","2016-02-16"
"1602.04352","Stephanie Rend\'on de la Torre","Stephanie Rend\'on de la Torre, Jaan Kalda, Robert Kitt, J\""uri
  Engelbrecht","On the topologic structure of economic complex networks: Empirical
  evidence from large scale payment network of Estonia","Chaos, Solitons and Fractals: the interdisciplinary journal of
  Nonlinear Science, and Nonequilibrium and Complex Phenomena, 2016",,"10.1016/j.chaos.2016.01.018",,"physics.soc-ph q-fin.GN","http://arxiv.org/licenses/nonexclusive-distrib/1.0/","  This paper presents the first topological analysis of the economic structure
of an entire country based on payments data obtained from Swedbank. This data
set is exclusive in its kind because around 80% of Estonia's bank transactions
are done through Swedbank, hence, the economic structure of the country can be
reconstructed. Scale-free networks are commonly observed in a wide array of
different contexts such as nature and society. In this paper, the nodes are
comprised by customers of the bank (legal entities) and the links are
established by payments between these nodes. We study the scaling-free and
structural properties of this network. We also describe its topology,
components and behaviors. We show that this network shares typical structural
characteristics known in other complex networks: degree distributions follow a
power law, low clustering coefficient and low average shortest path length. We
identify the key nodes of the network and perform simulations of resiliency
against random and targeted attacks of the nodes with two different approaches.
With this, we find that by identifying and studying the links between the nodes
is possible to perform vulnerability analysis of the Estonian economy with
respect to economic shocks.
","[{""version"":""v1"",""created"":""Sat, 13 Feb 2016 16:20:33 GMT""}]","2016-02-20"
"1602.04353","Michael Pinsker","Libor Barto, Michael Pinsker","The algebraic dichotomy conjecture for infinite domain Constraint
  Satisfaction Problems","15 pages",,,,"cs.LO cs.CC math.LO","http://arxiv.org/licenses/nonexclusive-distrib/1.0/","  We prove that an $\omega$-categorical core structure primitively positively
interprets all finite structures with parameters if and only if some stabilizer
of its polymorphism clone has a homomorphism to the clone of projections, and
that this happens if and only if its polymorphism clone does not contain
operations $\alpha$, $\beta$, $s$ satisfying the identity $\alpha
s(x,y,x,z,y,z) \approx \beta s(y,x,z,x,z,y)$.
  This establishes an algebraic criterion equivalent to the conjectured
borderline between P and NP-complete CSPs over reducts of finitely bounded
homogenous structures, and accomplishes one of the steps of a proposed strategy
for reducing the infinite domain CSP dichotomy conjecture to the finite case.
  Our theorem is also of independent mathematical interest, characterizing a
topological property of any $\omega$-categorical core structure (the existence
of a continuous homomorphism of a stabilizer of its polymorphism clone to the
projections) in purely algebraic terms (the failure of an identity as above).
","[{""version"":""v1"",""created"":""Sat, 13 Feb 2016 16:38:37 GMT""}]","2016-02-16"
"1602.04354","Dieter Degrijse","Dieter Degrijse, Juan Souto","Dimension invariants of outer automorphism groups","24 pages",,,"CPH-SYM-DNRF92","math.GR math.AT math.GT","http://arxiv.org/licenses/nonexclusive-distrib/1.0/","  The geometric dimension for proper actions $\underline{\mathrm{gd}}(G)$ of a
group $G$ is the minimal dimension of a classifying space for proper actions
$\underline{E}G$. We construct for every integer $r\geq 1$, an example of a
virtually torsion-free Gromov-hyperbolic group $G$ such that for every group
$\Gamma$ which contains $G$ as a finite index normal subgroup, the virtual
cohomological dimension $\mathrm{vcd}(\Gamma)$ of $\Gamma $ equals
$\underline{\mathrm{gd}}(\Gamma)$ but such that the outer automorphism group
$\mathrm{Out}(G)$ is virtually torsion-free, admits a cocompact model for
$\underline E\mathrm{Out}(G)$ but nonetheless has
$\mathrm{vcd}(\mathrm{Out}(G))\le\underline{\mathrm{gd}}(\mathrm{Out}(G))-r$.
","[{""version"":""v1"",""created"":""Sat, 13 Feb 2016 16:53:57 GMT""}]","2016-02-16"
"1602.04355","Jinhua Zhang","Christian Bonatti and Jinhua Zhang","Transverse foliations on the torus $\T^2$ and partially hyperbolic
  diffeomorphisms on 3-manifolds","34 pages, 7 figures",,,,"math.DS","http://arxiv.org/licenses/nonexclusive-distrib/1.0/","  In this paper, we prove that given two $C^1$ foliations $\mathcal{F}$ and
$\mathcal{G}$ on $\mathbb{T}^2$ which are transverse, there exists a non-null
homotopic loop $\{\Phi_t\}_{t\in[0,1]}$ in $\diff^{1}(\T^2)$ such that
$\Phi_t(\calF)\pitchfork \calG$ for every $t\in[0,1]$, and $\Phi_0=\Phi_1= Id$.
As a direct consequence, we get a general process for building new partially
hyperbolic diffeomorphisms on closed $3$-manifolds. \cite{BPP} built a new
example of dynamically coherent non-transitive partially hyperbolic
diffeomorphism on a closed $3$-manifold, the example in \cite{BPP} is obtained
by composing the time $t$ map, $t>0$ large enough, of a very specific
non-transitive Anosov flow by a Dehn twist along a transverse torus. Our result
shows that the same construction holds starting with any non-transitive Anosov
flow on an oriented $3$-manifold. Moreover, for a given transverse torus, our
result explains which type of Dehn twists lead to partially hyperbolic
diffeomorphisms.
","[{""version"":""v1"",""created"":""Sat, 13 Feb 2016 16:56:24 GMT""}]","2016-02-16"
"1602.04356","Nickolai Bobrov","I. K. Yanson, V. V. Fisun, N. L. Bobrov, and L. F. Rybal'chenko","Reabsorption of nonequilibrium phonons at superconducting point contacts","4 pages, 3 figures","already published: Pis'ma Zh. Eksp. Teor. Fiz.45, No. 9, 425
  (1987); JETP Lett., 45, No. 9, 543 (1987)",,,"cond-mat.supr-con","http://arxiv.org/licenses/nonexclusive-distrib/1.0/","  When there is a deviation from the inequality $d\ll {{l}_{\varepsilon }}$
($d$ is the contact diameter, and ${{l}_{\varepsilon }}$ is the energy
relaxation length of the electrons), structural features are produced on the
current-voltage characteristics of $S-c-N$ contacts at characteristic phonon
energies because of the decrease in $\Delta $ due to the accumulation of
nonequilibrium phonons with low group velocities near the contact.
","[{""version"":""v1"",""created"":""Sat, 13 Feb 2016 17:15:18 GMT""}]","2016-02-16"
"1602.04357","Oliver K\""uhn","A. A. Ahmed, S. Thiele-Bruhn, P. Leinweber, O. K\""uhn","Towards a Molecular Level Understanding of the Sulfanilamide-Soil
  Organic Matter-Interaction",,"Science of the Total Environment 559, 347 (2016)","10.1016/j.scitotenv.2016.03.136",,"physics.chem-ph","http://arxiv.org/licenses/nonexclusive-distrib/1.0/","  In-depth understanding of the sorption mechanisms of organic pollutants, like
the antibiotic sulfanilamide (SAA), in soil requires a combined experimental
and theoretical approach. Therefore, sorption experiments of SAA on
well-characterized samples of soil size-fractions were combined with the
modeling of SAA-soil-interaction via quantum chemical calculations. Freundlich
unit capacities were determined in batch experiments and it was found that they
increase with the soil organic matter (SOM) content according to the order fine
silt > medium silt > clay > whole soil > coarse silt > sand. The calculated
binding energies for mass-spectrometrically quantified sorption sites followed
the order ionic species > peptides > carbohydrates > phenols and lignin
monomers > lignin dimers > heterocyclic compounds > fatty acids > sterols >
aromatic compounds > lipids, alkanes, and alkenes. SAA forms H-bonds through
its different polar centers with polar SOM sorption sites. In contrast
dispersion and {\pi}-{\pi}-interactions predominate the interaction of the
sulfonamide aromatic ring with the non-polar moieties of SOM. Moreover, the
dipole moment, partial atomic charges, and molecular volume of the SOM sorption
sites are the main physical properties controlling the SAA-SOM-interaction. The
correlation between experimental and theoretical results was established by
reasonable estimates of the Freundlich unit capacities from the calculated
binding energies. Consequently, we suggest using this approach in forthcoming
studies to disclose the interactions of a wide range of organic pollutants with
SOM.
","[{""version"":""v1"",""created"":""Sat, 13 Feb 2016 17:16:42 GMT""}]","2016-05-12"
"1602.04358","Leonid Gugel","Leonid Gugel, Yoel Shkolnisky, Shai Dekel","Machine olfaction using time scattering of sensor multiresolution graphs",,,,,"cs.AI cs.DS stat.ML","http://arxiv.org/licenses/nonexclusive-distrib/1.0/","  In this paper we construct a learning architecture for high dimensional time
series sampled by sensor arrangements. Using a redundant wavelet decomposition
on a graph constructed over the sensor locations, our algorithm is able to
construct discriminative features that exploit the mutual information between
the sensors. The algorithm then applies scattering networks to the time series
graphs to create the feature space. We demonstrate our method on a machine
olfaction problem, where one needs to classify the gas type and the location
where it originates from data sampled by an array of sensors. Our experimental
results clearly demonstrate that our method outperforms classical machine
learning techniques used in previous studies.
","[{""version"":""v1"",""created"":""Sat, 13 Feb 2016 17:25:03 GMT""}]","2016-02-16"
"1602.04359","James J.Y. Zhao","Brian Y. Sun and James J.Y. Zhao","Log-behavior of two sequences related to the elliptic integrals","15 pages",,,,"math.CO","http://arxiv.org/licenses/nonexclusive-distrib/1.0/","  Two interesting sequences arose in the study of the series expansions of the
complete elliptic integrals, which are called the Catalan-Larcombe-French
sequence $\{P_n\}_{n\geq 0}$ and the Fennessey-Larcombe-French sequence
$\{V_n\}_{n\geq 0}$ respectively. In this paper, we prove the log-convexity of
$\{V_n^2-V_{n-1}V_{n+1}\}_{n\geq 2}$ and $\{n!V_n\}_{n\geq 1}$, the ratio
log-concavity of $\{P_n\}_{n\geq 0}$ and the sequence $\{A_n\}_{n\geq 0}$ of
Ap\'{e}ry numbers, and the ratio log-convexity of $\{V_n\}_{n\geq 1}$.
","[{""version"":""v1"",""created"":""Sat, 13 Feb 2016 17:28:51 GMT""},{""version"":""v2"",""created"":""Mon, 1 Aug 2016 09:29:37 GMT""},{""version"":""v3"",""created"":""Thu, 6 Apr 2017 13:32:26 GMT""},{""version"":""v4"",""created"":""Mon, 10 Apr 2017 17:35:42 GMT""}]","2017-04-11"
"1602.04360","Juergen Hausen","Anne Fahrner, Juergen Hausen, Michele Nicolussi","Smooth projective varieties with a torus action of complexity 1 and
  Picard number 2","31 pages, new results added",,,,"math.AG","http://arxiv.org/licenses/nonexclusive-distrib/1.0/","  We give an explicit description of all smooth varieties with a torus action
of complexity one having Picard number at most two. As a consequence, we
classify in every dimension the smooth (almost) Fano varieties with a torus
action of complexity one having Picard number two. It turns out that all the
Fano examples are obtained via an iterated generalized cone construction from a
series of smooth varieties of dimension at most seven.
","[{""version"":""v1"",""created"":""Sat, 13 Feb 2016 17:47:26 GMT""},{""version"":""v2"",""created"":""Tue, 8 Mar 2016 10:10:08 GMT""},{""version"":""v3"",""created"":""Fri, 19 Aug 2016 10:30:00 GMT""}]","2016-08-22"
"1602.04361","Ilya Tolstikhin","Ilya Tolstikhin, Bharath Sriperumbudur and Krikamol Muandet","Minimax Estimation of Kernel Mean Embeddings",,,,,"math.ST stat.TH","http://arxiv.org/licenses/nonexclusive-distrib/1.0/","  In this paper, we study the minimax estimation of the Bochner integral
$$\mu_k(P):=\int_{\mathcal{X}} k(\cdot,x)\,dP(x),$$ also called as the kernel
mean embedding, based on random samples drawn i.i.d.~from $P$, where
$k:\mathcal{X}\times\mathcal{X}\rightarrow\mathbb{R}$ is a positive definite
kernel. Various estimators (including the empirical estimator),
$\hat{\theta}_n$ of $\mu_k(P)$ are studied in the literature wherein all of
them satisfy $\bigl\|
\hat{\theta}_n-\mu_k(P)\bigr\|_{\mathcal{H}_k}=O_P(n^{-1/2})$ with
$\mathcal{H}_k$ being the reproducing kernel Hilbert space induced by $k$. The
main contribution of the paper is in showing that the above mentioned rate of
$n^{-1/2}$ is minimax in $\|\cdot\|_{\mathcal{H}_k}$ and
$\|\cdot\|_{L^2(\mathbb{R}^d)}$-norms over the class of discrete measures and
the class of measures that has an infinitely differentiable density, with $k$
being a continuous translation-invariant kernel on $\mathbb{R}^d$. The
interesting aspect of this result is that the minimax rate is independent of
the smoothness of the kernel and the density of $P$ (if it exists). This result
has practical consequences in statistical applications as the mean embedding
has been widely employed in non-parametric hypothesis testing, density
estimation, causal inference and feature selection, through its relation to
energy distance (and distance covariance).
","[{""version"":""v1"",""created"":""Sat, 13 Feb 2016 17:53:48 GMT""},{""version"":""v2"",""created"":""Mon, 31 Jul 2017 19:37:03 GMT""}]","2017-08-02"
"1602.04362","Philip von Paris","P. von Paris, P. Gratier, P. Bord\'e, J. Leconte, F. Selsis","Inferring asymmetric limb cloudiness on exoplanets from transit light
  curves","accepted for publication in Astronomy&Astrophysics on Feb. 12th, 11
  pages, 20 figures, 2 tables, + Appendix",,"10.1051/0004-6361/201527894",,"astro-ph.EP","http://arxiv.org/licenses/nonexclusive-distrib/1.0/","  Clouds have been shown to be present in many exoplanetary atmospheres. Cloud
formation modeling predicts considerable inhomogeneities of cloud cover,
consistent with optical phase curve observations. However, optical phase curves
cannot resolve some existing degeneracies between cloud location and cloud
optical properties.
  We present a conceptually simple technique to detect inhomogeneous cloud
cover on exoplanets. Such an inhomogeneous cloud cover produces an asymmetric
primary transit of the planet in front of the host star. Asymmetric transits
produce characteristic residuals compared to a standard symmetric model.
Furthermore, bisector spans can be used to determine asymmetries in the transit
light curve.
  We apply a model of asymmetric transits to the light curves of HAT-P-7b,
Kepler-7b and HD209458b and search for possible cloud signatures. The nearly
uninterrupted Kepler photometry is particularly well-suited for this method
since it allows for a very high time resolution.
  We do not find any statistically sound cloud signature in the data of the
considered planets. For HAT-P-7b, a tentative detection of an asymmetric cloud
cover is found, consistent with analysis of the optical phase curve. Based on
Bayesian probability arguments, a symmetric model with an offset in the transit
ephemeris remains, however, the most viable model. Still, this work
demonstrates that for suitable targets, namely low-gravity planets around
bright stars, the method can be used to constrain cloud cover characteristics
and is thus a helpful additional tool to study exoplanetary atmospheres.
","[{""version"":""v1"",""created"":""Sat, 13 Feb 2016 18:22:01 GMT""}]","2016-04-27"
"1602.04363","Sumiyoshi Abe","Masayuki Hattori, Sumiyoshi Abe","Path probability of stochastic motion: A functional approach","19 pages, 2 figures","Physica A 451 (2016) 198-204","10.1016/j.physa.2016.01.053",,"cond-mat.stat-mech q-fin.GN quant-ph","http://arxiv.org/licenses/nonexclusive-distrib/1.0/","  The path probability of a particle undergoing stochastic motion is studied by
the use of functional technique, and the general formula is derived for the
path probability distribution functional. The probability of finding paths
inside a tube/band, the center of which is stipulated by a given path, is
analytically evaluated in a way analogous to continuous measurements in quantum
mechanics. Then, the formalism developed here is applied to the stochastic
dynamics of stock price in finance.
","[{""version"":""v1"",""created"":""Sat, 13 Feb 2016 18:22:55 GMT""}]","2016-02-16"
"1602.04364","Jimmy Ren","Jimmy Ren, Yongtao Hu, Yu-Wing Tai, Chuan Wang, Li Xu, Wenxiu Sun,
  Qiong Yan","Look, Listen and Learn - A Multimodal LSTM for Speaker Identification","The 30th AAAI Conference on Artificial Intelligence (AAAI-16)",,,,"cs.LG","http://arxiv.org/licenses/nonexclusive-distrib/1.0/","  Speaker identification refers to the task of localizing the face of a person
who has the same identity as the ongoing voice in a video. This task not only
requires collective perception over both visual and auditory signals, the
robustness to handle severe quality degradations and unconstrained content
variations are also indispensable. In this paper, we describe a novel
multimodal Long Short-Term Memory (LSTM) architecture which seamlessly unifies
both visual and auditory modalities from the beginning of each sequence input.
The key idea is to extend the conventional LSTM by not only sharing weights
across time steps, but also sharing weights across modalities. We show that
modeling the temporal dependency across face and voice can significantly
improve the robustness to content quality degradations and variations. We also
found that our multimodal LSTM is robustness to distractors, namely the
non-speaking identities. We applied our multimodal LSTM to The Big Bang Theory
dataset and showed that our system outperforms the state-of-the-art systems in
speaker identification with lower false alarm rate and higher recognition
accuracy.
","[{""version"":""v1"",""created"":""Sat, 13 Feb 2016 18:49:50 GMT""}]","2016-02-16"
"1602.04365","Christoph D\""urr","Christoph D\""urr, Zden\v{e}k Hanz\'alek, Christian Konrad, Yasmina
  Seddik, Ren\'e Sitters, \'Oscar C. V\'asquez, Gerhard Woeginger","The triangle scheduling problem",,,,,"cs.DS","http://arxiv.org/licenses/nonexclusive-distrib/1.0/","  This paper introduces a novel scheduling problem, where jobs occupy a
triangular shape on the time line. This problem is motivated by scheduling jobs
with different criticality levels. A measure is introduced, namely the binary
tree ratio. It is shown that the greedy algorithm solves the problem to
optimality when the binary tree ratio of the input instance is at most 2. We
also show that the problem is unary NP-hard for instances with binary tree
ratio strictly larger than 2, and provide a quasi polynomial time approximation
scheme (QPTAS). The approximation ratio of Greedy on general instances is shown
to be between 1.5 and 1.05.
","[{""version"":""v1"",""created"":""Sat, 13 Feb 2016 19:05:21 GMT""},{""version"":""v2"",""created"":""Mon, 25 Apr 2016 19:57:49 GMT""},{""version"":""v3"",""created"":""Sun, 1 May 2016 12:41:32 GMT""}]","2016-05-03"
"1602.04366","Wrick Sengupta","W.Sengupta, A.B. Hassam","Effective Mass in Rosenbluth-Hinton type zonal flows",,,,,"physics.plasm-ph","http://arxiv.org/licenses/nonexclusive-distrib/1.0/","  An initial radial electric field, $E_r(0)$, in an axisymmetric tokamak,
results in geodesic acoustic mode (GAM) oscillations. The GAMs Landau damp,
resulting in a much smaller final residual electric field, $E_r(\infty)$, and
accompanying parallel zonal flows (Rosenbluth and Hinton, 1998 PRL 80, 724,
hereafter RH). The phenomenon exhibits a large effective mass (inertia due to
flows), with an enhancement of order the well-known RH factor. In apparent
paradox, the final angular momentum in the RH parallel zonal flow is much
smaller than the angular momentum expected from the well-known rapid precession
of the trapped particle population in the final electric field. In addition, an
effective mass calculated naively based on the rapid trapped particle (TP)
precession is much larger than the RH factor. A drift kinetic calculation is
presented showing that the mathematical origin of the extra mass factor is a
shift, proportional to $E_r$, of the usual energy coordinates in phase space.
Importantly, this shift contributes to the effective mass even if the system is
linearized in $E_r$, and can be interpreted as a first order linear shift in
the Jacobian. Further, the Jacobian shift recovers the large TP precession flow
and also uncovers the presence of reverse circulating particle flows that, to
lowest order, are equal and opposite to the TP precession. A detailed
calculation is presented. Work supported by DOE.
","[{""version"":""v1"",""created"":""Sat, 13 Feb 2016 19:20:18 GMT""}]","2016-02-16"
"1602.04367","Shuo Sun","Shuo Sun and Edo Waks","Single-shot optical readout of a quantum bit using cavity quantum
  electrodynamics",,"Phys. Rev. A 94, 012307 (2016)","10.1103/PhysRevA.94.012307",,"quant-ph","http://arxiv.org/licenses/nonexclusive-distrib/1.0/","  We propose a method to perform single-shot optical readout of a quantum bit
(qubit) using cavity quantum electrodynamics. We selectively couple the optical
transitions associated with different qubit basis states to the cavity, and
utilize the change in cavity transmissivity to generate a qubit readout signal
composed of many photons. We show that this approach enables single-shot
optical readout even when the qubit does not have a good cycling transition
required for standard resonance fluorescence measurements. We calculate the
probability that the measurement detects the correct spin state using the
example of a quantum dot spin under various experimental conditions and
demonstrate that it can exceed 0.99.
","[{""version"":""v1"",""created"":""Sat, 13 Feb 2016 19:36:28 GMT""}]","2016-07-13"
"1602.04368","Bonnie Kirkpatrick","Bonnie Kirkpatrick","Fast Computation of the Kinship Coefficients",,,,,"cs.DS q-bio.PE","http://arxiv.org/licenses/nonexclusive-distrib/1.0/","  For families, kinship coefficients are quantifications of the amount of
genetic sharing between a pair of individuals. These coefficients are critical
for understanding the breeding habits and genetic diversity of diploid
populations. Historically, computations of the inbreeding coefficient were used
to prohibit inbred marriages and prohibit breeding of some pairs of pedigree
animals. Such prohibitions foster genetic diversity and help prevent recessive
Mendelian disease at a population level.
  This paper gives the fastest known algorithms for computing the kinship
coefficient of a set of individuals with a known pedigree. The algorithms given
here consider the possibility that the founders of the known pedigree may
themselves be inbred, and they compute the appropriate inbreeding-adjusted
kinship coefficients. The exact kinship algorithm has running-time $O(n^2)$ for
an $n$-individual pedigree. The recursive-cut exact kinship algorithm has
running time $O(s^2m)$ where $s$ is the number of individuals in the largest
segment of the pedigree and $m$ is the number of cuts. The approximate
algorithm has running-time $O(n)$ for an $n$-individual pedigree on which to
estimate the kinship coefficients of $\sqrt{n}$ individuals from $\sqrt{n}$
founder kinship coefficients.
","[{""version"":""v1"",""created"":""Sat, 13 Feb 2016 19:38:44 GMT""}]","2016-02-20"
