"1602.04385","Ossi Niemim\""aki","Ossi Niemim\""aki, Stefan Kurz, Lauri Kettunen","Structure-preserving mesh coupling based on the Buffa-Christiansen
  complex","17 pages, 7 figures. Some figures are omitted due to a restricted
  copyright. Full paper to appear in Mathematics of Computation",,,,"math.NA","http://arxiv.org/licenses/nonexclusive-distrib/1.0/","  The state of the art for mesh coupling at nonconforming interfaces is
presented and reviewed. Mesh coupling is frequently applied to the modeling and
simulation of motion in electromagnetic actuators and machines. The paper
exploits Whitney elements to present the main ideas. Both interpolation- and
projection-based methods are considered. In addition to accuracy and
efficiency, we emphasize the question whether the schemes preserve the
structure of the de Rham complex, which underlies Maxwell's equations. As a new
contribution, a structure-preserving projection method is presented, in which
Lagrange multiplier spaces are chosen from the Buffa-Christiansen complex. Its
performance is compared with a straightforward interpolation based on Whitney
and de Rham maps, and with Galerkin projection.
","[{""version"":""v1"",""created"":""Sat, 13 Feb 2016 21:38:25 GMT""}]","2016-02-16"
"1602.04386","Shivam Gandhi","Shivam Gandhi","Improvement of the Cascadic Multigrid Algorithm with a Gauss Seidel
  Smoother to Efficiently Compute the Fiedler Vector of a Graph Laplacian",,,,,"math.NA","http://arxiv.org/licenses/nonexclusive-distrib/1.0/","  In this paper, we detail the improvement of the Cascadic Multigrid algorithm
with the addition of the Gauss Seidel algorithm in order to compute the Fiedler
vector of a graph Laplacian, which is the eigenvector corresponding to the
second smallest eigenvalue. This vector has been found to have applications in
graph partitioning, particularly in the spectral clustering algorithm. The
algorithm is algebraic and employs heavy edge coarsening, which was developed
for the first cascadic multigrid algorithm. We present numerical tests that
test the algorithm against a variety of matrices of different size and
properties. We then test the algorithm on a range of square matrices with
uniform properties in order to prove the linear complexity of the algorithm.
","[{""version"":""v1"",""created"":""Sat, 13 Feb 2016 21:56:07 GMT""}]","2016-02-16"
"1602.04387","Luca Weihs","Preetam Nandy, Luca Weihs, and Mathias Drton","Large-Sample Theory for the Bergsma-Dassios Sign Covariance",,,,,"math.ST stat.TH","http://arxiv.org/licenses/nonexclusive-distrib/1.0/","  The Bergsma-Dassios sign covariance is a recently proposed extension of
Kendall's tau. In contrast to tau or also Spearman's rho, the new sign
covariance $\tau^*$ vanishes if and only if the two considered random variables
are independent. Specifically, this result has been shown for continuous as
well as discrete variables. We develop large-sample distribution theory for the
empirical version of $\tau^*$. In particular, we use theory for degenerate
U-statistics to derive asymptotic null distributions under independence and
demonstrate in simulations that the limiting distributions give useful
approximations.
","[{""version"":""v1"",""created"":""Sat, 13 Feb 2016 22:03:05 GMT""}]","2016-02-16"
"1602.04388","Federico Bambozzi","Federico Bambozzi","Theorems A and B for dagger quasi-Stein spaces",,,,,"math.AG","http://arxiv.org/licenses/nonexclusive-distrib/1.0/","  In this article we use the homological methods of the theory of quasi-abelian
categories and some results from functional analysis to prove Theorems A and B
for (a broad sub-class of) dagger quasi-Stein spaces. In particular we show how
to deduce these theorems from the vanishing, under certain hypothesis, of the
higher derived functors of the projective limit functor. Our strategy of the
proof generalizes and puts in a more formal framework the Kiehl's proof for
rigid quasi-Stein spaces.
","[{""version"":""v1"",""created"":""Sat, 13 Feb 2016 22:15:04 GMT""}]","2016-02-16"
"1602.04389","Kaustubh Rajwade","Kaustubh Rajwade, Jayanth Chennamangalam, Duncan Lorimer, Aris
  Karastergiou, Dan Werthimer, Andrew Siemion, David MacMahon, Jeff Cobb,
  Christopher Williams, Wes Armour","Commissioning of ALFABURST: initial tests and results","3 pages, 2 figures, To be published in Proceedings of the Fourteenth
  Marcel Grossmann Meeting on General Relativity, edited by Massimo Bianchi,
  Robert T Jantzen, Remo Ruffini, World Scientific, Singapore, 2016",,,,"astro-ph.IM","http://arxiv.org/licenses/nonexclusive-distrib/1.0/","  Fast Radio Bursts (FRBs) are apparently one-time, relatively bright radio
pulses that have been observed in recent years. The origin of FRBs is currently
unknown and many instruments are being built to detect more of these bursts to
better characterize their physical properties and identify the source
population. ALFABURST is one such instrument. ALFABURST takes advantage of the
7-beam Arecibo L-band Feed Array (ALFA) receiver on the 305-m Arecibo Radio
Telescope in Puerto Rico, to detect FRBs in real-time at L-band (1.4 GHz). We
present the results of recent on-sky tests and observations undertaken during
the commissioning phase of the instrument. ALFABURST is now available for
commensal observations with other ALFA projects.
","[{""version"":""v1"",""created"":""Sat, 13 Feb 2016 22:17:38 GMT""}]","2016-02-16"
"1602.04390","Alan Coley","Paul S. Wesson","A Machian definition of particle mass in higher-dimensional gravity","Paul S. Wesson passed away on September 16, 2015. This paper, his
  300th research paper, was submitted for publication before his death, and is
  posted here for posterity. A detailed obituary will be posted on the STM
  website in the near future",,,,"gr-qc","http://arxiv.org/licenses/nonexclusive-distrib/1.0/","  A new method involving the effective wave function is used to define the mass
of a particle in a standard five-dimensional extension of general relativity.
The mass is inversely proportional to the magnitude of the scalar field of the
extra dimension. Since the scalar field is global and depends on the
coordinates, this definition for the particle mass agrees with Machs Principle.
","[{""version"":""v1"",""created"":""Sat, 13 Feb 2016 22:19:30 GMT""}]","2016-02-16"
"1602.04391","Kinjal Basu","Kinjal Basu, Shaunak Chatterjee, Ankan Saha","Constrained Multi-Slot Optimization for Ranking Recommendations","12 Pages, 6 figures",,,,"stat.ML math.OC stat.AP","http://arxiv.org/licenses/nonexclusive-distrib/1.0/","  Ranking items to be recommended to users is one of the main problems in large
scale social media applications. This problem can be set up as a
multi-objective optimization problem to allow for trading off multiple,
potentially conflicting objectives (that are driven by those items) against
each other. Most previous approaches to this problem optimize for a single slot
without considering the interaction effect of these items on one another.
  In this paper, we develop a constrained multi-slot optimization formulation,
which allows for modeling interactions among the items on the different slots.
We characterize the solution in terms of problem parameters and identify
conditions under which an efficient solution is possible. The problem
formulation results in a quadratically constrained quadratic program (QCQP). We
provide an algorithm that gives us an efficient solution by relaxing the
constraints of the QCQP minimally. Through simulated experiments, we show the
benefits of modeling interactions in a multi-slot ranking context, and the
speed and accuracy of our QCQP approximate solver against other state of the
art methods.
","[{""version"":""v1"",""created"":""Sat, 13 Feb 2016 22:22:54 GMT""},{""version"":""v2"",""created"":""Tue, 16 May 2017 06:30:42 GMT""}]","2017-05-17"
"1602.04392","Jan de Gier","Luigi Cantini, Jan de Gier and Michael Wheeler","Matrix product and sum rule for Macdonald polynomials","11 pages, extended abstract submission to FPSAC",,,,"math.RT math-ph math.CO math.MP","http://arxiv.org/licenses/nonexclusive-distrib/1.0/","  We present a new, explicit sum formula for symmetric Macdonald polynomials
$P_\lambda$ and show that they can be written as a trace over a product of
(infinite dimensional) matrices. These matrices satisfy the
Zamolodchikov--Faddeev (ZF) algebra. We construct solutions of the ZF algebra
from a rank-reduced version of the Yang--Baxter algebra. As a corollary, we
find that the normalization of the stationary measure of the multi-species
asymmetric exclusion process is a Macdonald polynomial with all variables set
equal to one.
","[{""version"":""v1"",""created"":""Sat, 13 Feb 2016 22:25:28 GMT""}]","2016-02-16"
"1602.04393","Abhinav Maurya","Abhinav Maurya, Kenton Murray, Yandong Liu, Chris Dyer, William W.
  Cohen, Daniel B. Neill","Semantic Scan: Detecting Subtle, Spatially Localized Events in Text
  Streams","10 pages, 4 figures, KDD 2016 submission",,,,"cs.IR stat.ML","http://arxiv.org/licenses/nonexclusive-distrib/1.0/","  Early detection and precise characterization of emerging topics in text
streams can be highly useful in applications such as timely and targeted public
health interventions and discovering evolving regional business trends. Many
methods have been proposed for detecting emerging events in text streams using
topic modeling. However, these methods have numerous shortcomings that make
them unsuitable for rapid detection of locally emerging events on massive text
streams. In this paper, we describe Semantic Scan (SS) that has been developed
specifically to overcome these shortcomings in detecting new spatially compact
events in text streams.
  Semantic Scan integrates novel contrastive topic modeling with online
document assignment and principled likelihood ratio-based spatial scanning to
identify emerging events with unexpected patterns of keywords hidden in text
streams. This enables more timely and accurate detection and characterization
of anomalous, spatially localized emerging events. Semantic Scan does not
require manual intervention or labeled training data, and is robust to noise in
real-world text data since it identifies anomalous text patterns that occur in
a cluster of new documents rather than an anomaly in a single new document.
  We compare Semantic Scan to alternative state-of-the-art methods such as
Topics over Time, Online LDA, and Labeled LDA on two real-world tasks: (i) a
disease surveillance task monitoring free-text Emergency Department chief
complaints in Allegheny County, and (ii) an emerging business trend detection
task based on Yelp reviews. On both tasks, we find that Semantic Scan provides
significantly better event detection and characterization accuracy than
competing approaches, while providing up to an order of magnitude speedup.
","[{""version"":""v1"",""created"":""Sat, 13 Feb 2016 22:33:56 GMT""}]","2016-02-16"
"1602.04394","Dmitry Fedyanin","Dmitry Yu. Fedyanin and Mario Agio","Ultrabright single-photon source on diamond with electrical pumping","21 pages, 4 figures, 6 pages of Supplementary Information","New J. Phys. 18, 073012 (2016)","10.1088/1367-2630/18/7/073012",,"cond-mat.mes-hall physics.optics quant-ph","http://arxiv.org/licenses/nonexclusive-distrib/1.0/","  The recently demonstrated electroluminescence of color centers in diamond
makes them one of the best candidates for room temperature single-photon
sources. However, the reported emission rates are far off what can be achieved
by state-of-the-art electrically driven epitaxial quantum dots. Since the
electroluminescence mechanism has not yet been elucidated, it is not clear to
what extent the emission rate can be increased. Here we develop a theoretical
framework to study single-photon emission from color centers in diamond under
electrical pumping. The proposed model comprises electron and hole trapping and
releasing, transitions between the ground and excited states of the color
center as well as structural transformations of the center due to carrier
trapping. It provides the possibility to predict both the photon emission rate
and the wavelength of emitted photons. Self-consistent numerical simulations of
the single-photon emitting diode based on the proposed model show that the
photon emission rate can be as high as 100 kcounts s$^{-1}$ at standard
conditions. In contrast to most optoelectronic devices, the emission rate
steadily increases with the device temperature achieving of more than 100
Mcount s$^{-1}$ at 500 K, which is highly advantageous for practical
applications. These results demonstrate the potential of color centers in
diamond as electrically driven non-classical light emitters and provide a
foundation for the design and development of single-photon sources for optical
quantum computation and quantum communication networks operating at room and
higher temperatures.
","[{""version"":""v1"",""created"":""Sat, 13 Feb 2016 22:36:03 GMT""}]","2019-04-29"
"1602.04395","Yen Chin Ong","Yen Chin Ong","Black Hole: The Interior Spacetime","Proceedings for the 2nd LeCosPA Symposium: ""Everything about Gravity:
  Celebrating the Centenary of Einstein's General Relativity"", based on a talk
  given on 17 December 2015, Taipei",,"10.1142/9789813203952_0081",,"gr-qc hep-th","http://arxiv.org/licenses/nonexclusive-distrib/1.0/","  The information loss paradox is often discussed from the perspective of the
observers who stay outside of a black hole. However, the interior spacetime of
a black hole can be rather nontrivial. We discuss the open problems regarding
the volume of a black hole, and whether it plays any role in information
storage. We also emphasize the importance of resolving the black hole
singularity, if one were to resolve the information loss paradox.
","[{""version"":""v1"",""created"":""Sat, 13 Feb 2016 22:49:38 GMT""}]","2019-02-27"
"1602.04396","Yanjun Li","Yanjun Li, Kiryung Lee, Yoram Bresler","Optimal Sample Complexity for Stable Matrix Recovery","42 pages",,,,"cs.IT math.IT","http://arxiv.org/licenses/nonexclusive-distrib/1.0/","  Tremendous efforts have been made to study the theoretical and algorithmic
aspects of sparse recovery and low-rank matrix recovery. This paper fills a
theoretical gap in matrix recovery: the optimal sample complexity for stable
recovery without constants or log factors. We treat sparsity, low-rankness, and
potentially other parsimonious structures within the same framework: constraint
sets that have small covering numbers or Minkowski dimensions. We consider
three types of random measurement matrices (unstructured, rank-1, and symmetric
rank-1 matrices), following probability distributions that satisfy some mild
conditions. In all these cases, we prove a fundamental result -- the recovery
of matrices with parsimonious structures, using an optimal (or near optimal)
number of measurements, is stable with high probability.
","[{""version"":""v1"",""created"":""Sat, 13 Feb 2016 22:51:42 GMT""},{""version"":""v2"",""created"":""Fri, 22 Dec 2017 20:02:56 GMT""}]","2018-01-03"
"1602.04397","Osvaldo Pablo Santillan","Ivo Alani, Osvaldo Santillan","Cosmological singularity theorems for $f(R)$ gravity theories","An improved version is published in JCAP 05 (2016) 023",,"10.1088/1475-7516/2016/05/023",,"gr-qc hep-th math-ph math.DG math.MP","http://arxiv.org/licenses/nonexclusive-distrib/1.0/","  In the present work some generalizations of the Hawking singularity theorems
in the context of $f(R)$ theories are presented. The assumptions are of these
generalized theorems is that the matter fields satisfy the conditions
$\bigg(T_{ij}-\frac{g_{ij}}{2} T\bigg)k^i k^j\geq 0$ for any generic unit time
like field, that the scalaron takes bounded positive values during its
evolution, and that the resulting space time is globally hyperbolic. Then, if
there exist a Cauchy hyper surface $\Sigma$ for which the expansion parameter
$\theta$ of the geodesic congruence emanating orthogonally from $\Sigma$
satisfies some specific conditions, it may be shown that the resulting space
time is geodesically incomplete. Some mathematical results of reference
\cite{fewster} are very important for proving this. The generalized theorems
presented here apply directly some specific models such as the Hu-Sawicki or
Starobinsky ones \cite{especif3}, \cite{capoziello4}. However, for other
scenarios, some extra assumptions should be implemented for the geodesic
incompleteness to take place. However, the negation of the hypothesis of these
results does not necessarily imply that a singularity is absent, but that other
mathematical results should be considered to prove that.
","[{""version"":""v1"",""created"":""Sat, 13 Feb 2016 23:02:45 GMT""},{""version"":""v2"",""created"":""Wed, 17 Feb 2016 02:39:58 GMT""},{""version"":""v3"",""created"":""Sun, 21 Feb 2016 04:24:02 GMT""},{""version"":""v4"",""created"":""Fri, 4 Mar 2016 21:49:42 GMT""},{""version"":""v5"",""created"":""Fri, 13 May 2016 04:06:02 GMT""}]","2016-05-25"
"1602.04398","Yanjun Li","Yanjun Li, Yoram Bresler","Joint Dimensionality Reduction for Two Feature Vectors","19 pages, 3 figures",,,,"stat.ML cs.IT cs.LG math.IT","http://arxiv.org/licenses/nonexclusive-distrib/1.0/","  Many machine learning problems, especially multi-modal learning problems,
have two sets of distinct features (e.g., image and text features in news story
classification, or neuroimaging data and neurocognitive data in cognitive
science research). This paper addresses the joint dimensionality reduction of
two feature vectors in supervised learning problems. In particular, we assume a
discriminative model where low-dimensional linear embeddings of the two feature
vectors are sufficient statistics for predicting a dependent variable. We show
that a simple algorithm involving singular value decomposition can accurately
estimate the embeddings provided that certain sample complexities are
satisfied, without specifying the nonlinear link function (regressor or
classifier). The main results establish sample complexities under multiple
settings. Sample complexities for different link functions only differ by
constant factors.
","[{""version"":""v1"",""created"":""Sat, 13 Feb 2016 23:11:56 GMT""},{""version"":""v2"",""created"":""Tue, 16 Feb 2016 06:01:05 GMT""},{""version"":""v3"",""created"":""Mon, 31 Oct 2016 16:57:32 GMT""}]","2016-11-01"
"1602.04399","Pablo P\'erez-Lantero","Gilberto Guti\'errez, Pablo P\'erez-Lantero and Claudio Torres","Linear Separability in Spatial Databases",,,,,"cs.DS","http://arxiv.org/licenses/nonexclusive-distrib/1.0/","  Given two point sets $R$ and $B$ in the plane, with cardinalities $m$ and
$n$, respectively, and each set stored in a separate R-tree, we present an
algorithm to decide whether $R$ and $B$ are linearly separable. Our algorithm
exploits the structure of the R-trees, loading into the main memory only
relevant data, and runs in $O(m\log m + n\log n)$ time in the worst case. As
experimental results, we implement the proposed algorithm and executed it on
several real and synthetic point sets, showing that the percentage of nodes of
the R-trees that are accessed and the memory usage are low in these cases. We
also present an algorithm to compute the convex hull of $n$ planar points given
in an R-tree, running in $O(n\log n)$ time in the worst case.
","[{""version"":""v1"",""created"":""Sat, 13 Feb 2016 23:12:25 GMT""}]","2016-02-16"
"1602.04400","Hulya Seferoglu","Ajita Singh and Yuxuan Xing and Hulya Seferoglu","Energy-Aware Cooperative Computation in Mobile Devices",,,,,"cs.NI","http://arxiv.org/licenses/nonexclusive-distrib/1.0/","  New data intensive applications, which are continuously emerging in daily
routines of mobile devices, significantly increase the demand for data, and
pose a challenge for current wireless networks due to scarce resources.
Although bandwidth is traditionally considered as the primary scarce resource
in wireless networks, the developments in communication theory shifts the focus
from bandwidth to other scarce resources including processing power and energy.
Especially, in device-to-device networks, where data rates are increasing
rapidly, processing power and energy are becoming the primary bottlenecks of
the network. Thus, it is crucial to develop new networking mechanisms by taking
into account the processing power and energy as bottlenecks. In this paper, we
develop an energy-aware cooperative computation framework for mobile devices.
In this setup, a group of cooperative mobile devices, within proximity of each
other, (i) use their cellular or Wi-Fi (802.11) links as their primary
networking interfaces, and (ii) exploit their device-to-device connections
(e.g., Wi-Fi Direct) to overcome processing power and energy bottlenecks. We
evaluate our energy-aware cooperative computation framework on a testbed
consisting of smartphones and tablets, and we show that it brings significant
performance benefits.
","[{""version"":""v1"",""created"":""Sat, 13 Feb 2016 23:16:00 GMT""}]","2016-02-16"
"1602.04401","Romana Grossova","Romana Grossov\'a","High Dispersion Spectroscopy with Ond\v{r}ejov Echelle Spectrograph",,,,,"astro-ph.IM","http://arxiv.org/licenses/nonexclusive-distrib/1.0/","  Echelle spectrographs with their high resolution plays important role in
determination of characteristics of stellar lines. Wide field of applications
is focused mainly on the measurements of precise radial velocity applied in
exoplanetary research. In my diploma thesis I am concentrated on the
calibration of the Ond\v{r}ejov Echelle Spectrograph at Astronomical Institute
of the Czech Academy of Sciences. My role was to investigate the wide field of
opportunities how to process the data with the best possible results.
Successful reduction was performed by both Image Reduction and Analysis
Facility (IRAF) and for Open source Pipeline for ESPaDOnS Reduction and
Analysis. This thesis includes the comparison of both pipelines.
","[{""version"":""v1"",""created"":""Sat, 13 Feb 2016 23:17:37 GMT""}]","2016-02-16"
"1602.04402","Xin Du","Xin Du and Peter Benner","Balanced Truncation of Linear Time-Invariant Systems over
  Finite-frequency Ranges","prepared to submit for International Journal of Control",,,,"cs.SY math.DS math.OC","http://arxiv.org/licenses/nonexclusive-distrib/1.0/","  This paper discusses model order reduction of LTI systems over limited
frequency intervals within the framework of balanced truncation. Two new
\emph{frequency-dependent balanced truncation} methods were developed, one is
\emph{SF-type frequency-dependent balanced truncation} to copy with the cases
that only a single dominating point of the operating frequency interval is
pre-known, the other is \emph{interval-type frequency-dependent balanced
truncation} to deal with the cases that both of the upper and lower bound of
frequency interval are known \emph{a priori}. SF-type error bound and
interval-type error bound are derived for the first time to estimate the
desired approximation error over pre-specified frequency interval. We show that
the new methods generally lead to good in-band approximation performance, at
the same time, provide accurate error bounds under certain conditions. Examples
are included for illustration.
","[{""version"":""v1"",""created"":""Sat, 13 Feb 2016 23:29:09 GMT""}]","2016-02-16"
"1602.04403","Maciej M. Maska","Damian Makiela and Maciej M. Maska","Spontaneous currents in a bosonic ring","6 pages, 3 figures","Acta Physica Polonica A 130, 569 (2016)","10.12693/APhysPolA.130.569",,"cond-mat.quant-gas","http://arxiv.org/licenses/nonexclusive-distrib/1.0/","  Nonequilibrium dynamics of noninteracting bosons in a one-dimensional
ring-shaped lattice is studied by means of the Kinetic Monte Carlo method. The
system is approximated by the classical XY model (the kinetic term is
neglected) and then the simulations are performed for the planar classical
spins. We study the dynamics that follows a finite-time quench to zero
temperature. If the quench is slow enough the system can equilibrate and
finally reaches the ground state with uniform spin alignment. However, we show
that if the quench is faster than the relaxation rate, the system can get
locked in a current-carrying metastable state characterized by a nonzero
winding number. We analyze how the zero-temperature state depends on the quench
rate.
","[{""version"":""v1"",""created"":""Sat, 13 Feb 2016 23:32:32 GMT""}]","2017-01-17"
