"1602.07023","Geoff Campbell Mr.","A. Brieussel, Y. Shen, G. Campbell, G. Guccione, J. Janousek, B. Hage,
  B. C. Buchler, N. Treps, C. Fabre, F. Z. Fang, X. Y. Li, T. Symul, P. K. Lam","Squeezed light from a diamond-turned monolithic cavity","15 pages, 10 figures","Opt. Express 24, 4042-4056 (2016)","10.1364/OE.24.004042",,"physics.optics quant-ph","http://arxiv.org/licenses/nonexclusive-distrib/1.0/","  For some crystalline materials, a regime can be found where continuous
ductile cutting is feasible. Using precision diamond turning, such materials
can be cut into complex optical components with high surface quality and form
accuracy. In this work we use diamond-turning to machine a monolithic,
square-shaped, doubly-resonant $LiNbO_3$ cavity with two flat and two convex
facets. When additional mild polishing is implemented, the Q-factor of the
resonator is found to be limited only by the material absorption loss. We show
how our monolithic square resonator may be operated as an optical parametric
oscillator that is evanescently coupled to free-space beams via birefringent
prisms. The prism arrangement allows for independent and large tuning of the
fundamental and second harmonic coupling rates. We measure $2.6\pm0.5$ dB of
vacuum squeezing at 1064 nm using our system. Potential improvements to obtain
higher degrees of squeezing are discussed.
","[{""version"":""v1"",""created"":""Tue, 23 Feb 2016 03:43:36 GMT""}]","2016-04-20"
"1602.07024","Sailik Sengupta","Sailik Sengupta, Satya Gautam Vadlamudi, Subbarao Kambhampati,
  Marthony Taguinod, Adam Doup\'e, Ziming Zhao, Gail-Joon Ahn","Moving Target Defense for Web Applications using Bayesian Stackelberg
  Games","9 pages, 4 figures",,,,"cs.CR cs.AI cs.GT cs.MA","http://arxiv.org/licenses/nonexclusive-distrib/1.0/","  The present complexity in designing web applications makes software security
a difficult goal to achieve. An attacker can explore a deployed service on the
web and attack at his/her own leisure. Moving Target Defense (MTD) in web
applications is an effective mechanism to nullify this advantage of their
reconnaissance but the framework demands a good switching strategy when
switching between multiple configurations for its web-stack. To address this
issue, we propose modeling of a real-world MTD web application as a repeated
Bayesian game. We then formulate an optimization problem that generates an
effective switching strategy while considering the cost of switching between
different web-stack configurations. To incorporate this model into a developed
MTD system, we develop an automated system for generating attack sets of Common
Vulnerabilities and Exposures (CVEs) for input attacker types with predefined
capabilities. Our framework obtains realistic reward values for the players
(defenders and attackers) in this game by using security domain expertise on
CVEs obtained from the National Vulnerability Database (NVD). We also address
the issue of prioritizing vulnerabilities that when fixed, improves the
security of the MTD system. Lastly, we demonstrate the robustness of our
proposed model by evaluating its performance when there is uncertainty about
input attacker information.
","[{""version"":""v1"",""created"":""Tue, 23 Feb 2016 03:44:16 GMT""},{""version"":""v2"",""created"":""Tue, 8 Nov 2016 18:20:38 GMT""},{""version"":""v3"",""created"":""Thu, 17 Nov 2016 01:04:59 GMT""}]","2016-11-18"
"1602.07025","Christopher Voll","Christopher Voll","Local functional equations for submodule zeta functions associated to
  nilpotent algebras of endomorphisms","28 pages, final version, to appear in Int. Math. Res. Not. IMRN",,,,"math.RA math.GR","http://arxiv.org/licenses/nonexclusive-distrib/1.0/","  We give a sufficient criterion for generic local functional equations for
submodule zeta functions associated to nilpotent algebras of endomorphisms
defined over number fields. This allows us, in particular, to prove various
conjectures on such functional equations for ideal zeta functions of nilpotent
Lie lattices. Via the Mal'cev correspondence, these results have corollaries
pertaining to zeta functions enumerating normal subgroups of finite index in
finitely generated nilpotent groups, most notably finitely generated free
nilpotent groups of any given class.
","[{""version"":""v1"",""created"":""Tue, 23 Feb 2016 03:54:17 GMT""},{""version"":""v2"",""created"":""Sun, 23 Jul 2017 21:27:51 GMT""}]","2017-07-25"
"1602.07026","Mehdi Salimi","Gunar Matthies, Mehdi Salimi, Somayeh Sharifi, Juan Luis Varona","An optimal three-point eighth-order iterative method without memory for
  solving nonlinear equations with its dynamics","arXiv admin note: substantial text overlap with arXiv:1508.01748",,,,"math.NA","http://arxiv.org/licenses/nonexclusive-distrib/1.0/","  We present a three-point iterative method without memory for solving
nonlinear equations in one variable. The proposed method provides convergence
order eight with four function evaluations per iteration. Hence, it possesses a
very high computational efficiency and supports Kung and Traub's conjecture.
The construction, the convergence analysis, and the numerical implementation of
the method will be presented. Using several test problems, the proposed method
will be compared with existing methods of convergence order eight concerning
accuracy and basin of attraction. Furthermore, some measures are used to judge
methods with respect to their performance in finding the basin of attraction.
","[{""version"":""v1"",""created"":""Tue, 23 Feb 2016 03:55:54 GMT""}]","2016-02-24"
"1602.07027","Na Wang doctoral candidate","Na Wang","Charmless $B_{c}$ $\to$ $PP$, $PV$ decays in the QCD factorization
  approach","25 pages, revtex4",,,,"hep-ph","http://creativecommons.org/licenses/by/4.0/","  The charmless $B_{c}$ $\to$ $PP$, $PV$~(where $P$ and $V$ denote the light
pseudoscalar and vector mesons, respectively) decays can occur only via the
weak annihilation diagrams within the Standard Model and provide, therefore, an
ideal place to probe the strength of annihilation contribution in hadronic
$B_{u,d,s}$ decays. In this paper, we study these kinds of decays in the
framework of QCD factorization, by adopting two different schemes: scheme I is
similar to the method usually adopted in the QCD factorization approach, while
scheme II is based on the infrared behavior of gluon propagator and running
coupling. For comparison, in our calculation, we adopt three kinds of wave
functions for $B_{c}$ meson. It is found that: (a) The predicted branching
ratios in scheme I are, however, quite small and are almost impossible to be
measured at the LHCb experiment. (b) In scheme II, by assigning a dynamical
gluon mass to the gluon propagator, we can avoid enhancements of the
contribution from soft endpoint region. The strength of annihilation
contributions predicted in scheme II is enhanced compared to that obtained in
scheme I. However, the predicted branching ratios are still smaller than the
corresponding ones obtained in the perturbative QCD approach. The large
discrepancies among these theoretical predictions indicate that more detailed
studies of these decays are urgently needed and will be tested by the future
measurements performed at the LHCb experiment.
","[{""version"":""v1"",""created"":""Tue, 23 Feb 2016 03:58:22 GMT""}]","2016-02-24"
"1602.07028","Andrew Mathas","Clinton Boys and Andrew Mathas","Quiver Hecke algebras for alternating groups","V2: Incorporating comments from referee. Latex. 40 pages",,,,"math.RT math.GR math.QA","http://arxiv.org/licenses/nonexclusive-distrib/1.0/","  The main result of this paper shows that, over large enough fields of
characteristic different from $2$, the alternating Hecke algebras are
$\mathbb{Z}$-graded algebras that are isomorphic to fixed-point subalgebras of
the quiver Hecke algebra of the symmetric group $\mathfrak{S}_n$. As a special
case, this shows that the group algebra of the alternating group, over large
enough fields of characteristic different from $2$, is a $\mathbb{Z}$-graded
algebra. We give a homogeneous presentation for these algebras, compute their
graded dimension and show that the blocks of the quiver Hecke algebras of the
alternating group are graded symmetric algebras.
","[{""version"":""v1"",""created"":""Tue, 23 Feb 2016 04:16:30 GMT""},{""version"":""v2"",""created"":""Fri, 5 Aug 2016 01:47:18 GMT""}]","2016-08-08"
"1602.07029","Siddharth Reddy","Siddharth Reddy, Igor Labutov, Thorsten Joachims","Latent Skill Embedding for Personalized Lesson Sequence Recommendation","Under review by the ACM SIGKDD Conference on Knowledge Discovery and
  Data Mining",,,,"cs.LG cs.AI cs.CY","http://arxiv.org/licenses/nonexclusive-distrib/1.0/","  Students in online courses generate large amounts of data that can be used to
personalize the learning process and improve quality of education. In this
paper, we present the Latent Skill Embedding (LSE), a probabilistic model of
students and educational content that can be used to recommend personalized
sequences of lessons with the goal of helping students prepare for specific
assessments. Akin to collaborative filtering for recommender systems, the
algorithm does not require students or content to be described by features, but
it learns a representation using access traces. We formulate this problem as a
regularized maximum-likelihood embedding of students, lessons, and assessments
from historical student-content interactions. An empirical evaluation on
large-scale data from Knewton, an adaptive learning technology company, shows
that this approach predicts assessment results competitively with benchmark
models and is able to discriminate between lesson sequences that lead to
mastery and failure.
","[{""version"":""v1"",""created"":""Tue, 23 Feb 2016 04:20:40 GMT""}]","2016-02-24"
"1602.07030","Ping Zhang","Fawei Zheng, Ping Zhang","Phonon Unfolding: A program for unfolding phonon dispersions of
  materials","7 pages, 3 figures. arXiv admin note: text overlap with
  arXiv:1403.0634",,"10.1016/j.cpc.2016.09.005",,"cond-mat.mtrl-sci cond-mat.mes-hall","http://arxiv.org/licenses/nonexclusive-distrib/1.0/","  We present Phonon Unfolding, a Fortran90 program for unfolding phonon
dispersions. It unfolds phonon dispersions by using a generalized projection
algorithm, which can be used to any kind of atomic systems in principle. Thus
our present program provides a very useful tool for the phonon dispersion and
vibration mode analysis of surface reconstructions, atomic point defects,
alloys and glasses.
","[{""version"":""v1"",""created"":""Tue, 23 Feb 2016 04:22:49 GMT""}]","2018-01-17"
"1602.07031","Mohammad Abu Alsheikh","Mohammad Abu Alsheikh, Dusit Niyato, Shaowei Lin, Hwee-Pink Tan, and
  Zhu Han","Mobile Big Data Analytics Using Deep Learning and Apache Spark",,"IEEE Network, vol. 30, no. 3, pp. 22-29, June 2016","10.1109/MNET.2016.7474340",,"cs.DC cs.LG cs.NE","http://arxiv.org/licenses/nonexclusive-distrib/1.0/","  The proliferation of mobile devices, such as smartphones and Internet of
Things (IoT) gadgets, results in the recent mobile big data (MBD) era.
Collecting MBD is unprofitable unless suitable analytics and learning methods
are utilized for extracting meaningful information and hidden patterns from
data. This article presents an overview and brief tutorial of deep learning in
MBD analytics and discusses a scalable learning framework over Apache Spark.
Specifically, a distributed deep learning is executed as an iterative MapReduce
computing on many Spark workers. Each Spark worker learns a partial deep model
on a partition of the overall MBD, and a master deep model is then built by
averaging the parameters of all partial models. This Spark-based framework
speeds up the learning of deep models consisting of many hidden layers and
millions of parameters. We use a context-aware activity recognition application
with a real-world dataset containing millions of samples to validate our
framework and assess its speedup effectiveness.
","[{""version"":""v1"",""created"":""Tue, 23 Feb 2016 04:32:02 GMT""}]","2016-08-16"
"1602.07032","Siddharth Reddy","Siddharth Reddy, Igor Labutov, Siddhartha Banerjee, Thorsten Joachims","Unbounded Human Learning: Optimal Scheduling for Spaced Repetition","Accepted to the ACM SIGKDD Conference on Knowledge Discovery and Data
  Mining 2016",,"10.1145/2939672.2939850",,"cs.AI cs.CY","http://arxiv.org/licenses/nonexclusive-distrib/1.0/","  In the study of human learning, there is broad evidence that our ability to
retain information improves with repeated exposure and decays with delay since
last exposure. This plays a crucial role in the design of educational software,
leading to a trade-off between teaching new material and reviewing what has
already been taught. A common way to balance this trade-off is spaced
repetition, which uses periodic review of content to improve long-term
retention. Though spaced repetition is widely used in practice, e.g., in
electronic flashcard software, there is little formal understanding of the
design of these systems. Our paper addresses this gap in three ways. First, we
mine log data from spaced repetition software to establish the functional
dependence of retention on reinforcement and delay. Second, we use this memory
model to develop a stochastic model for spaced repetition systems. We propose a
queueing network model of the Leitner system for reviewing flashcards, along
with a heuristic approximation that admits a tractable optimization problem for
review scheduling. Finally, we empirically evaluate our queueing model through
a Mechanical Turk experiment, verifying a key qualitative prediction of our
model: the existence of a sharp phase transition in learning outcomes upon
increasing the rate of new item introductions.
","[{""version"":""v1"",""created"":""Tue, 23 Feb 2016 04:33:05 GMT""},{""version"":""v2"",""created"":""Wed, 8 Jun 2016 02:22:16 GMT""}]","2016-06-09"
"1602.07033","Inom Mirzaev","Inom Mirzaev and David M. Bortz","A numerical framework for computing steady states of size-structured
  population models and their stability",,,,,"math.AP math.NA q-bio.PE","http://arxiv.org/licenses/nonexclusive-distrib/1.0/","  Structured population models are a class of general evolution equations which
are widely used in the study of biological systems. Many theoretical methods
are available for establishing existence and stability of steady states of
general evolution equations. However, except for very special cases, finding an
analytical form of stationary solutions for evolution equations is a
challenging task. In the present paper, we develop a numerical framework for
computing approximations to stationary solutions of general evolution
equations, which can also be used to produce existence and stability regions
for steady states. In particular, we use the Trotter-Kato Theorem to
approximate the infinitesimal generator of an evolution equation on a finite
dimensional space, which in turn reduces the evolution equation into a system
of ordinary differential equations. Consequently, we approximate and study the
asymptotic behavior of stationary solutions. We illustrate the convergence of
our numerical framework by applying it to a linear Sinko-Streifer structured
population model for which the exact form of the steady state is known. To
further illustrate the utility of our approach, we apply our framework to
nonlinear population balance equation, which is an extension of well-known
Smoluchowksi coagulation-fragmentation model to biological populations. We also
demonstrate that our numerical framework can be used to gain insight about the
theoretical stability of the stationary solutions of the evolution equations.
Furthermore, the open source Python program that we have developed for our
numerical simulations is freely available from our Github repository
(github.com/MathBioCU).
","[{""version"":""v1"",""created"":""Tue, 23 Feb 2016 04:37:18 GMT""}]","2016-02-24"
"1602.07035","Salah-Eddine Kabbaj","E. Houston, S. Kabbaj, A. Miomouni","Star-reductions of ideals and Prufer v-multiplication domains","9 pages. Journal of Commutative Algebra 2016",,,,"math.AC","http://arxiv.org/licenses/nonexclusive-distrib/1.0/","  Let R be a commutative ring and I an ideal of R. A sub-ideal J of I is a
reduction of I if JI^n = I^n+1 for some positive integer n. The ring R has the
(finite) basic ideal property if (finitely generated) ideals of R do not have
proper reductions. Hays characterized (one-dimensional) Prufer domains as
domains with the finite basic ideal property (basic ideal property). We extend
Hays' results to Prufer v-multiplication domains by replacing ""basic"" with
""w-basic,"" where w is a particular star operation. We also investigate
relations among star-basic properties for certain star operations.
","[{""version"":""v1"",""created"":""Tue, 23 Feb 2016 04:38:35 GMT""}]","2016-02-24"
"1602.07037","Kenji Yajima","Kenji Yajima","Remarks on $L^p$-boundedness of wave operators for Schr\""odinger
  operators with threshold singularities","58 pages",,,,"math-ph math.MP","http://arxiv.org/licenses/nonexclusive-distrib/1.0/","  We consider the continuity property in Lebesgue spaces $L^p(\R^m)$ of wave
operators $W_\pm$ of scattering theory for Schr\""odinger operator $H=-\lap + V$
on $\R^m$, $|V(x)|\leq C\ax^{-\delta}$ for some $\delta>2$ when $H$ is of
exceptional type, i.e. $\Ng=\{u \in \ax^{-s} L^2(\R^m) \colon (1+
(-\lap)^{-1}V)u=0 \}\not=\{0\}$ for some $1/2<s<\delta-1/2$. It has recently
been proved by Goldberg and Green for $m\geq 5$ that $W_\pm$ are bounded in
$L^p(\R^m)$ for $1\leq p<m/2$, the same holds for $1\leq p<m$ if all $\f\in
\Ng$ satisfy $\int_{\R^m} V\f dx=0$ and, for $1\leq p<\infty$ if in addition
$\int_{\R^m} x_i V\f dx=0$, $i=1, \dots, m$. We make the results for $p>m/2$
more precise and prove in particular that these conditions are also necessary
for the stated properties of $W_\pm$. We also prove that, for $m=3$, $W_\pm$
are bounded in $L^p(\R^3)$ for $1<p<3$ and that the same holds for $1<p<\infty$
if and only if all $\f\in \Ng$ satisfy $\int_{\R^3}V\f dx=0$ and $\int_{\R^3}
x_i V\f dx=0$, $i=1, 2, 3$, simultaneously.
","[{""version"":""v1"",""created"":""Tue, 23 Feb 2016 04:45:20 GMT""}]","2016-02-24"
"1602.07038","Barak Sober","Barak Sober, David Levin","Computer Aided Restoration of Handwritten Character Strokes","11 pages, 17 figures",,,,"cs.GR cs.CV math.NA","http://arxiv.org/licenses/nonexclusive-distrib/1.0/","  This work suggests a new variational approach to the task of computer aided
restoration of incomplete characters, residing in a highly noisy document. We
model character strokes as the movement of a pen with a varying radius.
Following this model, a cubic spline representation is being utilized to
perform gradient descent steps, while maintaining interpolation at some initial
(manually sampled) points. The proposed algorithm was utilized in the process
of restoring approximately 1000 ancient Hebrew characters (dating to ca.
8th-7th century BCE), some of which are presented herein and show that the
algorithm yields plausible results when applied on deteriorated documents.
","[{""version"":""v1"",""created"":""Tue, 23 Feb 2016 04:47:28 GMT""},{""version"":""v2"",""created"":""Wed, 6 Jul 2016 23:24:19 GMT""}]","2016-07-08"
"1602.07041","Salah-Eddine Kabbaj","S. Kabbaj, A. Kadri","t-Reductions and t-integral closure of ideals","13 pages. Rocky Mountain Journal of Mathematics 2016",,,,"math.AC","http://arxiv.org/licenses/nonexclusive-distrib/1.0/","  Let R be an integral domain and I a nonzero ideal of R. A sub-ideal J of I is
a t-reduction of I if (JI^{n})_{t}=(I^{n+1})_{t} for some positive integer n.
An element x in R is t-integral over I if there is an equation x^{n} +
a_{1}x^{n-1} +...+ a_{n-1}x + a_{n} = 0 with a_{i} in (I^{i})_{t} for I =
1,...,n. The set of all elements that are t-integral over I is called the
t-integral closure of I. This paper investigates the t-reductions and
t-integral closure of ideals. Our objective is to establish satisfactory
t-analogues of well-known results, in the literature, on the integral closure
of ideals and its correlation with reductions. Namely, Section 2 identifies
basic properties of t-reductions of ideals and features explicit examples
discriminating between the notions of reduction and t-reduction. Section 3
investigates the concept of t-integral closure of ideals, including its
correlation with t-reductions. Section 4 studies the persistence and
contraction of t-integral closure of ideals under ring homomorphisms. All along
the paper, the main results are illustrated with original examples.
","[{""version"":""v1"",""created"":""Tue, 23 Feb 2016 04:50:01 GMT""}]","2016-02-24"
"1602.07042","Rabeet  Singh Chauhan","Rabeet Singh Chauhan, Manoj K. Harbola","The Levy-Perdew-Sahni equation for the density: accurate effective
  potential and self-consistent solution for two-electron atomic systems","4 figures and 2 tables",,,,"physics.atom-ph physics.chem-ph","http://arxiv.org/licenses/nonexclusive-distrib/1.0/","  Levy-Perdew-Sahni (LPS) provided a proof of the connection between the
density and ionization potential of a many-electron system using the equation
for the density directly. This equation employs an effective potential which is
derived by LPS from the many-electron wavefunction of the system. In this
paper, we calculate this potential explicitly by employing an accurate
wavefunction for two-electron systems. With this wavefunction connection the
LPS equation is then solved self- consistently employing this potential and
shown to lead to accurate densities and chemical potentials for these systems.
","[{""version"":""v1"",""created"":""Tue, 23 Feb 2016 04:52:08 GMT""}]","2016-02-24"
"1602.07043","Suresh Venkatasubramanian","Philip Adler, Casey Falk, Sorelle A. Friedler, Gabriel Rybeck, Carlos
  Scheidegger, Brandon Smith and Suresh Venkatasubramanian","Auditing Black-box Models for Indirect Influence","Final version of paper that appears in the IEEE International
  Conference on Data Mining (ICDM), 2016",,,,"stat.ML cs.LG","http://arxiv.org/licenses/nonexclusive-distrib/1.0/","  Data-trained predictive models see widespread use, but for the most part they
are used as black boxes which output a prediction or score. It is therefore
hard to acquire a deeper understanding of model behavior, and in particular how
different features influence the model prediction. This is important when
interpreting the behavior of complex models, or asserting that certain
problematic attributes (like race or gender) are not unduly influencing
decisions.
  In this paper, we present a technique for auditing black-box models, which
lets us study the extent to which existing models take advantage of particular
features in the dataset, without knowing how the models work. Our work focuses
on the problem of indirect influence: how some features might indirectly
influence outcomes via other, related features. As a result, we can find
attribute influences even in cases where, upon further direct examination of
the model, the attribute is not referred to by the model at all.
  Our approach does not require the black-box model to be retrained. This is
important if (for example) the model is only accessible via an API, and
contrasts our work with other methods that investigate feature influence like
feature selection. We present experimental evidence for the effectiveness of
our procedure using a variety of publicly available datasets and models. We
also validate our procedure using techniques from interpretable learning and
feature selection, as well as against other black-box auditing procedures.
","[{""version"":""v1"",""created"":""Tue, 23 Feb 2016 04:52:28 GMT""},{""version"":""v2"",""created"":""Wed, 30 Nov 2016 06:55:16 GMT""}]","2016-12-01"
"1602.07045","Luisberis Velazquez-Abad","L. Velazquez and J.C. Castro-Palacio","Extended canonical Monte Carlo methods: Improving accuracy of
  microcanonical calculations using a re-weighting technique",,"Phys. Rev. E 91, 033308 (2015)","10.1103/PhysRevE.91.033308",,"cond-mat.stat-mech","http://arxiv.org/licenses/nonexclusive-distrib/1.0/","  Velazquez and Curilef have proposed a methodology to extend Monte Carlo
algorithms that are based on canonical ensemble. According to our previous
study, their proposal allows us to overcome slow sampling problems in systems
that undergo any type of temperature-driven phase transition. After a
comprehensive review about ideas and connections of this framework, we discuss
the application a re-weighting technique to improve the accuracy of
microcanonical calculations, specifically, the well-known multi-histograms
method of Ferrenberg and Swendsen. As example of application, we reconsider the
study of four-state Potts model on the square lattice $L\times L$ with periodic
boundary conditions. This analysis allows us to detect the existence of a very
small latent heat per site $q_{L}$ during the occurrence of temperature-driven
phase transition of this model, whose size dependence seems to follow a
power-law $q_{L}(L)\propto(1/L)^{z}$ with exponent $z\simeq0$.$26\pm0$.$02$. It
is discussed the compatibility of these results with the continuous character
of temperature-driven phase transition when $L\rightarrow+\infty$.
","[{""version"":""v1"",""created"":""Tue, 23 Feb 2016 04:55:27 GMT""}]","2016-02-24"
