"1602.07121","Tristan Cantat-Gaudin","T. Cantat-Gaudin, P. Donati, A. Vallenari, R. Sordo, A. Bragaglia, and
  L. Magrini","Abundances and kinematics for ten anticentre open clusters","17 pages, 9 figures; accepted for publication in A&A","A&A 588, A120 (2016)","10.1051/0004-6361/201628115",,"astro-ph.GA","http://arxiv.org/licenses/nonexclusive-distrib/1.0/","  Open clusters are distributed all across the disk and are convenient tracers
of its properties. In particular, outer disk clusters bear a key role for the
investigation of the chemical evolution of the Galactic disk. The goal of this
study is to derive homogeneous elemental abundances for a sample of ten outer
disk OCs, and investigate possible links with disk structures such as the
Galactic Anticenter Stellar Structure. We analyse high-resolution spectra of
red giants, obtained from the HIRES@Keck and UVES@VLT archives. We derive
elemental abundances and stellar atmosphere parameters by means of the
classical equivalent width method. We also performed orbit integrations using
proper motions. The Fe abundances we derive trace a shallow negative radial
metallicity gradient of slope -0.027+/-0.007 dex.kpc-1 in the outer 12 kpc of
the disk. The [alpha/Fe] gradient appears flat, with a slope of 0.006+/-0.007
dex.kpc-1 . The two outermost clusters (Be 29 and Sau 1) appear to follow
elliptical orbits. Be 20 also exhibits a peculiar orbit with a large excursion
above the plane. The irregular orbits of the three most metal-poor clusters (of
which two are located at the edge of the Galactic disk), if confirmed by more
robust astrometric measurements such as those of the Gaia mission, are
compatible with an inside-out formation scenario for the Milky Way, in which
extragalactic material is accreted onto the outer disk. We cannot determine if
Be 20, Be 29,and Sau 1 are of extragalactic origin, as they may be old genuine
Galactic clusters whose orbits were perturbed by accretion events or minor
mergers in the past 5 Gyr, or they may be representants of the thick disk
population. The nature of these objects is intriguing and deserves further
investigations in the near future.
","[{""version"":""v1"",""created"":""Tue, 23 Feb 2016 11:20:38 GMT""},{""version"":""v2"",""created"":""Wed, 24 Feb 2016 16:01:00 GMT""}]","2016-03-30"
"1602.07122","Jan Kunes","J. Kunes and D. Geffroy","Spontaneous Spin Textures in Multiorbital Mott Systems","the published version with Supplemental Material attached","Phys. Rev. Lett. 116, 256403 (2016)","10.1103/PhysRevLett.116.256403",,"cond-mat.str-el cond-mat.mtrl-sci","http://arxiv.org/licenses/nonexclusive-distrib/1.0/","  Spin textures in k-space arising from spin-orbit coupling in
non-centrosymmetric crystals find numerous applications in spintronics. We
present a mechanism that leads to appearance of k-space spin texture due to
spontaneous symmetry breaking driven by electronic correlations. Using
dynamical mean-field theory we show that doping a spin-triplet excitonic
insulator provides a means of creating new thermodynamic phases with unique
properties. The numerical results are interpreted using analytic calculations
within a generalized double-exchange framework.
","[{""version"":""v1"",""created"":""Tue, 23 Feb 2016 11:26:30 GMT""},{""version"":""v2"",""created"":""Wed, 24 Feb 2016 09:58:07 GMT""},{""version"":""v3"",""created"":""Thu, 23 Jun 2016 12:31:46 GMT""}]","2016-06-24"
"1602.07123","Dmitry Rokhlin B.","Dmitry B. Rokhlin and Anatoly Usov","Rational taxation in an open access fishery model","18 pages",,,,"math.OC","http://arxiv.org/licenses/nonexclusive-distrib/1.0/","  We consider a model of fishery management, where $n$ agents exploit a single
population with strictly concave continuously differentiable growth function of
Verhulst type. If the agent actions are coordinated and directed towards the
maximization of the discounted cooperative revenue, then the biomass stabilizes
at the level, defined by the well known ""golden rule"". We show that for
independent myopic harvesting agents such optimal (or $\varepsilon$-optimal)
cooperative behavior can be stimulated by the proportional tax, depending on
the resource stock, and equal to the marginal value function of the cooperative
problem. To implement this taxation scheme we prove that the mentioned value
function is strictly concave and continuously differentiable, although the
instantaneous individual revenues may be neither concave nor differentiable.
","[{""version"":""v1"",""created"":""Tue, 23 Feb 2016 11:30:33 GMT""}]","2016-02-24"
"1602.07124","Wojciech Pasek","Wojciech Julian Pasek","The Coulomb-interaction-induced breaking of the Aufbau principle for
  hole charging of InGaAs/GaAs quantum dots",,,"10.1088/0953-8984/28/48/485303",,"cond-mat.mes-hall","http://arxiv.org/licenses/nonexclusive-distrib/1.0/","  The so called ""incomplete hole shell filling"" phenomenon, that is the
breaking of the Aufbau principle was reported by D. Reuter et al., [Phys. Rev.
Lett. 94, 026808] in the hole charging spectra of quantum dot when results were
interpreted in context of s/p/d shell system - typical for electrons. We report
an example of inter-particle-interaction induced Aufbau principle violation
even if it is applied to one-particle Kohn-Luttinger eigenstates. We present a
k-dot-p/configuration-interaction study that concerns multiple holes confined
in InGaAs/GaAs self-assembled cylindrical quantum dot. Eigenenergies and
eigenvectors of up to six hole ground states were obtained - along with
corresponding one-hole orbital occupations - and discussed in context of the
Aufbau principle.
  PACS numbers: 73.21.La, 81.07.Ta, 71.70.Gm
","[{""version"":""v1"",""created"":""Tue, 23 Feb 2016 11:31:01 GMT""},{""version"":""v2"",""created"":""Fri, 26 Feb 2016 10:34:17 GMT""}]","2016-11-03"
"1602.07125","Heikki Huttunen","Heikki Huttunen and Fatemeh Shokrollahi Yancheshmeh and Ke Chen","Car Type Recognition with Deep Neural Networks","To appear in proceedings of IEEE Intelligent Vehicles Symposium 2016","In proceedings of IEEE Intelligent Vehicles Symposium 2016","10.1109/IVS.2016.7535529",,"cs.CV","http://arxiv.org/licenses/nonexclusive-distrib/1.0/","  In this paper we study automatic recognition of cars of four types: Bus,
Truck, Van and Small car. For this problem we consider two data driven
frameworks: a deep neural network and a support vector machine using SIFT
features. The accuracy of the methods is validated with a database of over 6500
images, and the resulting prediction accuracy is over 97 %. This clearly
exceeds the accuracies of earlier studies that use manually engineered feature
extraction pipelines.
","[{""version"":""v1"",""created"":""Tue, 23 Feb 2016 11:34:58 GMT""},{""version"":""v2"",""created"":""Fri, 22 Apr 2016 07:19:43 GMT""}]","2019-08-22"
"1602.07126","Bo Hellsing","H. Toren, L. Samuelsson and B. Hellsing","Model study of the electron-phonon coupling in graphene; relative
  importance of intraband and interband scattering","5 pages, 3 figures",,"10.1016/j.cplett.2016.08.019",,"cond-mat.mes-hall","http://arxiv.org/licenses/nonexclusive-distrib/1.0/","  The aim of this model study of the electron-phonon coupling in graphene was
to find out about the relative importance of the inter- and intraband
scattering and which phonon modes are the most active. This was achieved by
analyzing the electron-phonon matrix element of the carbon dimer in the unit
cell. We found that for the intra molecular orbital matrix elements the
longitudinal optical phonon mode is the active phonon mode. The matrix element
corresponding to sigma to sigma is greater than the matrix element for pi to pi
. The inter molecular orbital scattering pi to sigma is driven by the
out-of-plane acoustic phonon mode, while the out-of-plane optical mode does not
contribute for symmetry reasons. We found the unexpected result that the
magnitude of matrix element of the inter molecular orbital scattering pi to
sigmat exceeds the intra molecular orbital scattering pi to pi . These results
indicate that the in general not considered inter-band scattering has to be
taken into account when analyzing e.g. photo-hole lifetimes and the
electron-phonon coupling constant ?from photoemission data of graphene.
","[{""version"":""v1"",""created"":""Tue, 23 Feb 2016 11:41:26 GMT""}]","2016-09-21"
"1602.07127","Johannes Br\""auer","Johannes Br\""auer","Measuring Object-Oriented Design Principles","4 pages, 1 figure, Proceeding of the Doctoral Symposium at the 30th
  ACM/IEEE International Conference on Automated Software Engineering (ASE
  2015), Lincoln, Nebraska, USA, November 9-13, 2015",,"10.1109/ASE.2015.17",,"cs.SE","http://arxiv.org/licenses/nonexclusive-distrib/1.0/","  The idea of automatizing the assessment of objectoriented design is not new.
Different approaches define and apply their own quality models, which are
composed of single metrics or combinations thereof, to operationalize software
design. However, single metrics are too fine-grained to identify core design
flaws and they cannot provide hints for making design improvements. In order to
deal with these weaknesses of metric-based models, rules-based approaches have
proven successful in the realm of source-code quality. Moreover, for developing
a well-designed software system, design principles play a key role, as they
define fundamental guidelines and help to avoid pitfalls. Therefore, this
thesis will enhance and complete a rule-based quality reference model for
operationalizing design principles and will provide a measuring tool that
implements these rules. The validation of the design quality model and the
measurement tool will be based on various industrial projects. Additionally,
quantitative and qualitative surveys will be conducted in order to get
validated results on the value of object-oriented design principles for
software development
","[{""version"":""v1"",""created"":""Tue, 23 Feb 2016 11:49:07 GMT""}]","2016-02-24"
"1602.07128","Gabi Nakibly","Gabi Nakibly, Jaime Schcolnik, Yossi Rubin","Website-Targeted False Content Injection by Network Operators",,,,,"cs.CR","http://arxiv.org/licenses/nonexclusive-distrib/1.0/","  It is known that some network operators inject false content into users'
network traffic. Yet all previous works that investigate this practice focus on
edge ISPs (Internet Service Providers), namely, those that provide Internet
access to end users. Edge ISPs that inject false content affect their customers
only. However, in this work we show that not only edge ISPs may inject false
content, but also core network operators. These operators can potentially alter
the traffic of \emph{all} Internet users who visit predetermined websites. We
expose this practice by inspecting a large amount of traffic originating from
several networks. Our study is based on the observation that the forged traffic
is injected in an out-of-band manner: the network operators do not update the
network packets in-path, but rather send the forged packets \emph{without}
dropping the legitimate ones. This creates a race between the forged and the
legitimate packets as they arrive to the end user. This race can be identified
and analyzed. Our analysis shows that the main purpose of content injection is
to increase the network operators' revenue by inserting advertisements to
websites. Nonetheless, surprisingly, we have also observed numerous cases of
injected malicious content. We publish representative samples of the injections
to facilitate continued analysis of this practice by the security community.
","[{""version"":""v1"",""created"":""Tue, 23 Feb 2016 11:51:07 GMT""},{""version"":""v2"",""created"":""Mon, 29 Feb 2016 14:15:07 GMT""}]","2016-03-01"
"1602.07129","Shivani Sharma","Shivani Sharma, R. Rawat, N. P. Lalla","Structural and magnetic properties of S = 3/2 chemically disordered
  perovskite Sr2TiMnO6","this paper has been withdrawn due to minor error in the calculation
  of dielectric constant",,,,"cond-mat.mtrl-sci","http://arxiv.org/licenses/nonexclusive-distrib/1.0/","  Single phase polycrystalline sample of perovskite Sr2TiMnO6 (STMO) has been
successfully synthesized via solid state reaction route. Its detailed
structural and physical properties have been studied using x-ray diffraction,
transmission electron microscopy, magnetization, specific heat, and dielectric
measurements. Rietveld analysis of the powder XRD data and transmission
electron microscopy studies confirm that STMO is not a double perovskite
structure with Fm-3m space group. But it is a disordered perovskite structure
with Pm-3m space group where Ti4+ and Mn4+ ions are randomly distributed at the
1b site. The dc magnetization (\c{hi}dc-vs-T) measurements in the temperature
range 2-300K reveals a single anomaly at ~13K with predominant long range
canted antiferromagnetic (AFM) ordering. The frequency invariant maxima at 13K
in the ac susceptibility (\c{hi}ac-vs-T) discards the spin-glass behaviour in
STMO. Despite the presence of sharp feature in M-T data, the specific heat data
(Cp-vs-T) shows only a broad hump around 13K, which has been attributed to the
magneto-structural ordering giving rise to canted AFM state in chemically
disorder STMO. Matching with the magnetic and specific heat anomaly, the
dielectric permittivity also shows a broad anomaly around 14K, indicating the
possible magneto-dielectric coupling in STMO.
","[{""version"":""v1"",""created"":""Tue, 23 Feb 2016 11:52:35 GMT""},{""version"":""v2"",""created"":""Sat, 3 Sep 2016 09:45:22 GMT""}]","2016-09-06"
"1602.07130","Maram Akila","M. Akila, D. Waltner, B. Gutkin, T. Guhr","Particle-Time Duality in the Kicked Ising Chain I: The Dual Operator","14 pages, 5 figures",,"10.1088/1751-8113/49/37/375101",,"nlin.CD quant-ph","http://arxiv.org/licenses/nonexclusive-distrib/1.0/","  We demonstrate that the dynamics of kicked spin chains possess a remarkable
duality property. The trace of the unitary evolution operator for $N$ spins at
time $T$ is related to one of a non-unitary evolution operator for $T$ spins at
time $N$. We investigate the spectrum of this dual operator with a focus on the
different parameter regimes (chaotic, regular) of the spin chain. We present
applications of this duality relation to spectral statistics in an accompanying
paper.
","[{""version"":""v1"",""created"":""Tue, 23 Feb 2016 12:04:20 GMT""}]","2016-09-21"
"1602.07131","Sai Vinjanampathy","Masahito Hayashi, Sai Vinjanampathy and L. C. Kwek","Unattainable & attainable bounds for quantum sensors","9 pages, 2 figures",,,,"quant-ph","http://arxiv.org/licenses/nonexclusive-distrib/1.0/","  In quantum metrology, it is widely believed that the quantum Cramer-Rao bound
is attainable bound while it is not true. In order to clarify this point, we
explain why the quantum Cramer-Rao bound cannot be attained geometrically. In
this manuscript, we investigate noiseless channel estimation under energy
constraint for states, using a physically reasonable error function, and
present the optimal state and the attainable bound. We propose the experimental
generation of the optimal states for enhanced metrology using squeezing
transformations. This makes the estimation of unitary channels physically
implementable, while existing unitary estimation protocols do not work
","[{""version"":""v1"",""created"":""Tue, 23 Feb 2016 12:06:09 GMT""},{""version"":""v2"",""created"":""Fri, 24 Jun 2016 11:31:59 GMT""}]","2016-06-27"
"1602.07132","Ilya Ponomarenko","Ilia Ponomarenko and Andrey Vasil'ev","Cartan coherent configurations","24 pages","Journal of Algebraic Combinatorics, 45, No. 2, 525-552 (2017)","10.1007/s10801-016-0715-5",,"math.CO math.GR","http://arxiv.org/licenses/nonexclusive-distrib/1.0/","  The Cartan scheme $\cal X$ of a finite group $G$ with a $(B,N)$-pair is
defined to be the coherent configuration associated with the action of $G$ on
the right cosets of the Cartan subgroup $B\cap N$ by the right multiplications.
It is proved that if $G$ is a simple group of Lie type, then asymptotically,
the coherent configuration $\cal X$ is 2-separable, i.e., the array of
2-dimensional intersection numbers determines $\cal X$ up to isomorphism. It is
also proved that in this case, the base number of $\cal X$ equals 2. This
enables us to construct a polynomial-time algorithm for recognizing the Cartan
schemes when the rank of $G$ and order of the underlying field are sufficiently
large. One of the key points in the proof of the main results is a new
sufficient condition for an arbitrary homogeneous coherent configuration to be
2-separable.
","[{""version"":""v1"",""created"":""Tue, 23 Feb 2016 12:11:39 GMT""}]","2019-02-01"
"1602.07133","Thomas Oikonomou","G. Baris Bagci, Thomas Oikonomou","Validity of the third law of thermodynamics for the Tsallis entropy","5 pages, PRE 93 (2016) 022112",,,,"cond-mat.stat-mech","http://arxiv.org/licenses/nonexclusive-distrib/1.0/","  Bento \textit{et al.} [Phys. Rev. E 91, 022105 (2015)] recently stated that
the Tsallis entropy violates the third law of thermodynamics for $0 < q <1$ in
the sub-additive regime. We first show that the division between the regimes $q
< 1$ and $q > 1$ is already inherent in the fundamental incomplete structure of
the deformed logarithms and exponentials underlying the Tsallis entropy. Then,
we provide the complete deformed functions and show that the Tsallis entropy
conforms to the third law of thermodynamics for both super-additive $q < 1$ and
sub-additive $q > 1$ regimes. Finally, we remark that the Tsallis entropy does
not require the use of escort-averaging scheme once it is expressed in terms of
the complete deformed functions.
","[{""version"":""v1"",""created"":""Tue, 23 Feb 2016 12:16:29 GMT""}]","2016-02-24"
"1602.07134","Hojjat Mostafanasab","Hojjat Mostafanasab, Fatemeh Soheilnia and Ahmad Yousefian Darani","On weakly $n$-absorbing ideals of commutative rings","23 pages. arXiv admin note: text overlap with arXiv:1503.00108",,,,"math.AC","http://arxiv.org/licenses/nonexclusive-distrib/1.0/","  All rings are commutative with $1\neq0$. The purpose of this paper is to
investigate the concept of weakly $n$-absorbing ideals generalizing weakly
2-absorbing ideals. We prove that over a $u$-ring $R$ the Anderson-Badawi's
conjectures about $n$-absorbing ideals and the Badawi-Yousefian's question
about weakly 2-absorbing ideals hold.
","[{""version"":""v1"",""created"":""Tue, 23 Feb 2016 12:19:35 GMT""}]","2016-02-24"
"1602.07135","Nicola Zamponi","Maria Gualdani and Nicola Zamponi","Spectral gap and exponential convergence to equilibrium for a
  multi-species Landau system",,,,,"math-ph math.MP","http://arxiv.org/licenses/nonexclusive-distrib/1.0/","  In this paper we prove new constructive coercivity estimates and convergence
to equilibrium for a spatially non-homogeneous system of Landau equations with
soft potentials. We show that the nonlinear collision operator conserves each
species' mass, total momentum, total energy and that the Boltzmann entropy is
nonincreasing along solutions of the system. The entropy decay vanishes if and
only if the Boltzmann distributions of the single species are Maxwellians with
the same momentum and energy. A linearization of the collision operator is
computed, which has the same conservation properties as its nonlinear
counterpart. We show that the linearized system dissipates a quadratic entropy,
and prove existence of spectral gap and exponential decay of the solution
towards the global equilibrium.
","[{""version"":""v1"",""created"":""Tue, 23 Feb 2016 12:22:19 GMT""},{""version"":""v2"",""created"":""Tue, 8 Mar 2016 08:46:57 GMT""},{""version"":""v3"",""created"":""Wed, 21 Jun 2017 11:27:41 GMT""},{""version"":""v4"",""created"":""Thu, 6 Jul 2017 16:34:40 GMT""}]","2017-07-07"
"1602.07136","Simon Pigeon","Simon Pigeon and Andr\'e Xuereb","Thermodynamics of trajectories of open quantum systems, step by step","23 pages and 4 figures","J. Stat. Mech. (2016) 063203","10.1088/1742-5468/2016/06/063203",,"quant-ph cond-mat.stat-mech","http://arxiv.org/licenses/nonexclusive-distrib/1.0/","  Thermodynamics of trajectories promises to make possible the thorough
analysis of the dynamical properties of an open quantum system, a sought-after
goal in modern physics. Unfortunately, calculation of the relevant quantities
presents severe challenges. Determining the large-deviation function that gives
access to the full counting statistics associated with a dynamical order
parameter is challenging, if not impossible, even for systems evolving in a
restricted Liouville space. Acting on the realisation that the salient features
of most dynamical systems are encoded in the first few moments of the counting
statistics, in this article we present a method that gives sequential access to
these moments. Our method allows for obtaining analytical result in several
cases, as we illustrate, and allows using large deviation theory to reinterpret
certain well-known results.
","[{""version"":""v1"",""created"":""Tue, 23 Feb 2016 12:24:53 GMT""},{""version"":""v2"",""created"":""Mon, 13 Jun 2016 14:28:20 GMT""}]","2016-06-14"
"1602.07137","S\'andor Boz\'oki","Krist\'of \'Abele-Nagy, S\'andor Boz\'oki, \""Ors Reb\'ak","Efficiency analysis of double perturbed pairwise comparison matrices","29 pages, 3 figures","Journal of the Operational Research Society 69(5) (2018) 707-713","10.1080/01605682.2017.1409408",,"math.OC","http://arxiv.org/licenses/nonexclusive-distrib/1.0/","  Efficiency is a core concept of multi-objective optimization problems and
multi-attribute decision making. In the case of pairwise comparison matrices a
weight vector is called efficient if the approximations of the elements of the
pairwise comparison matrix made by the ratios of the weights cannot be improved
in any position without making it worse in some other position. A pairwise
comparison matrix is called double perturbed if it can be made consistent by
altering two elements and their reciprocals. The most frequently used weighting
method, the eigenvector method is analyzed in the paper, and it is shown that
it produces an efficient weight vector for double perturbed pairwise comparison
matrices.
","[{""version"":""v1"",""created"":""Tue, 23 Feb 2016 12:40:36 GMT""},{""version"":""v2"",""created"":""Tue, 11 Sep 2018 09:02:38 GMT""}]","2018-09-12"
"1602.07138","Jaume  Haro","Jaume de Haro","On the viability of quintessential inflationary models from
  observational data","version accepted for publication in GERG",,"10.1007/s10714-016-2173-8",,"gr-qc","http://arxiv.org/licenses/nonexclusive-distrib/1.0/","  Assuming that primordial density fluctuationas are nearly Gaussian, from a
frequentist viewpoint, the two-dimensional marginalized joint coincidence
contour in the plane $(n_s,r)$ (being $n_s$ the spectral index and $r$ the
ratio of tensor to scalar perturbations), without the presence of running is
usually used to test the viability of the inflationary models. The models that
provide, between $50$ and $60$ e-folds, a curve in that plane, which lies
outside the $95.5 \%$ C.L are ruled out. I will basically argue that the this
low number of e-folds is unjustified, and that models leading to a theoretical
value of the running different from zero must be checked with observational
data allowing the running. When both prescriptions are taken into account,
dealing in the context of quintessential inflation, i.e. when the potential is
a combination of an inflationary with a quintessential one that leads to a
deflationary regime, inflationary models such as the quartic or the Higgs
potential are allowed.
","[{""version"":""v1"",""created"":""Tue, 23 Feb 2016 12:57:06 GMT""},{""version"":""v2"",""created"":""Sun, 4 Dec 2016 18:41:25 GMT""}]","2016-12-21"
"1602.07139","Che-Ming Li","Che-Ming Li, Hsin-Pin Lo, Liang-Yu Chen, and Atsushi Yabushita","Experimental verification of multidimensional quantum steering",,"Optics Communications 410, 956 (2018)","10.1016/j.optcom.2017.11.070",,"quant-ph","http://arxiv.org/licenses/nonexclusive-distrib/1.0/","  Quantum steering enables one party to communicate with another remote party
even if the sender is untrusted. Such characteristics of quantum systems not
only provide direct applications to quantum information science, but are also
conceptually important for distinguishing between quantum and classical
resources. While concrete illustrations of steering have been shown in several
experiments, quantum steering has not been certified for higher dimensional
systems. Here, we introduce a simple method to experimentally certify two
different kinds of quantum steering: Einstein-Podolsky-Rosen (EPR) steering and
single-system (SS) steering (i.e., temporal steering), for dimensionality (d)
up to d=16. The former reveals the steerability among bipartite systems,
whereas the latter manifests itself in single quantum objects. We use
multidimensional steering witnesses to verify EPR steering of
polarization-entangled pairs and SS steering of single photons. The ratios
between the measured witnesses and the maximum values achieved by classical
mimicries are observed to increase with $d$ for both EPR and SS steering. The
designed scenario offers a new method to study further the genuine multipartite
steering of large dimensionality and potential uses in quantum information
processing.
","[{""version"":""v1"",""created"":""Tue, 23 Feb 2016 13:06:59 GMT""},{""version"":""v2"",""created"":""Fri, 29 Dec 2017 01:00:03 GMT""}]","2018-01-01"
