"1602.06836","Louis Esperet","Louis Esperet, Laetitia Lemoine, Fr\'ed\'eric Maffray","Long induced paths in graphs","20 pages, 5 figures - revised version","European Journal of Combinatorics 62 (2017), 1-14","10.1016/j.ejc.2016.11.011",,"math.CO","http://arxiv.org/licenses/nonexclusive-distrib/1.0/","  We prove that every 3-connected planar graph on $n$ vertices contains an
induced path on $\Omega(\log n)$ vertices, which is best possible and improves
the best known lower bound by a multiplicative factor of $\log \log n$. We
deduce that any planar graph (or more generally, any graph embeddable on a
fixed surface) with a path on $n$ vertices, also contains an induced path on
$\Omega(\sqrt{\log n})$ vertices. We conjecture that for any $k$, there is a
contant $c(k)$ such that any $k$-degenerate graph with a path on $n$ vertices
also contains an induced path on $\Omega((\log n)^{c(k)})$ vertices. We provide
examples showing that this order of magnitude would be best possible (already
for chordal graphs), and prove the conjecture in the case of interval graphs.
","[{""version"":""v1"",""created"":""Mon, 22 Feb 2016 16:02:28 GMT""},{""version"":""v2"",""created"":""Thu, 1 Dec 2016 13:19:41 GMT""}]","2016-12-20"
"1602.06837","Vladimir Gudkov","Young-Ho Song, Rimantas Lazauskas, and Vladimir Gudkov","Time Reversal Invariance Violating and Parity Conserving effects in
  Proton Deuteron Scattering",,,"10.1103/PhysRevC.93.049901",,"nucl-th hep-ph","http://arxiv.org/licenses/nonexclusive-distrib/1.0/","  Time reversal invariance violating parity conserving (TVPC) effects are
calculated for elastic proton deuteron scattering with proton energies up to
$2~$MeV. Distorted Wave Born Approximation is employed to estimate TVPC matrix
elements, based on hadronic wave functions, obtained by solving three-body
Faddeev-Merkuriev equations in configuration space with realistic potentials.
","[{""version"":""v1"",""created"":""Mon, 22 Feb 2016 16:10:07 GMT""}]","2016-04-20"
"1602.06838","J. Christensen-Dalsgaard","J. Christensen-Dalsgaard","Asteroseismology with solar-like oscillations","Proc. International conference on: Variability of the Sun and
  sun-like stars: from asteroseismology to space weather,Baku, Azerbaijan, 6 -
  8 July 2015, ed. J.-P. Rozelot, Lecture Notes in Physics, Springer, in the
  press",,,,"astro-ph.SR","http://arxiv.org/licenses/nonexclusive-distrib/1.0/","  Almost 100 years ago Sir Arthur Eddington noted that the interiors of stars
were inaccessible to observations. The advent of helio- and asteroseismology
has completely changed this assessment. Helioseismology has provided very
detailed information about the interior structure and dynamics of the Sun,
highlighting remaining issues in our understanding of the solar interior. In
the last decade extensive observations of stellar oscillations, in particular
from space photometry, have provided very detailed information about the global
and internal properties of stars. Here I provide an overview of these
developments, including the remarkable insight that has been obtained on the
properties of evolved stars.
","[{""version"":""v1"",""created"":""Mon, 22 Feb 2016 16:11:40 GMT""}]","2016-02-23"
"1602.06839","Jart Hageman","J. Hageman, M. Blaauboer","Effect of transverse anisotropy on inelastic tunneling spectroscopy of
  atomic-scale magnetic chains",,"Phys. Rev. B 95, 134418 (2017)",,,"cond-mat.mes-hall","http://arxiv.org/licenses/nonexclusive-distrib/1.0/","  We theoretically investigate the effect of transverse magnetic anisotropy on
spin-flip assisted tunneling through atomic spin chains. Using a
phenomenological approach and first-order perturbation theory, we analytically
calculate the inelastic tunneling current, differential conductance and atomic
spin transition rates. We predict the appearance of additional steps in the
differential conductance and a pronounced increase in the spin-flip transition
rate which at low voltages scale quadratically with the ratio of the transverse
anisotropy energy and the sum of the longitudinal anisotropy energy and the
exchange energy. Our results provide intuitive quantitative insight in the role
played by transverse anisotropy in inelastic tunneling spectroscopy of atomic
chains and can be observed under realistic experimental conditions.
","[{""version"":""v1"",""created"":""Mon, 22 Feb 2016 16:14:58 GMT""},{""version"":""v2"",""created"":""Wed, 10 May 2017 07:56:33 GMT""}]","2017-05-17"
"1602.06842","Diego  Fregolente Mendes de Oliveira","Marcus Vinicius Camillo Galia, Diego F. M. Oliveira, Edson D. Leonel","Evolution to the equilibrium in a dissipative and time dependent
  billiard",,,,,"nlin.CD","http://arxiv.org/licenses/nonexclusive-distrib/1.0/","  We study the convergence towards the equilibrium for a dissipative and
stochastic time-dependent oval billiard. The dynamics of the system is
described by using a generic four dimensional nonlinear map for the variables:
the angular position of the particle, the angle formed by the trajectory of the
article with the tangent line at the position of the collision, the absolute
velocity of the particle, and the instant of the hit with the boundary. The
dynamics of the stationary state as well as the dynamical evolution towards the
equilibrium is made by using an ensemble of non interacting particles. Finally,
we make a connection with the thermodynamic by using the energy equipartition
theorem.
","[{""version"":""v1"",""created"":""Mon, 22 Feb 2016 16:25:18 GMT""}]","2016-02-23"
"1602.06843","Tomoki Kawahira","Tomoki Kawahira","The Riemann hypothesis and holomorphic index in complex dynamics","19 pages, 11 Figures","Exp. Math. 27 (2018) pp 37-46","10.1080/10586458.2016.1217443",,"math.DS math.CV math.NT","http://arxiv.org/licenses/nonexclusive-distrib/1.0/","  We give an interpretation of the Riemann hypothesis in terms of complex and
topological dynamics. For example, the Riemann hypothesis is affirmative and
all zeros of the Riemann zeta function are simple if and only if a certain
meromorphic function has no attracting fixed point. To obtain this, we use
holomorphic index (residue fixed point index), which characterizes local
properties of fixed points in complex dynamics.
","[{""version"":""v1"",""created"":""Mon, 22 Feb 2016 16:28:08 GMT""}]","2019-08-01"
"1602.06844","Hao Wu","Hao Wu, Yue Ning, Prithwish Chakraborty, Jilles Vreeken, Nikolaj Tatti
  and Naren Ramakrishnan","Generating Realistic Synthetic Population Datasets","The conference version of the paper is submitted for publication",,,,"cs.DB","http://arxiv.org/licenses/nonexclusive-distrib/1.0/","  Modern studies of societal phenomena rely on the availability of large
datasets capturing attributes and activities of synthetic, city-level,
populations. For instance, in epidemiology, synthetic population datasets are
necessary to study disease propagation and intervention measures before
implementation. In social science, synthetic population datasets are needed to
understand how policy decisions might affect preferences and behaviors of
individuals. In public health, synthetic population datasets are necessary to
capture diagnostic and procedural characteristics of patient records without
violating confidentialities of individuals. To generate such datasets over a
large set of categorical variables, we propose the use of the maximum entropy
principle to formalize a generative model such that in a statistically
well-founded way we can optimally utilize given prior information about the
data, and are unbiased otherwise. An efficient inference algorithm is designed
to estimate the maximum entropy model, and we demonstrate how our approach is
adept at estimating underlying data distributions. We evaluate this approach
against both simulated data and on US census datasets, and demonstrate its
feasibility using an epidemic simulation application.
","[{""version"":""v1"",""created"":""Mon, 22 Feb 2016 16:28:17 GMT""},{""version"":""v2"",""created"":""Tue, 23 Feb 2016 16:50:26 GMT""},{""version"":""v3"",""created"":""Thu, 25 Feb 2016 17:20:42 GMT""}]","2016-02-26"
"1602.06845","Katrin Gelfert","L. J. Diaz, K. Gelfert, and M. Rams","Nonhyperbolic step skew-products: Ergodic approximation","43 pages, 5 figures",,,,"math.DS","http://arxiv.org/licenses/nonexclusive-distrib/1.0/","  We study transitive step skew-product maps modeled over a complete shift of
$k$, $k\ge2$, symbols whose fiber maps are defined on the circle and have
intermingled contracting and expanding regions. These dynamics are genuinely
nonhyperbolic and exhibit simultaneously ergodic measures with positive,
negative, and zero exponents.
  We introduce a set of axioms for the fiber maps and study the dynamics of the
resulting skew-product. These axioms turn out to capture the key mechanisms of
the dynamics of nonhyperbolic robustly transitive maps with compact central
leaves.
  Focusing on the nonhyperbolic ergodic measures (with zero fiber exponent) of
these systems, we prove that such measures are approximated in the weak$\ast$
topology and in entropy by hyperbolic ones. We also prove that they are in the
intersection of the convex hulls of the measures with positive fiber exponent
and with negative fiber exponent. Our methods also allow us to perturb
hyperbolic measures. We can perturb a measure with negative exponent directly
to a measure with positive exponent (and vice-versa), however we lose some
amount of entropy in this process. The loss of entropy is determined by the
difference between the Lyapunov exponents of the measures.
","[{""version"":""v1"",""created"":""Mon, 22 Feb 2016 16:29:29 GMT""}]","2016-02-23"
"1602.06846","Luca Redaelli","Luca Redaelli, Gabriele Bulgarini, Sergiy Dobrovolskiy, Sander N.
  Dorenbos, Val Zwiller, Eva Monroy, Jean-Michel G\'erard","Design of broadband high-efficiency superconducting-nanowire single
  photon detectors",,,"10.1088/0953-2048/29/6/065016",,"physics.ins-det cond-mat.supr-con physics.optics","http://arxiv.org/licenses/nonexclusive-distrib/1.0/","  In this paper several designs to maximize the absorption efficiency of
superconducting-nanowire single-photon detectors are investigated. Using a
simple optical cavity consisting of a gold mirror and a SiO2 layer, the
absorption efficiency can be boosted to over 97%: this result is confirmed
experimentally by the realization of an NbTiN-based detector having an overall
system detection efficiency of 85% at 1.31 micrometers. Calculations show that
by sandwiching the nanowire between two dielectric Bragg reflectors, unity
absorption (> 99.9%) could be reached at the peak wavelength for optimized
structures. To achieve broadband high efficiency, a different approach is
considered: a waveguide-coupled detector. The calculations performed in this
work show that, by correctly dimensioning the waveguide and the nanowire,
polarization-insensitive detectors absorbing more than 95% of the injected
photons over a wavelength range of several hundred nm can be designed. We
propose a detector design making use of GaN/AlN waveguides, since these
materials allow lattice-matched epitaxial deposition of Nb(Ti)N films and are
transparent on a very wide wavelength range.
","[{""version"":""v1"",""created"":""Mon, 22 Feb 2016 16:32:55 GMT""}]","2016-06-22"
"1602.06847","Lingxiang Li","Lingxiang Li and Athina P. Petropulu and Zhi Chen and Jun Fang","Improving Wireless Physical Layer Security via Exploiting Co-Channel
  Interference","13 pages and 6 figures",,"10.1109/JSTSP.2016.2600516",,"cs.IT math.IT","http://arxiv.org/licenses/nonexclusive-distrib/1.0/","  This paper considers a scenario in which a source-destination pair needs to
establish a confidential connection against an external eavesdropper, aided by
the interference generated by another source-destination pair that exchanges
public messages. The goal is to compute the maximum achievable secrecy degrees
of freedom (S.D.o.F) region of a MIMO two-user wiretap network. First, a
cooperative secrecy transmission scheme is proposed, whose feasible set is
shown to achieve all S.D.o.F. pairs on the S.D.o.F. region boundary. In this
way, the determination of the S.D.o.F. region is reduced to a problem of
maximizing the S.D.o.F. pair over the proposed transmission scheme. The maximum
achievable S.D.o.F. region boundary points are obtained in closed form, and the
construction of the precoding matrices achieving the maximum S.D.o.F. region
boundary is provided. The obtained analytical expressions clearly show the
relation between the maximum achievable S.D.o.F. region and the number of
antennas at each terminal.
","[{""version"":""v1"",""created"":""Mon, 22 Feb 2016 16:37:58 GMT""}]","2016-12-21"
"1602.06848","Boris Hanin","Boris Hanin, Steve Zelditch, Peng Zhou","Scaling of Harmonic Oscillator Eigenfunctions and Their Nodal Sets
  Around the Caustic","v3. Accepted to Communications in Mathematical Physics",,"10.1007/s00220-016-2807-4",,"math-ph math.MP math.PR math.SP","http://arxiv.org/licenses/nonexclusive-distrib/1.0/","  We study the scaling asymptotics of the eigenspace projection kernels
$\Pi_{\hbar, E}(x,y)$ of the isotropic Harmonic Oscillator $- \hbar ^2 \Delta +
|x|^2$ of eigenvalue $E = \hbar(N + \frac{d}{2})$ in the semi-classical limit
$\hbar \to 0$. The principal result is an explicit formula for the scaling
asymptotics of $\Pi_{\hbar, E}(x,y)$ for $x,y$ in a $\hbar^{2/3}$ neighborhood
of the caustic $\mathcal C_E$ as $\hbar \to 0.$ The scaling asymptotics are
applied to the distribution of nodal sets of Gaussian random eigenfunctions
around the caustic as $\hbar \to 0$. In previous work we proved that the
density of zeros of Gaussian random eigenfunctions of $\hat{H}_{\hbar}$ have
different orders in the Planck constant $\hbar$ in the allowed and forbidden
regions: In the allowed region the density is of order $\hbar^{-1}$ while it is
$\hbar^{-1/2}$ in the forbidden region. Our main result on nodal sets is that
the density of zeros is of order $\hbar^{-\frac{2}{3}}$ in an
$\hbar^{\frac{2}{3}}$-tube around the caustic. This tube radius is the
`critical radius'. For annuli of larger inner and outer radii $\hbar^{\alpha}$
with $0< \alpha < \frac{2}{3}$ we obtain density results which interpolate
between this critical radius result and our prior ones in the allowed and
forbidden region. We also show that the Hausdorff $(d-2)$-dimensional measure
of the intersection of the nodal set with the caustic is of order $\hbar^{-
\frac{2}{3}}$.
","[{""version"":""v1"",""created"":""Mon, 22 Feb 2016 16:45:47 GMT""},{""version"":""v2"",""created"":""Sat, 27 Feb 2016 03:11:49 GMT""},{""version"":""v3"",""created"":""Sun, 13 Nov 2016 21:28:43 GMT""}]","2016-12-21"
"1602.06850","Tianhua Xu","Tianhua Xu, Gunnar Jacobsen, Sergei Popov, Jie Li, Tiegen Liu, Yimo
  Zhang","Close-Form Expression of One-Tap Normalized LMS Carrier Phase Recovery
  in Optical Communication Systems","[SPIE] International Conference on Wireless and Optical
  Communications (ICWOC) 2016, W22",,"10.1117/12.2261932",,"physics.optics cs.IT math.IT","http://arxiv.org/licenses/nonexclusive-distrib/1.0/","  The performance of long-haul high speed coherent optical fiber communication
systems is significantly degraded by the laser phase noise and the equalization
enhanced phase noise (EEPN). In this paper, the analysis of the one-tap
normalized least-mean-square (LMS) carrier phase recovery (CPR) is carried out
and the close-form expression is investigated for quadrature phase shift keying
(QPSK) coherent optical fiber communication systems, in compensating both laser
phase noise and equalization enhanced phase noise. Numerical simulations have
also been implemented to verify the theoretical analysis. It is found that the
one-tap normalized least-mean-square algorithm gives the same analytical
expression for predicting CPR bit-error-rate (BER) floors as the traditional
differential carrier phase recovery, when both the laser phase noise and the
equalization enhanced phase noise are taken into account.
","[{""version"":""v1"",""created"":""Mon, 22 Feb 2016 16:49:44 GMT""},{""version"":""v2"",""created"":""Sun, 17 Jul 2016 16:40:22 GMT""},{""version"":""v3"",""created"":""Wed, 5 Oct 2016 10:29:17 GMT""}]","2017-02-01"
"1602.06851","Frank Marsiglio","R.L. Pavelich and F. Marsiglio","Calculation of 2D electronic band structure using matrix mechanics","23 pages, 10 figures","American Journal of Physics 84, 924-935 (2016)","10.1119/1.4964353",,"cond-mat.mes-hall cond-mat.other","http://arxiv.org/licenses/nonexclusive-distrib/1.0/","  We extend previous work applying elementary matrix mechanics to
one-dimensional periodic arrays (to generate energy bands) to two-dimensional
arrays. We generate band structures for the square lattice ""2D Kronig-Penney
model"" (square wells), muffin-tin potential (cylindrical wells), and Gaussian
wells. We then apply the method to periodic arrays of more than one atomic site
in a unit cell, in particular, the case of materials with hexagonal lattices
like graphene. These straightforward extensions of undergraduate-level
calculations allow students to readily determine band structures of current
research interest.
","[{""version"":""v1"",""created"":""Mon, 22 Feb 2016 16:51:04 GMT""}]","2018-01-09"
"1602.06852","Thierry Dauxois","Christophe Brouzet (Phys-ENS), Evgeny Ermanyuk (Phys-ENS), Sylvain
  Joubaud (Phys-ENS), Ilias Sibgatullin (Phys-ENS, SIO), Thierry Dauxois
  (Phys-ENS)","Energy cascade in internal wave attractors",,"Europhysics Letters 113, 44001 (2016)","10.1209/0295-5075/113/44001",,"physics.flu-dyn physics.ao-ph","http://arxiv.org/licenses/nonexclusive-distrib/1.0/","  One of the pivotal questions in the dynamics of the oceans is related to the
cascade of mechanical energy in the abyss and its contribution to mixing. Here,
we propose internal wave attractors in the large amplitude regime as a unique
self-consistent experimental and numerical setup that models a cascade of
triadic interactions transferring energy from large-scale monochro-matic input
to multi-scale internal wave motion. We also provide signatures of a discrete
wave turbulence framework for internal waves. Finally, we show how beyond this
regime, we have a clear transition to a regime of small-scale high-vorticity
events which induce mixing. Introduction.
","[{""version"":""v1"",""created"":""Mon, 22 Feb 2016 16:52:33 GMT""}]","2021-02-10"
"1602.06853","Fung Lam","F. Lam","Non-linear vorticity upsurge in Burgers' flow","32 pages and 17 figures (17 ps files). Corrections of typos with
  minor re-wording",,,,"physics.flu-dyn","http://arxiv.org/licenses/nonexclusive-distrib/1.0/","  We demonstrate that numerical solutions of Burgers' equation can be obtained
by a scale-totality algorithm for fluids of small viscosity (down to one
billionth). Two sets of initial data, modelling simple shears and wall boundary
layers, are chosen for our computations. Most of the solutions are carried out
well into the fully turbulent regime over finely-resolved scales in space and
in time. It is found that an abrupt spatio-temporal concentration in shear
constitutes an essential part during the flow evolution. The vorticity surge
has been instigated by the non-linearity complying with instantaneous enstrophy
production, while ad hoc disturbances play no role in the process. In
particular, the present method predicts the precipitous vorticity
re-distribution and accumulation, predominantly over localised regions of
minute dimension. The growth rate depends on viscosity and is a strong function
of initial data. Nevertheless, the long-time energy decay is
history-independent and is inversely proportional to time. Our results provide
direct evidence of the vorticity proliferation embedded in the equations of
motion. The non-linear intensification is a robust feature, and is ultimately
responsible for the drastic succession in boundary layer profiles over the
intrinsic laminar-turbulent transition (Schubauer and Klebanoff 1955). The
dynamical inception of turbulence can be decrypted by solving the full
time-dependent Navier-Stokes equations which ascribe no instability stages.
","[{""version"":""v1"",""created"":""Mon, 22 Feb 2016 16:53:40 GMT""},{""version"":""v2"",""created"":""Wed, 19 Dec 2018 10:19:27 GMT""}]","2018-12-20"
"1602.06854","Lior Shamir","Evan Kuminski and Lior Shamir","Computer-generated visual morphology catalog of ~3,000,000 SDSS galaxies","ApJS, accepted. CAS public tables added",,"10.3847/0067-0049/223/2/20",,"astro-ph.GA","http://arxiv.org/licenses/nonexclusive-distrib/1.0/","  We applied computer analysis to classify the broad morphological type of
~3,000,000 SDSS galaxies. The catalog provides for each galaxy the DR8 object
ID, right ascension, declination, and the certainty of the automatic
classification to spiral or elliptical. The certainty of the classification
allows controlling the accuracy of a subset of galaxies by sacrificing some of
the least certain classifications. The accuracy of the catalog was tested using
galaxies that were classified by the manually annotated Galaxy Zoo catalog. The
results show that the catalog contains ~900,000 spiral galaxies and ~600,000
elliptical galaxies with classification certainty that has a statistical
agreement rate of ~98% with Galaxy Zoo debiased 'superclean' dataset. That also
demonstrates the ability of computers to turn large datasets of galaxy images
into structured catalogs of galaxy morphology. The catalog can be downloaded at
http://vfacstaff.ltu.edu/lshamir/data/morph_catalog , and can be accessed
through public tables on CAS: public.broadMorph.LargeGM,
public.broadMorph.LargeWnnGM, and public.broadMorph.SpectraGM. The image
analysis software that was used to create the catalog is also publicly
available.
","[{""version"":""v1"",""created"":""Mon, 22 Feb 2016 16:55:46 GMT""},{""version"":""v2"",""created"":""Sun, 27 Mar 2016 17:39:59 GMT""}]","2016-04-20"
"1602.06855","Marcelo Byrro Ribeiro","Abner D. Soares (1), Newton J. Moura Jr. (2), Marcelo B. Ribeiro (3
  and 4) ((1) Comiss\~ao Nacional de Energia Nuclear - CNEN, Rio de Janeiro,
  (2) Instituto Brasileiro de Geografia e Estat\'istica - IBGE, Rio de Janeiro,
  (3) Instituto de F\'isica, Universidade Federal do Rio de Janeiro - UFRJ, (4)
  Observat\'orio do Valongo, Universidade Federal do Rio de Janeiro - UFRJ)","Tsallis statistics in the income distribution of Brazil","10 figures, 39 graphs, 17 pages, LaTeX. Minor changes to match
  version sent to publisher. To appear in ""Chaos, Solitons & Fractals""","Chaos, Solitons and Fractals 88 (2016) 158-171","10.1016/j.chaos.2016.02.026",,"q-fin.EC nlin.AO physics.data-an physics.soc-ph","http://arxiv.org/licenses/nonexclusive-distrib/1.0/","  This paper discusses the empirical evidence of Tsallis statistical functions
in the personal income distribution of Brazil. Yearly samples from 1978 to 2014
were linearized by the q-logarithm and straight lines were fitted to the entire
range of the income data in all samples, producing a two-parameters-only single
function representation of the whole distribution in every year. The results
showed that the time evolution of the parameters is periodic and plotting one
in terms of the other reveals a cycle mostly clockwise. It was also found that
the empirical data oscillate periodically around the fitted straight lines with
the amplitude growing as the income values increase. Since the entire income
data range can be fitted by a single function, this raises questions on
previous results claiming that the income distribution is constituted by a well
defined two-classes-base income structure, since such a division in two very
distinct income classes might not be an intrinsic property of societies, but a
consequence of an a priori fitting-choice procedure that may leave aside
possibly important income dynamics at the intermediate levels.
","[{""version"":""v1"",""created"":""Mon, 22 Feb 2016 16:58:11 GMT""},{""version"":""v2"",""created"":""Wed, 9 Mar 2016 22:08:52 GMT""}]","2016-05-24"
"1602.06856","Marouane Assal","Marouane Assal","Long time semiclassical Egorov theorem for $\hbar$-pseudodifferential
  systems","33 pages",,,,"math-ph math.DS math.MP","http://arxiv.org/licenses/nonexclusive-distrib/1.0/","  In the Heisenberg picture, we study the semiclassical time evolution of a
bounded quantum observable $Q^w(x,\hbar D_x)$ associated to a $(m\times m)$
matrix-valued symbol $Q$ generated by a semiclassical matrix-valued Hamiltonian
$H\sim H_0+\hbar H_1$. Under a non-crossing assumption on the eigenvalues of
the principal symbol $H_0$ that ensures the existence of almost invariant
subspaces of $L^{2}(\mathbb R^n)\otimes \mathbb C^m$, and for a class of
observables that are semiclassically block-diagonal with respect to the
projections onto these almost invariants subspaces, we establish a long time
matrix-valued version for the semiclassical Egorov theorem valid in a large
time interval of Ehrenfest type $T(\hbar)\simeq log(\hbar^{-1})$.
","[{""version"":""v1"",""created"":""Mon, 22 Feb 2016 16:58:11 GMT""},{""version"":""v2"",""created"":""Sat, 1 Oct 2016 09:27:01 GMT""}]","2016-10-04"
