"1602.06938","Kohta Murase","Kohta Murase, Kazumi Kashiyama, Peter Meszaros, Ian Shoemaker,
  Nicholas Senno","Ultrafast Outflows from Black Hole Mergers with a Mini-Disk","5 pages, accepted for publication in ApJL, discussions added, some
  typos fixed. Conclusions unchanged","Astrophys.J. 822 (2016) L9","10.3847/2041-8205/822/1/L9",,"astro-ph.HE gr-qc","http://arxiv.org/licenses/nonexclusive-distrib/1.0/","  Recently, the direct detection of gravitational waves from black hole (BH)
mergers was announced by the Advanced LIGO Collaboration. Multi-messenger
counterparts of stellar-mass BH mergers are of interest, and it had been
suggested that a small disk or celestial body may be involved in the binary of
two BHs. To test such possibilities, we consider the fate of a wind powered by
an active mini-disk in a relatively short, super-Eddington accretion episode
onto a BH with ~10-100 solar masses. We show that its thermal emission could be
seen as a fast optical transient with the duration from hours to days. We also
find that the coasting outflow forms external shocks due to interaction with
the interstellar medium, whose synchrotron emission might be expected in the
radio band on a time scale of years. Finally, we also discuss a possible jet
component and the associated high-energy neutrino emission as well as
ultra-high-energy cosmic-ray acceleration.
","[{""version"":""v1"",""created"":""Mon, 22 Feb 2016 20:55:30 GMT""},{""version"":""v2"",""created"":""Thu, 25 Feb 2016 20:57:14 GMT""},{""version"":""v3"",""created"":""Mon, 11 Apr 2016 19:50:07 GMT""}]","2016-04-29"
"1602.06939","Massimiliano Rinaldi","Adolfo Cisterna, T\'erence Delsate, Ludovic Ducobu, Massimiliano
  Rinaldi","Slowly rotating neutron stars in the nonminimal derivative coupling
  sector of Horndeski gravity","29 pages, 6 figures, revtex preprint style. Few typos corrected, one
  reference added. Version accepted for publication in Physical Review D","Phys. Rev. D 93, 084046 (2016)","10.1103/PhysRevD.93.084046",,"gr-qc astro-ph.HE hep-th","http://arxiv.org/licenses/nonexclusive-distrib/1.0/","  This work is devoted to the construction of slowly rotating neutron stars in
the framework of the nonminimal derivative coupling sector of Horndeski theory.
We match the large radius expansion of spherically symmetric solutions with
cosmological solutions and we find that the most viable model has only one free
parameter. Then, by using several tabulated and realistic equations of state,
we establish numerically the upper bound for this parameter in order to
construct neutron stars in the slow rotation approximation with the maximal
mass observed today. We finally study the surface redshift and the inertia of
these objects and compare them with known data.
","[{""version"":""v1"",""created"":""Mon, 22 Feb 2016 20:56:03 GMT""},{""version"":""v2"",""created"":""Fri, 18 Mar 2016 18:48:33 GMT""},{""version"":""v3"",""created"":""Wed, 6 Apr 2016 21:30:46 GMT""}]","2016-05-04"
"1602.06940","Haris Aziz","Haris Aziz and Sylvain Bouveret and Jerome Lang and Simon Mackenzie","Complexity of Manipulating Sequential Allocation",,,,,"cs.GT","http://arxiv.org/licenses/nonexclusive-distrib/1.0/","  Sequential allocation is a simple allocation mechanism in which agents are
given pre-specified turns and each agents gets the most preferred item that is
still available. It has long been known that sequential allocation is not
strategyproof.
  Bouveret and Lang (2014) presented a polynomial-time algorithm to compute a
best response of an agent with respect to additively separable utilities and
claimed that (1) their algorithm correctly finds a best response, and (2) each
best response results in the same allocation for the manipulator. We show that
both claims are false via an example. We then show that in fact the problem of
computing a best response is NP-complete. On the other hand, the insights and
results of Bouveret and Lang (2014) for the case of two agents still hold.
","[{""version"":""v1"",""created"":""Mon, 22 Feb 2016 20:56:34 GMT""}]","2016-02-23"
"1602.06941","Roger Z\""ust","Thierry De Pauw and Roger Z\""ust","Partial regularity of almost minimizing rectifiable G chains in Hilbert
  space","96 pages","American Journal of Mathematics, Volume 141, Number 6, 2019, pp.
  1591-1705",,,"math.DG","http://arxiv.org/licenses/nonexclusive-distrib/1.0/","  We adapt to an infinite dimensional ambient space E.R. Reifenberg's
epiperimetric inequality and a quantitative version of D. Preiss' second
moments computations to establish that the set of regular points of an almost
mass minimizing rectifiable $G$ chain in $\ell_2$ is dense in its support,
whenever the group $G$ of coefficients is so that $\{\|g\| : g \in G \}$ is
discrete and closed.
","[{""version"":""v1"",""created"":""Mon, 22 Feb 2016 20:58:01 GMT""},{""version"":""v2"",""created"":""Wed, 22 Jan 2020 10:10:57 GMT""}]","2020-01-23"
"1602.06942","D\'aniel Virosztek","D\'aniel Virosztek","Quantum $f$-divergence preserving maps on positive semidefinite
  operators acting on finite dimensional Hilbert spaces","v2: some typos corrected v3: improved presentation and some new
  references v4: accepted manuscript version","Linear Algebra Appl. 501 (2016), 242-253","10.1016/j.laa.2016.03.031",,"math-ph math.FA math.MP quant-ph","http://arxiv.org/licenses/nonexclusive-distrib/1.0/","  We determine the structure of all bijections on the cone of positive
semidefinite operators which preserve the quantum $f$-divergence for an
arbitrary strictly convex function $f$ defined on the positive halfline. It
turns out that any such transformation is implemented by either a unitary or an
antiunitary operator.
","[{""version"":""v1"",""created"":""Mon, 22 Feb 2016 20:59:14 GMT""},{""version"":""v2"",""created"":""Wed, 24 Feb 2016 17:07:39 GMT""},{""version"":""v3"",""created"":""Thu, 3 Mar 2016 15:34:03 GMT""},{""version"":""v4"",""created"":""Fri, 18 Mar 2016 15:23:40 GMT""}]","2016-03-31"
"1602.06944","Itamar Sivan","Itamar Sivan, Hyungkook Choi, Amir Rosenblatt, Jinhong Park, Yuval
  Gefen, Diana Mahalu, Vladimir Umansky","Observation of Interaction-Induced Modulations of a Quantum Hall
  Liquid's Area",,,"10.1038/ncomms12184",,"cond-mat.mes-hall","http://arxiv.org/licenses/nonexclusive-distrib/1.0/","  Studies of electronic interferometers, based on edge channel transport in the
quantum Hall effect regime, have been stimulated by the search for evidence of
abelian and non-abelian anyonic statistics of fractional charges.These studies
found the ubiquitous electronic Fabry-Perot interferometer to be Coulomb
dominated, thus masking coherent Aharonov-Bohm interference. Typically, the
main signature of the Coulomb dominated regime is the lack of interference of
the outer most edge channel as the magnetic field is varied. This seemingly
surprising behavior is explained by the shrinkage of the interference area with
increasing magnetic field, thus keeping the number of electrons and the
enclosed flux constant. The model further stipulates, but with no experimental
evidence thus far, that once the area shrinks by a size corresponding to an
entire flux-quantum, it abruptly inflates to its original size leading to an
unobservable 2{\pi} phase jump. Here we report on the observation of such area
breathing by performing a partial screening of the Coulomb interactions. The
novelty is that the variation of the phase induced by the external knobs is not
fully cancelled by the area response. We infer the area variations (with a
resolution on the order of ~50 nm$^{2}$) from conductance measurements. The
latter are sensitive to the continuous phase variations, and reveal abrupt
phase-jumps (smaller than 2{\pi}). Based on our results, we propose a new
experimental tool for probing anyonic statistics.
","[{""version"":""v1"",""created"":""Mon, 22 Feb 2016 20:59:59 GMT""}]","2016-08-24"
"1602.06945","Rafael Mart\'in-Dom\'enech Mr.","R. Mart\'in-Dom\'enech, G.M. Mu\~noz Caro, and G.A. Cruz-D\'iaz","Study of the photon-induced formation and subsequent desorption of CH3
  OH and H2 CO in interstellar ice analogs",,"A&A 589, A107 (2016)","10.1051/0004-6361/201528025",,"astro-ph.GA astro-ph.SR","http://arxiv.org/licenses/nonexclusive-distrib/1.0/","  Methanol and formaldehyde are two simple organic molecules that are
ubiquitously detected in the interstellar medium. An origin in the solid phase
and a subsequent nonthermal desorption into the gas phase is often invoked to
explain their abundances in some of the environments where they are found.
Experimental simulations under astrophysically relevant conditions have been
carried out to find a suitable mechanism for that process. We explore the in
situ formation and subsequent photon-induced desorption of these species,
studying the UV photoprocessing of pure ethanol ice, and a more realistic
binary H2O:CH4 ice analog. Ice samples deposited onto an infrared transparent
window at 8 K were UV-irradiated using a microwave-discharged hydrogen flow
lamp. Evidence of photochemical production of these two species and subsequent
UV-photon-induced desorption into the gas phase were searched for by means of a
Fourier transform infrared spectrometer and a quadrupole mass spectrometer,
respectively. Formation of CH3OH was only observed during photoprocessing of
the H2O:CH4 ice analog, but no photon-induced desorption was detected.
Photochemical production of H2CO was observed in both series of experiments.
Photochemidesorption of formaldehyde, i.e., photon-induced formation on the ice
surface and inmediate desorption, was observed, with a yield of 4.4 x 10-4
(molecules/incident photon) when the H2O:CH4 ice analogs were photoprocessed.
While certain C-bearing species, in particular H2CO, were found to desorb upon
irradiation, nonthermal desorption of CH3OH was not observed. So far, there is
no experimental evidence of any efficient CH3 OH desorption induced by UV
photons.
","[{""version"":""v1"",""created"":""Tue, 23 Feb 2016 08:26:44 GMT""},{""version"":""v2"",""created"":""Wed, 16 Mar 2016 14:57:41 GMT""}]","2016-04-20"
"1602.06946","Miguel G. Palomo P.E.","Miguel G. Palomo","Latin Puzzles","41 pages, 31 figures",,,,"math.HO","http://arxiv.org/licenses/nonexclusive-distrib/1.0/","  Based on a previous generalization by the author of Latin squares to Latin
boards, this paper generalizes partial Latin squares and related objects like
partial Latin squares, completable partial Latin squares and Latin square
puzzles. The latter challenge players to complete partial Latin squares, Sudoku
being the most popular variant nowadays.
  The present generalization results in partial Latin boards, completable
partial Latin boards and Latin puzzles. Provided examples of Latin puzzles
illustrate how they differ from puzzles based on Latin squares. The examples
include Sudoku Ripeto and Custom Sudoku, two new Sudoku variants. This is
followed by a discussion of methods to find Latin boards and Latin puzzles
amenable to being solved by human players, with an emphasis on those based on
constraint programming. The paper also includes an analysis of objective and
subjective ways to measure the difficulty of Latin puzzles.
","[{""version"":""v1"",""created"":""Mon, 22 Feb 2016 18:33:38 GMT""}]","2016-02-24"
"1602.06947","Yuan-Sen Ting Mr","Yuan-Sen Ting, Charlie Conroy, Hans-Walter Rix","Accelerated Fitting of Stellar Spectra","17 pages, 10 figures, ApJ (Accepted for publication- 2016 May 16)","2016, ApJ, 826, 83","10.3847/0004-637X/826/1/83",,"astro-ph.SR astro-ph.GA","http://arxiv.org/licenses/nonexclusive-distrib/1.0/","  Stellar spectra are often modeled and fit by interpolating within a
rectilinear grid of synthetic spectra to derive the stars' labels: stellar
parameters and elemental abundances. However, the number of synthetic spectra
needed for a rectilinear grid grows exponentially with the label space
dimensions, precluding the simultaneous and self-consistent fitting of more
than a few elemental abundances. Shortcuts such as fitting subsets of labels
separately can introduce unknown systematics and do not produce correct error
covariances in the derived labels. In this paper we present a new approach --
CHAT (Convex Hull Adaptive Tessellation) -- which includes several new ideas
for inexpensively generating a sufficient stellar synthetic library, using
linear algebra and the concept of an adaptive, data-driven grid. A convex hull
approximates the region where the data lie in the label space. A variety of
tests with mock datasets demonstrate that CHAT can reduce the number of
required synthetic model calculations by three orders of magnitude in an 8D
label space. The reduction will be even larger for higher-dimensional label
spaces. In CHAT the computational effort increases only linearly with the
number of labels that are fit simultaneously. Around each of these grid points
in label space an approximate synthetic spectrum can be generated through
linear expansion using a set of ""gradient spectra"" that represent flux
derivatives at every wavelength point with respect to all labels. These
techniques provide new opportunities to fit the full stellar spectra from large
surveys with 15-30 labels simultaneously.
","[{""version"":""v1"",""created"":""Mon, 22 Feb 2016 21:00:00 GMT""},{""version"":""v2"",""created"":""Mon, 16 May 2016 20:32:06 GMT""}]","2016-07-26"
"1602.06948","Jacob Hummel","Jacob A. Hummel, Athena Stacy and Volker Bromm","The First Stars: formation under cosmic ray feedback","13 pages, 9 figures. Submitted for publication in MNRAS",,"10.1093/mnras/stw1127",,"astro-ph.GA astro-ph.CO","http://arxiv.org/licenses/nonexclusive-distrib/1.0/","  We explore the impact of a cosmic ray (CR) background generated by supernova
explosions from the first stars on star-forming metal-free gas in a minihalo at
$z\sim25$. Starting from cosmological initial conditions, we use the smoothed
particle hydrodynamics code GADGET-2 to follow gas collapsing under the
influence of a CR background up to densities of $n=10^{12}\,{\rm cm}^{-3}$, at
which point we form sink particles. Using a suite of simulations with two sets
of initial conditions and employing a range of CR background models, we follow
each simulation for $5000\,$yr after the first sink forms. CRs both heat and
ionise the gas, boosting ${\rm H}_2$ formation. Additional ${\rm H}_2$ enhances
the cooling efficiency of the gas, allowing it to fulfil the Rees-Ostriker
criterion sooner and expediting the collapse, such that each simulation reaches
high densities at a different epoch. As it exits the loitering phase, the
thermodynamic path of the collapsing gas converges to that seen in the absence
of any CR background. By the time the gas approaches sink formation densities,
the thermodynamic state of the gas is thus remarkably similar across all
simulations. This leads to a robust characteristic mass that is largely
independent of the CR background, of order $\sim$ a few $\times10\,{\rm
M}_{\odot}$ even as the CR background strength varies by five orders of
magnitude.
","[{""version"":""v1"",""created"":""Mon, 22 Feb 2016 21:00:00 GMT""}]","2016-07-27"
"1602.06949","Curt von Keyserlingk","C.W. von Keyserlingk, S. L. Sondhi","1D Many-body localized Floquet systems II: Symmetry-Broken phases","Published version","Phys. Rev. B 93, 245146 (2016)","10.1103/PhysRevB.93.245146",,"cond-mat.str-el cond-mat.dis-nn","http://arxiv.org/licenses/nonexclusive-distrib/1.0/","  Recent work suggests that a sharp definition of `phase of matter' can be
given for periodically driven `Floquet' quantum systems exhibiting many-body
localization. In this work we propose a classification of the phases of
interacting Floquet localized systems with (completely) spontaneously broken
symmetries -- we focus on the one dimensional case, but our results appear to
generalize to higher dimensions. We find that the different Floquet phases
correspond to elements of $Z(G)$, the centre of the symmetry group in question.
In a previous paper we offered a companion classification of unbroken, i.e.,
paramagnetic phases.
","[{""version"":""v1"",""created"":""Mon, 22 Feb 2016 21:00:01 GMT""},{""version"":""v2"",""created"":""Thu, 24 Nov 2016 14:20:37 GMT""}]","2016-11-28"
"1602.06950","Ka-Wah Wong","Ka-Wah Wong, Jimmy A. Irwin, Daniel R. Wik, Ming Sun, Craig L.
  Sarazin, Yutaka Fujita, Thomas H. Reiprich","Suzaku X-ray Observations of the Nearest Non-Cool Core Cluster, Antlia:
  Dynamically Young but with Remarkably Relaxed Outskirts","24 pages, 16 figures, minor modifications to match the published
  version in ApJ",,"10.3847/0004-637X/829/1/49",,"astro-ph.HE astro-ph.CO","http://arxiv.org/licenses/nonexclusive-distrib/1.0/","  We present the results of seven Suzaku mosaic observations (>200 ks in total)
of the nearest non-cool core cluster, the Antlia Cluster (or Group), beyond its
degree-scale virial radius in its eastern direction. The temperature is
consistent with the scaled profiles of many other clusters. Its pressure
follows the universal profile. The density slope in its outskirts is
significantly steeper than that of the nearest cool core cluster (Virgo) with a
similar temperature as Antlia, but shallower than those of the massive
clusters. The entropy increases all the way out to R_200, which is consistent
in value with the baseline model predicted by a gravity heating-only mechanism
in the outskirts. Antlia is quite relaxed in this direction. However, the
entropy inside ~R_500 is significantly higher than the baseline model, which is
similar to many other nearby low mass clusters or groups. The enclosed gas-mass
fraction does not exceed the cosmic value out to 1.3R_200. Thus, there is no
evidence of significant gas clumping, electron-ion non-equipartition, or
departure from the hydrostatic equilibrium approximation that are suggested to
explain the entropy and gas fraction anomalies found in the outskirts of some
massive clusters. We also present scaling relations for the gas fraction
(f_gas,200), entropy (K_200), and temperature (T_500) using 22 groups and
clusters with published data in the literature. The enclosed baryon fraction at
R_200 is broadly consistent with the cosmic value. The power law slope of the
K_200-T_500 relation is 0.638+/-0.205. The entropy deficit at R_200 cannot be
fully accounted for by the bias or deviation in the gas fraction.
","[{""version"":""v1"",""created"":""Mon, 22 Feb 2016 21:00:03 GMT""},{""version"":""v2"",""created"":""Sun, 25 Sep 2016 18:46:02 GMT""}]","2016-09-27"
"1602.06951","Alberto Sesana","Alberto Sesana","The promise of multi-band gravitational wave astronomy","6 pages, 4 figures, version accepted for publication in Physical
  Review Letters","Phys. Rev. Lett. 116, 231102 (2016)","10.1103/PhysRevLett.116.231102",,"gr-qc astro-ph.CO astro-ph.HE","http://arxiv.org/licenses/nonexclusive-distrib/1.0/","  We show that the black hole binary (BHB) coalescence rates inferred from the
advanced LIGO (aLIGO) detection of GW150914 imply an unexpectedly loud GW sky
at milli-Hz frequencies accessible to the evolving Laser Interferometer Space
Antenna (eLISA), with several outstanding consequences. First, up to thousands
of BHB will be individually resolvable by eLISA; second, millions of non
resolvable BHBs will build a confusion noise detectable with signal-to-noise
ratio of few to hundreds; third -- and perhaps most importantly -- up to
hundreds of BHBs individually resolvable by eLISA will coalesce in the aLIGO
band within ten years. eLISA observations will tell aLIGO and all
electromagnetic probes weeks in advance when and where these BHB coalescences
are going to occur, with uncertainties of <10s and <1deg^2. This will allow the
pre-pointing of telescopes to realize coincident GW and multi-wavelength
electromagnetic observations of BHB mergers. Time coincidence is critical
because prompt emission associated to a BHB merger will likely have a duration
comparable to the dynamical time-scale of the systems, and is only possible
with low frequency GW alerts.
","[{""version"":""v1"",""created"":""Mon, 22 Feb 2016 21:00:04 GMT""},{""version"":""v2"",""created"":""Thu, 12 May 2016 13:31:05 GMT""}]","2016-06-15"
"1602.06952","Davide Gerosa","Davide Gerosa, Ulrich Sperhake, Christian D. Ott","Numerical simulations of stellar collapse in scalar-tensor theories of
  gravity","37 pages, 8 figures. Accepted for publication in CQG. Supporting
  material available at http://davidegerosa.com/corecollapse/","Class. Quantum Grav. 33, 13, 135002 (2016)","10.1088/0264-9381/33/13/135002","YITP-16-14","gr-qc astro-ph.HE astro-ph.SR","http://arxiv.org/licenses/nonexclusive-distrib/1.0/","  We present numerical-relativity simulations of spherically symmetric core
collapse and compact-object formation in scalar-tensor theories of gravity. The
additional scalar degree of freedom introduces a propagating monopole
gravitational-wave mode. Detection of monopole scalar waves with current and
future gravitational-wave experiments may constitute smoking gun evidence for
strong-field modifications of General Relativity. We collapse both polytropic
and more realistic pre-supernova profiles using a high-resolution
shock-capturing scheme and an approximate prescription for the nuclear equation
of state. The most promising sources of scalar radiation are protoneutron stars
collapsing to black holes. In case of a Galactic core collapse event forming a
black hole, Advanced LIGO may be able to place independent constraints on the
parameters of the theory at a level comparable to current Solar-System and
binary-pulsar measurements. In the region of the parameter space admitting
spontaneously scalarised stars, transition to configurations with prominent
scalar hair before black-hole formation further enhances the emitted signal.
Although a more realistic treatment of the microphysics is necessary to fully
investigate the occurrence of spontaneous scalarisation of neutron star
remnants, we speculate that formation of such objects could constrain the
parameters of the theory beyond the current bounds obtained with Solar-System
and binary-pulsar experiments.
","[{""version"":""v1"",""created"":""Mon, 22 Feb 2016 21:00:05 GMT""},{""version"":""v2"",""created"":""Wed, 18 May 2016 17:29:30 GMT""}]","2016-06-29"
"1602.06953","Miguel G. Echevarria","Miguel G. Echevarria, Ahmad Idilbi, Koichi Kanazawa, C\'edric Lorc\'e,
  Andreas Metz, Barbara Pasquini, Marc Schlegel","Proper definition and evolution of generalized transverse momentum
  distributions","v2: typo in eq.(19) corrected. Matches published version in PLB. v1:
  9 pages, 2 figures","Physics Letters B (2016), pp. 336-341","10.1016/j.physletb.2016.05.086",,"hep-ph","http://arxiv.org/licenses/nonexclusive-distrib/1.0/","  We consider one of the most fundamental sets of hadronic matrix elements,
namely the generalized transverse momentum distributions (GTMDs), and argue
that their existing definitions lack proper evolution properties. By exploiting
the similarity of GTMDs with the much better understood transverse momentum
distributions, we argue that the existing definitions of GTMDs have to include
an additional dependence on soft gluon radiation in order to render them
properly defined. With this, we manage to obtain the evolution kernel of all
(un)polarized quark and gluon GTMDs, which turns out to be spin independent. As
a byproduct, all large logarithms can be resummed up to
next-to-next-to-leading-logarithmic accuracy with the currently known
perturbative ingredients.
","[{""version"":""v1"",""created"":""Mon, 22 Feb 2016 21:00:05 GMT""},{""version"":""v2"",""created"":""Fri, 10 Jun 2016 09:05:17 GMT""}]","2016-06-13"
