"1604.01099","Maurice H. P. M. van Putten","Maurice H.P.M. van Putten","A new estimator of the deceleration parameter from galaxy rotation
  curves","to appear in ApJ",,"10.3847/0004-637X/824/1/43","KITP-16-016","astro-ph.GA","http://arxiv.org/licenses/nonexclusive-distrib/1.0/","  The nature of dark energy may be probed by the derivative
$Q=\left.dq(z)/dz\right|_0$ at redshift $z=0$ of the deceleration parameter
$q(z)$. It is probably static if $Q<1$ or dynamic if $Q>2.5$, supporting
$\Lambda$CDM or, respectively, $\Lambda=(1-q)H^2$, where $H$ denotes the Hubble
parameter. We derive $q=1-\left(4\pi a_0/cH\right)^{2}$, enabling a
determination of $q(z)$ by measurement of Milgrom's parameter $a_0(z)$ in
galaxy rotation curves, equivalent to the coefficient $A$ in the Tully-Fisher
relation $V^4_c=AM_b$ between rotation velocity $V_c$ and baryonic mass $M_b$.
We infer that dark matter should be extremely light with clustering limited to
the size of galaxy clusters. The associated transition radius to non-Newtonian
gravity may conceivably be probed in a free fall Cavendish type experiment in
space.
","[{""version"":""v1"",""created"":""Tue, 5 Apr 2016 00:30:40 GMT""}]","2016-06-15"
"1604.01100","Ariel Epstein","Ariel Epstein and George V. Eleftheriades","Arbitrary power-conserving field transformations with passive lossless
  omega-type bianisotropic metasurfaces","16 pages, 10 figures","IEEE Transactions on Antennas and Propagation, Vol. 64, Iss. 9
  (2016)","10.1109/TAP.2016.2588495",,"physics.optics","http://arxiv.org/licenses/nonexclusive-distrib/1.0/","  We present a general theory for designing realistic omega-type bianisotropic
metasurfaces (O-BMSs), unlocking their full potential for molding
electromagnetic fields. These metasurfaces, characterized by electric surface
impedance, magnetic surface admittance, and magnetoelectric coupling
coefficient, were previously considered for wavefront manipulation. However,
previous reports mainly considered plane-wave excitations, and implementations
included cumbersome metallic features. In this work, we prove that any field
transformation which locally conserves real power can be implemented via
passive and lossless meta-atoms characterized by closed-form expressions; this
allows rigorous incorporation of arbitrary source and scattering
configurations. Subsequently, we show that O-BMS meta-atoms can be implemented
using an asymmetric stack of three impedance sheets, an appealing structure for
printed circuit board fabrication. Our formulation reveals that, as opposed to
Huygens' metasurfaces (HMSs), which exhibit negligible magnetoelectric
coupling, O-BMSs are not limited to controlling the phase of transmitted
fields, but can rather achieve high level of control over the amplitude and
phase of reflected fields. This is demonstrated by designing O-BMSs for
reflectionless wide-angle refraction, independent surface-wave guiding, and a
highly-directive low-profile antenna, verified with full-wave simulations. This
straightforward methodology facilitates development of O-BMS-based devices for
controlling the near and far fields of arbitrary sources in complex scattering
configurations.
","[{""version"":""v1"",""created"":""Tue, 5 Apr 2016 00:47:36 GMT""},{""version"":""v2"",""created"":""Wed, 6 Jul 2016 13:17:36 GMT""}]","2016-07-07"
"1604.01101","Federico Galetto","Federico Galetto, Anthony V. Geramita, David L. Wehlau","Symmetric Complete Intersections","14 pages, includes referee's suggestions for publication in
  Communications in Algebra","Communications in Algebra, 46:5, 2194-2204, 2018","10.1080/00927872.2017.1372453",,"math.AC math.RT","http://arxiv.org/licenses/nonexclusive-distrib/1.0/","  We consider complete intersection ideals in a polynomial ring over a field of
characteristic zero that are stable under the action of the symmetric group
permuting the variables. We determine the possible representation types for
these ideals, and describe formulas for the graded characters of the
corresponding quotient rings.
","[{""version"":""v1"",""created"":""Tue, 5 Apr 2016 00:48:53 GMT""},{""version"":""v2"",""created"":""Wed, 23 Aug 2017 16:52:20 GMT""}]","2018-10-10"
"1604.01102","Pedro Cavalcanti Malta","Y.M.P. Gomes and P.C. Malta","Lab-based limits on the Carroll-Field-Jackiw Lorentz-violating
  electrodynamics","Reviewed version in two columns (8 pages, 1 figure): small
  corrections. Matches the version accepted for publication (Phys. Rev. D)","Phys. Rev. D 94, 025031 (2016)","10.1103/PhysRevD.94.025031",,"hep-ph","http://arxiv.org/licenses/nonexclusive-distrib/1.0/","  The CPT-odd and Lorentz-violating Carroll-Field-Jackiw modification of
electrodynamics is discussed and we study its effects on the energy spectrum of
hydrogen, as well as in the generation of a momentum-dependent electric dipole
moment for charged leptons. We also briefly comment on the possibility of the
detection of Lorentz violation in measurements of vacuum birefringence in
resonant cavities. The bounds found are based on local laboratory experimental
limits and are not competitive with the ones coming from astrophysical
considerations.
","[{""version"":""v1"",""created"":""Tue, 5 Apr 2016 00:58:30 GMT""},{""version"":""v2"",""created"":""Tue, 10 May 2016 20:05:19 GMT""},{""version"":""v3"",""created"":""Tue, 24 May 2016 22:30:27 GMT""},{""version"":""v4"",""created"":""Mon, 11 Jul 2016 11:14:47 GMT""}]","2016-07-27"
"1604.01103","Taichi Kato","Taichi Kato (Kyoto U), Enrique de Miguel, William Stein, Yutaka Maeda,
  Colin Littlefield, Seiichiro Kiyota, Tonny Vanmunster, Shawn Dvorak, Sergey
  Yu. Shugarov, Eugenia S. Kalinicheva, Roger D. Pickard, Kiyoshi Kasai, Lewis
  M. Cook, Hiroshi Itoh, Eddy Muyllaert","PM J03338+3320: Long-Period Superhumps in Growing Phase Following a
  Separate Precursor Outburst","11 pages, 4 figures, accepted for publication in PASJ (includes
  supporting information)",,"10.1093/pasj/psw046",,"astro-ph.SR","http://arxiv.org/licenses/nonexclusive-distrib/1.0/","  We observed the first-ever recorded outburst of PM J03338+3320, the
cataclysmic variable selected by proper-motion survey. The outburst was
composed of a precursor and the main superoutburst. The precursor outburst
occurred at least 5 d before the maximum of the main superoutburst. Despite
this separation, long-period superhumps were continuously seen between the
precursor and main superoutburst. The period of these superhumps is longer than
the orbital period by 6.0(1)% and can be interpreted to reflect the dynamical
precession rate at the 3:1 resonance for a mass ratio of 0.172(4). These
superhumps smoothly evolved into those in the main superoutburst. These
observations provide the clearest evidence that the 3:1 resonance is triggered
by the precursor outburst, even if it is well separated, and the resonance
eventually causes the main superoutburst as predicted by the thermal-tidal
instability model. The presence of superhumps well before the superoutburst
cannot be explained by alternative models (the enhanced mass-transfer model and
the pure thermal instability model) and the present observations give a clear
support to the thermal-tidal instability model.
","[{""version"":""v1"",""created"":""Tue, 5 Apr 2016 01:03:37 GMT""}]","2016-06-01"
"1604.01104","Sasha Sodin","In-Jee Jeong and Sasha Sodin","A Limit Theorem for Stochastically Decaying Partitions at the Edge","39 pages, 8 figures","Random Matrices: Theory Appl. 05, 1650016 (2016)","10.1142/S2010326316500167",,"math.PR math-ph math.CO math.MP","http://arxiv.org/licenses/nonexclusive-distrib/1.0/","  In this paper, we study the asymptotic behavior of the first, second, and so
on rows of stochastically decaying partitions. We establish that, with
appropriate scaling in time and length, the sequence of rows converges to the
Airy$_2$ line ensemble.
  This result was first established, in a more general setting, by Borodin and
Olshanski, who relied on the determinantal structure of the Poissonized
correlation functions. Our argument is based on a different, combinatorial
approach, developed by Okounkov. This approach may be useful in other problems
in which no determinantal structure is available, and also highlights the
similarity between random partitions and random matrices.
","[{""version"":""v1"",""created"":""Tue, 5 Apr 2016 01:09:40 GMT""},{""version"":""v2"",""created"":""Sun, 29 May 2016 22:15:18 GMT""},{""version"":""v3"",""created"":""Wed, 5 Oct 2016 10:23:28 GMT""}]","2016-11-10"
"1604.01105","Amit Sharma","Amit Sharma, Dan Cosley","Distinguishing between Personal Preferences and Social Influence in
  Online Activity Feeds","13 pages, ACM CSCW 2016",,"10.1145/2818048.2819982",,"cs.SI cs.HC stat.ME","http://arxiv.org/licenses/nonexclusive-distrib/1.0/","  Many online social networks thrive on automatic sharing of friends'
activities to a user through activity feeds, which may influence the user's
next actions. However, identifying such social influence is tricky because
these activities are simultaneously impacted by influence and homophily. We
propose a statistical procedure that uses commonly available network and
observational data about people's actions to estimate the extent of
copy-influence---mimicking others' actions that appear in a feed. We assume
that non-friends don't influence users; thus, comparing how a user's activity
correlates with friends versus non-friends who have similar preferences can
help tease out the effect of copy-influence.
  Experiments on datasets from multiple social networks show that estimates
that don't account for homophily overestimate copy-influence by varying, often
large amounts. Further, copy-influence estimates fall below 1% of total actions
in all networks: most people, and almost all actions, are not affected by the
feed. Our results question common perceptions around the extent of
copy-influence in online social networks and suggest improvements to diffusion
and recommendation models.
","[{""version"":""v1"",""created"":""Tue, 5 Apr 2016 01:16:30 GMT""}]","2016-04-06"
"1604.01106","Wadim Zudilin","Shaun Cooper, Jes\'us Guillera, Armin Straub, Wadim Zudilin","Crouching AGM, Hidden Modularity","16 pages","Frontiers in Orthogonal Polynomials and q-Series (M. Zuhair Nashed
  and Xin Li, eds.), Contemporary Mathematics and Its Applications: Monographs,
  Expositions and Lecture Notes 1 (World Scientific, 2018), pp. 169--187","10.1142/9789813228887_0009",,"math.NT math.CA math.CO","http://arxiv.org/licenses/nonexclusive-distrib/1.0/","  Special arithmetic series $f(x)=\sum_{n=0}^{\infty}c_nx^n$, whose
coefficients $c_n$ are normally given as certain binomial sums, satisfy
""self-replicating"" functional identities. For example, the equation
$$\frac1{(1+4z)^2}f\biggl(\frac{z}{(1+4z)^3}\biggr)=\frac1{(1+2z)^2}f\biggl(\frac{z^2}{(1+2z)^3}\biggr)$$
generates a modular form $f(x)$ of weight 2 and level 7, when a related modular
parametrization $x=x(\tau)$ is properly chosen. In this note we investigate the
potential of describing modular forms by such self-replicating equations as
well as applications of the equations that do not make use of the modularity.
In particular, we outline a new recipe of generating AGM-type algorithms for
computing $\pi$ and other related constants. Finally, we indicate some
possibilities to extend the functional equations to a two-variable setting.
","[{""version"":""v1"",""created"":""Tue, 5 Apr 2016 01:17:28 GMT""}]","2018-01-24"
"1604.01107","Pieter Tibboel","Pieter Tibboel","Finiteness of polygonal relative equilibria for generalised
  quasi-homogeneous $n$-body problems and $n$-body problems in spaces of
  constant curvature","17 pages",,,,"math-ph math.MP","http://arxiv.org/licenses/nonexclusive-distrib/1.0/","  We prove for generalisations of quasi-homogeneous $n$-body problems with
center of mass zero and $n$-body problems in spaces of negative constant
Gaussian curvature that if the masses and rotation are fixed, there exists, for
every order of the masses, at most one equivalence class of relative equilibria
for which the point masses lie on a circle, as well as that there exists, for
every order of the masses, at most one equivalence class of relative equilibria
for which all but one of the point masses lie on a circle and rotate around the
remaining point mass. The method of proof is a generalised version of a proof
by J.M. Cors, G.R. Hall and G.E. Roberts on the uniqueness of co-circular
central configurations for power-law potentials.
","[{""version"":""v1"",""created"":""Tue, 5 Apr 2016 01:17:55 GMT""}]","2016-04-06"
"1604.01108","Hiroyuki Kitahata","Hiroyuki Kitahata and Natsuhiko Yoshinaga","Effective diffusion coefficient including the Marangoni effect","11 pages, 10 figures","J. Chem. Phys., 148, 134906 (2018)","10.1063/1.5021502",,"nlin.PS","http://arxiv.org/licenses/nonexclusive-distrib/1.0/","  Surface-active molecules supplied from a particle fixed at the water surface
create a spatial gradient of the molecule concentration, resulting in Marangoni
convection. Convective flow transports the molecules far from the particle,
enhancing diffusion. We analytically derive the effective diffusion coefficient
associated with the Marangoni convection rolls. The resulting estimated
effective diffusion coefficient is consistent with our numerical results and
the apparent diffusion coefficient measured in experiments.
","[{""version"":""v1"",""created"":""Tue, 5 Apr 2016 01:26:56 GMT""},{""version"":""v2"",""created"":""Fri, 8 Sep 2017 07:28:23 GMT""},{""version"":""v3"",""created"":""Wed, 4 Apr 2018 16:51:34 GMT""}]","2018-04-05"
"1604.01109","Zhanning Gao","Zhanning Gao, Gang Hua, Dongqing Zhang, Jianru Xue, Nanning Zheng","Counting Grid Aggregation for Event Retrieval and Recognition","This paper has been withdrawn by the author because this work will be
  part of another object which will be released soon",,,,"cs.CV","http://arxiv.org/licenses/nonexclusive-distrib/1.0/","  Event retrieval and recognition in a large corpus of videos necessitates a
holistic fixed-size visual representation at the video clip level that is
comprehensive, compact, and yet discriminative. It shall comprehensively
aggregate information across relevant video frames, while suppress redundant
information, leading to a compact representation that can effectively
differentiate among different visual events. In search for such a
representation, we propose to build a spatially consistent counting grid model
to aggregate together deep features extracted from different video frames. The
spatial consistency of the counting grid model is achieved by introducing a
prior model estimated from a large corpus of video data. The counting grid
model produces an intermediate tensor representation for each video, which
automatically identifies and removes the feature redundancy across the
different frames. The tensor representation is subsequently reduced to a
fixed-size vector representation by averaging over the counting grid. When
compared to existing methods on both event retrieval and event classification
benchmarks, we achieve significantly better accuracy with much more compact
representation.
","[{""version"":""v1"",""created"":""Tue, 5 Apr 2016 01:38:07 GMT""},{""version"":""v2"",""created"":""Fri, 12 Aug 2016 09:01:57 GMT""},{""version"":""v3"",""created"":""Tue, 11 Oct 2016 12:11:47 GMT""}]","2016-10-12"
"1604.01110","Vadim Gorin","Alexey Bufetov, Vadim Gorin","Fluctuations of particle systems determined by Schur generating
  functions","65 pages, 4 figures. v3: some misprints corrected compared to the
  journal version","Advances in Mathematics, 338 (2018), 702-781","10.1016/j.aim.2018.07.009",,"math.PR math-ph math.CO math.MP math.RT","http://arxiv.org/licenses/nonexclusive-distrib/1.0/","  We develop a new toolbox for the analysis of the global behavior of
stochastic discrete particle systems. We introduce and study the notion of the
Schur generating function of a random discrete configuration. Our main result
provides a Central Limit Theorem (CLT) for such a configuration given certain
conditions on the Schur generating function. As applications of this approach,
we prove CLT's for several probabilistic models coming from asymptotic
representation theory and statistical physics, including random lozenge and
domino tilings, non-intersecting random walks, decompositions of tensor
products of representations of unitary groups.
","[{""version"":""v1"",""created"":""Tue, 5 Apr 2016 01:39:28 GMT""},{""version"":""v2"",""created"":""Tue, 21 Jan 2020 22:11:34 GMT""},{""version"":""v3"",""created"":""Thu, 31 Dec 2020 01:42:09 GMT""}]","2021-01-01"
"1604.01111","Chandra Varma","Changtao Hou and Chandra M. Varma","Phase diagram and quantum-criticality of the two dimensional dissipative
  quantum XY model",,"Phys. Rev. B 94, 201101 (2016)","10.1103/PhysRevB.94.201101",,"cond-mat.str-el","http://arxiv.org/licenses/nonexclusive-distrib/1.0/","  The two-dimensional dissipative quantum XY model is applicable to the
quantum-critical properties of diverse experimental systems, ranging from the
superconductor to insulator transitions, ferromagnetic and antiferromagnetic
transitions in metals, to the loop-current order transition in the cuprates. We
solve the re-expression of this model in terms of topological excitations:
vortices and a variety of instantons, by renormalization group methods. The
calculations explain the extraordinary properties of the model discovered in
Monte-Carlo calculations: the separability of the quantum critical fluctuations
(QCF) in space and time, the spatial correlation length proportional to
logarithm of the temporal correlation length near the transition from
disordered to the fully ordered state, and the occurrence of a phase with
spatial order without temporal order. They are intimately related to the flow
of the metric of time in relation to the metric of space, i.e. of the dynamical
critical exponent $z$. These properties appear to be essential in understanding
the strange metallic phase found in a variety of quantum-critical transitions
as well as the accompanying high temperature superconductivity.
","[{""version"":""v1"",""created"":""Tue, 5 Apr 2016 01:44:46 GMT""}]","2016-11-09"
"1604.01112","Zhi-wei Sun","Zhiwei Sun and Xiaoqiang Sun and Ping Wang","Multiparty quantum key agreement protocol secure against collusion
  attacks","8 pages, 1 figures, Any comments are welcomed",,,,"cs.CR quant-ph","http://arxiv.org/licenses/nonexclusive-distrib/1.0/","  The fairness of a secure multi-party quantum key agreement (MQKA) protocol
requires that all involved parties are entirely peer entities and can equally
influence the outcome of the protocol to establish a shared key wherein no one
can decide the shared key alone. However, it is found that parts of the
existing MQKA protocols are sensitive to collusion attacks, i.e., some of the
dishonest participants can collaborate to predetermine the final key without
being detected. In this paper, a multi-party QKA protocol resisting collusion
attacks is proposed. Different from previous QKA protocol resisting $N-1$
coconspirators or resisting $1$ coconspirators, we investigate the general
circle-type MQKA protocol which can be secure against $t$ dishonest
participants' cooperation. Here, $t < N$. We hope the results of the presented
paper will be helpful for further research on fair MQKA protocols.
","[{""version"":""v1"",""created"":""Tue, 5 Apr 2016 01:55:31 GMT""}]","2016-04-06"
"1604.01113","Anatoly Khina","Anatoly Khina, Tal Philosof and Moshe Laifenfeld","Layered Uplink Transmission in Clustered Cellular Networks",,,,,"cs.IT math.IT","http://arxiv.org/licenses/nonexclusive-distrib/1.0/","  The demand for higher data rates and the scarce spectrum resources drive the
adoption of collaborative communication techniques. In this work we shown that
the existing cluster based collaborative schemes can be greatly improved in
terms of both the achievable performance, and complexity, by allowing
overlapping across clusters. Further improvement is achieved by incorporating
scheduling to the decoding process. Different variants of the improved schemes
are considered and are shown to achieve near optimum performance for practical
signal-to-noise ratios for the one- and two-dimensional (hexagonal) Wyner-type
models.
","[{""version"":""v1"",""created"":""Tue, 5 Apr 2016 02:19:10 GMT""}]","2016-04-06"
"1604.01114","Takashi Naka","Takashi Naka, Artem M. Nikitin, Yu Pan, Anne de Visser, Takayuki
  Nakane, Fumihiro Ishikawa, Yuh Yamada, Motoharu Imai, Akiyuki Matsushita","Composition induced metal-insulator quantum phase transition in the
  Heusler type Fe2VAl","submitted for Journal of Physics: Condensed Matter, 18 pages, 13
  figures","J. Phys.: Condens. Matter, 28, 285601 (2016)","10.1088/0953-8984/28/28/285601",,"cond-mat.str-el","http://arxiv.org/licenses/nonexclusive-distrib/1.0/","  We report the magnetism and transport properties of the Heusler compound
Fe2+xV1-xAl at -0.10 < x < 0.10 under pressure and a magnetic field. A
metal-insulator quantum phase transition occurred at x = -0.05. Application of
pressure or a magnetic field facilitated the emergence of finite
zero-temperature conductivity around the critical point, which scaled
approximately according to the power law. At x < -0.05, a localized
paramagnetic spin appeared, whereas above the ferromagnetic quantum critical
point at x = 0.05, itinerant ferromagnetism was established. At the quantum
critical points at x = -0.05 and 0.05, the resistivity and specific heat
exhibited singularities characteristic of a Griffiths phase appearing as an
inhomogeneous electronic state.
","[{""version"":""v1"",""created"":""Tue, 5 Apr 2016 02:33:26 GMT""},{""version"":""v2"",""created"":""Wed, 6 Apr 2016 02:36:54 GMT""}]","2021-05-31"
"1604.01115","Mykhailo Bilogliadov","Mykhailo Bilogliadov","Minimum Energy Problem on the Hypersphere","arXiv admin note: substantial text overlap with arXiv:1510.06420",,,,"math.CA","http://arxiv.org/licenses/nonexclusive-distrib/1.0/","  We consider the minimum energy problem on the unit sphere $\mathbb S^{d-1}$
in the Euclidean space $\mathbb R^d$, $d\geq 3$, in the presence of an external
field $Q$, where the charges are assumed to interact according to Newtonian
potential $1/r^{d-2}$, with $r$ denoting the Euclidean distance. We solve the
problem by finding the support of the extremal measure, and obtaining an
explicit expression for the density of the extremal measure. We then apply our
results to an external field generated by a point charge of positive magnitude,
placed at the North Pole of the sphere, and to a quadratic external field.
","[{""version"":""v1"",""created"":""Tue, 5 Apr 2016 02:40:37 GMT""}]","2016-04-06"
"1604.01116","Kasra Khosoussi","Kasra Khosoussi, Gaurav S. Sukhatme, Shoudong Huang, Gamini
  Dissanayake","Maximizing the Weighted Number of Spanning Trees: Near-$t$-Optimal
  Graphs","24 pages, 3 figures",,,,"cs.DS cs.SI","http://arxiv.org/licenses/nonexclusive-distrib/1.0/","  Designing well-connected graphs is a fundamental problem that frequently
arises in various contexts across science and engineering. The weighted number
of spanning trees, as a connectivity measure, emerges in numerous problems and
plays a key role in, e.g., network reliability under random edge failure,
estimation over networks and D-optimal experimental designs. This paper tackles
the open problem of designing graphs with the maximum weighted number of
spanning trees under various constraints. We reveal several new structures,
such as the log-submodularity of the weighted number of spanning trees in
connected graphs. We then exploit these structures and design a pair of
efficient approximation algorithms with performance guarantees and
near-optimality certificates. Our results can be readily applied to a wide
verity of applications involving graph synthesis and graph sparsification
scenarios.
","[{""version"":""v1"",""created"":""Tue, 5 Apr 2016 02:42:48 GMT""},{""version"":""v2"",""created"":""Tue, 12 Apr 2016 04:04:27 GMT""}]","2016-04-13"
"1604.01117","Nihar Ranjan Sahoo","STAR Collaboration","Jet-like Correlations with Direct-Photon and Neutral-Pion Triggers at
  $\sqrt{s_{_{NN}}} = 200$ GeV","9 pages, 7 figures, minor modification, accepted version for
  publication in Physics Letters B","Physics Letters B 760 (2016)","10.1016/j.physletb.2016.07.046",,"nucl-ex hep-ex hep-ph nucl-th","http://arxiv.org/licenses/nonexclusive-distrib/1.0/","  Azimuthal correlations of charged hadrons with direct-photon ($\gamma_{dir}$)
and neutral-pion ($\pi^{0}$) trigger particles are analyzed in central Au+Au
and minimum-bias $p+p$ collisions at $\sqrt{s_{_{NN}}} = 200$ GeV in the STAR
experiment. The charged-hadron per-trigger yields at mid-rapidity from central
Au+Au collisions are compared with $p+p$ collisions to quantify the suppression
in Au+Au collisions. The suppression of the away-side associated-particle
yields per $\gamma_{dir}$ trigger is independent of the transverse momentum of
the trigger particle ($p_{T}^{\mathrm{trig}}$), whereas the suppression is
smaller at low transverse momentum of the associated charged hadrons
($p_{T}^{\mathrm{assoc}}$). Within uncertainty, similar levels of suppression
are observed for $\gamma_{dir}$ and $\pi^{0}$ triggers as a function of $z_{T}$
($\equiv p_T^{\mathrm{assoc}}/p_T^{\mathrm{trig}}$). The results are compared
with energy-loss-inspired theoretical model predictions. Our studies support
previous conclusions that the lost energy reappears predominantly at low
transverse momentum, regardless of the trigger energy.
","[{""version"":""v1"",""created"":""Tue, 5 Apr 2016 02:49:31 GMT""},{""version"":""v2"",""created"":""Thu, 7 Apr 2016 15:41:06 GMT""},{""version"":""v3"",""created"":""Tue, 19 Jul 2016 04:12:44 GMT""}]","2016-08-04"
