"1604.00925","Ye-Ling Zhou","Silvia Pascoli and Ye-Ling Zhou","The role of flavon cross couplings in leptonic flavour mixing","21 pages, 3 figures, typo corrected, published in JHEP","JHEP 06: 073, 2016","10.1007/JHEP06(2016)073","IPPP/16/19","hep-ph","http://arxiv.org/licenses/nonexclusive-distrib/1.0/","  In models with discrete flavour symmetries, flavons are critical to realise
specific flavour structures. Leptonic flavour mixing originates from the
misalignment of flavon vacuum expectation values which respect different
residual symmetries in the charged lepton and neutrino sectors. Flavon cross
couplings are usually forbidden, in order to protect these symmetries. Contrary
to this approach, we show that cross couplings can play a key role and give
raise to necessary corrections to flavour-mixing patterns, including a non-zero
value for the reactor angle and CP violation. For definiteness, we present two
models based on $A_4$. In the first model, all flavons are assumed to be real
or pseudo-real, with 7 real degrees of freedom in the flavon sector in total. A
sizable reactor angle associated with nearly maximal CP violation is achieved,
and, as both originate from the same cross coupling, a sum rule results with a
precise prediction for the value of the Dirac CP-violating phase. In the second
model, the flavons are taken to be complex scalars, which can be connected with
supersymmetric models and multi-Higgs models. The complexity properties of
flavons provide new sources for generating the reactor angle. Models in this
new approach introduce very few degrees of freedom beyond the Standard Model
and can be more economical than those in the framework of extra dimension or
supersymmetry.
","[{""version"":""v1"",""created"":""Mon, 4 Apr 2016 16:00:02 GMT""},{""version"":""v2"",""created"":""Mon, 13 Jun 2016 13:52:17 GMT""}]","2016-06-14"
"1604.00926","Xing Li","Xing Li, Seungil You, Lijun Chen, An Liu, Youjian (Eugene) Liu","Dual Link Algorithm for the Weighted Sum Rate Maximization in MIMO
  Interference Channels",,,,,"cs.IT math.IT","http://arxiv.org/licenses/nonexclusive-distrib/1.0/","  MIMO interference network optimization is important for increasingly crowded
wireless communication networks. We provide a new algorithm, named Dual Link
algorithm, for the classic problem of weighted sum-rate maximization for MIMO
multiaccess channels (MAC), broadcast channels (BC), and general MIMO
interference channels with Gaussian input and a total power constraint. For
MIMO MAC/BC, the algorithm finds optimal signals to achieve the capacity region
boundary. For interference channels with Gaussian input assumption, two of the
previous state-of-the-art algorithms are the WMMSE algorithm and the polite
water-filling (PWF) algorithm. The WMMSE algorithm is provably convergent,
while the PWF algorithm takes the advantage of the optimal transmit signal
structure and converges the fastest in most situations but is not guaranteed to
converge in all situations. It is highly desirable to design an algorithm that
has the advantages of both algorithms. The dual link algorithm is such an
algorithm. Its fast and guaranteed convergence is important to distributed
implementation and time varying channels. In addition, the technique and a
scaling invariance property used in the convergence proof may find applications
in other non-convex problems in communication networks.
","[{""version"":""v1"",""created"":""Mon, 4 Apr 2016 16:01:22 GMT""}]","2016-04-05"
"1604.00927","Christos Mantoulidis","Christos Mantoulidis, Pengzi Miao","Total mean curvature, scalar curvature, and a variational analog of
  Brown-York mass","Final version; incorporates changes made for journal",,"10.1007/s00220-016-2767-8",,"math.DG gr-qc","http://arxiv.org/licenses/nonexclusive-distrib/1.0/","  We study the supremum of the total mean curvature on the boundary of compact,
mean-convex 3-manifolds with nonnegative scalar curvature, and a prescribed
boundary metric. We establish an additivity property for this supremum and
exhibit rigidity for maximizers assuming the supremum is attained. When the
boundary consists of 2-spheres, we demonstrate that the finiteness of the
supremum follows from the previous work of Shi-Tam and Wang-Yau on the
quasi-local mass problem in general relativity. In turn, we define a
variational analog of Brown-York quasi-local mass without assuming that the
boundary 2-sphere has positive Gauss curvature.
","[{""version"":""v1"",""created"":""Mon, 4 Apr 2016 16:04:18 GMT""},{""version"":""v2"",""created"":""Thu, 5 May 2016 06:19:14 GMT""},{""version"":""v3"",""created"":""Sun, 16 Oct 2016 06:25:20 GMT""}]","2016-10-18"
"1604.00928","Antoine Pauthier","Antoine Pauthier","Entire solution in cylinder-like domains for a bistable
  reaction-diffusion equation","23 pages",,,,"math.AP","http://arxiv.org/licenses/nonexclusive-distrib/1.0/","  We construct nontrivial entire solutions for a bistable reaction-diffusion
equation in a class of domains that are unbounded in one direction. The
motivation comes from recent results of Berestycki, Bouhours, and Chapuisat
concerning propagation and blocking phenomena in infinite domains. A key
assumption in their study was the ""cylinder-like"" assumption: their domains are
supposed to be straight cylinders in a half space. The purpose of this paper is
to consider domains that tend to a straight cylinder in one direction.
  We also prove the existence of an entire solution for a one-dimensional
problem with a non-homogeneous linear term.
","[{""version"":""v1"",""created"":""Mon, 4 Apr 2016 16:04:19 GMT""},{""version"":""v2"",""created"":""Mon, 26 Sep 2016 21:39:25 GMT""}]","2016-09-28"
"1604.00929","Jan Glaubitz","Jan Glaubitz, Philipp \""Offner, Thomas Sonar","Application of Modal Filtering to a Spectral Difference Method","Updated version","Math. Comp. 87 (2018), 175-207","10.1090/mcom/3257",,"math.NA","http://arxiv.org/licenses/nonexclusive-distrib/1.0/","  We adapt the spectral viscosity (SV) formulation implemented as a modal
filter to a Spectral Difference Method (SD) solving hyperbolic conservation
laws. In the SD Method we use selections of different orthogonal polynomials
(APK polynomials). Furthermore we obtain new error bounds for filtered APK
extensions of smooth functions. We demonstrate that the modal filter also
depends on the chosen polynomial basis in the SD Method. Spectral filtering
stabilizes the scheme and leaves weaker oscillations. Hence, the selection of
the family of orthogonal polynomials on triangles and their specific modal
filter possesses a positive influence on the stability and accuracy of the SD
Method. In the second part, we initiate a stability analysis for a linear
scalar test case with periodic initial condition to find the best selection of
APK polynomials and their specific modal filter. To the best of our knowledge,
this work is the first that gives a stability analysis for a scheme with
spectral filtering. Finally, we demonstrate the influence of the underlying
basis of APK polynomials in a well-known test case.
","[{""version"":""v1"",""created"":""Mon, 4 Apr 2016 16:13:30 GMT""},{""version"":""v2"",""created"":""Wed, 14 Feb 2018 13:25:57 GMT""}]","2018-02-15"
"1604.00930","Monica Patriche","Monica Patriche","Existence of the equilibrium in choice","17 pages",,,,"math.OC","http://creativecommons.org/licenses/by/4.0/","  In this paper, we prove the existence of the equilibrium in choice for games
in choice form. These games have recently been introduced by A. Stefanescu, M.
Ferrara and M. V. Stefanescu. Our results link the recent research to the older
approaches, regarding games in normal form or qualitative games.
","[{""version"":""v1"",""created"":""Mon, 4 Apr 2016 16:16:04 GMT""}]","2016-04-05"
"1604.00932","Hubie Chen","Hubie Chen, Benoit Larose","Asking the metaquestions in constraint tractability",,,,,"cs.CC cs.AI","http://arxiv.org/licenses/nonexclusive-distrib/1.0/","  The constraint satisfaction problem (CSP) involves deciding, given a set of
variables and a set of constraints on the variables, whether or not there is an
assignment to the variables satisfying all of the constraints. One formulation
of the CSP is as the problem of deciding, given a pair (G,H) of relational
structures, whether or not there is a homomorphism from the first structure to
the second structure. The CSP is in general NP-hard; a common way to restrict
this problem is to fix the second structure H, so that each structure H gives
rise to a problem CSP(H). The problem family CSP(H) has been studied using an
algebraic approach, which links the algorithmic and complexity properties of
each problem CSP(H) to a set of operations, the so-called polymorphisms of H.
Certain types of polymorphisms are known to imply the polynomial-time
tractability of $CSP(H)$, and others are conjectured to do so. This article
systematically studies---for various classes of polymorphisms---the
computational complexity of deciding whether or not a given structure H admits
a polymorphism from the class. Among other results, we prove the
NP-completeness of deciding a condition conjectured to characterize the
tractable problems CSP(H), as well as the NP-completeness of deciding if CSP(H)
has bounded width.
","[{""version"":""v1"",""created"":""Mon, 4 Apr 2016 16:18:16 GMT""},{""version"":""v2"",""created"":""Fri, 6 Jan 2017 02:55:16 GMT""}]","2017-01-09"
"1604.00933","Walid Shalaby","Walid Shalaby, Khalifeh Al Jadda, Mohammed Korayem and Trey Grainger","Entity Type Recognition using an Ensemble of Distributional Semantic
  Models to Enhance Query Understanding","A short version of this paper has been accepted in ""COMPSAC 2016: The
  40th IEEE Computer Society International Conference on Computers, Software &
  Applications""",,"10.1109/COMPSAC.2016.109",,"cs.CL cs.IR","http://arxiv.org/licenses/nonexclusive-distrib/1.0/","  We present an ensemble approach for categorizing search query entities in the
recruitment domain. Understanding the types of entities expressed in a search
query (Company, Skill, Job Title, etc.) enables more intelligent information
retrieval based upon those entities compared to a traditional keyword-based
search. Because search queries are typically very short, leveraging a
traditional bag-of-words model to identify entity types would be inappropriate
due to the lack of contextual information. Our approach instead combines clues
from different sources of varying complexity in order to collect real-world
knowledge about query entities. We employ distributional semantic
representations of query entities through two models: 1) contextual vectors
generated from encyclopedic corpora like Wikipedia, and 2) high dimensional
word embedding vectors generated from millions of job postings using word2vec.
Additionally, our approach utilizes both entity linguistic properties obtained
from WordNet and ontological properties extracted from DBpedia. We evaluate our
approach on a data set created at CareerBuilder; the largest job board in the
US. The data set contains entities extracted from millions of job
seekers/recruiters search queries, job postings, and resume documents. After
constructing the distributional vectors of search entities, we use supervised
machine learning to infer search entity types. Empirical results show that our
approach outperforms the state-of-the-art word2vec distributional semantics
model trained on Wikipedia. Moreover, we achieve micro-averaged F 1 score of
97% using the proposed distributional representations ensemble.
","[{""version"":""v1"",""created"":""Mon, 4 Apr 2016 16:18:44 GMT""}]","2016-11-17"
"1604.00934","B\'alint M\'ark V\'as\'arhelyi","B\'alint V\'as\'arhelyi","On the bipartite graph packing problem",,,,,"math.CO","http://arxiv.org/licenses/nonexclusive-distrib/1.0/","  The graph packing problem is a well-known area in graph theory. We consider a
bipartite version and give almost tight conditions on the packability of two
bipartite sequences.
","[{""version"":""v1"",""created"":""Mon, 4 Apr 2016 16:20:27 GMT""},{""version"":""v2"",""created"":""Tue, 2 May 2017 07:04:26 GMT""}]","2017-05-03"
"1604.00935","Ralf Diener","The LCTPC Collaboration: David Atti\'e, Ties Behnke, Alain Bellerive,
  Oleg Bezshyyko, Deb Sankar Bhattacharya, Purba Bhattacharya, Sudeb
  Bhattacharya, Stefano Caiazza, Paul Colas, Gilles De Lentdecker, Klaus
  Dehmelt, Klaus Desch, Ralf Diener, Madhu Dixit, Ivor Fleck, Keisuke Fujii,
  Takahiro Fusayasu, Serguei Ganjour, Yuanning Gao, Philippe Gros, Peter
  Hayman, Vincent Hedberg, Katsumasa Ikematsu, Leif J\""onsson, Jochen Kaminski,
  Yukihiro Kato, Shin-ichi Kawada, Martin Killenberg, Claus Kleinwort, Makoto
  Kobayashi, Vladyslav Krylov, Bo Li, Yulan Li, Bj\""orn Lundberg, Michael
  Lupberger, Nayana Majumdar, Takeshi Matsuda, Rashid Mehdiyev, Ulf
  Mj\""ornmark, Felix M\""uller, Astrid M\""unnich, Supratik Mukhopadhyay,
  Tomohisa Ogawa, Anders Oskarsson, Lennart \""Osterman, Daniel Peterson, Marc
  Riallot, Christoph Rosemann, Stefan Roth, Peter Schade, Oliver Sch\""afer,
  Ronald Dean Settles, Amir Noori Shirazi, Oxana Smirnova, Akira Sugiyama,
  Tohru Takahashi, Junping Tian, Jan Timmermans, Maksym Titov, Dimitra Tsionou,
  Annika Vauth, Wenxin Wang, Takashi Watanabe, Ulrich Werthenbach, Yifan Yang,
  Zhenwei Yang, Ryo Yonamine, Klaus Zenker, Fan Zhang","A Time Projection Chamber with GEM-Based Readout","22 pages, 19 figures",,,"DESY 16-059","physics.ins-det hep-ex","http://creativecommons.org/licenses/by/4.0/","  For the International Large Detector concept at the planned International
Linear Collider, the use of time projection chambers (TPC) with micro-pattern
gas detector readout as the main tracking detector is investigated. In this
paper, results from a prototype TPC, placed in a 1 T solenoidal field and read
out with three independent GEM-based readout modules, are reported. The TPC was
exposed to a 6 GeV electron beam at the DESY II synchrotron. The efficiency for
reconstructing hits, the measurement of the drift velocity, the space point
resolution and the control of field inhomogeneities are presented.
","[{""version"":""v1"",""created"":""Mon, 4 Apr 2016 16:21:06 GMT""}]","2016-04-05"
"1604.00936","Giuseppe Greco","Sabine Frittella and Giuseppe Greco and Alessandra Palmigiano and Fan
  Yang","Structural Multi-type Sequent Calculus for Inquisitive Logic",,,,,"cs.LO","http://arxiv.org/licenses/nonexclusive-distrib/1.0/","  In this paper, we define a multi-type calculus for inquisitive logic, which
is sound, complete and enjoys Belnap-style cut-elimination and subformula
property. Inquisitive logic is the logic of inquisitive semantics, a semantic
framework developed by Groenendijk, Roelofsen and Ciardelli which captures both
assertions and questions in natural language. Inquisitive logic is sound and
complete w.r.t. the so-called state semantics (also known as team semantics).
The Hilbert-style presentation of inquisitive logic is not closed under uniform
substitution; indeed, some occurrences of formulas are restricted to a certain
subclass of formulas, called flat formulas. This and other features make the
quest for analytic calculi for this logic not straightforward. We develop a
certain algebraic and order-theoretic analysis of the team semantics, which
provides the guidelines for the design of a multi-type environment which
accounts for two domains of interpretation, for flat and for general formulas,
as well as for their interaction. This multi-type environment in its turn
provides the semantic environment for the multi-type calculus for inquisitive
logic we introduce in this paper.
","[{""version"":""v1"",""created"":""Mon, 4 Apr 2016 16:29:14 GMT""}]","2016-04-05"
"1604.00937","Ranjith Nair","Ranjith Nair and Mankei Tsang","Far-field Superresolution of Thermal Electromagnetic Sources at the
  Quantum Limit","Close approximation to the published version + Supplementary Material
  (13 pages, 6 figures)","Phys. Rev. Lett. 117, 190801 (2016)","10.1103/PhysRevLett.117.190801",,"quant-ph physics.optics","http://arxiv.org/licenses/nonexclusive-distrib/1.0/","  We obtain the ultimate quantum limit for estimating the transverse separation
of two thermal point sources using a given imaging system with limited spatial
bandwidth. We show via the quantum Cram\'er-Rao bound that, contrary to the
Rayleigh limit in conventional direct imaging, quantum mechanics does
notmandate any loss of precision in estimating even deep sub-Rayleigh
separations. We propose two coherent measurement techniques, easily
implementable using current linear-optics technology, that approach the quantum
limit over an arbitrarily large range of separations. Our bound is valid for
arbitrary source strengths, all regions of the electromagnetic spectrum, and
for any imaging system with an inversion-symmetric point-spread function. The
measurement schemes can be applied to microscopy, optical sensing, and
astrometry at all wavelengths.
","[{""version"":""v1"",""created"":""Mon, 4 Apr 2016 16:31:33 GMT""},{""version"":""v2"",""created"":""Wed, 6 Jul 2016 14:31:55 GMT""},{""version"":""v3"",""created"":""Mon, 28 Nov 2016 01:24:33 GMT""}]","2016-11-29"
"1604.00938","Tomasz Jurczyk","Tomasz Jurczyk and Jinho D. Choi","Multi-Field Structural Decomposition for Question Answering",,,,,"cs.CL","http://arxiv.org/licenses/nonexclusive-distrib/1.0/","  This paper presents a precursory yet novel approach to the question answering
task using structural decomposition. Our system first generates linguistic
structures such as syntactic and semantic trees from text, decomposes them into
multiple fields, then indexes the terms in each field. For each question, it
decomposes the question into multiple fields, measures the relevance score of
each field to the indexed ones, then ranks all documents by their relevance
scores and weights associated with the fields, where the weights are learned
through statistical modeling. Our final model gives an absolute improvement of
over 40% to the baseline approach using simple search for detecting documents
containing answers.
","[{""version"":""v1"",""created"":""Mon, 4 Apr 2016 16:33:15 GMT""}]","2016-04-05"
"1604.00939","Temo Vekua Dr.","Temo Vekua and Gaoyong Sun","Exact asymptotic correlation functions of bilinear spin operators of the
  Heisenberg antiferromagnetic spin-$\frac{1}{2}$ chain","10 pages, 2 figures","Phys. Rev. B 94, 014417 (2016)","10.1103/PhysRevB.94.014417",,"cond-mat.str-el","http://arxiv.org/licenses/nonexclusive-distrib/1.0/","  Exact asymptotic expressions of the uniform parts of the two-point
correlation functions of bilinear spin operators in the Heisenberg
antiferromagnetic spin-$\frac{1}{2}$ chain are obtained. Apart from the
algebraic decay, the logarithmic contribution is identified, and the numerical
prefactor is determined. We also confirm numerically the multiplicative
logarithmic correction of the staggered part of the bilinear spin operators
$\langle\langle S^{a}_0S^{a}_{1}S^{b}_{r}S^{b}_{r+1} \rangle\rangle=(-1)^rd/(r
\ln^{\frac{3}{2}}r) +(3\delta_{a,b}-1) \ln^2r /(12 \pi^4 r^4)$, and estimate
the numerical prefactor as $d\simeq 0.067$. The relevance of our results for
ground state fidelity susceptibility at the Berezinskii-Kosterlitz-Thouless
quantum phase transition points in one-dimensional systems is discussed at the
end of our work.
","[{""version"":""v1"",""created"":""Mon, 4 Apr 2016 16:34:13 GMT""},{""version"":""v2"",""created"":""Fri, 15 Jul 2016 09:01:36 GMT""}]","2016-07-18"
"1604.00940","Remi Geiger","I. Dutta, D. Savoie, B. Fang, B. Venon, C.L. Garrido Alzar, R. Geiger
  and A. Landragin","Continuous Cold-atom Inertial Sensor with $1\ \text{nrad.s}^{-1}$
  Rotation Stability","4 pages, 3 figures","Phys. Rev. Lett. 116, 183003 (2016)","10.1103/PhysRevLett.116.183003",,"physics.atom-ph physics.ins-det","http://arxiv.org/licenses/nonexclusive-distrib/1.0/","  We report the operation of a cold-atom inertial sensor which continuously
captures the rotation signal. Using a joint interrogation scheme, where we
simultaneously prepare a cold-atom source and operate an atom interferometer
(AI) enables us to eliminate the dead times. We show that such continuous
operation improves the short-term sensitivity of AIs, and demonstrate a
rotation sensitivity of $100\ \text{nrad.s}^{-1}.\text{Hz}^{-1/2}$ in a
cold-atom gyroscope of $11 \ \text{cm}^2$ Sagnac area. We also demonstrate a
rotation stability of $1 \ \text{nrad.s}^{-1}$ at $10^4$ s of integration time,
which establishes the record for atomic gyroscopes. The continuous operation of
cold-atom inertial sensors will enable to benefit from the full sensitivity
potential of large area AIs, determined by the quantum noise limit.
","[{""version"":""v1"",""created"":""Mon, 4 Apr 2016 16:38:38 GMT""}]","2016-05-10"
"1604.00941","Holly Swisher","Amanda Folsom, Sharon Garthwaite, Soon-Yi Kang, Holly Swisher,
  Stephanie Treneer","Quantum mock modular forms arising from eta-theta functions","33 pages",,,,"math.NT","http://arxiv.org/licenses/nonexclusive-distrib/1.0/","  In 2013, Lemke Oliver classified all eta-quotients which are theta functions.
In this paper, we unify the eta-theta functions by constructing mock modular
forms from the eta-theta functions with even characters, such that the shadows
of these mock modular forms are given by the eta-theta functions with odd
characters. In addition, we prove that our mock modular forms are quantum
modular forms. As corollaries, we establish simple finite hypergeometric
expressions which may be used to evaluate Eichler integrals of the odd
eta-theta functions, as well as some curious algebraic identities.
","[{""version"":""v1"",""created"":""Mon, 4 Apr 2016 16:42:41 GMT""}]","2016-04-05"
"1604.00942","Emanuel Laci\'c","Emanuel Lacic, Dominik Kowald, Elisabeth Lex","High Enough? Explaining and Predicting Traveler Satisfaction Using
  Airline Review","5 pages + references, 2 tables, 7 figures",,,,"cs.IR","http://arxiv.org/licenses/nonexclusive-distrib/1.0/","  Air travel is one of the most frequently used means of transportation in our
every-day life. Thus, it is not surprising that an increasing number of
travelers share their experiences with airlines and airports in form of online
reviews on the Web. In this work, we thrive to explain and uncover the features
of airline reviews that contribute most to traveler satisfaction. To that end,
we examine reviews crawled from the Skytrax air travel review portal. Skytrax
provides four review categories to review airports, lounges, airlines and
seats. Each review category consists of several five-star ratings as well as
free-text review content. In this paper, we conducted a comprehensive feature
study and we find that not only five-star rating information such as airport
queuing time and lounge comfort highly correlate with traveler satisfaction but
also textual features in the form of the inferred review text sentiment. Based
on our findings, we created classifiers to predict traveler satisfaction using
the best performing rating features. Our results reveal that given our
methodology, traveler satisfaction can be predicted with high accuracy.
Additionally, we find that training a model on the sentiment of the review text
provides a competitive alternative when no five star rating information is
available. We believe that our work is of interest for researchers in the area
of modeling and predicting user satisfaction based on available review data on
the Web.
","[{""version"":""v1"",""created"":""Mon, 4 Apr 2016 16:44:00 GMT""}]","2016-04-05"
"1604.00943","Alejandro Molina-Sanchez Ph.D","Alejandro Molina-S\'anchez, Maurizia Palummo, Andrea Marini, Ludger
  Wirtz","Temperature dependent excitonic effects in the optical properties of
  single-layer MoS$_2$",,"Phys. Rev. B 93 (2016) 155435","10.1103/PhysRevB.93.155435",,"cond-mat.mes-hall","http://arxiv.org/licenses/nonexclusive-distrib/1.0/","  Temperature influences the performance of two-dimensional materials in
optoelectronic devices. Indeed, the optical characterization of these materials
is usually realized at room temperature. Nevertheless most {\it ab-initio}
studies are yet performed without including any temperature effect. As a
consequence, important features are thus overlooked, such as the relative
intensity of the excitonic peaks and their broadening, directly related to the
temperature and to the non-radiative exciton relaxation time. We present {\it
ab-initio} calculations of the optical response of single-layer MoS$_2$, a
prototype 2D material, as a function of temperature using density functional
theory and many-body perturbation theory. We compute the electron-phonon
interaction using the full spinorial wave functions, i.e., fully taking into
account effects of spin-orbit interaction. We find that bound excitons ($A$ and
$B$ peaks) and resonant excitons ($C$ peak) exhibit different behavior with
temperature, displaying different non-radiative linewidths. We conclude that
the inhomogeneous broadening of the absorption spectra is mainly due to
electron-phonon scattering mechanisms. Our calculations explain the
shortcomings of previous (zero-temperature) theoretical spectra and match well
with the experimental spectra acquired at room temperature. Moreover, we
disentangle the contributions of acoustic and optical phonon modes to the
quasi-particles and exciton linewidths. Our model also allows to identify which
phonon modes couple to each exciton state, useful for the interpretation of
resonant Raman scattering experiments.
","[{""version"":""v1"",""created"":""Mon, 4 Apr 2016 16:45:23 GMT""}]","2016-06-06"
