"1604.01218","Xmass Publications","XMASS Collaboration","Detectability of galactic supernova neutrinos coherently scattered on
  xenon nuclei in XMASS","6 pages, 5 figures","XMASS Collaboration, Detectability of galactic supernova neutrinos
  coherently scattered on xenon nuclei in XMASS, Astropart. Phys. 2017","10.1016/j.astropartphys.2017.01.006",,"physics.ins-det astro-ph.HE astro-ph.IM hep-ex nucl-ex","http://arxiv.org/licenses/nonexclusive-distrib/1.0/","  The coherent elastic neutrino-nucleus scattering (CEvNS) plays a crucial role
at the final evolution of stars. The detection of it would be of importance in
astroparticle physics. Among all available neutrino sources, galactic
supernovae give the highest neutrino flux in the MeV range. Among all liquid
xenon dark matter experiments, XMASS has the largest sensitive volume and light
yield. The possibility to detect galactic supernova via the CEvNS-process on
xenon nuclei in the current XMASS detector was investigated. The total number
of events integrated in about 18 seconds after the explosion of a supernova
10~kpc away from the Earth was expected to be from 3.5 to 21.1, depending on
the supernova model used to predict the neutrino flux, while the number of
background events in the same time window was measured to be negligible. All
lead to very high possibility to detect CEvNS experimentally for the first time
utilizing the combination of galactic supernovae and the XMASS detector. In
case of a supernova explosion as close as Betelgeuse, the total observable
events can be more than ten thousand, making it possible to distinguish
different supernova models by examining the evolution of neutrino event rate in
XMASS.
","[{""version"":""v1"",""created"":""Tue, 5 Apr 2016 11:17:22 GMT""},{""version"":""v2"",""created"":""Tue, 24 Jan 2017 15:53:15 GMT""}]","2017-01-25"
"1604.01219","Yuting Qaing","Yuting Qiang, Yanwei Fu, Yanwen Guo, Zhi-Hua Zhou and Leonid Sigal","Learning to Generate Posters of Scientific Papers","in Proceedings of the 30th AAAI Conference on Artificial Intelligence
  (AAAI'16), Phoenix, AZ, 2016",,,,"cs.AI cs.CL cs.HC cs.MM stat.ML","http://arxiv.org/licenses/nonexclusive-distrib/1.0/","  Researchers often summarize their work in the form of posters. Posters
provide a coherent and efficient way to convey core ideas from scientific
papers. Generating a good scientific poster, however, is a complex and time
consuming cognitive task, since such posters need to be readable, informative,
and visually aesthetic. In this paper, for the first time, we study the
challenging problem of learning to generate posters from scientific papers. To
this end, a data-driven framework, that utilizes graphical models, is proposed.
Specifically, given content to display, the key elements of a good poster,
including panel layout and attributes of each panel, are learned and inferred
from data. Then, given inferred layout and attributes, composition of graphical
elements within each panel is synthesized. To learn and validate our model, we
collect and make public a Poster-Paper dataset, which consists of scientific
papers and corresponding posters with exhaustively labelled panels and
attributes. Qualitative and quantitative results indicate the effectiveness of
our approach.
","[{""version"":""v1"",""created"":""Tue, 5 Apr 2016 11:18:04 GMT""}]","2016-04-15"
"1604.01220","Seung-il Nam","Seung-il Nam, Chung-Wen Kao","QCD topological susceptibility from the nonlocal chiral quark model","10 pages, 1 figure",,"10.3938/jkps.70.1027","PKNU-NuHaTh-2016-01, CYCU-HEP-16-02","hep-ph hep-lat nucl-th","http://arxiv.org/licenses/nonexclusive-distrib/1.0/","  We investigate the QCD topological susceptibility $\chi_t$ by using the
nonlocal chiral quark model (NL$\chi$QM). This model is based on the liquid
instanton QCD-vacuum configuration in which $\mathrm{SU}(3)$ flavor symmetry is
explicitly broken by the current quark mass $(m_{u,d},m_s)\approx(5,135)$ MeV.
To compute $\chi_t$, the local topological charge density operator $Q_t(x)$ is
derived from the effective partition function of NL$\chi$QM. We take into
account the contributions from the leading-order (LO) ones
$\sim\mathcal{O}(N_c)$ in the $1/N_c$ expansion. We also verify that the
analytical expression of $\chi_t$ in NL$\chi$QM satisfy the Witten-Veneziano
(WV) and the Leutwyler-Smilga (LS) formulae. Once the average instanton size
and inter-instanton distance are fixed with $\bar{\rho}=1/3$ fm and $\bar{R}=1$
fm, respectively, all the associated model parameters are all determined
self-consistently within the model, including the $\eta$ and $\eta'$ weak decay
constants. We obtain the results such as $F_{\eta}=96.77$ MeV and
$F_{\eta'}=102.53$ MeV for instance. Numerically we observe that
$\chi_{t}=(165.57\,\mathrm{MeV})^4$ in our full calculation. This value is
comparable with its empirical one $\chi_t=(175\pm5\,\mathrm{MeV})^4$. We also
find that our $\chi^\mathrm{WV}_t=\chi^\mathrm{QL}_t=(194.30,\mathrm{MeV})^4$
in the quenched limit and $\chi^\mathrm{LS}_t=(162.54\,\mathrm{MeV})^4$ in the
chiral limit. Consequently, we conclude that $\chi_{t}<\chi^\mathrm{QL}_t$. Our
result also implies that the $(10\sim20)\,\%$ decrease with the dynamical quark
contributions.
","[{""version"":""v1"",""created"":""Tue, 5 Apr 2016 11:30:45 GMT""}]","2017-08-02"
"1604.01221","Guntis Barzdins","Guntis Barzdins, Steve Renals, Didzis Gosko","Character-Level Neural Translation for Multilingual Media Monitoring in
  the SUMMA Project","LREC-2016 submission",,,,"cs.CL","http://arxiv.org/licenses/nonexclusive-distrib/1.0/","  The paper steps outside the comfort-zone of the traditional NLP tasks like
automatic speech recognition (ASR) and machine translation (MT) to addresses
two novel problems arising in the automated multilingual news monitoring:
segmentation of the TV and radio program ASR transcripts into individual
stories, and clustering of the individual stories coming from various sources
and languages into storylines. Storyline clustering of stories covering the
same events is an essential task for inquisitorial media monitoring. We address
these two problems jointly by engaging the low-dimensional semantic
representation capabilities of the sequence to sequence neural translation
models. To enable joint multi-task learning for multilingual neural translation
of morphologically rich languages we replace the attention mechanism with the
sliding-window mechanism and operate the sequence to sequence neural
translation model on the character-level rather than on the word-level. The
story segmentation and storyline clustering problem is tackled by examining the
low-dimensional vectors produced as a side-product of the neural translation
process. The results of this paper describe a novel approach to the automatic
story segmentation and storyline clustering problem.
","[{""version"":""v1"",""created"":""Tue, 5 Apr 2016 11:34:11 GMT""}]","2016-04-06"
"1604.01222","Kenneth Hansen","Kenneth K. Hansen and Lars Bojer Madsen","Same Period Emission and Recombination in Non-Sequential Double
  Recombination High-Harmonic Generation in H$_2$","5 pages, 4 figures","Phys. Rev. A 93, 053427 (2016)","10.1103/PhysRevA.93.053427",,"physics.atom-ph","http://arxiv.org/licenses/nonexclusive-distrib/1.0/","  Non-sequential double recombination (NSDR) high-order harmonic generation
(HHG) is studied in a molecular system. We observe a unique molecular
two-electron effect with a characteristic cutoff in the HHG spectrum at higher
energies than what was previously seen for NSDR HHG in atoms. The effect is
corroborated with a classical model where it is found that the effect is
sensitive to the molecular potential and originates from same period emission
and recombination (SPEaR) of two electrons. The effect persists for
intermediate nuclear distances of $R \gtrsim 8.0$ a.u.
","[{""version"":""v1"",""created"":""Tue, 5 Apr 2016 11:36:33 GMT""}]","2016-06-08"
"1604.01223","Wellington Galleas","W. Galleas","Elliptic solid-on-solid model's partition function as a single
  determinant","6 pages; v2: minor stylistic changes; v3: typo in eq. 11 fixed,
  accepted as Rapid Communication in PRE","Phys. Rev. E 94, 010102 (2016)","10.1103/PhysRevE.94.010102",,"math-ph cond-mat.stat-mech hep-th math.MP nlin.SI","http://arxiv.org/licenses/nonexclusive-distrib/1.0/","  In this work we express the partition function of the integrable elliptic
solid-on-solid model with domain-wall boundary conditions as a single
determinant. This representation appears naturally as the solution of a system
of functional equations governing the model's partition function.
","[{""version"":""v1"",""created"":""Tue, 5 Apr 2016 11:41:26 GMT""},{""version"":""v2"",""created"":""Fri, 15 Apr 2016 09:08:49 GMT""},{""version"":""v3"",""created"":""Mon, 20 Jun 2016 09:31:38 GMT""}]","2016-07-29"
"1604.01224","Luca Barbaglia","Luca Barbaglia, Ines Wilms and Christophe Croux","Commodity Dynamics: A Sparse Multi-class Approach",,,,,"q-fin.EC","http://arxiv.org/licenses/nonexclusive-distrib/1.0/","  The correct understanding of commodity price dynamics can bring relevant
improvements in terms of policy formulation both for developing and developed
countries. Agricultural, metal and energy commodity prices might depend on each
other: although we expect few important effects among the total number of
possible ones, some price effects among different commodities might still be
substantial. Moreover, the increasing integration of the world economy suggests
that these effects should be comparable for different markets. This paper
introduces a sparse estimator of the Multi-class Vector AutoRegressive model to
detect common price effects between a large number of commodities, for
different markets or investment portfolios. In a first application, we consider
agricultural, metal and energy commodities for three different markets. We show
a large prevalence of effects involving metal commodities in the Chinese and
Indian markets, and the existence of asymmetric price effects. In a second
application, we analyze commodity prices for five different investment
portfolios, and highlight the existence of important effects from energy to
agricultural commodities. The relevance of biofuels is hereby confirmed.
Overall, we find stronger similarities in commodity price effects among
portfolios than among markets.
","[{""version"":""v1"",""created"":""Tue, 5 Apr 2016 11:42:56 GMT""},{""version"":""v2"",""created"":""Tue, 13 Sep 2016 12:57:26 GMT""},{""version"":""v3"",""created"":""Wed, 12 Oct 2016 08:34:35 GMT""}]","2016-10-13"
"1604.01225","Bradraj Pandey","Bradraj Pandey and Swapan K. Pati","Triplet Superfluidity on a triangular ladder with dipolar fermions","8 pages and 9 figures","Phys. Rev. B 95, 085105 (2017)","10.1103/PhysRevB.95.085105",,"cond-mat.str-el","http://arxiv.org/licenses/nonexclusive-distrib/1.0/","  Motivated by recent experimental progress in the field of dipolar-Fermi
gases, we investigate the quantum phases of dipolar fermions, on a triangular
ladder at half filling. Using density matrix renormalization group method, in
presence of onsite repulsion and intersite attractive interaction, we find
exotic spin-triplet superfluid phase in addition to the usual spin-density and
charge-density waves. We examine the stability of spin-triplet superfluid phase
by varying hopping along the rungs of the triangle. Possibility of fermionic
supersolidity has also been discussed, by considering three- body interaction
in the Hamiltonian. We also study the effect of spin-dependent hopping on the
stability of spin-triplet superfluid phase.
","[{""version"":""v1"",""created"":""Tue, 5 Apr 2016 11:45:37 GMT""},{""version"":""v2"",""created"":""Wed, 16 Nov 2016 16:50:46 GMT""},{""version"":""v3"",""created"":""Wed, 15 Feb 2017 06:52:56 GMT""}]","2017-02-16"
"1604.01226","Cosimo Inserra","C. Inserra, S. J. Smartt, E. E. E. Gall, G. Leloudas, T.-W. Chen, S.
  Schulze, A. Jerkstarnd, M. Nicholl, J. P. Anderson, I. Arcavi, S. Benetti, R.
  A. Cartier, M. Childress, M. Della Valle, H. Flewelling, M. Fraser, A.
  Gal-Yam, C. P. Gutierrez, G. Hosseinzadeh, D. A. Howell, M. Huber, E.
  Kankare, E. A. Magnier, K. Maguire, C. McCully, S. Prajs, N. Primak, R.
  Scalzo, B. P. Schmidt, M. Smith, K. W. Smith, B. E. Tucker, S. Valenti, M.
  Wilman, D. R. Young, and F. Yuan","On the nature of Hydrogen-rich Superluminous Supernovae","21 pages of main text, 9 pages of appendix. MNRAS accepted. The paper
  has new sections and it has been reorganised, but the conclusions are
  unchanged from previous version",,"10.1093/mnras/stx3179",,"astro-ph.HE astro-ph.CO astro-ph.SR","http://arxiv.org/licenses/nonexclusive-distrib/1.0/","  We present two hydrogen-rich superluminous supernovae (SLSNe), namely
SN2013hx and PS15br. These objects, together with SN2008es are the only SLSNe
showing a distinct, broad Halpha feature during the photospheric phase and also
do not show any sign of strong interaction between fast-moving ejecta and
circumstellar shells in their early spectra. Despite PS15br peak luminosity is
fainter than the other two objects, the spectrophotometric evolution is similar
to SN2013hx and different than any other supernova in a similar luminosity
space. We group all of them as SLSNe II and hence distinct from the known class
of SLSN IIn. Both transients show a strong, multi-component Halpha emission
after 200 days past maximum which we interpret as an indication of interaction
of the ejecta with an asymmetric, clumpy circumstellar material. The spectra
and photometric evolution of the two objects are similar to type II supernovae,
although they have much higher luminosity and evolve on slower timescales. This
is qualitatively similar to how SLSNe I compare with normal type Ic in that the
former are brighter and evolve more slowly. We apply a magnetar and an
interaction semi-analytical codes to fit the light curves of our two objects
and SN2008es. The overall observational dataset would tend to favour the
magnetar, or central engine, model as the source of the peak luminosity
although the clear signature of late-time interaction indicates that
interaction can play a role in the luminosity evolution of SLSNe II at some
phases.
","[{""version"":""v1"",""created"":""Tue, 5 Apr 2016 11:53:08 GMT""},{""version"":""v2"",""created"":""Tue, 5 Dec 2017 15:26:39 GMT""}]","2018-02-21"
"1604.01227","Takashi Tanaka","Takashi Tanaka, Karl Henrik Johansson, Tobias Oechtering, Henrik
  Sandberg, Mikael Skoglund","Rate of Prefix-free Codes in LQG Control Systems","The 2016 IEEE International Symposium on Information Theory",,"10.1109/ISIT.2016.7541729",,"math.OC cs.IT math.IT","http://arxiv.org/licenses/nonexclusive-distrib/1.0/","  In this paper, we consider a discrete time linear quadratic Gaussian (LQG)
control problem in which state information of the plant is encoded in a
variable-length binary codeword at every time step, and a control input is
determined based on the codewords generated in the past. We derive a lower
bound of the rate achievable by the class of prefix-free codes attaining the
required LQG control performance. This lower bound coincides with the infimum
of a certain directed information expression, and is computable by semidefinite
programming (SDP). Based on a technique by Silva et al., we also provide an
upper bound of the best achievable rate by constructing a controller equipped
with a uniform quantizer with subtractive dither and Shannon-Fano coding. The
gap between the obtained lower and upper bounds is less than $0.754r+1$ bits
per time step regardless of the required LQG control performance, where $r$ is
the rank of a signal-to-noise ratio matrix obtained by SDP, which is no greater
than the dimension of the state.
","[{""version"":""v1"",""created"":""Tue, 5 Apr 2016 11:59:51 GMT""}]","2016-11-15"
"1604.01228","Satoshi Ejima","Satoshi Ejima, Fabian H. L. Essler, Florian Lange, and Holger Fehske","Ising tricriticality in the extended Hubbard model with bond
  dimerization","Editors' Suggestion. 9 pages, 9 figures, final version","Phys. Rev. B 93, 235118 (2016)","10.1103/PhysRevB.93.235118",,"cond-mat.str-el","http://arxiv.org/licenses/nonexclusive-distrib/1.0/","  We explore the quantum phase transition between Peierls and
charge-density-wave insulating states in the one-dimensional, half-filled,
extended Hubbard model with explicit bond dimerization. We show that the
critical line of the continuous Ising transition terminates at a tricritical
point, belonging to the universality class of the tricritical Ising model with
central charge $c=7/10$. Above this point, the quantum phase transition becomes
first order. Employing a numerical matrix-product-state based (infinite)
density-matrix renormalization group method we determine the ground-state phase
diagram, the spin and two-particle charge excitations gaps, and the
entanglement properties of the model with high precision. Performing a
bosonization analysis we can derive a field description of the transition
region in terms of a triple sine-Gordon model. This allows us to derive field
theory predictions for the power-law (exponential) decay of the density-density
(spin-spin) and bond-order-wave correlation functions, which are found to be in
excellent agreement with our numerical results.
","[{""version"":""v1"",""created"":""Tue, 5 Apr 2016 12:02:08 GMT""},{""version"":""v2"",""created"":""Sun, 12 Jun 2016 21:04:05 GMT""}]","2016-06-14"
"1604.01229","Joachim Toft jto","Joachim Toft","Matrix parameterized pseudo-differential calculi on modulation spaces","22 pages. The paper include straight-forward extensions on already
  well-known results available in papers by Bayer, Cordero, Gr\""ochenig, Heil,
  Wahlberg and others. In versions 2 and 3: Added one reference, and extended
  some results to include Lebesgue exponents in the interval (0,\infty ]
  instead of [1,\infty]. Corrected misprints",,,,"math.FA","http://arxiv.org/licenses/nonexclusive-distrib/1.0/","  We consider a broad matrix parameterized family of pseudo-differential
calculi, containing the usual Shubin's family of pseudo-differential calculi,
parameterized by real numbers. We show that continuity properties in the
framework of modulation space theory, valid for the Shubin's family extend to
the broader matrix parameterized family of pseudo-differential calculi.
","[{""version"":""v1"",""created"":""Tue, 5 Apr 2016 12:09:35 GMT""},{""version"":""v2"",""created"":""Wed, 4 May 2016 07:11:32 GMT""},{""version"":""v3"",""created"":""Sun, 25 Sep 2016 08:39:03 GMT""}]","2016-09-27"
"1604.01230","Henrik Ueberschaer","Henrik Ueberschaer","Delocalization for random displacement models with Dirac masses","18 pp",,,,"math-ph math.MP","http://arxiv.org/licenses/nonexclusive-distrib/1.0/","  We study a random Schroedinger operator, the Laplacian with random Dirac
delta potentials on a torus T^d_L = R^d/LZ^d, in the thermodynamic limit
L\to\infty, for dimension d=2. The potentials are located on a randomly
distorted lattice Z^2+\omega, where the displacements are i.i.d. random
variables sampled from a compactly supported probability density. We prove
that, if the disorder is sufficiently weak, there exists a certain energy
threshold E_0>0 above which exponential localization of the eigenfunctions must
break down. In fact we can rule out any decay faster than a certain polynomial
one. Our results are obtained by translating the problem of the distribution of
eigenfunctions of the random Schroedinger operator into a study of the spatial
distribution of two point correlation densities of certain random
superpositions of Green's functions and its relation with a lattice point
problem.
","[{""version"":""v1"",""created"":""Tue, 5 Apr 2016 12:13:20 GMT""}]","2016-04-06"
"1604.01231","Hao Tong","H. Tong, F. F. Kou","Possible evolution of the pulsar braking index from larger than three to
  about one","7 pages, 4 figures, accepted in ApJ. Significantly rewritten compared
  with the original version: focusing on the braking index evolution, other
  materials are now dropped off",,"10.3847/1538-4357/aa60c6",,"astro-ph.HE","http://arxiv.org/licenses/nonexclusive-distrib/1.0/","  The coupled evolution of pulsar rotation and inclination angle in the wind
braking model is calculated. The oblique pulsar tends to align. The pulsar
alignment will affect its spin-down behavior. As a pulsar evolves from the
magneto-dipole radiation dominated case to the particle wind dominated case,
the braking index will first increase and then decrease. In the early time, the
braking index may be larger than 3. And during the following long time, the
braking index will be always smaller than 3. The minimum braking index is about
one. This can explain the existence of high braking index larger than 3, and
low braking index of pulsars simultaneously. The pulsar braking index is
expected to evolve from larger than three to about one. A general trend is that
the pulsar braking index will evolve from the Crab-like case to the Vela-like
case.
","[{""version"":""v1"",""created"":""Tue, 5 Apr 2016 12:24:20 GMT""},{""version"":""v2"",""created"":""Thu, 16 Feb 2017 03:46:42 GMT""}]","2017-03-15"
"1604.01232","Tom Lummen","Tom T.A. Lummen, Raymond J. Lamb, Gabriele Berruto, Thomas Lagrange,
  Lucal Dal Negro, F. Javier Garc\'ia de Abajo, Damien McGrouther, Brett
  Barwick and Fabrizio Carbone","Shaping, imaging and controlling plasmonic interference fields at buried
  interfaces","16 pages, 5 figures, 3 supplementary figures",,"10.1038/ncomms13156",,"cond-mat.mes-hall cond-mat.mtrl-sci","http://arxiv.org/licenses/nonexclusive-distrib/1.0/","  Filming and controlling plasmons at buried interfaces with nanometer (nm) and
femtosecond (fs) resolution has yet to be achieved and is critical for next
generation plasmonic/electronic devices. In this work, we use light to excite
and shape a plasmonic interference pattern at a buried metal-dielectric
interface in a nanostructured thin film. Plasmons are launched from a
photoexcited array of nanocavities and their propagation is filmed via
photon-induced near-field electron microscopy (PINEM). The resulting movie
directly captures the plasmon dynamics, allowing quantification of their group
velocity at approximately 0.3c, consistent with our theoretical predictions.
Furthermore, we show that the light polarization and nanocavity design can be
tailored to shape transient plasmonic gratings at the nanoscale. These results,
demonstrating dynamical imaging with PINEM, pave the way for the fs/nm
visualization and control of plasmonic fields in advanced heterostructures
based on novel 2D materials such as graphene, MoS$_2$, and ultrathin metal
films.
","[{""version"":""v1"",""created"":""Tue, 5 Apr 2016 12:32:06 GMT""}]","2016-11-03"
"1604.01233","Lucy Kerns Ph.D.","Lucy Kerns","Construction of Simultaneous Confidence Bands for Multiple Logistic
  Regression Models over Restricted Regions","15 pages, 2 figures in 2016, Statistics: A Journal of Theoretical and
  Applied Statistics",,,,"math.ST stat.ME stat.TH","http://arxiv.org/licenses/nonexclusive-distrib/1.0/","  This article presents methods for constructing an asymptotic hyperbolic band
under the multiple logistic regression model when the predictor variables are
restricted to a specific region $\mathscr{X}$. Scheff\'{e}'s method yields
unnecessarily wide, and hence conservative, bands if the predictor variables
can be restricted to a certain region. Piegorsch and Casella (1988) developed a
procedure to build an asymptotic confidence band for the multiple logistic
regression model over particular regions. Those regions are shown to be special
cases of the region $\mathscr{X}$, which was first investigated by Seppanen and
Uusipaikka (1992) in the multiple linear regression context. This article also
provides methods for constructing conservative confidence bands when the
restricted region is not of the specified form. Particularly, rectangular
restricted regions, which are commonly encountered in practice, are considered.
Two examples are given to illustrate the proposed methodology, and one example
shows that the proposed procedure outperforms the method given by Piegorsch and
Casella (1988).
","[{""version"":""v1"",""created"":""Tue, 5 Apr 2016 12:39:02 GMT""}]","2016-04-06"
"1604.01234","Kathryn Hare","Ignacio Garcia, Kathryn Hare, Franklin Mendivil","Assouad dimensions of complementary sets",,,,,"math.CA","http://arxiv.org/licenses/nonexclusive-distrib/1.0/","  Given a positive, decreasing sequence $a,$ whose sum is $L$, we consider all
the closed subsets of $[0,L]$ such that the lengths of their complementary open
intervals are in one to one correspondence with the sequence $a$. The aim of
this note is to investigate the possible values that Assouad-type dimensions
can attain for this class of sets. In many cases, the set of attainable values
is a closed interval whose endpoints we determine.
","[{""version"":""v1"",""created"":""Tue, 5 Apr 2016 12:40:23 GMT""}]","2016-04-06"
