"1604.01024","Daniela Saadeh","Daniela Saadeh (UCL), Stephen M. Feeney (Imperial College), Andrew
  Pontzen (UCL), Hiranya V. Peiris (UCL), Jason D. McEwen (UCL)","A framework for testing isotropy with the cosmic microwave background","11 pages, 6 figures, v3: minor modifications to match version
  accepted by MNRAS","Monthly Notices of the Royal Astronomical Society, Volume 462,
  Issue 2, p.1802-1811, 2016","10.1093/mnras/stw1731",,"astro-ph.CO gr-qc","http://arxiv.org/licenses/nonexclusive-distrib/1.0/","  We present a new framework for testing the isotropy of the Universe using
cosmic microwave background data, building on the nested-sampling ANICOSMO
code. Uniquely, we are able to constrain the scalar, vector and tensor degrees
of freedom alike; previous studies only considered the vector mode (linked to
vorticity). We employ Bianchi type VII$_h$ cosmologies to model the anisotropic
Universe, from which other types may be obtained by taking suitable limits. In
a separate development, we improve the statistical analysis by including the
effect of Bianchi power in the high-$\ell$, as well as the low-$\ell$,
likelihood. To understand the effect of all these changes, we apply our new
techniques to WMAP data. We find no evidence for anisotropy, constraining shear
in the vector mode to $(\sigma_V/H)_0 < 1.7 \times 10^{-10}$ (95% CL). For the
first time, we place limits on the tensor mode; unlike other modes, the tensor
shear can grow from a near-isotropic early Universe. The limit on this type of
shear is $(\sigma_{T,\rm reg}/H)_0 < 2.4 \times 10^{-7}$ (95% CL).
","[{""version"":""v1"",""created"":""Mon, 4 Apr 2016 20:00:01 GMT""},{""version"":""v2"",""created"":""Mon, 8 Aug 2016 13:39:16 GMT""},{""version"":""v3"",""created"":""Wed, 7 Sep 2016 18:16:46 GMT""}]","2016-09-08"
"1604.01025","Aaron C. Vincent","David G. Cerdeno (IPPP, Durham U.), Malcolm Fairbairn (King's Coll.
  London), Thomas Jubb (IPPP, Durham U.), Pedro A. N. Machado (Madrid, IFT and
  Madrid, Autonoma U.), Aaron C. Vincent (IPPP, Durham U.), Celine Boehm (IPPP,
  Durham U. and Annecy, LAPTH)","Physics from solar neutrinos in dark matter direct detection experiments","15 pages. v3: corrected typos in Table IV and mistake in LUX
  constraints in Fig. 6","JHEP05(2016)118","10.1007/JHEP05(2016)118","IFT-UAM/CSIC-16-031, FTUAM-16-12, IPPP/16/27, DCTP/16/54,
  KCL-PH-TH/2016-19","hep-ph","http://arxiv.org/licenses/nonexclusive-distrib/1.0/","  The next generation of dark matter direct detection experiments will be
sensitive to both coherent neutrino-nucleus and neutrino-electron scattering.
This will enable them to explore aspects of solar physics, perform the lowest
energy measurement of the weak angle to date, and probe contributions from new
theories with light mediators. In this article, we compute the projected
nuclear and electron recoil rates expected in several dark matter direct
detection experiments due to solar neutrinos, and use these estimates to
quantify errors on future measurements of the neutrino fluxes, weak mixing
angle and solar observables, as well as to constrain new physics in the
neutrino sector. Our analysis shows that the combined rates of solar neutrino
events in second generation experiments (SuperCDMS and LZ) can yield a
measurement of the $pp$ flux to 2.5% accuracy via electron recoil, and slightly
improve the $^8$B flux determination. Assuming a low-mass argon phase,
projected tonne-scale experiments like DARWIN can reduce the uncertainty on
both the $pp$ and boron-8 neutrino fluxes to below 1%. Finally, we use current
results from LUX, SuperCDMS and CDMSlite to set bounds on new interactions
between neutrinos and electrons or nuclei, and show that future direct
detection experiments can be used to set complementary constraints on the
parameter space associated with light mediators.
","[{""version"":""v1"",""created"":""Mon, 4 Apr 2016 20:00:01 GMT""},{""version"":""v2"",""created"":""Tue, 24 May 2016 19:32:16 GMT""},{""version"":""v3"",""created"":""Fri, 8 Jul 2016 10:22:02 GMT""}]","2016-07-13"
"1604.01026","Tim Linden","Tim Linden, Nicholas L. Rodd, Benjamin R. Safdi, Tracy R. Slatyer","The High-Energy Tail of the Galactic Center Gamma-Ray Excess","40 pages, 36 figures","Phys. Rev. D 94, 103013 (2016)","10.1103/PhysRevD.94.103013",,"astro-ph.HE hep-ph","http://arxiv.org/licenses/nonexclusive-distrib/1.0/","  Observations by the Fermi-LAT have uncovered a bright, spherically symmetric
excess surrounding the center of the Milky Way galaxy. The spectrum of the
gamma-ray excess peaks sharply at an energy ~2 GeV, exhibiting a hard spectrum
at lower energies, and falls off quickly above an energy ~5 GeV. The spectrum
of the excess above ~10 GeV is potentially an important discriminator between
different physical models for its origin. We focus our study on observations of
the gamma-ray excess at energies exceeding 10 GeV, finding: (1) a statistically
significant excess remains in the energy range 9.5-47.5 GeV, which is not
degenerate with known diffuse emission templates such as the Fermi Bubbles, (2)
the radial profile of the excess at high energies remains relatively consistent
with data near the spectral peak, (3) the data above ~5 GeV prefer a slightly
greater ellipticity with a major axis oriented perpendicular to the Galactic
plane. Using the recently developed non-Poissonian template fit, we find mild
evidence for a point-source origin for the high-energy excess, although given
the statistical and systematic uncertainties we show that a smooth origin of
the high-energy emission cannot be ruled out. We discuss the implication of
these findings for pulsar and dark matter models of the gamma-ray excess.
Finally we provide a number of updated measurements of the gamma-ray excess,
utilizing novel diffuse templates and the Pass 8 dataset.
","[{""version"":""v1"",""created"":""Mon, 4 Apr 2016 20:00:01 GMT""},{""version"":""v2"",""created"":""Sat, 25 Feb 2017 19:37:57 GMT""}]","2017-02-28"
"1604.01027","Robert Grand","Robert J. J. Grand, Volker Springel, Daisuke Kawata, Ivan Minchev,
  Patricia S\'anchez-Bl\'azquez, Facundo A. G\'omez, Federico Marinacci,
  R\""udiger Pakmor, David J. R. Campbell","Spiral-induced velocity and metallicity patterns in a cosmological zoom
  simulation of a Milky Way-sized galaxy","5 pages, 3 figures. Accepted to MNRAS after minor corrections",,"10.1093/mnrasl/slw086",,"astro-ph.GA","http://arxiv.org/licenses/nonexclusive-distrib/1.0/","  We use a high resolution cosmological zoom simulation of a Milky Way-sized
halo to study the observable features in velocity and metallicity space
associated with the dynamical influence of spiral arms. For the first time, we
demonstrate that spiral arms, that form in a disc in a fully cosmological
environment with realistic galaxy formation physics, drive large-scale
systematic streaming motions. In particular, on the trailing edge of the spiral
arms the peculiar galacto-centric radial and azimuthal velocity field is
directed radially outward and azimuthally backward, whereas it is radially
inward and azimuthally forward on the leading edge. Owing to the negative
radial metallicity gradient, this systematic motion drives, at a given radius,
an azimuthal variation in the residual metallicity that is characterised by a
metal rich trailing edge and a metal poor leading edge. We show that these
signatures are theoretically observable in external galaxies with Integral
Field Unit instruments such as VLT/MUSE, and if detected, would provide
evidence for large-scale systematic radial migration driven by spiral arms.
","[{""version"":""v1"",""created"":""Mon, 4 Apr 2016 20:00:01 GMT""},{""version"":""v2"",""created"":""Mon, 16 May 2016 12:12:43 GMT""}]","2016-07-13"
"1604.01028","Thomas O'Brien E","T. E. O'Brien, M. Diez, and C. W. J. Beenakker","Magnetic breakdown and Klein tunneling in a type-II Weyl semimetal","7 pages, 8 figures","Phys. Rev. Lett. 116, 236401 (2016)","10.1103/PhysRevLett.116.236401",,"cond-mat.mes-hall cond-mat.mtrl-sci","http://arxiv.org/licenses/nonexclusive-distrib/1.0/","  The band structure of a type-II Weyl semimetal has pairs of electron and hole
pockets that coexist over a range of energies and touch at a topologically
protected conical point. We identify signatures of this Weyl point in the
magnetic quantum oscillations of the density of states, observable in
thermodynamic properties. Tunneling between the electron and hole pockets in a
magnetic field is the momentum space counterpart of Klein tunneling at a p-n
junction in real space. This magnetic breakdown happens at a characteristic
field that vanishes when the Fermi level approaches the Weyl point.
Topologically distinct, connected or disconnected, pairs of type-II Weyl cones
can be distinguished by the qualitatively different dependence of the quantum
oscillations on the direction of the magnetic field.
","[{""version"":""v1"",""created"":""Mon, 4 Apr 2016 20:00:01 GMT""},{""version"":""v2"",""created"":""Tue, 19 Apr 2016 09:07:27 GMT""}]","2016-06-16"
"1604.01029","Andrea Bracco","Planck Collaboration: N. Aghanim, M. I. R. Alves, D. Arzoumanian, J.
  Aumont, C. Baccigalupi, M. Ballardini, A. J. Banday, R. B. Barreiro, N.
  Bartolo, S. Basak, K. Benabed, J.-P. Bernard, M. Bersanelli, P. Bielewicz, L.
  Bonavera, J. R. Bond, J. Borrill, F. R. Bouchet, F. Boulanger, A. Bracco, M.
  Bucher, C. Burigana, E. Calabrese, J.-F. Cardoso, H. C. Chiang, L. P. L.
  Colombo, C. Combet, B. Comis, F. Couchot, A. Coulais, B. P. Crill, A. Curto,
  F. Cuttaia, R. J. Davis, P. de Bernardis, A. de Rosa, G. de Zotti, J.
  Delabrouille, J.-M. Delouis, E. Di Valentino, C. Dickinson, J. M. Diego, O.
  Dor\'e, M. Douspis, A. Ducout, X. Dupac, S. Dusini, G. Efstathiou, F. Elsner,
  T. A. En{\ss}lin, H. K. Eriksen, E. Falgarone, Y. Fantaye, K. Ferri\`ere, F.
  Finelli, M. Frailis, A. A. Fraisse, E. Franceschi, A. Frolov, S. Galeotta, S.
  Galli, K. Ganga, R. T. G\'enova-Santos, M. Gerbino, T. Ghosh, J.
  Gonz\'alez-Nuevo, K. M. G\'orski, S. Gratton, A. Gregorio, A. Gruppuso, J. E.
  Gudmundsson, V. Guillet, F. K. Hansen, G. Helou, S. Henrot-Versill\'e, D.
  Herranz, E. Hivon, Z. Huang, A. H. Jaffe, T. R. Jaffe, W. C. Jones, E.
  Keih\""anen, R. Keskitalo, T. S. Kisner, N. Krachmalnicoff, M. Kunz, H.
  Kurki-Suonio, G. Lagache, A. L\""ahteenm\""aki, J.-M. Lamarre, M. Langer, A.
  Lasenby, M. Lattanzi, M. Le Jeune, F. Levrier, M. Liguori, P. B. Lilje, M.
  L\'opez-Caniego, P. M. Lubin, J. F. Mac\'ias-P\'erez, G. Maggio, D. Maino, N.
  Mandolesi, A. Mangilli, M. Maris, P. G. Martin, E. Mart\'inez-Gonz\'alez, S.
  Matarrese, N. Mauri, J. D. McEwen, A. Melchiorri, A. Mennella, M. Migliaccio,
  M.-A. Miville-Desch\^enes, D. Molinari, A. Moneti, L. Montier, G. Morgante,
  A. Moss, P. Naselsky, P. Natoli, J. Neveu, H. U. N{\o}rgaard-Nielsen, N.
  Oppermann, C. A. Oxborrow, L. Pagano, D. Paoletti, B. Partridge, O.
  Perdereau, L. Perotto, V. Pettorino, F. Piacentini, S. Plaszczynski, G.
  Polenta, J. P. Rachen, R. Rebolo, M. Reinecke, M. Remazeilles, A. Renzi, I.
  Ristorcelli, G. Rocha, M. Rossetti, G. Roudier, B. Ruiz-Granados, L. Salvati,
  M. Sandri, M. Savelainen, D. Scott, C. Sirignano, J. D. Soler, A.-S.
  Suur-Uski, J. A. Tauber, D. Tavagnacco, M. Tenti, L. Toffolatti, M. Tomasi,
  M. Tristram, T. Trombetti, J. Valiviita, F. Vansyngel, F. Van Tent, P.
  Vielva, F. Villa, B. D. Wandelt, I. K. Wehus, A. Zacchei, and A. Zonca","Planck intermediate results. XLIV. The structure of the Galactic
  magnetic field from dust polarization maps of the southern Galactic cap",,"A&A 596, A105 (2016)","10.1051/0004-6361/201628636",,"astro-ph.GA","http://arxiv.org/licenses/nonexclusive-distrib/1.0/","  We study the statistical properties of interstellar dust polarization at high
Galactic latitude, using the Stokes parameter Planck maps at 353 GHz. Our aim
is to advance the understanding of the magnetized interstellar medium (ISM),
and to provide a model of the polarized dust foreground for cosmic microwave
background component-separation procedures. Focusing on the southern Galactic
cap, we examine the statistical distributions of the polarization fraction
($p$) and angle ($\psi$) to characterize the ordered and turbulent components
of the Galactic magnetic field (GMF) in the solar neighbourhood. We relate
patterns at large angular scales in polarization to the orientation of the mean
(ordered) GMF towards Galactic coordinates $(l_0,b_0)=(70^\circ \pm
5^\circ,24^\circ \pm 5^\circ)$. The histogram of $p$ shows a wide dispersion up
to 25 %. The histogram of $\psi$ has a standard deviation of $12^\circ$ about
the regular pattern expected from the ordered GMF. We use these histograms to
build a phenomenological model of the turbulent component of the GMF, assuming
a uniform effective polarization fraction ($p_0$) of dust emission. To model
the Stokes parameters, we approximate the integration along the line of sight
(LOS) as a sum over a set of $N$ independent polarization layers, in each of
which the turbulent component of the GMF is obtained from Gaussian realizations
of a power-law power spectrum. We are able to reproduce the observed $p$ and
$\psi$ distributions using: a $p_0$ value of (26 $\pm$ 3)%; a ratio of 0.9
$\pm$ 0.1 between the strengths of the turbulent and mean components of the
GMF; and a small value of $N$. We relate the polarization layers to the density
structure and to the correlation length of the GMF along the LOS.
","[{""version"":""v1"",""created"":""Mon, 4 Apr 2016 20:00:02 GMT""}]","2016-12-14"
"1604.01030","Denis Klevers","Denis Klevers and Washington Taylor","Three-Index Symmetric Matter Representations of SU(2) in F-Theory from
  Non-Tate Form Weierstrass Models","34 pages, 3 figures",,"10.1007/JHEP06(2016)171","CERN-TH-2016-063, MIT-CTP-4773","hep-th math.AG","http://arxiv.org/licenses/nonexclusive-distrib/1.0/","  We give an explicit construction of a class of F-theory models with matter in
the three-index symmetric (4) representation of SU(2). This matter is realized
at codimension two loci in the F-theory base where the divisor carrying the
gauge group is singular; the associated Weierstrass model does not have the
form associated with a generic SU(2) Tate model. For 6D theories, the matter is
localized at a triple point singularity of arithmetic genus g=3 in the curve
supporting the SU(2) group. This is the first explicit realization of matter in
F-theory in a representation corresponding to a genus contribution greater than
one. The construction is realized by ""unHiggsing"" a model with a U(1) gauge
factor under which there is matter with charge q=3. The resulting SU(2) models
can be further unHiggsed to realize non-Abelian G_2xSU(2) models with more
conventional matter content or SU(2)^3 models with trifundamental matter. The
U(1) models used as the basis for this construction do not seem to have a
Weierstrass realization in the general form found by Morrison-Park, suggesting
that a generalization of that form may be needed to incorporate models with
arbitrary matter representations and gauge groups localized on singular
divisors.
","[{""version"":""v1"",""created"":""Mon, 4 Apr 2016 20:00:02 GMT""}]","2016-07-20"
"1604.01031","Zhengwei Liu","Zheng-Wei Liu (AIfA, Bonn) and Richard J. Stancliffe (AIfA, Bonn)","Constraining the Progenitor of the Type Ia Supernova SN 2012cg","10 pages, 6 figures, 1 table, accepted for publication in Monthly
  Notices of the Royal Astronomical Society (MNRAS)",,"10.1093/mnras/stw774",,"astro-ph.SR astro-ph.HE","http://arxiv.org/licenses/nonexclusive-distrib/1.0/","  The nature of the progenitors of SNe Ia is not yet fully understood. In the
single-degenerate (SD) scenario, the collision of the SN ejecta with its
companion star is expected to produce detectable UV emission in the first few
days after the SN explosion within certain viewing angles. It was recently
found that the $B-V$ colour of the nearby SN Ia SN 2012cg at about sixteen days
before the maximum $B$-band brightness was about 0.2 mag bluer than those of
other normal SNe Ia, which was reported as the first evidence for excess blue
light from the interaction of normal SN Ia ejecta with its companion star. In
this work, we compare current observations for SN 2012cg from its pre-explosion
phase to the late-time nebular phase with theoretical predictions from binary
evolution and population synthesis calculations for a variety of popular
progenitor scenarios. We find that a main-sequence donor or a carbon-oxygen
white dwarf donor binary system is more likely to be the progenitor of SN
2012cg. However, both scenarios also predict properties which are in
contradiction to the observed features of this system. Taking both theoretical
and observational uncertainties into account, we suggest that it might be too
early to conclude that SN 2012cg was produced from an explosion of a
Chandrasekhar-mass white dwarf in the SD scenario. Future observations and
improved detailed theoretical modelling are still required to place a more
stringent constraint on the progenitor of SN 2012cg.
","[{""version"":""v1"",""created"":""Mon, 4 Apr 2016 20:00:02 GMT""}]","2016-04-06"
"1604.01032","Allison Youngblood","Allison Youngblood, Kevin France, R. O. Parke Loyd, Jeffrey L. Linsky,
  Seth Redfield, P. Christian Schneider, Brian E. Wood, Alexander Brown,
  Cynthia Froning, Yamila Miguel, Sarah Rugheimer, Lucianne Walkowicz","The MUSCLES Treasury Survey II: Intrinsic Lyman Alpha and Extreme
  Ultraviolet Spectra of K and M Dwarfs with Exoplanets","20 pages, 9 figures, accepted for publication in ApJ",,"10.3847/0004-637X/824/2/101",,"astro-ph.SR","http://arxiv.org/licenses/nonexclusive-distrib/1.0/","  The ultraviolet (UV) spectral energy distributions of low-mass (K- and
M-type) stars play a critical role in the heating and chemistry of exoplanet
atmospheres, but are not observationally well-constrained. Direct observations
of the intrinsic flux of the Lyman alpha line (the dominant source of UV
photons from low-mass stars) are challenging, as interstellar HI absorbs the
entire line core for even the closest stars. To address the existing gap in
empirical constraints on the UV flux of K and M dwarfs, the MUSCLES HST
Treasury Survey has obtained UV observations of 11 nearby M and K dwarfs
hosting exoplanets. This paper presents the Lyman alpha and extreme-UV spectral
reconstructions for the MUSCLES targets. Most targets are optically inactive,
but all exhibit significant UV activity. We use a Markov Chain Monte Carlo
technique to correct the observed Lyman alpha profiles for interstellar
absorption, and we employ empirical relations to compute the extreme-UV
spectral energy distribution from the intrinsic Lyman alpha flux in ~100 {\AA}
bins from 100-1170 {\AA}. The reconstructed Lyman alpha profiles have 300 km/s
broad cores, while >1% of the total intrinsic Lyman alpha flux is measured in
extended wings between 300 km/s to 1200 km/s. The Lyman alpha surface flux
positively correlates with the MgII surface flux and negatively correlates with
the stellar rotation period. Stars with larger Lyman alpha surface flux also
tend to have larger surface flux in ions formed at higher temperatures, but
these correlations remain statistically insignificant in our sample of 11
stars. We also present HI column density measurements for 10 new sightlines
through the local interstellar medium.
","[{""version"":""v1"",""created"":""Mon, 4 Apr 2016 20:00:05 GMT""}]","2016-06-29"
"1604.01033","Roman S\""usstrunk","Roman S\""usstrunk, Sebastian D. Huber","Classification of topological phonons in linear mechanical metamaterials","14 pages, 8 figures","Proc. Natl. Acad. Sci. USA 113, E4767 (2016)","10.1073/pnas.1605462113",,"cond-mat.mes-hall cond-mat.mtrl-sci cond-mat.soft","http://arxiv.org/licenses/nonexclusive-distrib/1.0/","  Topological phononic crystals, alike their electronic counterparts, are
characterized by a bulk-edge correspondence where the interior of a material
dictates the existence of stable surface or boundary modes. In the mechanical
setup, such surface modes can be used for various applications such as
wave-guiding, vibration isolation, or the design of static properties such as
stable floppy modes where parts of a system move freely. Here, we provide a
classification scheme of topological phonons based on local symmetries. We
import and adapt the classification of non-interacting electron systems and
embed it into the mechanical setup. Moreover, we provide an extensive set of
examples that illustrate our scheme and can be used to generate new models in
unexplored symmetry classes. Our works unifies the vast recent literature on
topological phonons and paves the way to future applications of topological
surface modes in mechanical metamaterials.
","[{""version"":""v1"",""created"":""Mon, 4 Apr 2016 20:00:11 GMT""}]","2016-09-02"
"1604.01034","Jure Japelj","J. Japelj, S. D. Vergani, R. Salvaterra, P. D'Avanzo, F. Mannucci, A.
  Fernandez-Soto, S. Boissier, L. K. Hunt, H. Atek, L. Rodr\'iguez-Mu\~noz, M.
  Scodeggio, S. Cristiani, E. Le Floc'h, H. Flores, J. Gallego, G. Ghirlanda,
  A. Gomboc, F. Hammer, D. A. Perley, A. Pescalli, P. Petitjean, M. Puech, M.
  Rafelski, G. Tagliaferri","Are LGRBs biased tracers of star formation? Clues from the host galaxies
  of the Swift/BAT6 complete sample of bright LGRBs. II: star formation rates
  and metallicities at z < 1","15 pages, 10 figures, accepted for publication in Astronomy &
  Astrophysics","A&A 590, A129 (2016)","10.1051/0004-6361/201628314",,"astro-ph.HE astro-ph.GA","http://arxiv.org/licenses/nonexclusive-distrib/1.0/","  Long gamma-ray bursts (LGRBs) are associated with the deaths of massive stars
and could thus be a potentially powerful tool to trace cosmic star formation.
However, especially at low redshifts (z < 1.5) LGRBs seem to prefer particular
types of environment. Our aim is to study the host galaxies of a complete
sample of bright LGRBs to investigate the impact of the environment on GRB
formation. We study host galaxy spectra of the Swift/BAT6 complete sample of 14
z < 1 bright LGRBs. We use the detected nebular emission lines to measure the
dust extinction, star formation rate (SFR) and nebular metallicity (Z) of the
hosts and supplement the data set with previously measured stellar masses
M$_{\star}$. The distributions of the obtained properties and their
interrelations (e.g. mass-metallicity and SFR-M$_{\star}$ relations) are
compared to samples of field star-forming galaxies.We find that LGRB hosts at z
< 1 have on average lower SFRs than if they were direct star-formation tracers.
By directly comparing metallicity distributions of LGRB hosts and star-forming
galaxies, we find a good match between the two populations up to Z $\sim
8.4-8.5$, after which the paucity of metal-rich LGRB hosts becomes apparent.
The LGRB host galaxies of our complete sample are not inconsistent with the
mass-metallicity relation at similar mean redshift and stellar masses. The
cutoff against high metallicities (and high masses) can explain the low SFR
values of LGRB hosts. We find a hint of increased incidence of starburst
galaxies in the Swift/BAT6 z < 1 sample with respect to that of a field
star-forming population. Given that the SFRs are low on average, the latter is
ascribed to low stellar masses. Nevertheless the limits on the completeness and
metallicity availability of current surveys, coupled with the limited number of
LGRB host galaxies, prevent us from reaching more quantitative conclusions.
","[{""version"":""v1"",""created"":""Mon, 4 Apr 2016 20:00:14 GMT""}]","2016-06-01"
"1604.01035","Alexander Richings","Alexander J. Richings, Joop Schaye","Chemical evolution of giant molecular clouds in simulations of galaxies","28 pages, 29 figures (including appendices), Accepted for publication
  in MNRAS. Minor changes relative to v1",,"10.1093/mnras/stw1135",,"astro-ph.GA astro-ph.CO","http://arxiv.org/licenses/nonexclusive-distrib/1.0/","  We present an analysis of Giant Molecular Clouds (GMCs) within hydrodynamic
simulations of isolated, low-mass (M* ~ 10^9 M_sol) disc galaxies. We study the
evolution of molecular abundances and the implications for CO emission and the
X_CO conversion factor in individual clouds. We define clouds either as regions
above a density threshold n_H,min = 10 cm^-3, or using an observationally
motivated CO intensity threshold of 0.25 K km s^-1. Our simulations include a
non-equilibrium chemical model with 157 species, including 20 molecules. We
also investigate the effects of resolution and pressure floors (i.e. Jeans
limiters). We find cloud lifetimes up to ~40 Myr, with a median of 13 Myr, in
agreement with observations. At one tenth solar metallicity, young clouds
(<10-15 Myr) are underabundant in H2 and CO compared to chemical equilibrium,
by factors of ~3 and 1-2 orders of magnitude, respectively. At solar
metallicity, GMCs reach chemical equilibrium faster (within ~1 Myr). We also
compute CO emission from individual clouds. The mean CO intensity, I_CO, is
strongly suppressed at low dust extinction, A_v, and possibly saturates towards
high A_v, in agreement with observations. The I_CO - A_v relation shifts
towards higher A_v for higher metallicities and, to a lesser extent, for
stronger UV radiation. At one tenth solar metallicity, CO emission is weaker in
young clouds (<10-15 Myr), consistent with the underabundance of CO.
Consequently, X_CO decreases by an order of magnitude from 0 to 15 Myr, albeit
with a large scatter.
","[{""version"":""v1"",""created"":""Mon, 4 Apr 2016 20:00:16 GMT""},{""version"":""v2"",""created"":""Wed, 11 May 2016 18:50:53 GMT""}]","2016-07-27"
