"1603.03971","Sri Raj Paul","Sri Raj Paul, John Mellor-Crummey, Mauricio Araya-Polo, Detlef Hohl","Performance Analysis and Optimization of a Hybrid Distributed Reverse
  Time Migration Application","2 page extended abstract presented at The International Conference
  for High Performance Computing, Networking, Storage and Analysis (SC) 2015
  for ACM Student Research Competition",,,,"cs.DC","http://arxiv.org/licenses/nonexclusive-distrib/1.0/","  Applications to process seismic data employ scalable parallel systems to
produce timely results. To fully exploit emerging processor architectures,
application will need to employ threaded parallelism within a node and message
passing across nodes. Today, MPI+OpenMP is the preferred programming model for
this task. However, tuning hybrid programs for clusters is difficult.
Performance tools can help users identify bottlenecks and uncover opportunities
for improvement. This poster describes our experiences of applying Rice
University's HPCToolkit and hardware performance counters to gain insight into
an MPI+OpenMP code that performs Reverse Time Migration (RTM) on a cluster of
multicore processors. The tools provided us with insights into the
effectiveness of the domain decomposition strategy, the use of threaded
parallelism, and functional unit utilization in individual cores. By applying
insights obtained from the tools, we were able to improve the performance of
the RTM code by roughly 30 percent.
","[{""version"":""v1"",""created"":""Sat, 12 Mar 2016 22:38:53 GMT""}]","2016-03-15"
"1603.03972","Keith Levin","Keith Levin and Vince Lyzinski","Laplacian Eigenmaps from Sparse, Noisy Similarity Measurements",,,"10.1109/TSP.2016.2645517",,"stat.ML","http://arxiv.org/licenses/nonexclusive-distrib/1.0/","  Manifold learning and dimensionality reduction techniques are ubiquitous in
science and engineering, but can be computationally expensive procedures when
applied to large data sets or when similarities are expensive to compute. To
date, little work has been done to investigate the tradeoff between
computational resources and the quality of learned representations. We present
both theoretical and experimental explorations of this question. In particular,
we consider Laplacian eigenmaps embeddings based on a kernel matrix, and
explore how the embeddings behave when this kernel matrix is corrupted by
occlusion and noise. Our main theoretical result shows that under modest noise
and occlusion assumptions, we can (with high probability) recover a good
approximation to the Laplacian eigenmaps embedding based on the uncorrupted
kernel matrix. Our results also show how regularization can aid this
approximation. Experimentally, we explore the effects of noise and occlusion on
Laplacian eigenmaps embeddings of two real-world data sets, one from speech
processing and one from neuroscience, as well as a synthetic data set.
","[{""version"":""v1"",""created"":""Sat, 12 Mar 2016 23:02:20 GMT""},{""version"":""v2"",""created"":""Tue, 16 Aug 2016 14:16:56 GMT""}]","2017-04-05"
"1603.03973","Hichem Hajaiej","Said El Manouni, Hichem Hajaiej and Patrick Winkert","Bounded Solutions to nonlinear problems involving the fractional
  laplacian depending on parameters","16",,,,"math.AP","http://arxiv.org/licenses/nonexclusive-distrib/1.0/","  The main goal of this paper is the study of two kinds of nonlinear problems
depending on parameters in unbounded domains. Using a nonstandard variational
approach, we first prove the existence of bounded solutions for nonlinear
eigenvalue problems involving the fractional Laplace operator and
nonlinearities that have subcritical growth. In the second part, based on a
variational principle of Ricceri [16], we study a fractional nonlinear problem
with two parameters and prove the existence of multiple solutions.
","[{""version"":""v1"",""created"":""Sun, 13 Mar 2016 00:10:43 GMT""}]","2016-04-04"
"1603.03974","Xing-Qiu Chen","Ronghan Li, Xiyue Cheng, Hui Ma, Shoulong Wang, Dianzhong Li, Zhenyu
  Zhang, Yiyi Li, Xing-Qiu Chen","Dirac node lines in pure alkali earth metals","5 pages, 4 figures","Phys. Rev. Lett. 117, 096401 (2016)","10.1103/PhysRevLett.117.096401",,"cond-mat.mtrl-sci","http://arxiv.org/licenses/nonexclusive-distrib/1.0/","  Beryllium is a simple alkali earth metal, but has been the target of
intensive studies for decades because of its unusual electron behaviors at
surfaces. Puzzling aspects include (i) severe deviations from the description
of the nearly free electron picture, (ii) anomalously large electron-phonon
coupling effect, and (iii) giant Friedal oscillations. The underlying origins
for such anomalous surface electron behaviors have been under active debate,
but with no consensus. Here, by means of first-principle calculations, we
discover that this pure metal system, surprisingly, harbors the Dirac node line
(DNL) that in turn helps to rationalize many of the existing puzzles. The DNL
is featured by a closed line consisting of linear band crossings and its
induced topological surface band agrees well with previous photoemission
spectroscopy observation on Be (0001) surface. We further reveal that each of
the elemental alakali earth metals of Mg, Ca, and Sr also harbors the DNL, and
speculate that the fascinating topological property of DNL might naturally
exist in other elemental metals as well.
","[{""version"":""v1"",""created"":""Sun, 13 Mar 2016 00:10:55 GMT""},{""version"":""v2"",""created"":""Thu, 31 Mar 2016 09:10:23 GMT""}]","2016-08-31"
"1603.03975","Sen-Yue Lou","S. Y. Lou","Alice-Bob systems, $P_s$-$T_d$-$C$ principles and multi-soliton
  solutions","22 pages",,,,"nlin.SI math-ph math.MP","http://arxiv.org/licenses/nonexclusive-distrib/1.0/","  To describe two-place physical problems, many possible models named Alice-Bob
(AB) systems are proposed. To find and to solve these systems, the Parity (P),
time reversal (T), charge conjugation (C), shifted-parity ($P_s$, parity with a
shift), delayed time reversal ($T_d$, time reversal with a delay) and their
possible combinations such as PT, PC, $P_sC$, $P_sT_d$ and $P_sT_dC$ etc. can
be successively used. Especially, some special types of $P_s$-$T_d$-$C$ group
invariant multi-soliton solutions for the KdV-KP-Toda type, mKdV-sG type, NLS
type and discrete $H_1$ type AB systems are explicitly constructed.
","[{""version"":""v1"",""created"":""Sun, 13 Mar 2016 00:16:20 GMT""},{""version"":""v2"",""created"":""Sun, 10 Apr 2016 06:50:33 GMT""}]","2016-04-12"
"1603.03976","Xie BinQiang","Boling Guo, Binqiang Xie, Xiaoyu Xi","On a compressible non-isothermal model for nematic liquid crystals","arXiv admin note: substantial text overlap with arXiv:1108.4939 by
  other authors; text overlap with arXiv:0904.3587 by other authors",,,,"math.AP","http://arxiv.org/licenses/nonexclusive-distrib/1.0/","  We prove the existence of a weak solution to a non-isothermal compressible
model for nematic liquid crystals. An initial-boundary value problem is studied
in a bounded domain with large data. The existence of a global weak solution is
established through a three-level approximation, energy estimates, and weak
convergence for the adiabatic exponent \gamma>3/2.
","[{""version"":""v1"",""created"":""Sun, 13 Mar 2016 00:44:23 GMT""}]","2016-03-15"
"1603.03977","Shuang Song","Shuang Song, Yizhen Wang, Kamalika Chaudhuri","Pufferfish Privacy Mechanisms for Correlated Data",,,,,"cs.LG cs.CR stat.ML","http://arxiv.org/licenses/nonexclusive-distrib/1.0/","  Many modern databases include personal and sensitive correlated data, such as
private information on users connected together in a social network, and
measurements of physical activity of single subjects across time. However,
differential privacy, the current gold standard in data privacy, does not
adequately address privacy issues in this kind of data.
  This work looks at a recent generalization of differential privacy, called
Pufferfish, that can be used to address privacy in correlated data. The main
challenge in applying Pufferfish is a lack of suitable mechanisms. We provide
the first mechanism -- the Wasserstein Mechanism -- which applies to any
general Pufferfish framework. Since this mechanism may be computationally
inefficient, we provide an additional mechanism that applies to some practical
cases such as physical activity measurements across time, and is
computationally efficient. Our experimental evaluations indicate that this
mechanism provides privacy and utility for synthetic as well as real data in
two separate domains.
","[{""version"":""v1"",""created"":""Sun, 13 Mar 2016 00:47:15 GMT""},{""version"":""v2"",""created"":""Tue, 23 Aug 2016 06:01:57 GMT""},{""version"":""v3"",""created"":""Sun, 12 Mar 2017 22:47:02 GMT""}]","2017-03-14"
"1603.03978","Papa Sissokho A","C. Augspurger, M. Minter, K. Shoukry, P. Sissokho, and K. Voss","Avoiding zero-sum subsequences of prescribed length over the integers","13 pages. Added a new reference, corrected typos in the proof of
  Lemma 13, and added more details to the proof of Theorem 5",,,,"math.CO","http://arxiv.org/licenses/nonexclusive-distrib/1.0/","  Let $t$ and $k$ be a positive integers, and let $I_k=\{i\in \mathbb{Z}:\;
-k\leq i\leq k\}$. Let $\mathsf{s}'_t(I_k)$ be the smallest positive integer
$\ell$ such that every zero-sum sequence $S$ over $I_k$ of length $|S|\ge \ell$
contains a zero-sum subsequence of length $t$. If no such $\ell$ exists, then
let $\mathsf{s}'_t(I_k)=\infty$.
  In this paper, we prove that $\mathsf{s}'_t(I_k)$ is finite if and only if
every integer in $[1,D(I_k)]$ divides $t$, where $D(I_k)=\max\{2,2k-1\}$ is the
Davenport constant of $I_k$. Moreover, we prove that if $\mathsf{s}'_t(I_k)$ is
finite, then $t+k(k-1)\leq \mathsf{s}'_t(I_k)\leq t+(2k-2)(2k-3)$. We also show
that $\mathsf{s}'_t(I_k)=t+k(k-1)$ holds for $k\leq 3$ and conjecture that this
equality holds for any $k\geq1$.
","[{""version"":""v1"",""created"":""Sun, 13 Mar 2016 01:02:31 GMT""},{""version"":""v2"",""created"":""Thu, 31 Mar 2016 15:34:46 GMT""},{""version"":""v3"",""created"":""Thu, 1 Dec 2016 19:30:18 GMT""}]","2016-12-02"
"1603.03979","Cheng-Chih Hsieh","Cheng-Chih Hsieh, Anupam Roy, Yao-Feng Chang, Davood Shahrjerdi, and
  Sanjay K. Banerjee","A sub-1-volt analog metal oxide memristive-based synaptic device for
  energy-efficient spike-based computing systems","11 pages of main text, 3 pages of supplementary information, 5
  figures, submitted for Advanced Materials",,"10.1063/1.4971188",,"cond-mat.mes-hall","http://arxiv.org/licenses/nonexclusive-distrib/1.0/","  Nanoscale metal oxide memristors have potential in the development of
brain-inspired computing systems that are scalable and efficient1-3. In such
systems, memristors represent the native electronic analogues of the biological
synapses. However, the characteristics of the existing memristors do not fully
support the key requirements of synaptic connections: high density, adjustable
weight, and low energy operation. Here we show a bilayer memristor that is
forming-free, low-voltage (~|0.8V|), energy-efficient (full On/Off switching at
~2pJ), and reliable. Furthermore, pulse measurements reveal the analog nature
of the memristive device, that is it can be directly programmed to intermediate
resistance states. Leveraging this finding, we demonstrate
spike-timing-dependent plasticity (STDP), a spike-based Hebbian learning rule4.
In those experiments, the memristor exhibits a marked change in the normalized
synaptic strength (>30 times) when the pre- and post-synaptic neural spikes
overlap. This demonstration is an important step towards the physical
construction of high density and high connectivity neural networks.
","[{""version"":""v1"",""created"":""Sun, 13 Mar 2016 01:06:53 GMT""}]","2016-12-21"
"1603.03980","Ravi Ganti","Nikhil Rao, Ravi Ganti, Laura Balzano, Rebecca Willett, Robert Nowak","On Learning High Dimensional Structured Single Index Models","7 pages, 3 tables, 1 Figure, substantial text overlap with
  arXiv:1506.08910; Accepted for publication at AAAI 2017; added new
  experimental results comparing our method to a single layer neural network",,,,"stat.ML cs.AI cs.LG","http://arxiv.org/licenses/nonexclusive-distrib/1.0/","  Single Index Models (SIMs) are simple yet flexible semi-parametric models for
machine learning, where the response variable is modeled as a monotonic
function of a linear combination of features. Estimation in this context
requires learning both the feature weights and the nonlinear function that
relates features to observations. While methods have been described to learn
SIMs in the low dimensional regime, a method that can efficiently learn SIMs in
high dimensions, and under general structural assumptions, has not been
forthcoming. In this paper, we propose computationally efficient algorithms for
SIM inference in high dimensions with structural constraints. Our general
approach specializes to sparsity, group sparsity, and low-rank assumptions
among others. Experiments show that the proposed method enjoys superior
predictive performance when compared to generalized linear models, and achieves
results comparable to or better than single layer feedforward neural networks
with significantly less computational cost.
","[{""version"":""v1"",""created"":""Sun, 13 Mar 2016 01:53:40 GMT""},{""version"":""v2"",""created"":""Tue, 29 Nov 2016 22:55:39 GMT""}]","2016-12-01"
"1603.03981","Menghan Wang","Meera Sitharam, Andrew Vince, Menghan Wang, Miklos Bona","Symmetry in Sphere-based Assembly Configuration Spaces",,"Symmetry 8.1 (2016): 5",,,"math.CO cond-mat.soft","http://arxiv.org/licenses/nonexclusive-distrib/1.0/","  Many remarkably robust, rapid and spontaneous self-assembly phenomena in
nature can be modeled geometrically starting from a collection of rigid bunches
of spheres. This paper highlights the role of symmetry in sphere-based assembly
processes. Since spheres within bunches could be identical and bunches could be
identical as well, the underlying symmetry groups could be of large order that
grows with the number of participating spheres and bunches. Thus, understanding
symmetries and associated isomorphism classes of microstates correspond to
various types of macrostates can significantly reduce the complexity of
computing entropy and free energy, as well as paths and kinetics, in high
dimensional configuration spaces. In addition, a precise understanding of
symmetries is crucial for giving provable guarantees of algorithmic accuracy
and efficiency in such computations. In particular, this may aid in predicting
crucial assembly-driving interactions.
  This is a primarily expository paper that develops a novel, original
framework for dealing with symmetries in configuration spaces of assembling
spheres with the following goals. (1) We give new, formal definitions of
various concepts relevant to sphere-based assembly that occur in previous work,
and in turn, formal definitions of their relevant symmetry groups leading to
the main theorem concerning their symmetries. These previously developed
concepts include, for example, (a) assembly configuration spaces, (b)
stratification of assembly configuration space into regions defined by active
constraint graphs, (c) paths through the configurational regions, and (d)
coarse assembly pathways. (2) We demonstrate the new symmetry concepts to
compute sizes and numbers of orbits in two example settings appearing in
previous work. (3) We give formal statements of a variety of open problems and
challenges using the new conceptual definitions.
","[{""version"":""v1"",""created"":""Sun, 13 Mar 2016 02:33:31 GMT""}]","2016-03-15"
"1603.03982","Hai Zhang","Habib Ammari, Brian Fitzpatrick, David Gontier, Hyundae Lee and Hai
  Zhang","Minnaert resonances for acoustic waves in bubbly media",,,,,"math.AP","http://arxiv.org/licenses/nonexclusive-distrib/1.0/","  Through the application of layer potential techniques and Gohberg-Sigal
theory we derive an original formula for the Minnaert resonance frequencies of
arbitrarily shaped bubbles. We also provide a mathematical justification for
the monopole approximation of scattering of acoustic waves by bubbles at their
Minnaert resonant frequency. Our results are complemented by several numerical
examples which serve to validate our formula in two dimensions.
","[{""version"":""v1"",""created"":""Sun, 13 Mar 2016 02:35:50 GMT""}]","2016-03-15"
"1603.03983","Alina Ostafe","Alina Ostafe","On roots of unity in orbits of rational functions","The case of of rational functions h=f/g with deg f - deg g<0 has been
  removed due to a gap in the argument. The main result holds for the case deg
  f - deg g > 1 only",,,,"math.NT","http://arxiv.org/licenses/nonexclusive-distrib/1.0/","  In this paper we characterise univariate rational functions over a number
field $\K$ having infinitely many points in the cyclotomic closure $\K^c$ for
which the orbit contains a root of unity. Our results are similar to previous
results of Dvornicich and Zannier describing all polynomials having infinitely
many preperiodic points in $\K^c$.
","[{""version"":""v1"",""created"":""Sun, 13 Mar 2016 02:36:28 GMT""},{""version"":""v2"",""created"":""Sat, 30 Apr 2016 11:22:28 GMT""}]","2016-05-03"
"1603.03984","Rudrasis Chakraborty Mr","Rudrasis Chakraborty, Dohyung Seo and Baba C. Vemuri","An efficient Exact-PGA algorithm for constant curvature manifolds","Accepted in CVPR (IEEE Conference on Computer Vision and Pattern
  Recognition) 2016",,,,"cs.CV","http://arxiv.org/licenses/nonexclusive-distrib/1.0/","  Manifold-valued datasets are widely encountered in many computer vision
tasks. A non-linear analog of the PCA, called the Principal Geodesic Analysis
(PGA) suited for data lying on Riemannian manifolds was reported in literature
a decade ago. Since the objective function in PGA is highly non-linear and hard
to solve efficiently in general, researchers have proposed a linear
approximation. Though this linear approximation is easy to compute, it lacks
accuracy especially when the data exhibits a large variance. Recently, an
alternative called exact PGA was proposed which tries to solve the optimization
without any linearization. For general Riemannian manifolds, though it gives
better accuracy than the original (linearized) PGA, for data that exhibit large
variance, the optimization is not computationally efficient. In this paper, we
propose an efficient exact PGA for constant curvature Riemannian manifolds
(CCM-EPGA). CCM-EPGA differs significantly from existing PGA algorithms in two
aspects, (i) the distance between a given manifold-valued data point and the
principal submanifold is computed analytically and thus no optimization is
required as in existing methods. (ii) Unlike the existing PGA algorithms, the
descent into codimension-1 submanifolds does not require any optimization but
is accomplished through the use of the Rimeannian inverse Exponential map and
the parallel transport operations. We present theoretical and experimental
results for constant curvature Riemannian manifolds depicting favorable
performance of CCM-EPGA compared to existing PGA algorithms. We also present
data reconstruction from principal components and directions which has not been
presented in literature in this setting.
","[{""version"":""v1"",""created"":""Sun, 13 Mar 2016 02:57:34 GMT""}]","2016-03-15"
"1603.03985","Lendert Gelens","Pedro Parra-Rivas, Edgar Knobloch, Damia Gomila, Lendert Gelens","Dark solitons in the Lugiato-Lefever equation with normal dispersion","18 pages, 22 figures","Phys. Rev. A 93, 063839 (2016)","10.1103/PhysRevA.93.063839",,"nlin.PS physics.optics","http://arxiv.org/licenses/nonexclusive-distrib/1.0/","  The regions of existence and stability of dark solitons in the
Lugiato-Lefever model with normal chromatic dispersion are described. These
localized states are shown to be organized in a bifurcation structure known as
collapsed snaking implying the presence of a region in parameter space with a
finite multiplicity of dark solitons. For some parameter values dynamical
instabilities are responsible for the appearance of oscillations and temporal
chaos. The importance of the results for understanding frequency comb
generation in microresonators is emphasized.
","[{""version"":""v1"",""created"":""Sun, 13 Mar 2016 03:28:24 GMT""}]","2016-06-29"
"1603.03986","Taekyun Kim","Taekyun Kim, Dae san Kim","Differential equations associated with Legendre polynomials","11 pages",,,,"math.NT","http://arxiv.org/licenses/nonexclusive-distrib/1.0/","  In this paper, we study non-linear differential equations associated with
Legendre polynomials and their applications. From our study of non- linear
differential equations, we derive some new and explicit identities for Legendre
polynomials.
","[{""version"":""v1"",""created"":""Sun, 13 Mar 2016 03:33:12 GMT""}]","2016-03-15"
"1603.03987","Xiao-Shan Gao","Xiao-Shan Gao, Zhang Huang, Chun-Ming Yuan","Binomial Difference Ideals","arXiv admin note: substantial text overlap with arXiv:1404.7580",,,,"cs.SC math.AC","http://arxiv.org/licenses/nonexclusive-distrib/1.0/","  In this paper, binomial difference ideals are studied. Three canonical
representations for Laurent binomial difference ideals are given in terms of
the reduced Groebner basis of Z[x]-lattices, regular and coherent difference
ascending chains, and partial characters over Z[x]-lattices, respectively.
Criteria for a Laurent binomial difference ideal to be reflexive, prime,
well-mixed, and perfect are given in terms of their support lattices. The
reflexive, well-mixed, and perfect closures of a Laurent binomial difference
ideal are shown to be binomial. Most of the properties of Laurent binomial
difference ideals are extended to the case of difference binomial ideals.
Finally, algorithms are given to check whether a given Laurent binomial
difference ideal I is reflexive, prime, well-mixed, or perfect, and in the
negative case, to compute the reflexive, well-mixed, and perfect closures of I.
An algorithm is given to decompose a finitely generated perfect binomial
difference ideal as the intersection of reflexive prime binomial difference
ideals.
","[{""version"":""v1"",""created"":""Sun, 13 Mar 2016 03:49:01 GMT""}]","2016-03-15"
"1603.03988","He Tian","He Tian, Qiushi Guo, Yunjun Xie, Huan Zhao, Cheng Li, Judy J. Cha,
  Fengnian Xia, and Han Wang","Anisotropic Black Phosphorus Synaptic Device for Neuromorphic
  Applications","24 pages, 7 figures, Advanced Materials, In press",,,,"cond-mat.mtrl-sci cond-mat.mes-hall","http://arxiv.org/licenses/nonexclusive-distrib/1.0/","  Synapses are functional links between neurons, through which ""information""
flows in the neural network. These connections vary significantly in strength,
typically resulting from the intrinsic heterogeneity in their chemical and
biological properties. Such heterogeneity is fundamental to the diversity of
neural activities, which together with other features of the brain enables
functions ranging from perception and recognition, to memory and reasoning.
Realizing such heterogeneity in synaptic electronics is critical towards
building artificial neural network with the potential for achieving the level
of complexity in biological systems. However, such intrinsic heterogeneity has
been very challenging to realize in current synaptic devices. Here, we
demonstrate the first black phosphorus (BP) synaptic device, which offers
intrinsic anisotropy in its synaptic characteristics directly resulting from
its low crystal symmetry. The charge transfer between the 2-nm native oxide of
BP and the BP channel is utilized to achieve the synaptic behavior. Key
features of biological synapses such as long-term plasticity with
heterogeneity, including long-term potentiation/depression and
spike-timing-dependent plasticity, are mimicked. With the anisotropic BP
synaptic devices, we also realize a simple compact heterogeneous
axon-multi-synapses network. This demonstration represents an important step
towards introducing intrinsic heterogeneity to artificial neuromorphic systems.
","[{""version"":""v1"",""created"":""Sun, 13 Mar 2016 03:52:37 GMT""}]","2016-03-15"
"1603.03989","Oleg Kalashev E","V. Berezinsky and O. Kalashev","High energy electromagnetic cascades in extragalactic space: physics and
  features","21 pages, 21 figures","Phys. Rev. D 94, 023007 (2016)","10.1103/PhysRevD.94.023007",,"astro-ph.HE","http://arxiv.org/licenses/nonexclusive-distrib/1.0/","  Using the analytic modeling of the electromagnetic cascades compared with
more precise numerical simulations we describe the physical properties of
electromagnetic cascades developing in the universe on CMB and EBL background
radiations. A cascade is initiated by very high energy photon or electron and
the remnant photons at large distance have two-component energy spectrum,
$\propto E^{-2}$ ($\propto E^{-1.9}$ in numerical simulations) produced at
cascade multiplication stage, and $\propto E^{-3/2}$ from Inverse Compton
electron cooling at low energies. The most noticeable property of the cascade
spectrum in analytic modeling is 'strong universality', which includes the
standard energy spectrum and the energy density of the cascade $\omega_{\rm
cas}$ as its only numerical parameter. Using numerical simulations of the
cascade spectrum and comparing it with recent Fermi LAT spectrum we obtained
the upper limit on $\omega_{\rm cas}$ stronger than in previous works. The new
feature of the analysis is ""$E_{\max}$ rule"". We investigate the dependence of
$\omega_{\rm cas}$ on the distribution of sources, distinguishing two cases of
universality: the strong and weak ones.
","[{""version"":""v1"",""created"":""Sun, 13 Mar 2016 03:53:34 GMT""}]","2016-07-27"
