"1603.07547","Hlynur Gretarsson Dr.","H. Gretarsson, N. H. Sung, J. Porras, J. Bertinshaw, C. Dietl, Jan A.
  N. Bruin, A. F. Bangura, Y. K. Kim, R. Dinnebier, Jungho Kim, A. Al-Zein, M.
  Moretti Sala, M. Krisch, M. Le Tacon, B. Keimer, B. J. Kim","Persistent paramagnons deep in the metallic phase of
  Sr$_{2-x}$La$_x$IrO$_4$","6 pages, 4 figures","PRL 117, 107001 (2016)","10.1103/PhysRevLett.117.107001",,"cond-mat.str-el","http://arxiv.org/licenses/nonexclusive-distrib/1.0/","  We have studied the magnetic excitations of electron-doped
Sr$_{2-x}$La$_x$IrO$_4$ ($0 \leq x \leq 0.10$) using resonant inelastic x-ray
scattering (RIXS) at the Ir L$_3$-edge. The long range magnetic order is
rapidly lost with increasing $x$, but two-dimensional short-range order (SRO)
and dispersive magnon excitations with nearly undiminished spectral weight
persist well into the metallic part of the phase diagram. The magnons in the
SRO phase are heavily damped and exhibit anisotropic softening. Their
dispersions are well described by a pseudospin-1/2 Heisenberg model with
exchange interactions whose spatial range increases with doping. We also find a
doping-independent high-energy magnetic continuum, which is not described by
this model. The spin-orbit excitons arising from the pseudospin-3/2 manifold of
the Ir ions broaden substantially in the SRO phase, but remain largely
separated from the low-energy magnons. Pseudospin-1/2 models are therefore a
good starting point for the theoretical description of the low-energy magnetic
dynamics of doped iridates.
","[{""version"":""v1"",""created"":""Thu, 24 Mar 2016 12:32:17 GMT""},{""version"":""v2"",""created"":""Thu, 20 Oct 2016 13:10:34 GMT""}]","2016-10-21"
"1603.07548","Theodoros Horikis","Theodoros P. Horikis","Modulation instability and solitons in two-color nematic crystals",,,"10.1016/j.physleta.2016.08.034",,"nlin.PS nlin.SI physics.optics","http://arxiv.org/licenses/nonexclusive-distrib/1.0/","  The conditions under which stable evolution of two nonlinear interacting
waves are derived within the context of nematic crystals. Two cases are
considered: plane waves and solitons. In the first case, the modulation
instability analysis reveals that while the nonlocal term suppresses the growth
rates, substantially, the coupled system exhibits significantly higher growth
rates than its scalar counterpart. In the soliton case, the necessary
conditions are derived that lead the solitons to exhibit stable, undistorted
evolution, suppressing any breathing behavior and radiation, leading to soliton
mutual guiding.
","[{""version"":""v1"",""created"":""Thu, 24 Mar 2016 12:34:55 GMT""},{""version"":""v2"",""created"":""Sun, 7 Aug 2016 21:37:06 GMT""}]","2016-10-12"
"1603.07550","Kjetil M.D Hals","Kjetil M. D. Hals, Michael Schecter and Mark S. Rudner","Composite Topological Excitations in Ferromagnet-Superconductor
  Heterostructures","Final version accepted by Physical Review Letters; 9 pages, 5 figures","Phys. Rev. Lett. 117, 017001 (2016)","10.1103/PhysRevLett.117.017001","NBI QDEV 2016","cond-mat.mes-hall","http://arxiv.org/licenses/nonexclusive-distrib/1.0/","  We investigate the formation of a new type of composite topological
excitation -- the skyrmion-vortex pair (SVP) -- in hybrid systems consisting of
coupled ferromagnetic and superconducting layers. Spin-orbit interaction in the
superconductor mediates a magnetoelectric coupling between the vortex and the
skyrmion, with a sign (attractive or repulsive) that depends on the topological
indices of the constituents. We determine the conditions under which a bound
SVP is formed, and characterize the range and depth of the effective binding
potential through analytical estimates and numerical simulations. Furthermore,
we develop a semiclassical description of the coupled skyrmion-vortex dynamics
and discuss how SVPs can be controlled by applied spin currents.
","[{""version"":""v1"",""created"":""Thu, 24 Mar 2016 12:43:25 GMT""},{""version"":""v2"",""created"":""Sat, 9 Jul 2016 11:48:26 GMT""}]","2016-07-12"
"1603.07551","F. Javier Garcia de Abajo","F. Javier Garcia de Abajo, Brett Barwick, and Fabrizio Carbone","Electron Diffraction by Plasmon Waves","10 pages, 6 figures","Phys. Rev. B 94, 041404 (2016)","10.1103/PhysRevB.94.041404",,"cond-mat.mes-hall","http://arxiv.org/licenses/nonexclusive-distrib/1.0/","  An electron beam traversing a structured plasmonic field is shown to undergo
diffraction with characteristic angular patterns of both elastic and inelastic
outgoing electron components. In particular, a plasmonic {\it grating} (e.g., a
standing wave formed by two counter-propagating plasmons in a thin film)
produces diffraction orders of the same parity as the net number of exchanged
plasmons. Large diffracted beam fractions are predicted to occur for realistic
plasmon intensities in attainable geometries due to a combination of phase and
amplitude changes locally imprinted on the passing electron wave. Our study
opens new vistas in the study of multiphoton exchanges between electron beams
and evanescent optical fields with unexplored effects related to the
transversal component of the electron wave function.
","[{""version"":""v1"",""created"":""Thu, 24 Mar 2016 12:51:17 GMT""}]","2016-07-20"
"1603.07553","Geoffrey Powell","Geoffrey Powell","On double Poisson structures on commutative algebras","12 pages; very minor revision",,"10.1016/j.geomphys.2016.07.003",,"math.QA","http://arxiv.org/licenses/nonexclusive-distrib/1.0/","  Double Poisson structures (a la Van den Bergh) on commutative algebras are
studied; the main result shows that there are no non-trivial such structures on
polynomial algebras of Krull dimension greater than one. For a general
commutative algebra A, this places significant restrictions on possible double
Poisson structures. Exotic double Poisson structures are exhibited by the case
of the polynomial algebra on a single generator, previously considered by Van
den Bergh.
","[{""version"":""v1"",""created"":""Thu, 24 Mar 2016 12:56:13 GMT""},{""version"":""v2"",""created"":""Fri, 8 Jul 2016 15:40:52 GMT""}]","2016-08-24"
"1603.07554","Victor Quintero","Victor Quintero, Samir M. Perlaza, I\~naki Esnaola, Jean-Marie Gorce","Approximate Capacity of the Gaussian Interference Channel with Noisy
  Channel-Output Feedback","5 Pages, 3 figures. Paper in IEEE Information Theory Workshop 2016
  (ITW-2016)",,"10.1109/ITW.2016.7606879",,"cs.IT math.IT","http://arxiv.org/licenses/nonexclusive-distrib/1.0/","  In this paper, an achievability region and a converse region for the two-user
Gaussian interference channel with noisy channel-output feedback (G-IC-NOF) are
presented. The achievability region is obtained using a random coding argument
and three well-known techniques: rate splitting, superposition coding and
backward decoding. The converse region is obtained using some of the existing
perfect-output feedback outer-bounds as well as a set of new outer-bounds that
are obtained by using genie-aided models of the original G-IC-NOF. Finally, it
is shown that the achievability region and the converse region approximate the
capacity region of the G-IC-NOF to within a constant gap in bits per channel
use.
","[{""version"":""v1"",""created"":""Thu, 24 Mar 2016 12:56:50 GMT""},{""version"":""v2"",""created"":""Sat, 2 Apr 2016 15:53:05 GMT""},{""version"":""v3"",""created"":""Thu, 4 Aug 2016 09:50:44 GMT""},{""version"":""v4"",""created"":""Thu, 11 Aug 2016 08:13:01 GMT""},{""version"":""v5"",""created"":""Mon, 14 Nov 2016 12:25:02 GMT""}]","2016-11-18"
"1603.07555","Luca Rondi","Hongyu Liu, Luca Rondi, Jingni Xiao","Mosco convergence for H(curl) spaces, higher integrability for Maxwell's
  equations, and stability in direct and inverse EM scattering problems","48 pages. To appear in JEMS","Journal of the European Mathematical Society (JEMS) 21 (2019)
  2945-2993","10.4171/JEMS/895",,"math.AP","http://arxiv.org/licenses/nonexclusive-distrib/1.0/","  This paper is concerned with the scattering problem for time-harmonic
electromagnetic waves, due to the presence of scatterers and of inhomogeneities
in the medium.
  We prove a sharp stability result for the solutions to the direct
electromagnetic scattering problem, with respect to variations of the scatterer
and of the inhomogeneity, under minimal regularity assumptions for both of
them. The stability result leads to uniform bounds on solutions to the
scattering problems for an extremely general class of admissible scatterers and
inhomogeneities.
  The uniform bounds are a key step to tackle the challenging stability issue
for the corresponding inverse electromagnetic scattering problem. In this paper
we establish two optimal stability results of logarithmic type for the
determination of polyhedral scatterers by a minimal number of electromagnetic
scattering measurements.
  In order to prove the stability result for the direct electromagnetic
scattering problem, we study two fundamental issues in the theory of Maxwell
equations: Mosco convergence for H(curl) spaces and higher integrability
properties of solutions to Maxwell equations in nonsmooth domains.
","[{""version"":""v1"",""created"":""Thu, 24 Mar 2016 12:58:25 GMT""},{""version"":""v2"",""created"":""Wed, 11 May 2016 13:24:58 GMT""},{""version"":""v3"",""created"":""Sun, 17 Dec 2017 16:22:47 GMT""}]","2020-03-19"
"1603.07556","Janusz Szwabi\'nski","Patryk Siedlecki, Janusz Szwabi\'nski, Tomasz Weron","The interplay between conformity and anticonformity and its polarizing
  effect on society","22 pages, 16 figures, accepted for publication in JASSS",,"10.18564/jasss.3203",,"physics.soc-ph cs.SI","http://arxiv.org/licenses/nonexclusive-distrib/1.0/","  Simmering debates leading to polarization are observed in many domains.
Although empirical findings show a strong correlation between this phenomenon
and modularity of a social network, still little is known about the actual
mechanisms driving communities to conflicting opinions. In this paper, we used
an agent-based model to check if the polarization may be induced by a
competition between two types of social response: conformity and
anticonformity. The proposed model builds on the q-voter model (Castellano et
al. 2009b) and uses a double-clique topology in order to capture segmentation
of a community. Our results indicate that the interplay between intra-clique
conformity and inter-clique anticonformity may indeed lead to a polarized state
of the entire system. We have found a dynamic phase transition controlled by
the fraction $L$ of cross-links between cliques. In the regime of small values
of $L$ system is able to reach the total positive consensus. If the values of
$L$ are large enough, anticonformity takes over and the system always ends up
in a polarized stated. Putting it the other way around, the segmentation of the
network is not a sufficient condition for the polarization to appear. A
suitable level of antagonistic interactions between segments is namely required
to arrive at a polarized steady state within our model.
","[{""version"":""v1"",""created"":""Thu, 24 Mar 2016 13:04:23 GMT""},{""version"":""v2"",""created"":""Wed, 31 Aug 2016 12:03:44 GMT""}]","2016-11-28"
"1603.07557","Alice M.W. Hui","Alice M. W. Hui","A geometric proof of Wilbrink's characterization of even order classical
  unitals",,,,,"math.SG","http://arxiv.org/licenses/nonexclusive-distrib/1.0/","  Using geometric methods and without invoking deep results from group theory,
we prove that a classical unital of even order $n\geq4$ is characterized by two
conditions (I) and (II): (I) is the absence of O'Nan configurations of four
distinct lines intersecting in exactly six distinct points; (II) is a notion of
parallelism. This was previously proven by Wilbrink (1983), where the proof
depends on the classification of finite groups with a split BN-pair of rank 1.
","[{""version"":""v1"",""created"":""Thu, 24 Mar 2016 13:13:08 GMT""}]","2016-03-25"
"1603.07558","Antoni Szczurek","Andrzej Rybicki, Antoni Szczurek, Miroslaw Kielbowicz, Nikolaos Davis
  and Vitalii Ozvenchuk","Can we obtain a ""new femtoscopy"" on the basis of electromagnetic
  effects?","a talk by A. Rybicki at WPCF2015 at Warsaw, Poland",,,,"nucl-th hep-ex hep-ph","http://arxiv.org/licenses/nonexclusive-distrib/1.0/","  We review our studies of spectator-induced electromagnetic (EM) effects on
charged pion emission in ultrarelativistic heavy ion collisions. These effects
are found to consist in the electromagnetic {charge splitting} of pion directed
flow as well as very large distortions in spectra and ratios of produced
charged particles. As it emerges from our analysis, they offer sensitivity to
the actual distance $d_E$ between the pion formation zone at freeze-out and the
spectator matter. As a result, this gives a new possibility of studying the
space-time evolution of dense and hot matter created in the course of the
collision. Having established that $d_E$ traces the longitudinal evolution of
the system and therefore rapidly decreases as a function of pion rapidity, we
investigate the latter finding in view of pion feed-over from intermediate
resonance production. As a result we obtain a first estimate of the pion
decoupling time from EM effects which we compare to existing HBT data. We
conclude that spectator-induced EM interactions can serve as a new tool for
studying the space-time characteristics and longitudinal evolution of the
system.
","[{""version"":""v1"",""created"":""Thu, 24 Mar 2016 13:13:40 GMT""}]","2016-03-25"
"1603.07559","Tony Cai","Tony Cai, Donggyu Kim, Yazhen Wang, Ming Yuan, Harrison H. Zhou","Optimal large-scale quantum state tomography with Pauli measurements","Published at http://dx.doi.org/10.1214/15-AOS1382 in the Annals of
  Statistics (http://www.imstat.org/aos/) by the Institute of Mathematical
  Statistics (http://www.imstat.org)","Annals of Statistics 2016, Vol. 44, No. 2, 682-712","10.1214/15-AOS1382","IMS-AOS-AOS1382","math.ST stat.TH","http://arxiv.org/licenses/nonexclusive-distrib/1.0/","  Quantum state tomography aims to determine the state of a quantum system as
represented by a density matrix. It is a fundamental task in modern scientific
studies involving quantum systems. In this paper, we study estimation of
high-dimensional density matrices based on Pauli measurements. In particular,
under appropriate notion of sparsity, we establish the minimax optimal rates of
convergence for estimation of the density matrix under both the spectral and
Frobenius norm losses; and show how these rates can be achieved by a common
thresholding approach. Numerical performance of the proposed estimator is also
investigated.
","[{""version"":""v1"",""created"":""Thu, 24 Mar 2016 13:19:51 GMT""}]","2016-03-25"
"1603.07560","Allal Ghanmi","A. Ghanmi, A. Intissar, Z. Mouhcine, and M. Ziyat","Likewise theta functions of rank $r$ on $\mathbb{R}^d$: analytic
  properties and associated Segal-Bargmann transform","14 pages",,,,"math.CV","http://arxiv.org/licenses/nonexclusive-distrib/1.0/","  We introduce and study the Hilbert space of $(L^2,\Gamma,\chi)$-likewise
theta functions on $\mathbb{R}^d$ with respect to a given discrete subgroup
$\Gamma$ of arbitrary rank and a character $\chi$ of $\Gamma$. A concrete
description is given and an orthonormal basis is then constructed. Its range by
the classical Segal-Bargmann transform is also characterized and leads to the
so-called theta-Bargmann Fock space.
","[{""version"":""v1"",""created"":""Thu, 24 Mar 2016 13:21:41 GMT""},{""version"":""v2"",""created"":""Thu, 2 Feb 2017 19:09:20 GMT""}]","2017-02-06"
"1603.07561","Gholam Hossein Bordbar","Z. Rezaei and G. H. Bordbar","Saturation properties of nuclear matter in the presence of strong
  magnetic field","16 pages, 1 table, 7 figures, European Physical Journal A 52 (2016)
  accepted","European Physical Journal A 52 (2016) 132","10.1140/epja/i2016-16132-0",,"nucl-th astro-ph.SR","http://creativecommons.org/publicdomain/zero/1.0/","  Different saturation properties of cold symmetric nuclear matter in the
strong magnetic field have been considered. We have seen that for magnetic
fields about $B> 3 \times 10 ^ {17}\ G$, {for both cases with and without
nucleon anomalous magnetic moments}, the saturation density and saturation
energy grow by increasing the magnetic field. It is indicated that the magnetic
susceptibility of symmetric nuclear matter becomes negative showing the
diamagnetic response especially at $B< 3 \times 10 ^ {17}\ G$. We have found
that for the nuclear matter, the magnitude of orbital magnetization reaches the
higher values comparing to the spin magnetization. Our results for the
incompressibility show that at high enough magnetic fields, i.e. $B> 3 \times
10 ^ {17}\ G$, {the softening of equation of state caused by Landau
quantization is overwhelmed by stiffening due to the magnetization of nuclear
matter.} We have shown that the effects of strong magnetic field on nuclear
matter may affect the constraints on the equation of state of symmetric nuclear
matter obtained applying the experimental observable.
","[{""version"":""v1"",""created"":""Thu, 24 Mar 2016 13:21:53 GMT""}]","2016-06-22"
"1603.07562","Slavisa Milovanovic","Slavisa P. Milovanovic and Francois M. Peeters","Characterization of the size and position of electron-hole puddles at a
  graphene p-n junction","This is an author-created, un-copyedited version of an article
  published in Nanotechnology. IOP Publishing Ltd is not responsible for any
  errors or omissions in this version of the manuscript or any version derived
  from it. The Version of Record is available online at
  doi:10.1088/0957-4484/27/10/105203","Nanotechnology 27, 105203 (2016)","10.1088/0957-4484/27/10/105203",,"cond-mat.mes-hall","http://arxiv.org/licenses/nonexclusive-distrib/1.0/","  The effect of an electron-hole puddle on the electrical transport when
governed by snake states in a bipolar graphene structure is investigated. Using
numerical simulations we show that information on the size and position of the
electron-hole puddle can be obtained using the dependence of the conductance on
magnetic field and electron density of the gated region. The presence of the
scatterer disrupts snake state transport which alters the conduction pattern.
We obtain a simple analytical formula that connects the position of the
electron-hole puddle with features observed in the conductance. Size of the
electron-hole puddle is estimated from the magnetic field and gate potential
that maximizes the effect of the puddle on the electrical transport.
","[{""version"":""v1"",""created"":""Thu, 24 Mar 2016 13:23:25 GMT""}]","2016-03-25"
"1603.07563","Jie Zhao","Jie Zhao, Stuart A. Gilchrist, Guillaume Aulanier, Brigitte Schmieder,
  Etienne Pariat and Hui Li","Hooked flare ribbons and flux-rope related QSL footprints","Accepted for publication in ApJ",,"10.3847/0004-637X/823/1/62",,"astro-ph.SR","http://arxiv.org/licenses/nonexclusive-distrib/1.0/","  We studied the magnetic topology of active region 12158 on 2014 September 10
and compared it with the observations before and early in the flare which
begins at 17:21 UT (SOL2014-09-10T17:45:00). Our results show that the
sigmoidal structure and flare ribbons of this active region observed by SDO/AIA
can be well reproduced from a Grad-Rubin non linear force free field
extrapolation method. Various inverse-S and -J shaped magnetic field lines,
that surround a coronal flux rope, coincide with the sigmoid as observed in
different extreme ultraviolet wavelengths, including its multi-threaded curved
ends. Also, the observed distribution of surface currents in the magnetic
polarity where it was not prescribed is well reproduced. This validates our
numerical implementation and set-up of the Grad-Rubin method. The modeled
double inverse-J shaped Quasi-Separatrix Layer (QSL) footprints match the
observed flare ribbons during the rising phase of the flare, including their
hooked parts. The spiral-like shape of the latter may be related to a complex
pre-eruptive flux rope with more than one turn of twist, as obtained in the
model. These ribbon-associated flux-rope QSL-footprints are consistent with the
new standard flare model in 3D, with the presence of a hyperbolic flux tube
located below an inverse tear drop shaped coronal QSL. This is a new step
forward forecasting the locations of reconnection and ribbons in solar flares,
and the geometrical properties of eruptive flux ropes.
","[{""version"":""v1"",""created"":""Thu, 24 Mar 2016 13:24:12 GMT""}]","2016-06-01"
"1603.07564","Yuanping Chen","Zhongwei Zhang, Yuanping Chen, Yuee Xie, and Shengbai Zhang","Transition of thermal rectification in silicon nanocones","in Applied Thermal Engineering 2016",,,,"cond-mat.mes-hall","http://arxiv.org/licenses/nonexclusive-distrib/1.0/","  Current understanding of thermal rectification asserts that the rectification
ratio (R), which measures the relative heat flux between two ends of a
nanostructure, is determined by its geometric asymmetry. The higher the
asymmetry, the higher the R. However, by using nonequilibrium molecular
dynamics method we have calculated thermal transport in Si nanocones as an
example, the results show that such an understanding may be incorrect and R may
not increase monotonically with geometric asymmetry. Rather, R exhibits a sharp
reverse when the vertex angle ({\theta}) of the nanocone is approximately
90{\deg}. In other words, when {\theta} > 90{\deg}, R decreases, rather than
increasing. We show that this abnormal behavior is originated from a change in
the thermal transport mechanism. At small {\theta}s, phonon transport is
dominated by localized modes, especially for transport from tip to bottom. At
large {\theta}s, however, these localized modes disappear, leading to R
decrease.
","[{""version"":""v1"",""created"":""Thu, 24 Mar 2016 13:25:22 GMT""}]","2016-03-25"
"1603.07565","G. Sironi","Giorgio Sironi","Challenges and prospects for better measurements of the CMB intensity
  spectrum","in extenso version of the invited talk presented at CMB@50, Princeton
  9-12 June 2015 19 pages, 4 figures, 2 tables",,"10.1088/1475-7516/2017/02/023",,"astro-ph.IM astro-ph.CO","http://arxiv.org/licenses/nonexclusive-distrib/1.0/","  Spectral distortions of the Cosmic Microwave Background (CMB) offer the
possibility of probing processes which occurred during the evolution of our
Universe going back up to Z$\simeq 10^7$. Unfortunately all the attempts so far
carried out for detecting distortions failed. All of them were based on
comparisons among absolute measurements of the CMB temperature at different
frequencies. We suggest a different approach: measurements of the frequency
derivative of the CMB temperature over large frequency intervals instead of
observations of the absolute temperature at few, well separated, frequencies as
frequently done in the past, and, direct measurements of the foregrounds which
hinder bobservations, at the same site and with the same radiometer prepared
for the search of CMB distortions. We discuss therefore the perspectives of new
observations in the next years from the ground, at very special sites, or in
space as independent missions or part of other CMB projects
","[{""version"":""v1"",""created"":""Thu, 24 Mar 2016 13:26:08 GMT""},{""version"":""v2"",""created"":""Wed, 24 Aug 2016 20:13:32 GMT""},{""version"":""v3"",""created"":""Thu, 17 Nov 2016 11:27:35 GMT""},{""version"":""v4"",""created"":""Mon, 16 Jan 2017 15:16:02 GMT""},{""version"":""v5"",""created"":""Mon, 23 Jan 2017 09:51:48 GMT""}]","2017-02-22"
"1603.07566","Arpad Baricz","\'Arp\'ad Baricz","Zeros of a cross-product of the Coulomb wave and Tricomi hypergeometric
  functions","7 pages","Proceedings of the American Mathematical Society 145(4) (2017)
  1643-1648","10.1090/proc/13331",,"math.CA","http://arxiv.org/licenses/nonexclusive-distrib/1.0/","  Motivated by a problem related to conditions for the existence of clines in
genetics, in this note our aim is to show that the positive zeros of a
cross-product of the regular Coulomb wave function and the Tricomi
hypergeometric function are increasing with respect to the order. In
particular, this implies that the eigenvalues of a boundary value problem are
increasing with the dimension.
","[{""version"":""v1"",""created"":""Thu, 24 Mar 2016 13:31:32 GMT""}]","2017-07-14"
"1603.07567","Marco Tognon","Marco Tognon and Antonio Franchi","Dynamics, Control, and Estimation for Aerial Robots Tethered by Cables
  or Bars",,"IEEE Transaction on Robotics Volume: 33, Issue: 4, Aug. 2017","10.1109/TRO.2017.2677915",,"cs.RO cs.SY","http://arxiv.org/licenses/nonexclusive-distrib/1.0/","  We consider the problem of controlling an aerial robot connected to the
ground by a passive cable or a passive rigid link. We provide a thorough
characterization of this nonlinear dynamical robotic system in terms of
fundamental properties such as differential flatness, controllability, and
observability. We prove that the robotic system is differentially flat with
respect to two output pairs: elevation of the link and attitude of the vehicle;
elevation of the link and longitudinal link force (e.g., cable tension, or bar
compression). We show the design of an almost globally convergent nonlinear
observer of the full state that resorts only to an onboard accelerometer and a
gyroscope. We also design two almost globally convergent nonlinear controllers
to track any sufficiently smooth time-varying trajectory of the two output
pairs. Finally we numerically test the robustness of the proposed method in
several far-from-nominal conditions: nonlinear cross-coupling effects,
parameter deviations, measurements noise and non ideal actuators.
","[{""version"":""v1"",""created"":""Thu, 24 Mar 2016 13:32:10 GMT""},{""version"":""v2"",""created"":""Fri, 3 Mar 2017 09:10:12 GMT""}]","2017-12-20"
