"1603.07339","Martin Kolo\v{s}","Zden\v{e}k Stuchl\'ik, Martin Kolo\v{s}","Mass of intermediate black hole in the source M82 X-1 restricted by
  models of twin high-frequency quasi-periodic oscillations",,"Monthly Notices of the Royal Astronomical Society, Volume 451,
  Issue 3, p.2575-2588 (2015)","10.1093/mnras/stv1120",,"astro-ph.HE","http://arxiv.org/licenses/nonexclusive-distrib/1.0/","  We apply the relativistic precession (RP) model with its variants and the
resonance epicyclic model with its variants, based on the frequencies of the
geodesic epicyclic motion in the field of a Kerr black hole, to put limits on
the mass of the black hole in the ultraluminous X-ray source M82 X-1
demonstrating twin high-frequency quasi-periodic oscillations (HF QPOs) with
the frequency ratio near 3:2. The mass limits implied by the geodesic HF QPO
models are compared to those obtained due to the model of string loop
oscillations around a stable equilibrium position. Assuming the whole range of
the black hole dimensionless spin, 0 < a < 1, the restrictions on the black
hole mass related to the twin HF QPOs are widely extended and strongly model
dependent; nevertheless, they give the lower limit M_{M82 X-1} > 130 M_{sun}
confirming existence of an intermediate black hole in the M82 X-1 source. The
upper limit given by one of the variants of the geodesic twin HF QPO models
goes up to M_{M82 X-1}<1500 M_{sun}. The range 37-210 mHz of the low-frequency
QPOs observed in the M82 X-1 source introduces additional restrictive limits on
the black hole mass, if we model the low-frequency QPOs by nodal precession of
the epicyclic motion. The nodal precession model restrictions combined with
those implied by the geodesic models of the twin HF QPOs give allowed ranges of
the M82 X-1 black hole parameters, namely 140 M_{sun}<M_{M82 X-1}<660 M_{sun}
for the mass parameter and 0.05<a_{M82 X-1}<0.6 for the spin parameter.
","[{""version"":""v1"",""created"":""Wed, 23 Mar 2016 20:11:08 GMT""}]","2016-04-06"
"1603.07340","Tillmann Miltzow","D\'aniel Marx and Tillmann Miltzow","Peeling and Nibbling the Cactus: Subexponential-Time Algorithms for
  Counting Triangulations and Related Problems","47 pages, 23 Figures, to appear in SoCG 2016",,,,"cs.CG cs.DM cs.DS math.CO","http://arxiv.org/licenses/nonexclusive-distrib/1.0/","  Given a set of $n$ points $S$ in the plane, a triangulation $T$ of $S$ is a
maximal set of non-crossing segments with endpoints in $S$. We present an
algorithm that computes the number of triangulations on a given set of $n$
points in time $n^{(11+ o(1))\sqrt{n} }$, significantly improving the previous
best running time of $O(2^n n^2)$ by Alvarez and Seidel [SoCG 2013]. Our main
tool is identifying separators of size $O(\sqrt{n})$ of a triangulation in a
canonical way. The definition of the separators are based on the decomposition
of the triangulation into nested layers (""cactus graphs""). Based on the above
algorithm, we develop a simple and formal framework to count other non-crossing
straight-line graphs in $n^{O(\sqrt{n})}$ time. We demonstrate the usefulness
of the framework by applying it to counting non-crossing Hamilton cycles,
spanning trees, perfect matchings, $3$-colorable triangulations, connected
graphs, cycle decompositions, quadrangulations, $3$-regular graphs, and more.
","[{""version"":""v1"",""created"":""Wed, 23 Mar 2016 20:12:41 GMT""}]","2016-08-06"
"1603.07341","Tayfun Gokmen","Tayfun Gokmen, Yurii Vlasov","Acceleration of Deep Neural Network Training with Resistive Cross-Point
  Devices","19 pages, 5 figures, 2 tables","Front. Neurosci 10, 333 (2016)","10.3389/fnins.2016.00333",,"cs.LG cs.NE stat.ML","http://arxiv.org/licenses/nonexclusive-distrib/1.0/","  In recent years, deep neural networks (DNN) have demonstrated significant
business impact in large scale analysis and classification tasks such as speech
recognition, visual object detection, pattern extraction, etc. Training of
large DNNs, however, is universally considered as time consuming and
computationally intensive task that demands datacenter-scale computational
resources recruited for many days. Here we propose a concept of resistive
processing unit (RPU) devices that can potentially accelerate DNN training by
orders of magnitude while using much less power. The proposed RPU device can
store and update the weight values locally thus minimizing data movement during
training and allowing to fully exploit the locality and the parallelism of the
training algorithm. We identify the RPU device and system specifications for
implementation of an accelerator chip for DNN training in a realistic
CMOS-compatible technology. For large DNNs with about 1 billion weights this
massively parallel RPU architecture can achieve acceleration factors of 30,000X
compared to state-of-the-art microprocessors while providing power efficiency
of 84,000 GigaOps/s/W. Problems that currently require days of training on a
datacenter-size cluster with thousands of machines can be addressed within
hours on a single RPU accelerator. A system consisted of a cluster of RPU
accelerators will be able to tackle Big Data problems with trillions of
parameters that is impossible to address today like, for example, natural
speech recognition and translation between all world languages, real-time
analytics on large streams of business and scientific data, integration and
analysis of multimodal sensory data flows from massive number of IoT (Internet
of Things) sensors.
","[{""version"":""v1"",""created"":""Wed, 23 Mar 2016 20:13:11 GMT""}]","2017-05-24"
"1603.07342","Arkadiusz Hypki Dr","Arkadiusz Hypki","BEANS - a software package for distributed Big Data analysis","14 pages, 6 figures, submitted to MNRAS, comments are welcome",,,,"astro-ph.IM cs.MS","http://arxiv.org/licenses/nonexclusive-distrib/1.0/","  BEANS software is a web based, easy to install and maintain, new tool to
store and analyse data in a distributed way for a massive amount of data. It
provides a clear interface for querying, filtering, aggregating, and plotting
data from an arbitrary number of datasets. Its main purpose is to simplify the
process of storing, examining and finding new relations in the so-called Big
Data.
  Creation of BEANS software is an answer to the growing needs of the
astronomical community to have a versatile tool to store, analyse and compare
the complex astrophysical numerical simulations with observations (e.g.
simulations of the Galaxy or star clusters with the Gaia archive). However,
this software was built in a general form and it is ready to use in any other
research field or open source software.
","[{""version"":""v1"",""created"":""Wed, 23 Mar 2016 20:14:34 GMT""}]","2016-03-25"
"1603.07344","Stanley Snelson","Stanley Snelson","Asymptotic stability for odd perturbations of the the stationary kink in
  the variable-speed $\phi^4$ model","22 pages, minor errors corrected",,,,"math.AP math-ph math.MP","http://arxiv.org/licenses/nonexclusive-distrib/1.0/","  We consider the $\phi^4$ model in one space dimension with propagation speeds
that are small deviations from a constant function. In the constant-speed case,
a stationary solution called the kink is known explicitly, and the recent work
of Kowalczyk, Martel, and Mu\~noz established the asymptotic stability of the
kink with respect to odd perturbations in the natural energy space. We show
that a stationary kink solution exists also for our class of non-constant
propagation speeds, and extend the asymptotic stability result by taking a
perturbative approach to the method of Kowalczyk, Martel, and Mu\~noz. This
requires an understanding of the spectrum of the linearization around the
variable-speed kink.
","[{""version"":""v1"",""created"":""Wed, 23 Mar 2016 20:26:13 GMT""},{""version"":""v2"",""created"":""Thu, 1 Dec 2016 02:24:52 GMT""}]","2016-12-02"
"1603.07345","Mikhail Klassen","Mikhail Klassen, Ralph Pudritz, Rolf Kuiper, Thomas Peters, Robi
  Banerjee","Simulating the Formation of Massive Protostars: I. Radiative Feedback
  and Accretion Disks","24 pages, 14 figures. Accepted to The Astrophysical Journal",,"10.3847/0004-637X/823/1/28",,"astro-ph.GA astro-ph.SR","http://arxiv.org/licenses/nonexclusive-distrib/1.0/","  We present radiation hydrodynamic simulations of collapsing protostellar
cores with initial masses of 30, 100, and 200 M$_{\odot}$. We follow their
gravitational collapse and the formation of a massive protostar and
protostellar accretion disk. We employ a new hybrid radiative feedback method
blending raytracing techniques with flux-limited diffusion for a more accurate
treatment of the temperature and radiative force. In each case, the disk that
forms becomes Toomre-unstable and develops spiral arms. This occurs between
0.35 and 0.55 freefall times and is accompanied by an increase in the accretion
rate by a factor of 2-10. Although the disk becomes unstable, no other stars
are formed. In the case of our 100 and 200 M$_{\odot}$ simulation, the star
becomes highly super-Eddington and begins to drive bipolar outflow cavities
that expand outwards. These radiatively-driven bubbles appear stable, and
appear to be channeling gas back onto the protostellar accretion disk.
Accretion proceeds strongly through the disk. After 81.4 kyr of evolution, our
30 M$_{\odot}$ simulation shows a star with a mass of 5.48 M$_{\odot}$ and a
disk of mass 3.3 M$_{\odot}$, while our 100 M$_{\odot}$ simulation forms a 28.8
M$_{\odot}$ mass star with a 15.8 M$_{\odot}$ disk over the course of 41.6 kyr,
and our 200 M$_{\odot}$ simulation forms a 43.7 M$_{\odot}$ star with an 18
M$_{\odot}$ disk in 21.9 kyr. In the absence of magnetic fields or other forms
of feedback, the masses of the stars in our simulation do not appear limited by
their own luminosities.
","[{""version"":""v1"",""created"":""Wed, 23 Mar 2016 20:27:24 GMT""},{""version"":""v2"",""created"":""Thu, 7 Apr 2016 18:14:38 GMT""}]","2016-05-25"
"1603.07346","Qiushi Guo","Qiushi Guo, Andreas Pospischil, Maruf Bhuiyan, Hao Jiang, He Tian,
  Damon Farmer, Bingchen Deng, Cheng Li, Shu-Jen Han, Han Wang, Qiangfei Xia,
  Tso-Ping Ma, Thomas Mueller, and Fengnian Xia","Black Phosphorus Mid-Infrared Photodetectors with High Gain",,"Nano Lett., 2016, 16 (7), pp 4648-4655","10.1021/acs.nanolett.6b01977",,"cond-mat.mtrl-sci","http://arxiv.org/licenses/nonexclusive-distrib/1.0/","  Recently, black phosphorus (BP) has joined the two dimensional material
family as a promising candidate for photonic applications, due to its moderate
bandgap, high carrier mobility, and compatibility with a diverse range of
substrates. Photodetectors are probably the most explored BP photonic devices,
however, their unique potential compared with other layered materials in the
mid-infrared wavelength range has not been revealed. Here, we demonstrate BP
mid infrared detectors at 3.39 um with high internal gain, resulting in an
external responsivity of 82 A/W. Noise measurements show that such BP
photodetectors are capable of sensing low intensity mid-infrared light in the
picowatt range. Moreover, the high photoresponse remains effective at kilohertz
modulation frequencies, because of the fast carrier dynamics arising from BPs
moderate bandgap. The high photoresponse at mid infrared wavelengths and the
large dynamic bandwidth, together with its unique polarization dependent
response induced by low crystalline symmetry, can be coalesced to promise
photonic applications such as chip-scale mid-infrared sensing and imaging at
low light levels.
","[{""version"":""v1"",""created"":""Wed, 23 Mar 2016 20:28:07 GMT""}]","2017-01-09"
"1603.07347","Arkadiusz Hypki Dr","Arkadiusz Hypki (1, 2) and Anthony G.A. Brown (1) ((1) Sterrewacht
  Leiden, (2) N. Copernicus Astronomical Center)","Gaia archive","Proceedings of the XXXVII Meeting of the Polish Astronomical Society",,,,"astro-ph.GA astro-ph.IM","http://arxiv.org/licenses/nonexclusive-distrib/1.0/","  The Gaia archive is being designed and implemented by the DPAC Consortium.
The purpose of the archive is to maximize the scientific exploitation of the
Gaia data by the astronomical community. Thus, it is crucial to gather and
discuss with the community the features of the Gaia archive as much as
possible. It is especially important from the point of view of the GENIUS
project to gather the feedback and potential use cases for the archive. This
paper presents very briefly the general ideas behind the Gaia archive and
presents which tools are already provided to the community.
","[{""version"":""v1"",""created"":""Wed, 23 Mar 2016 20:29:13 GMT""}]","2016-03-25"
"1603.07348","Chong Qi","Chong Qi, Tao Chen","Exact solution of the pairing problem for spherical and deformed systems","5 pages, 6 figures","Phys. Rev. C 92, 051304(R) (2015)","10.1103/PhysRevC.92.051304",,"nucl-th","http://arxiv.org/licenses/nonexclusive-distrib/1.0/","  There has been increasing interest in studying the Richardson model from
which one can derive the exact solution for certain pairing Hamiltonians.
However, it is still a numerical challenge to solve the nonlinear equations
involved. In this paper we tackle this problem by employing a simple hybrid
polynomial approach. The method is found to be robust and is valid for both
deformed and nearly spherical nuclei. It also provides important and convenient
initial guesses for spherical systems with large degeneracy. As an example, we
apply the method to study the shape coexistence in neutron-rich Ni isotopes.
","[{""version"":""v1"",""created"":""Wed, 23 Mar 2016 20:31:27 GMT""}]","2016-03-25"
"1603.07349","Vincent Emery","Vincent Emery","On volumes of quasi-arithmetic hyperbolic lattices","11 pages. Final version. To appear in Selecta math","Sel. Math. New Ser. (2017) 23: 2849","10.1007/s00029-017-0308-8",,"math.MG math.KT math.NT","http://arxiv.org/licenses/nonexclusive-distrib/1.0/","  We prove that the covolume of any quasi-arithmetic hyperbolic lattice (a
notion that generalizes the definition of arithmetic subgroups) is a rational
multiple of the covolume of an arithmetic subgroup. As a corollary, we obtain a
good description for the shape of the volumes of most of the known hyperbolic
n-manifolds with n>3.
","[{""version"":""v1"",""created"":""Wed, 23 Mar 2016 20:34:44 GMT""},{""version"":""v2"",""created"":""Sat, 9 Apr 2016 20:33:08 GMT""},{""version"":""v3"",""created"":""Tue, 31 Jan 2017 10:05:01 GMT""}]","2018-02-23"
"1603.07351","Christian Cachin","Christian Cachin, Simon Schubert, Marko Vukoli\'c","Non-determinism in Byzantine Fault-Tolerant Replication",,,,,"cs.DC cs.CR","http://arxiv.org/licenses/nonexclusive-distrib/1.0/","  Service replication distributes an application over many processes for
tolerating faults, attacks, and misbehavior among a subset of the processes.
The established state-machine replication paradigm inherently requires the
application to be deterministic. This paper distinguishes three models for
dealing with non-determinism in replicated services, where some processes are
subject to faults and arbitrary behavior (so-called Byzantine faults): first, a
modular approach that does not require any changes to the potentially
non-deterministic application (and neither access to its internal data);
second, a master-slave approach, in which ties are broken by a leader and the
other processes validate the choices of the leader; and finally, a treatment of
applications that use cryptography and secret keys. Cryptographic operations
and secrets must be treated specially because they require strong randomness to
satisfy their goals.
  The paper also introduces two new protocols. The first uses the modular
approach for filtering out non-de\-ter\-min\-istic operations in an
application. It ensures that all correct processes produce the same outputs and
that their internal states do not diverge. The second protocol implements
cryptographically secure randomness generation with a verifiable random
function and is appropriate for certain security models. All protocols are
described in a generic way and do not assume a particular implementation of the
underlying consensus primitive.
","[{""version"":""v1"",""created"":""Wed, 23 Mar 2016 20:42:55 GMT""},{""version"":""v2"",""created"":""Mon, 19 Dec 2016 17:08:40 GMT""}]","2016-12-20"
"1603.07352","Keh-Fei Liu","Keh-Fei Liu","Parton Distribution Function from the Hadronic Tensor on the Lattice","7 pages, 2 figures",,,,"hep-ph hep-lat nucl-th","http://arxiv.org/licenses/nonexclusive-distrib/1.0/","  The path-integral formulation of the hadronic tensor W_{\mu\nu} of deep
inelastic scattering is reviewed. It is shown that there are 3 gauge invariant
and topologically distinct contributions. The separation of the connected sea
partons from those of the disconnected sea can be achieved with a combination
of the global fit of the parton distribution function (PDF), the semi-inclusive
DIS data on the strange PDF and the lattice calculation of the ratio of the
strange to $u/d$ momentum fraction in the disconnected insertion. We shall
discuss numerical issues associated with lattice calculation of the hadronic
tensor involving a four-point function, such as large hadron momenta and
improved maximum entropy method to obtain the spectral density from the
hadronic tensor in Euclidean time. We also draw a comparison between the large
momentum approach to the parton distribution function (PDF) and the hadronic
tensor approach.
","[{""version"":""v1"",""created"":""Wed, 23 Mar 2016 20:45:16 GMT""}]","2016-03-25"
"1603.07353","Nicolas Perinet","Nicolas P\'erinet, Pablo Guti\'errez, H\'ector Urra, Nicol\'as Mujica
  and Leonardo Gordillo","Streaming patterns in Faraday waves","27 pages, 16 figures, submitted to J. Fluid Mech",,"10.1017/jfm.2017.166",,"physics.flu-dyn","http://arxiv.org/licenses/nonexclusive-distrib/1.0/","  Waves patterns in the Faraday instability have been studied for decades.
Besides the rich dynamics that can be observed on the waves at the interface,
Faraday waves hide beneath them an elusive range of flow patterns --or
streaming patterns-- which have not been studied in detail until now. The
streaming patterns are responsible for a net circulation in the flow which are
reminiscent of convection cells. In this article, we analyse these streaming
flows by conducting experiments in a Faraday-wave setup. To visualize the
flows, tracers are used to generate both trajectory maps and to probe the
streaming velocity field via Particle Image Velocimetry (PIV). We identify
three types of patterns and experimentally show that identical Faraday waves
can mask streaming patterns that are qualitatively very different. Next we
propose a three-dimensional model that explains streaming flows in
quasi-inviscid fluids. We show that the streaming inside the fluid arises from
a complex coupling between the bulk and the boundary layers. This coupling can
be taken into account by applying modified boundary conditions in a
three-dimensional Navier-Stokes formulation for the streaming in the bulk.
Numerical simulations based on this theoretical framework show good qualitative
and quantitative agreement with experimental results. They also highlight the
relevance of three-dimensional effects in the streaming patterns. Our
simulations reveal that the variety of experimental patterns is deeply linked
to the boundary condition at the top interface, which may be strongly affected
by the presence of contaminants along the surface.
","[{""version"":""v1"",""created"":""Wed, 23 Mar 2016 20:45:44 GMT""}]","2017-05-24"
"1603.07354","A. H. Rezaeian","Amir H. Rezaeian","Photon-jet ridge at RHIC and the LHC","15 pages, 12 figures; v2: results unchanged, presentation improved,
  typos corrected. The version to appear in PRD. arXiv admin note: text overlap
  with arXiv:1209.0478","Phys. Rev. D 93, 094030 (2016)","10.1103/PhysRevD.93.094030",,"hep-ph hep-ex","http://arxiv.org/licenses/nonexclusive-distrib/1.0/","  We investigate long range rapidity correlations of pairs of prompt photon and
jet in the Color Glass Condensate (CGC) framework in proton-proton and
proton-nucleus collisions at RHIC and the LHC. We show that photon-jet
correlations exhibit long-range azimuthal collimation at near-side for low
transverse momenta of the produced photon and jet in high-multiplicity events.
These ridge-like features are strikingly similar to the observed ridge effect
for di-hadron correlations at RHIC and the LHC. We show that correlations in
the relative rapidity and the relative azimuthal angle between pairs of prompt
photon and jet strongly depend on the gluon saturation dynamics at small-x
kinematics and such measurements can help to understand the true origin of the
observed di-hadron ridge in p+A collisions, and address whether the ridge is a
universal phenomenon for all two particle correlations at high energy and high
multiplicity events. We also investigate if there is a ridge-like structure for
photon-hadron pair correlations at RHIC and the LHC. We found that the
hadronization of jet has non-trivial effects on the photon-jet correlations.
","[{""version"":""v1"",""created"":""Wed, 23 Mar 2016 20:52:26 GMT""},{""version"":""v2"",""created"":""Mon, 16 May 2016 20:05:36 GMT""}]","2016-05-30"
"1603.07355","Nyagudi Musandu Nyagudi","Nyagudi Musandu Nyagudi","Clinical Informatics: Recursive Concurrence Intravenous Medication
  Administration Systems Protocols for Addressing the Potential Problem of
  Recessive Lethal Autonomy in Smart Infusion Systems","26 pages, 1 schematic graph",,,,"cs.CY","http://arxiv.org/licenses/nonexclusive-distrib/1.0/","  Smart Infusion Pumps are vital tools for use in administering a broad range
of parenteral/intravenous medications. Safe and effective use of smart infusion
pumps depends upon their integration with Pump Servers, Computerized Physician
Order Entry Systems, Pharmacy Information Systems, DERS/MERS Dose/Medication
Error Reduction Systems( and the digital Drug Libraries that they use),
eMARS/electronic Medication Administration Records Systems, etc. More computer
systems result in more computer network connections, with systems that run on
ever more lines of computer software code. Resulting in more chaos and more
complexity, and inevitably a greater likelihood for systems failure and/or
malfunction - this in effect runs contrary to the objective of deploying
clinical informatics solutions such as smart infusion systems, due to their
inherent technical and chronic performance problems as well as error prone
usage that may occasion Recessive(unintended but underlying) Lethal Autonomy.
The Recursive Concurrence protocols suggested in this paper are a means for
reducing if not eliminating the challenging phenomenon of Recessive Lethal
Autonomy in clinical informatics devices and/or systems.
","[{""version"":""v1"",""created"":""Wed, 23 Mar 2016 20:55:08 GMT""}]","2016-03-25"
"1603.07356","Gregory Berkolaiko","Gregory Berkolaiko","An elementary introduction to quantum graphs","31 pages, 17 figures","In ""Geometric and Computational Spectral Theory"" (eds: A.
  Girouard, D. Jakobson, M. Levitin, N. Nigam, I. Polterovich and F. Rochon),
  Contemp. Math. 700, AMS, 2017","10.1090/conm/700",,"math-ph math.MP math.SP","http://arxiv.org/licenses/nonexclusive-distrib/1.0/","  We describe some basic tools in the spectral theory of Schr\""odinger operator
on metric graphs (also known as ""quantum graph"") by studying in detail some
basic examples. The exposition is kept as elementary and accessible as
possible. In the later sections we apply these tools to prove some results on
the count of zeros of the eigenfunctions of quantum graphs.
","[{""version"":""v1"",""created"":""Wed, 23 Mar 2016 20:55:37 GMT""},{""version"":""v2"",""created"":""Sat, 17 Dec 2016 05:11:10 GMT""}]","2021-10-27"
"1603.07357","Blesson Varghese","Blesson Varghese, Lawan Thamsuhang Subba, Long Thai, Adam Barker","DocLite: A Docker-Based Lightweight Cloud Benchmarking Tool","16th IEEE/ACM International Symposium on Cluster, Cloud and Grid
  Computing (CCGrid), 2016, Cartagena, Colombia. arXiv admin note: substantial
  text overlap with arXiv:1601.03872",,"10.1109/CCGrid.2016.14",,"cs.DC","http://arxiv.org/licenses/nonexclusive-distrib/1.0/","  Existing benchmarking methods are time consuming processes as they typically
benchmark the entire Virtual Machine (VM) in order to generate accurate
performance data, making them less suitable for real-time analytics. The
research in this paper is aimed to surmount the above challenge by presenting
DocLite - Docker Container-based Lightweight benchmarking tool. DocLite
explores lightweight cloud benchmarking methods for rapidly executing
benchmarks in near real-time. DocLite is built on the Docker container
technology, which allows a user-defined memory size and number of CPU cores of
the VM to be benchmarked. The tool incorporates two benchmarking methods - the
first referred to as the native method employs containers to benchmark a small
portion of the VM and generate performance ranks, and the second uses historic
benchmark data along with the native method as a hybrid to generate VM ranks.
The proposed methods are evaluated on three use-cases and are observed to be up
to 91 times faster than benchmarking the entire VM. In both methods, small
containers provide the same quality of rankings as a large container. The
native method generates ranks with over 90% and 86% accuracy for sequential and
parallel execution of an application compared against benchmarking the whole
VM. The hybrid method did not improve the quality of the rankings
significantly.
","[{""version"":""v1"",""created"":""Wed, 23 Mar 2016 20:55:44 GMT""}]","2016-11-17"
