"1603.07430","Rakesh  Kumar Singh","Vinu R. V, Kyoohyun Kim, Atul S. Somkuwar, YongKeun Park, and Rakesh
  Kumar Singh","Single-shot optical imaging through scattering medium using digital
  in-line holography",,,,,"physics.optics","http://arxiv.org/licenses/nonexclusive-distrib/1.0/","  Non-invasive and single-shot holographic imaging through complex media is
technically challenging due to random light scattering which significantly
scrambles optical information. Recently, several methods have been presented to
address this issue. However, they require complicated measurements of optical
transmission matrices, or existing techniques do only retrieve intensity
information. Here we propose and experimentally demonstrate a holographic
approach for single-shot imaging through a scattering layer based on digital
in-line holography in combination with the autocorrelation of the speckle
intensity. Using a simple optical configuration and experimental procedure, the
proposed method enables to retrieve the complex amplitude image of an object
located at arbitrary planes behind scattering media. The technique has
potential applications in biomedical imaging, deep tissue microscopy, and 3D
imaging through turbid media.
","[{""version"":""v1"",""created"":""Thu, 24 Mar 2016 04:14:55 GMT""}]","2016-03-25"
"1603.07431","Junaid Qadir","Junaid Qadir, Arjuna Sathiaseelan, Liang Wang, Barath Raghavan","Approximate Networking for Global Access to the Internet for All (GAIA)","arXiv admin note: text overlap with arXiv:1602.08135",,,,"cs.NI","http://arxiv.org/licenses/nonexclusive-distrib/1.0/","  Decades of experience have shown that there is no single one-size-fits-all
solution that can be used to provision Internet globally and that invariably
there are tradeoffs in the design of Internet. Despite the best efforts of
networking researchers and practitioners, an ideal Internet experience is
inaccessible to an overwhelming majority of people the world over, mainly due
to the lack of cost efficient ways of provisioning high-performance global
Internet. In this paper, we argue that instead of an exclusive focus on a
utopian goal of universally accessible ""ideal networking"" (in which we have
high throughput and quality of service as well as low latency and congestion),
we should consider providing ""approximate networking"" through the adoption of
context-appropriate tradeoffs. Approximate networking can be used to implement
a pragmatic tiered global access to the Internet for all (GAIA) system in which
different users the world over have different context-appropriate (but still
contextually functional) Internet experience.
","[{""version"":""v1"",""created"":""Thu, 24 Mar 2016 04:19:33 GMT""}]","2016-03-25"
"1603.07432","Shouhuai Xu","Zhenxin Zhan and Maochao Xu and Shouhuai Xu","Predicting Cyber Attack Rates with Extreme Values",,"IEEE Transactions on Information Forensics & Security, 10(8):
  1666-1677 (2015)",,,"cs.CR stat.AP","http://arxiv.org/licenses/nonexclusive-distrib/1.0/","  It is important to understand to what extent, and in what perspectives, cyber
attacks can be predicted. Despite its evident importance, this problem was not
investigated until very recently, when we proposed using the innovative
methodology of {\em gray-box prediction}. This methodology advocates the use of
gray-box models, which accommodate the statistical properties/phenomena
exhibited by the data. Specifically, we showed that gray-box models that
accommodate the Long-Range Dependence (LRD) phenomenon can predict the attack
rate (i.e., the number of attacks per unit time) 1-hour ahead-of-time with an
accuracy of 70.2-82.1\%. To the best of our knowledge, this is the first result
showing the feasibility of prediction in this domain. We observe that the
prediction errors are partly caused by the models' incapability in predicting
the large attack rates, which are called {\em extreme values} in statistics.
This motivates us to analyze the {\em extreme-value phenomenon}, by using two
complementary approaches: the Extreme Value Theory (EVT) and the Time Series
Theory (TST). In this paper, we show that EVT can offer long-term predictions
(e.g., 24-hour ahead-of-time), while gray-box TST models can predict attack
rates 1-hour ahead-of-time with an accuracy of 86.0-87.9\%. We explore
connections between the two approaches, and point out future research
directions. Although our prediction study is based on specific cyber attack
data, our methodology can be equally applied to analyze any cyber attack data
of its kind.
","[{""version"":""v1"",""created"":""Thu, 24 Mar 2016 04:25:12 GMT""}]","2016-03-25"
"1603.07433","Shouhuai Xu","Zhenxin Zhan and Maochao Xu and Shouhuai Xu","Characterizing Honeypot-Captured Cyber Attacks: Statistical Framework
  and Case Study",,"IEEE Transactions on Information Forensics & Security (IEEE TIFS),
  8(11): 1775-1789, (2013)",,,"cs.CR stat.AP","http://arxiv.org/licenses/nonexclusive-distrib/1.0/","  Rigorously characterizing the statistical properties of cyber attacks is an
important problem. In this paper, we propose the {\em first} statistical
framework for rigorously analyzing honeypot-captured cyber attack data. The
framework is built on the novel concept of {\em stochastic cyber attack
process}, a new kind of mathematical objects for describing cyber attacks. To
demonstrate use of the framework, we apply it to analyze a low-interaction
honeypot dataset, while noting that the framework can be equally applied to
analyze high-interaction honeypot data that contains richer information about
the attacks. The case study finds, for the first time, that Long-Range
Dependence (LRD) is exhibited by honeypot-captured cyber attacks. The case
study confirms that by exploiting the statistical properties (LRD in this
case), it is feasible to predict cyber attacks (at least in terms of attack
rate) with good accuracy. This kind of prediction capability would provide
sufficient early-warning time for defenders to adjust their defense
configurations or resource allocations. The idea of ""gray-box"" (rather than
""black-box"") prediction is central to the utility of the statistical framework,
and represents a significant step towards ultimately understanding (the degree
of) the {\em predictability} of cyber attacks.
","[{""version"":""v1"",""created"":""Thu, 24 Mar 2016 04:27:09 GMT""}]","2016-03-25"
"1603.07434","Yoshiharu Kawamura","Yugo Abe, Masaatsu Horikoshi and Yoshiharu Kawamura","Dark energy from gravitational corrections","11 pages, 1 figure, the title and contents in Sect.3 changed","International Journal of Modern Physics A, Vol.32 (2017) 1750037","10.1142/S0217751X17500373",,"hep-th astro-ph.CO gr-qc hep-ph","http://arxiv.org/licenses/nonexclusive-distrib/1.0/","  We study physics concerning the cosmological constant problem in the
framework of effective field theory and suggest that a dominant part of dark
energy can originate from gravitational corrections of vacuum energy, under the
assumption that the classical gravitational fields do not couple to a large
portion of the vacuum energy effectively, in spite of the coupling between
graviton and matters at a microscopic level. Our speculation is excellent with
terascale supersymmetry.
","[{""version"":""v1"",""created"":""Thu, 24 Mar 2016 04:27:12 GMT""},{""version"":""v2"",""created"":""Mon, 5 Sep 2016 02:17:09 GMT""},{""version"":""v3"",""created"":""Wed, 1 Feb 2017 07:59:52 GMT""}]","2017-02-24"
"1603.07435","Michael Lindsey","Michael Lindsey, Yanir A. Rubinstein","Optimal transport via a Monge-Amp\`ere optimization problem","v2: introduced modifications of the optimization problem for which we
  prove stronger convergence results","SIAM J. Math. Anal., 49 (2017), 3073-3124","10.1137/16M1071560",,"math.NA math.AP","http://arxiv.org/licenses/nonexclusive-distrib/1.0/","  We rephrase Monge's optimal transportation (OT) problem with quadratic
cost--via a Monge-Amp\`ere equation--as an infinite-dimensional optimization
problem, which is in fact a convex problem when the target is a log-concave
measure with convex support. We define a natural finite-dimensional
discretization to the problem and associate a piecewise affine convex function
to the solution of this discrete problem. The discrete problems always admit a
solution, which can be obtained by standard convex optimization algorithms
whenever the target is a log-concave measure with convex support. We show that
under suitable regularity conditions the convex functions retrieved from the
discrete problems converge to the convex solution of the original OT problem
furnished by Brenier's theorem. Also, we put forward an interpretation of our
convergence result that suggests applicability to the convergence of a wider
range of numerical methods for OT. Finally, we demonstrate the practicality of
our convergence result by providing visualizations of OT maps as well as of the
dynamic OT problem obtained by solving the discrete problem numerically.
","[{""version"":""v1"",""created"":""Thu, 24 Mar 2016 04:36:55 GMT""},{""version"":""v2"",""created"":""Wed, 20 Apr 2016 00:48:46 GMT""}]","2017-08-29"
"1603.07436","Kohji Matsumoto","Kohji Matsumoto and Yumiko Umegaki","On the value-distribution of the difference between logarithms of two
  symmetric power $L$-functions","36 pages",,,,"math.NT","http://arxiv.org/licenses/nonexclusive-distrib/1.0/","  We consider the value distribution of the difference between logarithms of
two symmetric power $L$-functions at $s=\sigma > 1/2$. We prove that certain
averages of those values can be written as integrals involving a density
function which is constructed explicitly.
","[{""version"":""v1"",""created"":""Thu, 24 Mar 2016 04:39:11 GMT""}]","2016-03-25"
"1603.07437","Nagatoshi Sasano","Nagatoshi Sasano","Lie algebras constructed with Lie modules and their positively and
  negatively graded modules",,,,,"math.RT","http://arxiv.org/licenses/nonexclusive-distrib/1.0/","  In this paper, we shall give a way to construct a graded Lie algebra
$L(\mathfrak{g},\rho,V,{\cal V},B_0)$ from a standard pentad
$(\mathfrak{g},\rho,V,{\cal V},B_0)$ which consists of a Lie algebra
$\mathfrak{g}$ which has a non-degenerate invariant bilinear form $B_0$ and
$\mathfrak{g}$-modules $(\rho, V)$ and ${\cal V}\subset \mathrm {Hom
}(V,\mathfrak{k})$ all defined over a field $\mathfrak{k}$. In general, we do
not assume that these objects are finite-dimensional. We can embed the objects
$\mathfrak{g},\rho,V,{\cal V}$ into $L(\mathfrak{g},\rho,V,{\cal V},B_0)$.
Moreover, we construct specific positively and negatively graded modules of
$L(\mathfrak{g},\rho,V,{\cal V},B_0)$. Finally, we give a chain rule on the
embedding rules of standard pentads.
","[{""version"":""v1"",""created"":""Thu, 24 Mar 2016 04:41:29 GMT""}]","2016-03-25"
"1603.07438","Shouhuai Xu","Zhenxin Zhan and Maochao Xu and Shouhuai Xu","A Characterization of Cybersecurity Posture from Network Telescope Data",,"Proceedings of the 6th International Conference Trusted Systems
  (INTRUST'2014), pp 105-126",,,"cs.CR stat.AP","http://arxiv.org/licenses/nonexclusive-distrib/1.0/","  Data-driven understanding of cybersecurity posture is an important problem
that has not been adequately explored. In this paper, we analyze some real data
collected by CAIDA's network telescope during the month of March 2013. We
propose to formalize the concept of cybersecurity posture from the perspectives
of three kinds of time series: the number of victims (i.e., telescope IP
addresses that are attacked), the number of attackers that are observed by the
telescope, and the number of attacks that are observed by the telescope.
Characterizing cybersecurity posture therefore becomes investigating the
phenomena and statistical properties exhibited by these time series, and
explaining their cybersecurity meanings. For example, we propose the concept of
{\em sweep-time}, and show that sweep-time should be modeled by stochastic
process, rather than random variable. We report that the number of attackers
(and attacks) from a certain country dominates the total number of attackers
(and attacks) that are observed by the telescope. We also show that
substantially smaller network telescopes might not be as useful as a large
telescope.
","[{""version"":""v1"",""created"":""Thu, 24 Mar 2016 04:44:18 GMT""}]","2016-03-25"
"1603.07439","Shouhuai Xu","Yu-Zhong Chen and Zi-Gang Huang and Shouhuai Xu and Ying-Cheng Lai","Spatiotemporal patterns and predictability of cyberattacks",,"PLoS One 10(5): e0124472 (2015)","10.1371/journal.pone.0124472",,"cs.CR physics.data-an physics.soc-ph stat.AP","http://arxiv.org/licenses/nonexclusive-distrib/1.0/","  A relatively unexplored issue in cybersecurity science and engineering is
whether there exist intrinsic patterns of cyberattacks. Conventional wisdom
favors absence of such patterns due to the overwhelming complexity of the
modern cyberspace. Surprisingly, through a detailed analysis of an extensive
data set that records the time-dependent frequencies of attacks over a
relatively wide range of consecutive IP addresses, we successfully uncover
intrinsic spatiotemporal patterns underlying cyberattacks, where the term
""spatio"" refers to the IP address space. In particular, we focus on analyzing
{\em macroscopic} properties of the attack traffic flows and identify two main
patterns with distinct spatiotemporal characteristics: deterministic and
stochastic. Strikingly, there are very few sets of major attackers committing
almost all the attacks, since their attack ""fingerprints"" and target selection
scheme can be unequivocally identified according to the very limited number of
unique spatiotemporal characteristics, each of which only exists on a
consecutive IP region and differs significantly from the others. We utilize a
number of quantitative measures, including the flux-fluctuation law, the Markov
state transition probability matrix, and predictability measures, to
characterize the attack patterns in a comprehensive manner. A general finding
is that the attack patterns possess high degrees of predictability, potentially
paving the way to anticipating and, consequently, mitigating or even preventing
large-scale cyberattacks using macroscopic approaches.
","[{""version"":""v1"",""created"":""Thu, 24 Mar 2016 04:57:11 GMT""}]","2016-03-25"
"1603.07440","Pooya Monshizadeh","Pooya Monshizadeh, Claudio De Persis, Nima Monshizadeh, Arjan van der
  Schaft","Nonlinear Analysis of an Improved Swing Equation",,,,,"cs.SY","http://arxiv.org/licenses/nonexclusive-distrib/1.0/","  In this paper, we investigate the properties of an improved swing equation
model for synchronous generators. This model is derived by omitting the main
simplifying assumption of the conventional swing equation, and requires a novel
analysis for the stability and frequency regulation. We consider two scenarios.
First we study the case that a synchronous generator is connected to a constant
load. Second, we inspect the case of the single machine connected to an
infinite bus. Simulations verify the results.
","[{""version"":""v1"",""created"":""Thu, 24 Mar 2016 04:58:03 GMT""}]","2016-03-25"
"1603.07441","Chao Ding","Chao Ding, Raymond Walter, John Ryan","Construction of Arbitrary Order Conformally Invariant Operators in
  Higher Spin Spaces","arXiv admin note: text overlap with arXiv:1509.00098",,,,"math.DG math-ph math.CV math.MP","http://arxiv.org/licenses/nonexclusive-distrib/1.0/","  This paper completes the construction of arbitrary order conformally
invariant differential operators in higher spin spaces. Jan Slov\'{a}k has
classified all conformally invariant differential operators on locally
conformally flat manifolds. We complete his results in higher spin theory by
giving explicit expressions for arbitrary order conformally invariant
differential operators, where by conformally invariant we mean equivariant with
respect to the conformal group of $\mathbb{S}^m$ acting in Euclidean space
$\mathbb{R}^m$. We name these the fermionic operators when the order is odd and
bosonic operators when the order is even. Our approach explicitly uses
convolution type operators to construct conformally invariant differential
operators. These convolution type operators are examples of Knapp-Stein
operators and they can be considered as the inverses of the corresponding
differential operators. Intertwining operators of these convolution type
operators are provided and intertwining operators of differential operators
follow immediately. This reveals that our convolution type operators and
differential operators are all conformally invariant. This also gives us a
class of conformally invariant convolution type operators in higher spin
spaces. Their inverses, when they exist, are conformally invariant
pseudo-differential operators. Further we use Stein Weiss gradient operators
and representation theory for the Spin group to naturally motivate the
Rarita-Schwinger operators.
","[{""version"":""v1"",""created"":""Thu, 24 Mar 2016 05:05:39 GMT""},{""version"":""v2"",""created"":""Wed, 30 Mar 2016 04:32:07 GMT""},{""version"":""v3"",""created"":""Fri, 15 Apr 2016 03:25:29 GMT""},{""version"":""v4"",""created"":""Tue, 19 Apr 2016 01:11:09 GMT""},{""version"":""v5"",""created"":""Tue, 6 Dec 2016 16:16:50 GMT""}]","2016-12-07"
"1603.07442","Donggeun Yoo","Donggeun Yoo, Namil Kim, Sunggyun Park, Anthony S. Paek, In So Kweon","Pixel-Level Domain Transfer","Published in ECCV 2016. Code and dataset available at dgyoo.github.io",,,,"cs.CV cs.AI","http://arxiv.org/licenses/nonexclusive-distrib/1.0/","  We present an image-conditional image generation model. The model transfers
an input domain to a target domain in semantic level, and generates the target
image in pixel level. To generate realistic target images, we employ the
real/fake-discriminator as in Generative Adversarial Nets, but also introduce a
novel domain-discriminator to make the generated image relevant to the input
image. We verify our model through a challenging task of generating a piece of
clothing from an input image of a dressed person. We present a high quality
clothing dataset containing the two domains, and succeed in demonstrating
decent results.
","[{""version"":""v1"",""created"":""Thu, 24 Mar 2016 05:20:59 GMT""},{""version"":""v2"",""created"":""Mon, 29 Aug 2016 01:20:33 GMT""},{""version"":""v3"",""created"":""Mon, 28 Nov 2016 13:17:40 GMT""}]","2016-11-29"
"1603.07443","Vasily Rodionov Nikolaevich","V.N. Rodionov","Non-Hermitian ${\cal PT}$-symmetric relativistic quantum theory in an
  intensive magnetic field","15 pages, 4 figures, Materials of The XVth conference on
  Pseudo-Hermitian Hamiltonians in Quantum Physics that was held in Palermo
  (Italy)",,,,"hep-ph astro-ph.HE hep-ex","http://arxiv.org/licenses/nonexclusive-distrib/1.0/","  We develop relativistic non-Hermitian quantum theory and its application to
neutrino physics in a strong magnetic field. It is well known, that one of the
fundamental postulates of quantum theory is the requirement of Hermiticity of
physical parameters. This condition not only guarantees the reality of the
eigenvalues of Hamiltonian operators, but also implies the preservation of the
probabilities of the considered quantum processes. However as it was shown
relatively recently (Bender, Boettcher 1998), Hermiticity is a sufficient but
it is not a necessary condition. It turned out that among non-Hermitian
Hamiltonians it is possible to allocate a number of such which have real energy
spectra and can ensure the development of systems over time with preserving
unitarity. This type of Hamiltonians includes so-called parity-time (${\cal
PT}$) symmetric models which is already used in various fields of modern
physics. The most developed in this respect are models, which used in the field
of ${\cal PT}$-symmetric optics, where for several years produced not only
theoretical but experimental studies.
","[{""version"":""v1"",""created"":""Thu, 24 Mar 2016 05:26:00 GMT""}]","2016-03-25"
"1603.07444","Hyesung Kang","Hyesung Kang","Re-acceleration model for the ""Toothbrush"" Radio Relic","10 pages, 6 figures, submitted to JKAS",,"10.5303/JKAS.2016.49.3.083",,"astro-ph.HE","http://arxiv.org/licenses/nonexclusive-distrib/1.0/","  The Toothbrush radio relic associated the merging cluster 1RXS J060303.3 is
presumed to be produced by relativistic electrons accelerated at merger-driven
shocks. Since the shock Mach number inferred from the observed radio spectral
index, $M_{radio}\approx 2.8$, is larger than that estimated from X-ray
observations, $M_{X-ray}\lesssim 1.5$, we consider the re-acceleration model in
which a weak shock of $M_s\approx 1.2-1.5$ sweeps through the intracluster
plasma with a preshock population of relativistic electrons. We find the models
with a power-law momentum spectrum with the slope, $s\approx 4.6$, and the
cutoff Lorentz factor, $\gamma_{e,c}\approx 7-8\times 10^4$ can reproduce
reasonably well the observed profiles of radio fluxes and integrated radio
spectrum of the head portion of the Toothbrush relic. This study confirms the
strong connection between the ubiquitous presence of fossil relativistic plasma
originated from AGNs and the shock-acceleration model of radio relics in the
intracluster medium.
","[{""version"":""v1"",""created"":""Thu, 24 Mar 2016 05:28:05 GMT""}]","2017-01-18"
"1603.07445","Michael (Micky) Fire","Michael Fire and Carlos Guestrin","Time Is of the Essence: Analyzing the Effect of Vertex-Joining Time on
  Complex Network Evolution",,,,,"cs.SI physics.soc-ph","http://arxiv.org/licenses/nonexclusive-distrib/1.0/","  Complex networks have non-trivial characteristics and appear in many
real-world systems. Such networks are vitally important, but their full
underlying dynamics are not completely understood. Utilizing new data sources,
however, can unveil the evolution process of these networks.
  This study uses the recently published Reddit dataset, containing over 1.65
billion comments, to construct the largest publicly available social network
corpus to date. We used this dataset to deeply examine the network evolution
process, which resulted in two key observations: First, links are more likely
to be created among users who join a network at a similar time. Second, the
rate in which new users join a network is a central factor in molding a
network's topology; i.e., different user-join patterns create different
topological properties.
  Based on these observations, we developed the \textit{Temporal Preferential
Attachment} random network generation model. This model produces not only
scale-free networks that have relative high clustering coefficients, but also
networks that are sensitive to both the rate and the time in which users join
the network. This results in a more accurate and flexible model of how complex
networks evolve, one which more closely represents real-world data.
","[{""version"":""v1"",""created"":""Thu, 24 Mar 2016 05:32:31 GMT""},{""version"":""v2"",""created"":""Thu, 25 Aug 2016 05:48:36 GMT""}]","2016-08-26"
"1603.07446","Supantho Rakshit","Supantho Rakshit","On The Changes in Optical Interferometry Induced by The Relativistic
  Motion of An Optical Medium","13 pages, 5 figures","Eur. J. Phys. 37 065302 (2016)","10.1088/0143-0807/37/6/065302",,"physics.optics","http://arxiv.org/licenses/nonexclusive-distrib/1.0/","  We investigate the effects of the relativistic movement of an optical medium
on the conditions of constructive and destructive interference, reflection and
transmission pattern, and performance of spectroscopes. First, we consider the
case of two beams reflected from a relativistically moving thin film and derive
the conditions of constructive and destructive interference. Then we broaden
the idea to multiple beam interference and formulate a new modified equation of
reflection and transmission pattern of light from a relativistically moving
plane parallel dielectric film. Finally, we determine the new effective
resolving power of a Fabry-Perot spectroscope, which has a moving dielectric
medium in its etalon. Here, we consider the case where the optical media move
parallel to the plane of incidence of light. Throughout this paper, we use
basic Lorentz transformation of space and time co-ordinates and electromagnetic
fields to conduct these investigations. This paper can strongly motivate
undergraduate physics students to associate the concepts of special relativity
and optical interference.
","[{""version"":""v1"",""created"":""Thu, 24 Mar 2016 05:38:44 GMT""},{""version"":""v2"",""created"":""Fri, 25 Mar 2016 09:13:49 GMT""},{""version"":""v3"",""created"":""Tue, 27 Sep 2016 10:05:27 GMT""}]","2016-09-28"
