"1603.07983","Yueh-Ning Lee","Yueh-Ning Lee, Patrick Hennebelle","Formation of proto-cluster: a virialized structure from gravo-turbulent
  collapse II. A two-dimensional analytical model for rotating and accreting
  system",,"A&A 591, A31 (2016)","10.1051/0004-6361/201527982",,"astro-ph.SR","http://arxiv.org/licenses/nonexclusive-distrib/1.0/","  Most stars are born in the gaseous proto-cluster environment. The knowledge
of this intermediate stage gives more accurate constraints on star formation
characteristics. We demonstrate that a virialized globally supported structure,
in which star formation happens, is formed out of a collapsing molecular cloud,
and derive a mapping from the parent cloud parameters to the proto-cluster to
predict its properties, with a view to confront analytical calculations with
observations and simulations. The virial theorem is decomposed into two
dimensions to account for the rotation and the flattened geometry. Equilibrium
is found by balancing rotation, turbulence and self-gravity, while turbulence
is maintained by accretion driving and dissipates in one crossing time. The
angular momentum and the accretion rate of the proto-cluster are estimated from
the parent cloud properties. The two-dimensional virial model predicts the size
and velocity dispersion given the mass of the proto-cluster and that of the
parent cloud. The gaseous proto-clusters lie on a sequence of equilibrium with
the trend $R \sim M^{0.5}$, with limited variations depending on the
evolutionary stage, the parent cloud, and the parameters not well known like
turbulence driving efficiency by accretion and the turbulence anisotropy. The
model reproduces successfully observations and simulation results. The
properties of proto-clusters follow universal relations and they can be derived
from that of the parent cloud. Using simple estimates to infer the peak
position of the core mass function (CMF) we find a weak dependence on the
cluster mass suggesting that the physical conditions inside proto-clusters may
contribute to set a CMF, and by extension an IMF, that looks independent of the
environment.
","[{""version"":""v1"",""created"":""Fri, 25 Mar 2016 18:51:38 GMT""}]","2016-06-08"
"1603.07984","Walter Lucia","Walter Lucia, Bruno Sinopoli, Giuseppe Franze'","Networked Constrained Cyber-Physical Systems subject to malicious
  attacks: a resilient set-theoretic control approach",,,,,"cs.SY","http://arxiv.org/licenses/nonexclusive-distrib/1.0/","  In this paper a novel set-theoretic control framework for Networked
Constrained Cyber-Physical Systems is presented. By resorting to set-theoretic
ideas and the physical watermarking concept, an anomaly detector module and a
control remediation strategy are formally derived with the aim to contrast
severe cyber attacks affecting the communication channels. The resulting scheme
ensures Uniformly Ultimate Boundedness and constraints fulfillment regardless
of any admissible attack scenario. Simulation results show the effectiveness of
the proposed strategy both against Denial of Service and False Data Injection
attacks.
","[{""version"":""v1"",""created"":""Fri, 25 Mar 2016 18:54:54 GMT""}]","2016-03-28"
"1603.07985","Adam Schneider","Adam C. Schneider, James Windsor, Michael C. Cushing, J. Davy
  Kirkpatrick, and Edward L. Wright","WISEA J114724.10-204021.3: A Free-Floating Planetary Mass Member of the
  TW Hya Association","Accepted for publication in ApJ Letters",,"10.3847/2041-8205/822/1/L1",,"astro-ph.SR astro-ph.EP","http://arxiv.org/licenses/nonexclusive-distrib/1.0/","  We present WISEA J114724.10$-$204021.3, a young, low-mass, high probability
member of the TW Hya association. WISEA J114724.10$-$204021.3 was discovered
based on its red AllWISE color (W1$-$W2 = 0.63 mag) and extremely red 2MASS
$J-K_{\rm S}$ color ($>$ 2.64 mag), the latter of which is confirmed with
near-infrared photometry from the VISTA Hemisphere Survey ($J-K_{\rm S}$ =
2.57$\pm$0.03). Follow-up near-infrared spectroscopy shows a spectral type of
L7 $\pm$ 1 as well as several spectroscopic indicators of youth. These include
a peaked $H$-band shape and a steeper $K$-band slope, traits typically
attributed to low surface gravity. The sky position, proper motion, and
distance estimates of WISEA J114724.10$-$204021.3 are all consistent with
membership in the $\sim$10 Myr old TW Hya association. Using the age of the TW
Hya association and evolutionary models, we estimate the mass of WISEA
J114724.10$-$204021.3 to be 5$-$13 $M_{\rm Jup}$, making it one of the youngest
and lowest mass free-floating objects yet discovered in the Solar neighborhood.
","[{""version"":""v1"",""created"":""Fri, 25 Mar 2016 19:09:30 GMT""}]","2016-04-27"
"1603.07987","Takuya Ura","Federico A. Bugni and Takuya Ura","Inference in Dynamic Discrete Choice Problems under Local
  Misspecification",,,,,"stat.ME","http://arxiv.org/licenses/nonexclusive-distrib/1.0/","  Single-agent dynamic discrete choice models are typically estimated using
heavily parametrized econometric frameworks, making them susceptible to model
misspecification. This paper investigates how misspecification affects the
results of inference in these models. Specifically, we consider a local
misspecification framework in which specification errors are assumed to vanish
at an arbitrary and unknown rate with the sample size. Relative to global
misspecification, the local misspecification analysis has two important
advantages. First, it yields tractable and general results. Second, it allows
us to focus on parameters with structural interpretation, instead of
""pseudo-true"" parameters.
  We consider a general class of two-step estimators based on the K-stage
sequential policy function iteration algorithm, where K denotes the number of
iterations employed in the estimation. This class includes Hotz and Miller
(1993)'s conditional choice probability estimator, Aguirregabiria and Mira
(2002)'s pseudo-likelihood estimator, and Pesendorfer and Schmidt-Dengler
(2008)'s asymptotic least squares estimator.
  We show that local misspecification can affect the asymptotic distribution
and even the rate of convergence of these estimators. In principle, one might
expect that the effect of the local misspecification could change with the
number of iterations K. One of our main findings is that this is not the case,
i.e., the effect of local misspecification is invariant to K. In practice, this
means that researchers cannot eliminate or even alleviate problems of model
misspecification by changing K.
","[{""version"":""v1"",""created"":""Fri, 25 Mar 2016 19:28:15 GMT""},{""version"":""v2"",""created"":""Fri, 15 Apr 2016 18:59:35 GMT""},{""version"":""v3"",""created"":""Tue, 21 Feb 2017 16:34:52 GMT""},{""version"":""v4"",""created"":""Tue, 22 Aug 2017 13:06:10 GMT""},{""version"":""v5"",""created"":""Wed, 7 Feb 2018 16:04:26 GMT""}]","2018-02-08"
"1603.07988","F\'elix del Teso","F\'elix del Teso","An extension problem related to inverse fractional operators","This paper has been withdrawn by the author since Theorem 1.2 is not
  original",,,,"math.AP math.FA math.NA","http://arxiv.org/licenses/nonexclusive-distrib/1.0/","  It is well known from the work of Caffarelli and Silvestre that the
fractional Laplacian $(-\Delta_x)^{\frac{\sigma}{2}}$ for $\sigma \in (0,2)$
can be obtained as a Dirichlet-to-Neumann map through an extension problem to
the upper half space. In this paper we emphasize that the inverse fractional
Laplacian $(-\Delta_x)^{-\frac{\sigma}{2}}$ has a similar property: it can be
obtained as a Neumann-to-Dirichlet map via an extension problem to the upper
half space. We also show an explicit formula for the solution of the extension
problem. Moreover, we deal with powers of a more general class of second order
differential operators defined in open subsets of $\mathbb{R}^N$ using the
results of Stinga and Torrea. From this characterization we show possible
applications among which we mention the numerical analysis of a wide class of
nonlinear and nonlocal equations.
","[{""version"":""v1"",""created"":""Fri, 25 Mar 2016 19:31:55 GMT""},{""version"":""v2"",""created"":""Fri, 27 May 2016 16:25:22 GMT""},{""version"":""v3"",""created"":""Fri, 24 Jun 2016 17:34:14 GMT""},{""version"":""v4"",""created"":""Wed, 29 Jun 2016 20:37:40 GMT""}]","2016-07-01"
"1603.07989","Solomon Akaraka Owerre","S. A. Owerre","Magnon edge states in hardcore-Bose-Hubbard model","7 pages, 8 figures. Published version","J. Phys.: Condens. Matter 28, 436003 (2016)","10.1088/0953-8984/28/43/436003",,"cond-mat.str-el","http://arxiv.org/licenses/nonexclusive-distrib/1.0/","  Quantum Monte Carlo (QMC) simulation has uncovered nonzero Berry curvature
and bosonic edge states in hardcore-Bose-Hubbard model on the gapped honeycomb
lattice. The competition between the chemical potential and staggered onsite
potential leads to an interesting quantum phase diagram comprising superfluid
phase, Mott insulator, and charge density wave insulator. In this paper, we
present a semiclassical perspective of this system by mapping to a spin-$1/2$
quantum XY model. We give an explicit analytical origin of the quantum phase
diagram, the Berry curvatures, and the edge states using semiclassical
approximations. We find very good agreements between the semiclassical analyses
and the QMC results. Our results show that the topological properties of
hardcore-Bose-Hubbard model are the same as those of magnon in the
corresponding quantum spin system. Our results are applicable to systems of
ultracold bosonic atoms trapped in honeycomb optical lattices.
","[{""version"":""v1"",""created"":""Fri, 25 Mar 2016 19:32:59 GMT""},{""version"":""v2"",""created"":""Wed, 27 Apr 2016 21:31:51 GMT""},{""version"":""v3"",""created"":""Mon, 18 Jul 2016 19:13:39 GMT""},{""version"":""v4"",""created"":""Wed, 7 Sep 2016 12:51:03 GMT""}]","2016-09-08"
"1603.07990","Raj Jain","Abdel-Karim Al-Tamimi, Raj Jain, Chakchai So-In","Modeling and Resource Allocation for HD Videos over WiMAX Broadband
  Wireless Networks",,"IEEE Communication Society Multimedia Communications Technical
  Committee, E-letter Vol. 5, No. 3, May 2010",,,"cs.NI cs.MM","http://arxiv.org/licenses/nonexclusive-distrib/1.0/","  Mobile video is considered a major upcoming application and revenue generator
for broadband wireless networks like WiMAX and LTE. Therefore, it is important
to design a proper resource allocation scheme for mobile video, since video
traffic is both throughput consuming and delay sensitive.
","[{""version"":""v1"",""created"":""Fri, 25 Mar 2016 19:35:59 GMT""}]","2016-03-28"
"1603.07991","Joshua Daymude","Sarah Cannon, Joshua J. Daymude, Dana Randall, Andr\'ea W. Richa","A Markov Chain Algorithm for Compression in Self-Organizing Particle
  Systems",,"PODC '16: Proceedings of the 2016 ACM Symposium on Principles of
  Distributed Computing, pp. 279-288","10.1145/2933057.2933107",,"cs.DC cs.DS","http://arxiv.org/licenses/nonexclusive-distrib/1.0/","  In systems of programmable matter, we are given a collection of simple
computation elements (or particles) with limited (constant-size) memory. We are
interested in when they can self-organize to solve system-wide problems of
movement, configuration and coordination. Here, we initiate a stochastic
approach to developing robust distributed algorithms for programmable matter
systems using Markov chains. We are able to leverage the wealth of prior work
in Markov chains and related areas to design and rigorously analyze our
distributed algorithms and show that they have several desirable properties.
  We study the compression problem, in which a particle system must gather as
tightly together as possible, as in a sphere or its equivalent in the presence
of some underlying geometry. More specifically, we seek fully distributed,
local, and asynchronous algorithms that lead the system to converge to a
configuration with small boundary. We present a Markov chain-based algorithm
that solves the compression problem under the geometric amoebot model, for
particle systems that begin in a connected configuration. The algorithm takes
as input a bias parameter $\lambda$, where $\lambda > 1$ corresponds to
particles favoring having more neighbors. We show that for all $\lambda >
2+\sqrt{2}$, there is a constant $\alpha > 1$ such that eventually with all but
exponentially small probability the particles are $\alpha$-compressed, meaning
the perimeter of the system configuration is at most $\alpha \cdot p_{min}$,
where $p_{min}$ is the minimum possible perimeter of the particle system.
Surprisingly, the same algorithm can also be used for expansion when $0 <
\lambda < 2.17$, and we prove similar results about expansion for values of
$\lambda$ in this range. This is counterintuitive as it shows that particles
preferring to be next to each other ($\lambda > 1$) is not sufficient to
guarantee compression.
","[{""version"":""v1"",""created"":""Fri, 25 Mar 2016 19:36:24 GMT""},{""version"":""v2"",""created"":""Tue, 19 Jul 2016 14:30:25 GMT""},{""version"":""v3"",""created"":""Wed, 21 Sep 2016 14:07:03 GMT""},{""version"":""v4"",""created"":""Tue, 26 Feb 2019 00:13:06 GMT""}]","2019-02-27"
"1603.07992","Saeed-Ul Hassan","Saeed-Ul Hassan, Uzair Ahmed Gillani","Altmetrics of ""altmetrics"" using Google Scholar, Twitter, Mendeley,
  Facebook, Google-plus, CiteULike, Blogs and Wiki","19 pages, 6 figures, 4 tables",,,,"cs.SI cs.DL","http://arxiv.org/licenses/nonexclusive-distrib/1.0/","  We measure the impact of ""altmetrics"" field by deploying altmetrics
indicators using the data from Google Scholar, Twitter, Mendeley, Facebook,
Google-plus, CiteULike, Blogs and Wiki during 2010- 2014. To capture the social
impact of scientific publications, we propose an index called alt-index,
analogues to h-index. Across the deployed indices, our results have shown high
correlation among the indicators that capture social impact. While we observe
medium Pearson's correlation (\r{ho}= .247) among the alt-index and h-index, a
relatively high correlation is observed between social citations and scholarly
citations (\r{ho}= .646). Interestingly, we find high turnover of social
citations in the field compared with the traditional scholarly citations, i.e.
social citations are 42.2 % more than traditional citations. The social mediums
such as Twitter and Mendeley appear to be the most effective channels of social
impact followed by Facebook and Google-plus. Overall, altmetrics appears to be
working well in the field of ""altmetrics"".
","[{""version"":""v1"",""created"":""Fri, 25 Mar 2016 19:42:31 GMT""}]","2016-03-28"
"1603.07993","Maxim Chernodub","M. N. Chernodub","Anomalous Transport Due to the Conformal Anomaly","6 pages, 2 figures; v2: clarifying remarks added, relation to the
  Schwinger effect in de Sitter space discussed, published version","Phys. Rev. Lett. 117, 141601 (2016)","10.1103/PhysRevLett.117.141601",,"hep-th cond-mat.mes-hall gr-qc","http://arxiv.org/licenses/nonexclusive-distrib/1.0/","  We show that the scale (conformal) anomaly in field theories leads to new
anomalous transport effects that emerge in an external electromagnetic field in
an inhomogeneous gravitational background. In inflating geometry the QED scale
anomaly locally generates an electric current that flows in opposite direction
with respect to background electric field (the scale electric effect). In a
static spatially inhomogeneous gravitational background the dissipationless
electric current flows transversely both to the magnetic field axis and to the
gradient of the inhomogeneity (the scale magnetic effect). The anomalous
currents are proportional to the beta function of the theory.
","[{""version"":""v1"",""created"":""Fri, 25 Mar 2016 19:45:50 GMT""},{""version"":""v2"",""created"":""Thu, 6 Oct 2016 14:49:53 GMT""}]","2016-10-07"
"1603.07994","Mikhail Titov","I. A. Ado, O. A. Tretiakov and M. Titov","Microscopic theory of spin-orbit torques and skyrmion dynamics","13 pages, 4 figures","Phys. Rev. B 95, 094401 (2017)","10.1103/PhysRevB.95.094401",,"cond-mat.mes-hall cond-mat.dis-nn","http://arxiv.org/licenses/nonexclusive-distrib/1.0/","  We formulate a general microscopic approach to spin-orbit torques in thin
ferromagnet/heavy-metal bilayers in linear response to electric current or
electric field. The microscopic theory we develop avoids the notion of spin
currents and spin-Hall effect. Instead, the torques are directly related to a
local spin polarization of conduction electrons, which is computed from
generalized Kubo-St\v{r}eda formulas. A symmetry analysis provides a one-to-one
correspondence between polarization susceptibility tensor components and
different torque terms in the Landau-Lifshitz-Gilbert equation for
magnetization dynamics. The spin-orbit torques arising from Rashba or
Dresselhaus type of spin-orbit interaction are shown to have different
symmetries. We analyze these spin-orbit torques microscopically for a generic
electron model in the presence of an arbitrary smooth magnetic texture. For a
model with spin-independent disorder we find a major cancelation of the
torques. In this case the only remaining torque corresponds to the
magnetization-independent Edelstein effect. Furthermore, our results are
applied to analyze the dynamics of a Skyrmion under the action of electric
current.
","[{""version"":""v1"",""created"":""Fri, 25 Mar 2016 19:48:49 GMT""},{""version"":""v2"",""created"":""Wed, 25 Jan 2017 14:51:06 GMT""}]","2017-03-03"
"1603.07995","Ali Dabirmoghaddam","Ali Dabirmoghaddam, Mostafa Dehghan, J. J. Garcia-Luna-Aceves","Characterizing Interest Aggregation in Content-Centric Networks","9 pages, to appear in Proc. IFIP Networking 2016 Conference, Vienna,
  Austria",,,,"cs.NI","http://arxiv.org/licenses/nonexclusive-distrib/1.0/","  The Named Data Networking (NDN) and Content-Centric Networking (CCN)
architectures advocate Interest aggregation as a means to reduce end-to-end
latency and bandwidth consumption. To enable these benefits, Interest
aggregation must be realized through Pending Interest Tables (PIT) that grow in
size at the rate of incoming Interests to an extent that may eventually defeat
their original purpose. A thorough analysis is provided of the Interest
aggregation mechanism using mathematical arguments backed by extensive
discrete-event simulation results. We present a simple yet accurate analytical
framework for characterizing Interest aggregation in an LRU cache, and use our
model to develop an iterative algorithm to analyze the benefits of Interest
aggregation in a network of interconnected caches. Our findings reveal that,
under realistic assumptions, an insignificant fraction of Interests in the
system benefit from aggregation, compromising the effectiveness of using PITs
as an integral component of Content-Centric Networks.
","[{""version"":""v1"",""created"":""Fri, 25 Mar 2016 19:51:49 GMT""}]","2016-03-28"
"1603.07996","Andrea Camposeo","M. Moffa (1), V. Fasano (2), A. Camposeo (1), L. Persano (1), D.
  Pisignano (1,2) ((1) Istituto Nanoscienze-CNR, (2) Dipartimento di Matematica
  e Fisica 'Ennio De Giorgi'-Universit\`a del Salento)","Control of photon transport properties in nanocomposite nanowires","7 pages, 3 figures, 29 references. Invited contribution. Copyright
  (2016) Society of Photo Optical Instrumentation Engineers. One print or
  electronic copy may be made for personal use only. Systematic reproduction
  and distribution, duplication of any material in this paper for a fee or for
  commercial purposes, or modification of the content of the paper are
  prohibited","Proceedings SPIE 9745, 97450S. 24 February 2016","10.1117/12.2212640",,"cond-mat.mtrl-sci","http://arxiv.org/licenses/nonexclusive-distrib/1.0/","  Active nanowires and nanofibers can be realized by the electric-field induced
stretching of polymer solutions with sufficient molecular entanglements. The
resulting nanomaterials are attracting an increasing attention in view of their
application in a wide variety of fields, including optoelectronics, photonics,
energy harvesting, nanoelectronics, and microelectromechanical systems.
Realizing nanocomposite nanofibers is especially interesting in this respect.
In particular, methods suitable for embedding inorganic nanocrystals in
electrified jets and then in active fiber systems allow for controlling
light-scattering and refractive index properties in the realized fibrous
materials. We here report on the design, realization, and morphological and
spectroscopic characterization of new species of active, composite nanowires
and nanofibers for nanophotonics. We focus on the properties of
light-confinement and photon transport along the nanowire longitudinal axis,
and on how these depend on nanoparticle incorporation. Optical losses
mechanisms and their influence on device design and performances are also
presented and discussed.
","[{""version"":""v1"",""created"":""Fri, 25 Mar 2016 19:53:35 GMT""}]","2016-03-28"
"1603.07997","Peter Jung","Richard Kueng and Peter Jung","Robust Nonnegative Sparse Recovery and the Nullspace Property of 0/1
  Measurements","23 pages, 4 figures, revised version [scaling is now m =
  O(slog(n/s)); see Remark 10 and Kueng&Jung, ITW16]",,,,"cs.IT math.IT","http://arxiv.org/licenses/nonexclusive-distrib/1.0/","  We investigate recovery of nonnegative vectors from non-adaptive compressive
measurements in the presence of noise of unknown power. In the absence of
noise, existing results in the literature identify properties of the
measurement that assure uniqueness in the non-negative orthant. By linking such
uniqueness results to nullspace properties, we deduce uniform and robust
compressed sensing guarantees for nonnegative least squares. No
l1-regularization is required. As an important proof of principle, we establish
that m x n random i.i.d. 0/1-valued Bernoulli matrices obey the required
conditions with overwhelming probability provided that m=O(slog(n/s)). We
achieve this by establishing the robust nullspace property for random
0/1-matrices - a novel result in its own right. Our analysis is motivated by
applications in wireless network activity detection.
","[{""version"":""v1"",""created"":""Fri, 25 Mar 2016 19:56:34 GMT""},{""version"":""v2"",""created"":""Fri, 10 Mar 2017 16:35:24 GMT""}]","2017-03-13"
"1603.07998","Hang Zhang","Hang Zhang, Kristin Dana and Ko Nishino","Friction from Reflectance: Deep Reflectance Codes for Predicting
  Physical Surface Properties from One-Shot In-Field Reflectance",,,,,"cs.CV","http://arxiv.org/licenses/nonexclusive-distrib/1.0/","  Images are the standard input for vision algorithms, but one-shot infield
reflectance measurements are creating new opportunities for recognition and
scene understanding. In this work, we address the question of what reflectance
can reveal about materials in an efficient manner. We go beyond the question of
recognition and labeling and ask the question: What intrinsic physical
properties of the surface can be estimated using reflectance? We introduce a
framework that enables prediction of actual friction values for surfaces using
one-shot reflectance measurements. This work is a first of its kind
vision-based friction estimation. We develop a novel representation for
reflectance disks that capture partial BRDF measurements instantaneously. Our
method of deep reflectance codes combines CNN features and fisher vector
pooling with optimal binary embedding to create codes that have sufficient
discriminatory power and have important properties of illumination and spatial
invariance. The experimental results demonstrate that reflectance can play a
new role in deciphering the underlying physical properties of real-world
scenes.
","[{""version"":""v1"",""created"":""Fri, 25 Mar 2016 19:57:03 GMT""},{""version"":""v2"",""created"":""Sun, 10 Jul 2016 20:36:37 GMT""}]","2016-07-12"
