"1603.07946","Maxim Dvornikov","Maxim Dvornikov (1 and 2), Victor B. Semikoz (1) ((1) IZMIRAN, (2)
  Tomsk State University)","Nonconservation of lepton current and asymmetry of relic neutrinos","14 pages in pdfLaTeX, 1 eps figure; paper was significantly revised,
  title was changed, Sec. 2 was added, Secs. 3 and 4.1 were revised, version to
  be published in JETP","Journal of Experimental and Theoretical Physics, vol. 124, pp.
  731-739 (2017)","10.1134/S1063776117050016",,"astro-ph.CO hep-ph","http://arxiv.org/licenses/nonexclusive-distrib/1.0/","  The neutrino asymmetry in the early universe plasma, $n_\nu - n_{\bar \nu}$,
is calculated both before and after the electroweak phase transition (EWPT).
The leptogenesis before EWPT within the standard model is well known to be
driven by the abelian anomaly in a massless hypercharge field. The generation
of the neutrino asymmetry in the Higgs phase after EWPT, in its turn, has not
been considered previously because of the absence of any quantum anomaly in an
external electromagnetic field for such electroneutral particles as neutrino,
unlike the Adler anomaly for charged left and right polarized massless
electrons in the same electromagnetic field. Using the neutrino Boltzmann
equation, modified by the Berry curvature term in the momentum space, we
establish the violation of the macroscopic neutrino current in plasma after
EWPT and exactly reproduce the nonconservation of the lepton current in the
symmetric phase before EWPT arising in quantum field theory due to the non-zero
lepton hypercharge and corresponding triangle anomaly in an external
hypercharge field. In the last case the violation of the lepton current is
derived through the kinetic approach without the computation of the
corresponding Feynman diagrams. Then the new kinetic equation is applied for
the calculation of the neutrino asymmetry accounting for the the Berry
curvature and the electroweak interaction with background fermions in the Higgs
phase, including the stage after the neutrino decoupling at the absence of
neutrino collisions in plasma. This asymmetry is found to be rather small to be
observed. Thus, a difference of the relic neutrino and antineutrino densities,
if exists, should be acquired mainly in the symmetric phase before EWPT.
","[{""version"":""v1"",""created"":""Fri, 25 Mar 2016 16:01:18 GMT""},{""version"":""v2"",""created"":""Thu, 12 May 2016 07:15:47 GMT""},{""version"":""v3"",""created"":""Tue, 25 Apr 2017 10:38:30 GMT""}]","2017-05-05"
"1603.07947","Nouri Sakr","Nourhan Sakr and Cliff Stein","An Empirical Study of Online Packet Scheduling Algorithms",,,,,"cs.DS","http://arxiv.org/licenses/nonexclusive-distrib/1.0/","  This work studies online scheduling algorithms for buffer management,
develops new algorithms, and analyzes their performances. Packets arrive at a
release time r, with a non-negative weight w and an integer deadline d. At each
time step, at most one packet is scheduled. The modified greedy (MG) algorithm
is 1.618-competitive for the objective of maximizing the sum of weights of
packets sent, assuming agreeable deadlines. We analyze the empirical behavior
of MG in a situation with arbitrary deadlines and demonstrate that it is at a
disadvantage when frequently preferring maximum weight packets over early
deadline ones. We develop the MLP algorithm, which remedies this problem whilst
mimicking the behavior of the offline algorithm. Our comparative analysis shows
that, although the competitive ratio of MLP is not as good as that of MG, it
performs better in practice. We validate this by simulating the behavior of
both algorithms under a spectrum of simulated parameter settings. Finally, we
propose the design of three additional algorithms, which may help in improving
performance in practice.
","[{""version"":""v1"",""created"":""Fri, 25 Mar 2016 16:07:06 GMT""}]","2016-03-28"
"1603.07948","Rebecca Wooten Dr.","Rebecca D. Wooten and J. D'Andrea","Modeling Hurricanes using Principle Component Analysis in conjunction
  with Non-Response Analysis","17 pages, 15 figures",,,,"stat.AP physics.ao-ph","http://arxiv.org/licenses/nonexclusive-distrib/1.0/","  This paper demonstrates how principle component analysis can be used to
determine the distinct factors that house the terms that explain the variance
among the co-dependent variables and how non-response analysis can be applied
to model the non-functional relationship that exist in a dynamic system.
Moreover, the analysis indicates that there are pumping actions or ebb and flow
between the pressure and the water temperature readings near the surface of the
water days before a tropical storm forms in the Atlantic Basin and that there
is a high correlation between storm conditions and buoy conditions three-four
days before a storm forms. Further analysis shows that that the relationship
among the variables is conical.
","[{""version"":""v1"",""created"":""Fri, 25 Mar 2016 16:15:17 GMT""}]","2016-03-28"
"1603.07949","Charles Vanwynsberghe","Charles Vanwynsberghe and R\'egis Marchiano and Fran\c{c}ois Ollivier
  and Pascal Challande and H\'el\`ene Moingeon and Jacques Marchal","Design and implementation of a multi-octave-band audio camera for
  realtime diagnosis",,"Applied Acoustics 89 (2015), 281-287","10.1016/j.apacoust.2014.10.009",,"physics.ins-det","http://arxiv.org/licenses/nonexclusive-distrib/1.0/","  Noise pollution investigation takes advantage of two common methods of
diagnosis: measurement using a Sound Level Meter and acoustical imaging. The
former enables a detailed analysis of the surrounding noise spectrum whereas
the latter is rather used for source localization. Both approaches complete
each other, and merging them into a unique system, working in realtime, would
offer new possibilities of dynamic diagnosis. This paper describes the design
of a complete system for this purpose: imaging in realtime the acoustic field
at different octave bands, with a convenient device. The acoustic field is
sampled in time and space using an array of MEMS microphones. This recent
technology enables a compact and fully digital design of the system. However,
performing realtime imaging with resource-intensive algorithm on a large amount
of measured data confronts with a technical challenge. This is overcome by
executing the whole process on a Graphic Processing Unit, which has recently
become an attractive device for parallel computing.
","[{""version"":""v1"",""created"":""Fri, 25 Mar 2016 16:22:11 GMT""}]","2016-03-28"
"1603.07950","Hongbin Liu","H. Liu, M. Benoit, H. Chen, K. Chen, F.A. Di Bello, G. Iacobucci, F.
  Lanni, I. Peric, B. Ristic, M. Vicente Barreto Pinto, W. Wu, L. Xu and G. Jin","Development of a modular test system for the silicon sensor R&D of the
  ATLAS Upgrade",,,"10.1088/1748-0221/12/01/P01008",,"physics.ins-det hep-ex","http://arxiv.org/licenses/nonexclusive-distrib/1.0/","  High Voltage CMOS sensors are a promising technology for tracking detectors
in collider experiments. Extensive R&D studies are being carried out by the
ATLAS Collaboration for a possible use of HV-CMOS in the High Luminosity LHC
upgrade of the Inner Tracker detector. CaRIBOu (Control and Readout Itk BOard)
is a modular test system developed to test Silicon based detectors. It
currently includes five custom designed boards, a Xilinx ZC706 development
board, FELIX (Front-End LInk eXchange) PCIe card and a host computer. A
software program has been developed in Python to control the CaRIBOu hardware.
CaRIBOu has been used in the testbeam of the HV-CMOS sensor CCPDv4 at CERN.
Preliminary results have shown that the test system is very versatile. Further
development is ongoing to adapt to different sensors, and to make it available
to various lab test stands.
","[{""version"":""v1"",""created"":""Fri, 25 Mar 2016 16:32:46 GMT""},{""version"":""v2"",""created"":""Mon, 28 Mar 2016 14:29:08 GMT""},{""version"":""v3"",""created"":""Fri, 1 Apr 2016 04:39:23 GMT""},{""version"":""v4"",""created"":""Mon, 17 Oct 2016 14:32:10 GMT""}]","2017-01-12"
"1603.07951","Rishat Salimov","R.K. Salimov, E.G. Ekomasov","About the corollaries of the soliton-breather models of particles
  tunneling on the example of the nonlinear Klein-Gordon and Schrodinger
  equation",,,,,"nlin.PS","http://arxiv.org/licenses/nonexclusive-distrib/1.0/","  The paper presents soliton-breather models of particles tunneling on the
example of Klein-Gordon and Schrodinger equation nonlinear breathers. It is
shown that in this case the non-linearity registration should lead to spatial
restrictions in breathers wave properties observation and to appearance of
radiation during tunneling. The paper also presents a new type of Schrodinger
equation, which leads to the solutions localization in a space
three-dimensional spherically symmetric case.
","[{""version"":""v1"",""created"":""Fri, 25 Mar 2016 16:32:48 GMT""}]","2016-03-28"
"1603.07952","Romain Gicquaud","Julien Cortier, Mattias Dahl and Romain Gicquaud","Mass-like invariants for asymptotically hyperbolic metrics","98 pages",,,,"math.DG gr-qc math.RT","http://arxiv.org/licenses/nonexclusive-distrib/1.0/","  In this article, we classify the set of asymptotic mass-like invariants for
asymptotically hyperbolic metrics. It turns out that the standard mass is just
one example (but probably the most important one) among the two families of
invariants we find. These invariants are attached to finite-dimensional
representations of the group of isometries of hyperbolic space. They are then
described in terms of wave harmonic polynomials and polynomial solutions to the
linearized Einstein equations in Minkowski space.
","[{""version"":""v1"",""created"":""Fri, 25 Mar 2016 16:37:06 GMT""},{""version"":""v2"",""created"":""Fri, 22 Jun 2018 14:00:36 GMT""}]","2018-06-25"
"1603.07953","Saikat Mazumdar","Saikat Mazumdar","Struwe's Decomposition for a Polyharmonic Operator on a compact
  Riemannian Manifold with or without Boundary",,,,,"math.AP","http://arxiv.org/licenses/nonexclusive-distrib/1.0/","  Given a high-order elliptic operator on a compact manifold with or without
boundary, we perform the decomposition of Palais-Smale sequences for a
nonlinear problem as a sum of bubbles. This is a generalization of the
celebrated 1984 result of Struwe. Unlike the case of second-order operators,
bubbles close to the boundary might appear. Our result includes the case of a
smooth bounded domain of $\mathbb{R}^n$.
","[{""version"":""v1"",""created"":""Fri, 25 Mar 2016 16:38:03 GMT""}]","2016-03-28"
"1603.07954","Karthik Narasimhan","Karthik Narasimhan, Adam Yala and Regina Barzilay","Improving Information Extraction by Acquiring External Evidence with
  Reinforcement Learning","Appearing in EMNLP 2016 (12 pages incl. supplementary material)",,,,"cs.CL","http://arxiv.org/licenses/nonexclusive-distrib/1.0/","  Most successful information extraction systems operate with access to a large
collection of documents. In this work, we explore the task of acquiring and
incorporating external evidence to improve extraction accuracy in domains where
the amount of training data is scarce. This process entails issuing search
queries, extraction from new sources and reconciliation of extracted values,
which are repeated until sufficient evidence is collected. We approach the
problem using a reinforcement learning framework where our model learns to
select optimal actions based on contextual information. We employ a deep
Q-network, trained to optimize a reward function that reflects extraction
accuracy while penalizing extra effort. Our experiments on two databases -- of
shooting incidents, and food adulteration cases -- demonstrate that our system
significantly outperforms traditional extractors and a competitive
meta-classifier baseline.
","[{""version"":""v1"",""created"":""Fri, 25 Mar 2016 16:38:54 GMT""},{""version"":""v2"",""created"":""Tue, 14 Jun 2016 03:24:37 GMT""},{""version"":""v3"",""created"":""Tue, 27 Sep 2016 23:33:28 GMT""}]","2016-09-29"
"1603.07956","Simone Gutt","Michel Cahen, Thibaut Grouy and Simone Gutt","A possible symplectic framework for Radon-type transforms","Conference presented at the XXIV International Fall Workshop on
  Geometry and Physics in Zaragoza in September 2015",,"10.1142/S0219887816410024",,"math.SG","http://arxiv.org/licenses/nonexclusive-distrib/1.0/","  Our project is to define Radon-type transforms in symplectic geometry. The
chosen framework consists of symplectic symmetric spaces whose canonical
connection is of Ricci-type. They can be considered as symplectic analogues of
the spaces of constant holomorphic curvature in K\""ahlerian Geometry. They are
characterized amongst a class of symplectic manifolds by the existence of many
totally geodesic symplectic submanifolds. We present a particular class of
Radon type tranforms, associating to a smooth compactly supported function on a
homogeneous manifold $M$, a function on a homogeneous space $N$ of totally
geodesic submanifolds of $M$, and vice versa. We describe some spaces $M$ and
$N$ in such Radon-type duality with $M$ a model of symplectic symmetric space
with Ricci-type canonical connection and $N$ an orbit of totally geodesic
symplectic submanifolds.
","[{""version"":""v1"",""created"":""Fri, 25 Mar 2016 16:40:49 GMT""}]","2016-11-03"
"1603.07957","Fuqiang Liu","Fuqiang Liu, Fukun Bi, Liang Chen","Object Recognition Based on Amounts of Unlabeled Data","16 pages, 6 figures, 2 tables",,,,"cs.CV","http://creativecommons.org/licenses/by/4.0/","  This paper proposes a novel semi-supervised method on object recognition.
First, based on Boost Picking, a universal algorithm, Boost Picking Teaching
(BPT), is proposed to train an effective binary-classifier just using a few
labeled data and amounts of unlabeled data. Then, an ensemble strategy is
detailed to synthesize multiple BPT-trained binary-classifiers to be a
high-performance multi-classifier. The rationality of the strategy is also
analyzed in theory. Finally, the proposed method is tested on two databases,
CIFAR-10 and CIFAR-100. Using 2% labeled data and 98% unlabeled data, the
accuracies of the proposed method on the two data sets are 78.39% and 50.77%
respectively.
","[{""version"":""v1"",""created"":""Fri, 25 Mar 2016 16:44:35 GMT""}]","2019-08-17"
"1603.07958","Jose I. Liberati","Jose I. Liberati","Cohomology of vertex algebras","11 pages. arXiv admin note: text overlap with arXiv:1008.2351 by
  other authors",,,,"math.QA","http://arxiv.org/licenses/nonexclusive-distrib/1.0/","  Let $V$ be a vertex algebra and $M$ a $V$-module. We define the first and
second cohomology of $V$ with coefficients in $M$, and we show that the second
cohomology $H^{2}(V, M)$ corresponds bijectively to the set of equivalence
classes of square-zero extensions of $V$ by $M$. In the case that $M=V$, we
show that the second cohomology $H^{2}(V, V)$ corresponds bijectively to the
set of equivalence classes of first order deformations of $V$.
","[{""version"":""v1"",""created"":""Fri, 25 Mar 2016 16:45:18 GMT""}]","2016-03-28"
"1603.07959","Bryan Johnson","Bryan M. Johnson, Richard I. Klein","Three temperature plasma shock solutions with gray radiation diffusion","Accepted for publication in Shock Waves. The final publication is
  available at Springer via http://dx.doi.org/10.1007/s00193-016-0649-9",,"10.1007/s00193-016-0649-9","LLNL-JRNL-685240","astro-ph.HE physics.plasm-ph","http://arxiv.org/licenses/nonexclusive-distrib/1.0/","  The effects of radiation on the structure of shocks in a fully-ionized plasma
are investigated by solving the steady-state fluid equations for ions,
electrons, and radiation. The electrons and ions are assumed to have the same
bulk velocity but separate temperatures, and the radiation is modeled with the
gray-diffusion approximation. Both electron and ion conduction are included, as
well as ion viscosity. When the material is optically thin, three-temperature
behavior occurs. When the diffusive flux of radiation is important but
radiation pressure is not, two-temperature behavior occurs, with the electrons
strongly coupled to the radiation. Since the radiation heats the electrons on
length scales that are much longer than the electron-ion Coulomb coupling
length scale, these solutions resemble radiative shock solutions rather than
plasma shock solutions that neglect radiation. When radiation pressure is
important, all three components are strongly coupled. Results with constant
values for the transport and coupling coefficients are compared to a full
numerical simulation with a good match between the two, demonstrating that
steady shock solutions constitute a straightforward and comprehensive
verification test methodology for multi-physics numerical algorithms.
","[{""version"":""v1"",""created"":""Fri, 25 Mar 2016 16:52:03 GMT""}]","2016-03-28"
"1603.07960","Kei Yamamoto","Morimitsu Tanimoto, Kei Yamamoto","Probing the SUSY with $10$ TeV stop mass in rare decays and CP violation
  of Kaon","23 pages, 8 figures. Major changes. Discussion for the gluino
  contributions added","Prog Theor Exp Phys (2016)","10.1093/ptep/ptw160","KEK-TH-1894","hep-ph","http://arxiv.org/licenses/nonexclusive-distrib/1.0/","  We probe the SUSY at the $10 \ {\rm TeV}$ scale in the rare decays and the CP
violation of the kaon. We focus on the processes of $K_L \to \pi^0 \nu{\bar
\nu}$ and $K^+ \to \pi^+ \nu{\bar \nu}$ combined with the CP violating
parameters $\epsilon_K$ and $\epsilon_K^\prime/\epsilon_K$. The Z-penguin
mediated by the chargino loop cannot enhance $K_L \to \pi^0 \nu{\bar \nu}$ and
$K^+ \to \pi^+ \nu{\bar \nu}$ because the left-right mixing of the stop is
constrained by the $125$ GeV Higgs mass. On the other hand, the Z-penguin
mediated by the gluino loop can enhance the branching ratios of both $K_L \to
\pi^0 \nu {\bar \nu}$ and $K^+ \to \pi^+ \nu {\bar \nu}$. The former increases
up to more than $1.0 \times 10^{-10}$, which is much larger than the SM
prediction even if the constraint of $\epsilon_K$ is imposed. It is remarkable
that the Z-penguin mediated by the gluino loop can enhance simultaneously
$\epsilon^\prime_K/\epsilon_K$ and the branching ratio of $K_L \to \pi^0 \nu
{\bar \nu}$, which increases up to $1.0 \times 10^{-10}$. We also study the
decay rates of $K_L\rightarrow \mu^+\mu^-$, $B^0\rightarrow \mu^+\mu^-$ and
$B_s\rightarrow \mu^+\mu^-$, which correlate with the $K_L \to \pi^0 \nu {\bar
\nu}$ decay through the Z penguin. It is important to examine the
$B^0\rightarrow \mu^+\mu^-$ process since we expect the enough sensitivity of
this decay mode to the SUSY at LHCb.
","[{""version"":""v1"",""created"":""Fri, 25 Mar 2016 16:54:25 GMT""},{""version"":""v2"",""created"":""Wed, 18 May 2016 08:21:59 GMT""},{""version"":""v3"",""created"":""Mon, 22 Aug 2016 19:01:51 GMT""}]","2019-12-06"
"1603.07961","P Balasubramanian","P Balasubramanian, N E Mastorakis","ASIC-based Implementation of Synchronous Section-Carry Based Carry
  Lookahead Adders","in the Book, Recent Advances in Circuits, Systems, Signal Processing
  and Communications, Included in ISI/SCI Web of Science and Web of Knowledge,
  Proceedings of 10th International Conference on Circuits, Systems, Signal and
  Telecommunications, pp. 58-64, 2016, Barcelona, Spain",,,,"cs.AR","http://arxiv.org/licenses/nonexclusive-distrib/1.0/","  The section-carry based carry lookahead adder (SCBCLA) topology was proposed
as an improved high-speed alternative to the conventional carry lookahead adder
(CCLA) topology in previous works. Self-timed and FPGA-based implementations of
SCBCLAs and CCLAs were considered earlier, and it was found that SCBCLAs could
help in delay reduction i.e. pave the way for improved speed compared to CCLAs
at the expense of some increase in area and/or power parameters. In this work,
we consider semi-custom ASIC-based implementations of different variants of
SCBCLAs and CCLAs to perform 32-bit dual-operand addition. Based on the
simulation results for 32-bit dual-operand addition obtained by targeting a
high-end 32/28nm CMOS process, it is found that an optimized SCBCLA
architecture reports a 9.8% improvement in figure-of-merit (FOM) compared to an
optimized CCLA architecture, where the FOM is defined as the inverse of the
product of power, delay, and area. It is generally inferred from the
simulations that the SCBCLA architecture could be more beneficial compared to
the CCLA architecture in terms of the design metrics whilst benefitting a
variety of computer arithmetic operations involving dual-operand and/or
multi-operand additions. Also, it is observed that heterogeneous CLA
architectures tend to fare well compared to homogeneous CLA architectures, as
substantiated by the simulation results.
","[{""version"":""v1"",""created"":""Fri, 25 Mar 2016 17:02:58 GMT""}]","2016-03-28"
"1603.07962","P Balasubramanian","P Balasubramanian, N E Mastorakis","Global versus Local Weak-Indication Self-Timed Function Blocks - A
  Comparative Analysis","in the Book, Recent Advances in Circuits, Systems, Signal Processing
  and Communications, Included in ISI/SCI Web of Science and Web of Knowledge,
  Proceedings of 10th International Conference on Circuits, Systems, Signal and
  Telecommunications, pp. 86-97, 2016, Barcelona, Spain",,,,"cs.AR","http://arxiv.org/licenses/nonexclusive-distrib/1.0/","  This paper analyzes the merits and demerits of global weak-indication
self-timed function blocks versus local weak-indication self-timed function
blocks, implemented using a delay-insensitive data code and adhering to 4-phase
return-to-zero handshaking. A self-timed ripple carry adder is considered as an
example function block for the analysis. The analysis shows that while global
weak-indication could help in optimizing the power, latency and area
parameters, local weak-indication facilitates the optimum performance in terms
of realizing the data-dependent cycle time that is characteristic of a
weak-indication self-timed design.
","[{""version"":""v1"",""created"":""Fri, 25 Mar 2016 17:11:33 GMT""}]","2016-03-28"
"1603.07963","Ming Xin","M. Xin, K. Shafak, M. Y. Peng, A. Kalaydzhyan, W. Wang, O. D. Muecke,
  F. X. Kaertner","Attosecond Precision Multi-km Laser-Microwave Network","42 pages, 13 figures",,,,"physics.ins-det physics.optics","http://arxiv.org/licenses/nonexclusive-distrib/1.0/","  Synchronous laser-microwave networks delivering attosecond timing precision
are highly desirable in many advanced applications, such as geodesy,
very-long-baseline interferometry, high-precision navigation and
multi-telescope arrays. In particular, rapidly expanding photon science
facilities like X-ray free-electron lasers and intense laser beamlines require
system-wide attosecond-level synchronization of dozens of optical and microwave
signals up to kilometer distances. Once equipped with such precision, these
facilities will initiate radically new science by shedding light on molecular
and atomic processes happening on the attosecond timescale, such as
intramolecular charge transfer, Auger processes and their impact on X-ray
imaging. Here, we present for the first time a complete synchronous
laser-microwave network with attosecond precision, which is achieved through
new metrological devices and careful balancing of fiber nonlinearities and
fundamental noise contributions. We demonstrate timing stabilization of a
4.7-km fiber network and remote optical-optical synchronization across a 3.5-km
fiber link with an overall timing jitter of 580 and 680 attoseconds RMS,
respectively, for over 40 hours. Ultimately we realize a complete
laser-microwave network with 950-attosecond timing jitter for 18 hours. This
work can enable next-generation attosecond photon-science facilities to
revolutionize many research fields from structural biology to material science
and chemistry to fundamental physics.
","[{""version"":""v1"",""created"":""Fri, 25 Mar 2016 17:14:07 GMT""},{""version"":""v2"",""created"":""Wed, 27 Jul 2016 13:44:07 GMT""}]","2016-07-28"
"1603.07964","P Balasubramanian","P Balasubramanian, N E Mastorakis","Power, Delay and Area Comparisons of Majority Voters relevant to TMR
  Architectures","in the Book, Recent Advances in Circuits, Systems, Signal Processing
  and Communications, Included in ISI/SCI Web of Science and Web of Knowledge,
  Proceedings of 10th International Conference on Circuits, Systems, Signal and
  Telecommunications, pp. 110-117, 2016, Barcelona, Spain",,,,"cs.AR","http://arxiv.org/licenses/nonexclusive-distrib/1.0/","  N-modular redundancy (NMR) is commonly used to enhance the fault tolerance of
a circuit/system, when subject to a fault-inducing environment such as in space
or military systems, where upsets due to radiation phenomena, temperature
and/or other environmental conditions are anticipated. Triple Modular
Redundancy (TMR), which is a 3-tuple version of NMR, is widely preferred for
mission-control space, military, and aerospace, and safety-critical nuclear,
power, medical, and industrial control and automation systems. The TMR scheme
involves the two-times duplication of a simplex system hardware, with a
majority voter ensuring correctness provided at least two out of three copies
of the hardware remain operational. Thus the majority voter plays a pivotal
role in ensuring the correct operation of the TMR scheme. In this paper, a
number of standard-cell based majority voter designs relevant to TMR
architectures are presented, and their power, delay and area parameters are
estimated based on physical realization using a 32/28nm CMOS process.
","[{""version"":""v1"",""created"":""Fri, 25 Mar 2016 17:14:55 GMT""}]","2016-03-28"
