"1603.08030","Alejandro Lopez-Bezanilla Ph.D","Alejandro Lopez-Bezanilla","Electronic Transport Properties of Chemically Modified Double-Walled
  Carbon Nanotubes","7 pages, 4 Figures","J. Phys. Chem. C, 2013, 117 (29), pp 15266-15271","10.1021/jp402355x",,"cond-mat.mtrl-sci","http://arxiv.org/licenses/nonexclusive-distrib/1.0/","  We present a study on the quantum transport properties of chemically
functionalized metallic double-walled carbon nanotubes (DWNTs) with lengths
reaching the micrometer scale. First-principles calculations evidence that, for
coaxial tubes separated by the typical graphitic van der Waals-bond distance,
the chemical modification of the outer wall with sp$^3$-type defects affects
the electronic structure of both the outer and the inner tube, which reduces
significantly the charge transport capability of the DWNT. For larger spacing
between sidewalls, the conductivity of the outer wall decreases with increasing
functional group coverage density while charge transport in the inner tube is
equivalent to that of a pristine nanotube. Additionally, chemical attachment of
CCl$_2$ onto the outer DWNT sidewall barely affect the conjugated $\pi$-network
of the double-wall and charge transport remains in the quasi-ballistic regime.
These results indicate an efficient route for tailoring electronic transport in
DWNTs provided inner shell geometry and functional groups are properly chosen.
","[{""version"":""v1"",""created"":""Fri, 25 Mar 2016 20:58:09 GMT""}]","2016-03-29"
"1603.08031","Luigi Mancini","L. Mancini, J. Kemmer, J. Southworth, K. Bott, P. Molli\`ere, S.
  Ciceri, G. Chen, Th. Henning","An optical transmission spectrum of the giant planet WASP-36 b","11 pages, 9 figures, accepted for publication in MNRAS","Monthly Notices of the Royal Astronomical Society 459, 1393-1402,
  2016","10.1093/mnras/stw659",,"astro-ph.EP","http://arxiv.org/licenses/nonexclusive-distrib/1.0/","  We present broad-band photometry of five transits in the planetary system
WASP-36, totaling 17 high-precision light curves. Four of the transits were
simultaneously observed in four passbands (g, r, i, z), using the
telescope-defocussing technique, and achieving scatters of less than 1 mmag per
observation. We used these data to improve the measured orbital and physical
properties of the system, and obtain an optical transmission spectrum of the
planet. We measured a decreasing radius from bluer to redder passbands with a
confidence level of more than 5 sigma. The radius variation is roughly 11
pressure scale heights between the g and the z bands. This is too strong to be
Rayleigh scattering in the planetary atmosphere, and implies the presence of a
species which absorbs strongly at bluer wavelengths.
","[{""version"":""v1"",""created"":""Fri, 25 Mar 2016 21:00:01 GMT""}]","2016-05-19"
"1603.08032","Marko Gacesa","Marko Gacesa, John A. Montgomery Jr., H. Harvey Michels, and Robin
  C\^ot\'e","Production of NaCa$^+$ molecular ions in the ground state from cold
  atom-ion mixtures by photoassociation via an intermediate state","13 pages, 15 figures; submitted to Phys. Rev. A",,"10.1103/PhysRevA.94.013407",,"physics.atom-ph quant-ph","http://arxiv.org/licenses/nonexclusive-distrib/1.0/","  We present a theoretical analysis of optical pathways for formation of cold
Ca($^1$S)Na$^+$($^1$S) molecular ions via an intermediate state. The formation
schemes are based on ab initio potential energy curves and transition dipole
moments calculated using effective-core-potential methods of quantum chemistry.
In the proposed approach, starting from a mixture of cold trapped Ca$^+$ ions
immersed into an ultracold gas of Na atoms, (NaCa)$^+$ molecular ions are
photoassociated in the excited E$^{1}\Sigma^+$ electronic state and allowed to
spontaneously decay either to the ground electronic state or an intermediate
state from which the population is transferred to the ground state via an
additional optical excitation. By analyzing all possible pathways, we find that
the efficiency of a two-photon scheme, via either B$^{1}\Sigma^+$ or
C$^{1}\Sigma^+$ potential, is sufficient to produce significant quantities of
ground state (NaCa)$^+$ molecular ions. A single-step process results in lower
formation rates that would require either a high density sample or a very
intense photoassociation laser to be viable.
","[{""version"":""v1"",""created"":""Fri, 25 Mar 2016 21:05:34 GMT""},{""version"":""v2"",""created"":""Thu, 9 Jun 2016 17:46:48 GMT""}]","2016-08-03"
"1603.08033","Kemp Plumb Dr.","K. W. Plumb, Jennifer Morey, J. A. Rodriguez-Rivera, Hui Wu, A. A.
  Podlesnyak, T. M. McQueen, C. L. Broholm","Antiferromagnetic and Orbital Ordering on a Diamond Lattice Near Quantum
  Criticality","16 pages, 12 figures","Phys. Rev. X 6, 041055 (2016)","10.1103/PhysRevX.6.041055",,"cond-mat.str-el","http://arxiv.org/licenses/nonexclusive-distrib/1.0/","  We present neutron scattering measurements on powder samples of the spinel
FeSc2S4 that reveal a previously unobserved magnetic ordering transition
occurring at 11.8(2)~K. Magnetic ordering occurs subsequent to a subtle
cubic-to-tetragonal structural transition which distorts Fe coordinating sulfur
tetrahedra lifting the orbital degeneracy. The application of 1~GPa hydrostatic
pressure appears to destabilize this N\'eel state, reducing the transition
temperature to 8.6(8)~K and redistributing magnetic spectral weight to higher
energies. The relative magnitudes of ordered $\langle m \rangle^2\!=\!3.1(2)$
and fluctuating moments $\langle \delta m \rangle^2\!=\!13(1)$ show that the
magnetically ordered ground state of FeSc2S4 is drastically renormalized and in
proximity to criticality.
","[{""version"":""v1"",""created"":""Fri, 25 Mar 2016 21:06:34 GMT""}]","2016-12-21"
"1603.08034","Robert Carlson","Robert Carlson","An Extended Pruess Method for Sturm-Liouville Problems",,,,,"math.NA","http://arxiv.org/licenses/nonexclusive-distrib/1.0/","  A new version of the piecewise approximation (Pruess) method is developed for
calculating eigenvalues of Sturm-Liouville problems. The usual piecewise
constant or piecewise linear potential approximations are replaced by
translates of $2/cos^2(x)$, whose corresponding eigenvalue equation has
elementary solutions.
","[{""version"":""v1"",""created"":""Fri, 25 Mar 2016 21:08:36 GMT""}]","2016-03-29"
"1603.08035","Horia Mania","Horia Mania, Aaditya Ramdas, Martin J. Wainwright, Michael I. Jordan,
  Benjamin Recht","On kernel methods for covariates that are rankings","35 pages, 5 figures",,,,"stat.ML cs.DM cs.LG","http://arxiv.org/licenses/nonexclusive-distrib/1.0/","  Permutation-valued features arise in a variety of applications, either in a
direct way when preferences are elicited over a collection of items, or an
indirect way in which numerical ratings are converted to a ranking. To date,
there has been relatively limited study of regression, classification, and
testing problems based on permutation-valued features, as opposed to
permutation-valued responses. This paper studies the use of reproducing kernel
Hilbert space methods for learning from permutation-valued features. These
methods embed the rankings into an implicitly defined function space, and allow
for efficient estimation of regression and test functions in this richer space.
Our first contribution is to characterize both the feature spaces and spectral
properties associated with two kernels for rankings, the Kendall and Mallows
kernels. Using tools from representation theory, we explain the limited
expressive power of the Kendall kernel by characterizing its degenerate
spectrum, and in sharp contrast, we prove that Mallows' kernel is universal and
characteristic. We also introduce families of polynomial kernels that
interpolate between the Kendall (degree one) and Mallows' (infinite degree)
kernels. We show the practical effectiveness of our methods via applications to
Eurobarometer survey data as well as a Movielens ratings dataset.
","[{""version"":""v1"",""created"":""Fri, 25 Mar 2016 21:09:54 GMT""},{""version"":""v2"",""created"":""Thu, 20 Jul 2017 21:58:31 GMT""}]","2017-07-24"
"1603.08036","Sandrine Daurat","Sandrine Daurat","Hyperbolic saddle measures and laminarity for holomorphic endomorphisms
  of $P^2C$","29 pages, 1 figure",,,,"math.DS math.CV","http://arxiv.org/licenses/nonexclusive-distrib/1.0/","  We study the laminarity of the Green current of endomorphisms of $P^2C$ near
hyperbolic measures of saddle type. When these measures are supported by
attracting sets, we prove that the Green current is laminar in the basin of
attraction and we obtain new ergodic properties. This generalizes some results
of Bedford and Jonsson on regular polynomial mappings in $C^2$.
","[{""version"":""v1"",""created"":""Fri, 25 Mar 2016 21:19:39 GMT""},{""version"":""v2"",""created"":""Tue, 31 May 2016 11:58:02 GMT""}]","2016-06-01"
"1603.08037","Kevin Jamieson","Kevin Jamieson and Daniel Haas and Ben Recht","On the Detection of Mixture Distributions with applications to the Most
  Biased Coin Problem",,,,,"cs.LG","http://arxiv.org/licenses/nonexclusive-distrib/1.0/","  This paper studies the trade-off between two different kinds of pure
exploration: breadth versus depth. The most biased coin problem asks how many
total coin flips are required to identify a ""heavy"" coin from an infinite bag
containing both ""heavy"" coins with mean $\theta_1 \in (0,1)$, and ""light"" coins
with mean $\theta_0 \in (0,\theta_1)$, where heavy coins are drawn from the bag
with probability $\alpha \in (0,1/2)$. The key difficulty of this problem lies
in distinguishing whether the two kinds of coins have very similar means, or
whether heavy coins are just extremely rare. This problem has applications in
crowdsourcing, anomaly detection, and radio spectrum search. Chandrasekaran et.
al. (2014) recently introduced a solution to this problem but it required
perfect knowledge of $\theta_0,\theta_1,\alpha$. In contrast, we derive
algorithms that are adaptive to partial or absent knowledge of the problem
parameters. Moreover, our techniques generalize beyond coins to more general
instances of infinitely many armed bandit problems. We also prove lower bounds
that show our algorithm's upper bounds are tight up to $\log$ factors, and on
the way characterize the sample complexity of differentiating between a single
parametric distribution and a mixture of two such distributions. As a result,
these bounds have surprising implications both for solutions to the most biased
coin problem and for anomaly detection when only partial information about the
parameters is known.
","[{""version"":""v1"",""created"":""Fri, 25 Mar 2016 21:22:59 GMT""}]","2016-03-29"
"1603.08038","Valery Kovalchuk","V. I. Kovalchuk","Test of the Glauber Formula for Nucleon-Deuteron Scattering at
  Intermediate Energies",,"Phys. Atom. Nucl. Vol.75, No.1 (2012) P.33-36","10.1134/S1063778812010103",,"nucl-th","http://arxiv.org/licenses/nonexclusive-distrib/1.0/","  A high-precision test of the Glauber formula for the amplitude of
nucleon-deuteron scattering is performed. Nucleon-nucleon amplitudes used in
the calculations depend on the spins of interacting particles, phase shifts,
and mixing parameters. These amplitudes were derived by using the Nijmegen
potentials. The differential cross sections for nucleon-deuteron scattering
were calculated for the projectile-nucleon energies of 65, 95, 135, 150, 190,
and 250~MeV, and the results of these calculations were compared with
experimental data.
","[{""version"":""v1"",""created"":""Fri, 25 Mar 2016 21:26:25 GMT""}]","2016-03-29"
"1603.08039","Wen-Sheng Chu","Zhuo Hui and Wen-Sheng Chu","An Empirical Study of Dimensional Reduction Techniques for Facial Action
  Units Detection","Report on DR",,,,"cs.CV","http://arxiv.org/licenses/nonexclusive-distrib/1.0/","  Biologically inspired features, such as Gabor filters, result in very high
dimensional measurement. Does reducing the dimensionality of the feature space
afford advantages beyond computational efficiency? Do some approaches to
dimensionality reduction (DR) yield improved action unit detection? To answer
these questions, we compared DR approaches in two relatively large databases of
spontaneous facial behavior (45 participants in total with over 2 minutes of
FACS-coded video per participant). Facial features were tracked and aligned
using active appearance models (AAM). SIFT and Gabor features were extracted
from local facial regions. We compared linear (PCA and KPCA), manifold (LPP and
LLE), supervised (LDA and KDA) and hybrid approaches (LSDA) to DR with respect
to AU detection. For further comparison, a no-DR control condition was included
as well. Linear support vector machine classifiers with independent train and
test sets were used for AU detection. AU detection was quantified using area
under the ROC curve and F1. Baseline results for PCA with Gabor features were
comparable with previous research. With some notable exceptions, DR improved AU
detection relative to no-DR. Locality embedding approaches proved vulnerable to
\emph{out-of-sample} problems. Gradient-based SIFT lead to better AU detection
than the filter-based Gabor features. For area under the curve, few differences
were found between linear and other DR approaches. For F1, results were mixed.
For both metrics, the pattern of results varied among action units. These
findings suggest that action unit detection may be optimized by using specific
DR for specific action units. PCA and LDA were the most efficient approaches;
KDA was the least efficient.
","[{""version"":""v1"",""created"":""Fri, 25 Mar 2016 21:27:31 GMT""}]","2016-03-29"
"1603.08040","J. Davy Kirkpatrick","J. Davy Kirkpatrick, Kendra Kellogg, Adam C. Schneider, Sergio
  Fajardo-Acosta, Michael C. Cushing, Jennifer Greco, Gregory N. Mace,
  Christopher R. Gelino, Edward L. Wright, Peter R. M. Eisenhardt, Daniel
  Stern, Jacqueline K. Faherty, Scott S. Sheppard, George B. Lansbury, Sarah E.
  Logsdon, Emily C. Martin, Ian S. McLean, Steven D. Schurr, Roc M. Cutri, Tim
  Conrow","The AllWISE Motion Survey, Part 2","62 pages with 80 figures, accepted for publication in The
  Astrophysical Journal Supplement Series, 23 Mar 2016; second version fixes a
  few small typos and corrects the footnotes for Table 4",,"10.3847/0067-0049/224/2/36",,"astro-ph.SR","http://arxiv.org/licenses/nonexclusive-distrib/1.0/","  We use the AllWISE Data Release to continue our search for WISE-detected
motions. In this paper, we publish another 27,846 motion objects, bringing the
total number to 48,000 when objects found during our original AllWISE motion
survey are included. We use this list, along with the lists of confirmed
WISE-based motion objects from the recent papers by Luhman and by Schneider et
al. and candidate motion objects from the recent paper by Gagne et al. to
search for widely separated, common-proper-motion systems. We identify 1,039
such candidate systems. All 48,000 objects are further analyzed using
color-color and color-mag plots to provide possible characterizations prior to
spectroscopic follow-up. We present spectra of 172 of these, supplemented with
new spectra of 23 comparison objects from the literature, and provide
classifications and physical interpretations of interesting sources. Highlights
include: (1) the identification of three G/K dwarfs that can be used as
standard candles to study clumpiness and grain size in nearby molecular clouds
because these objects are currently moving behind the clouds, (2) the
confirmation/discovery of several M, L, and T dwarfs and one white dwarf whose
spectrophotometric distance estimates place them 5-20 pc from the Sun, (3) the
suggestion that the Na 'D' line be used as a diagnostic tool for interpreting
and classifying metal-poor late-M and L dwarfs, (4) the recognition of a triple
system including a carbon dwarf and late-M subdwarf, for which model fits of
the late-M subdwarf (giving [Fe/H] ~ -1.0) provide a measured metallicity for
the carbon star, and (5) a possible 24-pc-distant K5 dwarf + peculiar red L5
system with an apparent physical separation of 0.1 pc.
","[{""version"":""v1"",""created"":""Fri, 25 Mar 2016 21:34:12 GMT""},{""version"":""v2"",""created"":""Sat, 16 Apr 2016 04:30:04 GMT""}]","2016-06-22"
"1603.08041","Vitaly Chaban","Vitaly Chaban, Oleg Prezhdo","The Haber Process Made Efficient by Hydroxylated Graphene",,,,,"physics.chem-ph cond-mat.mtrl-sci","http://arxiv.org/licenses/nonexclusive-distrib/1.0/","  The Haber-Bosch process is the main industrial method for producing ammonia
from diatomic nitrogen and hydrogen. Very demanding energetically, it uses an
iron catalyst, and requires high temperature and pressure. Any improvement of
the Haber process will have an extreme scientific and economic impact. We
report a significant increase of ammonia production using hydroxylated
graphene. Exploiting the polarity difference between N2/H2 and NH3, as well as
the universal proton acceptor behavior of NH3, we demonstrate a strong shift of
the equilibrium of the Haber-Bosch process towards ammonia. Hydroxylated
graphene provides the polar environment favoring the forward reaction, and
remain stable under the investigated thermodynamic conditions. Ca. 50 kJ mol-1
enthalpy gain and ca. 60-70 kJ mol-1 free energy gain are achieved at 298-1300
K and 1-1000 bar, strongly shifting the reaction equilibrium towards the
product. A clear microscopic interpretation of the observed phenomenon is given
using electronic structure calculations and real-time reactive simulations. The
demonstrated principle can be applied with many polar groups functionalizing a
substrate with a high surface area, provided that the system is chemically
inert to H2, N2 and NH3. The modified Haber-Bosch process is of significant
importance to the chemical industry, since it provides a substantial increase
of the reaction yield while decreasing the temperature and pressure, thereby,
reducing the cost.
","[{""version"":""v1"",""created"":""Fri, 25 Mar 2016 21:40:36 GMT""}]","2016-03-29"
"1603.08042","Ouais Alsharif","Rohit Prabhavalkar, Ouais Alsharif, Antoine Bruguier, Ian McGraw","On the Compression of Recurrent Neural Networks with an Application to
  LVCSR acoustic modeling for Embedded Speech Recognition","Accepted in ICASSP 2016",,,,"cs.CL cs.LG cs.NE","http://arxiv.org/licenses/nonexclusive-distrib/1.0/","  We study the problem of compressing recurrent neural networks (RNNs). In
particular, we focus on the compression of RNN acoustic models, which are
motivated by the goal of building compact and accurate speech recognition
systems which can be run efficiently on mobile devices. In this work, we
present a technique for general recurrent model compression that jointly
compresses both recurrent and non-recurrent inter-layer weight matrices. We
find that the proposed technique allows us to reduce the size of our Long
Short-Term Memory (LSTM) acoustic model to a third of its original size with
negligible loss in accuracy.
","[{""version"":""v1"",""created"":""Fri, 25 Mar 2016 21:43:28 GMT""},{""version"":""v2"",""created"":""Mon, 2 May 2016 15:19:30 GMT""}]","2016-05-03"
"1603.08043","Avadh Saxena","Avinash Khare, Fred Cooper, and Avadh Saxena","Approximate Analytic Solutions to Coupled Nonlinear Dirac Equations","11 pages, 10 figures",,"10.1016/j.physleta.2017.01.018",,"nlin.PS","http://arxiv.org/licenses/nonexclusive-distrib/1.0/","  We consider the coupled nonlinear Dirac equations (NLDE's) in 1+1 dimensions
with scalar-scalar self interactions $\frac{ g_1^2}{2} ( {\bpsi} \psi)^2 +
\frac{ g_2^2}{2} ( {\bphi} \phi)^2 + g_3^2 ({\bpsi} \psi) ( {\bphi} \phi)$ as
well as vector-vector interactions of the form $\frac{g_1^2 }{2} (\bpsi
\gamma_{\mu} \psi)(\bpsi \gamma^{\mu} \psi)+ \frac{g_2^2 }{2} (\bphi
\gamma_{\mu} \phi)(\bphi \gamma^{\mu} \phi) + g_3^2 (\bpsi \gamma_{\mu}
\psi)(\bphi \gamma^{\mu} \phi ). $ Writing the two components of the assumed
solitary wave solution of these equations in the form $\psi = e^{-i \omega_1 t}
\{R_1 \cos \theta, R_1 \sin \theta \}$, $\phi = e^{-i \omega_2 t} \{R_2 \cos
\eta, R_2\sin \eta \}$, and assuming that $ \theta(x),\eta(x)$ have the {\it
same} functional form they had when $g_3$=0, which is an approximation
consistent with the conservation laws, we then find approximate analytic
solutions for $R_i(x)$ which are valid for small values of $g_3^2/ g_2^2 $ and
$g_3^2/ g_1^2$. In the nonrelativistic limit we show that both of these coupled
models go over to the same coupled nonlinear Schr\""odinger equation for which
we obtain two exact pulse solutions vanishing at $x \rightarrow \pm \infty$.
","[{""version"":""v1"",""created"":""Fri, 25 Mar 2016 21:54:45 GMT""}]","2017-03-08"
"1603.08044","Huajun Huang Dr","Prakash Ghimire, Huajun Huang","Derivations of the Lie algebra of strictly block upper triangular
  matrices","14 pages",,,,"math.RT math.QA math.RA","http://arxiv.org/licenses/nonexclusive-distrib/1.0/","  Let ${\mathcal N}$ be the Lie algebra of all $n\times n$ strictly block upper
triangular matrices over a field ${\mathbb F}$ relative to a given partition.
In this paper, we give an explicit description of all derivations of ${\mathcal
N}$.
","[{""version"":""v1"",""created"":""Fri, 25 Mar 2016 21:58:36 GMT""}]","2016-03-29"
"1603.08045","Mohammad Alomari Dr.","Mohammad W. Alomari","A Generalization of Hermite-Hadamard's Inequality","14 pages, no figures",,,,"math.CA","http://arxiv.org/licenses/nonexclusive-distrib/1.0/","  In literature the Hermite-Hadamard inequality was eligible for many reasons,
one of the most surprising and interesting that the Hermite-Hadamard inequality
combine the midpoint and trapezoid formulae in an inequality. In this work, a
Hermite-Hadamard like inequality that combines the composite trapezoid and
composite midpoint formulae is proved. So that, the classical Hermite-Hadamard
inequality becomes a special case of the presented result. Some Ostrowski's
type inequalities for convex functions are proved as well.
","[{""version"":""v1"",""created"":""Fri, 25 Mar 2016 22:03:36 GMT""}]","2016-03-29"
"1603.08046","Kohei Hayashi","Kohei Hayashi, Koji Ichikawa, Shigeki Matsumoto, Masahiro Ibe, Miho N.
  Ishigaki, Hajime Sugai","Dark matter annihilation and decay from non-spherical dark halos in the
  Galactic dwarf satellites","16 pages, 3 tables and 9 figures, published in MNRAS, matches
  published version",,"10.1093/mnras/stw1457",,"astro-ph.GA astro-ph.HE hep-ph","http://arxiv.org/licenses/nonexclusive-distrib/1.0/","  The dwarf spheroidal galaxies (dSphs) in the Milky Way are the primary
targets in the indirect searches for particle dark matter. To set robust
constraints on candidate of dark matter particles, understanding the dark halo
structure of these systems is of substantial importance. In this paper, we
first evaluate the astrophysical factors for dark matter annihilation and decay
for 24 dSphs, with taking into account a non-spherical dark halo, using
generalized axisymmetric mass models based on axisymmetric Jeans equations.
First, from a fitting analysis of the most recent kinematic data available, our
axisymmetric mass models are a much better fit than previous spherical ones,
thus, our work should be the most realistic and reliable estimator for
astrophysical factors. Secondly, we find that among analysed dSphs, the
ultra-faint dwarf galaxies Triangulum II and Ursa Major II are the most
promising but large uncertain targets for dark matter annihilation while the
classical dSph Draco is the most robust and detectable target for dark matter
decay. It is also found that the non-sphericity of luminous and dark components
influences the estimate of astrophysical factors, even though these factors
largely depend on the sample size, the prior range of parameters and the
spatial extent of the dark halo. Moreover, owing to these effects, the
constraints on the dark matter annihilation cross-section are more conservative
than those of previous spherical works. These results are important for
optimizing and designing dark matter searches in current and future
multi-messenger observations by space and ground-based telescopes.
","[{""version"":""v1"",""created"":""Fri, 25 Mar 2016 22:05:06 GMT""},{""version"":""v2"",""created"":""Thu, 4 Aug 2016 07:23:59 GMT""}]","2016-08-05"
