"1603.08084","Jianxin Lu","Qiang Jia, J. X. Lu and Xiao-Jun Tan","Phase structures of 4D stringy charged black holes in canonical ensemble","32 pages, 4 figures, 2 tables, a footnote on bubble phase added",,"10.1016/j.nuclphysb.2016.06.005","USTC-ICTS-16-03","hep-th","http://arxiv.org/licenses/nonexclusive-distrib/1.0/","  We study the thermodynamics and phase structures of the asymptotically flat
dilatonic black holes in 4 dimensions, placed in a cavity {\it a la} York, in
string theory for an arbitrary dilaton coupling. We consider these charged
black systems in canonical ensemble for which the temperature at the wall of
and the charge inside the cavity are fixed. We find that the dilaton coupling
plays the key role in the underlying phase structures. The connection of these
black holes to higher dimensional brane systems via diagonal (double) and/or
direct dimensional reductions indicates that the phase structures of the former
may exhaust all possible ones of the latter, which are more difficult to study,
under conditions of similar settings. Our study also shows that a diagonal
(double) dimensional reduction preserves the underlying phase structure while a
direct dimensional reduction has the potential to change it.
","[{""version"":""v1"",""created"":""Sat, 26 Mar 2016 07:53:22 GMT""},{""version"":""v2"",""created"":""Tue, 5 Apr 2016 06:47:03 GMT""}]","2016-06-29"
"1603.08085","Yogesh Singh","Amit and Yogesh Singh","The H-T and P-T phase diagram of the superconducting phase in
  Pd:Bi$_2$Te$_3$","4 pages, 6 figures, To appear in Journal of Superconductivity and
  Novel Magnetism",,,,"cond-mat.supr-con cond-mat.str-el","http://arxiv.org/licenses/nonexclusive-distrib/1.0/","  We study the magnetic field vs temperature ($H$--$T$) and pressure vs
temperature ($P$--$T$) phase diagram of the $T_c \approx 5.5$~K superconducting
phase in Pd$_x$Bi$_2$Te$_3$ ($x \approx 1$) using electrical resistivity versus
temperature measurements at various applied magnetic fields ($H$) and magnetic
susceptibility versus temperature measurements at various applied magnetic
fields ($H$) and pressure ($P$). The $H$--$T$ phase diagram has an initial
upward curvature as observed in some unconventional superconductors. The
critical field extrapolated to $T = 0$~K is $H_c (0) \approx 6$--$10$~kOe. The
$T_c$ is suppressed approximately linearly with pressure at a rate $dT_c/dP
\approx -0.28$~K/GPa.
","[{""version"":""v1"",""created"":""Sat, 26 Mar 2016 07:55:30 GMT""}]","2016-03-29"
"1603.08086","Raj Patel Dr","Raj B. Patel, Joseph Ho, Franck Ferreyrol, Timothy C. Ralph, Geoff J.
  Pryde","A quantum Fredkin gate","8 pages, 4 figures, also includes Supplementary Material. Published
  version available at http://advances.sciencemag.org/content/2/3/e1501531","Sci. Adv. 2016, 2 : e1501531","10.1126/sciadv.1501531",,"quant-ph","http://arxiv.org/licenses/nonexclusive-distrib/1.0/","  Key to realising quantum computers is minimising the resources required to
build logic gates into useful processing circuits. While the salient features
of a quantum computer have been shown in proof-of-principle experiments,
difficulties in scaling quantum systems have made more complex operations
intractable. This is exemplified in the classical Fredkin (controlled-SWAP)
gate for which, despite theoretical proposals, no quantum analogue has been
realised. By adding control to the SWAP unitary, we use photonic qubit logic to
demonstrate the first quantum Fredkin gate, which promises many applications in
quantum information and measurement. We implement example algorithms and
generate the highest-fidelity three-photon GHZ states to-date. The technique we
use allows one to add a control operation to a black-box unitary, something
impossible in the standard circuit model. Our experiment represents the first
use of this technique to control a two-qubit operation and paves the way for
larger controlled circuits to be realised efficiently.
","[{""version"":""v1"",""created"":""Sat, 26 Mar 2016 08:33:49 GMT""}]","2016-03-29"
"1603.08087","Sang Pyo Kim","Sang Pyo Kim, Won Kim (Kunsan Natl U.)","Will quantum cosmology resurrect chaotic inflation model?","LaTex 10 pages, 1 figure; CosPA 2015 (Cosmology and Particle
  Astrophysics), IBS, Daejeon, Korea, Oct. 12-16, 2015; to be published in Int.
  J. Mod. Phys.: Conf. Ser",,"10.1142/S2010194516602052",,"gr-qc","http://arxiv.org/licenses/nonexclusive-distrib/1.0/","  The single field chaotic inflation model with a monomial power greater than
one seems to be ruled out by the recent Planck and WMAP CMB data while
Starobinsky model with a higher curvature term seems to be a viable model.
Higher curvature terms being originated from quantum fluctuations, we revisit
the quantum cosmology of the Wheeler-DeWitt equation for the chaotic inflation
model. The semiclassical cosmology emerges from quantum cosmology with
fluctuations of spacetimes and matter when the wave function is peaked around
the semiclassical trajectory with quantum corrections a la the de Broglie-Bohm
pilot theory.
","[{""version"":""v1"",""created"":""Sat, 26 Mar 2016 08:41:05 GMT""}]","2016-08-03"
"1603.08088","Charles-Edouard Br\'ehier","Michel Bena\""im, Charles-Edouard Br\'ehier","Convergence of Adaptive Biasing Potential methods for diffusions",,,"10.1016/j.crma.2016.05.011",,"math.PR stat.CO","http://arxiv.org/licenses/nonexclusive-distrib/1.0/","  We prove the consistency of an adaptive importance sampling strategy based on
biasing the potential energy function $V$ of a diffusion process
$dX_t^0=-\nabla V(X_t^0)dt+dW_t$; for the sake of simplicity, periodic boundary
conditions are assumed, so that $X_t^0$ lives on the flat $d$-dimensional
torus. The goal is to sample its invariant distribution
$\mu=Z^{-1}\exp\bigl(-V(x)\bigr)\,dx$. The bias $V_t-V$, where $V_t$ is the new
(random and time-dependent) potential function, acts only on some coordinates
of the system, and is designed to flatten the corresponding empirical
occupation measure of the diffusion $X$ in the large time regime.
  The diffusion process writes $dX_t=-\nabla V_t(X_t)dt+dW_t$, where the bias
$V_t-V$ is function of the key quantity $\overline{\mu}_t$: a probability
occupation measure which depends on the past of the process, {\it i.e.} on
$(X_s)_{s\in [0,t]}$. We are thus dealing with a self-interacting diffusion.
  In this note, we prove that when $t$ goes to infinity, $\overline{\mu}_t$
almost surely converges to $\mu$. Moreover, the approach is justified by the
convergence of the bias to a limit which has an intepretation in terms of a
free energy.
  The main argument is a change of variables, which formally validates the
consistency of the approach. The convergence is then rigorously proven adapting
the ODE method from stochastic approximation.
","[{""version"":""v1"",""created"":""Sat, 26 Mar 2016 08:47:23 GMT""}]","2016-07-13"
"1603.08089","Qingqing Zhou","Qingqing Zhou, Rui Xia, Chengzhi Zhang","Online shopping behavior study based on multi-granularity opinion
  mining: China vs. America",,,,,"cs.CY cs.CL cs.HC","http://arxiv.org/licenses/nonexclusive-distrib/1.0/","  With the development of e-commerce, many products are now being sold
worldwide, and manufacturers are eager to obtain a better understanding of
customer behavior in various regions. To achieve this goal, most previous
efforts have focused mainly on questionnaires, which are time-consuming and
costly. The tremendous volume of product reviews on e-commerce websites has
seen a new trend emerge, whereby manufacturers attempt to understand user
preferences by analyzing online reviews. Following this trend, this paper
addresses the problem of studying customer behavior by exploiting recently
developed opinion mining techniques. This work is novel for three reasons.
First, questionnaire-based investigation is automatically enabled by employing
algorithms for template-based question generation and opinion mining-based
answer extraction. Using this system, manufacturers are able to obtain reports
of customer behavior featuring a much larger sample size, more direct
information, a higher degree of automation, and a lower cost. Second,
international customer behavior study is made easier by integrating tools for
multilingual opinion mining. Third, this is the first time an automatic
questionnaire investigation has been conducted to compare customer behavior in
China and America, where product reviews are written and read in Chinese and
English, respectively. Our study on digital cameras, smartphones, and tablet
computers yields three findings. First, Chinese customers follow the Doctrine
of the Mean, and often use euphemistic expressions, while American customers
express their opinions more directly. Second, Chinese customers care more about
general feelings, while American customers pay more attention to product
details. Third, Chinese customers focus on external features, while American
customers care more about the internal features of products.
","[{""version"":""v1"",""created"":""Sat, 26 Mar 2016 08:57:22 GMT""}]","2016-10-04"
"1603.08090","Igor Aharonovich","Ke Li, Yu Zhou, Abdullah Rasmita, Igor Aharonovich, WeiBo Gao","CVD nanodiamonds with non-blinking, near transform-limited linewidths
  emitters",,,,,"cond-mat.mtrl-sci physics.optics quant-ph","http://arxiv.org/licenses/nonexclusive-distrib/1.0/","  Near transform-limited single photon sources are required for perfect photon
indistinguishability in quantum networks. Having such sources in nanodiamonds
is particularly important since it can enable engineering hybrid quantum
photonic systems. In this letter, we report the generation of optically stable,
nearly transform-limited single silicon vacancy emitters in nanodiamonds. Lines
as narrow as 325 MHz are reported, which is comparable to the lifetime limited
linewidth. Moreover, the emitters exhibit minimal spectrum diffusion and
absolute photostability, even if pumped well above saturation. Our results
suggest that nanodiamonds can host color centers with supreme properties
suitable for hybrid photonic devices and quantum information.
","[{""version"":""v1"",""created"":""Sat, 26 Mar 2016 09:17:54 GMT""}]","2016-03-29"
"1603.08091","Qingqing Zhou","Qingqing Zhou, Chengzhi Zhang, Star X. Zhao, Bikun Chen","Measuring Book Impact Based on the Multi-granularity Online Review
  Mining","21pages,3 figures, 12 tables",,,,"cs.DL cs.CL","http://arxiv.org/licenses/nonexclusive-distrib/1.0/","  As with articles and journals, the customary methods for measuring books'
academic impact mainly involve citations, which is easy but limited to
interrogating traditional citation databases and scholarly book reviews,
Researchers have attempted to use other metrics, such as Google Books,
libcitation, and publisher prestige. However, these approaches lack
content-level information and cannot determine the citation intentions of
users. Meanwhile, the abundant online review resources concerning academic
books can be used to mine deeper information and content utilizing altmetric
perspectives. In this study, we measure the impacts of academic books by
multi-granularity mining online reviews, and we identify factors that affect a
book's impact. First, online reviews of a sample of academic books on Amazon.cn
are crawled and processed. Then, multi-granularity review mining is conducted
to identify review sentiment polarities and aspects' sentiment values. Lastly,
the numbers of positive reviews and negative reviews, aspect sentiment values,
star values, and information regarding helpfulness are integrated via the
entropy method, and lead to the calculation of the final book impact scores.
The results of a correlation analysis of book impact scores obtained via our
method versus traditional book citations show that, although there are
substantial differences between subject areas, online book reviews tend to
reflect the academic impact. Thus, we infer that online reviews represent a
promising source for mining book impact within the altmetric perspective and at
the multi-granularity content level. Moreover, our proposed method might also
be a means by which to measure other books besides academic publications.
","[{""version"":""v1"",""created"":""Sat, 26 Mar 2016 09:25:16 GMT""}]","2016-03-31"
"1603.08092","Jianyu Tang","Jianyu Tang, Hanzi Wang and Yan Yan","Learning Hough Regression Models via Bridge Partial Least Squares for
  Object Detection",,"Neurocomputing, 2015,152(3):236-249","10.1016/j.neucom.2014.10.071",,"cs.CV","http://arxiv.org/licenses/nonexclusive-distrib/1.0/","  Popular Hough Transform-based object detection approaches usually construct
an appearance codebook by clustering local image features. However, how to
choose appropriate values for the parameters used in the clustering step
remains an open problem. Moreover, some popular histogram features extracted
from overlapping image blocks may cause a high degree of redundancy and
multicollinearity. In this paper, we propose a novel Hough Transform-based
object detection approach. First, to address the above issues, we exploit a
Bridge Partial Least Squares (BPLS) technique to establish context-encoded
Hough Regression Models (HRMs), which are linear regression models that cast
probabilistic Hough votes to predict object locations. BPLS is an efficient
variant of Partial Least Squares (PLS). PLS-based regression techniques
(including BPLS) can reduce the redundancy and eliminate the multicollinearity
of a feature set. And the appropriate value of the only parameter used in PLS
(i.e., the number of latent components) can be determined by using a
cross-validation procedure. Second, to efficiently handle object scale changes,
we propose a novel multi-scale voting scheme. In this scheme, multiple Hough
images corresponding to multiple object scales can be obtained simultaneously.
Third, an object in a test image may correspond to multiple true and false
positive hypotheses at different scales. Based on the proposed multi-scale
voting scheme, a principled strategy is proposed to fuse hypotheses to reduce
false positives by evaluating normalized pointwise mutual information between
hypotheses. In the experiments, we also compare the proposed HRM approach with
its several variants to evaluate the influences of its components on its
performance. Experimental results show that the proposed HRM approach has
achieved desirable performances on popular benchmark datasets.
","[{""version"":""v1"",""created"":""Sat, 26 Mar 2016 09:33:30 GMT""}]","2016-03-29"
"1603.08093","Md. Ashraf Ali","Md. Ashraf Ali, A. K. M. Azharul Islam, Nusrat Jahan, Syeda
  Karimunnesa","First Principles Study of SnO Under High Pressure","08 pages","International Journal of Modern Physics B 30 (2016) 1650228","10.1142/S0217979216502283",,"cond-mat.mtrl-sci","http://arxiv.org/licenses/nonexclusive-distrib/1.0/","  This article reports the study of SnO by using the first-principles
pseudopotential plane-wave method within the generalized gradient approximation
(GGA). We have calculated the structural, elastic, electronic and optical of
SnO under high pressure. The elastic properties such as the elastic constants
Cij bulk modulus, shear modulus, Young modulus, anisotropic factor, Pugh ratio,
Poisson ratio are calculated and analyzed. Mechanical stability of SnO at all
pressure are confirmed by using Born stability criteria in terms of elastic
constants and are associated with ductile behaviour based on G/B ratios. It is
also found that SnO exhibits very high anisotropy. The energy band structure
and density of states are also calculated and analyzed. The results show the
semiconducting and metallic properties at 0 (zero) and high pressure,
respectively. Furthermore, the optical properties such as dielectric function,
refractive index, photoconductivity, absorption coefficients, loss function and
reflectivity are also calculated. All the results are compared with those of
the SnO where available but most of the results at high pressure are not
compared due to unavailability of the results.
","[{""version"":""v1"",""created"":""Sat, 26 Mar 2016 09:48:56 GMT""},{""version"":""v2"",""created"":""Thu, 21 Jul 2016 04:49:28 GMT""}]","2016-09-21"
"1603.08094","Aryan Mokhtari","Aryan Mokhtari and Wei Shi and Qing Ling and Alejandro Ribeiro","A Decentralized Second-Order Method for Dynamic Optimization",,,,,"math.OC","http://arxiv.org/licenses/nonexclusive-distrib/1.0/","  This paper considers decentralized dynamic optimization problems where nodes
of a network try to minimize a sequence of time-varying objective functions in
a real-time scheme. At each time slot, nodes have access to different summands
of an instantaneous global objective function and they are allowed to exchange
information only with their neighbors. This paper develops the application of
the Exact Second-Order Method (ESOM) to solve the dynamic optimization problem
in a decentralized manner. The proposed dynamic ESOM algorithm operates by
primal descending and dual ascending on a quadratic approximation of an
augmented Lagrangian of the instantaneous consensus optimization problem. The
convergence analysis of dynamic ESOM indicates that a Lyapunov function of the
sequence of primal and dual errors converges linearly to an error bound when
the local functions are strongly convex and have Lipschitz continuous
gradients. Numerical results demonstrate the claim that the sequence of
iterates generated by the proposed method is able to track the sequence of
optimal arguments.
","[{""version"":""v1"",""created"":""Sat, 26 Mar 2016 09:50:08 GMT""}]","2016-03-29"
"1603.08095","Vania Estrela Dr.","Felipe P. do Carmo, Joaquim T. de Assis, Vania V. Estrela, Alessandra
  M. Coelho","Blind signal separation and identification of mixtures of images","6 pages",,"10.1109/ACSSC.2009",,"cs.CV","http://creativecommons.org/licenses/by/4.0/","  In this paper, a fresh procedure to handle image mixtures by means of blind
signal separation relying on a combination of second order and higher order
statistics techniques are introduced. The problem of blind signal separation is
reassigned to the wavelet domain. The key idea behind this method is that the
image mixture can be decomposed into the sum of uncorrelated and/or independent
sub-bands using wavelet transform. Initially, the observed image is
pre-whitened in the space domain. Afterwards, an initial separation matrix is
estimated from the second order statistics de-correlation model in the wavelet
domain. Later, this matrix will be used as an initial separation matrix for the
higher order statistics stage in order to find the best separation matrix. The
suggested algorithm was tested using natural images.Experiments have confirmed
that the use of the proposed process provides promising outcomes in identifying
an image from noisy mixtures of images.
","[{""version"":""v1"",""created"":""Sat, 26 Mar 2016 10:04:41 GMT""}]","2016-03-29"
"1603.08096","Levon Aramyan","L. S. Aramyan, A. A. Hakobyan, A. R. Petrosian, V. de Lapparent, E.
  Bertin, G. A. Mamon, D. Kunth, T. A. Nazaryan, V. Adibekyan, M. Turatto","Supernovae and their host galaxies - IV. The distribution of supernovae
  relative to spiral arms","19 pages, 10 figures, 11 tables, resubmitted to MNRAS after
  addressing referee's comments",,"10.1093/mnras/stw873",,"astro-ph.GA","http://arxiv.org/licenses/nonexclusive-distrib/1.0/","  Using a sample of 215 supernovae (SNe), we analyze their positions relative
to the spiral arms of their host galaxies, distinguishing grand-design (GD)
spirals from non-GD (NGD) galaxies. We find that: (1) in GD galaxies, an offset
exists between the positions of Ia and core-collapse (CC) SNe relative to the
peaks of arms, while in NGD galaxies the positions show no such shifts; (2) in
GD galaxies, the positions of CC SNe relative to the peaks of arms are
correlated with the radial distance from the galaxy nucleus. Inside (outside)
the corotation radius, CC SNe are found closer to the inner (outer) edge. No
such correlation is observed for SNe in NGD galaxies nor for SNe Ia in either
galaxy class; (3) in GD galaxies, SNe Ibc occur closer to the leading edges of
the arms than do SNe II, while in NGD galaxies they are more concentrated
towards the peaks of arms. In both samples of hosts, the distributions of SNe
Ia relative to the arms have broader wings. These observations suggest that
shocks in spiral arms of GD galaxies trigger star formation in the leading
edges of arms affecting the distributions of CC SNe (known to have short-lived
progenitors). The closer locations of SNe Ibc vs. SNe II relative to the
leading edges of the arms supports the belief that SNe Ibc have more massive
progenitors. SNe Ia having less massive and older progenitors, have more time
to drift away from the leading edge of the spiral arms.
","[{""version"":""v1"",""created"":""Sat, 26 Mar 2016 10:17:26 GMT""}]","2016-04-27"
"1603.08097","Kunle Adegoke","Kunle Adegoke","Infinite arctangent sums involving Fibonacci and Lucas numbers",,,,,"math.NT","http://arxiv.org/licenses/nonexclusive-distrib/1.0/","  Using a straightforward elementary approach, we derive numerous infinite
arctangent summation formulas involving Fibonacci and Lucas numbers. While most
of the results obtained are new, a couple of celebrated results appear as
particular cases of the more general formulas derived here.
","[{""version"":""v1"",""created"":""Sat, 26 Mar 2016 10:17:28 GMT""}]","2016-03-29"
"1603.08098","Andrea Lucchini","Andrea Lucchini","A bound on the expected number of random elements to generate a finite
  group all of whose Sylow subgroups are d-generated",,,,,"math.GR","http://arxiv.org/licenses/nonexclusive-distrib/1.0/","  Assume that all the Sylow subgroups of a finite group $G$ can be generated by
$d$ elements. Then the expected number of elements of $G$ which have to be
drawn at random, with replacement, before a set of generators is found, is at
most $d+\eta$ with $\eta \sim 2.875065.$
","[{""version"":""v1"",""created"":""Sat, 26 Mar 2016 10:19:32 GMT""}]","2016-03-29"
"1603.08099","Wei Su","Wei Su and Yongguang Yu","Partial Convergence of Heterogeneous Hegselmann-Krause Opinion Dynamics","6pages,no figure","Science China Technological Sciences, 2017, 60","10.1007/s11431-016-0615-x",,"math.OC nlin.AO","http://arxiv.org/licenses/nonexclusive-distrib/1.0/","  In opinion dynamics, the convergence of the heterogeneous Hegselmann-Krause
(HK) dynamics has always been an open problem for years which looks forward to
any essential progress. In this short note, we prove a partial convergence
conclusion of the general heterogeneous HK dynamis. That is, there must be some
agents who will reach static states in finite time, while the other opinions
have to evolve between them with a minimum distance if all the opinions does
not reach consensus. And this result leads to the convergence of two special
case of heterogeneous HK dynamics: the minimum confidence threshold is large
enough, or the initial opinion difference is small enough.
","[{""version"":""v1"",""created"":""Sat, 26 Mar 2016 10:37:10 GMT""}]","2017-05-10"
"1603.08100","Svjetlana Terzic","Svjetlana Terzic","The rational homology ring of the based loop space of the gauge groups
  and the spaces of connections on a four-manifold","10 pages, some typos corrected, to appear in the volume of
  Fundamentalnaya i Prikladnaya Matematika honoring Yuri Petrovich Solovyov (in
  Russian); English translation in Journal of Mathematical Sciences",,,,"math.AT","http://arxiv.org/licenses/nonexclusive-distrib/1.0/","  We provide the rational-homotopic proof that the ranks of the homotopy groups
of a simply connected four-manifold depend only on its second Betti number. We
also consider the based loop spaces of the gauge groups and the spaces of
connections of a simply connected four-manifold and, appealing to~\cite{TI} and
using the models from the rational homotopy theory, we obtain the explicit
formulas for their rational Pontrjagin homology rings.
","[{""version"":""v1"",""created"":""Sat, 26 Mar 2016 11:08:23 GMT""},{""version"":""v2"",""created"":""Mon, 16 Jan 2017 22:49:54 GMT""}]","2017-01-18"
"1603.08101","Maria Chekhova Dr","Kirill Spasibko, Denis Kopylov, Tatiana Murzina, Gerd Leuchs, Maria
  Chekhova","Ring-shaped spectra of parametric down-conversion and entangled photons
  that never meet","4 pages, 6 figures",,"10.1364/OL.41.002827",,"quant-ph physics.optics","http://arxiv.org/licenses/nonexclusive-distrib/1.0/","  We report on the observation of an unusual type of parametric
down-conversion. In the regime where collinear degenerate emission is in the
anomalous range of group-velocity dispersion, its spectrum is restricted in
both angle and wavelength. Detuning from exact collinear-degenerate
phasematching leads to a ring shape of the wavelength-angular spectrum,
suggesting a new type of spatiotemporal coherence and entanglement of photon
pairs. By imposing a phase varying in a specific way in both angle and
wavelength, one can obtain an interesting state of an entangled photon pair,
with the two photons being never at the same point at the same time.
","[{""version"":""v1"",""created"":""Sat, 26 Mar 2016 11:19:30 GMT""}]","2016-06-29"
