"1605.01226","Katharina Rojan","Katharina Rojan, Rebecca Kraus, Thom\'as Fogarty, Hessam Habibian,
  Anna Minguzzi and Giovanna Morigi","Localization transition in presence of cavity backaction","10 pages, 6 figures","Phys. Rev. A 94, 013839 (2016)","10.1103/PhysRevA.94.013839",,"quant-ph","http://arxiv.org/licenses/nonexclusive-distrib/1.0/","  We study the localization transition of an atom confined by an external
optical lattice in a high-finesse cavity. The atom-cavity coupling yields an
effective secondary lattice potential, whose wavelength is incommensurate with
the periodicity of the optical lattice. The cavity lattice can induce
localization of the atomic wave function analogously to the Aubry-Andr\'e
localization transition. Starting from the master equation for the cavity and
the atom we perform a mapping of the system dynamics to a Hubbard Hamiltonian,
which can be reduced to the Harper's Hamiltonian in appropriate limits. We
evaluate the phase diagram for the atom ground state and show that the
transition between extended and localized wavefunction is controlled by the
strength of the cavity nonlinearity, which determines the size of the localized
region and the behaviour of the Lyapunov exponent. The Lyapunov exponent, in
particular, exhibits resonance-like behaviour in correspondence with the
optomechanical resonances. Finally we discuss the experimental feasibility of
these predictions.
","[{""version"":""v1"",""created"":""Wed, 4 May 2016 11:19:26 GMT""}]","2016-07-27"
"1605.01227","Markus Fulmek","Markus Fulmek","A simple bijection between permutation matrices and descending plane
  partitions without special parts","Included the reference to Lalonde's paper where this bijection was
  already mentioned",,,,"math.CO","http://arxiv.org/licenses/nonexclusive-distrib/1.0/","  We present a simple bijection between permutation matrices and descending
plane partitions without special parts. This bijection is already mentioned in
work of P. Lalonde (without giving the details); it involves the inversion
words of permutations and the (well-known) representation of descending plane
partitions as families of non--intersecting lattice paths. (Taking a short
detour, we will also exhibit how the (well--known) enumeration of descending
plane partitions follows easily from the evaluation of Andrew's determinant.)
","[{""version"":""v1"",""created"":""Wed, 4 May 2016 11:20:17 GMT""},{""version"":""v2"",""created"":""Mon, 19 Sep 2016 11:25:02 GMT""},{""version"":""v3"",""created"":""Tue, 7 Mar 2017 12:01:45 GMT""}]","2017-03-08"
"1605.01228","Dina Ali Sawi","Dina Farouk ALtayeb Ali, Fatima abdelgani Mustafa and Mohamed Osman
  Mustafa Fdolelsid","Automatic Handover Control for Distributed Load Balancing in Mobile
  Communication Network","15 pages, 10 figure",,,,"cs.NI","http://arxiv.org/licenses/nonexclusive-distrib/1.0/","  This paper explains the enhancement of handover processes in GSM networks by
using Load balancing algorithms (Round Robin), comparing the results with the
real system to determine the improvement percentage.
","[{""version"":""v1"",""created"":""Wed, 4 May 2016 11:25:36 GMT""}]","2016-05-05"
"1605.01229","Paolo Missier","Paolo Missier","The lifecycle of provenance metadata and its associated challenges and
  opportunities",,,,,"cs.DB","http://arxiv.org/licenses/nonexclusive-distrib/1.0/","  This chapter outlines some of the challenges and opportunities associated
with adopting provenance principles and standards in a variety of disciplines,
including data publication and reuse, and information sciences.
","[{""version"":""v1"",""created"":""Wed, 4 May 2016 11:27:45 GMT""}]","2016-05-05"
"1605.01230","Serafina Lapenta","Serafina Lapenta and Ioana Leustean","Notes on divisible MV-algebras",,,"10.1007/s00500-016-2339-z",,"math.LO","http://arxiv.org/licenses/nonexclusive-distrib/1.0/","  In these notes we study the class of divisible MV-algebras inside the
algebraic hierarchy of MV-algebras with product. We connect divisible
MV-algebras with $\mathbb Q$-vector lattices, we present the divisible hull as
a categorical adjunction and we prove a duality between finitely presented
algebras and rational polyhedra.
","[{""version"":""v1"",""created"":""Wed, 4 May 2016 11:32:32 GMT""},{""version"":""v2"",""created"":""Wed, 2 Nov 2016 10:18:41 GMT""}]","2016-11-03"
"1605.01231","Nico Van Cleemput","Nico Van Cleemput","Hamiltonian-connectedness of triangulations with few separating
  triangles","8 pages, 1 figure",,,,"math.CO","http://arxiv.org/licenses/nonexclusive-distrib/1.0/","  We prove that 3-connected triangulations with at most one separating triangle
are hamiltonian-connected. In order to show bounds on the strongest form of
this theorem, we proved that for any $s\geq4$ there are 3-connected
triangulation with $s$ separating triangles that are not hamiltonian-connected.
We also present computational results which show that all `small' 3-connected
triangulations with at most 3 separating triangles are hamiltonian-connected.
","[{""version"":""v1"",""created"":""Wed, 4 May 2016 11:39:49 GMT""}]","2016-05-05"
"1605.01232","Thu Ninh Van","Ninh Van Thu and Nguyen Ngoc Khanh","A note on uniqueness boundary of holomorphic mappings","12 pages",,,,"math.CV","http://arxiv.org/licenses/nonexclusive-distrib/1.0/","  In this paper, we prove Huang et al.'s conjecture stated that if $f$ is a
holomorphic function on $\Delta^+:=\{z\in \mathbb C \colon
|z|<1,~\mathrm{Im}(z)>0\}$ with $\mathcal{C}^\infty$-smooth extension up to
$(-1,1)$ such that $f$ maps $(-1,1)$ into a cone $\Gamma_C:=\{z\in \mathbb
C\colon |\mathrm{Im} (z)| \leq C|\mathrm{Re} (z)|\}$, for some positive number
$C$, and $f$ vanishes to infinite order at $0$, then $f$ vanishes identically.
In addition, some regularity properties of the Riemann mapping functions on the
boundary and an example concerning Huang et al.'s conjecture are also given.
","[{""version"":""v1"",""created"":""Wed, 4 May 2016 11:41:22 GMT""}]","2016-05-05"
"1605.01233","Chung Chan","Chung Chan, Ali Al-Bashabsheh, Qiaoqiao Zhou, Tarik Kaced and Tie Liu","Info-Clustering: A Mathematical Theory for Data Clustering","In celebration of Claude Shannon's Centenary",,,,"cs.IT math.IT q-bio.GN q-bio.NC","http://arxiv.org/licenses/nonexclusive-distrib/1.0/","  We formulate an info-clustering paradigm based on a multivariate information
measure, called multivariate mutual information, that naturally extends
Shannon's mutual information between two random variables to the multivariate
case involving more than two random variables. With proper model reductions, we
show that the paradigm can be applied to study the human genome and connectome
in a more meaningful way than the conventional algorithmic approach. Not only
can info-clustering provide justifications and refinements to some existing
techniques, but it also inspires new computationally feasible solutions.
","[{""version"":""v1"",""created"":""Wed, 4 May 2016 11:43:47 GMT""},{""version"":""v2"",""created"":""Wed, 5 Oct 2016 13:55:22 GMT""},{""version"":""v3"",""created"":""Sun, 11 Dec 2016 15:57:16 GMT""}]","2016-12-13"
"1605.01234","Nobuyuki Yoshioka","Nobuyuki Yoshioka, Hiroyasu Matsuura, and Masao Ogata","Quantum Hall Effect of Massless Dirac Fermions and Free Fermions in
  Hofstadter's Butterfly","6 pages, 4 figures, To be published in J. Phys. Soc. Jpn","J. Phys. Soc. Jpn. 85, 064712 (2016)","10.7566/JPSJ.85.064712",,"cond-mat.str-el","http://arxiv.org/licenses/nonexclusive-distrib/1.0/","  We propose a new physical interpretation of the Diophantine equation of
$\sigma_{xy}$ for the Hofstadter problem. First, we divide the energy spectrum,
or Hofstadter's butterfly, into smaller self-similar areas called ""subcells"",
which were first introduced by Hofstadter to describe the recursive structure.
We find that in the energy gaps between subcells, there are two ways to account
for the quantization rule of $\sigma_{xy}$, that are consistent with the
Diophantine equation: Landau quantization of (i) massless Dirac fermions or
(ii) free fermions in Hofstadter's butterfly.
","[{""version"":""v1"",""created"":""Wed, 4 May 2016 11:49:16 GMT""}]","2016-09-13"
"1605.01235","Sascha Eichst\""adt","S. Eichst\""adt, N. Makarava and C. Elster","On the evaluation of uncertainties for state estimation with the Kalman
  filter","27 pages, 5 figures",,"10.1088/0957-0233/27/12/125009",,"cs.SY","http://arxiv.org/licenses/nonexclusive-distrib/1.0/","  The Kalman filter is an established tool for the analysis of dynamic systems
with normally distributed noise, and it has been successfully applied in
numerous application areas. It provides sequentially calculated estimates of
the system states along with a corresponding covariance matrix. For nonlinear
systems, the extended Kalman filter is often used which is derived from the
Kalman filter by linearization around the current estimate. A key issue in
metrology is the evaluation of the uncertainty associated with the Kalman
filter state estimates. The ""Guide to the Expression of Uncertainty in
Measurements"" (GUM) and its supplements serve as the de facto standard for
uncertainty evaluation in metrology. We explore the relationship between the
covariance matrix produced by the Kalman filter and a GUM-compliant uncertainty
analysis. In addition, also the results of a Bayesian analysis are considered.
For the case of linear systems with known system matrices, we show that all
three approaches are compatible. When the system matrices are not precisely
known, however, or when the system is nonlinear, this equivalence breaks down
and different results can be reached then. Though for precisely known nonlinear
systems the result of the extended Kalman filter still corresponds to the
linearized uncertainty propagation of GUM. The extended Kalman filter can
suffer from linearization and convergence errors. These disadvantages can be
avoided to some extent by applying Monte Carlo procedures, and we propose such
a method which is GUM-compliant and can also be applied online during the
estimation. We illustrate all procedures in terms of a two-dimensional dynamic
system and compare the results with those obtained by particle filtering, which
has been proposed for the approximate calculation of a Bayesian solution.
Finally, we give some recommendations based on our findings.
","[{""version"":""v1"",""created"":""Wed, 4 May 2016 11:49:22 GMT""}]","2016-10-26"
"1605.01236","Joseph Y. Halpern","Joseph Y. Halpern, Yoram Moses","Characterizing Solution Concepts in Terms of Common Knowledge of
  Rationality","To appear in International Journal of Game Theory",,,,"cs.GT","http://arxiv.org/licenses/nonexclusive-distrib/1.0/","  Characterizations of Nash equilibrium, correlated equilibrium, and
rationalizability in terms of common knowledge of rationality are well known.
Analogous characterizations of sequential equilibrium, (trembling hand) perfect
equilibrium, and quasi-perfect equilibrium using results of Halpern [2009].
","[{""version"":""v1"",""created"":""Wed, 4 May 2016 11:49:43 GMT""}]","2016-05-05"
"1605.01237","Sebastian Eggert","Xue-Feng Zhang, Shijie Hu, Axel Pelster, and Sebastian Eggert","Quantum domain walls induce incommensurate supersolid phase on the
  anisotropic triangular lattice","8 pages, 8 figures. Latest version and more information at
  http://www.physik.uni-kl.de/eggert/papers/index.html","Phys. Rev. Lett. 117, 193201 (2016)","10.1103/PhysRevLett.117.193201",,"cond-mat.quant-gas cond-mat.str-el","http://arxiv.org/licenses/nonexclusive-distrib/1.0/","  We investigate the extended hard-core Bose-Hubbard model on the triangular
lattice as a function of spatial anisotropy with respect to both tunneling and
nearest-neighbor interaction strength. At half-filling the system can be tuned
from decoupled one-dimensional chains to a two-dimensional solid phase with
alternating density order by adjusting the anisotropic coupling. At
intermediate anisotropy, however, frustration effects dominate and an
incommensurate supersolid phase emerges, which is characterized by
incommensurate density order as well as an anisotropic superfluid density. We
demonstrate that this intermediate phase results from the proliferation of
topological defects in the form of quantum bosonic domain walls. Accordingly,
the structure factor has peaks at wave vectors, which are linearly related to
the number of domain walls in a finite system in agreement with extensive
quantum Monte Carlo simulations. We discuss possible connections with the
supersolid behavior in the high-temperature superconducting striped phase.
","[{""version"":""v1"",""created"":""Wed, 4 May 2016 11:52:54 GMT""},{""version"":""v2"",""created"":""Fri, 6 Jan 2017 16:48:55 GMT""}]","2017-01-09"
"1605.01238","Mattia Tani","Francesco Calabr\`o, Giancarlo Sangalli, Mattia Tani","Fast formation of isogeometric Galerkin matrices by weighted quadrature",,,"10.1016/j.cma.2016.09.013",,"math.NA","http://arxiv.org/licenses/nonexclusive-distrib/1.0/","  In this paper we propose an algorithm for the formation of matrices of
isogeometric Galerkin methods. The algorithm is based on three ideas. The first
is that we perform the external loop over the rows of the matrix. The second is
that we calculate the row entries by weighted quadrature. The third is that we
exploit the (local) tensor product structure of the basis functions. While all
ingredients have a fundamental role for computational efficiency, the major
conceptual change of paradigm with respect to the standard implementation is
the idea of using weighted quadrature: the test function is incorporated in the
integration weight while the trial function, the geometry parametrization and
the PDEs coefficients form the integrand function. This approach is very
effective in reducing the computational cost, while maintaining the optimal
order of approximation of the method. Analysis of the cost is confirmed by
numerical testing, where we show that, for $p$ large enough, the time required
by the floating point operations is less than the time spent in unavoidable
memory operations (the sparse matrix allocation and memory write). The proposed
algorithm allows significant time saving when assembling isogeometric Galerkin
matrices for all the degrees of the test spline space and paves the way for a
use of high-degree $k$-refinement in isogeometric analysis.
","[{""version"":""v1"",""created"":""Wed, 4 May 2016 11:54:34 GMT""},{""version"":""v2"",""created"":""Tue, 20 Sep 2016 21:02:47 GMT""}]","2017-04-05"
"1605.01239","Dariusz Lis","D. C. Lis, H. A. Wootten, M. Gerin, L. Pagani, E. Roueff, F.F.S van
  der Tak, C. Vastel, and C.M. Walmsley","Star Formation and Feedback: A Molecular Outflow-Prestellar Core
  Interaction in L1689N","Accepted for publication in the Astrophysical Journal, 20 pages, 10
  figures, 2 tables",,"10.3847/0004-637X/827/2/133",,"astro-ph.GA","http://arxiv.org/licenses/nonexclusive-distrib/1.0/","  We present Herschel, ALMA Compact Array (ACA), and Caltech Submillimeter
Observatory (CSO) observations of the prestellar core in L1689N, which has been
suggested to be interacting with a molecular outflow driven by the nearby solar
type protostar IRAS 16293-2422. This source is characterized by some of the
highest deuteration levels seen in the interstellar medium. The change in the
NH2D line velocity and width across the core provides clear evidence of an
interaction with the outflow, traced by the high-velocity water emission.
Quiescent, cold gas, characterized by narrow line widths is seen in the NE part
of the core, while broader, more disturbed line profiles are seen in the W/SW
part. Strong N2D+ and ND3 emission is detected with the ACA, extending S/SW
from the peak of the single-dish NH2D emission. The ACA data also reveal the
presence a compact dust continuum source, with a mean size of ~1100 au, a
central density of (1-2) 10^7 cm-3, and a mass of 0.2-0.4 Msun. The dust
emission peak is displaced ~5"" to the south with respect to the N2D+ and ND3
emission, as well as the single-dish dust continuum peak, suggesting that the
northern, quiescent part of the core is characterized by spatially extended
continuum emission, which is resolved out by the interferometer. We see no
clear evidence of fragmentation in this quiescent part of the core, which could
lead to a second generation of star formation, although a weak dust continuum
source is detected in this region in the ACA data.
","[{""version"":""v1"",""created"":""Wed, 4 May 2016 12:03:44 GMT""}]","2016-08-24"
"1605.01240","Afshin Goodarzi","Anders Bj\""orner and Afshin Goodarzi","On Codimension one Embedding of Simplicial Complexes",,,,,"math.GT math.CO","http://arxiv.org/licenses/nonexclusive-distrib/1.0/","  We study $d$-dimensional simplicial complexes that are PL embeddable in
$\mathbb{R}^{d+1}$. It is shown that such a complex must satisfy a certain
homological condition.
  The existence of this obstruction allows us to provide a systematic approach
to deriving upper bounds for the number of top-dimensional faces of such
complexes, particularly in low dimensions.
","[{""version"":""v1"",""created"":""Wed, 4 May 2016 12:09:09 GMT""},{""version"":""v2"",""created"":""Fri, 3 Mar 2017 18:31:53 GMT""}]","2017-03-06"
"1605.01241","Fabrizio Nichele","Fabrizio Nichele, Morten Kjaergaard, Henri J. Suominen, Rafal
  Skolasinski, Michael Wimmer, Binh-Minh Nguyen, Andrey A. Kiselev, Wei Yi,
  Marko Sokolich, Michael J. Manfra, Fanming Qu, Arjan J.A. Beukman, Leo P.
  Kouwenhoven, Charles M. Marcus","Giant spin-orbit splitting in inverted InAs/GaSb double quantum wells",,"Phys. Rev. Lett. 118, 016801 (2017)","10.1103/PhysRevLett.118.016801","NBI QDEV 2016","cond-mat.mes-hall","http://arxiv.org/licenses/nonexclusive-distrib/1.0/","  Transport measurements in inverted InAs/GaSb quantum wells reveal a giant
spin-orbit splitting of the energy bands close to the hybridization gap. The
splitting results from the interplay of electron-hole mixing and spin-orbit
coupling, and can exceed the hybridization gap. We experimentally investigate
the band splitting as a function of top gate voltage for both electron-like and
hole-like states. Unlike conventional, noninverted two-dimensional electron
gases, the Fermi energy in InAs/GaSb can cross a single spin-resolved band,
resulting in full spin-orbit polarization. In the fully polarized regime we
observe exotic transport phenomena such as quantum Hall plateaus evolving in
$e^2/h$ steps and a non-trivial Berry phase.
","[{""version"":""v1"",""created"":""Wed, 4 May 2016 12:12:31 GMT""},{""version"":""v2"",""created"":""Thu, 24 Nov 2016 09:54:26 GMT""}]","2017-01-06"
"1605.01242","Olivier Guye","Olivier Guye","Hierarchical Modeling of Multidimensional Data in Regularly Decomposed
  Spaces: Applications in Image Analysis","172 pages, 52 figures, research report",,,,"cs.CV","http://arxiv.org/licenses/nonexclusive-distrib/1.0/","  This last document is showing the gradual introduction of hierarchical
modeling techniques in image analysis. The first chapter is dealing with the
first works carried out in the field of industrial applications of pattern
recognition. The second chapter is focusing on the usage of these techniques in
satellite imagery and on the development of a satellite data archiving system
in the aim of using it in digital geography. The third chapter is about face
recognition based on planar image analysis and about the recognition of
partially hidden patterns. The present publication is ending with the
description of a future system of self-descriptive coding of still or moving
pictures in relation with the current video coding standards. As in the
previous documents, it will be found in annex algorithms targeted on image
analysis according two complementary approaches: - boundary-based approach for
the industrial applications of artificial vision; - region-based approach for
satellite image analysis.
","[{""version"":""v1"",""created"":""Wed, 4 May 2016 12:15:45 GMT""}]","2016-05-05"
"1605.01243","Akihiko Takahashi","Akihiko Takahashi, Toshihiro Yamada","A weak approximation with asymptotic expansion and multidimensional
  Malliavin weights","Published at http://dx.doi.org/10.1214/15-AAP1105 in the Annals of
  Applied Probability (http://www.imstat.org/aap/) by the Institute of
  Mathematical Statistics (http://www.imstat.org)","Annals of Applied Probability 2016, Vol. 26, No. 2, 818-856","10.1214/15-AAP1105","IMS-AAP-AAP1105","math.PR","http://arxiv.org/licenses/nonexclusive-distrib/1.0/","  This paper develops a new efficient scheme for approximations of expectations
of the solutions to stochastic differential equations (SDEs). In particular, we
present a method for connecting approximate operators based on an asymptotic
expansion with multidimensional Malliavin weights to compute a target
expectation value precisely. The mathematical validity is given based on
Watanabe and Kusuoka theories in Malliavin calculus. Moreover, numerical
experiments for option pricing under local and stochastic volatility models
confirm the effectiveness of our scheme. Especially, our weak approximation
substantially improves the accuracy at deep Out-of-The-Moneys (OTMs).
","[{""version"":""v1"",""created"":""Wed, 4 May 2016 12:15:49 GMT""}]","2016-05-05"
"1605.01244","Marco Caliari","Marco Caliari and Simone Zuccher","INFFTM: Fast evaluation of 3d Fourier series in MATLAB with an
  application to quantum vortex reconnections",,,"10.1016/j.cpc.2016.12.004",,"math.NA","http://arxiv.org/licenses/nonexclusive-distrib/1.0/","  Although Fourier series approximation is ubiquitous in computational physics
owing to the Fast Fourier Transform (FFT) algorithm, efficient techniques for
the fast evaluation of a three-dimensional truncated Fourier series at a set of
\emph{arbitrary} points are quite rare, especially in MATLAB language. Here we
employ the Nonequispaced Fast Fourier Transform (NFFT, by J. Keiner, S. Kunis,
and D. Potts), a C library designed for this purpose, and provide a Matlab and
GNU Octave interface that makes NFFT easily available to the Numerical Analysis
community. We test the effectiveness of our package in the framework of quantum
vortex reconnections, where pseudospectral Fourier methods are commonly used
and local high resolution is required in the post-processing stage. We show
that the efficient evaluation of a truncated Fourier series at arbitrary points
provides excellent results at a computational cost much smaller than carrying
out a numerical simulation of the problem on a sufficiently fine regular grid
that can reproduce comparable details of the reconnecting vortices.
","[{""version"":""v1"",""created"":""Wed, 4 May 2016 12:19:02 GMT""}]","2017-03-08"
"1605.01245","Li Ze","Ze Li and Lifeng Zhao","Asymptotic behaviors of Landau-Lifshitz flows from $\Bbb R^2$ to
  K\""ahler manifolds","This version improves the results in original Theorem 1.2 by
  including the positive curvature case",,,,"math.AP","http://arxiv.org/licenses/nonexclusive-distrib/1.0/","  In this paper, we study the asymptotic behaviors of finite energy solutions
to the Landau-Lifshitz flows from $\Bbb R^2$ into K\""ahler manifolds. First, we
prove that the solution with initial data below the critical energy converges
to a constant map in the energy space as $t\to \infty$ for the compact
Riemannian surface targets. In particular, when the target is a two dimensional
sphere, we prove that the solution to the Landau-Lifshitz-Gilbert equation with
initial data having an energy below $4\pi$ converges to some constant map in
the energy space. Second, for general compact K\""ahler manifolds and initial
data of an arbitrary finite energy, we obtain a bubbling theorem analogous to
the Struwe's results on the heat flows.
","[{""version"":""v1"",""created"":""Wed, 4 May 2016 12:23:46 GMT""},{""version"":""v2"",""created"":""Wed, 30 Nov 2016 14:31:27 GMT""}]","2016-12-01"
"1605.01246","Christine Cordula Dantas","Christine C. Dantas (IAE/DCTA-Brazil)","An Inhomogeneous Space-Time Patching Model Based on a Nonlocal and
  Nonlinear Schrodinger Equation","29 pages, 2 figures, accepted for publication in Foundations of
  Physics",,"10.1007/s10701-016-0019-6",,"gr-qc","http://arxiv.org/licenses/nonexclusive-distrib/1.0/","  We consider an integrable, nonlocal and nonlinear, Schr\""odinger equation
(NNSE) as a model for building space-time patchings in inhomogeneous loop
quantum cosmology (LQC). We briefly review exact solutions of the NNSE,
specially those obtained through ""geometric equivalence"" methods. Furthemore,
we argue that the integrability of the NNSE could be linked to consistency
conditions derived from LQC, under the assumption that the patchwork dynamics
behaves as an integrable many-body system.
","[{""version"":""v1"",""created"":""Wed, 4 May 2016 12:27:19 GMT""}]","2016-06-29"
"1605.01247","Philippe Ben-Abdallah","Gr\'egory Barbillon, Jean-Paul Hugonin, Svend-Age Biehs, Philippe
  Ben-Abdallah","True thermal antenna with hyperbolic metamaterials",,,"10.1364/OE.25.023356",,"physics.optics","http://arxiv.org/licenses/nonexclusive-distrib/1.0/","  A thermal antenna is an electromagnetic source which emits in its
surrounding, a spatially coherent field in the infrared frequency range.
Usually, its emission pattern changes with the wavelength so that the heat flux
it radiates is weakly directive. Here, we show that a class of hyperbolic
materials, possesses a Brewster angle which is weakly dependent on the
wavelength, so that they can radiate like a true thermal antenna with a highly
directional heat flux. The realization of these sources could open a new avenue
in the field of thermal management in far-field regime.
","[{""version"":""v1"",""created"":""Wed, 4 May 2016 12:32:37 GMT""},{""version"":""v2"",""created"":""Tue, 30 Aug 2016 21:48:05 GMT""}]","2017-10-11"
