"1605.01141","Gui-Song Xia","Gang Liu, Yann Gousseau, Gui-Song Xia","Texture Synthesis Through Convolutional Neural Networks and Spectrum
  Constraints",,,,,"cs.CV","http://arxiv.org/licenses/nonexclusive-distrib/1.0/","  This paper presents a significant improvement for the synthesis of texture
images using convolutional neural networks (CNNs), making use of constraints on
the Fourier spectrum of the results. More precisely, the texture synthesis is
regarded as a constrained optimization problem, with constraints conditioning
both the Fourier spectrum and statistical features learned by CNNs. In contrast
with existing methods, the presented method inherits from previous CNN
approaches the ability to depict local structures and fine scale details, and
at the same time yields coherent large scale structures, even in the case of
quasi-periodic images. This is done at no extra computational cost. Synthesis
experiments on various images show a clear improvement compared to a recent
state-of-the art method relying on CNN constraints only.
","[{""version"":""v1"",""created"":""Wed, 4 May 2016 04:37:52 GMT""},{""version"":""v2"",""created"":""Tue, 10 May 2016 17:50:49 GMT""},{""version"":""v3"",""created"":""Thu, 19 May 2016 08:43:00 GMT""}]","2016-05-20"
"1605.01142","Robin Kothari","Anurag Anshu, Aleksandrs Belovs, Shalev Ben-David, Mika G\""o\""os,
  Rahul Jain, Robin Kothari, Troy Lee, Miklos Santha","Separations in communication complexity using cheat sheets and
  information complexity","v1: 36 pages, 1 figure; v2: Added separation between exact quantum
  and bounded-error randomized communication, 39 pages, 2 figures","Proceedings of the 57th Annual IEEE Symposium on Foundations of
  Computer Science (FOCS 2016), pp. 555-564 (2016)","10.1109/FOCS.2016.66","MIT-CTP #4801","quant-ph cs.CC","http://arxiv.org/licenses/nonexclusive-distrib/1.0/","  While exponential separations are known between quantum and randomized
communication complexity for partial functions (Raz, STOC 1999), the best known
separation between these measures for a total function is quadratic, witnessed
by the disjointness function. We give the first super-quadratic separation
between quantum and randomized communication complexity for a total function,
giving an example exhibiting a power 2.5 gap. We further present a 1.5 power
separation between exact quantum and randomized communication complexity,
improving on the previous ~1.15 separation by Ambainis (STOC 2013). Finally, we
present a nearly optimal quadratic separation between randomized communication
complexity and the logarithm of the partition number, improving upon the
previous best power 1.5 separation due to G\""o\""os, Jayram, Pitassi, and
Watson.
  Our results are the communication analogues of separations in query
complexity proved using the recent cheat sheet framework of Aaronson,
Ben-David, and Kothari (STOC 2016). Our main technical results are randomized
communication and information complexity lower bounds for a family of
functions, called lookup functions, that generalize and port the cheat sheet
framework to communication complexity.
","[{""version"":""v1"",""created"":""Wed, 4 May 2016 04:42:08 GMT""},{""version"":""v2"",""created"":""Mon, 15 Aug 2016 18:19:41 GMT""}]","2017-09-25"
"1605.01143","Gianluca Caterina","Vittorio Cafagna, Gianluca Caterina","Spectra of fuzzy sets of $S^1$",,,,,"math.CA math.LO","http://arxiv.org/licenses/nonexclusive-distrib/1.0/","  In this article we explore some aspects of Fourier analysis on fuzzy sets.
This work was part of a broader project jointly with Professor Vittorio Cafagna
which spanned over a few years between 1998 and 2005. Professor Cafagna passed
away unexpectedly in 2007. His intellectual breadth and inspiring passion for
mathematics is still very well alive today.
","[{""version"":""v1"",""created"":""Wed, 4 May 2016 04:45:57 GMT""}]","2016-05-05"
"1605.01144","Mohammad Ghomi","Mohammad Ghomi","The length, width, and inradius of space curves","23 pages, 11 figures; minor edits, accepted for publication in
  Geometriae Dedicata",,,,"math.DG math.GT math.MG","http://arxiv.org/licenses/nonexclusive-distrib/1.0/","  The width $w$ of a curve $\gamma$ in Euclidean space $R^n$ is the infimum of
the distances between all pairs of parallel hyperplanes which bound $\gamma$,
while its inradius $r$ is the supremum of the radii of all spheres which are
contained in the convex hull of $\gamma$ and are disjoint from $\gamma$. We use
a mixture of topological and integral geometric techniques, including an
application of Borsuk Ulam theorem due to Wienholtz and Crofton's formulas, to
obtain lower bounds on the length of $\gamma$ subject to constraints on $r$ and
$w$. The special case of closed curves is also considered in each category. Our
estimates confirm some conjectures of Zalgaller up to $99\%$ of their stated
value, while we also disprove one of them.
","[{""version"":""v1"",""created"":""Wed, 4 May 2016 04:49:26 GMT""},{""version"":""v2"",""created"":""Tue, 4 Apr 2017 03:34:40 GMT""},{""version"":""v3"",""created"":""Tue, 16 Jan 2018 19:10:17 GMT""}]","2018-01-18"
"1605.01145","Ryojun Ito","Ryojun Ito","The Beilinson Conjectures for CM Elliptic Curves via Hypergeometric
  Functions","14 pages",,,,"math.NT","http://arxiv.org/licenses/nonexclusive-distrib/1.0/","  We consider certain CM elliptic curves which are related to Fermat curves,
and express the values of $L$-functions at $s=2$ in terms of special values of
generalized hypergeometric functions. We compare them and a similar result of
Rogers-Zudilin with Otsubo's regulator formulas, and give a new proof of the
Beilinson conjectures originally due to Bloch.
","[{""version"":""v1"",""created"":""Wed, 4 May 2016 04:59:38 GMT""},{""version"":""v2"",""created"":""Wed, 29 Jun 2016 12:57:29 GMT""}]","2016-06-30"
"1605.01146","Minkyoung Kang","Minkyoung Kang, Brani Vidakovic","A note on Bayesian wavelet-based estimation of scaling",,,,,"stat.ME","http://arxiv.org/licenses/nonexclusive-distrib/1.0/","  A number of phenomena in various fields such as geology, atmospheric
sciences, economics, to list a few, can be modeled as a fractional Brownian
motion indexed by Hurst exponent $H$. This exponent is related to the degree of
regularity and self-similarity present in the signal, and it often captures
important characteristics useful in various applications. Given its importance,
a number of methods have been developed for the estimation of the Hurst
exponent. Typically, the proposed methods do not utilize prior information
about scaling of a signal. Some signals are known to possess a theoretical
value of the Hurst exponent, which motivates us to propose a Bayesian approach
that incorporates this information via a suitable elicited prior distribution
on $H$.
  This significantly improves the accuracy of the estimation, as we demonstrate
by simulations. Moreover, the proposed method is robust to small
misspecifications of the prior location. The proposed method is applied to a
turbulence time series for which Hurst exponent is theoretically known by
Kolmogorov's K41 theory.
","[{""version"":""v1"",""created"":""Wed, 4 May 2016 05:01:36 GMT""}]","2016-05-05"
"1605.01147","E. V. Sampathkumaran Professor","Venkatesh Chandragiri, Kartik K Iyer, E.V. Sampathkumaran","Insight into the magnetism of a distorted Kagome lattice, Dy3Ru4Al12,
  based on polycrystalline studies","14 pages, 9 figures in Intermetallics 2016",,,,"cond-mat.str-el","http://arxiv.org/licenses/nonexclusive-distrib/1.0/","  The layered compound with distorted Kagome nets, Dy3Ru4Al12, was previously
reported to undergo antiferromagnetic ordering below (TN=) 7 K, based on
investigations on single crystals. Here, we report the results of our
investigation of ac and dc magnetic susceptibility (\c{hi}), isothermal remnant
magnetization (MIRM), heat-capacity, magnetocaloric effect and
magnetoresistance measurements on polycrystals. The present results reveal that
there is an additional magnetic anomaly around 20 K, as though the N\'eel order
is preceded by the formation of ferromagnetic clusters. We attribute this
feature to geometric frustration of magnetism. In view of the existence of this
phase, the interpretation of the linear-term in the heat-capacity in terms of
spin-fluctuations from the Ru 4d band needs to be revisited. Additionally, in
the vicinity of TN, AC \c{hi} shows a prominent frequency dependence and, below
TN, MIRM exhibits a slow decay with time. This raises a question whether the
antiferromagnetic structure in this compound is characterized by
spin-glass-like dynamics. In contrast to what was reported earlier, there is a
change in the sign of the magnetoresistance (MR) at the metamagnetic
transition. A butter-fly-shaped (isothermal) MR loop (interestingly spanning
over all the four quadrants) is observed at 2 K with distinct evidence for the
magnetic phase co-existence phenomenon in zero field after travelling through
metamagnetic transition field. The results on polycrystals thus provide
additional information about the magnetism of this compound, revealing that the
magnetism of this compound is more complex than what is believed, due to
geometric frustration intrinsic to Kagome net.
","[{""version"":""v1"",""created"":""Wed, 4 May 2016 05:33:14 GMT""}]","2016-05-05"
"1605.01148","Viirj Kan","Viirj Kan, Emma Vargo, Noa Machover, Hiroshi Ishii, Serena Pan,
  Weixuan Chen, Yasuaki Kakehi","Organic Primitives: Synthesis and Design of pH-Reactive Materials using
  Molecular I/O for Sensing, Actuation, and Interaction","Updated paper",,"10.1145/3025453.3025952",,"cs.HC","http://arxiv.org/licenses/nonexclusive-distrib/1.0/","  In this paper we present Organic Primitives, an enabling toolbox that expands
upon the library of input-output devices in HCI and facilitates the design of
interactions with organic, fluid-based systems. We formulated color, odor and
shape changing material primitives which act as sensor-actuators that convert
pH signals into human-readable outputs. Food-grade organic molecules
anthocyanin, vanillin, and chitosan were employed as dopants to synthesize
materials which output a spectrum of colors, degrees of shape deformation, and
switch between odorous and non-odorous states. We evaluated the individual
output properties of our sensor-actuators to assess the rate, range, and
reversibility of the changes as a function of pH 2-10. We present a design
space with techniques for enhancing the functionality of the material
primitives, and offer passive and computational methods for controlling the
material interfaces. Finally, we explore applications enabled by Organic
Primitives under four contexts: environmental, cosmetic, edible, and
interspecies.
","[{""version"":""v1"",""created"":""Wed, 4 May 2016 05:33:44 GMT""},{""version"":""v2"",""created"":""Sat, 25 Feb 2017 02:23:43 GMT""}]","2017-02-28"
"1605.01149","Baishali Saikia","D.K. Choudhury and Baishali Saikia","Transverse Momentum Dependent Parton Distributions with self-similarity
  at small $x$ and models of proton structure function","28 pages, 10 figures",,,,"hep-ph","http://arxiv.org/licenses/nonexclusive-distrib/1.0/","  In this paper we make re-analysis of a self-similarity based model of the
proton structure function at small $x$ pursued in recent years. The additional
assumption is that it should be singularity free in the entire kinematic range
$0\leq \textit{x}\leq 1$. Our analysis indicates that the singularity free
version of the model is valid in a more restrictive range of $Q^{2}$. We then
analyse the defining Transverse Momentum Dependent Parton Distributions (TMD)
occurred in the models and show that the proper generalizations and initial
conditions on them not only remove the undesired singularity but also results
in a QCD compatible structure function with logarithmic growth in $Q^2$. The
phenomenological range of validity is then found to be much larger than the
earlier versions. We also extrapolate the models to large $x$ in a parameter
free way.
","[{""version"":""v1"",""created"":""Wed, 4 May 2016 05:42:24 GMT""}]","2016-05-05"
"1605.01150","Enrico Guarnera","Enrico Guarnera, Eric Vanden-Eijnden","Optimized Markov State Models for Metastable Systems","15 pages, 12 figures, accepted for publication in J. Chem. Phys",,"10.1063/1.4954769",,"cond-mat.stat-mech physics.data-an q-bio.BM","http://arxiv.org/licenses/nonexclusive-distrib/1.0/","  A method is proposed to identify target states that optimize a metastability
index amongst a set of trial states and use these target states as milestones
(or core sets) to build Markov State Models (MSMs). If the optimized
metastability index is small, this automatically guarantees the accuracy of the
MSM, in the sense that the transitions between the target milestones is indeed
approximately Markovian. The method is simple to implement and use, it does not
require that the dynamics on the trial milestones be Markovian, and it also
offers the possibility to partition the system's state-space by assigning every
trial milestone to the target milestones it is most likely to visit next and to
identify transition state regions. Here the method is tested on the Gly-Ala-Gly
peptide, where it shown to correctly identify the expected metastable states in
the dihedral angle space of the molecule without \textit{a~priori} information
about these states. It is also applied to analyze the folding landscape of the
Beta3s mini-protein, where it is shown to identify the folded basin as a
connecting hub between an helix-rich region, which is entropically stabilized,
and a beta-rich region, which is energetically stabilized and acts as a kinetic
trap.
","[{""version"":""v1"",""created"":""Wed, 4 May 2016 05:59:29 GMT""},{""version"":""v2"",""created"":""Mon, 20 Jun 2016 14:22:02 GMT""}]","2016-08-03"
"1605.01151","Felix Olu Bankole","Felix Olu Bankole (University of South Africa) and Lucas Mimbi
  (University of South Africa)","ICT and Health System Performance in Africa: A Multi-Method Approach","ISBN# 978-0-646-95337-3, Presented at the Australasian Conference on
  Information Systems 2015 (arXiv:1605.01032), Keywords: Information
  Communication Technology, Health Systems, Multi-method, Africa",,,"ACIS/2015/4","cs.CY","http://creativecommons.org/licenses/by-nc-sa/4.0/","  For the past two decades, the discussion regarding the effect of ICT on
health systems is becoming apparent. However, past studies have mainly focused
on ICT impact on specific social-economic phenomena. Little empirical research
on ICT and health systems exists. Many African countries have invested in ICT
and there is a need to examine if such investments have impacted on health
system of these countries. Using a multi-method approach, data for 27 African
countries were analysed. We employed Data Envelopment Analysis, Cluster
Analysis and Partial Least Squares to examine the impact. The findings indicate
that the 27 countries can be grouped into three clusters based on their
relative efficiency scores of ICT and health systems. More compelling, the
findings indicate that countries that performed efficiently in ICT inputs also
do so in their health systems. Further, findings indicate that ICT
significantly improves life expectancy at birth and reduces infant mortality
rate. African countries must significantly invest in ICT to improve their
health systems so as to achieve socio-economic development. The current study
has theoretical, methodological and policy implications.
","[{""version"":""v1"",""created"":""Wed, 4 May 2016 06:03:40 GMT""}]","2016-05-24"
"1605.01152","Anto Sulaksono","A. I. Qauli, M. Iqbal, A. Sulaksono, and H. S. Ramadhan","Hyperons in neutron stars within Eddington-inspired Born-Infeld theory
  of gravity","10 pages,11 figures, Phys. Rev. D (accepted)","Phys. Rev. D 93, 104056 (2016)","10.1103/PhysRevD.93.104056",,"astro-ph.SR gr-qc nucl-th","http://arxiv.org/licenses/nonexclusive-distrib/1.0/","  We investigate the mass-radius relation of neutron star (NS) with hyperons
inside its core by using the Eddington-inspired Born-Infeld (EiBI) theory of
gravity. The equation of state of the star is calculated by using the
relativistic mean field model under which the standard SU(6) prescription and
hyperons potential depths are used to determine the hyperon coupling constants.
We found that, for $4\times 10^{6}~\rm{m^2}~\lesssim~\kappa \lesssim~6\times
10^{6}~\rm{m^2}$, the corresponding NS mass and radius predicted by the EiBI
theory of gravity is compatible with observational constraints of maximum NS
mass and radius. The corresponding $\kappa$ value is also compatible with the
$\kappa$ range predicted by the astrophysical-cosmological constraints. We also
found that the parameter $\kappa$ could control the size and the compactness of
a neutron star.
","[{""version"":""v1"",""created"":""Wed, 4 May 2016 06:06:14 GMT""}]","2016-06-01"
"1605.01153","Chih-Hong Cheng","Chih-Hong Cheng, Yassine Hamza, Harald Ruess","Structural Synthesis for GXW Specifications","The long (including appendix) version being reviewed by CAV'16
  program committee. Compared to the submitted version, one author (out of her
  wish) is moved to the Acknowledgement. (v2) Corrected typos. (v3) Add an
  additional remark over environment assumption and easy corner cases",,,,"cs.LO cs.SE","http://arxiv.org/licenses/nonexclusive-distrib/1.0/","  We define the GXW fragment of linear temporal logic (LTL) as the basis for
synthesizing embedded control software for safety-critical applications. Since
GXW includes the use of a weak-until operator we are able to specify a number
of diverse programmable logic control (PLC) problems, which we have compiled
from industrial training sets. For GXW controller specifications, we develop a
novel approach for synthesizing a set of synchronously communicating
actor-based controllers. This synthesis algorithm proceeds by means of
recursing over the structure of GXW specifications, and generates a set of
dedicated and synchronously communicating sub-controllers according to the
formula structure. In a subsequent step, 2QBF constraint solving identifies and
tries to resolve potential conflicts between individual GXW specifications.
This structural approach to GXW synthesis supports traceability between
requirements and the generated control code as mandated by certification
regimes for safety-critical software. Synthesis for GXW specifications is in
PSPACE compared to 2EXPTIME-completeness of full-fledged LTL synthesis. Indeed
our experimental results suggest that GXW synthesis scales well to
industrial-sized control synthesis problems with 20 input and output ports and
beyond.
","[{""version"":""v1"",""created"":""Wed, 4 May 2016 06:18:13 GMT""},{""version"":""v2"",""created"":""Sat, 7 May 2016 23:48:24 GMT""},{""version"":""v3"",""created"":""Wed, 6 Jul 2016 10:15:17 GMT""}]","2016-07-07"
"1605.01154","Anto Sulaksono","A. I. Qauli, and A. Sulaksono","Quark Matter at High Density based on Extended
  Confined-isospin-density-dependent-mass Model","8 pages, 6 figures","Physical Review D. 93, 025022 (2016)","10.1103/PhysRevD.93.025022",,"nucl-th astro-ph.HE hep-ph","http://arxiv.org/licenses/nonexclusive-distrib/1.0/","  We investigate the effect of the inclusion of relativistic Coulomb terms in a
confined-isospin-density-dependent-mass (CIDDM) model of strange quark matter
(SQM). We found that if we include Coulomb term in scalar density form, SQM
equation of state (EOS) at high densities is stiffer but if we include Coulomb
term in vector density form is softer than that of standard CIDDM model. We
also investigate systematically the role of each term of the extended CIDDM
model. Compared with what was reported in Ref.~\cite {ref:isospin}, we found
the stiffness of SQM EOS is controlled by the interplay among the the
oscillator harmonic, isospin asymmetry and Coulomb contributions depending on
the parameter's range of these terms. We have found that the absolute stable
condition of SQM and the mass of 2 $M_\odot$ pulsars can constrain the
parameter of oscillator harmonic $\kappa_1$ $\approx 0.53$ in the case Coulomb
term excluded. If the Coulomb term is included, for the models with their
parameters are consistent with SQM absolute stability condition, the
$2.0~M_{\odot}$ constraint more prefer the maximum mass prediction of model
with scalar Coulomb term than that of model with vector Coulomb term. On
contrary, the high densities EOS predicted by model with vector Coulomb is more
compatible with recent pQCD result \cite{ref:pressure} than that predicted by
model with scalar Coulomb. Furthermore, we also observed the quark composition
in a very high density region depends quite sensitively on the kind of Coulomb
term used.
","[{""version"":""v1"",""created"":""Wed, 4 May 2016 06:29:50 GMT""}]","2016-05-11"
"1605.01155","Lincong Wang","Lincong Wang","The contributions of surface charge and geometry to protein-solvent
  interaction",,,,,"q-bio.BM","http://arxiv.org/licenses/nonexclusive-distrib/1.0/","  To better understand protein-solvent interaction we have analyzed a variety
of physical and geometrical properties of the solvent-excluded surfaces (SESs)
over a large set of soluble proteins with crystal structures. We discover that
all have net negative surface charges and permanent electric dipoles. Moreover
both SES area and surface charge as well as several physical and geometrical
properties defined by them change with protein size via well-fitted power laws.
The relevance to protein-solvent interaction of these physical and geometrical
properties is supported by strong correlations between them and known
hydrophobicity scales and by their large changes upon protein unfolding. The
universal existence of negative surface charge and dipole, the characteristic
surface geometry and power laws reveal fundamental but distinct roles of
surface charge and SES in protein-solvent interaction and make it possible to
describe solvation and hydrophobic effect using theories on anion solute in
protic solvent. In particular the great significance of surface charge for
protein-solvent interaction suggests that a change of perception may be needed
since from solvation perspective folding into a native state is to optimize
surface negative charge rather than to minimize the hydrophobic surface area.
","[{""version"":""v1"",""created"":""Wed, 4 May 2016 06:34:11 GMT""}]","2016-05-05"
"1605.01156","Yunjie Liu","Yunjie Liu, Evan Racah, Prabhat, Joaquin Correa, Amir Khosrowshahi,
  David Lavers, Kenneth Kunkel, Michael Wehner, William Collins","Application of Deep Convolutional Neural Networks for Detecting Extreme
  Weather in Climate Datasets",,,,,"cs.CV","http://arxiv.org/licenses/nonexclusive-distrib/1.0/","  Detecting extreme events in large datasets is a major challenge in climate
science research. Current algorithms for extreme event detection are build upon
human expertise in defining events based on subjective thresholds of relevant
physical variables. Often, multiple competing methods produce vastly different
results on the same dataset. Accurate characterization of extreme events in
climate simulations and observational data archives is critical for
understanding the trends and potential impacts of such events in a climate
change content. This study presents the first application of Deep Learning
techniques as alternative methodology for climate extreme events detection.
Deep neural networks are able to learn high-level representations of a broad
class of patterns from labeled data. In this work, we developed deep
Convolutional Neural Network (CNN) classification system and demonstrated the
usefulness of Deep Learning technique for tackling climate pattern detection
problems. Coupled with Bayesian based hyper-parameter optimization scheme, our
deep CNN system achieves 89\%-99\% of accuracy in detecting extreme events
(Tropical Cyclones, Atmospheric Rivers and Weather Fronts
","[{""version"":""v1"",""created"":""Wed, 4 May 2016 06:38:19 GMT""}]","2016-05-05"
