"1605.01060","Brian Metzger","Brian D. Metzger, Charles Zivancev","Pair Fireball Precursors of Neutron Star Mergers","5 pages, 2 figures",,"10.1093/mnras/stw1800",,"astro-ph.HE gr-qc","http://arxiv.org/licenses/nonexclusive-distrib/1.0/","  If at least one neutron star (NS) is magnetized in a binary NS merger, then
the orbital motion of the conducting companion during the final inspiral
induces a strong voltage and current along the magnetic field lines connecting
the NSs. If a modest fraction, eta, of the extracted electromagnetic power
extracted accelerates relativistic particles, the resulting gamma-ray emission
a compact volume will result in the formation of an electron-positron pair
fireball. Applying a steady-state pair wind model, we quantify the
detectability of the precursor fireball with gamma-ray satellites. For eta ~ 1
the gamma-ray detection horizon of D_max ~ 10(Bd/1e14 G)^{3/4} Mpc is much
closer than the Advanced LIGO/Virgo horizon of 200 Mpc, unless the NS surface
magnetic field strength is very large, Bd > 1e15 G. Given the quasi-isotropic
nature of the emission, mergers with weaker NS fields could contribute a nearby
population of short gamma-ray bursts. Power not dissipated close to the binary
is carried to infinity along the open field lines by a large scale Poynting
flux. Reconnection within this outflow, well outside of the pair photosphere,
provides a potential site for non-thermal emission, such as a coherent
millisecond radio burst.
","[{""version"":""v1"",""created"":""Tue, 3 May 2016 20:00:03 GMT""},{""version"":""v2"",""created"":""Fri, 24 Jun 2016 02:41:07 GMT""}]","2016-08-17"
"1605.01061","Steven Gubser","Steven S. Gubser, Johannes Knaute, Sarthak Parikh, Andreas Samberg,
  and Przemek Witaszczyk","$p$-adic AdS/CFT","53 pages, 6 figures. v2: Improved discussion of normalizations and
  chordal distance",,"10.1007/s00220-016-2813-6","PUPT-2503","hep-th","http://arxiv.org/licenses/nonexclusive-distrib/1.0/","  We construct a $p$-adic analog to AdS/CFT, where an unramified extension of
the $p$-adic numbers replaces Euclidean space as the boundary and a version of
the Bruhat-Tits tree replaces the bulk. Correlation functions are computed in
the simple case of a single massive scalar in the bulk, with results that are
strikingly similar to ordinary holographic correlation functions when expressed
in terms of local zeta functions. We give some brief discussion of the geometry
of $p$-adic chordal distance and of Wilson loops. Our presentation includes an
introduction to $p$-adic numbers.
","[{""version"":""v1"",""created"":""Tue, 3 May 2016 20:00:04 GMT""},{""version"":""v2"",""created"":""Mon, 9 May 2016 19:11:27 GMT""}]","2017-02-01"
"1605.01062","Armin Rahmani","Anirban Dutta, Armin Rahmani, Adolfo del Campo","Anti-Kibble-Zurek Behavior in Crossing the Quantum Critical Point of a
  Thermally Isolated System Driven by a Noisy Control Field","5 pages, 3 figures, 2 pages of supplemental material","Phys. Rev. Lett. 117, 080402 (2016)","10.1103/PhysRevLett.117.080402",,"quant-ph cond-mat.other","http://arxiv.org/licenses/nonexclusive-distrib/1.0/","  We show that a thermally isolated system driven across a quantum phase
transition by a noisy control field exhibits anti-Kibble-Zurek behavior,
whereby slower driving results in higher excitations. We characterize the
density of excitations as a function of the ramping rate and the noise
strength. The optimal driving time to minimize excitations is shown to scale as
a universal power law of the noise strength. Our findings reveal the
limitations of adiabatic protocols such as quantum annealing and demonstrate
the universality of the optimal ramping rate.
","[{""version"":""v1"",""created"":""Tue, 3 May 2016 20:00:06 GMT""},{""version"":""v2"",""created"":""Fri, 19 Aug 2016 20:40:05 GMT""}]","2016-08-23"
"1605.01063","Alice Chau","Alice Chau, Lucio Mayer and Fabio Governato","Constraining the nature of dark matter with the star formation history
  of the faintest Local Group dwarf galaxy satellites","13 pages, 9 figures, 5 tables, matches the version published in ApJ
  (discussion extended, 2 figures added to account for the caveats in the mass
  estimations, overall conclusions not changed)","The Astrophysical Journal, 845, 1, 2017","10.3847/1538-4357/aa7e74",,"astro-ph.GA","http://arxiv.org/licenses/nonexclusive-distrib/1.0/","  $\Lambda$-Warm Dark Matter (WDM) has been proposed as alternative scenario to
$\Lambda$ cold dark matter (CDM), motivated by discrepancies at the scale of
dwarf galaxies, with less small-scale power and realized by collisionless
particles with energies in the range $1-3$ keV. We present a new approach to
constrain the viability of such WDM models using star formation histories of
the dwarf spheroidal galaxies (dSphs) in the Local Group. We compare their high
time-resolution star formation histories (SFHs) obtained with HST-based color
magnitude diagrams with the range of possible collapse redshifts of their dark
matter halos expected in CDM and in different WDM scenarios. The collapse
redshift is inferred after determining a plausible infall mass of the subhalo.
This is based on the current mass of individual dwarf inferred from stellar
kinematics combined with results of cosmological simulations providing
information on the subhalo evolution. Since WDM subhalos close to the filtering
mass scale form significantly later than CDM, we show that they are in the
first place difficult to reconcile with a truncation of star formation
occurring as early as $z\geq 3$. The Ultra-Faint Dwarfs (UFDs) provide the most
stringent constraints. Using 6 UFDs with the best determination of the SFHs, we
show that we can exclude a 1 keV warm particle to a 2-$\sigma$ confidence
interval consistently with other methods reported in the literature. For some
objects the $2$ keV model is also excluded. We discuss the various caveats of
the method, most notably the low number of dwarfs with accurately determined
star formation histories and the uncertainties in the determination of the
infall mass of the subhalos. Our preliminary analysis serves as a pathfinder
for future investigations that will combine upcoming accurate SFHs for more
local dSphs with direct analysis of WDM cosmological simulations with baryons.
","[{""version"":""v1"",""created"":""Tue, 3 May 2016 20:00:08 GMT""},{""version"":""v2"",""created"":""Tue, 7 Aug 2018 16:59:36 GMT""}]","2018-08-08"
"1605.01064","Lidia del Rio","Lea Kraemer and Lidia del Rio","Currencies in resource theories","13 pages + appendix. Contains a one-page summary of the paper
  Resource theories of knowledge [arXiv:1511.08818]",,,,"quant-ph cond-mat.stat-mech math-ph math.MP","http://arxiv.org/licenses/nonexclusive-distrib/1.0/","  How may we quantify the value of physical resources, such as entangled
quantum states, heat baths or lasers? Existing resource theories give us
partial answers; however, these rely on idealizations, like perfectly
independent copies of states or exact knowledge of a quantum state. Here we
introduce the general tool of currencies to quantify realistic descriptions of
resources, applicable in experimental settings when we do not have perfect
control over a physical system, when only the neighbourhood of a state or some
of its properties are known, or when there is no obvious way to decompose a
global space into subsystems. Currencies are a special set of resources chosen
to quantify all others - like Bell pairs in LOCC or a lifted weight in
thermodynamics. We show that from very weak assumptions on the theory we can
already find useful currencies that give us necessary and sufficient conditions
for resource conversion, and we build up more results as we impose further
structure. This work is an application of Resource theories of knowledge
[arXiv:1511.08818], generalizing axiomatic approaches to thermodynamic entropy,
work and currencies made of local copies.
","[{""version"":""v1"",""created"":""Tue, 3 May 2016 20:00:08 GMT""}]","2016-05-05"
"1605.01065","Hung-Jin Huang","Hung-Jin Huang, Rachel Mandelbaum, Peter E. Freeman, Yen-Chi Chen,
  Eduardo Rozo, Eli Rykoff, Eric J. Baxter","Intrinsic alignments in redMaPPer clusters -- I. Central galaxy
  alignments and angular segregation of satellites","matches version accepted to MNRAS; minor changes in presentation
  compared to v1, no changes to results",,"10.1093/mnras/stw1982",,"astro-ph.GA astro-ph.CO","http://arxiv.org/licenses/nonexclusive-distrib/1.0/","  The shapes of cluster central galaxies are not randomly oriented, but rather
exhibit coherent alignments with the shapes of their parent clusters as well as
with the surrounding large-scale structures. In this work, we aim to identify
the galaxy and cluster quantities that most strongly predict the central galaxy
alignment phenomenon among a large parameter space with a sample of 8237
clusters and 94817 members within 0.1<z<0.35, based on the redMaPPer cluster
catalog constructed from the Sloan Digital Sky Survey. We first quantify the
alignment between the projected central galaxy shapes and the distribution of
member satellites, to understand what central galaxy and cluster properties
most strongly correlate with these alignments. Next, we investigate the angular
segregation of satellites with respect to their central galaxy major axis
directions, to identify the satellite properties that most strongly predict
their angular segregation. We find that central galaxies are more aligned with
their member galaxy distributions in clusters that are more elongated and have
higher richness, and for central galaxies with larger physical size, higher
luminosity and centering probability, and redder color. Satellites with redder
color, higher luminosity, located closer to the central galaxy, and with
smaller ellipticity show a stronger angular segregation toward their central
galaxy major axes. Finally, we provide physical explanations for some of the
identified correlations, and discuss the connection to theories of central
galaxy alignments, the impact of primordial alignments with tidal fields, and
the importance of anisotropic accretion.
","[{""version"":""v1"",""created"":""Tue, 3 May 2016 20:00:17 GMT""},{""version"":""v2"",""created"":""Fri, 5 Aug 2016 02:07:28 GMT""}]","2016-08-17"
"1605.01066","Daniel D.B. Koll","Daniel D.B. Koll and Dorian S. Abbot","Temperature Structure and Atmospheric Circulation of Dry, Tidally Locked
  Rocky Exoplanets","Accepted in ApJ","Astrophysical Journal 825 (2016)","10.3847/0004-637X/825/2/99",,"astro-ph.EP","http://arxiv.org/licenses/nonexclusive-distrib/1.0/","  Next-generation space telescopes will observe the atmospheres of rocky
planets orbiting nearby M-dwarfs. Understanding these observations will require
well-developed theory in addition to numerical simulations. Here we present
theoretical models for the temperature structure and atmospheric circulation of
dry, tidally locked rocky exoplanets with grey radiative transfer and test them
using a general circulation model (GCM). First, we develop a
radiative-convective model that captures surface temperatures of slowly
rotating and cool atmospheres. Second, we show that the atmospheric circulation
acts as a global heat engine, which places strong constraints on large-scale
wind speeds. Third, we develop a radiative-convective-subsiding model which
extends our radiative-convective model to hot and thin atmospheres. We find
that rocky planets develop large day-night temperature gradients at a ratio of
wave-to-radiative timescales up to two orders of magnitude smaller than the
value suggested by work on hot Jupiters. The small ratio is due to the heat
engine inefficiency and asymmetry between updrafts and subsidence in convecting
atmospheres. Fourth, we show using GCM simulations that rotation only has a
strong effect on temperature structure if the atmosphere is hot or thin. Our
models let us map out atmospheric scenarios for planets such as GJ 1132b and
show how thermal phase curves could constrain them. Measuring phase curves of
short-period planets will require similar amounts of time on the James Webb
Space Telescope as detecting molecules via transit spectroscopy, so future
observations should pursue both techniques.
","[{""version"":""v1"",""created"":""Tue, 3 May 2016 20:00:26 GMT""}]","2016-08-29"
"1605.01067","Davide Gerosa","Davide Gerosa, Michael Kesden","PRECESSION: Dynamics of spinning black-hole binaries with python","Code homepage: https://davidegerosa.com/precession - Source:
  https://github.com/dgerosa/precession - Documentation:
  http://dgerosa.github.io/precession - pypi:
  https://pypi.python.org/pypi/precession - Fixed typos in Eq. (36-37)","Phys. Rev. D 93, 124066 (2016)","10.1103/PhysRevD.93.124066",,"astro-ph.HE astro-ph.CO astro-ph.GA gr-qc","http://arxiv.org/licenses/nonexclusive-distrib/1.0/","  We present the numerical code PRECESSION: a new open-source python module to
study the dynamics of precessing black-hole binaries in the post-Newtonian
regime. The code provides a comprehensive toolbox to (i) study the evolution of
the black-hole spins along their precession cycles, (ii) perform
gravitational-wave driven binary inspirals using both orbit-averaged and
precession-averaged integrations, and (iii) predict the properties of the
merger remnant through fitting formulae obtained from numerical-relativity
simulations. PRECESSION is a ready-to-use tool to add the black-hole spin
dynamics to larger-scale numerical studies such as gravitational-wave parameter
estimation codes, population synthesis models to predict gravitational-wave
event rates, galaxy merger trees and cosmological simulations of structure
formation. PRECESSION provides fast and reliable integration methods to
propagate statistical samples of black-hole binaries from/to large separations
where they form to/from small separations where they become detectable, thus
linking gravitational-wave observations of spinning black-hole binaries to
their astrophysical formation history. The code is also a useful tool to
compute initial parameters for numerical-relativity simulations targeting
specific precessing systems. PRECESSION can be installed from the Python
Package Index and it is freely distributed under version control on Github,
where further documentation is provided.
","[{""version"":""v1"",""created"":""Tue, 3 May 2016 20:00:58 GMT""},{""version"":""v2"",""created"":""Tue, 28 Jun 2016 09:49:54 GMT""},{""version"":""v3"",""created"":""Fri, 15 Dec 2017 21:10:18 GMT""}]","2017-12-19"
"1605.01068","Sean Eberhard","Sean Eberhard, Kevin Ford and Dimitris Koukoulopoulos","Permutations contained in transitive subgroups","36 pages, 1 figure. Reformatted for Discrete Analysis but otherwise
  identical to the previous version","Discrete Anal. 2016, Paper No. 12, 34 pp","10.19086/da.849",,"math.GR math.CO","http://creativecommons.org/licenses/by/4.0/","  In the first paper in this series we estimated the probability that a random
permutation $\pi\in\mathcal{S}_n$ has a fixed set of a given size. In this
paper, we elaborate on the same method to estimate the probability that $\pi$
has $m$ disjoint fixed sets of prescribed sizes $k_1,\dots,k_m$, where
$k_1+\cdots+k_m=n$. We deduce an estimate for the proportion of permutations
contained in a transitive subgroup other than $\mathcal{S}_n$ or
$\mathcal{A}_n$. This theorem consists of two parts: an estimate for the
proportion of permutations contained in an imprimitive transitive subgroup, and
an estimate for the proportion of permutations contained in a primitive
subgroup other than $\mathcal{S}_n$ or $\mathcal{A}_n$.
","[{""version"":""v1"",""created"":""Tue, 3 May 2016 20:02:14 GMT""},{""version"":""v2"",""created"":""Wed, 27 Jul 2016 17:02:38 GMT""},{""version"":""v3"",""created"":""Sat, 11 Feb 2017 23:00:31 GMT""}]","2017-06-12"
"1605.01069","Mark Hoefer Dr.","M.A. Hoefer and B. Ilan","Onset of transverse instabilities of confined dark solitons","11 pages, 11 figures","Physical Review A 94, 013609 (2016)","10.1103/PhysRevA.94.013609",,"nlin.PS","http://arxiv.org/licenses/nonexclusive-distrib/1.0/","  We investigate propagating dark soliton solutions of the two-dimensional
defocusing nonlinear Schr\""odinger / Gross-Pitaevskii (NLS/GP) equation that
are transversely confined to propagate in an infinitely long channel. Families
of single, vortex, and multi-lobed solitons are computed using a
spectrally-accurate numerical scheme. The multi-lobed solitons are unstable to
small transverse perturbations. However, the single-lobed solitons are stable
if they are sufficiently confined along the transverse direction, which
explains their effective one-dimensional dynamics. The emergence of a
transverse modulational instability is characterized in terms of a spectral
bifurcation. The critical confinement width for this bifurcation is found to
coincide with the existence of a propagating vortex solution and the onset of a
""snaking"" instability in the dark soliton dynamics that, in turn, give rise to
vortex or multi-vortex excitations. These results shed light on the
superfluidic hydrodynamics of dispersive shock waves in Bose-Einstein
condensates and nonlinear optics.
","[{""version"":""v1"",""created"":""Tue, 3 May 2016 20:05:13 GMT""}]","2016-08-03"
"1605.01070","Netta Engelhardt","Netta Engelhardt and Gary T. Horowitz","Towards a Reconstruction of General Bulk Metrics","29 pages, 10 figures; v3: an incorrect side result is removed, main
  conclusions unaffected; refs added","Class.Quant.Grav. 34 (2017) no.1, 015004","10.1088/1361-6382/34/1/015004",,"hep-th gr-qc","http://arxiv.org/licenses/nonexclusive-distrib/1.0/","  We prove that the metric of a general holographic spacetime can be
reconstructed (up to an overall conformal factor) from distinguished spatial
slices - ""light-cone cuts"" - of the conformal boundary. Our prescription is
covariant and applies to bulk points in causal contact with the boundary.
Furthermore, we describe a procedure for determining the light-cone cuts
corresponding to bulk points in the causal wedge of the boundary in terms of
the divergences of correlators in the dual field theory. Possible extensions
for determining the conformal factor and including the cuts of points outside
of the causal wedge are discussed. We also comment on implications for
subregion/subregion duality.
","[{""version"":""v1"",""created"":""Tue, 3 May 2016 20:05:20 GMT""},{""version"":""v2"",""created"":""Thu, 26 May 2016 21:42:36 GMT""},{""version"":""v3"",""created"":""Tue, 23 Aug 2016 23:18:03 GMT""}]","2017-07-26"
"1605.01071","Andronikos Paliathanasis","A. Paliathanasis, R.M. Morris and P.G.L. Leach","Lie symmetries of (1+2) nonautonomous evolution equations in Financial
  Mathematics","15 pages, 1 figure, to be published in Mathematics in the Special
  issue ""Mathematical Finance""",,,,"math.AP q-fin.EC","http://arxiv.org/licenses/nonexclusive-distrib/1.0/","  We analyse two classes of $(1+2)$ evolution equations which are of special
interest in Financial Mathematics, namely the Two-dimensional Black-Scholes
Equation and the equation for the Two-factor Commodities Problem. Our approach
is that of Lie Symmetry Analysis. We study these equations for the case in
which they are autonomous and for the case in which the parameters of the
equations are unspecified functions of time. For the autonomous Black-Scholes
Equation we find that the symmetry is maximal and so the equation is reducible
to the $(1+2)$ Classical Heat Equation. This is not the case for the
nonautonomous equation for which the number of symmetries is submaximal. In the
case of the two-factor equation the number of symmetries is submaximal in both
autonomous and nonautonomous cases. When the solution symmetries are used to
reduce each equation to a $(1+1)$ equation, the resulting equation is of
maximal symmetry and so equivalent to the $(1+1)$ Classical Heat Equation.
","[{""version"":""v1"",""created"":""Tue, 3 May 2016 20:06:34 GMT""}]","2016-05-05"
"1605.01072","Max Wolotsky","Max Wolotsky, Mohammad Husain, Elisha Choe","Chill-Pass: Using Neuro-Physiological Responses to Chill Music to Defeat
  Coercion Attacks","14 pages",,,,"cs.CR","http://arxiv.org/licenses/nonexclusive-distrib/1.0/","  Current alphanumeric and biometric authentication systems cannot withstand
situations where a user is coerced into releasing their authentication
materials under hostile circumstances. Existing approaches of coercion
resistant authentication systems (CRAS) propose authentication factors such as
implicit learning tasks, which are non-transferable, but still have the
drawback that an attacker can force the victim (causing stress) to perform the
task in order to gain unauthorized access. Alternatively, there could be cases
where the user could claim that they were coerced into giving up the
authentication materials, whereas in reality they acted as an insider attacker.
Therefore, being able to detect stress during authentication also helps to
achieve non-repudiation in such cases. To address these concerns, we need CRAS
that have both the non-transferable property as well as a mechanism to detect
stress related to coercion. In this paper, we study the feasibility of using
Chill (intensely pleasurable) music as a stimulus to elicit unique
neuro-physiological responses that can be used as an authenticating factor for
CRAS. Chill music and stress are both stimuli for a neuro-chemical called
Dopamine. However, they release the Dopamine at different parts of the brain,
resulting in different neuro-physiological responses, which gives us both the
non-transferable and stress-detection properties necessary for CRAS. We have
experimentally validated our proposed Chill music based CRAS using human
subjects and measuring their neuro-physiological responses on our prototype
system. Based on the 100 samples collected from the subjects, we were able to
successfully authenticate the subjects with an accuracy of over 90\%. Our work
not only demonstrates the potential of Chill music as a unique stimulus for
CRAS, but also paves the path of wider adoption of CRAS in general.
","[{""version"":""v1"",""created"":""Tue, 3 May 2016 20:09:27 GMT""}]","2016-05-05"
"1605.01073","Kimball A. Milton","Kimball A. Milton, Li Yang, Pushpa Kalauni, Prachi Parashar, Romain
  Gu\'erout, Gert-Ludwig Ingold, Astrid Lambrecht, and Serge Reynaud","Negative Entropies in Casimir and Casimir-Polder Interactions","8 pages, 12 figures, extended version of talk at Frontiers of Quantum
  and Mesoscopic Thermodynamics, Prague, 2015","Fortschr. Phys. 65, 1600047 (2017)","10.1002/prop.201600047",,"quant-ph hep-th","http://arxiv.org/licenses/nonexclusive-distrib/1.0/","  It has been increasingly becoming clear that Casimir and Casimir-Polder
entropies may be negative in certain regions of temperature and separation. In
fact, the occurrence of negative entropy seems to be a nearly ubiquitous
phenomenon. This is most highlighted in the quantum vacuum interaction of a
nanoparticle with a conducting plate or between two nanoparticles. It has been
argued that this phenomenon does not violate physical intuition, since the
total entropy, including the self-entropies of the plate and the nanoparticle,
should be positive. New calculations, in fact, seem to bear this out at least
in certain cases.
","[{""version"":""v1"",""created"":""Tue, 3 May 2016 20:10:21 GMT""}]","2017-06-19"
"1605.01074","Yurui Fang PhD","Li Hu, Yingzhou Huang and Yurui Fang","Quantitatively analyzing intrinsic plasmonic chirality by tracking the
  interplay of electric and magnetic dipole modes","5 pages main text (3 figures) and 11 pages supporting materials (13
  figures). arXiv admin note: text overlap with arXiv:1511.04702",,,,"cond-mat.mes-hall physics.optics","http://arxiv.org/licenses/nonexclusive-distrib/1.0/","  Plasmonic chirality exhibits great potential for novel nanooptical devices
due to the generation of a strong chiroptical response. Previous reports on
plasmonic chirality explanations are mainly based on phase retardation and
coupling. We propose a quantitative model similar to the chiral molecules for
explaining the mechanism of the intrinsic plasmonic chirality quantitatively
based on the interplay and mixing of electric and magnetic dipole modes, which
forms a mixed electric and magnetic polarizability. The analysis method is also
suitable for small chiral object down to quasi-static limit without phase delay
and expected to be a universal rule.
","[{""version"":""v1"",""created"":""Tue, 3 May 2016 20:10:26 GMT""}]","2016-05-05"
"1605.01075","Nima Lashkari","Nima Lashkari, Jennifer Lin, Hirosi Ooguri, Bogdan Stoica, Mark Van
  Raamsdonk","Gravitational Positive Energy Theorems from Information Inequalities",,,"10.1093/ptep/ptw139",,"hep-th","http://arxiv.org/licenses/nonexclusive-distrib/1.0/","  In this paper we argue that classical, asymptotically AdS spacetimes that
arise as states in consistent ultraviolet completions of Einstein gravity
coupled to matter must satisfy an infinite family of positive energy
conditions. To each ball-shaped spatial region $B$ of the boundary spacetime,
we can associate a bulk spatial region $\Sigma_B$ between $B$ and the bulk
extremal surface $\tilde{B}$ with the same boundary as $B$. We show that there
exists a natural notion of a gravitational energy for every such region that is
non-negative, and non-increasing as one makes the region smaller. The results
follow from identifying this gravitational energy with a quantum relative
entropy in the associated dual CFT state. The positivity and monotonicity
properties of the gravitational energy are implied by the positivity and
monotonicity of relative entropy, which holds universally in all quantum
systems.
","[{""version"":""v1"",""created"":""Tue, 3 May 2016 20:11:55 GMT""}]","2016-12-28"
