"1605.01573","Ricardo Silva","Ricardo Silva","Observational-Interventional Priors for Dose-Response Learning",,,,,"stat.ML","http://arxiv.org/licenses/nonexclusive-distrib/1.0/","  Controlled interventions provide the most direct source of information for
learning causal effects. In particular, a dose-response curve can be learned by
varying the treatment level and observing the corresponding outcomes. However,
interventions can be expensive and time-consuming. Observational data, where
the treatment is not controlled by a known mechanism, is sometimes available.
Under some strong assumptions, observational data allows for the estimation of
dose-response curves. Estimating such curves nonparametrically is hard: sample
sizes for controlled interventions may be small, while in the observational
case a large number of measured confounders may need to be marginalized. In
this paper, we introduce a hierarchical Gaussian process prior that constructs
a distribution over the dose-response curve by learning from observational
data, and reshapes the distribution with a nonparametric affine transform
learned from controlled interventions. This function composition from different
sources is shown to speed-up learning, which we demonstrate with a thorough
sensitivity analysis and an application to modeling the effect of therapy on
cognitive skills of premature infants.
","[{""version"":""v1"",""created"":""Thu, 5 May 2016 12:50:44 GMT""}]","2016-05-06"
"1605.01574","Anil Singh","S. R. Mohapatra, B. Sahu, T.Badapanda, M. S. Pattanaik, S. D. Kaushik,
  A. K. Singh","Structural, optical and complex impedance spectroscopy study of
  multiferroic Bi2Fe4O9 ceramic","25 Pages, 12 Figures in J Mater Sci: Mater Electron (2015)",,"10.1007/s10854-015-4203-9",,"cond-mat.mtrl-sci","http://arxiv.org/licenses/nonexclusive-distrib/1.0/","  Multiferroic bismuth ferrite Bi_2Fe_4O_9 (BFO) ceramic was synthesized by
conventional solid state reaction route. X-ray diffraction and Rietveld
refinement show formation of single phase ceramic with orthorhombic crystal
structure (space group Pbam). The morphological study depicted a well-defined
grain of size $\simeq$2{\mu}m. The optical studies were carried out by using
UV-Vis spectrophotometer which shows a band gap of 1.53 eV and a green emission
spectrum at 537 is observed in the Photoluminescence study. The frequency
dependent dielectric study at various temperature revealed that the dielectric
constant decreases with increase in frequency. A noticeable peak shift towards
higher frequency with increasing temperature is observed in the frequency
dependent dielectric loss plot. The impedance spectroscopy shows a substantial
shift in imaginary impedance (Z"") peaks toward the high frequency side
described that the conduction in material favoring the long range motion of
mobile charge carriers. The presence of non-Debye type multiple relaxations has
been confirmed by complex modulus analysis. The frequency dependent ac
conductivity at different temperatures indicates that the conduction process is
thermally activated. The variation of dc conductivity exhibited a negative
temperature coefficient of resistance behavior. The activation energy
calculated from impedance, modulus and conductivity data confirmed that the
oxygen vacancies play a vital role in the conduction mechanism.
","[{""version"":""v1"",""created"":""Thu, 5 May 2016 13:02:56 GMT""}]","2016-05-06"
"1605.01575","Esmail Arasteh Rad","Esmail Arasteh Rad and Urs Hartl","Langlands-Rapoport Conjecture Over Function Fields","22 pages. arXiv admin note: text overlap with arXiv:1302.6143",,,,"math.NT","http://arxiv.org/licenses/nonexclusive-distrib/1.0/","  In this article we prove the analogue of the Langlands-Rapoport conjecture
for the moduli stacks of global $G$-shtukas. Here $G$ is a parahoric
Bruhat-Tits group scheme over a smooth projective curve $C$ over a finite field
$\mathbb{F}_q$.
","[{""version"":""v1"",""created"":""Thu, 5 May 2016 13:03:07 GMT""}]","2016-05-06"
"1605.01576","Tao Zhou","Tao Zhou, Brian Johnson, Rui Li","Patch-based Texture Synthesis for Image Inpainting","in Computer Science and Applications, 2016",,,,"cs.CV","http://arxiv.org/licenses/nonexclusive-distrib/1.0/","  Image inpaiting is an important task in image processing and vision. In this
paper, we develop a general method for patch-based image inpainting by
synthesizing new textures from existing one. A novel framework is introduced to
find several optimal candidate patches and generate a new texture patch in the
process. We form it as an optimization problem that identifies the potential
patches for synthesis from an coarse-to-fine manner. We use the texture
descriptor as a clue in searching for matching patches from the known region.
To ensure the structure faithful to the original image, a geometric constraint
metric is formally defined that is applied directly to the patch synthesis
procedure. We extensively conducted our experiments on a wide range of testing
images on various scenarios and contents by arbitrarily specifying the target
the regions for inference followed by using existing evaluation metrics to
verify its texture coherency and structural consistency. Our results
demonstrate the high accuracy and desirable output that can be potentially used
for numerous applications: object removal, background subtraction, and image
retrieval.
","[{""version"":""v1"",""created"":""Thu, 5 May 2016 13:04:09 GMT""}]","2016-05-06"
"1605.01577","Anton Khruslov","A.V. Khruslov, A.V. Kusakin, I.V. Reva","USNO-B1.0 1171-0309158: An RR Lyrae Star that Switched from a Double- to
  Single-mode Pulsation","9 pages, 6 figures, 2 tables",,"10.32023/0001-5237/67.4.2",,"astro-ph.SR","http://arxiv.org/licenses/nonexclusive-distrib/1.0/","  We report the discovery of a new case of an RR Lyrae star that experienced a
switching of its pulsation mode. We detected USNO-B1.0 1171-0309158 as a
double-mode RR Lyrae star from observations of the Catalina surveys (CSS) that
showed additional scattering on the light curve. Our analysis of the
time-series of CSS data showed gradual increase in scattering and in the
amplitude of fundamental pulsation mode. Our CCD observations carried out in
2015 reveal that this object is now a fundamental-mode RRab star, with no sign
of the first-overtone pulsation.
","[{""version"":""v1"",""created"":""Thu, 5 May 2016 13:06:13 GMT""}]","2018-10-24"
"1605.01578","Merc\`e Mora","Jaume Mart\'i-Farr\'e, Merc\`e Mora, Jos\'e Luis Ruiz","Uniform hypergraphs and dominating sets of graphs","24 pages, 3 figures",,,,"math.CO","http://arxiv.org/licenses/nonexclusive-distrib/1.0/","  A (simple) hypergraph is a family H of pairwise incomparable sets of a finite
set. We say that a hypergraph H is a domination hypergraph if there is at least
a graph G such that the collection of minimal dominating sets of G is equal to
H. Given a hypergraph, we are interested in determining if it is a domination
hypergraph and, if this is not the case, we want to find domination hypergraphs
in some sense close to it, the domination completions. Here we will focus on
the family of hypergraphs containing all the subsets with the same cardinality,
the uniform hypergraphs of maximum size. Specifically, we characterize those
hypergraphs H in this family that are domination hypergraphs and, in any other
case, we prove that the hypergraph H is uniquely determined by some of its
domination completions and that H can be recovered from them by using a
suitable hypergraph operation.
","[{""version"":""v1"",""created"":""Thu, 5 May 2016 13:10:39 GMT""}]","2016-05-06"
"1605.01579","Susanne Mertens Dr.","Susanne Mertens","Direct Neutrino Mass Experiments","Talk presented at NuPhys2015 (London, 16-18 December 2015). 9 pages,
  LaTeX, 9 png figures",,"10.1088/1742-6596/718/2/022013","NuPhys2015-Mertens","nucl-ex physics.ins-det","http://arxiv.org/licenses/nonexclusive-distrib/1.0/","  With a mass at least six orders of magnitudes smaller than the mass of an
electron -- but non-zero -- neutrinos are a clear misfit in the Standard Model
of Particle Physics. On the one hand, its tiny mass makes the neutrino one of
the most interesting particles, one that might hold the key to physics beyond
the Standard Model. On the other hand this minute mass leads to great
challenges in its experimental determination. Three approaches are currently
pursued: An indirect neutrino mass determination via cosmological observables,
the search for neutrinoless double $\beta$-decay, and a direct measurement
based on the kinematics of single $\beta$-decay. In this paper the latter will
be discussed in detail and the status and scientific reach of the current and
near-future experiments will be presented.
","[{""version"":""v1"",""created"":""Thu, 5 May 2016 13:10:48 GMT""}]","2016-06-22"
"1605.01580","Nazia Hameed Miss","Nazia Hameed, Maqbool ud din shaikh, Fozia Hameed","Effect of Cultural Factors on Students of Pakistan","International Journal of Education and Information Technologies
  (Issue 4, Volume 6, 2012). Pages: 310-318 Issue 4, Volume 6, 2012",,,,"cs.CY","http://arxiv.org/licenses/nonexclusive-distrib/1.0/","  Pakistan as culturally diverse country possesses wide range of cultural
factors. These cultural factors affect the living style, traditions, values and
norms as well as the education. As e-learning is global mode of education so
learners from different backgrounds enrolled in learning management system.
Diversity of culture and learning styles should keep under considerations while
designing e-learning environment. In this research work e learning cultural
factors highlighted by Bentley ET. AL are incorporated to find the learner
level. After assignment of level, learner respective Learning Management System
is allocated to learner. The focus is to concentrate on cultural factor in
e-learning system. Furthermore; a prototype of the proposed system is
implemented for the validation of proposed architecture.
","[{""version"":""v1"",""created"":""Thu, 5 May 2016 13:17:29 GMT""}]","2016-05-06"
"1605.01581","Roberto Longo","Stefan Hollands and Roberto Longo","Non-Equilibrium Thermodynamics and Conformal Field Theory","19 pages, 3 figures",,"10.1007/s00220-017-2938-2",,"hep-th cond-mat.stat-mech math-ph math.MP math.OA","http://arxiv.org/licenses/nonexclusive-distrib/1.0/","  We present a model independent, operator algebraic approach to
non-equilibrium quantum thermodynamics within the framework of two-dimensional
Conformal Field Theory. Two infinite reservoirs in equilibrium at their own
temperatures and chemical potentials are put in contact through a defect line,
possibly by inserting a probe. As time evolves, the composite system then
approaches a non-equilibrium steady state that we describe. In particular, we
re-obtain recent formulas of Bernard and Doyon.
","[{""version"":""v1"",""created"":""Thu, 5 May 2016 13:23:44 GMT""},{""version"":""v2"",""created"":""Wed, 7 Sep 2016 09:57:58 GMT""}]","2017-09-13"
"1605.01582","Alexander Popov","Alexander D. Popov","Superstring theories as low-energy limit of supergroup gauge theories","13 pages, v2: a paragraph and 4 refs. added",,,,"hep-th math-ph math.DG math.MP","http://arxiv.org/licenses/nonexclusive-distrib/1.0/","  We consider Yang-Mills theory with $N=2$ super translation group in $d=10$
auxiliary dimensions as the structure group. The gauge theory is defined on a
direct product manifold $\Sigma_2\times H^2$, where $\Sigma_2$ is a
two-dimensional Lorentzian manifold and $H^2$ is the open disc in
$\mathbb{R}^2$ with the boundary $S^1=\partial H^2$. We show that in the
adiabatic limit, when the metric on $H^2$ is scaled down, the Yang-Mills action
supplemented by the $d=5$ Chern-Simons term becomes the Green-Schwarz
superstring action. More concretely, the Yang-Mills action in the infrared
limit flows to the kinetic part of the superstring action and the $d=5$
Chern-Simons action, defined on a 5-manifold with the boundary $\Sigma_2\times
H^2$, flows to the Wess-Zumino part of the superstring action. The same kind of
duality between gauge fields and strings is established for type IIB
superstring on AdS$_5\times S^5$ background and a supergroup gauge theory with
PSU(2,2$|$4) as the structure group.
","[{""version"":""v1"",""created"":""Thu, 5 May 2016 13:26:47 GMT""},{""version"":""v2"",""created"":""Tue, 13 Sep 2016 15:17:46 GMT""}]","2016-09-14"
"1605.01583","Daljit Singh Dhillon","Daljit Singh J. Dhillon, Michel C. Milinkovitch, Matthias Zwicker","Bifurcation Analysis of Reaction Diffusion Systems on Arbitrary Surfaces","This paper was submitted at the Journal of Mathematical Biology,
  Springer on 07th July 2015, in its current form (barring image references on
  the last page and cosmetic changes owning to rebuild for arXiv). The complete
  body of work presented here was included and defended as a part of my PhD
  thesis in Nov 2015 at the University of Bern",,,,"cs.CE","http://arxiv.org/licenses/nonexclusive-distrib/1.0/","  In this paper we present computational techniques to investigate the
solutions of two-component, nonlinear reaction-diffusion (RD) systems on
arbitrary surfaces. We build on standard techniques for linear and nonlinear
analysis of RD systems, and extend them to operate on large-scale meshes for
arbitrary surfaces. In particular, we use spectral techniques for a linear
stability analysis to characterize and directly compose patterns emerging from
homogeneities. We develop an implementation using surface finite element
methods and a numerical eigenanalysis of the Laplace-Beltrami operator on
surface meshes. In addition, we describe a technique to explore solutions of
the nonlinear RD equations using numerical continuation. Here, we present a
multiresolution approach that allows us to trace solution branches of the
nonlinear equations efficiently even for large-scale meshes. Finally, we
demonstrate the working of our framework for two RD systems with applications
in biological pattern formation: a Brusselator model that has been used to
model pattern development on growing plant tips, and a chemotactic model for
the formation of skin pigmentation patterns. While these models have been used
previously on simple geometries, our framework allows us to study the impact of
arbitrary geometries on emerging patterns.
","[{""version"":""v1"",""created"":""Thu, 5 May 2016 13:29:36 GMT""}]","2016-05-06"
"1605.01584","Yongchao Liu","Yongchao Liu, Tony Pan, Srinivas Aluru","Parallel Pairwise Correlation Computation On Intel Xeon Phi Clusters","9 pages, 2 figures, 2 tables, accepted by the SBAC-PAD 2016
  conference",,,,"cs.DC q-bio.GN","http://arxiv.org/licenses/nonexclusive-distrib/1.0/","  Co-expression network is a critical technique for the identification of
inter-gene interactions, which usually relies on all-pairs correlation (or
similar measure) computation between gene expression profiles across multiple
samples. Pearson's correlation coefficient (PCC) is one widely used technique
for gene co-expression network construction. However, all-pairs PCC computation
is computationally demanding for large numbers of gene expression profiles,
thus motivating our acceleration of its execution using high-performance
computing. In this paper, we present LightPCC, the first parallel and
distributed all-pairs PCC computation on Intel Xeon Phi (Phi) clusters. It
achieves high speed by exploring the SIMD-instruction-level and thread-level
parallelism within Phis as well as accelerator-level parallelism among multiple
Phis. To facilitate balanced workload distribution, we have proposed a general
framework for symmetric all-pairs computation by building bijective functions
between job identifier and coordinate space for the first time. We have
evaluated LightPCC and compared it to two CPU-based counterparts: a sequential
C++ implementation in ALGLIB and an implementation based on a parallel general
matrix-matrix multiplication routine in Intel Math Kernel Library (MKL) (all
use double precision), using a set of gene expression datasets. Performance
evaluation revealed that with one 5110P Phi and 16 Phis, LightPCC runs up to
$20.6\times$ and $218.2\times$ faster than ALGLIB, and up to $6.8\times$ and
$71.4\times$ faster than single-threaded MKL, respectively. In addition,
LightPCC demonstrated good parallel scalability in terms of number of Phis.
Source code of LightPCC is publicly available at
http://lightpcc.sourceforge.net.
","[{""version"":""v1"",""created"":""Thu, 5 May 2016 13:30:28 GMT""},{""version"":""v2"",""created"":""Fri, 10 Jun 2016 13:35:27 GMT""},{""version"":""v3"",""created"":""Tue, 27 Sep 2016 00:15:44 GMT""}]","2016-09-28"
"1605.01585","Mariagrazia Bianchi","Mariagrazia Bianchi, Marcel Herzog","Finite groups with non-trivial intersections of kernels of all but one
  irreducible characters",,,,,"math.GR","http://arxiv.org/licenses/nonexclusive-distrib/1.0/","  In this paper we consider finite groups G satisfying the following condition:
G has two columns in its character table which differ by exactly one entry. It
turns out that such groups exist and they are exactly the finite groups with a
non-trivial intersection of the kernels of all but one irreducible characters
or, equivalently, finite groups with an irreducible character vanishing on all
but two conjugacy classes. We investigate such groups and in particular we
characterize their subclass, which properly contains all finite groups with
non-linear characters of distinct degrees, which were characterized by
Berkovich, Chillag and Herzog in 1992.
","[{""version"":""v1"",""created"":""Thu, 5 May 2016 13:33:51 GMT""}]","2016-05-06"
"1605.01586","Erik Palmgren","Erik Palmgren","Categories with families and first-order logic with dependent sorts","83 pages","Annals of Pure and Applied Logic Volume 170, Issue 12, December
  2019","10.1016/j.apal.2019.102715",,"math.LO math.CT","http://arxiv.org/licenses/nonexclusive-distrib/1.0/","  First-order logic with dependent sorts, such as Makkai's first-order logic
with dependent sorts (FOLDS), or Aczel's and Belo's dependently typed
(intuitionistic) first-order logic (DFOL), may be regarded as logic enriched
dependent type theories. Categories with families (cwfs) is an established
semantical structure for dependent type theories, such as Martin-L\""of type
theory. We introduce in this article a notion of hyperdoctrine over a cwf, and
show how FOLDS and DFOL fit in this semantical framework. A soundness and
completeness theorem is proved for DFOL. The semantics is functorial in the
sense of Lawvere, and uses a dependent version of the Lindenbaum-Tarski algebra
for a DFOL theory. Agreement with standard first-order semantics is
established. Applications of DFOL to constructive mathematics and categorical
foundations are given. A key feature is a local propositions-as-types
principle.
","[{""version"":""v1"",""created"":""Thu, 5 May 2016 13:34:00 GMT""},{""version"":""v2"",""created"":""Sun, 7 Jul 2019 23:58:17 GMT""}]","2019-10-10"
"1605.01587","Hang Liu","Hang Liu and Xin-he Meng","Angular Momentum-Free of the Entropy Relations for Rotating Kaluza-Klein
  Black Holes","Final version, accepted for publication by International Journal of
  Theoretical Physics","Int.J.Theor.Phys. 56 (2017) no.2, 437-449","10.1007/s10773-016-3185-6",,"gr-qc hep-th math-ph math.MP","http://arxiv.org/licenses/nonexclusive-distrib/1.0/","  Based on a mathematical lemma related to the Vandermonde determinant and two
theorems derived from the first law of black hole thermodynamics, we
investigate the angular momentum independence of the entropy sum as well as the
entropy product of general rotating Kaluza-Klein black holes in higher
dimensions. We show that for both non-charged rotating Kaluza-Klein black holes
and non-charged rotating Kaluza-Klein-AdS black holes, the angular momentum of
the black holes will not be present in entropy sum relation in dimensions
$d\geq4$, while the independence of angular momentum of the entropy product
holds provided that the black holes possess at least one zero rotation
parameter $a_j$ = 0 in higher dimensions $d\geq5$, which means that the
cosmological constant does not affect the angular momentum-free property of
entropy sum and entropy product under the circumstances that charge $\delta=0$.
For the reason that the entropy relations of charged rotating Kaluza-Klein
black holes as well as the non-charged rotating Kaluza-Klein black holes in
asymptotically flat spacetime act the same way, it is found that the charge has
no effect in the angular momentum-independence of entropy sum and product in
asymptotically flat spactime.
","[{""version"":""v1"",""created"":""Thu, 5 May 2016 13:40:56 GMT""},{""version"":""v2"",""created"":""Fri, 3 Jun 2016 09:54:42 GMT""},{""version"":""v3"",""created"":""Mon, 7 Nov 2016 11:19:46 GMT""}]","2017-08-28"
"1605.01588","Esmail Arasteh Rad","Esmail Arasteh Rad and Somayeh Habibi","Local Models For The Moduli Stacks of Global $G$-Shtukas","25 pages",,,,"math.NT","http://arxiv.org/licenses/nonexclusive-distrib/1.0/","  In this article we develop the theory of local models for the moduli stacks
of global $G$-shtukas, the function field analogs for Shimura varieties. Here
$G$ is a smooth affine group scheme over a smooth projective curve. As the
first approach, we relate the local geometry of these moduli stacks to the
geometry of Schubert varieties inside global affine Grassmannian, only by means
of global methods. Alternatively, our second approach uses the relation between
the deformation theory of global $G$-shtukas and associated local $P$-shtukas
at certain characteristic places. Regarding the analogy between function fields
and number fields, the first (resp. second) approach corresponds to the
Beilinson-Drinfeld-Gaitsgory (resp. Rapoport-Zink) local model for
(PEL-)Shimura varieties. As an application, we prove the flatness of these
moduli stacks over their reflex rings, for tamely ramified group $G$.
Furthermore, we introduce the Kottwitz-Rapoport stratification on these moduli
stacks and discuss the intersection cohomology of the special fiber.
","[{""version"":""v1"",""created"":""Thu, 5 May 2016 13:42:05 GMT""},{""version"":""v2"",""created"":""Thu, 15 Dec 2016 23:43:52 GMT""},{""version"":""v3"",""created"":""Thu, 2 Mar 2017 13:41:07 GMT""}]","2017-03-03"
"1605.01589","Dmitry Ostrovsky Dr","Dmitry Ostrovsky","On Barnes Beta Distributions and Applications to the Maximum
  Distribution of the 2D Gaussian Free Field","27 pages. To appear in J. Stat. Phys","J Stat Phys 164 (2016) 1292-1317","10.1007/s10955-016-1591-z",,"math.PR","http://arxiv.org/licenses/nonexclusive-distrib/1.0/","  A new family of Barnes beta distributions on $(0, \infty)$ is introduced and
its infinite divisibility, moment determinacy, scaling, and factorization
properties are established. The Morris integral probability distribution is
constructed from Barnes beta distributions of types $(1,0)$ and $(2,2),$ and
its moment determinacy and involution invariance properties are established.
For application, the maximum distributions of the 2D gaussian free field on the
unit interval and circle with a non-random logarithmic potential are
conjecturally related to the critical Selberg and Morris integral probability
distributions, respectively, and expressed in terms of sums of Barnes beta
distributions of types $(1,0)$ and $(2,2).$
","[{""version"":""v1"",""created"":""Thu, 5 May 2016 13:43:03 GMT""},{""version"":""v2"",""created"":""Fri, 22 Jul 2016 01:18:29 GMT""}]","2016-09-05"
"1605.01590","Andrij Kuzmak","A. R. Kuzmak","Quantum state geometry and entanglement of two spins with anisotropic
  interaction in evolution","16 pages, 2 figures","J. Geom. Phys. 116, 81 (2017)","10.1016/j.geomphys.2017.01.021",,"quant-ph math-ph math.MP","http://arxiv.org/licenses/nonexclusive-distrib/1.0/","  Quantum evolution of a two-spin system with anisotropic Heisenberg
Hamiltonian in the magnetic field is considered. We show that this evolution
happens on some manifold with geometry depending on the ratio between the
interaction couplings and on the initial state. The Fubini-Study metric of this
manifold is calculated. The entanglement of the states belonging to this
manifold is examined. Also we investigate similar problem for a two-spin system
described by the Dzyaloshinsky-Moria Hamiltonian. The problem is solved using
the fact that this Hamiltonian and the anisotropic Heisenberg Hamiltonian are
linked by the unitary transformation.
","[{""version"":""v1"",""created"":""Thu, 5 May 2016 13:43:22 GMT""},{""version"":""v2"",""created"":""Sat, 18 Feb 2017 19:25:24 GMT""}]","2017-03-08"
"1605.01591","Bettina Eick","Bettina Eick and Ann-Kristin Engel","Hall polynomials for the torsion free groups of Hirsch length at most 5",,,,,"math.GR","http://arxiv.org/licenses/nonexclusive-distrib/1.0/","  A theorem by Hall asserts that the multiplication in torsion free nilpotent
groups of finite Hirsch length can be facilitated by polynomials. In this note
we exhibit explicit Hall polynomials for the torsion free nilpotent groups of
Hirsch length at most 5.
","[{""version"":""v1"",""created"":""Thu, 5 May 2016 13:43:43 GMT""},{""version"":""v2"",""created"":""Thu, 1 Sep 2016 12:54:13 GMT""}]","2016-09-02"
