"1605.01416","Timothy Cohen","Timothy Cohen, Matthew J. Dolan, Sonia El Hedri, James Hirschauer,
  Nhan Tran, and Andrew Whitbeck","Dissecting Jets and Missing Energy Searches Using $n$-body Extended
  Simplified Models","31 + 28 pages, 11 + 10 figures; v2 references added, journal version",,"10.1007/JHEP08(2016)038","FERMILAB-PUB-16-122-E, NSF-KITP-16-063","hep-ph hep-ex","http://arxiv.org/licenses/nonexclusive-distrib/1.0/","  Simplified Models are a useful way to characterize new physics scenarios for
the LHC. Particle decays are often represented using non-renormalizable
operators that involve the minimal number of fields required by symmetries.
Generalizing to a wider class of decay operators allows one to model a variety
of final states. This approach, which we dub the $n$-body extension of
Simplified Models, provides a unifying treatment of the signal phase space
resulting from a variety of signals. In this paper, we present the first
application of this framework in the context of multijet plus missing energy
searches. The main result of this work is a global performance study with the
goal of identifying which set of observables yields the best discriminating
power against the largest Standard Model backgrounds for a wide range of signal
jet multiplicities. Our analysis compares combinations of one, two and three
variables, placing emphasis on the enhanced sensitivity gain resulting from
non-trivial correlations. Utilizing boosted decision trees, we compare and
classify the performance of missing energy, energy scale and energy structure
observables. We demonstrate that including an observable from each of these
three classes is required to achieve optimal performance. This work
additionally serves to establish the utility of $n$-body extended Simplified
Models as a diagnostic for unpacking the relative merits of different search
strategies, thereby motivating their application to new physics signatures
beyond jets and missing energy.
","[{""version"":""v1"",""created"":""Wed, 4 May 2016 20:03:26 GMT""},{""version"":""v2"",""created"":""Thu, 25 Aug 2016 00:03:09 GMT""}]","2016-08-26"
"1605.01417","Keir Rogers","Keir K. Rogers, Hiranya V. Peiris, Boris Leistedt, Jason D. McEwen,
  Andrew Pontzen","Spin-SILC: CMB polarisation component separation with spin wavelets","13 pages, 9 figures. Minor changes to match version published in
  MNRAS. Map products available at http://www.silc-cmb.org. Companion paper:
  arXiv:1605.01414 ""Wavelet reconstruction of pure E and B modes for CMB
  polarisation and cosmic shear analyses"" (B. Leistedt et al.)","MNRAS (2016) 463 (3): 2310-2322","10.1093/mnras/stw2128",,"astro-ph.CO astro-ph.IM","http://arxiv.org/licenses/nonexclusive-distrib/1.0/","  We present Spin-SILC, a new foreground component separation method that
accurately extracts the cosmic microwave background (CMB) polarisation $E$ and
$B$ modes from raw multifrequency Stokes $Q$ and $U$ measurements of the
microwave sky. Spin-SILC is an internal linear combination method that uses
spin wavelets to analyse the spin-2 polarisation signal $P = Q + iU$. The
wavelets are additionally directional (non-axisymmetric). This allows different
morphologies of signals to be separated and therefore the cleaning algorithm is
localised using an additional domain of information. The advantage of spin
wavelets over standard scalar wavelets is to simultaneously and
self-consistently probe scales and directions in the polarisation signal $P = Q
+ iU$ and in the underlying $E$ and $B$ modes, therefore providing the ability
to perform component separation and $E$-$B$ decomposition concurrently for the
first time. We test Spin-SILC on full-mission Planck simulations and data and
show the capacity to correctly recover the underlying cosmological $E$ and $B$
modes. We also demonstrate a strong consistency of our CMB maps with those
derived from existing component separation methods. Spin-SILC can be combined
with the pseudo- and pure $E$-$B$ spin wavelet estimators presented in a
companion paper to reliably extract the cosmological signal in the presence of
complicated sky cuts and noise. Therefore, it will provide a
computationally-efficient method to accurately extract the CMB $E$ and $B$
modes for future polarisation experiments.
","[{""version"":""v1"",""created"":""Wed, 4 May 2016 20:06:42 GMT""},{""version"":""v2"",""created"":""Mon, 22 Aug 2016 15:03:09 GMT""}]","2016-10-24"
"1605.01418","Jamie Haddock","Jesus De Loera, Jamie Haddock, Deanna Needell","A Sampling Kaczmarz-Motzkin Algorithm for Linear Feasibility",,,,,"math.OC","http://arxiv.org/licenses/nonexclusive-distrib/1.0/","  We combine two iterative algorithms for solving large-scale systems of linear
inequalities, the relaxation method of Agmon, Motzkin et al. and the randomized
Kaczmarz method. In doing so, we obtain a family of algorithms that generalize
and extend both techniques. We prove several convergence results, and our
computational experiments show our algorithms often outperform the original
methods.
","[{""version"":""v1"",""created"":""Wed, 4 May 2016 20:15:46 GMT""},{""version"":""v2"",""created"":""Fri, 10 Jun 2016 18:59:47 GMT""},{""version"":""v3"",""created"":""Thu, 8 Sep 2016 15:13:47 GMT""},{""version"":""v4"",""created"":""Fri, 4 Nov 2016 22:31:41 GMT""},{""version"":""v5"",""created"":""Tue, 28 Feb 2017 18:52:32 GMT""},{""version"":""v6"",""created"":""Tue, 4 Jun 2019 01:07:04 GMT""}]","2019-06-05"
"1605.01419","Robert Anderson","Robert L. Anderson","Green's Function for the Quartic Oscillator","This paper has been withdrawn by the author due to many errors that
  need work",,,,"math-ph math.MP","http://arxiv.org/licenses/nonexclusive-distrib/1.0/","  In this paper, a quantum mechanical Green's function $G_{qo}(y_b,t_b;$
$y_a,t_a)$ for the quartic oscillator is presented. This result is built upon
two previous papers: first [1], detailing the linearization of the quartic
oscillator $(qo)$ to the harmonic oscillator $(ho)$, second [2], the
integration of the classical action function for the quartic oscillator. Here
an equivalent form for the quartic oscillator action function $S_{qo}(y_b,t_b;$
$y_a,t_a)$ in terms of harmonic oscillator variables is derived in order to
facilitate the derivation of the quartic oscillator Green's Function amplitude.
Thus, the papers [1] and [2] and this paper, taken together, result in the
incorporation of the quartic oscillator into the non-relativistic quantum
mechanical physics literature consisting of those single particle systems whose
properties are described in terms of trig functions, their quadratures or both.
","[{""version"":""v1"",""created"":""Wed, 4 May 2016 20:16:01 GMT""},{""version"":""v2"",""created"":""Fri, 10 Jun 2016 13:54:23 GMT""},{""version"":""v3"",""created"":""Mon, 18 Jul 2016 20:41:34 GMT""},{""version"":""v4"",""created"":""Mon, 15 Aug 2016 15:24:55 GMT""}]","2016-08-16"
"1605.01420","Joseph M. Renes","Joseph M. Renes","Uncertainty relations and approximate quantum error correction","v2: improved bounds for v2 of the uncertainty game, added connection
  to wave-particle relations. v1: 5 pages, 2 figures. Completely subsumes
  arXiv:1003.1150","Physical Review A 94 032314 (2016)","10.1103/PhysRevA.94.032314",,"quant-ph","http://arxiv.org/licenses/nonexclusive-distrib/1.0/","  The uncertainty principle can be understood as constraining the probability
of winning a game in which Alice measures one of two conjugate observables,
such as position or momentum, on a system provided by Bob, and he is to guess
the outcome. Two variants are possible: either Alice tells Bob which observable
she measured, or he has to furnish guesses for both cases. Here I derive new
uncertainty relations for both, formulated directly in terms of Bob's guessing
probabilities. For the former these relate to the entanglement that can be
recovered by action on Bob's system alone. This gives a condition for
approximate quantum error correction in terms of the recoverability of
""amplitude"" and ""phase"" information, implicitly used in the recent construction
of efficient quantum polar codes. I also find a tight relation on the guessing
probabilities for the latter game, which has application to wave-particle
duality relations.
","[{""version"":""v1"",""created"":""Wed, 4 May 2016 20:16:19 GMT""},{""version"":""v2"",""created"":""Tue, 10 May 2016 08:15:08 GMT""}]","2017-07-06"
"1605.01421","Stefan Widgren","Stefan Widgren, Pavol Bauer, Robin Eriksson, Stefan Engblom","SimInf: An R package for Data-driven Stochastic Disease Spread
  Simulations","The manual has been updated to the latest version of SimInf (v6.0.0).
  41 pages, 16 figures","J. Stat. Softw., 91(12):1--42 (2019)","10.18637/jss.v091.i12",,"q-bio.PE stat.AP stat.CO","http://arxiv.org/licenses/nonexclusive-distrib/1.0/","  We present the R package SimInf which provides an efficient and very flexible
framework to conduct data-driven epidemiological modeling in realistic large
scale disease spread simulations. The framework integrates infection dynamics
in subpopulations as continuous-time Markov chains using the Gillespie
stochastic simulation algorithm and incorporates available data such as births,
deaths and movements as scheduled events at predefined time-points. Using C
code for the numerical solvers and OpenMP to divide work over multiple
processors ensures high performance when simulating a sample outcome. One of
our design goal was to make SimInf extendable and enable usage of the numerical
solvers from other R extension packages in order to facilitate complex
epidemiological research. In this paper, we provide a technical description of
the framework and demonstrate its use on some basic examples. We also discuss
how to specify and extend the framework with user-defined models.
","[{""version"":""v1"",""created"":""Wed, 4 May 2016 20:16:20 GMT""},{""version"":""v2"",""created"":""Wed, 14 Jun 2017 19:04:00 GMT""},{""version"":""v3"",""created"":""Thu, 3 May 2018 16:56:46 GMT""}]","2021-08-10"
"1605.01422","Elena Borisova","Elena Borisova, Sebastiano Cantalupo, Simon J. Lilly, Raffaella A.
  Marino, Sofia G. Gallego, Roland Bacon, Jeremy Blaizot, Nicolas Bouch\'e,
  Jarle Brinchmann, C. Marcella Carollo, Joseph Caruana, Hayley Finley, Edmund
  C. Herenz, Johan Richard, Joop Schaye, Lorrie A. Straka, Monica L. Turner,
  Tanya Urrutia, Anne Verhamme, Lutz Wisotzki","Ubiquitous giant Ly $\alpha$ nebulae around the brightest quasars at
  $z\sim3.5$ revealed with MUSE","19 pages, 9 figures, 3 Tables, accepted to ApJ",,"10.3847/0004-637X/831/1/39",,"astro-ph.GA astro-ph.CO","http://arxiv.org/licenses/nonexclusive-distrib/1.0/","  Direct Ly $\alpha$ imaging of intergalactic gas at $z\sim2$ has recently
revealed giant cosmological structures around quasars, e.g. the Slug Nebula
(Cantalupo et al. 2014). Despite their high luminosity, the detection rate of
such systems in narrow-band and spectroscopic surveys is less than 10%,
possibly encoding crucial information on the distribution of gas around quasars
and the quasar emission properties. In this study, we use the MUSE
integral-field instrument to perform a blind survey for giant Ly $\alpha$
nebulae around 17 bright radio-quiet quasars at $3<z<4$ that does not suffer
from most of the limitations of previous surveys. After data reduction and
analysis performed with specifically developed tools, we found that each quasar
is surrounded by giant Ly $\alpha$ nebulae with projected sizes larger than 100
physical kpc and, in some cases, extending up to 320 kpc. The circularly
averaged surface brightness profiles of the nebulae appear very similar to each
other despite their different morphologies and are consistent with power laws
with slopes $\approx-1.8$. The similarity between the properties of all these
nebulae and the Slug Nebula suggests a similar origin for all systems and that
a large fraction of gas around bright quasars could be in a relatively ""cold""
(T$\sim$10$^4$K) and dense phase. In addition, our results imply that such gas
is ubiquitous within at least 50 kpc from bright quasars at $3<z<4$
independently of the quasar emission opening angle, or extending up to 200 kpc
for quasar isotropic emission.
","[{""version"":""v1"",""created"":""Wed, 4 May 2016 20:17:26 GMT""},{""version"":""v2"",""created"":""Wed, 11 May 2016 19:32:20 GMT""},{""version"":""v3"",""created"":""Fri, 8 Jul 2016 14:47:40 GMT""}]","2016-11-15"
"1605.01423","Joseph Paddison","Joseph A. M. Paddison, Harapan S. Ong, James O. Hamp, Paromita
  Mukherjee, Xiaojian Bai, Matthew G. Tucker, Nicholas P. Butch, Claudio
  Castelnovo, Martin Mourigal, S. E. Dutton","Emergent Order in the Kagome Ising Magnet Dy3Mg2Sb3O14","30 pages, 11 figures, includes Supplementary Information",,"10.1038/ncomms13842",,"cond-mat.str-el cond-mat.mtrl-sci cond-mat.stat-mech","http://arxiv.org/licenses/nonexclusive-distrib/1.0/","  The kagome lattice -- a two-dimensional (2D) arrangement of corner-sharing
triangles -- is at the forefront of the search for exotic states generated by
magnetic frustration. Such states have been observed experimentally for
Heisenberg and planar spins. In contrast, frustration of Ising spins on the
kagome lattice has previously been restricted to nano-fabricated systems and
spin-ice materials under applied magnetic field. Here, we show that the layered
Ising magnet Dy3Mg2Sb3O14 hosts an emergent order predicted theoretically for
individual kagome layers of in-plane Ising spins. Neutron-scattering and bulk
thermomagnetic measurements, supported by Monte Carlo simulations, reveal a
phase transition at T* = 0.3 K from a disordered spin-ice like regime to an
""emergent charge ordered"" state in which emergent charge degrees of freedom
exhibit three-dimensional order while spins remain partially disordered. Our
results establish Dy3Mg2Sb3O14 as a tuneable system to study interacting
emergent charges arising from kagome Ising frustration.
","[{""version"":""v1"",""created"":""Wed, 4 May 2016 20:18:17 GMT""}]","2017-01-04"
"1605.01424","Li Tang","Li Tang and Aditya Ramamoorthy","Coded Caching for Networks with the Resolvability Property",,,,,"cs.IT math.IT","http://arxiv.org/licenses/nonexclusive-distrib/1.0/","  Coded caching is a recently proposed technique for dealing with large scale
content distribution over the Internet. As in conventional caching, it
leverages the presence of local caches at the end users. However, it considers
coding in the caches and/or coded transmission from the central server and
demonstrates that huge savings in transmission rate are possible when the
server and the end users are connected via a single shared link. In this work,
we consider a more general topology where there is a layer of relay nodes
between the server and the users, e.g., combination networks studied in network
coding are an instance of these networks. We propose novel schemes for a class
of such networks that satisfy a so-called resolvability property and
demonstrate that the performance of our scheme is strictly better than
previously proposed schemes.
","[{""version"":""v1"",""created"":""Wed, 4 May 2016 20:21:54 GMT""}]","2016-05-06"
"1605.01425","Edward Bierstone","Andre Belotto da Silva, Iwo Biborski and Edward Bierstone","Solutions of quasianalytic equations","revised version, 25 pages, to appear in Selecta Math",,,,"math.CV math.CA math.LO","http://arxiv.org/licenses/nonexclusive-distrib/1.0/","  The article develops techniques for solving equations G(x,y)=0, where
G(x,y)=G(x_1,...,x_n,y) is a function in a given quasianalytic class (for
example, a quasianalytic Denjoy-Carleman class, or the class of infinitely
differentiable functions definable in a polynomially-bounded o-minimal
structure). We show that, if G(x,y)=0 has a formal power series solution y=H(x)
at some point a, then H is the Taylor expansion at a of a quasianalytic
solution y=h(x), where h(x) is allowed to have a certain controlled loss of
regularity, depending on G. Several important questions on quasianalytic
functions, concerning division, factorization, Weierstrass preparation, etc.,
fall into the framework of this problem (or are closely related), and are also
discussed.
","[{""version"":""v1"",""created"":""Wed, 4 May 2016 20:23:41 GMT""},{""version"":""v2"",""created"":""Thu, 29 Jun 2017 21:18:27 GMT""}]","2017-07-03"
"1605.01426","Blake Stacey","Blake C. Stacey","Sporadic SICs and the Normed Division Algebras","2 pages, at the expense of deleting the definition of a Moufang loop","Foundations of Physics, vol. 47 (2017)","10.1007/s10701-017-0087-2",,"quant-ph","http://arxiv.org/licenses/nonexclusive-distrib/1.0/","  Recently, Zhu classified all the SIC-POVMs whose symmetry groups act doubly
transitively. Lattices of integers in the complex numbers, the quaternions and
the octonions yield the key parts of these symmetry groups.
","[{""version"":""v1"",""created"":""Wed, 4 May 2016 20:27:16 GMT""}]","2017-04-18"
"1605.01427","Cynthia J. Olson Reichhardt","C. Reichhardt and C.J. Olson Reichhardt","Drive Dependence of the Skyrmion Hall Effect in Disordered Systems","5 pages, 4 postscript figures","New J. Phys. 18, 095005 (2016)","10.1088/1367-2630/18/9/095005",,"cond-mat.str-el cond-mat.mes-hall","http://arxiv.org/licenses/nonexclusive-distrib/1.0/","  Using a particle-based simulation model, we show that quenched disorder
creates a drive-dependent skyrmion Hall effect as measured by the change in the
ratio $R=V_{\perp}/V_{||}$ of the skyrmion velocity perpendicular ($V_{\perp}$)
and parallel ($V_{||}$) to an external drive. $R$ is zero at depinning and
increases linearly with increasing drive, in agreement with recent experimental
observations. At sufficiently high drives where the skyrmions enter a free flow
regime, $R$ saturates to the disorder-free limit. This behavior is robust for a
wide range of disorder strengths and intrinsic Hall angle values, and occurs
whenever plastic flow is present. For systems with small intrinsic Hall angles,
we find that the Hall angle increases linearly with external drive, as also
observed in experiment. In the weak pinning regime where the skyrmion lattice
depins elastically, $R$ is nonlinear and the net direction of the skyrmion
lattice motion can rotate as a function of external drive.
","[{""version"":""v1"",""created"":""Wed, 4 May 2016 20:46:11 GMT""}]","2017-12-06"
"1605.01428","Saurabh Singh","Saurabh Singh, R. K. Maurya, Sudhir K. Pandey","Investigation of the Thermoelectric Properties of ZnV$_{2}$O$_{4}$
  Compound in High Temperature Region","10 pages, 8 figures, 1 table (to appear in J. Phys. D: Appl. Phys.)","J. Phys. D: Appl. Phys. 49 425601 (2016)","10.1088/0022-3727/49/42/425601",,"cond-mat.mtrl-sci","http://arxiv.org/licenses/nonexclusive-distrib/1.0/","  In the present work, we report the experimental thermopower ($\alpha$) data
for ZnV$_{2}$O$_{4}$ compound in the high temperature range 300-600 K. The
value of $\alpha$ is found to be $\sim$184 and $\sim$126 $\mu$V/K at $\sim$300
and $\sim$600 K, respectively. The temperature dependent behavior of $\alpha$
is almost linear in the measured temperature range. To understand the large and
positive $\alpha$ value observed in this compound, we have also investigated
the electronic and thermoelectric properties by combining the
\textit{ab-initio} electronic structures calculations with Boltzmann transport
theory. Within the local spin density approximation plus Hubbard U, the
anti-ferromagnetic ground state calculation gives an energy gap $\sim$0.33 eV
for U=3.7 eV, which is in accordance with the experimental results. The
effective mass for holes in the valance band is found nearly four times that of
electrons in conduction band. The large effective mass of holes are mainly
responsible for the observed positive and large $\alpha$ value in this
compound. There is reasonably good matching between calculated and experimental
$\alpha$ data in the temperature range 300-410 K. The power factor calculation
shows that thermoelectric properties in high temperature region can be enhanced
by tuning the sample synthesis conditions and suitable doping. The estimated
value of \textit{figure-of-merit}, ZT, at different absolute temperature
suggest that ZnV$_{2}$O$_{4}$ compound can be a good thermoelectric material in
high temperature range.
","[{""version"":""v1"",""created"":""Wed, 4 May 2016 20:46:32 GMT""},{""version"":""v2"",""created"":""Fri, 9 Sep 2016 09:42:16 GMT""}]","2016-09-30"
"1605.01429","PhridviRaj M.S.B","M.S.B. PhridviRaja, C.V. GuruRao","Data mining : past present and future - a typical survey on data streams","The 7th International Conference Interdisciplinary in Engineering
  (INTER-ENG 2013). in Procedia Technology, Volume 12, 2014",,,,"cs.DB","http://creativecommons.org/licenses/by/4.0/","  Data Stream Mining is one of the area gaining lot of practical significance
and is progressing at a brisk pace with new methods, methodologies and findings
in various applications related to medicine, computer science, bioinformatics
and stock market prediction, weather forecast, text, audio and video processing
to name a few. Data happens to be the key concern in data mining. With the huge
online data generated from several sensors, Internet Relay Chats, Twitter, Face
book, Online Bank or ATM Transactions, the concept of dynamically changing data
is becoming a key challenge, what we call as data streams. In this paper, we
give the algorithm for finding frequent patterns from data streams with a case
study and identify the research issues in handling data streams.
","[{""version"":""v1"",""created"":""Wed, 4 May 2016 20:46:36 GMT""}]","2016-05-06"
"1605.01430","Martin Puchol","Martin Puchol, Yeping Zhang, Jialin Zhu","Scattering Matrix and Analytic Torsion","56 pages","Analysis & PDE 14 (2021) 77-134","10.2140/apde.2021.14.77",,"math.DG","http://arxiv.org/licenses/nonexclusive-distrib/1.0/","  For a compact manifold, which has a part isometric to a cylinder of finite
length, we consider an adiabatic limit procedure, in which the length of the
cylinder tends to infinity. We study the asymptotic of the spectrum of
Hodge-Laplacian and the asymptotic of the $L^2$-metric on de Rham cohomology.
As an application, we give a pure analytic proof of the gluing formula for
analytic torsion.
","[{""version"":""v1"",""created"":""Wed, 4 May 2016 20:46:37 GMT""},{""version"":""v2"",""created"":""Tue, 5 Mar 2019 11:32:47 GMT""}]","2021-02-24"
"1605.01431","Sergio Velasco","S. Velasco, R. Rebolo, A. Oscoz, C. Mackay, L. Labadie, A. P\'erez
  Garrido, J. Crass, A. D\'iaz-S\'anchez, B. Femen\'ia, V. Gonz\'alez-Escalera,
  D.L. King, R.L. L\'opez, M. Puga, L.F. Rodr\'iguez-Ramos, and J. Zuther","High spatial resolution optical imaging of the multiple T Tauri system
  LkH{\alpha} 262/LkH{\alpha} 263","11 pages, 7 figures, Accepted 2016 May 4",,"10.1093/mnras/stw1071",,"astro-ph.SR astro-ph.IM","http://arxiv.org/licenses/nonexclusive-distrib/1.0/","  We report high spatial resolution i' band imaging of the multiple T Tauri
system LkH$\alpha$ 262/LkH$\alpha$ 263 obtained during the first commissioning
period of the Adaptive Optics Lucky Imager (AOLI) at the 4.2 m William Herschel
Telescope, using its Lucky Imaging mode. AOLI images have provided photometry
for each of the two components LkH$\alpha$ 263 A and B (0.41 arcsec separation)
and marginal evidence for an unresolved binary or a disc in LkH$\alpha$ 262.
The AOLI data combined with previously available and newly obtained optical and
infrared imaging show that the three components of LkH$\alpha$ 263 are
co-moving, that there is orbital motion in the AB pair, and, remarkably, that
LkH$\alpha$ 262-263 is a common proper motion system with less than 1 mas/yr
relative motion. We argue that this is a likely five-component gravitationally
bounded system. According to BT-settl models the mass of each of the five
components is close to 0.4 M$_{\odot}$ and the age is in the range 1-2 Myr. The
presence of discs in some of the components offers an interesting opportunity
to investigate the formation and evolution of discs in the early stages of
multiple very low-mass systems. In particular, we provide tentative evidence
that the disc in 263C could be coplanar with the orbit of 263AB.
","[{""version"":""v1"",""created"":""Wed, 4 May 2016 20:48:12 GMT""}]","2016-05-10"
"1605.01432","Michael Albert","Michael Albert, V\'it Jel\'inek","Unsplittable classes of separable permutations","20 pages",,,,"math.CO","http://arxiv.org/licenses/nonexclusive-distrib/1.0/","  A permutation class is splittable if it is contained in the merge of two of
its proper subclasses. We characterise the unsplittable subclasses of the class
of separable permutations both structurally and in terms of their bases.
","[{""version"":""v1"",""created"":""Wed, 4 May 2016 20:48:54 GMT""}]","2016-05-06"
"1605.01433","Alexander Mikhailichenko A","E.G. Bessonov, M.V. Gorbunkov, A.V. Vinogradov, Yu.Ya. Maslova,
  (Lebedev Physical Institute, RAS), A.A. Mikhailchenko (Cornell University,
  USA)","To the Thomson cross-section of light scattered by moving particle","4 pages",,,,"physics.acc-ph","http://arxiv.org/licenses/nonexclusive-distrib/1.0/","  In this paper in a framework of classical electrodynamics, we re-derived in a
simple way the formula for the light scattering by moving particle with
arbitrary angle of collision.
","[{""version"":""v1"",""created"":""Wed, 4 May 2016 20:53:25 GMT""}]","2016-05-06"
