"1605.01504","Jonathan  Tennyson","Tibor Furtenbacher, Istvan Szabo and Attila G. Csaszar, Peter F.
  Bernath, Sergei N. Yurchenko and Jonathan Tennyson","Experimental energy levels and partition function of the $^{12}$C$_2$
  molecule","ApJ Supplements (in press), 48 pages","ApJS, 224, 44 (2016)","10.3847/0067-0049/224/2/44",,"astro-ph.GA physics.chem-ph","http://arxiv.org/licenses/nonexclusive-distrib/1.0/","  The carbon dimer, the $^{12}$C$_2$ molecule, is ubiquitous in astronomical
environments. Experimental-quality rovibronic energy levels are reported for
$^{12}$C$_2$, based on rovibronic transitions measured for and among its
singlet, triplet, and quintet electronic states, reported in 42 publications.
The determination utilizes the Measured Active Rotational-Vibrational Energy
Levels (MARVEL) technique. The 23,343 transitions measured experimentally and
validated within this study determine 5,699 rovibronic energy levels, 1,325,
4,309, and 65 levels for the singlet, triplet, and quintet states investigated,
respectively. The MARVEL analysis provides rovibronic energies for six singlet,
six triplet, and two quintet electronic states. For example, the lowest
measurable energy level of the \astate\ state, corresponding to the $J=2$ total
angular momentum quantum number and the $F_1$ spin-multiplet component, is
603.817(5) \cm. This well-determined energy difference should facilitate
observations of singlet--triplet intercombination lines which are thought to
occur in the interstellar medium and comets. The large number of highly
accurate and clearly labeled transitions that can be derived by combining
MARVEL energy levels with computed temperature-dependent intensities should
help a number of astrophysical observations as well as corresponding laboratory
measurements. The experimental rovibronic energy levels, augmented, where
needed, with {\it ab initio} variational ones based on empirically adjusted and
spin-orbit coupled potential energy curves obtained using the \Duo\ code, are
used to obtain a highly accurate partition function, and related thermodynamic
data, for $^{12}$C$_2$ up to 4,000 K.
","[{""version"":""v1"",""created"":""Thu, 5 May 2016 06:48:19 GMT""}]","2016-07-05"
"1605.01505","Mathilde Noual","Mathilde Noual","A combinatorial problem about binary necklaces and attractors of Boolean
  automata networks",,,,,"cs.DM","http://arxiv.org/licenses/nonexclusive-distrib/1.0/","  It is known that there are no more Lyndon words of length n than there are
periodic necklaces of same length. This paper considers a similar problem
where, additionally, the necklaces must be without some forbidden factors. This
problem relates to a different context, concerned with the behaviours of
particular discrete dynamical systems, namely, Boolean automata networks. A
formal argument supporting the following idea is provided: addition of cycle
intersections in network structures causes exponential reduction of the
networks' number of attractors.
","[{""version"":""v1"",""created"":""Thu, 5 May 2016 06:53:22 GMT""}]","2016-05-06"
"1605.01506","Vsevolod Lev F.","Ernie Croot, Vsevolod Lev, and Peter Pach","Progression-free sets in Z_4^n are exponentially small","A vey minor improvement + simplification + correction",,,,"math.NT math.CO","http://arxiv.org/licenses/nonexclusive-distrib/1.0/","  We show that for integer $n>0$, any subset $A \subset Z_4^n$ free of
three-term arithmetic progressions has size $|A| < 4^{c n}$, with an absolute
constant $c \approx 0.926$.
","[{""version"":""v1"",""created"":""Thu, 5 May 2016 07:03:29 GMT""},{""version"":""v2"",""created"":""Sat, 21 May 2016 13:04:21 GMT""}]","2016-05-24"
"1605.01507","Xiaoli Dong","Yuan Dongna, Yuan Jie, Huang Yulong, Ni Shunli, Feng Zhongpei, Zhou
  Huaxue, Mao Yiyuan, Jin Kui, Zhang Guangming, Dong Xiaoli, Zhou Fang and Zhao
  Zhongxian","Observation of Ising spin-nematic order and its close relationship to
  the superconductivity in FeSe single crystals","13 pages, 4 figures","Phys. Rev. B 94, 060506 (2016)","10.1103/PhysRevB.94.060506",,"cond-mat.supr-con","http://arxiv.org/licenses/nonexclusive-distrib/1.0/","  Superconducting FeSe single crystals of (001) orientation are synthesized via
a hydrothermal ion-release route. An Ising spin-nematic order is identified by
our systematic measurements of in-plane angular-dependent magnetoresistance
(AMR) and static magnetization. The turn-on temperature of anisotropic AMR
signifies the Ising spin-nematic ordering temperature Tsn, below which a
two-fold rotational symmetry is observed in the iron plane. A downward
curvature appears below Tsn in the temperature dependence of static
magnetization for the weak in-plane magnetic field as reported previously.
Remarkably, we find a universal linear relationship between Tc and Tsn among
various superconducting samples, indicating that the spin nematicity and the
superconductivity in FeSe have a common microscopic origin.
","[{""version"":""v1"",""created"":""Thu, 5 May 2016 07:10:21 GMT""},{""version"":""v2"",""created"":""Mon, 1 Aug 2016 12:13:06 GMT""}]","2016-08-24"
"1605.01508","HongVan Le","Kotaro Kawai, H\^ong V\^an L\^e and Lorenz Schwachh\""ofer","Fr\""olicher-Nijenhuis bracket and geometry of $G_2$-and ${\rm
  Spin}(7)$-manifolds","v3: 25 p. final version with improved and shortened presentation,
  accepted for Annali di Matematica Pura ed Applicata. v2: 36 p. Completely
  revised and shortened version. The part on new cohomology invariants is
  removed and will be extended in a forthcoming paper. v 1: 55 p. Comments are
  welcome!",,,,"math.DG math-ph math.MP","http://arxiv.org/licenses/nonexclusive-distrib/1.0/","  We extend the characterization of the integrability of an almost complex
structure $J$ on differentiable manifolds via the vanishing of the
Fr\""olicher-Nijenhuis bracket $[J, J] ^{FN}$ to an analogous characterization
of torsion-free $G_2$-structures and torsion-free Spin(7)-structures. We also
explain the Fern\'andez-Gray classification of $G_2$-structures and the
Fern\'andez classification of Spin(7)-structures in terms of the
Fr\""olicher-Nijenhuis bracket.
","[{""version"":""v1"",""created"":""Thu, 5 May 2016 07:13:21 GMT""},{""version"":""v2"",""created"":""Tue, 28 Feb 2017 09:12:24 GMT""},{""version"":""v3"",""created"":""Wed, 2 Aug 2017 12:23:30 GMT""}]","2017-08-03"
"1605.01509","Yunkyu Bang","Yunkyu Bang","Pairing Mechanism of the Heavily Electron Doped FeSe Systems: Dynamical
  Tuning of the Pairing Cutoff Energy","12 pages, 11 figures; Appendix A is added","New J. Physics, 18 (2016) 113054","10.1088/1367-2630/18/11/113054",,"cond-mat.supr-con","http://arxiv.org/licenses/nonexclusive-distrib/1.0/","  We studied pairing mechanism of the heavily electron doped FeSe (HEDIS)
systems, which commonly have one incipient hole band -- a band top below the
Fermi level by a finite energy distance $\epsilon_b$ -- at $\Gamma$ point and
ordinary electron bands at $M$ points in Brillouin zone (BZ). We found that the
system allows two degenerate superconducting solutions with the exactly same
$T_c$ in clean limit: the incipient $s^{\pm}_{he}$-gap ($\Delta_h^{-} \neq 0$,
$\Delta_e^{+} \neq 0$) and $s_{ee}^{++}$-gap ($\Delta_h =0$, $\Delta_e^{+} \neq
0$) solutions with different pairing cutoffs, $\Lambda_{sf}$ (spin fluctuation
energy) and $\epsilon_b$, respectively. The $s_{ee}^{++}$-gap solution, in
which the system dynamically renormalizes the original pairing cutoff
$\Lambda_{sf}$ to $\Lambda_{phys}=\epsilon_b$ ($< \Lambda_{sf}$), therefore
actively eliminates the incipient hole band from forming Cooper pairs, but
without loss of $T_c$, becomes immune to the impurity pair-breaking. As a
result, the HEDIS systems, by dynamically tuning the pairing cutoff and
selecting the $s_{ee}^{++}$-pairing state, can always achieve the maximum $T_c$
-- the $T_c$ of the degenerate $s^{\pm}_{he}$ solution in the ideal clean limit
-- latent in the original pairing interactions, even in dirty limit.
","[{""version"":""v1"",""created"":""Thu, 5 May 2016 07:16:18 GMT""},{""version"":""v2"",""created"":""Sat, 7 May 2016 06:00:12 GMT""},{""version"":""v3"",""created"":""Fri, 3 Jun 2016 07:44:13 GMT""}]","2016-12-21"
"1605.01510","Pieter Kleer","Pieter Kleer, Guido Sch\""afer","The Impact of Worst-Case Deviations in Non-Atomic Network Routing Games",,,,,"cs.GT","http://arxiv.org/licenses/nonexclusive-distrib/1.0/","  We introduce a unifying model to study the impact of worst-case latency
deviations in non-atomic selfish routing games. In our model, latencies are
subject to (bounded) deviations which are taken into account by the players.
The quality deterioration caused by such deviations is assessed by the
$\textit{Deviation Ratio}$, i.e., the worst-case ratio of the cost of a Nash
flow with respect to deviated latencies and the cost of a Nash flow with
respect to the unaltered latencies. This notion is inspired by the
$\textit{Price of Risk Aversion}$ recently studied by Nikolova and Stier-Moses.
Here we generalize their model and results. In particular, we derive tight
bounds on the Deviation Ratio for multi-commodity instances with a common
source and arbitrary non-negative and non-decreasing latency functions. These
bounds exhibit a linear dependency on the size of the network (besides other
parameters). In contrast, we show that for general multi-commodity networks an
exponential dependency is inevitable. We also improve recent smoothness results
to bound the Price of Risk Aversion.
","[{""version"":""v1"",""created"":""Thu, 5 May 2016 07:19:16 GMT""},{""version"":""v2"",""created"":""Wed, 22 Jun 2016 08:22:24 GMT""}]","2016-06-23"
"1605.01511","Felix Klein","Bernd Finkbeiner and Felix Klein","Bounded Cycle Synthesis",,,,,"cs.LO","http://arxiv.org/licenses/nonexclusive-distrib/1.0/","  We introduce a new approach for the synthesis of Mealy machines from
specifications in linear-time temporal logic (LTL), where the number of cycles
in the state graph of the implementation is limited by a given bound. Bounding
the number of cycles leads to implementations that are structurally simpler and
easier to understand. We solve the synthesis problem via an extension of
SAT-based bounded synthesis, where we additionally construct a witness
structure that limits the number of cycles. We also establish a
triple-exponential upper and lower bound for the potential blow-up between the
length of the LTL formula and the number of cycles in the state graph.
","[{""version"":""v1"",""created"":""Thu, 5 May 2016 07:21:02 GMT""}]","2016-05-06"
"1605.01512","Leonardo Pedro","Leonardo Pedro","Relating spontaneous and explicit symmetry breaking in the presence of
  the Higgs mechanism","27 pages, v3: SU(5) grand-unified theory and a recent claim in a toy
  model are discussed",,,,"hep-ph","http://arxiv.org/licenses/nonexclusive-distrib/1.0/","  One common way to define spontaneous symmetry breaking involves explicit
symmetry breaking. This definition can be used in any approach to Effective
Field Theory, from perturbation theory to lattice simulations. It allows us to
study the spontaneous breakdown of global symmetries without assuming that the
local gauge symmetry is spontaneously broken. This is important since
perturbation theory is insufficient to study extended Higgs sectors: it is
insufficient to predict the physical spectrum of the SU(5) Grand Unified Theory
(Georgi-Glashow) or to predict the spontaneous breakdown of global symmetries.
  We also study background symmetries: these are symmetries that despite they
are already explicitly broken, can be still spontaneously broken. We analyse
examples where a background CP (charge-parity) symmetry is not spontaneously
broken: in the Standard Model, in rephasing symmetries and in geometrical
CP-violation.
  We show that all fields are real representations of the group of symmetries,
since CP is a unitary transformation. There are consequences: to study
accidental symmetries (e.g. custodial symmetry, pseudo-golstone bosons) we must
consider real representations; CP is a symmetry of order 4 if the neutrinos are
Majorana particles and the notion of CP-violating phases is inconsistent in
some Lagrangians; a recent claim that a toy model exhibits physical
CP-violation while the CP symmetry is conserved by the Lagrangian and the
vacuum is false.
","[{""version"":""v1"",""created"":""Thu, 5 May 2016 07:21:13 GMT""},{""version"":""v2"",""created"":""Mon, 28 Nov 2016 20:59:17 GMT""},{""version"":""v3"",""created"":""Fri, 20 Oct 2017 10:28:23 GMT""}]","2017-10-23"
"1605.01513","Daniel Azagra","Daniel Azagra, Juan Ferrera, and Javier Gomez-Gil","Nonsmooth Morse-Sard theorems","Final version. The main result has been strengthened thanks to the
  suggestions of a referee",,,,"math.CA math.DG math.OC","http://arxiv.org/licenses/nonexclusive-distrib/1.0/","  We prove that every function $f:\mathbb{R}^n\to \mathbb{R}$ satisfies that
the image of the set of critical points at which the function $f$ has Taylor
expansions of order $n-1$ and non-empty subdifferentials of order $n$ is a
Lebesgue-null set. As a by-product of our proof, for the proximal
subdifferential $\partial_{P}$, we see that for every lower semicontinuous
function $f:\mathbb{R}^2\to\mathbb{R}$ the set $f(\{x\in\mathbb{R}^2 :
0\in\partial_{P}f(x)\})$ is $\mathcal{L}^{1}$-null.
","[{""version"":""v1"",""created"":""Thu, 5 May 2016 07:29:57 GMT""},{""version"":""v2"",""created"":""Tue, 16 May 2017 08:53:15 GMT""}]","2017-05-17"
"1605.01514","Michal Gregor","Michal Gregor and Juraj Spalek","Fitness-based Adaptive Control of Parameters in Genetic Programming:
  Adaptive Value Setting of Mutation Rate and Flood Mechanisms","in 2011 IEEE International Conference on Intelligent Computing and
  Intelligent Systems (ICIS 2011)",,,,"cs.NE","http://arxiv.org/licenses/nonexclusive-distrib/1.0/","  This paper concerns applications of genetic algorithms and genetic
programming to tasks for which it is difficult to find a representation that
does not map to a highly complex and discontinuous fitness landscape. In such
cases the standard algorithm is prone to getting trapped in local extremes. The
paper proposes several adaptive mechanisms that are useful in preventing the
search from getting trapped.
","[{""version"":""v1"",""created"":""Thu, 5 May 2016 07:30:02 GMT""}]","2016-05-06"
"1605.01515","Samina S. Masood","Samina Masood","Propagation of Light in a Hot and Dense Medium","18 pages",,"10.1140/epjc/s10052-017-5398-0",,"hep-ph","http://arxiv.org/licenses/nonexclusive-distrib/1.0/","  Photons, as quanta of electromagnetic fields, determine the electromagnetic
properties of an extremely hot and dense medium. Considering the properties of
photons in the interacting medium of charged particles, we explicitly calculate
the electromagnetic properties such as the electric permittivity, magnetic
permeability, refractive index and the propagation speed of electromagnetic
signals in extremely hot and dense background in cosmos. Photons acquire
dynamically generated mass in a medium. The screening mass of photon, Debye
shielding length and the plasma frequency are calculated as functions of
statistical parameters of the medium. We study the properties of the
propagating particles in astrophysical systems of distinct statistical
conditions. The modifications in the medium properties lead to the equation of
state of the system. We mainly calculate all these parameters for extremely
high temperatures of the early universe.
","[{""version"":""v1"",""created"":""Thu, 5 May 2016 07:31:15 GMT""}]","2018-01-17"
"1605.01516","Keita Ozaki","Keita Ozaki, Satoru Takahashi, Shigeki Aoki, Keiki Kamada, Taichi
  Kaneyama, Ryo Nakagawa, Hiroki Rokujo","Demonstration of polarization sensitivity of emulsion-based pair
  conversion telescope for cosmic gamma-ray polarimetry",,"Nuclear Instruments and Methods in Physics Research A 833 (2016)
  165-168","10.1016/j.nima.2016.07.033",,"astro-ph.IM physics.ins-det","http://arxiv.org/licenses/nonexclusive-distrib/1.0/","  Linear polarization of high-energy gamma-rays (10 MeV-100 GeV) can be
detected by measuring the azimuthal angle of electron-positron pairs and
observing the modulation of the azimuthal distribution. To demonstrate the
gamma-ray polarization sensitivity of emulsion, we conducted a test using a
polarized gamma-ray beam at SPring-8/LEPS. Emulsion tracks were reconstructed
using scanning data, and gamma-ray events were selected automatically. Using an
optical microscope, out of the 2381 gamma-ray conversions that were observed,
1372 remained after event selection, on the azimuthal angle distribution of
which we measured the modulation. From the distribution of the azimuthal angles
of the selected events, a modulation factor of 0.21 + 0.11 - 0.09 was measured,
from which the detection of a non-zero modulation was established with a
significance of 3.06 $\sigma$. This attractive polarimeter will be applied to
the GRAINE project, a balloon-borne experiment that observes cosmic gamma-rays
with an emulsion-based pair conversion telescope.
","[{""version"":""v1"",""created"":""Thu, 5 May 2016 07:33:14 GMT""}]","2016-07-27"
"1605.01517","Zeinab Kordi","Zeinab Kordi, Seyed Hamideh Kazemi, Saeed Ghanbari and Mohammad
  Mahmoudi","Atom- Photon Entanglement in Double- Lambda Quantum System by using
  femtosecond Gaussian pulses","19 pages",,,,"quant-ph","http://arxiv.org/licenses/nonexclusive-distrib/1.0/","  The dynamical behavior of entanglement between the atomic ensemble and the
spontaneous emission is investigated by applying the femtosecond Gaussian
pulses in double- lambda quantum system. In fact by solving the density matrix
equations of motion in such a system and by using the von Neumann entropy, the
degree of entanglement (DEM) could be measured in semi classical regime and in
the multi-photon resonance condition. We interested in investigating the
maximum value for DEM and controlled the DEM via relative phase. At first we
consider three laser fields as CW optical laser fields and one femtosecond
Gaussian field. In this case DEM has interesting behavior. When the system is
applied by the other laser fields and Gaussian pulse is still there DEM can be
controlled via phase but after finishing the time duration of the femtosecond
Gaussian pulse DEM will be phase independent. Then we consider all the laser
fields as femtosecond Gaussian pulses which interact with atomic system and we
achieve to this point that the steady state entanglement can be occurred by
using such ultra-short laser pulses; in this situation DEM will be phase
independent. The system would be disentangled in special parameters of Rabi
frequencies and all the atoms are coherently populated in a dark state in
dressed state picture. Moreover when the system is entangled, there is a
population distribution of the atoms in dressed states.
","[{""version"":""v1"",""created"":""Thu, 5 May 2016 07:34:58 GMT""}]","2016-05-06"
"1605.01518","Andreas D\""opp","A. D\""opp, E. Guillaume, C. Thaury, J. Gautier, K. Ta Phuoc and V.
  Malka","3D printing of gas jet nozzles for laser-plasma accelerators",,"Review of Scientific Instruments, Volume 87, Issue 7, 2016","10.1063/1.4958649",,"physics.plasm-ph physics.acc-ph physics.ins-det","http://arxiv.org/licenses/nonexclusive-distrib/1.0/","  Recent results on laser wakefield acceleration in tailored plasma channels
have underlined the importance of controlling the density profile of the gas
target. In particular it was reported that appropriate density tailoring can
result in improved injection, acceleration and collimation of laser-accelerated
electron beams. To achieve such profiles innovative target designs are
required. For this purpose we have reviewed the usage of additive layer
manufacturing, commonly known as 3D printing, in order to produce gas jet
nozzles. Notably we have compared the performance of two industry standard
techniques, namely selective laser sintering (SLS) and stereolithography (SLA).
Furthermore we have used the common fused deposition modeling (FDM) to
reproduce basic gas jet designs and used SLA and SLS for more sophisticated
nozzle designs. The nozzles are characterized interferometrically and used for
electron acceleration experiments with the Salle Jaune terawatt laser at
Laboratoire d'Optique Appliqu\'ee.
","[{""version"":""v1"",""created"":""Thu, 5 May 2016 07:35:56 GMT""}]","2017-02-01"
"1605.01519","Anatol Slissenko","Anatol Slissenko","On entropic convergence of algorithms in terms of domain partitions",,,,,"cs.CC","http://creativecommons.org/licenses/by/4.0/","  The paper describes an approach to measuring convergence of an algorithm to
its result in terms of an entropy-like function of partitions of its inputs of
a given length. The goal is to look at the algorithmic data processing from the
viewpoint of information transformation, with a hope to better understand the
work of algorithm, and maybe its complexity. The entropy is a measure of
uncertainty, it does not correspond to our intuitive understanding of
information. However, it is what we have in this area. In order to realize this
approach we introduce a measure on the inputs of a given length based on the
Principle of Maximal Uncertainty: all results should be equiprobable to the
algorithm at the beginning. An algorithm is viewed as a set of events, each
event is an application of a command. The commands are very basic. To measure
the convergence we introduce a measure that is called entropic weight of events
of the algorithm. The approach is illustrated by two examples.
","[{""version"":""v1"",""created"":""Thu, 5 May 2016 07:36:43 GMT""}]","2016-05-06"
"1605.01520","Yun-Chong Fu","Li Zhang and Yun-Chong Fu","Preliminary study of 10Be/7Be in rainwater from Xi'an by Accelerator
  Mass Spectrometry",,,"10.1088/1674-1137/41/1/018201",,"physics.ins-det","http://arxiv.org/licenses/nonexclusive-distrib/1.0/","  The 10Be/7Be ratio is a sensitive tracer for the study of atmospheric
transport, particularly with regard to stratosphere-troposphere exchange.
Measurements with high accuracy and efficiency are crucial to 7Be and 10Be
tracer studies. This article describes sample preparation procedures and
analytical benchmarks for 7Be and 10Be measurements at the Xian Accelerator
Mass Spectrometry (Xian-AMS) laboratory for the study of rainwater samples. We
describe a sample preparation procedure to fabricate beryllium oxide (BeO) AMS
targets that includes co-precipitation, anion exchange column separation and
purification. We then provide details for the AMS measurement of 7Be and 10Be
following the sequence BeO- -> Be2+ -> Be4+ in the Xian- AMS. The 10Be/7Be
ratio of rainwater collected in Xian is shown to be about 1.3 at the time of
rainfall. The virtue of the method described here is that both 7Be and 10Be are
measured in the same sample, and is suitable for routine analysis of large
numbers of rainwater samples by AMS.
","[{""version"":""v1"",""created"":""Thu, 5 May 2016 07:37:01 GMT""}]","2017-02-01"
"1605.01521","Tsvetan Asamov","Tsvetan Asamov, Daniel F. Salas and Warren B. Powell","SDDP vs. ADP: The Effect of Dimensionality in Multistage Stochastic
  Optimization for Grid Level Energy Storage",,,,,"math.OC stat.CO","http://arxiv.org/licenses/nonexclusive-distrib/1.0/","  There has been widespread interest in the use of grid-level storage to handle
the variability from increasing penetrations of wind and solar energy. This
problem setting requires optimizing energy storage and release decisions for
anywhere from a half-dozen, to potentially hundreds of storage devices spread
around the grid as new technologies evolve. We approach this problem using two
competing algorithmic strategies. The first, developed within the stochastic
programming literature, is stochastic dual dynamic programming (SDDP) which
uses Benders decomposition to create a multidimensional value function
approximations, which have been widely used to manage hydro reservoirs. The
second approach, which has evolved using the language of approximate dynamic
programming, uses separable, piecewise linear value function approximations, a
method which has been successfully applied to high-dimensional fleet management
problems. This paper brings these two approaches together using a common
notational system, and contrasts the algorithmic strategies (which are both a
form of approximate dynamic programming) used by each approach. The methods are
then subjected to rigorous testing using the context of optimizing grid level
storage.
","[{""version"":""v1"",""created"":""Thu, 5 May 2016 07:37:14 GMT""}]","2016-05-06"
