"1605.03271","Yangdi Lyu","Yangdi Lyu, Alper \""Ung\""or","A Fast 2-Approximation Algorithm for Guarding Orthogonal Terrains",,,,,"cs.CG","http://arxiv.org/licenses/nonexclusive-distrib/1.0/","  Terrain Guarding Problem(TGP), which is known to be NP-complete, asks to find
a smallest set of guard locations on a terrain $T$ such that every point on $T$
is visible by a guard. Here, we study this problem on 1.5D orthogonal terrains
where the edges are bound to be horizontal or vertical. We propose a
2-approximation algorithm that runs in O($n \log m$) time, where $n$ and $m$
are the sizes of input and output, respectively. This is an improvement over
the previous best algorithm, which is a 2-approximation with O($n^2$) running
time.
","[{""version"":""v1"",""created"":""Wed, 11 May 2016 03:35:00 GMT""},{""version"":""v2"",""created"":""Tue, 17 May 2016 23:15:47 GMT""}]","2016-05-19"
"1605.03272","G\'abor Hal\'asz","G\'abor B. Hal\'asz, Natalia B. Perkins, Jeroen van den Brink","Resonant inelastic X-ray scattering response of the Kitaev honeycomb
  model","11 pages, 3 figures, published version with minor changes","Phys. Rev. Lett. 117, 127203 (2016)","10.1103/PhysRevLett.117.127203",,"cond-mat.str-el","http://arxiv.org/licenses/nonexclusive-distrib/1.0/","  We calculate the resonant inelastic X-ray scattering (RIXS) response of the
Kitaev honeycomb model, an exactly solvable quantum-spin-liquid model with
fractionalized Majorana and flux excitations. We find that the fundamental RIXS
channels, the spin-conserving (SC) and the non-spin-conserving (NSC) ones, do
not interfere and give completely different responses. SC-RIXS picks up
exclusively the Majorana sector with a pronounced momentum dispersion, whereas
NSC-RIXS also creates immobile fluxes, thereby rendering the response only
weakly momentum dependent, as in the spin structure factor measured by
inelastic neutron scattering. RIXS can therefore pick up the fractionalized
excitations of the Kitaev spin liquid separately, making it a sensitive probe
to detect spin-liquid character in potential material incarnations of the
Kitaev honeycomb model.
","[{""version"":""v1"",""created"":""Wed, 11 May 2016 03:54:51 GMT""},{""version"":""v2"",""created"":""Sat, 1 Oct 2016 01:34:27 GMT""}]","2016-10-04"
"1605.03273","Alin Stancu","Jacob Laubacher, Mihai D. Staic, Alin Stancu","Bar Simplicial Modules and Secondary Cyclic (Co)homology","17 pages",,,,"math.RA","http://arxiv.org/licenses/nonexclusive-distrib/1.0/","  In this paper we study the simplicial structure of the complex
$C^{\bullet}((A,B,\varepsilon); M)$, associated to the secondary Hochschild
cohomology. The main ingredient is the simplicial object
$\mathcal{B}(A,B,\varepsilon)$, which plays a role equivalent to that of the
bar resolution associated to an algebra. We also introduce the secondary cyclic
(co)homology and establish some of its properties (Theorems 3.9 and 4.11).
","[{""version"":""v1"",""created"":""Wed, 11 May 2016 04:14:26 GMT""}]","2016-05-12"
"1605.03274","Hyunyong Lee","Hyunyong Lee and Jung Hoon Han","Classification of trivial spin-1 tensor network states on a square
  lattice",,"Phys. Rev. B 94, 115150 (2016)","10.1103/PhysRevB.94.115150",,"cond-mat.str-el","http://arxiv.org/licenses/nonexclusive-distrib/1.0/","  Classification of possible quantum spin liquid (QSL) states of interacting
spin-1/2's in two dimensions has been a fascinating topic of condensed matter
for decades, resulting in enormous progress in our understanding of
low-dimensional quantum matter. By contrast, relatively little work exists on
the identification, let alone classification, of QSL phases for spin-1 systems
in dimensions higher than one. Employing the powerful ideas of tensor network
theory and its classification, we develop general methods for writing QSL wave
functions of spin-1 respecting all the lattice symmetries, spin rotation, and
time reversal with trivial gauge structure on the square lattice. We find $2^5$
distinct classes characterized by five binary quantum numbers. Several explicit
constructions of such wave functions are given for bond dimensions $D$ ranging
from two to four, along with thorough numerical analyses to identify their
physical characters. Both gapless and gapped states are found. The topological
entanglement entropy of the gapped states are close to zero, indicative of
topologically trivial states. In $D=4$, several different tensors can be
linearly combined to produce a family of states within the same symmetry class.
A rich ""phase diagram"" can be worked out among the phases of these tensors, as
well as the phase transitions among them. Among the states we identified in
this putative phase diagram is the plaquette-ordered phase, gapped resonating
valence bond phase, and a critical phase. A continuous transition separates the
plaquette-ordered phase from the resonating valence bond phase.
","[{""version"":""v1"",""created"":""Wed, 11 May 2016 04:30:18 GMT""}]","2016-09-28"
"1605.03275","Florentin Smarandache","Ion Patrascu, Florentin Smarandache","Complements to Classic Topics of Circles Geometry","180 pages; many geometrical figures","Pons Editions, Brussels, 2016",,,"math.GM","http://arxiv.org/licenses/nonexclusive-distrib/1.0/","  We approach several themes of classical geometry of the circle and complete
them with some original results, showing that not everything in traditional
math is revealed, and that it still has an open character. The topics were
chosen according to authors aspiration and attraction, as a poet writes lyrics
about spring according to his emotions.
","[{""version"":""v1"",""created"":""Wed, 11 May 2016 04:38:45 GMT""}]","2016-05-12"
"1605.03276","Ryszard Szwarc","Ryszard Szwarc","Inhomogeneous Jacobi matrices on trees",,,,,"math.FA","http://arxiv.org/licenses/nonexclusive-distrib/1.0/","  We study Jacobi matrices on trees with one end at inifinity. We show that the
defect indices cannot be greater than 1 and give criteria for essential
selfadjointness. We construct certain polynomials associated with matrices,
which mimic orthogonal polynomials in the classical case. Nonnegativity of
Jacobi matrices is studied as well.
","[{""version"":""v1"",""created"":""Wed, 11 May 2016 04:39:28 GMT""}]","2016-05-12"
"1605.03277","Manukumara  Manjappa","Manukumara Manjappa and Yogesh Kumar Srivastava and Ranjan Singh","Lattice Induced Transparency in Metasurfaces","5 figures","Phys. Rev. B 94, 161103 (2016)","10.1103/PhysRevB.94.161103",,"physics.optics","http://arxiv.org/licenses/nonexclusive-distrib/1.0/","  Lattice modes are intrinsic to the periodic structures and their occurrence
can be easily tuned and controlled by changing the lattice constant of the
structural array. Previous studies have revealed excitation of sharp absorption
resonances due to lattice mode coupling with the plasmonic resonances. Here, we
report the first experimental observation of a lattice induced transparency
(LIT) by coupling the first order lattice mode (FOLM) to the structural
resonance of a metamaterial resonator at terahertz frequencies. The observed
sharp transparency is a result of the destructive interference between the
bright mode and the FOLM mediated dark mode. As the FOLM is swept across the
metamaterial resonance, the transparency band undergoes large change in its
bandwidth and resonance position. Besides controlling the transparency
behaviour, LIT also shows a huge enhancement in the Q-factor and record high
group delay of 28 ps, which could be pivotal in ultrasensitive sensing and slow
light device applications.
","[{""version"":""v1"",""created"":""Wed, 11 May 2016 04:40:55 GMT""}]","2016-10-12"
"1605.03278","Chandan Kumar Misra","Chandan K Mishra, A K Sood and Rajesh Ganapathy","Site-Specific Colloidal Crystal Nucleation by Template-enhanced Particle
  Transport","12 pages, 3 figures",,"10.1073/pnas.1608568113",,"cond-mat.soft","http://arxiv.org/licenses/nonexclusive-distrib/1.0/","  The monomer surface mobility is the single most important parameter that
decides the nucleation density and morphology of islands during thin film
growth. During template-assisted surface growth in particular, low surface
mobilities can prevent monomers from reaching target sites and this results in
a partial to complete loss of nucleation control. While in atomic systems a
broad range of surface mobilities can be readily accessed, for colloids, owing
to their large size, this window is substantially narrow and therefore imposes
severe restrictions in extending template-assisted growth techniques to steer
their self-assembly. Here, we circumvented this fundamental limitation by
designing templates with spatially varying feature sizes, in this case moire
patterns, which in the presence of short-range depletion attraction presented
surface energy gradients for the diffusing colloids. The templates serve a dual
purpose, first, directing the particles to target sites by enhancing their
surface mean free paths and second, dictating the size and symmetry of the
growing crystallites. Using optical microscopy, we directly followed the
nucleation and growth kinetics of colloidal islands on these surfaces at the
single-particle level. We demonstrate nucleation control, with high fidelity,
in a regime that has remained unaccessed in theoretical, numerical and
experimental studies on atoms and molecules as well. Our findings pave the way
for fabricating non-trivial surface architectures composed of complex colloids
and nanoparticles.
","[{""version"":""v1"",""created"":""Wed, 11 May 2016 04:44:09 GMT""}]","2016-11-23"
"1605.03279","Daniel Friedan","Daniel Friedan","Quantum field theories of extended objects","76 pages, 2 animated gif files illustrating appendix A, gif files
  also available at http://www.physics.rutgers.edu/pages/friedan/GOT/",,,,"hep-th","http://arxiv.org/licenses/nonexclusive-distrib/1.0/","  First steps are taken in a project to construct a general class of conformal
and perhaps, eventually, non-conformal quantum field theories of
(n-1)-dimensional extended objects in a d=2n dimensional conformal space-time
manifold M. The fields live on the spaces E of relative integral (n-1)-cycles
in M -- the integral (n-1)-currents of given boundary. Each E is a complete
metric space geometrically analogous to a Riemann surface $\Sigma$. For
example, if $M=S^d$, $\Sigma = S^2$. The quantum fields on E are to be mapped
to observables in a 2d CFT on $\Sigma$. The correlation functions on E are to
be given by the 2d correlation functions on $\Sigma$. The goal is to construct
a CFT of extended objects in d=2n dimensions for every 2d CFT, and eventually a
non-conformal QFT of extended objects for every non-conformal 2d QFT, so that
all the technology of 2d QFT can be applied to the construction and analysis of
quantum field theories of extended objects. The project depends crucially on
settling some mathematical questions about analysis in the spaces E. The
project also depends on extending the observables of 2d CFT from the finite
sets of points in a Riemann surface to the integral 0-currents.
","[{""version"":""v1"",""created"":""Wed, 11 May 2016 04:47:39 GMT""}]","2016-05-12"
"1605.03280","Neelesh Upadhye Dr","Rakshith Jagannath and Neelesh S Upadhye","The LASSO Estimator: Distributional Properties","15 pages, 3 figures",,,,"math.ST stat.AP stat.TH","http://arxiv.org/licenses/nonexclusive-distrib/1.0/","  The least absolute shrinkage and selection operator (LASSO) is a popular
technique for simultaneous estimation and model selection. There have been a
lot of studies on the large sample asymptotic distributional properties of the
LASSO estimator, but it is also well-known that the asymptotic results can give
a wrong picture of the LASSO estimator's actual finite-sample behavior. The
finite sample distribution of the LASSO estimator has been previously studied
for the special case of orthogonal models. The aim in this work is to
generalize the finite sample distribution properties of LASSO estimator for a
real and linear measurement model in Gaussian noise.
  In this work, we derive an expression for the finite sample characteristic
function of the LASSO estimator, we then use the Fourier slice theorem to
obtain an approximate expression for the marginal probability density functions
of the one-dimensional components of a linear transformation of the LASSO
estimator.
","[{""version"":""v1"",""created"":""Wed, 11 May 2016 04:47:59 GMT""},{""version"":""v2"",""created"":""Sat, 2 Jul 2016 04:43:40 GMT""}]","2016-07-05"
"1605.03281","Hamidou Tembine","Boualem Djehiche and Alain Tcheukam and Hamidou Tembine","Mean-Field-Type Games in Engineering","84 pages, 24 figures, 183 references. to appear in AIMS 2017",,,,"math.OC cs.GT","http://arxiv.org/licenses/nonexclusive-distrib/1.0/","  A mean-field-type game is a game in which the instantaneous payoffs and/or
the state dynamics functions involve not only the state and the action profile
but also the joint distributions of state-action pairs. This article presents
some engineering applications of mean-field-type games including road traffic
networks, multi-level building evacuation, millimeter wave wireless
communications, distributed power networks, virus spread over networks, virtual
machine resource management in cloud networks, synchronization of oscillators,
energy-efficient buildings, online meeting and mobile crowdsensing.
","[{""version"":""v1"",""created"":""Wed, 11 May 2016 04:54:07 GMT""},{""version"":""v2"",""created"":""Fri, 29 Sep 2017 08:36:19 GMT""},{""version"":""v3"",""created"":""Wed, 29 Nov 2017 17:16:03 GMT""}]","2017-11-30"
"1605.03282","Won-Yong Shin","Cheol Jeong and Won-Yong Shin","Capacity of Three-Dimensional Erasure Networks","26 pages, 7 figures, To appear in IEEE Transactions on Communications",,,,"cs.IT cs.NI math.IT","http://arxiv.org/licenses/nonexclusive-distrib/1.0/","  In this paper, we introduce a large-scale three-dimensional (3D) erasure
network, where $n$ wireless nodes are randomly distributed in a cuboid of
$n^{\lambda}\times n^{\mu}\times n^{\nu}$ with $\lambda+\mu+\nu=1$ for
$\lambda,\mu,\nu>0$, and completely characterize its capacity scaling laws. Two
fundamental path-loss attenuation models (i.e., exponential and polynomial
power-law models) are used to suitably model an erasure probability for packet
transmission. Then, under the two erasure models, we introduce a routing
protocol using percolation highway in 3D space, and then analyze its achievable
throughput scaling laws. It is shown that, under the two erasure models, the
aggregate throughput scaling $n^{\min\{1-\lambda,1-\mu,1-\nu\}}$ can be
achieved in the 3D erasure network. This implies that the aggregate throughput
scaling $n^{2/3}$ can be achieved in 3D cubic erasure networks while $\sqrt{n}$
can be achieved in two-dimensional (2D) square erasure networks. The gain comes
from the fact that, compared to 2D space, more geographic diversity can be
exploited via 3D space, which means that generating more simultaneous
percolation highways is possible. In addition, cut-set upper bounds on the
capacity scaling are derived to verify that the achievable scheme based on the
3D percolation highway is order-optimal within a polylogarithmic factor under
certain practical operating regimes on the decay parameters.
","[{""version"":""v1"",""created"":""Wed, 11 May 2016 05:01:41 GMT""}]","2016-05-12"
"1605.03283","Mohammad Mamun Rashid Or","Mohammad Mamun Or Rashid, M. Masud Rana and Jugal Krishna Das","Implementation of the open source virtualization technologies in cloud
  computing","19 pages",,,,"cs.DC","http://arxiv.org/licenses/nonexclusive-distrib/1.0/","  The Virtualization and Cloud Computing is a recent buzzword in the digital
world. Cloud computing provide IT as a service to the users on demand basis.
This service has greater flexibility, availability, reliability and scalability
with utility computing model. This new concept of computing has an immense
potential in it to be used in the field of e-governance and in the overall IT
development perspective in developing countries like Bangladesh.
","[{""version"":""v1"",""created"":""Wed, 11 May 2016 05:03:27 GMT""}]","2016-05-12"
"1605.03284","Yuezhang Li","Tian Tian and Yuezhang Li","Machine Comprehension Based on Learning to Rank","9 pages",,,,"cs.CL","http://creativecommons.org/licenses/by/4.0/","  Machine comprehension plays an essential role in NLP and has been widely
explored with dataset like MCTest. However, this dataset is too simple and too
small for learning true reasoning abilities. \cite{hermann2015teaching}
therefore release a large scale news article dataset and propose a deep LSTM
reader system for machine comprehension. However, the training process is
expensive. We therefore try feature-engineered approach with semantics on the
new dataset to see how traditional machine learning technique and semantics can
help with machine comprehension. Meanwhile, our proposed L2R reader system
achieves good performance with efficiency and less training data.
","[{""version"":""v1"",""created"":""Wed, 11 May 2016 05:05:05 GMT""},{""version"":""v2"",""created"":""Fri, 13 May 2016 01:06:09 GMT""}]","2016-05-16"
"1605.03285","S. Dhara SKD","S. Kataria, Sandip Dhara, S. Dash, A. K. Tyagi","Carrier mediated reduction of stiffness in nanoindented crystalline
  Si(100)","13 pages, 3 figures, Journal","J. Appl. Phys. 118 (2015) 035702","10.1063/1.4927152",,"cond-mat.mtrl-sci","http://arxiv.org/licenses/nonexclusive-distrib/1.0/","  We report the observation of carrier mediated decrease in the stiffness of
crystalline (c)-Si(100) under nanoindentation. The apparent elastic modulii of
heavily dopes (1E21 cm-3) p- and n-type c-Si are observed to be lower by 5.-7.5
percent that the estimated value for intrinsic (1E14 cm-3) c-Si. The deviation
observed with respect to elastic modulus remarkably matches with the estimated
value while considering the electronic elastic strain effect on carrier
concentration as an influence of negative pressure coefficient of band gap for
Si. The value is predominantly higher than the reported value of a decrease of
1-3 percent in stiffness as an effect of impurity in c-Si.
","[{""version"":""v1"",""created"":""Wed, 11 May 2016 05:13:50 GMT""}]","2016-05-12"
"1605.03286","Bowen Yan","Bowen Yan and Jianxi Luo","Multicores-periphery structure in networks","26 pages","Net Sci 7 (2019) 70-87","10.1016/j.apsusc.2018.09.234",,"cs.SI physics.soc-ph","http://arxiv.org/licenses/nonexclusive-distrib/1.0/","  Many real-world networks exhibit a multicores-periphery structure, with
densely connected vertices in multiple cores surrounded by a general periphery
of sparsely connected vertices. Identification of the multicores-periphery
structure can provide a new lens to understand the structures and functions of
various real-world networks. This paper defines the multicores-periphery
structure and introduces an algorithm to identify the optimal partition of
multiple cores and the periphery in general networks. We demonstrate the
performance of our algorithm by applying it to a well-known social network and
a patent technology network, which are best characterized by the
multicores-periphery structure. The analyses also reveal the differences
between our multicores-periphery detection algorithm and two state-of-the-art
algorithms for detecting the single core-periphery structure and community
structure.
","[{""version"":""v1"",""created"":""Wed, 11 May 2016 05:20:44 GMT""},{""version"":""v2"",""created"":""Mon, 27 Aug 2018 02:30:14 GMT""}]","2019-05-08"
"1605.03287","Bjoern Lehnert","B. Lehnert, D. Degering, A. Frotscher, T. Michel, K. Zuber","A search for the radiative neutrinoless double electron capture of
  $^{58}$Ni",,,"10.1088/0954-3899/43/6/065201",,"nucl-ex","http://arxiv.org/licenses/nonexclusive-distrib/1.0/","  A search for the radiative neutrinoless double electron capture with single
\gray\ emission has been performed in $^{58}$Ni. Gamma radiation from a 7286 g
nickel sample in natural isotope composition was measured for 58.3 d with an
ultra low background HPGe detector in the Felsenkeller underground laboratory
in Dresden, Germany. A new lower half-life limit of $2.1 \times 10^{21}$ yr
(90% CL) was obtained for this decay mode. This half-life limit is two orders
of magnitude higher than the existing limit for $^{58}$Ni and among the best
half-life limits for neutrinoless double electron capture decays.
","[{""version"":""v1"",""created"":""Wed, 11 May 2016 05:31:36 GMT""}]","2016-06-22"
"1605.03288","Sunandan Gangopadhyay","Sunandan Gangopadhyay, Aslam Halder","Path-integral action of a particle in the noncommutative phase-space","9 pages Latex","Euro. Phys. Lett. 117 (2017) 10010","10.1209/0295-5075/117/10010",,"hep-th quant-ph","http://arxiv.org/licenses/nonexclusive-distrib/1.0/","  In this paper we construct a path integral formulation of quantum mechanics
on noncommutative phase-space. We first map the system to an equivalent system
on the noncommutative plane. Then by applying the formalism of representing a
quantum system in the space of Hilbert-Schmidt operators acting on
noncommutative configuration space, the path integral action of a particle is
derived. It is observed that the action has a similar form to that of a
particle in a magnetic field in the noncommutative plane. From this action the
energy spectrum is obtained for the free particle and the harmonic oscillator
potential. We also show that the nonlocal nature (in time) of the action yields
a second class constrained system from which the noncommutative Heisenberg
algebra can be recovered.
","[{""version"":""v1"",""created"":""Wed, 11 May 2016 05:35:54 GMT""}]","2017-03-02"
"1605.03289","Miroslav Bacak","Miroslav Bacak","A variational approach to stochastic minimization of convex functionals",,,,,"math.OC","http://arxiv.org/licenses/nonexclusive-distrib/1.0/","  Stochastic methods for minimizing a convex integral functional, as initiated
by Robbins and Monro in the early 1950s, rely on the evaluation of a gradient
(or subgradient if the function is not smooth) and moving in the corresponding
direction. In contrast, we use a variational technique resulting in an implicit
stochastic minimization method, which has recently appeared in several diverse
contexts. Such an approach is desirable whenever the underlying space does not
have a differentiable structure and moreover it exhibits better stability
properties which makes it preferable even in linear spaces. Our results are
formulated in locally compact Hadamard spaces, but they are new even in
Euclidean space, the main novelty being more general growth conditions on the
functional. We verify that the assumptions of our convergence theorem are
satisfied in a few classical minimization problems.
","[{""version"":""v1"",""created"":""Wed, 11 May 2016 05:38:31 GMT""}]","2016-05-12"
"1605.03290","Tetsufumi Tanamoto","Tetsufumi Tanamoto, Shinich Yasuda, Satoshi Takaya and Shinobu Fujita","Physically Unclonable Function using Initial Waveform of Ring
  Oscillators","11 pages, 10 figures","IEEE Transactions on Circuits and Systems II: Express Briefs Vol.
  64, pp827 - 831 (2017)","10.1109/TCSII.2016.2602828",,"cs.CR","http://arxiv.org/licenses/nonexclusive-distrib/1.0/","  A silicon physically unclonable function (PUF) is considered to be one of the
key security system solutions for local devices in an era in which the internet
is pervasive. Among many proposals, a PUF using ring oscillators (RO-PUF) has
the advantage of easy application to FPGA. In the conventional RO-PUF,
frequency difference between two ROs is used as one bit of ID. Thus, in order
to obtain an ID of long bit length, the corresponding number of RO pairs are
required and consequently power consumption is large, leading to difficulty in
implementing RO-PUF in local devices. Here, we provide a RO-PUF using the
initial waveform of the ROs. Because a waveform constitutes a part of the ID,
the number of ROs is greatly reduced and the time needed to generate the ID is
finished in a couple of system clocks. We also propose a solution to a change
of PUF performance attributable to temperature or voltage change.
","[{""version"":""v1"",""created"":""Wed, 11 May 2016 05:41:35 GMT""}]","2017-07-07"
"1605.03291","S. Dhara SKD","Avinash Patsha, Ramanathaswamy Pandian, Sandip Dhara and A. K. Tyagi","Nonpolar p-GaN/n-Si heterojunction diode characteristics: A comparison
  between ensemble and single nanowire devices","24 pages, 6 figures,Journal","J. Phys. D: Appl. Phys. 48 (2015) 395102","10.1088/0022-3727/48/39/395102",,"cond-mat.mtrl-sci cond-mat.mes-hall","http://arxiv.org/licenses/nonexclusive-distrib/1.0/","  The electrical and photodiode characteristics of ensemble and single p-GaN
nanowire and n-Si heterojunction devices were studied. Ideality factor of the
single nanowire p-GaN/n-Si device was found to be about three times lower
compared to that of the ensemble nanowire device. Apart from the deep-level
traps in p-GaN nanowires, defect states due to inhomogeneity in Mg dopants in
the ensemble nanowire device are attributed to the origin of high ideality
factor. Photovoltaic mode of ensemble nanowire device showed an improvement in
the fill-factors up to 60 percent over the single nanowire device with
fill-factors up to 30 percent. Reponsivity of the single nanowire device in
photoconducting mode was found to be enhanced by five orders, at 470 nm. The
enhanced photoresponse of the single nanowire device also confirms the
photoconduction due to defect states in p-GaN nanowires.
","[{""version"":""v1"",""created"":""Wed, 11 May 2016 05:42:17 GMT""}]","2016-05-12"
