"1605.03186","Kieran Finn","Kieran Finn, Federica B. Bianco, Maryam Modjaz, Yu-Qian Liu, Armin
  Rest","Comparison of Diversity of Type IIb Supernovae with Asymmetry in
  Cassiopeia A Using Light Echoes","Accepted for publication in ApJ. Comments are welcome",,"10.3847/0004-637X/830/2/73",,"astro-ph.HE","http://arxiv.org/licenses/nonexclusive-distrib/1.0/","  We compare the diversity of spectral line velocities in a large sample of
type IIb supernovae (SNe IIb) with the expected asphericity in the explosion,
as measured from the light echoes of Cassiopeia A (Cas A), which was a
historical galactic SN IIb. We revisit the results of Rest et al. (2011a), who
used light echoes to observe Cas A from multiple lines of sight and hence
determine its asphericity, as seen in the velocity of three spectral lines (He
I $\lambda$5876, H$\alpha$ and the Ca II NIR triplet). We confirm and improve
on this measurement by reproducing the effect of the light echoes in the
spectra of several extragalactic SNe IIb found in the literature as well as
mean SN IIb spectra recently created by Liu et al. (2016), and comparing these
to the observed light echo spectra of Cas A, including their associated
uncertainties. In order to quantify the accuracy of this comparison we smooth
the light echo spectra of Cas A using Gaussian processes and use a Monte Carlo
method to measure the absorption velocities of these three features in the
spectra. We then test the hypothesis that the diversity of ejecta velocities
seen in SNe IIb can be explained by asphericity. We do this by comparing the
range of velocities seen in the different light echoes, and hence different
lines of sight, of Cas A to that seen in the population of SNe IIb. We conclude
that these two ranges are of the same order and thus asphericity could be
enough to explain the diversity in the expansion velocity alone.
","[{""version"":""v1"",""created"":""Tue, 10 May 2016 20:00:02 GMT""},{""version"":""v2"",""created"":""Wed, 21 Sep 2016 16:31:02 GMT""}]","2016-10-19"
"1605.03187","Joanna Bridge","Joanna S. Bridge, Gregory R. Zeimann, Jonathan R. Trump, Caryl
  Gronwall, Robin Ciardullo, Derek B. Fox, Donald P. Schneider","Disentangling AGN and Star Formation Activity at High Redshift Using
  Hubble Space Telescope Grism Spectroscopy","33 pages, 13 figures, accepted to ApJ",,"10.3847/0004-637X/826/2/172",,"astro-ph.GA","http://arxiv.org/licenses/nonexclusive-distrib/1.0/","  Differentiating between active galactic nuclei (AGN) activity and star
formation in z ~ 2 galaxies is difficult because traditional methods, such as
line ratio diagnostics, change with redshift while multi-wavelength methods
(X-ray, radio, IR) are sensitive to only the brightest AGN. We have developed a
new method for spatially resolving emission lines in HST/WFC3 G141 grism
spectra and quantifying AGN activity through the spatial gradient of the [O
III]/H$\beta$ line ratio. Through detailed simulations, we show that our novel
line-ratio gradient approach identifies ~ sim 40% more low-mass and obscured
AGN than obtained by classical methods. Based on our simulations, we developed
a relationship that maps stellar mass, star formation rate, and measured [O
III]/H$\beta$ gradient to AGN Eddington ratio. We apply our technique to
previously studied stacked samples of galaxies at z ~2 and find that our
results are consistent with these studies. Using this gradient method will also
be able to inform other galaxy evolution science, such as inside-out quenching
and metallicity gradients, and will be widely applicable to future spatially
resolved JWST data.
","[{""version"":""v1"",""created"":""Tue, 10 May 2016 20:00:02 GMT""},{""version"":""v2"",""created"":""Fri, 13 May 2016 12:18:13 GMT""}]","2016-08-17"
"1605.03188","Jurij Vol\v{c}i\v{c}","Igor Klep, James Eldred Pascoe, Jurij Vol\v{c}i\v{c}","Regular and positive noncommutative rational functions",,"J. Lond. Math. Soc. 95 (2017) 613-632","10.1112/jlms.12030",,"math.RA","http://arxiv.org/licenses/nonexclusive-distrib/1.0/","  Call a noncommutative rational function $r$ regular if it has no
singularities, i.e., $r(X)$ is defined for all tuples of self-adjoint matrices
$X$. In this article regular noncommutative rational functions $r$ are
characterized via the properties of their (minimal size) linear systems
realizations $r=c^* L^{-1}b$. It is shown that $r$ is regular if and only if
$L=A_0+\sum_jA_j x_j$ is privileged. Roughly speaking, a linear pencil $L$ is
privileged if, after a finite sequence of basis changes and restrictions, the
real part of $A_0$ is positive definite and the other $A_j$ are skew-adjoint.
The second main result is a solution to a noncommutative version of Hilbert's
17th problem: a positive regular noncommutative rational function is a sum of
squares.
","[{""version"":""v1"",""created"":""Tue, 10 May 2016 20:00:02 GMT""},{""version"":""v2"",""created"":""Fri, 23 Dec 2016 22:53:53 GMT""}]","2017-11-29"
"1605.03189","Pasquale Marra","Pasquale Marra","Theoretical approach to direct resonant inelastic x-ray scattering on
  magnets and superconductors","Ph. D. thesis, IFW-Dresden and Technische Universitaet Dresden.
  Submitted in February 2015, defended in October 2015. Partially based on:
  arXiv:1405.5556, arXiv:1302.5028, arXiv:1212.0112, and arXiv:1205.4940.
  Revised version. 132 pages, 30 figures",,,,"cond-mat.supr-con cond-mat.str-el","http://arxiv.org/licenses/nonexclusive-distrib/1.0/","  The capability to probe the dispersion of elementary spin, charge, orbital,
and lattice excitations has positioned resonant inelastic x-ray scattering
(RIXS) at the forefront of photon science. In this work, we will investigate
how RIXS can contribute to a deeper understanding of the orbital properties and
of the pairing mechanism in unconventional high-temperature superconductors. In
particular, we will show how direct RIXS spectra of magnetic excitations can
reveal long-range orbital correlations in transition metal compounds, by
discriminating different kind of orbital order in magnetic and
antiferromagnetic systems. Moreover, we will show how RIXS spectra of
quasiparticle excitations in superconductors can measure the superconducting
gap magnitude, and reveal the presence of nodal points and phase differences of
the superconducting order parameter on the Fermi surface. This can reveal the
properties of the underlying pairing mechanism in unconventional
superconductors, in particular cuprates and iron pnictides, discriminating
between different superconducting order parameter symmetries, such as $s$, $d$
(singlet pairing) and $p$ wave (triplet pairing).
","[{""version"":""v1"",""created"":""Tue, 10 May 2016 20:00:03 GMT""}]","2016-05-13"
"1605.03190","Stefan Liebler","Robert V. Harlander, Stefan Liebler, Hendrik Mantler","SusHi Bento: Beyond NNLO and the heavy-top limit","35 pages, 10 figures; extended input file examples, updated
  references, matches published version","Computer Physics Communications 212C (2017) pp. 239-257","10.1016/j.cpc.2016.10.015","DESY 16-061, KA-TP-14-2016, TTK-16-14","hep-ph","http://creativecommons.org/licenses/by/4.0/","  Version 1.6.0 of the code SusHi is presented. Concerning inclusive CP-even
Higgs production in gluon fusion, the following new features with respect to
previous versions have been implemented: expansion of the partonic cross
section in the soft limit, i.e. around $x=M_H^2/\hat{s}\to 1$; N$^3$LO QCD
corrections in terms of the soft expansion; top-quark mass suppressed terms
through NNLO; matching to the cross section at $x\to 0$ through N$^3$LO. For
CP-even and -odd scalars, an efficient evaluation of the renormalization-scale
dependence is included, and effects of dimension-5 operators can be studied,
which we demonstrate for the SM Higgs boson and for a CP-even scalar with a
mass of $750$ GeV. In addition, as a generalization of the previously available
$b\bar{b}\to H$ cross section, SusHi 1.6.0 provides the cross section for
charged and neutral Higgs production in the annihilation of arbitrary heavy
quarks. At fixed order in perturbation theory, SusHi thus allows to obtain
Higgs cross-section predictions in different models to the highest precision
known today. For the SM Higgs boson of $M_H=125$ GeV, SusHi yields $48.28$ pb
for the gluon-fusion cross section at the LHC at $13$ TeV. Simultaneously,
SusHi provides the renormalization-scale uncertainty of $\pm 1.97$ pb.
","[{""version"":""v1"",""created"":""Tue, 10 May 2016 20:00:03 GMT""},{""version"":""v2"",""created"":""Mon, 28 Nov 2016 09:18:48 GMT""}]","2016-12-23"
"1605.03191","Jeremy Webb J","Jeremy J. Webb, Alison Sills, William E. Harris, Mat\'ias G\'omez,
  Maurizio Paolillo, Kristin A. Woodley, Thomas H. Puzia","Globular Cluster Scale Sizes in Giant Galaxies: Orbital Anisotropy and
  Tidally Under-filling Clusters in M87, NGC 1399, and NGC 5128","16 pages, 7 figures, 4 tables, Accepted for publication in MNRAS",,"10.1093/mnras/stw1115",,"astro-ph.GA","http://arxiv.org/licenses/nonexclusive-distrib/1.0/","  We investigate the shallow increase in globular cluster half-light radii with
projected galactocentric distance $R_{gc}$ observed in the giant galaxies M87,
NGC 1399, and NGC 5128. To model the trend in each galaxy, we explore the
effects of orbital anisotropy and tidally under-filling clusters. While a
strong degeneracy exists between the two parameters, we use kinematic studies
to help constrain the distance $R_\beta$ beyond which cluster orbits become
anisotropic, as well as the distance $R_{f\alpha}$ beyond which clusters are
tidally under-filling. For M87 we find $R_\beta > 27$ kpc and $20 < R_{f\alpha}
< 40$ kpc and for NGC 1399 $R_\beta > 13$ kpc and $10 < R_{f\alpha} < 30$ kpc.
The connection of $R_{f\alpha}$ with each galaxy's mass profile indicates the
relationship between size and $R_{gc}$ may be imposed at formation, with only
inner clusters being tidally affected. The best fitted models suggest the
dynamical histories of brightest cluster galaxies yield similar present-day
distributions of cluster properties. For NGC 5128, the central giant in a small
galaxy group, we find $R_\beta > 5$ kpc and $R_{f\alpha} > 30$ kpc. While we
cannot rule out a dependence on $R_{gc}$, NGC 5128 is well fitted by a tidally
filling cluster population with an isotropic distribution of orbits, suggesting
it may have formed via an initial fast accretion phase. Perturbations from the
surrounding environment may also affect a galaxy's orbital anisotropy profile,
as outer clusters in M87 and NGC 1399 have primarily radial orbits while outer
NGC 5128 clusters remain isotropic.
","[{""version"":""v1"",""created"":""Tue, 10 May 2016 20:00:04 GMT""}]","2016-06-15"
"1605.03192","Graeme Candlish","G. N. Candlish","The velocity field in MOND cosmology","16 pages, 18 figures. Accepted to MNRAS. References added, typos
  corrected, matches journal version",,"10.1093/mnras/stw1130",,"astro-ph.CO","http://arxiv.org/licenses/nonexclusive-distrib/1.0/","  The recently developed code for N-body/hydrodynamics simulations in Modified
Newtonian Dynamics (MOND), known as RAyMOND, is used to investigate the
consequences of MOND on structure formation in a cosmological context, with a
particular focus on the velocity field. This preliminary study investigates the
results obtained with the two formulations of MOND implemented in RAyMOND, as
well as considering the effects of changing the choice of MOND interpolation
function, and the cosmological evolution of the MOND acceleration scale. The
simulations are contrived such that structure forms in a background cosmology
that is similar to $\Lambda$CDM, but with a significantly lower matter content.
Given this, and the fact that a fully consistent MOND cosmology is still
lacking, we compare our results with a standard $\Lambda$CDM simulation, rather
than observations. As well as demonstrating the effectiveness of using RAyMOND
for cosmological simulations, it is shown that a significant enhancement of the
velocity field is likely an unavoidable consequence of the gravitational
modification implemented in MOND, and may represent a clear observational
signature of such a modification. It is further suggested that such a signal
may be clearest in intermediate density regions such as cluster outskirts and
filaments.
","[{""version"":""v1"",""created"":""Tue, 10 May 2016 20:00:35 GMT""},{""version"":""v2"",""created"":""Tue, 26 Jul 2016 16:38:46 GMT""}]","2016-07-27"
"1605.03193","Dimitrios Emmanoulopoulos","D. Emmanoulopoulos, I. M. McHardy, S. Vaughan, I. E. Papadakis","Extensive X-ray variability studies of NGC 7314 using long XMM-Newton
  observations","Accepted for publication in MNRAS. The paper is 21 pages long and
  contains 15 figures and 3 tables",,"10.1093/mnras/stw1128",,"astro-ph.HE astro-ph.CO astro-ph.GA","http://arxiv.org/licenses/nonexclusive-distrib/1.0/","  We present a detailed X-ray variability study of the low mass Active Galactic
Nuclei (AGN) NGC 7314 using the two newly obtained XMM-Newton observations
($140$ and $130$ ks), together with two archival data sets of shorter duration
($45$ and $84$ ks). The relationship between the X-ray variability
characteristics and other physical source properties (such as the black hole
mass) are still relatively poorly defined, especially for low-mass AGN. We
perform a new, fully analytical, power spectral density (PSD) model analysis
method, which will be described in detail in a forthcoming paper, that takes
into consideration the spectral distortions, caused by red-noise leak. We find
that the PSD in the $0.5-10$ keV energy range, can be represented by a bending
power-law with a bend around $6.7\times10^{-5}$ Hz, having a slope of $0.51$
and $1.99$ below and above the bend, respectively. Adding our bend time-scale
estimate, to an already published ensemble of estimates from several AGN,
supports the idea that the bend time-scale depends linearly only on the black
hole mass and not on the bolometric luminosity. Moreover, we find that as the
energy range increases, the PSD normalization increases and there is a hint
that simultaneously the high frequency slope becomes steeper. Finally, the
X-ray time-lag spectrum of NGC 7314 shows some very weak signatures of
relativistic reflection, and the energy resolved time-lag spectrum, for
frequencies around $3\times10^{-4}$ Hz, shows no signatures of X-ray
reverberation. We show that the previous claim about ks time-delays in this
source, is simply an artefact induced by the minuscule number of points
entering during the time-lag estimation in the low frequency part of the
time-lag spectrum (i.e. below $10^{-4}$ Hz).
","[{""version"":""v1"",""created"":""Tue, 10 May 2016 20:00:36 GMT""}]","2016-07-27"
"1605.03194","Francesco Valentino","F. Valentino, E. Daddi, A. Finoguenov, V. Strazzullo, A. M. C. Le
  Brun, C. Vignali, F. Bournaud, M. Dickinson, A. Renzini, M. B\'ethermin, A.
  Zanella, R. Gobat, A. Cimatti, D. Elbaz, M. Onodera, M. Pannella, M. T.
  Sargent, N. Arimoto, M. Carollo, J-L. Starck","A giant Ly$\alpha$ nebula in the core of an X-ray cluster at $z=1.99$:
  implications for early energy injection","15 pages, 11 figures, 1 appendix. Accepted for publication in ApJ",,"10.3847/0004-637X/829/1/53",,"astro-ph.GA astro-ph.CO","http://arxiv.org/licenses/nonexclusive-distrib/1.0/","  We present the discovery of a giant $\gtrsim$100~kpc Ly$\alpha$ nebula
detected in the core of the X-ray emitting cluster CL~J1449+0856 at $z=1.99$
through Keck/LRIS narrow-band imaging. This detection extends the known
relation between Ly$\alpha$ nebulae and overdense regions of the Universe to
the dense core of a $5-7\times10^{13}$ M$_{\odot}$ cluster. The most plausible
candidates to power the nebula are two Chandra-detected AGN host cluster
members, while cooling from the X-ray phase and cosmological cold flows are
disfavored primarily because of the high Ly$\alpha$ to X-ray luminosity ratio
($L_{\mathrm{Ly\alpha}}/L_{\mathrm{X}} \approx0.3$, $\gtrsim10-1000\times$
higher than in local cool-core clusters) and by current modeling. Given the
physical conditions of the Ly$\alpha$-emitting gas and the possible interplay
with the X-ray phase, we argue that the Ly$\alpha$ nebula would be short-lived
($\lesssim10$ Myr) if not continuously replenished with cold gas at a rate of
$\gtrsim1000$ M$_{\odot}$ yr$^{-1}$. We investigate the possibility that
cluster galaxies supply the required gas through outflows and we show that
their total mass outflow rate matches the replenishment necessary to sustain
the nebula. This scenario directly implies the extraction of energy from
galaxies and its deposition in the surrounding intracluster medium, as required
to explain the thermodynamic properties of local clusters. We estimate an
energy injection of the order of $\thickapprox2$ keV per particle in the
intracluster medium over a $2$ Gyr interval. In our baseline calculation AGN
provide up to $85$% of the injected energy and 2/3 of the mass, while the rest
is supplied by supernovae-driven winds.
","[{""version"":""v1"",""created"":""Tue, 10 May 2016 20:00:58 GMT""},{""version"":""v2"",""created"":""Mon, 4 Jul 2016 20:01:44 GMT""}]","2016-09-28"
"1605.03195","Jorge Abreu-Vicente","J. Abreu-Vicente, A. Stutz, Th. Henning, E. Keto, J.
  Ballesteros-Paredes, T. Robitaille","Fourier-space combination of Planck and Herschel images","Paper accepted for publications in A&A","A&A 604, A65 (2017)","10.1051/0004-6361/201628891",,"astro-ph.IM astro-ph.GA","http://arxiv.org/licenses/nonexclusive-distrib/1.0/","  Herschel has revolutionized our ability to measure column densities (N$_{\rm
H}$) and temperatures (T) of molecular clouds thanks to its far infrared
multiwavelength coverage. However, the lack of a well defined background
intensity level in the Herschel data limits the accuracy of the N$_{\rm H}$ and
T maps. We provide a method that corrects the missing Herschel background
intensity levels using the Planck model for foreground Galactic thermal dust
emission. We present a Fourier method that combines the publicly available
Planck model on large angular scales with the Herschel images on smaller
angular scales. We apply our method to two regions spanning a range of Galactic
environments: Perseus and the Galactic plane region around $l = 11\deg$
(HiGal--11). We post-process the combined dust continuum emission images to
generate column density and temperature maps. We compare these to previously
adopted constant--offset corrections. We find significant differences
($\gtrsim$20\%) over significant ($\sim$15\%) areas of the maps, at low column
densities ($N_{\rm H}\lesssim10^{22}$\,cm$^{-2}$) and relatively high
temperatures ($T\gtrsim20$\,K). We also apply our method to synthetic
observations of a simulated molecular cloud to validate our method. Our method
successfully corrects the Herschel images, including both the constant--offset
intensity level and the scale-dependent background variations measured by
Planck. Our method improves the previous constant--offset corrections, which
did not account for variations in the background emission levels.
","[{""version"":""v1"",""created"":""Tue, 10 May 2016 20:04:22 GMT""},{""version"":""v2"",""created"":""Tue, 30 Aug 2016 11:09:28 GMT""},{""version"":""v3"",""created"":""Thu, 29 Jun 2017 14:19:40 GMT""}]","2017-08-09"
"1605.03196","Grant Tremblay","Bryan Hilbert, Marco Chiaberge, JohnPaul Kotyla, Grant R. Tremblay,
  Carlo Stanghellini, William B. Sparks, Stefi A. Baum, Alessandro Capetti, F.
  Duccio Macchetto, George K. Miley, Christopher P. O'Dea, Eric S. Perlman,
  Alice C. Quillen","Powerful Activity in the Bright Ages. I. A Visible/IR Survey of High
  Redshift 3C Radio Galaxies and Quasars","25 pages, 54 figures; Accepted for publication in ApJS",,"10.3847/0067-0049/225/1/12",,"astro-ph.GA","http://arxiv.org/licenses/nonexclusive-distrib/1.0/","  We present new rest frame UV and visible observations of 22 high-redshift (1
< z < 2.5) 3C radio galaxies and QSOs obtained with the Hubble Space
Telescope's (HST) Wide Field Camera 3 (WFC3) instrument. Using a custom data
reduction strategy in order to assure the removal of cosmic rays, persistence
signal, and other data artifacts, we have produced high-quality science-ready
images of the targets and their local environments. We observe targets with
regions of UV emission suggestive of active star formation. In addition,
several targets exhibit highly distorted host galaxy morphologies in the rest
frame visible images. Photometric analyses reveals that brighter QSOs tend to
be generally redder than their dimmer counterparts. Using emission line fluxes
from the literature, we estimate that emission line contamination is relatively
small in the rest frame UV images for the QSOs. Using archival VLA data, we
have also created radio map overlays for each of our targets, allowing for
analysis of the optical and radio axes alignment.
","[{""version"":""v1"",""created"":""Tue, 10 May 2016 20:04:49 GMT""}]","2016-07-27"
"1605.03197","Dushko Kuzmanovski","Dushko Kuzmanovski, Jacob Linder, and Annica Black-Schaffer","Quantum ground state control in superconductor-silicene structures:
  $0$-$\pi$ transitions, $\varphi_0$-junctions, and Majorana bound states","5 pages, 4 figures + Supplemental material","Phys. Rev. B 94, 180505 (2016)","10.1103/PhysRevB.94.180505",,"cond-mat.supr-con","http://arxiv.org/licenses/nonexclusive-distrib/1.0/","  We demonstrate theoretically that proximity-induced superconductivity in
silicene offers the possibility to exert strong quantum ground state control.
We show that electrically controlled $0$-$\pi$ transitions occur in Josephson
junctions in the presence of an exchange field due to the buckling of the
silicene lattice. We also discover that zigzag-oriented interfaces, featuring
intervalley scattering, cause a $\varphi_0$ state with an applied electric
field. Finally, we demonstrate that Majorana bound states along the silicene
edge are tunable via the edge orientation, electric, and in-plane spin exchange
fields.
","[{""version"":""v1"",""created"":""Tue, 10 May 2016 20:07:02 GMT""},{""version"":""v2"",""created"":""Wed, 12 Oct 2016 13:41:24 GMT""},{""version"":""v3"",""created"":""Mon, 14 Nov 2016 14:26:40 GMT""}]","2016-11-15"
"1605.03198","Itzhack Dana Prof.","Moti Ben-Harush and Itzhack Dana","Generic Superweak Chaos Induced by Hall Effect",,"Physical Review E 93, 052207 (2016)","10.1103/PhysRevE.93.052207",,"nlin.CD cond-mat.mes-hall","http://arxiv.org/licenses/nonexclusive-distrib/1.0/","  We introduce and study the ""kicked Hall system"" (KHS), i.e., charged
particles periodically kicked in the presence of uniform magnetic
($\mathbf{B}$) and electric ($\mathbf{E}$) fields that are perpendicular to
each other and to the kicking direction. We show that for resonant values of
$B$ and $E$ and in the weak-chaos regime of sufficiently small nonintegrability
parameter $\kappa$ (the kicking strength), there exists a \emph{generic} family
of periodic kicking potentials for which the Hall effect from $\mathbf{B}$ and
$\mathbf{E}$ significantly suppresses the weak chaos, replacing it by
\emph{""superweak""} chaos (SWC). This means that the system behaves as if the
kicking strength were $\kappa ^2$ rather than $\kappa$. For $E=0$, SWC is known
to be a classical fingerprint of quantum antiresonance but it occurs under much
less generic conditions, in particular only for very special kicking
potentials. Manifestations of SWC are a decrease in the instability of periodic
orbits and a narrowing of the chaotic layers, relative to the ordinary
weak-chaos case. Also, for global SWC, taking place on an infinite ""stochastic
web"" in phase space, the chaotic diffusion on the web is much slower than the
weak-chaos one. Thus, the Hall effect can be relatively stabilizing for small
$\kappa$. In some special cases, the effect is shown to cause ballistic motion
for almost all parameter values. The generic global SWC on stochastic webs in
the KHS appears to be the two-dimensional closest analog to the Arnol'd web in
higher dimensional systems.
","[{""version"":""v1"",""created"":""Tue, 10 May 2016 20:10:53 GMT""}]","2016-05-12"
"1605.03199","Tooraj Ghaffary","Tooraj Ghaffary","Charged Particles Multiplicity and Scaling Violation of Fragmentation
  Functions in Electron-Positron Annihilation","13 pages",,,,"hep-ph","http://arxiv.org/licenses/nonexclusive-distrib/1.0/","  In electron positron annihilation, changing quarks into the final hadron
states is being described by fragmentation function. Based on the scaling
hypothesis, this function will be independent from the center of mass energy.
Gluon radiation violates the scaling feature. Transverse momentum distribution
plays an important role in scaling violation of fragmentation functions. In
this article, by the use of data resulted from the annihilation process of
electron positron in AMY detector at 60 GeV center of mass energy, first,
charged particles multiplicity distribution will be obtained and it will be
fitted with the KNO scaling. Furthermore, momentum spectra of charged particles
and momentum distribution respect to the jet axis will be obtained. Then, the
results will be compared regarding the different models of QCD; as well, the
distribution of fragmentation functions and scaling violations will be studied.
It is being expected that the scaling violations of the fragmentation functions
of gluon jet are stronger to the quark one. One of the reasons for such case is
that splitting function of jet is larger than splitting function of gluon.
","[{""version"":""v1"",""created"":""Tue, 10 May 2016 20:18:43 GMT""}]","2016-05-12"
