"1605.06991","Frederic Br\""unner","Frederic Br\""unner and Vyacheslav P. Spiridonov","A duality web of linear quivers","v3: 10 pages, minor corrections","Physics Letters B 761 (2016), 261-264","10.1016/j.physletb.2016.08.039",,"hep-th math-ph math.MP","http://arxiv.org/licenses/nonexclusive-distrib/1.0/","  We show that applying the Bailey lemma to elliptic hypergeometric integrals
on the $A_n$ root system leads to a large web of dualities for $\mathcal{N} =
1$ supersymmetric linear quiver theories. The superconformal index of Seiberg's
SQCD with $SU(N_c)$ gauge group and $SU(N_f)\times SU(N_f)\times U(1)$ flavour
symmetry is equal to that of $N_f-N_c-1$ distinct linear quivers. Seiberg
duality further enlarges this web by adding new quivers. In particular, both
interacting electric and magnetic theories with arbitrary $N_c$ and $N_f$ can
be constructed by quivering an $s$-confining theory with $N_f=N_c+1$.
","[{""version"":""v1"",""created"":""Mon, 23 May 2016 12:22:30 GMT""},{""version"":""v2"",""created"":""Mon, 6 Jun 2016 19:28:38 GMT""},{""version"":""v3"",""created"":""Tue, 6 Dec 2016 10:17:13 GMT""}]","2016-12-08"
"1605.06992","Sourav Dutta","Sourav Dutta","SONIK: Efficient In-situ All Item Rank Generation using Bit Operations","12 pages, 2 figures, WCSE 2016",,,,"cs.DS","http://arxiv.org/licenses/nonexclusive-distrib/1.0/","  Sorting, a classical combinatorial process, forms the bedrock of numerous
algorithms with varied applications. A related problem involves efficiently
finding the corresponding ranks of all the elements - catering to rank queries,
data partitioning and allocation, etc. Although, the element ranks can be
subsequently obtained by initially sorting the elements, such procedures
involve O(n log n) computations and might not be suitable with large input
sizes for hard real-time systems or for applications with data re-ordering
constraints. This paper proposes SONIK, a non-comparison linear time and space
algorithm using bit operations inspired by radix sort for computing the ranks
of all input integer elements, thereby providing implicit sorting. The element
ranks are generated in-situ, i.e., directly at the corresponding element
position without re-ordering or recourse to any other sorting mechanism.
","[{""version"":""v1"",""created"":""Mon, 23 May 2016 12:24:16 GMT""},{""version"":""v2"",""created"":""Thu, 23 Jun 2016 08:18:13 GMT""}]","2016-06-24"
"1605.06993","Piers Coleman","Piers Coleman","Phil Anderson's Magnetic Ideas in Science","References fully hypertexed with live links to historic papers.
  ""PWA90: A Lifetime of Emergence"", editors P. Chandra, P. Coleman, G. Kotliar,
  P. Ong, D. Stein and C. Yu, pp 187-213, World Scientific (2016)","PWA90: A Lifetime of Emergence, editors P. Chandra, P. Coleman, G.
  Kotliar, P. Ong, D. Stein and C. Yu, pp 187-213, World Scientific (2016).
  ISBN: 978-981-4733-61-8 (2016)",,,"cond-mat.str-el cond-mat.stat-mech cond-mat.supr-con physics.hist-ph","http://arxiv.org/licenses/nonexclusive-distrib/1.0/","  In Philip W. Anderson's research, magnetism has always played a special role,
providing a prism through which other more complex forms of collective behavior
and broken symmetry could be examined. I discuss his work on magnetism from the
1950s, where his early work on antiferromagnetism led to the pseudospin
treatment of superconductivity - to the 70s and 80s, highlighting his
contribution to the physics of local magnetic moments. Phil's interest in the
mechanism of moment formation, and screening evolved into the modern theory of
the Kondo effect and heavy fermions.
","[{""version"":""v1"",""created"":""Mon, 23 May 2016 12:26:30 GMT""}]","2018-06-20"
"1605.06994","Vladimir Zhuravlev","B.V. Komberg, V.I. Zhuravlev","Reflections on works by I.S.Shklovsky regarding the nature of radio
  galaxies","14 pages, 7 figures",,,,"astro-ph.GA astro-ph.HE","http://arxiv.org/licenses/nonexclusive-distrib/1.0/","  The paper is a brief overview of the works by Iosif S. Shklovsky
(1916--1985), carried out over almost 30 years (1955--1985), on the nature of
activity (primarily in the radio frequency range) in nuclei of some galaxies.
  Worthy of note is Shklovsky's pioneering work of 1962, in which he made an
attempt to consider possible evolutionary tracks of extragalactic radio sources
by constructing an analog of the Herzsprung--Russel diagram for stars (radio
luminosity at 160 MHz was taken instead of optical luminosity; total radio size
at the same frequency, as the other parameter). Later works by other authors
are also discussed, where similar diagrams were plotted using a larger
observational material.
  Special attention is paid to the evolution of Shklovsky's views regarding the
possible ways of gas getting into radio galaxies' central regions, followed by
high-velocity ejections of magnetized plasmons from their nuclei. In his
assumptions, Shklovsky was mainly based on the observational data for the
properties of the closest radio galaxy, NGC 4486 (Virgo A, M87), which he
believed to be the same reference standard for extragalactic radio astronomy as
the Crab Nebula for galactic radio astronomy.
  Shklovsky's approach to the recurrence of the activity phenomenon in galactic
nuclei and the one-sided character of radio ejections from them is discussed.
  Modern views on these issues are also briefly considered.
","[{""version"":""v1"",""created"":""Mon, 23 May 2016 12:30:39 GMT""}]","2016-06-08"
"1605.06995","Mijung Park","Mijung Park, Jimmy Foulds, Kamalika Chaudhuri, Max Welling","DP-EM: Differentially Private Expectation Maximization",,,,,"cs.LG cs.AI cs.CR stat.ME stat.ML","http://arxiv.org/licenses/nonexclusive-distrib/1.0/","  The iterative nature of the expectation maximization (EM) algorithm presents
a challenge for privacy-preserving estimation, as each iteration increases the
amount of noise needed. We propose a practical private EM algorithm that
overcomes this challenge using two innovations: (1) a novel moment perturbation
formulation for differentially private EM (DP-EM), and (2) the use of two
recently developed composition methods to bound the privacy ""cost"" of multiple
EM iterations: the moments accountant (MA) and zero-mean concentrated
differential privacy (zCDP). Both MA and zCDP bound the moment generating
function of the privacy loss random variable and achieve a refined tail bound,
which effectively decrease the amount of additive noise. We present empirical
results showing the benefits of our approach, as well as similar performance
between these two composition methods in the DP-EM setting for Gaussian mixture
models. Our approach can be readily extended to many iterative learning
algorithms, opening up various exciting future directions.
","[{""version"":""v1"",""created"":""Mon, 23 May 2016 12:36:55 GMT""},{""version"":""v2"",""created"":""Mon, 31 Oct 2016 17:17:01 GMT""}]","2016-11-01"
"1605.06996","Josef Urban","Chad Brown and Josef Urban","Extracting Higher-Order Goals from the Mizar Mathematical Library","Accepted to CICM 2016. The final publication will be available at
  Springer",,,,"cs.LO cs.AI","http://arxiv.org/licenses/nonexclusive-distrib/1.0/","  Certain constructs allowed in Mizar articles cannot be represented in
first-order logic but can be represented in higher-order logic. We describe a
way to obtain higher-order theorem proving problems from Mizar articles that
make use of these constructs. In particular, higher-order logic is used to
represent schemes, a global choice construct and set level binders. The
higher-order automated theorem provers Satallax and LEO-II have been run on
collections of these problems and the results are discussed.
","[{""version"":""v1"",""created"":""Mon, 23 May 2016 12:37:54 GMT""}]","2016-05-24"
"1605.06997","Binghai Yan","Jayita Nayak, Shu-Chun Wu, Nitesh Kumar, Chandra Shekhar, Sanjay
  Singh, J\""org Fink, Emile E. D. Rienks, Gerhard H. Fecher, Stuart S. P.
  Parkin, Binghai Yan and Claudia Felser","Multiple Dirac cones at the surface of the topological metal LaBi","18 pages including the supplementary information, 4+4 figures",,"10.1038/ncomms13942",,"cond-mat.mtrl-sci","http://arxiv.org/licenses/nonexclusive-distrib/1.0/","  The rare-earth monopnictide LaBi exhibits exotic magneto-transport properties
including an extremely large and anisotropic magnetoresistance. Experimental
evidence for topological surface states is still missing although band
inversions have been postulated to induce a topological phase in LaBi. By
employing angle-resolved photoemission spectroscopy (ARPES) in conjunction with
$ab~initio$ calculations, we have revealed the existence of surface states of
LaBi through the observation of three Dirac cones: two coexist at the corners
and one appears at the center of the Brillouin zone. The odd number of surface
Dirac cones is a direct consequence of the odd number of band inversions in the
bulk band structure, thereby proving that LaBi is a topological, compensated
semi-metal, which is equivalent to a time-reversal invariant topological
insulator. Our findings provide insight into the topological surface states of
LaBi's semi-metallicity and related magneto-transport properties.
","[{""version"":""v1"",""created"":""Mon, 23 May 2016 12:39:46 GMT""},{""version"":""v2"",""created"":""Fri, 12 Aug 2016 10:44:01 GMT""}]","2017-02-01"
"1605.06998","Paulina Plochocka Dr","A. Surrente, A. A. Mitioglu, K. Galkowski, L. Klopotowski, W. Tabis,
  B. Vignolle, D. K. Maude and P. Plochocka","Onset of exciton-exciton annihilation in single layer black phosphorus","6 pages, 5 figures","Phys. Rev. B 94, 075425 (2016)","10.1103/PhysRevB.94.075425",,"cond-mat.mes-hall","http://arxiv.org/licenses/nonexclusive-distrib/1.0/","  The exciton dynamics in monolayer black phosphorus is investigated over a
very wide range of photoexcited exciton densities using time resolved
photoluminescence. At low excitation densities, the exciton dynamics is
successfully described in terms of a double exponential decay. With increasing
exciton population, a fast, non-exponential component develops as
exciton-exciton annihilation takes over as the dominant recombination mechanism
under high excitation conditions. Our results identify an upper limit for the
injection density, after which exciton-exciton annihilation reduces the quantum
yield, which will significantly impact the performance of light emitting
devices based on single layer black phosphorus.
","[{""version"":""v1"",""created"":""Mon, 23 May 2016 12:40:30 GMT""},{""version"":""v2"",""created"":""Mon, 29 Aug 2016 06:41:55 GMT""}]","2016-08-30"
"1605.06999","Yanxia Xie Ms.","Yanxia Xie, Robert Nikutta, Lei Hao, Aigen Li","A Tale of Three Galaxies: A ""Clumpy"" View of the Spectroscopically
  Anomalous Galaxies IRAS F10398+1455, IRAS F21013-0739 and SDSS J0808+3948","23 pages, 4 figures, 2 tables; accepted for publication in Planetary
  and Space Science, special issue on ""Cosmic Dust""",,"10.1016/j.pss.2016.05.009",,"astro-ph.GA","http://arxiv.org/licenses/nonexclusive-distrib/1.0/","  We investigate the dust properties in three spectroscopically anomalous
galaxies (IRAS F10398+1455, IRAS F21013-0739 and SDSS J0808+3948). Their
Spitzer/IRS spectra are characterized by a steep ~5-8 micron emission
continuum, strong emission bands from polycyclic aromatic hydrocarbon (PAH)
molecules, and prominent 10 micron silicate emission. The steep ~5-8 micron
continuum and strong PAH emission features suggest the presence of starbursts,
while the silicate emission is indicative of significant heating from AGNs. The
simultaneous detection of these two observational properties has rarely been
reported on galactic scale. We employ the PAHFIT software to estimate their
starlight contributions, and the CLUMPY model for the components contributed by
the AGN tori. We find that the CLUMPY model is generally successful in
explaining the overall dust infrared emission, although it appears to emit too
flat at the ~5-8 micron continuum to be consistent with that observed in IRAS
F10398+1455 and IRAS F21013-0739. The flat ~5-8 micron continuum calculated
from the CLUMPY model could arise from the adopted specific silicate opacity of
Ossenkopf et al. (1992) which exceeds that of the Draine & Lee (1984)
""astronomical silicate"" by a factor up to 2 in the ~5-8 micron wavelength
range. Future models with a variety of dust species incorporated in the CLUMPY
radiation transfer regime are needed for a thorough understanding of the dust
properties of these spectroscopically anomalous galaxies.
","[{""version"":""v1"",""created"":""Mon, 23 May 2016 12:56:52 GMT""}]","2016-05-24"
"1605.07000","Seyit Hocuk","Seyit Hocuk","The role of ices in star-forming clouds","Proceedings of the 6th Zermatt ISM Symposium 2015 ""Conditions and
  Impact of Star Formation: From Lab to Space"". 4 pages, 4 figures",,"10.1051/eas/1575067",,"astro-ph.GA astro-ph.CO astro-ph.EP","http://arxiv.org/licenses/nonexclusive-distrib/1.0/","  Ices play a critical role during the evolution of interstellar clouds. Their
presence is ubiquitous in the dense molecular medium and their impact is not
only limited to chemistry. Species adsorbed onto dust grains also affect cloud
thermodynamics. It all depends on the interstellar conditions, the chemical
parameters, and the composition of ice layers. In this work, I study the
formation of ices by focusing on the interplay between gas and solid phase to
determine their role on cloud evolution and star formation. I show that while
the formation of ices greatly impacts the cloud chemistry, their role on the
thermodynamics is more conservative, and their influence on star formation is
only marginal.
","[{""version"":""v1"",""created"":""Mon, 23 May 2016 12:57:00 GMT""}]","2016-05-24"
"1605.07001","Konstantina Anastasopoulou","K. Anastasopoulou, A.Zezas, L. Ballo and R. Della Ceca","A deep Chandra observation of the interacting star-forming galaxy Arp
  299","20 pages, 14 figures, 9 tables. Accepted for publication in MNRAS",,"10.1093/mnras/stw1200",,"astro-ph.GA astro-ph.HE","http://arxiv.org/licenses/nonexclusive-distrib/1.0/","  We present results from a 90 ks Chandra ACIS-S observation of the X-ray
luminous interacting galaxy system Arp 299 (NGC 3690/IC 694). We detect 25
discrete X-ray sources with luminosities above 4.0x10^38 erg s^-1 covering the
entire Ultra Luminous X-ray source (ULX) regime. Based on the hard X-ray
spectra of the non-nuclear discrete sources identified in Arp 299, and their
association with young, actively star-forming region of Arp 299 we identify
them as HMXBs. We find in total 20 off-nuclear sources with luminosities above
the ULX limit, 14 of which are point-like sources. Furthermore we observe a
marginally significant deficit in the number of ULXs, with respect to the
number expected from scaling relations of X-ray binaries with the star
formation rate (SFR). Although the high metalicity of the galaxy could result
in lower ULX numbers, the good agreement between the observed total X-ray
luminosity of ULXs, and that expected from the relevant scaling relation
indicates that this deficit could be the result of confusion effects. The
integrated spectrum of the galaxy shows the presence of a hot gaseous component
with kT = 0.72+-0.03 keV, contributing 20% of the soft (0.1-2.0 keV) unabsorbed
luminosity of the galaxy. A plume of soft X-ray emission in the west of the
galaxy indicates a large scale outflow. We find that the AGN in NGC 3690
contributes only 22% of the observed broad-band X-ray luminosity of Arp 299.
","[{""version"":""v1"",""created"":""Mon, 23 May 2016 12:59:01 GMT""}]","2016-06-01"
"1605.07002","Marinus Gottschau","Marinus Gottschau","Bootstrap Percolation on Degenerate Graphs","The results presented in this paper were part of my Master Thesis
  written at the Technische Universitaet Muenchen supervised by Nina Gantert",,,,"math.CO","http://arxiv.org/licenses/nonexclusive-distrib/1.0/","  In this paper we focus on $r$-neighbor bootstrap percolation, which is a
process on a graph where initially a set $A_0$ of vertices gets infected. Now
subsequently, an uninfected vertex becomes infected if it is adjacent to at
least $r$ infected vertices. Call $A_f$ the set of vertices that is infected
after the process stops. More formally set $A_t:=A_{t-1}\cup \{v\in V:
|N(v)\cap A_{t-1}|\geq r\}$, where $N(v)$ is the neighborhood of $v$. Then
$A_f=\bigcup_{t>0} A_t$. We deal with finite graphs only and denote by $n$ the
number of vertices. We are mainly interested in the size of the final set
$A_f$. We present a theorem for degenerate graphs that bounds the size of the
final infected set. More precisely for a $d$-degenerate graph, if $r>d$, we
bound the size set $A_f$ from above by $(1+\tfrac{d}{r-d})|A_0|$.
","[{""version"":""v1"",""created"":""Mon, 23 May 2016 13:00:13 GMT""}]","2016-05-24"
"1605.07003","Afonso Teodoro","Afonso M. Teodoro, Jos\'e M. Bioucas-Dias, M\'ario A. T. Figueiredo","Image Restoration with Locally Selected Class-Adapted Models",,,,,"cs.CV","http://arxiv.org/licenses/nonexclusive-distrib/1.0/","  State-of-the-art algorithms for imaging inverse problems (namely deblurring
and reconstruction) are typically iterative, involving a denoising operation as
one of its steps. Using a state-of-the-art denoising method in this context is
not trivial, and is the focus of current work. Recently, we have proposed to
use a class-adapted denoiser (patch-based using Gaussian mixture models) in a
so-called plug-and-play scheme, wherein a state-of-the-art denoiser is plugged
into an iterative algorithm, leading to results that outperform the best
general-purpose algorithms, when applied to an image of a known class (e.g.
faces, text, brain MRI). In this paper, we extend that approach to handle
situations where the image being processed is from one of a collection of
possible classes or, more importantly, contains regions of different classes.
More specifically, we propose a method to locally select one of a set of
class-adapted Gaussian mixture patch priors, previously estimated from clean
images of those classes. Our approach may be seen as simultaneously performing
segmentation and restoration, thus contributing to bridging the gap between
image restoration/reconstruction and analysis.
","[{""version"":""v1"",""created"":""Mon, 23 May 2016 13:00:38 GMT""},{""version"":""v2"",""created"":""Tue, 2 Aug 2016 09:37:11 GMT""}]","2016-08-03"
"1605.07005","Sergey Skipetrov E","S.E. Skipetrov","Finite-size scaling analysis of localization transition for scalar waves
  in a 3D ensemble of resonant point scatterers","11 pages, 10 figures, revised manuscript","Phys. Rev. B 94, 064202 (2016)","10.1103/PhysRevB.94.064202",,"cond-mat.dis-nn physics.optics","http://arxiv.org/licenses/nonexclusive-distrib/1.0/","  We use the random Green's matrix model to study the scaling properties of the
localization transition for scalar waves in a three-dimensional (3D) ensemble
of resonant point scatterers. We show that the probability density $p(g)$ of
normalized decay rates of quasi-modes $g$ is very broad at the transition and
in the localized regime and that it does not obey a single-parameter scaling
law for finite system sizes that we can access. The single-parameter scaling
law holds, however, for the small-$g$ part of $p(g)$ which we exploit to
estimate the critical exponent $\nu$ of the localization transition.
Finite-size scaling analysis of small-$q$ percentiles $g_q$ of $p(g)$ yields an
estimate $\nu \simeq 1.55 \pm 0.07$. This value is consistent with previous
results for Anderson transition in the 3D orthogonal universality class and
suggests that the localization transition under study belongs to the same
class.
","[{""version"":""v1"",""created"":""Mon, 23 May 2016 13:18:18 GMT""},{""version"":""v2"",""created"":""Thu, 4 Aug 2016 15:14:38 GMT""}]","2016-08-30"
"1605.07006","Valerio Lucarini","Valerio Lucarini, Davide Faranda, Ana Cristina Moreira Freitas, Jorge
  Milhazes Freitas, Tobias Kuna, Mark Holland, Matthew Nicol, Mike Todd, Sandro
  Vaienti","Extremes and Recurrence in Dynamical Systems","305 pages book, V. Lucarini, D. Faranda, A. C. M. Freitas, J. M.
  Freitas, T. Kuna, M. Holland, M. Nicol, M. Todd, S. Vaienti, Extremes and
  Recurrence in Dynamical Systems, Wiley, New York, 2016, ISBN:
  978-1-118-63219-2",,,,"math.DS cond-mat.stat-mech math-ph math.MP math.PR nlin.CD","http://arxiv.org/licenses/nonexclusive-distrib/1.0/","  This book provides a comprehensive introduction for the study of extreme
events in the context of dynamical systems. The introduction provides a broad
overview of the interdisciplinary research area of extreme events, underlining
its relevance for mathematics, natural sciences, engineering, and social
sciences. After exploring the basics of the classical theory of extreme events,
the book presents a careful examination of how a dynamical system can serve as
a generator of stochastic processes, and explores in detail the relationship
between the hitting and return time statistics of a dynamical system and the
possibility of constructing extreme value laws for given observables. Explicit
derivation of extreme value laws are then provided for selected dynamical
systems. The book then discusses how extreme events can be used as probes for
inferring fundamental dynamical and geometrical properties of a dynamical
system and for providing a novel point of view in problems of physical and
geophysical relevance. A final summary of the main results is then presented
along with a discussion of open research questions. Finally, an appendix with
software in Matlab programming language allows the readers to develop further
understanding of the presented concepts.
","[{""version"":""v1"",""created"":""Mon, 23 May 2016 13:19:33 GMT""}]","2016-05-24"
"1605.07007","Eesa Nikahd","Eesa Nikahd, Mehdi Sedighi and Morteza Saheb Zamani","Non-Uniform Code Concatenation for Universal Fault-Tolerant Quantum
  Computing","6 pages and 4 figures","Phys. Rev. A 96, 032337 (2017)","10.1103/PhysRevA.96.032337",,"quant-ph","http://arxiv.org/licenses/nonexclusive-distrib/1.0/","  Using transversal gates is a straightforward and efficient technique for
fault-tolerant quantum computing. Since transversal gates alone cannot be
computationally universal, they must be combined with other approaches such as
magic state distillation, code switching or code concatenation in order to
achieve universality. In this paper we propose an alternative approach for
universal fault-tolerant quantum computing mainly based on the code
concatenation approach proposed in [PRL 112, 010505 (2014)] but in a
non-uniform fashion. The proposed approach is described based on non-uniform
concatenation of the 7-qubit Steane code with the 15-qubit Reed-Muller code as
well as the 5-qubit code with the 15-qubit Reed-Muller code, which lead to two
49-qubit and 47-qubit codes, respectively. These codes can correct any
arbitrary single physical error with the ability to perform a universal set of
fault-tolerant gates, without using magic state distillation.
","[{""version"":""v1"",""created"":""Mon, 23 May 2016 13:24:41 GMT""},{""version"":""v2"",""created"":""Mon, 30 May 2016 08:32:20 GMT""},{""version"":""v3"",""created"":""Wed, 2 Nov 2016 12:16:28 GMT""}]","2017-10-04"
"1605.07008","Sebastian B\""ock","Sebastian B\""ock, Filip Korzeniowski, Jan Schl\""uter, Florian Krebs,
  Gerhard Widmer","madmom: a new Python Audio and Music Signal Processing Library",,,,,"cs.SD","http://arxiv.org/licenses/nonexclusive-distrib/1.0/","  In this paper, we present madmom, an open-source audio processing and music
information retrieval (MIR) library written in Python. madmom features a
concise, NumPy-compatible, object oriented design with simple calling
conventions and sensible default values for all parameters, which facilitates
fast prototyping of MIR applications. Prototypes can be seamlessly converted
into callable processing pipelines through madmom's concept of Processors,
callable objects that run transparently on multiple cores. Processors can also
be serialised, saved, and re-run to allow results to be easily reproduced
anywhere. Apart from low-level audio processing, madmom puts emphasis on
musically meaningful high-level features. Many of these incorporate machine
learning techniques and madmom provides a module that implements some in MIR
commonly used methods such as hidden Markov models and neural networks.
Additionally, madmom comes with several state-of-the-art MIR algorithms for
onset detection, beat, downbeat and meter tracking, tempo estimation, and piano
transcription. These can easily be incorporated into bigger MIR systems or run
as stand-alone programs.
","[{""version"":""v1"",""created"":""Mon, 23 May 2016 13:29:09 GMT""}]","2016-05-25"
"1605.07009","Abdullah Al-Dujaili","Abdullah Al-Dujaili and S. Suresh","BMOBench: Black-Box Multi-Objective Optimization Benchmarking Platform","supplement materials for Multi-Objective Simultaneous Optimistic
  Optimization (Information Sciences)",,,,"math.OC cs.NE","http://arxiv.org/licenses/nonexclusive-distrib/1.0/","  This document briefly describes the Black-Box Multi-Objective Optimization
Benchmarking (BMOBench) platform. It presents the test problems, evaluation
procedure, and experimental setup. To this end, the BMOBench is demonstrated by
comparing recent multi-objective solvers from the literature, namely SMS-EMOA,
DMS, and MO-SOO.
","[{""version"":""v1"",""created"":""Mon, 23 May 2016 13:31:59 GMT""},{""version"":""v2"",""created"":""Sat, 1 Jul 2017 16:45:35 GMT""}]","2017-07-04"
