"1605.06935","Eleonore Saquet","E. Saquet, N. Emelyanov, F. Colas, J.-E. Arlot, V. Robert, B.
  Christophe, O. Dechambre","Eclipses of the inner satellites of Jupiter observed in 2015","7 pages, 10 figures, 4 tables","A&A 591, A42 (2016)","10.1051/0004-6361/201628246",,"astro-ph.EP","http://arxiv.org/licenses/nonexclusive-distrib/1.0/","  During the 2014-2015 campaign of mutual events, we recorded ground-based
photometric observations of eclipses of Amalthea (JV) and, for the first time,
Thebe (JXIV) by the Galilean moons. We focused on estimating whether the
positioning accuracy of the inner satellites determined with photometry is
sufficient for dynamical studies. We observed two eclipses of Amalthea and one
of Thebe with the 1 m telescope at Pic du Midi Observatory using an IR filter
and a mask placed over the planetary image to avoid blooming features. A third
observation of Amalthea was taken at Saint-Sulpice Observatory with a 60 cm
telescope using a methane filter (890 nm) and a deep absorption band to
decrease the contrast between the planet and the satellites. After background
removal, we computed a differential aperture photometry to obtain the light
flux, and followed with an astrometric reduction. We provide astrometric
results with an external precision of 53 mas for the eclipse of Thebe, and 20
mas for that of Amalthea. These observation accuracies largely override
standard astrometric measurements. The (O-C)s for the eclipse of Thebe are 75
mas on the X-axis and 120 mas on the Y-axis. The (O-C)s for the total eclipses
of Amalthea are 95 mas and 22 mas, along the orbit, for two of the three
events. Taking into account the ratio of (O-C) to precision of the astrometric
results, we show a significant discrepancy with the theory established by
Avdyushev and Ban'shikova in 2008, and the JPL JUP 310 ephemeris.
","[{""version"":""v1"",""created"":""Mon, 23 May 2016 08:47:53 GMT""}]","2016-06-08"
"1605.06936","Jisho Miyazaki","Jisho Miyazaki","Composite systems and state transformations in topos quantum theory","Corrections on thoerems, some new theorems, and different
  presentations of results. Title changed. Submitted to Foundation of Physics",,,,"quant-ph math-ph math.MP","http://arxiv.org/licenses/nonexclusive-distrib/1.0/","  Topos quantum theory provides representations of quantum states as direct
generalizations of the probability distribution, namely probability valuation.
In this article, we consider extensions of a known bijective correspondence
between quantum states and probability valuations to composite systems and to
state transformations. We show that multipartite probability valuations on
composite systems have a bijective correspondence to positive over pure tensor
states, according to a candidate definition of the composite systems in topos
quantum theory. Among the multipartite probability valuations, a special
attention is placed to Markov chains which are defined by generalizing
classical Markov chains from probability theory. We find an incompatibility
between the multipartite probability valuations and a monogamy property of
quantum states, which trivializes the Markov chains to product probability
valuations. Several observations on the transformations of probability
valuations are deduced from the results on multipartite probability valuations,
through duality relations between multipartite states and state
transformations.
","[{""version"":""v1"",""created"":""Mon, 23 May 2016 08:49:18 GMT""},{""version"":""v2"",""created"":""Wed, 17 May 2017 09:54:12 GMT""}]","2017-05-18"
"1605.06937","Vladimir Garc\'ia-Morales","Vladimir Garc\'ia-Morales","Diagrammatic approach to cellular automata and the emergence of form
  with inner structure","26 pages, 8 figures, some few minor corrections introduced to match
  the final, published version","Commun. Nonlinear Sci. Numer. Simulat. 63 (2018) 117","10.1016/j.cnsns.2018.02.041",,"nlin.CG math-ph math.MP nlin.AO nlin.PS","http://arxiv.org/licenses/nonexclusive-distrib/1.0/","  We present a diagrammatic method to build up sophisticated cellular automata
(CAs) as models of complex physical systems. The diagrams complement the
mathematical approach to CA modeling, whose details are also presented here,
and allow CAs in rule space to be classified according to their hierarchy of
layers. Since the method is valid for any discrete operator and only depends on
the alphabet size, the resulting conclusions, of general validity, apply to CAs
in any dimension or order in time, arbitrary neighborhood ranges and topology.
We provide several examples of the method, illustrating how it can be applied
to the mathematical modeling of the emergence of order out of disorder.
Specifically, we show how the the majority CA rule can be used as a building
block to construct more complex cellular automata in which separate domains
(with substructures having different dynamical properties) are able to emerge
out of disorder and coexist in a stable manner.
","[{""version"":""v1"",""created"":""Mon, 23 May 2016 08:50:00 GMT""},{""version"":""v2"",""created"":""Thu, 9 Jun 2016 17:10:02 GMT""},{""version"":""v3"",""created"":""Mon, 2 Apr 2018 08:10:56 GMT""}]","2018-04-03"
"1605.06938","Matija Pretnar","Ohad Kammar and Matija Pretnar","No value restriction is needed for algebraic effects and handlers",,"Journal of Functional Programming, 27, 2017","10.1017/S0956796816000320.",,"cs.PL cs.LO","http://arxiv.org/licenses/nonexclusive-distrib/1.0/","  We present a straightforward, sound Hindley-Milner polymorphic type system
for algebraic effects and handlers in a call-by-value calculus, which allows
type variable generalisation of arbitrary computations, not just values. This
result is surprising. On the one hand, the soundness of unrestricted
call-by-value Hindley-Milner polymorphism is known to fail in the presence of
computational effects such as reference cells and continuations. On the other
hand, many programming examples can be recast to use effect handlers instead of
these effects. Analysing the expressive power of effect handlers with respect
to state effects, we claim handlers cannot express reference cells, and show
they can simulate dynamically scoped state.
","[{""version"":""v1"",""created"":""Mon, 23 May 2016 08:51:36 GMT""}]","2017-04-20"
"1605.06939","Andr\'as L\'aszl\'o","Andras Laszlo, Gergo Hamar, Gabor Kiss, Dezso Varga","Single electron multiplication distribution in GEM avalanches","27 pages, 18 figures","Journal of Instrumentation 11 (2016) P10017","10.1088/1748-0221/11/10/P10017",,"physics.ins-det hep-ex nucl-ex","http://arxiv.org/licenses/nonexclusive-distrib/1.0/","  In this paper, measurement results and experimental methodology are presented
on the determination of multiplication distributions of avalanches initiated by
single electron in GEM foils. The measurement relies on the amplification of
photoelectrons by the GEM under study, which is subsequently amplified in an
MWPC for signal enhancement and readout. The intrinsic detector resolution,
namely the sigma-over-mean ratio of the multiplication. distribution is also
elaborated. Small gain dependence of the shape of the avalanche response
distribution is observed in the range of net effective gain of 15 to 100. The
distribution has an exponentially decaying tail at large amplitudes. At small
amplitudes, the applied working gas is seen to have a well visible effect on
the shape of the multiplication distribution. Equivalently, the working gas has
an influence on the intrinsic detector resolution of GEMs via suppression of
the low amplitude responses. A sigma-over-mean ratio of 0.75 was reached using
a neon based mixture, whereas other gases provided an intrinsic detector
resolution closer to 1, meaning a multiplication distribution closer to the
low-field limit exponential case.
","[{""version"":""v1"",""created"":""Mon, 23 May 2016 08:53:01 GMT""},{""version"":""v2"",""created"":""Tue, 2 Aug 2016 11:05:34 GMT""},{""version"":""v3"",""created"":""Tue, 25 Oct 2016 11:17:58 GMT""}]","2016-10-26"
"1605.06940","Barry Hurley","Barry Hurley, Deepak Mehta, Barry O'Sullivan","Elastic Solver: Balancing Solution Time and Energy Consumption","Keywords: Combinatorial Optimisation, Energy Minimisation, Parallel
  Solving",,,,"cs.AI cs.DC","http://arxiv.org/licenses/nonexclusive-distrib/1.0/","  Combinatorial decision problems arise in many different domains such as
scheduling, routing, packing, bioinformatics, and many more. Despite recent
advances in developing scalable solvers, there are still many problems which
are often very hard to solve. Typically the most advanced solvers include
elements which are stochastic in nature. If a same instance is solved many
times using different seeds then depending on the inherent characteristics of a
problem instance and the solver, one can observe a highly-variant distribution
of times spanning multiple orders of magnitude. Therefore, to solve a problem
instance efficiently it is often useful to solve the same instance in parallel
with different seeds. With the proliferation of cloud computing, it is natural
to think about an elastic solver which can scale up by launching searches in
parallel on thousands of machines (or cores). However, this could result in
consuming a lot of energy. Moreover, not every instance would require thousands
of machines. The challenge is to resolve the tradeoff between solution time and
energy consumption optimally for a given problem instance. We analyse the
impact of the number of machines (or cores) on not only solution time but also
on energy consumption. We highlight that although solution time always drops as
the number of machines increases, the relation between the number of machines
and energy consumption is more complicated. In many cases, the optimal energy
consumption may be achieved by a middle ground, we analyse this relationship in
detail. The tradeoff between solution time and energy consumption is studied
further, showing that the energy consumption of a solver can be reduced
drastically if we increase the solution time marginally. We also develop a
prediction model, demonstrating that such insights can be exploited to achieve
faster solutions times in a more energy efficient manor.
","[{""version"":""v1"",""created"":""Mon, 23 May 2016 08:54:27 GMT""}]","2016-05-24"
"1605.06941","Xuetao Zhu","Shuyuan Zhang, Jiaqi Guan, Xun Jia, Bing Liu, Weihua Wang, Fangsen Li,
  Lili Wang, Xucun Ma, Qikun Xue, Jiandi Zhang, E. W. Plummer, Xuetao Zhu, and
  Jiandong Guo","The Role of SrTiO3 Phonon Penetrating into thin FeSe Films in the
  Enhancement of Superconductivity","Main text: 6 pages, 3 figures; Supplementary Material: 8 pages, 6
  figures. An error in the EPC constant calculation was corrected in this
  version and several new references are added. The authors would like to thank
  Dr. Yan Wang (University of Tennessee) for pointing out the error","Phys. Rev. B 94, 081116 (2016)","10.1103/PhysRevB.94.081116",,"cond-mat.supr-con","http://arxiv.org/licenses/nonexclusive-distrib/1.0/","  The significant role of interfacial coupling on the superconductivity
enhancement in FeSe films on SrTiO3 has been widely recognized. But the
explicit origination of this coupling is yet to be identified. Here by surface
phonon measurements using high resolution electron energy loss spectroscopy, we
found electric field generated by Fuchs-Kliewer (F-K) phonon modes of SrTiO3
can penetrate into FeSe films and strongly interact with electrons therein. The
mode-specific electron-phonon coupling (EPC) constant for the ~92 meV F-K
phonon is ~0.25 in the single-layer FeSe on SrTiO3. With increasing FeSe
thickness, the penetrating field intensity decays exponentially, which matches
well the observed exponential decay of the superconducting gap. It is
unambiguously shown that the SrTiO3 F-K phonon penetrating into FeSe is
essential in the interfacial superconductivity enhancement.
","[{""version"":""v1"",""created"":""Mon, 23 May 2016 09:04:06 GMT""},{""version"":""v2"",""created"":""Wed, 10 Aug 2016 06:58:22 GMT""}]","2016-09-07"
"1605.06942","Nuno C. Santos","N. C. Santos, A. Santerne, J. P. Faria, J. Rey, A. C. M. Correia, J.
  Laskar, S. Udry, V. Adibekyan, F. Bouchy, E. Delgado-Mena, C. Melo, X.
  Dumusque, G. H\'ebrard, C. Lovis, M. Mayor, M. Montalto, A. Mortier, F. Pepe,
  P. Figueira, J. Sahlmann, D. S\'egransan, S. G. Sousa","An extreme planetary system around HD219828. One long-period super
  Jupiter to a hot-neptune host star","Astronomy & Astrophysics, in press","A&A 592, A13 (2016)","10.1051/0004-6361/201628374",,"astro-ph.EP","http://arxiv.org/licenses/nonexclusive-distrib/1.0/","  With about 2000 extrasolar planets confirmed, the results show that planetary
systems have a whole range of unexpected properties. We present a full
investigation of the HD219828 system, a bright metal-rich star for which a hot
neptune has previously been detected. We used a set of HARPS, SOPHIE, and
ELODIE radial velocities to search for the existence of orbiting companions to
HD219828. A dynamical analysis is also performed to study the stability of the
system and to constrain the orbital parameters and planet masses. We announce
the discovery of a long period (P=13.1years) massive (msini=15.1MJup) companion
(HD219828c) in a very eccentric orbit (e=0.81). The same data confirms the
existence of a hot-neptune, HD219828b, with a minimum mass of 21 MEarth and a
period of 3.83days. The dynamical analysis shows that the system is stable. The
HD219828 system is extreme and unique in several aspects. First, among all
known exoplanet systems it presents an unusually high mass ratio. We also show
that systems like HD219828, with a hot neptune and a long-period massive
companion are more frequent than similar systems with a hot jupiter instead.
This suggests that the formation of hot neptunes follows a different path than
the formation of their hot jovian counterparts. The high mass, long period, and
eccentricity of HD219828c also make it a good target for Gaia astrometry as
well as a potential target for atmospheric characterisation, using direct
imaging or high-resolution spectroscopy. Astrometric observations will allow us
to derive its real mass and orbital configuration. If a transit of HD219828b is
detected, we will be able to fully characterise the system, including the
relative orbital inclinations. With a clearly known mass, HD219828c may become
a benchmark object for the range in between giant planets and brown dwarfs.
","[{""version"":""v1"",""created"":""Mon, 23 May 2016 09:04:14 GMT""}]","2016-07-06"
"1605.06943","Nitin Tiwari S.","Nitin S. Tiwari, Koen Merkus and Paul van der Schoot","Dynamic Landau Theory for Supramolecular Self-Assembly","in The European Physical Journal E, 2015",,"10.1140/epje/i2015-15105-5",,"cond-mat.soft","http://arxiv.org/licenses/nonexclusive-distrib/1.0/","  Although pathway-specific kinetic theories are fundamentally important to
describe and under- stand reversible polymerisation kinetics, they come in
principle at a cost of having a large number of system-specific parameters.
Here, we construct a dynamical Landau theory to describe the kinetics of
activated linear supramolecular self-assembly, which drastically reduces the
number of parameters and still describes most of the interesting and generic
behavior of the system in hand. This phenomenological approach hinges on the
fact that if nucleated, the polymerisation transition resembles a phase
transition. We are able to describe hysteresis, overshooting, undershooting and
the existence of a lag time before polymerisation takes o?, and pinpoint the
conditions required for observing these types of phenomenon in the assembly and
disassembly kinetics. We argue that the phenomenological kinetic parameter in
our theory is a pathway controller, i.e., it controls the relative weights of
the molecular pathways through which self-assembly takes place.
","[{""version"":""v1"",""created"":""Mon, 23 May 2016 09:05:27 GMT""}]","2016-10-04"
"1605.06944","Roberto La Scala","Roberto La Scala","Computing minimal free resolutions of right modules over noncommutative
  algebras","23 pages, to appear in Journal of Algebra",,,,"math.RA math.AC","http://arxiv.org/licenses/nonexclusive-distrib/1.0/","  In this paper we propose a general method for computing a minimal free right
resolution of a finitely presented graded right module over a finitely
presented graded noncommutative algebra. In particular, if such module is the
base field of the algebra then one obtains its graded homology. The approach is
based on the possibility to obtain the resolution via the computation of
syzygies for modules over commutative algebras. The method behaves
algorithmically if one bounds the degree of the required elements in the
resolution. Of course, this implies a complete computation when the resolution
is a finite one. Finally, for a monomial right module over a monomial algebra
we provide a bound for the degrees of the non-zero Betti numbers of any single
homological degree in terms of the maximal degree of the monomial relations of
the module and the algebra.
","[{""version"":""v1"",""created"":""Mon, 23 May 2016 09:07:13 GMT""},{""version"":""v2"",""created"":""Thu, 9 Feb 2017 16:48:53 GMT""},{""version"":""v3"",""created"":""Fri, 3 Mar 2017 08:29:46 GMT""}]","2017-03-06"
"1605.06945","Hinnerk Christian Schmidt","Christian Schmidt, Nils-Eric Guenther, Lenka Zdeborov\'a","Circular Coloring of Random Graphs: Statistical Physics Investigation","19 pages, 8 figures, 3 tables","J. Stat. Mech. (2016) 083303","10.1088/1742-5468/2016/08/083303",,"cond-mat.dis-nn cond-mat.stat-mech","http://arxiv.org/licenses/nonexclusive-distrib/1.0/","  Circular coloring is a constraints satisfaction problem where colors are
assigned to nodes in a graph in such a way that every pair of connected nodes
has two consecutive colors (the first color being consecutive to the last). We
study circular coloring of random graphs using the cavity method. We identify
two very interesting properties of this problem. For sufficiently many color
and sufficiently low temperature there is a spontaneous breaking of the
circular symmetry between colors and a phase transition forwards a
ferromagnet-like phase. Our second main result concerns 5-circular coloring of
random 3-regular graphs. While this case is found colorable, we conclude that
the description via one-step replica symmetry breaking is not sufficient. We
observe that simulated annealing is very efficient to find proper colorings for
this case. The 5-circular coloring of 3-regular random graphs thus provides a
first known example of a problem where the ground state energy is known to be
exactly zero yet the space of solutions probably requires a full-step replica
symmetry breaking treatment.
","[{""version"":""v1"",""created"":""Mon, 23 May 2016 09:13:32 GMT""}]","2016-08-31"
"1605.06946","Ivan S. Yaroslavtsev","Ivan S. Yaroslavtsev","Brownian representations of cylindrical continuous local martingales","Minor revision","Infin. Dimens. Anal. Quantum Probab. Relat. Top. 21 (2018), no. 2,
  1850013, 25 pp","10.1142/S0219025718500133",,"math.PR math.FA","http://arxiv.org/licenses/nonexclusive-distrib/1.0/","  In this paper we give necessary and sufficient conditions for a cylindrical
continuous local martingale to be the stochastic integral with respect to a
cylindrical Brownian motion. In particular we consider the class of cylindrical
martingales with closed operator-generated covariations. We also prove that for
every cylindrical continuous local martingale $M$ there exists a time change
$\tau$ such that $M\circ \tau$ is Brownian representable.
","[{""version"":""v1"",""created"":""Mon, 23 May 2016 09:13:35 GMT""},{""version"":""v2"",""created"":""Thu, 18 Aug 2016 10:48:25 GMT""},{""version"":""v3"",""created"":""Thu, 22 Jun 2017 14:03:15 GMT""}]","2018-11-07"
"1605.06947","Petr Somberg","Petr Somberg, Petr Zima","Killing spinor-valued forms and the cone construction",,,,,"math.DG math-ph math.AP math.MP math.RT","http://arxiv.org/licenses/nonexclusive-distrib/1.0/","  On a pseudo-Riemannian manifold $\mathcal{M}$ we introduce a system of
partial differential Killing type equations for spinor-valued differential
forms, and study their basic properties. We discuss the relationship between
solutions of Killing equations on $\mathcal{M}$ and parallel fields on the
metric cone over $\mathcal{M}$ for spinor-valued forms.
","[{""version"":""v1"",""created"":""Mon, 23 May 2016 09:16:03 GMT""}]","2016-05-24"
"1605.06948","Ioan Badulescu","A. I. Badulescu, G. Henniart","Shintani relation for base change: unitary and elliptic representations","Advances in the Theory of Automorphic Forms and Their L-functions, in
  honor of James Cogdell's 60th birthday, Contemporary Mathematics 664, 2016,
  Editors D. Jiang, F. Shahidi and D. Soudry, pages 23-67",,,,"math.NT","http://arxiv.org/licenses/nonexclusive-distrib/1.0/","  Let $E/F$ be a cyclic extension of $p$-adic fields and $n$ a positive
integer. Arthur and Clozel constructed a base change process $\pi\mapsto \pi_E$
which associates to a smooth irreducible representation of $GL_n(F)$ a smooth
irreducible representation of $GL_n(E)$, invariant under $Gal(E/F)$. When $\pi$
is tempered, $\pi_E$ is tempered and is characterized by an identity (the
Shintani character relation) relating the character of $\pi$ to the character
of $\pi_E$ twisted by the action of $Gal(E/F)$. In this paper we show that the
Shintani relation also holds when $\pi$ is unitary or elliptic. We prove
similar results for the extension $C/R$. As a corollary we show that for a
cyclic extension $E/F$ of number fields the base change for automorphic
residual representations of the ad\`ele group $GL_n(A_F)$ respects the Shintani
relation at each place of $F$.
","[{""version"":""v1"",""created"":""Mon, 23 May 2016 09:18:21 GMT""}]","2016-05-24"
"1605.06949","Ilario Giordanelli","I. Giordanelli, M. Mendoza, J. S. Andrade, Jr., M. A. F. Gomes, H. J.
  Herrmann","Crumpling Damaged Graphene",,"Scientific Reports 6 (2016): 25891","10.1038/srep25891",,"cond-mat.mes-hall physics.comp-ph","http://arxiv.org/licenses/nonexclusive-distrib/1.0/","  Through molecular mechanics we find that non-covalent interactions modify the
fractality of crumpled damaged graphene. Pristine graphene membranes are
damaged by adding random vacancies and carbon-hydrogen bonds. Crumpled
membranes exhibit a fractal dimension of $ 2.71 \pm 0.02$ when all interactions
between carbon atoms are considered, and $2.30 \pm 0.05$ when non-covalent
interactions are suppressed. The transition between these two values, obtained
by switching on/off the non-covalent interactions of equilibrium
configurations, is shown to be reversible and independent on thermalisation. In
order to explain this transition, we propose a theoretical model that is
compatible with our numerical findings. Finally, we also compare damaged
graphene membranes with other crumpled structures, as for instance, polymerised
membranes and paper sheets, that share similar scaling properties.
","[{""version"":""v1"",""created"":""Mon, 23 May 2016 09:22:33 GMT""}]","2016-05-24"
"1605.06950","James Newling","James Newling, Fran\c{c}ois Fleuret","A Sub-Quadratic Exact Medoid Algorithm","Version 2: Added acknowledgements, Version 3: Post-acceptance at
  AISTATS 2017, Version 4: N-1 -> N denominator correction",,,,"stat.ML cs.DS cs.LG","http://arxiv.org/licenses/nonexclusive-distrib/1.0/","  We present a new algorithm, trimed, for obtaining the medoid of a set, that
is the element of the set which minimises the mean distance to all other
elements. The algorithm is shown to have, under certain assumptions, expected
run time O(N^(3/2)) in R^d where N is the set size, making it the first
sub-quadratic exact medoid algorithm for d>1. Experiments show that it performs
very well on spatial network data, frequently requiring two orders of magnitude
fewer distance calculations than state-of-the-art approximate algorithms. As an
application, we show how trimed can be used as a component in an accelerated
K-medoids algorithm, and then how it can be relaxed to obtain further
computational gains with only a minor loss in cluster quality.
","[{""version"":""v1"",""created"":""Mon, 23 May 2016 09:24:59 GMT""},{""version"":""v2"",""created"":""Mon, 30 May 2016 07:44:29 GMT""},{""version"":""v3"",""created"":""Tue, 11 Apr 2017 07:55:33 GMT""},{""version"":""v4"",""created"":""Wed, 12 Apr 2017 18:25:34 GMT""}]","2017-04-14"
"1605.06951","Rodney Van Meter","Rodney Van Meter and Simon J. Devitt","Local and Distributed Quantum Computation","30 pages, 4 figures, 143 references","IEEE Computer 49(9), 31-42, Sept. 2016","10.1109/MC.2016.291",,"quant-ph","http://arxiv.org/licenses/nonexclusive-distrib/1.0/","  Experimental groups are now fabricating quantum processors powerful enough to
execute small instances of quantum algorithms and definitively demonstrate
quantum error correction that extends the lifetime of quantum data, adding
urgency to architectural investigations. Although other options continue to be
explored, effort is coalescing around topological coding models as the most
practical implementation option for error correction on realizable
microarchitectures. Scalability concerns have also motivated architects to
propose distributed memory multicomputer architectures, with experimental
efforts demonstrating some of the basic building blocks to make such designs
possible. We compile the latest results from a variety of different systems
aiming at the construction of a scalable quantum computer.
","[{""version"":""v1"",""created"":""Mon, 23 May 2016 09:33:14 GMT""}]","2016-09-23"
