"1605.06882","Stephan Holzer","Benjamin Dissler, Stephan Holzer, Roger Wattenhofer","Distributed Local Multi-Aggregation and Centrality Approximation",,,,,"cs.DC","http://arxiv.org/licenses/nonexclusive-distrib/1.0/","  We study local aggregation and graph analysis in distributed environments
using the message passing model. We provide a flexible framework, where each of
the nodes in a set $S$--which is a subset of all nodes in the network--can
perform a large range of common aggregation functions in its $k$-neighborhood.
We study this problem in the CONGEST model, where in each synchronous round,
every node can transmit a different (but short) message to each of its
neighbors. While the $k$-neighborhoods of nodes in $S$ might overlap and
aggregation could cause congestion in this model, we present an algorithm that
needs time $O(|S|+k)$ even when each of the nodes in $S$ performs a different
aggregation on its $k$-neighborhood. The framework is not restricted to
aggregation-trees such that it can be used for more advanced graph analysis. We
demonstrate this by providing efficient approximations of centrality measures
and approximation of minimum routing cost trees.
","[{""version"":""v1"",""created"":""Mon, 23 May 2016 03:31:47 GMT""}]","2016-05-24"
"1605.06883","Peter Pikhitsa Dr","Peter V. Pikhitsa, Sukbyung Chae, Seungha Shin, Mansoo Choi","A low-field temperature-dependent EPR signal in terraced MgO:Mn2+
  nanoparticles: an enhanced Zeeman splitting in the wide-bandgap oxide","13 pages, 4 figures",,,,"cond-mat.mes-hall","http://arxiv.org/licenses/nonexclusive-distrib/1.0/","  Mn2+ ion doping is used as an electron paramagnetic resonance (EPR) probe to
investigate the influence of low-coordination structural defects such as step
edges at the surface of terraced (001) MgO nanoparticles on the electronic
properties. Beside the well-known hyperfine sextet of Mn2+ ions in the cubic
crystal field of MgO, an additional EPR feature with a striking non-monotonous
temperature dependent shift of the g-factor is observed in terraced
nanoparticles in the temperature range from 4K to room temperature. By linking
the difference in the temperature dependence of the Mn2+ sextet intensity in
cubic and terraced nanoparticles with the possible s-d exchange shift and
enhanced Zeeman splitting we conclude that the novel EPR feature originates
from the loosely trapped charge-compensating carriers at the abundant
structural defects at the surface of terraced nanoparticles due to their
exchange interaction with neighboring Mn2+ ions.
","[{""version"":""v1"",""created"":""Mon, 23 May 2016 03:34:43 GMT""}]","2016-05-24"
"1605.06884","Seongah Jeong","Seongah Jeong and Osvaldo Simeone and Joonhyuk Kang","Mobile Cloud Computing with a UAV-Mounted Cloudlet: Optimal Bit
  Allocation for Communication and Computation","21 pages, 3 figures, 1 Table, accepted in IET Communications",,,,"cs.NI cs.IT math.IT","http://arxiv.org/licenses/nonexclusive-distrib/1.0/","  Mobile cloud computing relieves the tension between compute-intensive mobile
applications and battery-constrained mobile devices by enabling the offloading
of computing tasks from mobiles to a remote processors. This paper considers a
mobile cloud computing scenario in which the ""cloudlet"" processor that provides
offloading opportunities to mobile devices is mounted on unmanned aerial
vehicles (UAVs) to enhance coverage. Focusing on a slotted communication system
with frequency division multiplexing between mobile and UAV, the joint
optimization of the number of input bits transmitted in the uplink by the
mobile to the UAV, the number of input bits processed by the cloudlet at the
UAV, and the number of output bits returned by the cloudlet to the mobile in
the downlink in each slot is carried out by means of dual decomposition under
maximum latency constraints with the aim of minimizing the mobile energy
consumption. Numerical results reveal the critical importance of an optimized
bit allocation in order to enable significant energy savings as compared to
local mobile execution for stringent latency constraints.
","[{""version"":""v1"",""created"":""Mon, 23 May 2016 03:36:39 GMT""},{""version"":""v2"",""created"":""Sun, 18 Sep 2016 17:12:05 GMT""},{""version"":""v3"",""created"":""Thu, 18 May 2017 04:10:24 GMT""}]","2017-05-19"
"1605.06885","Chunhua Shen","Zifeng Wu, Chunhua Shen, Anton van den Hengel","Bridging Category-level and Instance-level Semantic Image Segmentation","14 pages. arXiv admin note: substantial text overlap with
  arXiv:1604.04339",,,,"cs.CV","http://arxiv.org/licenses/nonexclusive-distrib/1.0/","  We propose an approach to instance-level image segmentation that is built on
top of category-level segmentation. Specifically, for each pixel in a semantic
category mask, its corresponding instance bounding box is predicted using a
deep fully convolutional regression network. Thus it follows a different
pipeline to the popular detect-then-segment approaches that first predict
instances' bounding boxes, which are the current state-of-the-art in instance
segmentation. We show that, by leveraging the strength of our state-of-the-art
semantic segmentation models, the proposed method can achieve comparable or
even better results to detect-then-segment approaches. We make the following
contributions. (i) First, we propose a simple yet effective approach to
semantic instance segmentation. (ii) Second, we propose an online bootstrapping
method during training, which is critically important for achieving good
performance for both semantic category segmentation and instance-level
segmentation. (iii) As the performance of semantic category segmentation has a
significant impact on the instance-level segmentation, which is the second step
of our approach, we train fully convolutional residual networks to achieve the
best semantic category segmentation accuracy. On the PASCAL VOC 2012 dataset,
we obtain the currently best mean intersection-over-union score of 79.1%. (iv)
We also achieve state-of-the-art results for instance-level segmentation.
","[{""version"":""v1"",""created"":""Mon, 23 May 2016 03:43:00 GMT""}]","2016-05-24"
"1605.06886","Xuhui Fan","Xuhui Fan, Bin Li, Yi Wang, Yang Wang, Fang Chen","Stochastic Patching Process",,,,,"cs.AI stat.ML","http://arxiv.org/licenses/nonexclusive-distrib/1.0/","  Stochastic partition models tailor a product space into a number of
rectangular regions such that the data within each region exhibit certain types
of homogeneity. Due to constraints of partition strategy, existing models may
cause unnecessary dissections in sparse regions when fitting data in dense
regions. To alleviate this limitation, we propose a parsimonious partition
model, named Stochastic Patching Process (SPP), to deal with multi-dimensional
arrays. SPP adopts an ""enclosing"" strategy to attach rectangular patches to
dense regions. SPP is self-consistent such that it can be extended to infinite
arrays. We apply SPP to relational modeling and the experimental results
validate its merit compared to the state-of-the-arts.
","[{""version"":""v1"",""created"":""Mon, 23 May 2016 03:43:01 GMT""},{""version"":""v2"",""created"":""Mon, 27 Feb 2017 03:26:56 GMT""}]","2017-02-28"
"1605.06887","Paolo E. Trevisanutto","Z. Yong, P. E. Trevisanutto, L. Chiodo, I. Santoso, A. R. Barman, T.
  C. Asmara, S. Dhar, A. Kotlov, A. Terentjevs, F. Della Sala, V. Olevano, M.
  R\""ubhausen, T. Venkatesan, A. Rusydi","Emerging giant resonant exciton induced by Ta-substitution in anatase
  TiO$_{2}$: a tunable correlation effect",,,"10.1103/PhysRevB.93.205118",,"cond-mat.str-el","http://arxiv.org/licenses/nonexclusive-distrib/1.0/","  Titanium dioxide (TiO$_2$) has rich physical properties with potential
implications in both fundamental physics and new applications. Up-to-date, the
main focus of applied research is to tune its optical properties, which is
usually done via doping and/or nano-engineering. However, understanding the
role of $d$-electrons in materials and possible functionalization of
$d$-electron properties are still major challenges. Herewith, within a
combination of an innovative experimental technique, high energy optical
conductivity, and of the state-of-the-art {\it ab initio} electronic structure
calculations, we report an emerging, novel resonant exciton in the deep
ultraviolet region of the optical response. The resonant exciton evolves upon
low concentration Ta-substitution in anatase TiO$_{2}$ films. It is
surprisingly robust and related to strong electron-electron and electron-hole
interactions. The $d$- and $f$- orbitals localization, due to Ta-substitution,
plays an unexpected role, activating strong electronic correlations and
dominating the optical response under photoexcitation. Our results shed light
on a new optical phenomenon in anatase TiO$_{2}$ films and on the possibility
of tuning electronic properties by Ta substitution.
","[{""version"":""v1"",""created"":""Mon, 23 May 2016 03:54:20 GMT""}]","2016-06-01"
"1605.06888","Hao Max Sun","Hao Max Sun","Arithmetic genus of integral space curves",,"Czech. Math. J., 68 (143) 2018, 1079-1089",,,"math.AG","http://arxiv.org/licenses/nonexclusive-distrib/1.0/","  We give an estimation for the arithmetic genus of an integral space curve,
which are not contained in a surface of degree $k-1$. Our main technique is the
Bogomolov-Gieseker type inequality for $\mathbb{P}^3$ proved by Macri.
","[{""version"":""v1"",""created"":""Mon, 23 May 2016 03:55:04 GMT""},{""version"":""v2"",""created"":""Thu, 15 Apr 2021 14:50:56 GMT""}]","2021-04-16"
"1605.06889","Rodney Nillsen","Rodney Nillsen","Generalised differences and multiplier operators in $L^2({\mathbb R})$","15 pages",,,,"math.CA","http://arxiv.org/licenses/nonexclusive-distrib/1.0/","  Given two real numbers, the $L^2$ functions whose Fourier transforms vanish
with a certain rapidity near the given numbers are characterised as those that
are expressible as the sum of a certain number of generalised finite
differences that is independent of the function. These generalised differences
can be regarded as approximating the appropriate powers of first order ordinary
differential operators. The upshot of this is that for operators in a certain
class of ordinary differential operators that have polynomial multipliers,
their ranges on the Sobolev spaces corresponding to the operators are those
functions expressible as a finite sum of corresponding generalised differences,
so that the latter form a weighted $L^2$ space under the Fourier transform.
There is a connection with the continuity properties of invariant forms on
$L^2$ spaces. The results presented here complement results previously obtained
for the $L^2$ space of the circle group.
","[{""version"":""v1"",""created"":""Mon, 23 May 2016 04:05:52 GMT""}]","2016-05-24"
"1605.06890","Yu Song","Chenglin Zhang, Weicheng Lv, Guotai Tan, Yu Song, Scott V. Carr,
  Songxue Chi, M. Matsuda, A. D. Christianson, J. A. Fernandez-Baca, L. W.
  Harriger, and Pengcheng Dai","Electron doping evolution of the neutron spin resonance in
  NaFe$_{1-x}$Co$_{x}$As","accepted by PRB",,"10.1103/PhysRevB.93.174522",,"cond-mat.supr-con cond-mat.str-el","http://arxiv.org/licenses/nonexclusive-distrib/1.0/","  Neutron spin resonance, a collective magnetic excitation coupled to
superconductivity, is one of the most prominent features shared by a broad
family of unconventional superconductors including copper oxides, iron
pnictides, and heavy fermions. In this work, we study the doping evolution of
the resonances in NaFe$_{1-x}$Co$_x$As covering the entire superconducting
dome. For the underdoped compositions, two resonance modes coexist. As doping
increases, the low-energy resonance gradually loses its spectral weight to the
high-energy one but remains at the same energy. By contrast, in the overdoped
regime we only find one single resonance, which acquires a broader width in
both energy and momentum, but retains approximately the same peak position even
when $T_c$ drops by nearly a half compared to optimal doping. These results
suggest that the energy of the resonance in electron overdoped
NaFe$_{1-x}$Co$_x$As is neither simply proportional to $T_c$ nor the
superconducting gap, but is controlled by the multi-orbital character of the
system and doped impurity scattering effect.
","[{""version"":""v1"",""created"":""Mon, 23 May 2016 04:14:13 GMT""}]","2016-06-22"
"1605.06891","Wahei Hara","Wahei Hara","Dimension of the singularity category of a variety with rational
  singularities","10 pages, v3: major revisions",,,,"math.AG math.AC","http://arxiv.org/licenses/nonexclusive-distrib/1.0/","  In this paper, we study the Rouquier dimension of the singularity category of
a variety with rational singularity. We construct an upper bound for the
dimension of $\mathrm{D}_{\mathrm{sg}}(X)$ if $X$ has at worst rational
singularities and $\dim X_{\mathrm{sing}} \leq 1$.
","[{""version"":""v1"",""created"":""Mon, 23 May 2016 04:18:33 GMT""},{""version"":""v2"",""created"":""Sat, 4 Jun 2016 06:12:33 GMT""},{""version"":""v3"",""created"":""Thu, 16 Feb 2017 16:43:54 GMT""}]","2017-02-17"
"1605.06892","Khanh Hien Le","Le Thi Khanh Hien, Cuong V. Nguyen, Huan Xu, Canyi Lu, Jiashi Feng","Accelerated Randomized Mirror Descent Algorithms For Composite
  Non-strongly Convex Optimization",,,,,"math.OC stat.ML","http://arxiv.org/licenses/nonexclusive-distrib/1.0/","  We consider the problem of minimizing the sum of an average function of a
large number of smooth convex components and a general, possibly
non-differentiable, convex function. Although many methods have been proposed
to solve this problem with the assumption that the sum is strongly convex, few
methods support the non-strongly convex case. Adding a small quadratic
regularization is a common devise used to tackle non-strongly convex problems;
however, it may cause loss of sparsity of solutions or weaken the performance
of the algorithms. Avoiding this devise, we propose an accelerated randomized
mirror descent method for solving this problem without the strongly convex
assumption. Our method extends the deterministic accelerated proximal gradient
methods of Paul Tseng and can be applied even when proximal points are computed
inexactly. We also propose a scheme for solving the problem when the component
functions are non-smooth.
","[{""version"":""v1"",""created"":""Mon, 23 May 2016 04:21:07 GMT""},{""version"":""v2"",""created"":""Tue, 24 May 2016 02:15:13 GMT""},{""version"":""v3"",""created"":""Tue, 11 Jul 2017 00:55:24 GMT""},{""version"":""v4"",""created"":""Mon, 24 Jul 2017 10:23:14 GMT""},{""version"":""v5"",""created"":""Tue, 17 Jul 2018 16:52:04 GMT""},{""version"":""v6"",""created"":""Mon, 31 Dec 2018 18:48:15 GMT""}]","2019-01-01"
"1605.06893","Wei-Li Lee","Shih-Ting Guo, R. Sankar, Yung-Yu Chien, Tay-Rong Chang, Horng-Tay
  Jeng, Guang-Yu Guo, F. C. Chou, and Wei-Li Lee","Large transverse Hall-like signal in topological Dirac semimetal Cd3As2","17 pages, 5 figures","Scientific reports 6, 27487 (2016)","10.1038/srep27487",,"cond-mat.mes-hall","http://arxiv.org/licenses/nonexclusive-distrib/1.0/","  Cadmium arsenide ($\rm Cd_3As_2$) is known for its inverted band structure
and ultra-high electron mobility. It has been theoretically predicted and also
confirmed by ARPES experiments to exhibit a 3D Dirac semimetal phase containing
degenerate Weyl nodes. From magneto-transport measurements in high quality
single crystals of $\rm Cd_3As_2$, a small effective mass $m^* \approx$ 0.05
$m_e$ is determined from the Shubnikov-de Haas (SdH) oscillations. In certain
field orientations, we find a splitting of the SdH oscillation frequency in the
FFT spectrum suggesting a possible lifting of the double degeneracy in accord
with the helical spin texture at outer and inner Fermi surfaces with opposite
chirality predicted by our \textit{ab initio} calculations. Strikingly, a large
antisymmetric magnetoresistance with respect to the applied magnetic fields is
uncovered over a wide temperature range in needle crystal of $\rm Cd_3As_2$
with its long axis along [112] crystal direction. It reveals a possible
contribution of intrinsic anomalous velocity term in the transport equation
resulting from a unique 3D Rashba-like spin splitted bands that can be obtained
from band calculations with the inclusion of Cd antisite defects.
","[{""version"":""v1"",""created"":""Mon, 23 May 2016 04:49:54 GMT""}]","2016-06-14"
"1605.06894","Chao Wang","Chao Wang, Qi Yu, Lei Gong, Xi Li, Yuan Xie, Xuehai Zhou","DLAU: A Scalable Deep Learning Accelerator Unit on FPGA",,,,,"cs.LG cs.DC cs.NE","http://arxiv.org/licenses/nonexclusive-distrib/1.0/","  As the emerging field of machine learning, deep learning shows excellent
ability in solving complex learning problems. However, the size of the networks
becomes increasingly large scale due to the demands of the practical
applications, which poses significant challenge to construct a high performance
implementations of deep learning neural networks. In order to improve the
performance as well to maintain the low power cost, in this paper we design
DLAU, which is a scalable accelerator architecture for large-scale deep
learning networks using FPGA as the hardware prototype. The DLAU accelerator
employs three pipelined processing units to improve the throughput and utilizes
tile techniques to explore locality for deep learning applications.
Experimental results on the state-of-the-art Xilinx FPGA board demonstrate that
the DLAU accelerator is able to achieve up to 36.1x speedup comparing to the
Intel Core2 processors, with the power consumption at 234mW.
","[{""version"":""v1"",""created"":""Mon, 23 May 2016 04:56:04 GMT""}]","2016-05-24"
"1605.06895","Gwanjeong Kim","Gwanjeong Kim, Chang Won Lee, Maheswar Gopinathan, Woong-Seob Jeong,
  and Mi-Ryang Kim","Dense Molecular Cores Being Externally Heated","48 pages, 8 figures,accepted for publication in ApJ",,"10.3847/0004-637X/824/2/85",,"astro-ph.GA","http://arxiv.org/licenses/nonexclusive-distrib/1.0/","  We present results of our study on eight dense cores, previously classified
as starless, using infrared (3-160 {\micron}) imaging observations with
\textit{AKARI} telescope and molecular line (HCN and N$_2$H$^+$) mapping
observations with \textit{KVN} telescope. Combining our results with the
archival IR to mm continuum data, we examined the starless nature of these
eight cores. Two of the eight cores are found to harbor faint protostars having
luminosity of $\sim0.3-4.4$ L$_{\odot}$. The other six cores are found to
remain as starless and probably are in a dynamically transitional state. The
temperature maps produced using multi-wavelength images show an enhancement of
about 3-6 K towards the outer boundary of these cores, suggesting that they are
most likely being heated externally by nearby stars and/or interstellar
radiation fields. Large virial parameters and an over-dominance of red
asymmetric line profiles over the cores may indicate that the cores are set
into either an expansion or an oscillatory motion, probably due to the external
heating. Most of the starless cores show coreshine effect due to the scattering
of light by the micron-size dust grains. This may imply that the age of the
cores is of the order of $\sim10^{5}$ years, being consistent with the
timescale required for the cores to evolve into an oscillatory stage due to the
external perturbation. Our observational results support the idea that the
external feedback from nearby stars and/or interstellar radiation fields may
play an important role in the dynamical evolution of the cores.
","[{""version"":""v1"",""created"":""Mon, 23 May 2016 05:05:03 GMT""}]","2016-06-22"
"1605.06896","Santosh Bhattarai","Santosh Bhattarai","On fractional Schrodinger systems of Choquard type","31 pages, revised version","J. Differential Equations 263 (2017), 3197-3229","10.1016/j.jde.2017.04.034",,"math.AP math-ph math.MP","http://arxiv.org/licenses/nonexclusive-distrib/1.0/","  In this article, we first employ the concentration compactness techniques to
prove existence and stability results of standing waves for nonlinear
fractional Schr\""{o}dinger-Choquard equation \[ i\partial_t\Psi +
(-\Delta)^{\alpha}\Psi = a |\Psi|^{s-2}\Psi+\lambda \left(
\frac{1}{|x|^{N-\beta}} \star |\Psi|^p \right)|\Psi|^{p-2}\Psi\ \ \
\mathrm{in}\ \mathbb{R}^{N+1}, \] where $N\geq 2$, $\alpha\in (0,1)$, $\beta\in
(0, N)$, $s\in (2, 2+\frac{4\alpha}{N})$, $p\in [2,
1+\frac{2\alpha+\beta}{N})$, and the constants $a, \lambda$ are nonnegative
satisfying $a+\lambda > 0.$ We then extend the arguments to establish similar
results for coupled standing waves of nonlinear fractional Schr\""{o}dinger
systems of Choquard type. The same argument works for equations with an
arbitrary number of combined nonlinearities and when $|x|^{\beta-N}$ is
replaced by a more general convolution potential $\mathcal{K}:\mathbb{R}^N\to
[0, \infty)$ under certain assumptions. The same arguments can be applied and
the results are identical for the case $\alpha=1$ as well.
","[{""version"":""v1"",""created"":""Mon, 23 May 2016 05:07:47 GMT""},{""version"":""v2"",""created"":""Wed, 8 Jun 2016 19:06:24 GMT""},{""version"":""v3"",""created"":""Mon, 20 Jun 2016 14:05:52 GMT""}]","2017-06-13"
"1605.06897","Yuta Hamada","Yuta Hamada, Masatoshi Yamada","Baryogenesis in false vacuum","25 pages, 7 figures, published version(v4)","Eur. Phys. J. C (2017) 77: 643","10.1140/epjc/s10052-017-5215-9","KEK-TH-1907, KANAZAWA-16-7","hep-ph astro-ph.CO hep-th","http://arxiv.org/licenses/nonexclusive-distrib/1.0/","  The null result in the LHC may indicate that the standard model is not
drastically modified up to very high scales such as the GUT/string scale.
Having this in the mind, we suggest a novel leptogenesis scenario realized in
the false vacuum of the Higgs field. If the Higgs field develops a large vacuum
expectation value in the early universe, a lepton number violating process is
enhanced, which we use for baryogenesis. To demonstrate the scenario, several
models are discussed. For example, we show that the observed baryon asymmetry
is successfully generated in the standard model with higher-dimensional
operators.
","[{""version"":""v1"",""created"":""Mon, 23 May 2016 05:18:25 GMT""},{""version"":""v2"",""created"":""Sun, 5 Jun 2016 15:36:31 GMT""},{""version"":""v3"",""created"":""Sun, 12 Feb 2017 19:18:52 GMT""},{""version"":""v4"",""created"":""Thu, 21 Sep 2017 02:51:08 GMT""}]","2017-09-26"
"1605.06898","Ian Barnett","Ian Barnett, Tarun Khanna, and Jukka-Pekka Onnela","Social and Spatial Clustering of People at Humanity's Largest Gathering","16 pages, 4 figures",,"10.1371/journal.pone.0156794",,"stat.AP cs.SI physics.soc-ph","http://arxiv.org/licenses/nonexclusive-distrib/1.0/","  Macroscopic behavior of scientific and societal systems results from the
aggregation of microscopic behaviors of their constituent elements, but
connecting the macroscopic with the microscopic in human behavior has
traditionally been difficult. Manifestations of homophily, the notion that
individuals tend to interact with others who resemble them, have been observed
in many small and intermediate size settings. However, whether this behavior
translates to truly macroscopic levels, and what its consequences may be,
remains unknown. Here, we use call detail records (CDRs) to examine the
population dynamics and manifestations of social and spatial homophily at a
macroscopic level among the residents of 23 states of India at the Kumbh Mela,
a 3-month-long Hindu festival. We estimate that the festival was attended by 61
million people, making it the largest gathering in the history of humanity.
While we find strong overall evidence for both types of homophily for residents
of different states, participants from low-representation states show
considerably stronger propensity for both social and spatial homophily than
those from high-representation states. These manifestations of homophily are
amplified on crowded days, such as the peak day of the festival, which we
estimate was attended by 25 million people. Our findings confirm that
homophily, which here likely arises from social influence, permeates all scales
of human behavior.
","[{""version"":""v1"",""created"":""Mon, 23 May 2016 05:19:09 GMT""}]","2016-09-28"
