"1605.06811","Joel Hartman","Joel D. Hartman (1), G\'asp\'ar \'A Bakos (1) ((1) Princeton
  University Department of Astrophysical Sciences)","VARTOOLS: A Program for Analyzing Astronomical Time-Series Data","83 pages, 5 figures, accepted for publication in Astronomy and
  Computing, code available at
  http://www.astro.princeton.edu/~jhartman/vartools.html",,,,"astro-ph.IM","http://arxiv.org/licenses/nonexclusive-distrib/1.0/","  This paper describes the VARTOOLS program, which is an open-source
command-line utility, written in C, for analyzing astronomical time-series
data, especially light curves. The program provides a general-purpose set of
tools for processing light curves including signal identification, filtering,
light curve manipulation, time conversions, and modeling and simulating light
curves. Some of the routines implemented include the Generalized Lomb-Scargle
periodogram, the Box-Least Squares transit search routine, the Analysis of
Variance periodogram, the Discrete Fourier Transform including the CLEAN
algorithm, the Weighted Wavelet Z-Transform, light curve arithmetic, linear and
non-linear optimization of analytic functions including support for Markov
Chain Monte Carlo analyses with non-trivial covariances, characterizing and/or
simulating time-correlated noise, and the TFA and SYSREM filtering algorithms,
among others. A mechanism is also provided for incorporating a user's own
compiled processing routines into the program. VARTOOLS is designed especially
for batch processing of light curves, including built-in support for parallel
processing, making it useful for large time-domain surveys such as searches for
transiting planets. Several examples are provided to illustrate the use of the
program.
","[{""version"":""v1"",""created"":""Sun, 22 May 2016 16:02:58 GMT""}]","2016-05-24"
"1605.06812","Dasari Durga Bhaktavatsala Rao","D. D. Bhaktavatsala Rao, S. Ali Momenzadeh and J\""org Wrachtrup","Heralded Control of Mechanical motion by Single Spins","4 pages, 3 figures","Phys. Rev. Lett. 117, 077203 (2016)","10.1103/PhysRevLett.117.077203",,"quant-ph","http://arxiv.org/licenses/nonexclusive-distrib/1.0/","  We propose a method to achieve high degree control of nanomechanical
oscillators by coupling their mechanical motion to single spins. By
manipulating the spin alone and measuring its quantum state heralds the cooling
or squeezing of the oscillator even for weak spin-oscillator couplings. We
analytically show that the asymptotic behavior of the oscillator is determined
by a spin-induced thermal filter function whose overlap with the initial
thermal distribution of the oscillator determines its cooling, heating or
squeezing. Counterintuitively, the rate of cooling dependence on the
instantaneous thermal occupancy of the oscillator renders robust cooling or
squeezing even for high initial temperatures and damping rates. We further
estimate how the proposed scheme can be used to control the motion of a thin
diamond cantilever by coupling it to its defect centers at low temperature.
","[{""version"":""v1"",""created"":""Sun, 22 May 2016 16:08:21 GMT""}]","2016-08-17"
"1605.06813","Ioannis Bakas","Ioannis Bakas","Aspects of non-associative structures in physics","7 pages, Contribution to the proceedings of the workshop on
  Non-commutative Field Theory and Gravity, 21-27 September 2015, Corfu, Greece",,,,"hep-th","http://arxiv.org/licenses/nonexclusive-distrib/1.0/","  We summarize the emergence of non-commutative/non-associative structures in
Dirac's generalization of Maxwell theory, focusing mostly on the magnetic field
analogue of the non-geometric R-flux string model. The cohomological
interpretation of the obstructions to associativity in terms of 3-cocycles and
the use of the star product as alternative to ordinary quantization are also
discussed in this context.
","[{""version"":""v1"",""created"":""Sun, 22 May 2016 16:09:12 GMT""}]","2016-05-24"
"1605.06814","Will Rosenbaum","Rafail Ostrovsky, Mor Perry, Will Rosenbaum","Space-Time Tradeoffs for Distributed Verification","Pre-proceedings version of paper presented at the 24th International
  Colloquium on Structural Information and Communication Complexity (SIROCCO
  2017)",,,,"cs.DC cs.CC","http://arxiv.org/licenses/nonexclusive-distrib/1.0/","  Verifying that a network configuration satisfies a given boolean predicate is
a fundamental problem in distributed computing. Many variations of this problem
have been studied, for example, in the context of proof labeling schemes (PLS),
locally checkable proofs (LCP), and non-deterministic local decision (NLD). In
all of these contexts, verification time is assumed to be constant. Korman,
Kutten and Masuzawa [PODC 2011] presented a proof-labeling scheme for MST, with
poly-logarithmic verification time, and logarithmic memory at each vertex.
  In this paper we introduce the notion of a $t$-PLS, which allows the
verification procedure to run for super-constant time. Our work analyzes the
tradeoffs of $t$-PLS between time, label size, message length, and computation
space. We construct a universal $t$-PLS and prove that it uses the same amount
of total communication as a known one-round universal PLS, and $t$ factor
smaller labels. In addition, we provide a general technique to prove lower
bounds for space-time tradeoffs of $t$-PLS. We use this technique to show an
optimal tradeoff for testing that a network is acyclic (cycle free). Our
optimal $t$-PLS for acyclicity uses label size and computation space $O((\log
n)/t)$. We further describe a recursive $O(\log^* n)$ space verifier for
acyclicity which does not assume previous knowledge of the run-time $t$.
","[{""version"":""v1"",""created"":""Sun, 22 May 2016 16:13:24 GMT""},{""version"":""v2"",""created"":""Mon, 21 Aug 2017 03:28:23 GMT""}]","2017-08-22"
"1605.06815","Xavier Morvan","Xavier Morvan","A non-commutative generalisation of Thurston's gluing equations","14 pages, 9 figures",,,,"math.GT","http://arxiv.org/licenses/nonexclusive-distrib/1.0/","  In his famous Princeton Notes, Thurston introduced the so-called gluing
equations defining the deformation variety. Later, Kashaev defined a
non-commutative ring from H-triangulations of 3-manifolds and observed that for
trefoil and figure-eight knot complements the abelianization of this ring is
isomorphic to the ring of regular functions on the deformation variety,
\cite{Kashaev-definition_delta_groupoid, def_anneau,
Kashaev-Delta-groupoids_and_ideal_triangulations}. In this paper, we prove that
this is true for any knot complement in a homology sphere. We also analyse some
examples on other manifolds.
","[{""version"":""v1"",""created"":""Sun, 22 May 2016 16:18:34 GMT""}]","2016-05-24"
"1605.06816","Asghar Asgari","Saina Haghkish, Asghar Asgari","The effects of cap layer thickness on the performance of InGaN/GaN MQW
  solar cell","8 pages, 3 figures, 2 tables",,,,"cond-mat.mes-hall","http://arxiv.org/licenses/nonexclusive-distrib/1.0/","  Following letter introduces a theoretical approach to investigate the effect
of two-step GaN barrier layer growth methodology on the performance of
InGaN/GaN MQW solar cell, in which a lower temperature GaN cap layer was grown
on top of each quantum well followed by a higher temperature GaN barrier layer.
Different growth conditions would cause changes in the concentration of trap
level density of states and imperfection sites. The simulation and comparison
of 3 samples each with different cap layer thickness, reveals the fact that
increasing cap layer thickness results in higher quantum efficiency, improved
short circuit density of current and 3.2% increase of the fill factor.
","[{""version"":""v1"",""created"":""Sun, 22 May 2016 16:30:41 GMT""}]","2016-05-24"
"1605.06817","Igor I. Smolyaninov","V. N. Smolyaninova, C. Jensen, W. Zimmerman, J. C. Prestigiacomo, M.
  S. Osofsky, H. Kim, Z. Xing, M. M. Qazilbash, I. I. Smolyaninov","Enhanced superconductivity in aluminum-based hyperbolic metamaterials","18 pages, 8 figures","Scientific Reports 6, 34140 (2016)",,,"cond-mat.supr-con physics.optics","http://arxiv.org/licenses/nonexclusive-distrib/1.0/","  One of the most important goals of condensed matter physics is materials by
design, i.e. the ability to reliably predict and design materials with a set of
desired properties. A striking example is the deterministic enhancement of the
superconducting properties of materials. Recent experiments have demonstrated
that the metamaterial approach is capable of achieving this goal, such as
tripling the critical temperature Tc in Al-Al2O3 epsilon near zero (ENZ)
core-shell metamaterial superconductors. However, transport properties of such
metamaterials remained much worse compared to conventional superconductors.
Here, we demonstrate that an Al/Al2O3 hyperbolic metamaterial geometry is
capable of a similar Tc enhancement, while having superior transport and
magnetic properties compared to the core-shell metamaterial superconductors.
This result opens up numerous new possibilities for metamaterial enhancement of
Tc in other practically important simple superconductors, such as niobium and
MgB2. It also indicates that the recently discovered hyperbolic properties of
high Tc superconductors may play considerable role in superconductivity
enhancement in cuprates.
","[{""version"":""v1"",""created"":""Sun, 22 May 2016 16:40:30 GMT""}]","2016-09-14"
"1605.06818","Tibor Pog\'any K.","Dragana Jankov Ma\v{s}irevi\'c and Tibor K. Pog\'any","Summations associated with Gamma exponentiated exponential Weibull
  distribution","6 pages",,,,"math.PR","http://arxiv.org/licenses/nonexclusive-distrib/1.0/","  Considering the recently studied Gamma exponentiated exponential Weibull
${\rm GEEW}(\theta)$ probability distribution \cite{PoganySaboor} surprising
infinite summations are obtained for series which building blocks are special
functions like lower and upper incomplete Gamma, Fox--Wright Psi, Meijer $G$ or
Whittaker $W$ functions.
","[{""version"":""v1"",""created"":""Sun, 22 May 2016 16:50:06 GMT""}]","2016-05-24"
"1605.06819","Benjamin Arras","Benjamin Arras, Guillaume Mijoule, Guillaume Poly and Yvik Swan","A new approach to the Stein-Tikhomirov method: with applications to the
  second Wiener chaos and Dickman convergence","45 pages. Complete re-writing of the previous version. Former
  applications detailed and new applications provided. Comments are welcome",,,,"math.PR","http://arxiv.org/licenses/nonexclusive-distrib/1.0/","  In this paper, we propose a general means of estimating the rate at which
convergences in law occur. Our approach, which is an extension of the classical
Stein-Tikhomirov method, rests on a new pair of linear operators acting on
characteristic functions. In principle, this method is admissible for any
approximating sequence and any target, although obviously the conjunction of
several favorable factors is necessary in order for the resulting bounds to be
of interest. As we briefly discuss, our approach is particularly promising
whenever some version of Stein's method applies. We apply our approach to two
examples. The first application concerns convergence in law towards targets
$F_\infty$ which belong to the second Wiener chaos (i.e. $F_{\infty}$ is a
linear combination of independent centered chi-squared rvs). We detail an
application to $U$-statistics. The second application concerns convergence
towards targets belonging to the generalized Dickman family of distributions.
We detail an application to a theorem from number theory. In both cases our
method produces bounds of the correct order (up to a logarithmic loss) in terms
of quantities which occur naturally in Stein's method.
","[{""version"":""v1"",""created"":""Sun, 22 May 2016 16:57:22 GMT""},{""version"":""v2"",""created"":""Tue, 27 Jun 2017 21:51:46 GMT""}]","2017-06-29"
"1605.06820","Hamid Tizhoosh","Fares Al-Qunaieer, Hamid R. Tizhoosh, Shahryar Rahnamayan","Automated Resolution Selection for Image Segmentation",,,,,"cs.CV","http://arxiv.org/licenses/nonexclusive-distrib/1.0/","  It is well-known in image processing that computational cost increases
rapidly with the number and dimensions of the images to be processed. Several
fields, such as medical imaging, routinely use numerous very large images,
which might also be 3D and/or captured at several frequency bands, all adding
to the computational expense. Multiresolution analysis is a method of
increasing the efficiency of the segmentation process. One multiresolution
approach is the coarse-to-fine segmentation strategy, whereby the segmentation
starts at a coarse resolution and is then fine-tuned during subsequent steps.
The starting resolution for segmentation is generally selected arbitrarily with
no clear selection criteria. The research reported in this paper showed that
starting from different resolutions for image segmentation results in different
accuracies and computational times, even for images of the same category
(depicting similar scenes or objects). An automated method for resolution
selection for an input image would thus be beneficial. This paper introduces a
framework for the automated selection of the best resolution for image
segmentation. We propose a measure for defining the best resolution based on
user/system criteria, offering a trade-off between accuracy and computation
time. A learning approach is then introduced for the selection of the
resolution, whereby extracted image features are mapped to the previously
determined best resolution. In the learning process, class (i.e., resolution)
distribution is generally imbalanced, making effective learning from the data
difficult. Experiments conducted with three datasets using two different
segmentation algorithms show that the resolutions selected through learning
enable much faster segmentation than the original ones, while retaining at
least the original accuracy.
","[{""version"":""v1"",""created"":""Sun, 22 May 2016 17:09:29 GMT""}]","2016-05-24"
"1605.06821","Ebrahim Moradi Shahrivar","Ebrahim Moradi Shahrivar and Shreyas Sundaram","The Game-Theoretic Formation of Interconnections Between Networks",,,,,"cs.GT cs.SI","http://arxiv.org/licenses/nonexclusive-distrib/1.0/","  We introduce a network design game where the objective of the players is to
design the interconnections between the nodes of two different networks $G_1$
and $G_2$ in order to maximize certain local utility functions. In this
setting, each player is associated with a node in $G_1$ and has functional
dependencies on certain nodes in $G_2$. We use a distance-based utility for the
players in which the goal of each player is to purchase a set of edges
(incident to its associated node) such that the sum of the distances between
its associated node and the nodes it depends on in $G_2$ is minimized. We
consider a heterogeneous set of players (i.e., players have their own costs and
benefits for constructing edges). We show that finding a best response of a
player in this game is NP-hard. Despite this, we characterize some properties
of the best response actions which are helpful in determining a Nash
equilibrium for certain instances of this game. In particular, we prove
existence of pure Nash equilibria in this game when $G_2$ contains a star
subgraph, and provide an algorithm that outputs such an equilibrium for any set
of players. Finally, we show that the price of anarchy in this game can be
arbitrarily large.
","[{""version"":""v1"",""created"":""Sun, 22 May 2016 17:10:06 GMT""},{""version"":""v2"",""created"":""Wed, 21 Dec 2016 00:37:53 GMT""}]","2016-12-22"
"1605.06822","Toshio Miyamachi","T. Miyamachi, S. Nakashima, S. Kim, N. Kawamura, Y. Tatetsu, Y. Gohda,
  S. Tsuneyuki, and F. Komori","Epitaxially stabilized iron thin films via effective strain relief from
  steps","5 pages, 5 figures","Phys. Rev. B 94, 045439 (2016)","10.1103/PhysRevB.94.045439",,"cond-mat.mes-hall","http://arxiv.org/licenses/nonexclusive-distrib/1.0/","  We show a new way to stabilize epitaxial structures against transforming bulk
stable phases for Fe thin films on a vicinal Cu(001) surface.
Atomically-resolved observations by scanning tunneling microscopy reveal that
high-density Cu steps serve as strain relievers for keeping
epitaxially-stabilized Fe fcc(001) lattice even at a transient thickness
towards the bulk stable bcc(110) lattice. Spectroscopic measurements further
clarify the intrinsic electronic properties of the fcc Fe thin film in real
space, implying electronic differences between 6 and 7 monolayer thick films
induced by the modification of the lattice constant in the topmost layers.
","[{""version"":""v1"",""created"":""Sun, 22 May 2016 17:13:13 GMT""}]","2016-08-02"
"1605.06823","Eric Fullerton","Vojtech Uhlir, Jon Ander Arregi, and Eric E. Fullerton","Colossal magnetic phase transition asymmetry in mesoscale FeRh stripes","18 pages, 7 figures",,"10.1038/ncomms13113",,"cond-mat.mes-hall","http://arxiv.org/licenses/nonexclusive-distrib/1.0/","  Coupled order parameters in phase-transition materials can be controlled
using various driving forces such as temperature, magnetic and electric field,
strain, spin-polarized currents and optical pulses. Tuning the material
properties to achieve efficient transitions would enable fast and low-power
electronic devices. Here we show that the first-order metamagnetic phase
transition in FeRh films becomes strongly asymmetric in mesoscale structures.
In patterned FeRh stripes we observed pronounced supercooling and an
avalanche-like abrupt transition from the ferromagnetic to the
antiferromagnetic phase while the reverse transition remains nearly continuous
over a broad temperature range. Although modest asymmetry signatures have been
found in FeRh films, the effect is dramatically enhanced at the mesoscale. The
asymmetry in the transitions is independent of applied magnetic fields and the
activation volume of the antiferromagnetic phase is more than two orders of
magnitude larger than typical magnetic heterogeneities observed in films. The
collective behavior upon cooling results from the role of long-range
ferromagnetic exchange correlations that become important at the mesoscale and
should be a general property of first-order magnetic phase transitions.
","[{""version"":""v1"",""created"":""Sun, 22 May 2016 17:13:25 GMT""}]","2016-11-03"
"1605.06824","Tian Qian","J.-Z. Ma, C.-J. Yi, B. Q. Lv, Z. J. Wang, S.-M. Nie, L. Wang, L.-Y.
  Kong, Y.-B. Huang, P. Richard, H.-M. Weng, B. A. Bernevig, Y.-G. Shi, T.
  Qian, and H. Ding","Experimental Discovery of the First Nonsymmorphic Topological Insulator
  KHgSb","15 pages, 4 figures","Science Advances 3, e1602415 (2017)","10.1126/sciadv.1602415",,"cond-mat.mtrl-sci cond-mat.mes-hall","http://arxiv.org/licenses/nonexclusive-distrib/1.0/","  Topological insulators (TIs) host novel states of quantum matter,
distinguished from trivial insulators by the presence of nontrivial conducting
boundary states connecting the valence and conduction bulk bands. Up to date,
all the TIs discovered experimentally rely on the presence of either time
reversal or symmorphic mirror symmetry to protect massless Dirac-like boundary
states. Very recently, it has been theoretically proposed that several
materials are a new type of TIs protected by nonsymmorphic symmetry, where
glide-mirror can protect novel exotic surface fermions with hourglass-shaped
dispersion. However, an experimental confirmation of such new nonsymmorphic TI
(NSTI) is still missing. Using angle-resolved photoemission spectroscopy, we
reveal that such hourglass topology exists on the (010) surface of crystalline
KHgSb while the (001) surface has no boundary state, which is fully consistent
with first-principles calculations. We thus experimentally demonstrate that
KHgSb is a NSTI hosting hourglass fermions. By expanding the classification of
topological insulators, this discovery opens a new direction in the research of
nonsymmorphic topological properties of materials.
","[{""version"":""v1"",""created"":""Sun, 22 May 2016 17:24:00 GMT""}]","2017-06-09"
"1605.06825","Eric Egge","David Anderson, Eric S. Egge, Manda Riehl, Lucas Ryan, Ruth Steinke,
  and Yuriko Vaughan","Pattern Avoiding Linear Extensions of Rectangular Posets","25 pages",,,,"math.CO","http://arxiv.org/licenses/nonexclusive-distrib/1.0/","  Inspired by Yakoubov's 2015 investigation of pattern avoiding linear
extensions of the posets called combs, we study pattern avoiding linear
extensions of rectangular posets. These linear extensions are closely related
to standard tableaux. For positive integers $s$ and $t$ we consider two natural
rectangular partial orders on $\{1,2,\ldots,s t\}$, which we call the NE
rectangular order and the EN rectangular order. First we enumerate linear
extensions of both rectangular orders avoiding most sets of patterns of length
three. Then we use both a generating tree and a bijection to show that the
linear extensions of the EN rectangular order which avoid 1243 are counted by
the Fuss-Catalan numbers. Next we use the transfer matrix method to enumerate
linear extensions of the EN rectangular order which avoid 2143. Finally, we
open an investigation of the distribution of the inversion number on pattern
avoiding linear extensions.
","[{""version"":""v1"",""created"":""Sun, 22 May 2016 17:32:31 GMT""}]","2016-05-24"
"1605.06826","Somphong Jitman","Parinyawat Choosuwan, Somphong Jitman, Patanee Udomkavanich","Determinants of Matrices over Commutative Finite Principal Ideal Rings",,,,,"math.RA","http://arxiv.org/licenses/nonexclusive-distrib/1.0/","  In this paper, the determinants of $n\times n$ matrices over commutative
finite chain rings and over commutative finite principal ideal rings are
studied. The number of $n\times n$ matrices over a commutative finite chain
ring ${R}$ of a fixed determinant $a$ is determined for all $a\in {R}$ and
positive integers $n$. Using the fact that every commutative finite principal
ideal ring is a product of commutative finite chain rings, the number of
$n\times n$ matrices of a fixed determinant over a commutative finite principal
ideal ring is shown to be multiplicative, and hence, it can be determined.
These results generalize the case of matrices over the ring of integers modulo
$m$.
","[{""version"":""v1"",""created"":""Sun, 22 May 2016 17:35:09 GMT""},{""version"":""v2"",""created"":""Wed, 1 Feb 2017 14:20:34 GMT""}]","2017-02-02"
"1605.06827","Somphong Jitman","Kriangkrai Boonniyom, Somphong Jitman","Complementary Dual Subfield Linear Codes Over Finite Fields","accepted in Thai Journal of Mathematics: Special issue ICMSA2015","Thai Journal of Mathematics Special issue ICMSA2015, 133-152
  (2016)",,,"cs.IT math.IT","http://arxiv.org/licenses/nonexclusive-distrib/1.0/","  Two families of complementary codes over finite fields $\mathbb{F}_q$ are
studied, where $q=r^2$ is square: i) Hermitian complementary dual linear codes,
and ii) trace Hermitian complementary dual subfield linear codes. Necessary and
sufficient conditions for a linear code (resp., a subfield linear code) to be
Hermitian complementary dual (resp., trace Hermitian complementary dual) are
determined. Constructions of such codes are given together their parameters.
Some illustrative examples are provided as well.
","[{""version"":""v1"",""created"":""Sun, 22 May 2016 17:44:26 GMT""}]","2017-10-13"
"1605.06828","Jaros{\l}aw Buczy\'nski","Jaros{\l}aw Buczy\'nski, Oskar K\k{e}dzierski","Maps of Mori Dream Spaces in Cox coordinates. Part I: existence of
  descriptions","28 pages. v2 a few corrected typos and minor bugs as suggested by the
  referee. To appear in Mathematische Nachrichten",,,"BCSim-2016-s02","math.AG","http://arxiv.org/licenses/nonexclusive-distrib/1.0/","  Any rational map between affine spaces, projective spaces or toric varieties
can be described in terms of their affine, homogeneous, or Cox coordinates. We
show an analogous statement in the setting of Mori Dream Spaces. More precisely
(in the case of regular maps) we show there exists a finite extension of the
Cox ring of the source, such that the regular map lifts to a morphism from the
Cox ring of the target to the finite extension. Moreover the extension only
involves roots of homogeneous elements. Such a description of the map can be
applied in practical computations.
","[{""version"":""v1"",""created"":""Sun, 22 May 2016 17:51:02 GMT""},{""version"":""v2"",""created"":""Fri, 20 Oct 2017 10:44:36 GMT""}]","2017-10-23"
