"1606.04118","Xueda Wen","Xueda Wen, Po-Yao Chang, Shinsei Ryu","Topological entanglement negativity in Chern-Simons theories","34 pages, 12 figures; v2: reference added","JHEP 09 (2016) 012","10.1007/JHEP09(2016)012",,"cond-mat.str-el hep-th","http://arxiv.org/licenses/nonexclusive-distrib/1.0/","  We study the topological entanglement negativity between two spatial regions
in (2+1)-dimensional Chern-Simons gauge theories by using the replica trick and
the surgery method. For a bipartitioned or tripartitioned spatial manifold, we
show how the topological entanglement negativity depends on the presence of
quasiparticles and the choice of ground states. In particular, for two adjacent
non-contractible regions on a tripartitioned torus, the entanglement negativity
provides a simple way to distinguish Abelian and non-Abelian theories. Our
method applies to a Chern-Simons gauge theory defined on an arbitrary oriented
(2+1)-dimensional spacetime manifold. Our results agree with the edge theory
approach in a recent work (X. Wen, S. Matsuura and S. Ryu, arXiv:1603.08534).
","[{""version"":""v1"",""created"":""Mon, 13 Jun 2016 20:05:12 GMT""},{""version"":""v2"",""created"":""Sat, 3 Sep 2016 17:21:26 GMT""}]","2016-09-06"
"1606.04119","Maksym Radziwi{\l}{\l}","Stephen Lester and Maksym Radziwi{\l}{\l}","Quantum Unique Ergodicity for half-integral weight forms","61 pages","Duke Math. J. 169, no. 2 (2020), 279-351","10.1215/00127094-2019-0040",,"math.NT math.DS math.SP","http://arxiv.org/licenses/nonexclusive-distrib/1.0/","  We investigate the analogue of the Quantum Unique Ergodicity (QUE) conjecture
for half-integral weight automorphic forms. Assuming the Generalized Riemann
Hypothesis (GRH) we establish QUE for both half-integral weight holomorphic
Hecke cusp forms for $\Gamma_0(4)$ lying in Kohnen's plus subspace and for
half-integral weight Hecke Maa{\ss} cusp forms for $\Gamma_0(4)$ lying in
Kohnen's plus subspace. By combining the former result along with an argument
of Rudnick, it follows that under GRH the zeros of these holomorphic Hecke cusp
equidistribute with respect to hyperbolic measure on $\Gamma_0(4)\backslash
\mathbb H$ as the weight tends to infinity.
","[{""version"":""v1"",""created"":""Mon, 13 Jun 2016 20:05:49 GMT""}]","2020-02-12"
"1606.04120","Kristen McQuinn","Kristen. B. W. McQuinn, Evan D. Skillman, Andrew E. Dolphin, Danielle
  Berg, Robert Kennicutt","The Distance to M51","10 pages, 3 figures, 2 tables","ApJ, 826, 21 (2016)","10.3847/0004-637X/826/1/21",,"astro-ph.GA","http://arxiv.org/licenses/nonexclusive-distrib/1.0/","  Great investments of observing time have been dedicated to the study of
nearby spiral galaxies with diverse goals ranging from understanding the star
formation process to characterizing their dark matter distributions. Accurate
distances are fundamental to interpreting observations of these galaxies, yet
many of the best studied nearby galaxies have distances based on methods with
relatively large uncertainties. We have started a program to derive accurate
distances to these galaxies. Here we measure the distance to M51 - the
Whirlpool galaxy - from newly obtained Hubble Space Telescope optical imaging
using the tip of the red giant branch method. We measure the distance modulus
to be 8.58+/-0.10 Mpc (statistical), corresponding to a distance modulus of
29.67+/-0.02 mag. Our distance is an improvement over previous results as we
use a well-calibrated, stable distance indicator, precision photometry in a
optimally selected field of view, and a Bayesian Maximum Likelihood technique
that reduces measurement uncertainties.
","[{""version"":""v1"",""created"":""Mon, 13 Jun 2016 20:05:56 GMT""}]","2016-10-14"
"1606.04121","Frederick Wilhelm","Luis Guijarro and Frederick Wilhelm","Restrictions on Submanifolds via Focal Radius Bounds","The change in title reflects the addition of a finiteness theorem for
  submanifolds. arXiv admin note: substantial text overlap with
  arXiv:1603.04050",,,,"math.DG","http://arxiv.org/licenses/nonexclusive-distrib/1.0/","  We give an optimal estimate for the norm of any submanifold's second
fundamental form in terms of its focal radius and the lower sectional curvature
bound of the ambient manifold.
  This is a special case of a similar theorem for intermediate Ricci curvature,
and leads to a $C^{1,\alpha}$ compactness result for submanifolds, as well as a
""soul-type"" structure theorem for manifolds with nonnegative
$k^{th}$--intermediate Ricci curvature that have a closed submanifold with
dimension $\geq k$ and infinite focal radius.
  To prove these results, we use the comparison lemma for Jacobi fields from
arXiv:1603.04050 that exploits Wilking's transverse Jacobi equation. The
comparison lemma also yields new information about group actions, Riemannian
submersions, and submetries, including generalizations to intermediate Ricci
curvature of results of Chen and Grove.
","[{""version"":""v1"",""created"":""Mon, 13 Jun 2016 20:06:22 GMT""},{""version"":""v2"",""created"":""Mon, 10 Oct 2016 15:09:38 GMT""},{""version"":""v3"",""created"":""Fri, 22 Feb 2019 16:46:18 GMT""}]","2019-02-26"
"1606.04123","Angel Rincon","Benjamin Koch, Ignacio A. Reyes, and Angel Rincon","A scale dependent black hole in three-dimensional space-time","12 pages, 4 figures; v2: references added, improved discussion,
  version published in Class. Quantum Grav","Classical and Quantum Gravity, Volume 33, Number 22, (2016)","10.1088/0264-9381/33/22/225010",,"hep-th gr-qc","http://arxiv.org/licenses/nonexclusive-distrib/1.0/","  Scale dependence at the level of the effective action is a generic result of
quantum field theory. Allowing for scale dependence of the gravitational
couplings leads to a generalization of the corresponding field equations. In
this work, those equations are solved by imposing the ""null energy condition""
in three-dimensional space time with stationary spherical symmetry. The
constants of integration are given in terms of the classical BTZ parameters
plus one additional constant, that parametrizes the strength of the scale
dependence. The properties such as asymptotics, horizon structure, and
thermodynamics are discussed. It is found that the black hole entropy shows a
remarkable transition from the usual ""area~law"" to an ""area~$\times$~radius""
law.
","[{""version"":""v1"",""created"":""Mon, 13 Jun 2016 20:14:46 GMT""},{""version"":""v2"",""created"":""Tue, 25 Oct 2016 20:17:32 GMT""}]","2016-10-27"
"1606.04124","Vincent Jacques","L. J. Mart\'inez, T. Pelini, V. Waselowski, J. R. Maze, B. Gil, G.
  Cassabois, and V. Jacques","Efficient single photon emission from a high-purity hexagonal boron
  nitride crystal","5 pages, 4 figures","Phys. Rev. B 94, 121405 (2016)","10.1103/PhysRevB.94.121405",,"cond-mat.mtrl-sci","http://arxiv.org/licenses/nonexclusive-distrib/1.0/","  Among a variety of layered materials used as building blocks in van der Waals
heterostructures, hexagonal boron nitride (hBN) appears as an ideal platform
for hosting optically-active defects owing to its large bandgap ($\sim 6$ eV).
Here we study the optical response of a high-purity hBN crystal under green
laser illumination. By means of photon correlation measurements, we identify
individual defects emitting a highly photostable fluorescence under ambient
conditions. A detailed analysis of the photophysical properties reveals a high
quantum efficiency of the radiative transition, leading to a single photon
source with very high brightness. These results illustrate how the wide range
of applications offered by hBN could be further extended to photonic-based
quantum information science and metrology.
","[{""version"":""v1"",""created"":""Mon, 13 Jun 2016 20:23:01 GMT""}]","2016-09-28"
"1606.04125","Fred McMorris","C. Garcia-Martinez, F.R. McMorris, O. Ortega and R.C. Powers","Axioms for consensus functions on the n-cube","12 pages",,,,"math.CO","http://arxiv.org/licenses/nonexclusive-distrib/1.0/","  An elementary general result is proved that allows for simple
characterizations of well-known location/consensus functions (median, mean and
center) on the n-cube. In addition, alternate new characterizations are given
for the median and anti-median functions on the n-cube.
","[{""version"":""v1"",""created"":""Mon, 13 Jun 2016 20:25:19 GMT""}]","2016-06-15"
"1606.04126","Arno Pauly","Takayuki Kihara and Arno Pauly","Dividing by zero - how bad is it, really?",,,,,"cs.LO","http://arxiv.org/licenses/nonexclusive-distrib/1.0/","  In computable analysis testing a real number for being zero is a fundamental
example of a non-computable task. This causes problems for division: We cannot
ensure that the number we want to divide by is not zero. In many cases, any
real number would be an acceptable outcome if the divisor is zero - but even
this cannot be done in a computable way.
  In this note we investigate the strength of the computational problem ""Robust
division"": Given a pair of real numbers, the first not greater than the other,
output their quotient if well-defined and any real number else. The formal
framework is provided by Weihrauch reducibility. One particular result is that
having later calls to the problem depending on the outcomes of earlier ones is
strictly more powerful than performing all calls concurrently. However, having
a nesting depths of two already provides the full power. This solves an open
problem raised at a recent Dagstuhl meeting on Weihrauch reducibility.
  As application for ""Robust division"", we show that it suffices to execute
Gaussian elimination.
","[{""version"":""v1"",""created"":""Mon, 13 Jun 2016 20:31:08 GMT""}]","2016-06-15"
"1606.04127","Benjamin Lev","Alicia J. Koll\'ar, Alexander T. Papageorge, Varun D. Vaidya, Yudan
  Guo, Jonathan Keeling, and Benjamin L. Lev","Supermode-Density-Wave-Polariton Condensation","12 pages, 9 figures","Nature Communications 8, 14386 (2017)","10.1038/ncomms14386",,"cond-mat.quant-gas quant-ph","http://arxiv.org/licenses/nonexclusive-distrib/1.0/","  Phase transitions, where observable properties of a many-body system change
discontinuously, can occur in both open and closed systems. Ultracold atoms
have provided an exemplary model system to demonstrate the physics of
closed-system phase transitions, confirming many theoretical models and
results. Our understanding of dissipative phase transitions in quantum systems
is less developed, and experiments that probe this physics even less so. By
placing cold atoms in optical cavities, and inducing strong coupling between
light and excitations of the atoms, one can experimentally study phase
transitions of open quantum systems. Here we observe and study a novel form of
nonequilibrium phase transition, the condensation of
supermode-density-wave-polaritons. These polaritons are formed from a hybrid
""supermode"" of cavity photons coupled to atomic density waves of a quantum gas.
Because the cavity supports multiple photon spatial modes, and because the
matter-light coupling can be comparable to the energy splitting of these modes,
the composition of the supermode polariton is changed by the matter-light
coupling upon condensation. These results, found in the few-mode-degenerate
cavity regime, demonstrate the potential of fully multimode cavities to exhibit
physics beyond mean-field theories. Such systems will provide experimental
access to nontrivial phase transitions in driven dissipative quantum systems as
well as enabling the studies of novel non-equilibrium spin glasses and
neuromorphic computation.
","[{""version"":""v1"",""created"":""Mon, 13 Jun 2016 20:32:15 GMT""}]","2017-02-23"
"1606.04128","Alexander Reznikov","S. V. Borodachov, D. P. Hardin, A. Reznikov, E. B. Saff","Optimal discrete measures for Riesz potentials",,,,,"math.CA","http://arxiv.org/licenses/nonexclusive-distrib/1.0/","  For $s\geqslant d$, we obtain the leading term as $N\to \infty$ of the
maximal weighted $N$-point Riesz $s$-polarization (or Chebyshev constant) for a
certain class of $d$-rectifiable compact subsets of $\mathbb{R}^p$. This class
includes compact subsets of $d$-dimensional $C^1$ manifolds whose boundary
relative to the manifold has $\mathcal{H}_d$-measure zero, as well as finite
unions of such sets when their pairwise intersections have
$\mathcal{H}_d$-measure zero. We also explicitly find the weak$^*$ limit
distribution of asymptotically optimal $N$-point polarization configurations as
$N\to \infty$.
","[{""version"":""v1"",""created"":""Mon, 13 Jun 2016 20:33:40 GMT""},{""version"":""v2"",""created"":""Wed, 1 Mar 2017 02:23:20 GMT""}]","2017-03-02"
"1606.04129","Garry Goldstein","Garry Goldstein, Claudio Chamon, Claudio Castelnovo","D-wave superconductivity in boson+fermion dimer models","12 pages, 3 figures","Phys. Rev. B 95, 174511 (2017)","10.1103/PhysRevB.95.174511",,"cond-mat.str-el","http://arxiv.org/licenses/nonexclusive-distrib/1.0/","  We present a slave-particle mean-field study of the mixed boson+fermion
quantum dimer model introduced by Punk, Allais, and Sachdev [PNAS 112, 9552
(2015)] to describe the physics of the pseudogap phase in cuprate
superconductors. Our analysis naturally leads to four charge e fermion pockets
whose total area is equal to the hole doping p, for a range of parameters
consistent with the t-J model for high temperature superconductivity. Here we
find that the dimers are unstable to d-wave superconductivity at low
temperatures. The region of the phase diagram with d-wave rather than s-wave
superconductivity matches well with the appearance of the four fermion pockets.
In the superconducting regime, the dispersion contains eight Dirac cones along
the diagonals of the Brillouin zone.
","[{""version"":""v1"",""created"":""Mon, 13 Jun 2016 20:34:25 GMT""}]","2017-05-24"
"1606.04130","Zachary Lipton","Zachary C. Lipton, David C. Kale, Randall Wetzel","Modeling Missing Data in Clinical Time Series with RNNs",,,,,"cs.LG cs.IR cs.NE stat.ML","http://arxiv.org/licenses/nonexclusive-distrib/1.0/","  We demonstrate a simple strategy to cope with missing data in sequential
inputs, addressing the task of multilabel classification of diagnoses given
clinical time series. Collected from the pediatric intensive care unit (PICU)
at Children's Hospital Los Angeles, our data consists of multivariate time
series of observations. The measurements are irregularly spaced, leading to
missingness patterns in temporally discretized sequences. While these artifacts
are typically handled by imputation, we achieve superior predictive performance
by treating the artifacts as features. Unlike linear models, recurrent neural
networks can realize this improvement using only simple binary indicators of
missingness. For linear models, we show an alternative strategy to capture this
signal. Training models on missingness patterns only, we show that for some
diseases, what tests are run can be as predictive as the results themselves.
","[{""version"":""v1"",""created"":""Mon, 13 Jun 2016 20:34:35 GMT""},{""version"":""v2"",""created"":""Mon, 8 Aug 2016 09:04:23 GMT""},{""version"":""v3"",""created"":""Thu, 18 Aug 2016 08:51:35 GMT""},{""version"":""v4"",""created"":""Tue, 20 Sep 2016 01:10:14 GMT""},{""version"":""v5"",""created"":""Fri, 11 Nov 2016 12:46:53 GMT""}]","2016-11-14"
"1606.04131","D. Ghilencea","D. M. Ghilencea, Hyun Min Lee","Bounds on supersymmetric effective operators from heavy diphoton
  searches","v3: 19 pages; additional results and figures","Modern Physics Letters A, Vol. 32, No. 13 (2017) 1750082","10.1142/S0217732317500821","CERN-PH-TH-2016-140","hep-ph","http://arxiv.org/licenses/nonexclusive-distrib/1.0/","  We identify the bounds on supersymmetric effective operators beyond MSSM,
from heavy diphoton resonance ($X$) negative searches at the LHC, where $X$ is
identified with the neutral CP-even (odd) $H$ ($A$) or both (mass degenerate).
While minimal supersymmetric models (MSSM, etc) comply with the data, a leading
effective operator of $d=6$ can contribute significantly to diphoton production
$\sigma\sim 1$ fb, well above its MSSM value and in conflict with recent data.
Both the $b\bar b$ and $gg$ production mechanisms of $H$ and $A$ can contribute
comparably to this. We examine the dependence of the diphoton cross section
$\sigma$ on the values of $m_X$, $\Lambda$ and $\tan\beta$, under the
experimental constraints from the SM-like higgs couplings $hgg$ and
$h\gamma\gamma$ (due to mixing) and from the $b\bar b$ and $t\bar t$ searches.
These give $\Lambda$ larger than $\sim 5$ TeV for $m_X$ in the range $0.5-1$
TeV. We show how to generate the $d=6$ effective operator from microscopic
(renormalizable) models. This demands the presence of vector-like states beyond
the MSSM spectrum (and eventually but not necessarily a gauge singlet), of mass
near $\Lambda$ and thus outside the LHC reach.
","[{""version"":""v1"",""created"":""Mon, 13 Jun 2016 20:45:26 GMT""},{""version"":""v2"",""created"":""Mon, 8 Aug 2016 10:17:36 GMT""},{""version"":""v3"",""created"":""Mon, 31 Oct 2016 17:45:58 GMT""}]","2017-05-10"
"1606.04133","Damien Scieur","Damien Scieur, Alexandre d'Aspremont and Francis Bach","Regularized Nonlinear Acceleration",,,,,"math.OC","http://arxiv.org/licenses/nonexclusive-distrib/1.0/","  We describe a convergence acceleration technique for unconstrained
optimization problems. Our scheme computes estimates of the optimum from a
nonlinear average of the iterates produced by any optimization method. The
weights in this average are computed via a simple linear system, whose solution
can be updated online. This acceleration scheme runs in parallel to the base
algorithm, providing improved estimates of the solution on the fly, while the
original optimization method is running. Numerical experiments are detailed on
classical classification problems.
","[{""version"":""v1"",""created"":""Mon, 13 Jun 2016 20:53:43 GMT""},{""version"":""v2"",""created"":""Fri, 31 Aug 2018 22:53:34 GMT""},{""version"":""v3"",""created"":""Sun, 14 Apr 2019 23:06:24 GMT""}]","2019-04-16"
"1606.04134","Mrinal Kanti Roychowdhury","Mrinal Kanti Roychowdhury","Least upper bound of the exact formula for optimal quantization of some
  uniform Cantor distributions","arXiv admin overlap: text overlap with arXiv:1605.09701",,,,"math.DS","http://arxiv.org/licenses/nonexclusive-distrib/1.0/","  The quantization scheme in probability theory deals with finding a best
approximation of a given probability distribution by a probability distribution
that is supported on finitely many points. Let $P$ be a Borel probability
measure on $\mathbb R$ such that $P=\frac 12 P\circ S_1^{-1}+\frac 12 P\circ
S_2^{-1},$ where $S_1$ and $S_2$ are two contractive similarity mappings given
by $S_1(x)=rx$ and $S_2(x)=rx+1-r$ for $0<r<\frac 12$ and $x\in \mathbb R$.
Then, $P$ is supported on the Cantor set generated by $S_1$ and $S_2$. The case
$r=\frac 13$ was treated by Graf and Luschgy who gave an exact formula for the
unique optimal quantization of the Cantor distribution $P$ (Math. Nachr., 183
(1997), 113-133). In this paper, we compute the precise range of $r$-values to
which Graf-Luschgy formula extends.
","[{""version"":""v1"",""created"":""Mon, 13 Jun 2016 20:58:48 GMT""},{""version"":""v2"",""created"":""Wed, 15 Jun 2016 18:38:59 GMT""},{""version"":""v3"",""created"":""Tue, 21 Jun 2016 05:35:42 GMT""},{""version"":""v4"",""created"":""Sat, 27 May 2017 06:56:22 GMT""},{""version"":""v5"",""created"":""Sat, 28 Oct 2017 03:38:50 GMT""},{""version"":""v6"",""created"":""Sat, 12 May 2018 04:07:55 GMT""}]","2019-06-17"
"1606.04135","Michael Famiano","M. A. Famiano, T. Kajino, W. Aoki, and T. Suda","Dependence of the Sr-to-Ba and Sr-to-Eu Ratio on the Nuclear Equation of
  State in Metal Poor Halo Stars","15 pages, 12 figures; To appear in ApJ","ApJ 830, 61 (2016)","10.3847/0004-637X/830/2/61",,"astro-ph.HE astro-ph.SR","http://arxiv.org/licenses/nonexclusive-distrib/1.0/","  A model is proposed in which the light r-process element enrichment in
metal-poor stars is explained via enrichment from a truncated r-process, or
""tr-process."" The truncation of the r-process from a generic core-collapse
event followed by a collapse into an accretion-induced black hole is examined
in the framework of a galactic chemical evolution model. The constraints on
this model imposed by observations of extremely metal-poor stars are explained,
and the upper limits in the [Sr/Ba] distributions are found to be related to
the nuclear equation of state in a collapse scenario. The scatter in [Sr/Ba]
and [Sr/Eu] as a function of metallicity has been found to be consistent with
turbulent ejection in core collapse supernovae. Adaptations of this model are
evaluated to account for the scatter in isotopic observables. This is done by
assuming mixing in ejecta in a supernova event.
","[{""version"":""v1"",""created"":""Mon, 13 Jun 2016 21:02:57 GMT""}]","2016-10-20"
"1606.04136","Neal Master","Neal Master and Carri W. Chan and Nicholas Bambos","Myopic Policies for Non-Preemptive Scheduling of Jobs with Decaying
  Value","Accepted for publication in Probability in the Engineering and
  Informational Sciences",,,,"cs.SY math.OC","http://arxiv.org/licenses/nonexclusive-distrib/1.0/","  In many scheduling applications, minimizing delays is of high importance. One
adverse effect of such delays is that the reward for completion of a job may
decay over time. Indeed in healthcare settings, delays in access to care can
result in worse outcomes, such as an increase in mortality risk. Motivated by
managing hospital operations in disaster scenarios, as well as other
applications in perishable inventory control and information services, we
consider non-preemptive scheduling of jobs whose internal value decays over
time. Because solving for the optimal scheduling policy is computationally
intractable, we focus our attention on the performance of three intuitive
heuristics: (1) a policy which maximizes the expected immediate reward, (2) a
policy which maximizes the expected immediate reward rate, and (3) a policy
which prioritizes jobs with imminent deadlines. We provide performance
guarantees for all three policies and show that many of these performance
bounds are tight. In addition, we provide numerical experiments and simulations
to compare how the policies perform in a variety of scenarios. Our theoretical
and numerical results allow us to establish rules-of-thumb for applying these
heuristics in a variety of situations, including patient scheduling scenarios.
","[{""version"":""v1"",""created"":""Mon, 13 Jun 2016 21:03:19 GMT""},{""version"":""v2"",""created"":""Thu, 22 Sep 2016 00:12:44 GMT""},{""version"":""v3"",""created"":""Fri, 21 Oct 2016 18:34:51 GMT""}]","2016-10-24"
"1606.04137","Yining Hu","Yining Hu","Combinatorial proof of the transcendence of $L(1,\chi_s)/\Pi$",,,,,"math.CO math.NT","http://arxiv.org/licenses/nonexclusive-distrib/1.0/","  We give a combinatorial proof of the transcendence of $L(1,\chi_s)/\Pi$,
where $L(1,\chi_s)$ (resp. $\Pi$) is the analogue in characteristic $p$ of the
function $L$ of Dirichlet (resp. $\pi$). This result has been proven by G.
Damamme using the criteria of de Mathan. Our proof is based on the Theorem of
Christol and another property of $k$-automatic sequences.
","[{""version"":""v1"",""created"":""Mon, 13 Jun 2016 21:04:36 GMT""},{""version"":""v2"",""created"":""Mon, 20 Jun 2016 14:29:34 GMT""}]","2016-06-21"
"1606.04138","Jessica Goodman","Linda M. Carpenter, Russell Colburn, Jessica Goodman, Tim Linden","Indirect Detection Constraints on s and t Channel Simplified Models of
  Dark Matter","13 pages, 13 figures","Phys. Rev. D 94, 055027 (2016)","10.1103/PhysRevD.94.055027",,"hep-ph astro-ph.HE","http://arxiv.org/licenses/nonexclusive-distrib/1.0/","  Recent Fermi-LAT observations of dwarf spheroidal galaxies in the Milky Way
have placed strong limits on the gamma-ray flux from dark matter annihilation.
In order to produce the strongest limit on the dark matter annihilation
cross-section, the observations of each dwarf galaxy have typically been
""stacked"" in a joint-likelihood analysis, utilizing optical observations to
constrain the dark matter density profile in each dwarf. These limits have
typically been computed only for singular annihilation final states, such as
$b\bar{b}$ or $\tau^+\tau^-$. In this paper, we generalize this approach by
producing an independent joint-likelihood analysis to set constraints on models
where the dark matter particle annihilates to multiple final state fermions. We
interpret these results in the context of the most popular simplified models,
including those with s- and t-channel dark matter annihilation through scalar
and vector mediators. We present our results as constraints on the minimum dark
matter mass and the mediator sector parameters. Additionally, we compare our
simplified model results to those of Effective Field Theory contact
interactions in the high-mass limit.
","[{""version"":""v1"",""created"":""Mon, 13 Jun 2016 21:05:06 GMT""}]","2016-09-28"
