"1606.04225","Vincenzo Bonifaci","Vincenzo Bonifaci","A revised model of fluid transport optimization in Physarum polycephalum","To appear in Journal of Mathematical Biology","Journal of Mathematical Biology, 74(3):567-581, 2017","10.1007/s00285-016-1036-y",,"q-bio.TO cs.DS cs.ET math.OC","http://arxiv.org/licenses/nonexclusive-distrib/1.0/","  Optimization of fluid transport in the slime mold Physarum polycephalum has
been the subject of several modeling efforts in recent literature. Existing
models assume that the tube adaptation mechanism in P. polycephalum's tubular
network is controlled by the sheer amount of fluid flow through the tubes. We
put forward the hypothesis that the controlling variable may instead be the
flow's pressure gradient along the tube. We carry out the stability analysis of
such a revised mathematical model for a parallel-edge network, proving that the
revised model supports the global flow-optimizing behavior of the slime mold
for a substantially wider class of response functions compared to previous
models. Simulations also suggest that the same conclusion may be valid for
arbitrary network topologies.
","[{""version"":""v1"",""created"":""Tue, 14 Jun 2016 07:25:49 GMT""}]","2019-07-01"
"1606.04226","Davide Gerosa","Davide Gerosa, Christopher J. Moore","Black hole kicks as new gravitational wave observables","6 pages, 3 figures. Accepted for publication in Physical Review
  Letters","Phys. Rev. Lett. 117, 011101 (2016)","10.1103/PhysRevLett.117.011101","LIGO-P1600118","gr-qc astro-ph.CO astro-ph.GA astro-ph.HE","http://arxiv.org/licenses/nonexclusive-distrib/1.0/","  Generic black hole binaries radiate gravitational waves anisotropically,
imparting a recoil, or kick, velocity to the merger remnant. If a component of
the kick along the line of sight is present, gravitational waves emitted during
the final orbits and merger will be gradually Doppler shifted as the kick
builds up. We develop a simple prescription to capture this effect in existing
waveform models, showing that future gravitational wave experiments will be
able to perform direct measurements, not only of the black hole kick velocity,
but also of its accumulation profile. In particular, the eLISA space mission
will measure supermassive black hole kick velocities as low as ~500 km/s, which
are expected to be a common outcome of black hole binary coalescence following
galaxy mergers. Black hole kicks thus constitute a promising new observable in
the growing field of gravitational wave astronomy.
","[{""version"":""v1"",""created"":""Tue, 14 Jun 2016 07:26:10 GMT""},{""version"":""v2"",""created"":""Wed, 29 Jun 2016 17:43:17 GMT""}]","2016-06-30"
"1606.04227","Jaehyun Kim","J. Kim and M. Yoon","Design Study of a Superconducting Gantry for Carbon Beam Therapy","11 pages, 8 figures",,"10.3938/jkps.69.1048",,"physics.acc-ph","http://creativecommons.org/licenses/by/4.0/","  This paper describes the design study of a gantry for a carbon beam. The
designed gantry is compact such that its size is comparable to the size of the
proton gantry. This is possible by introducing superconducting double helical
coils for dipole magnets. The gantry optics is designed in such a way that it
provides rotation-invariant optics and variable beam size as well as
point-to-parallel scanning of a beam. For large-aperture magnet,
three-dimensional magnetic field distribution is obtained by invoking a
computer code, and a number of particles are tracked by integrating equations
of motion numerically together with three-dimensional interpolation. The
beam-shape distortion due to the fringe field is reduced to an acceptable level
by optimizing the coil windings with the help of genetic algorithm.
Higher-order transfer coefficients are calculated and shown to be reduced
greatly with appropriate optimization of the coil windings.
","[{""version"":""v1"",""created"":""Tue, 14 Jun 2016 07:29:06 GMT""}]","2016-11-03"
"1606.04228","Eric Miqueu","Ion Grama, Quansheng Liu, Eric Miqueu","Asymptotic of the distribution and harmonic moments for a supercritical
  branching process in a random environment",,,,,"math.PR","http://arxiv.org/licenses/nonexclusive-distrib/1.0/","  Let $(Z_n)$ be a supercritical branching process in an independent and
identically distributed random environment $\xi$. We show the exact decay rate
of the probability $\mathbb{P}(Z_n=j | Z_0 = k)$ as $n \to \infty$, for each $j
\geq k,$ assuming that $\mathbb{P} (Z_1 = 0) =0$. We also determine the
critical value for the existence of harmonic moments of the random variable
$W=\lim_{n\to\infty}\frac{Z_n}{\mathbb E (Z_n|\xi)}$ under a simple moment
condition.
","[{""version"":""v1"",""created"":""Tue, 14 Jun 2016 07:29:46 GMT""}]","2016-06-15"
"1606.04229","Rasoul Roknizadeh","H. Lotfipour, S. Shahidani, R. Roknizadeh and M. H. Naderi","Response of a mechanical oscillator in an optomechanical cavity driven
  by a finite bandwidth squeezed vacuum excitation","13 pages","Physical Review A 93 (5), 053827 (2016)","10.1103/PhysRevA.93.053827",,"quant-ph","http://arxiv.org/licenses/nonexclusive-distrib/1.0/","  In this paper, we theoretically investigate the displacement and momentum
fluctuations spectra of the movable mirror in a standard optomechanical system
driven by a finite bandwidth squeezed vacuum light accompanying a coherent
laser field. Two cases in which the squeezed vacuum is generated by degenerated
and non-degenerate parametric oscillators (DPO and NDPO) are considered. We
find that for the case of finite bandwidth squeezed vacuum injection, the two
spectra exhibit unique features, which strongly differ from those of broadband
squeezing excitation. In particular, the spectra exhibit a three-peaked and a
four-peaked structure, respectively, for the squeezing injection from DPO and
NDPO. Besides, some anomalous characteristics of the spectra such as
squeezing-induced pimple, hole burning, and dispersive profile are found to be
highly sensitive to the squeezing parameters and the temperature of the mirror.
We also evaluate the mean-square fluctuations in position and momentum
quadratures of the movable mirror and analyze the influence of the squeezing
parameters of the input field on the mechanical squeezing. It will be shown
that the parameters of driven squeezed vacuum affects the squeezing. We find
the optimal mechanical squeezing is achievable via finite bandwidth squeezed
vacuum injection which is affected by the intensity of squeezed vacuum. We also
show that the phase of incident squeezed vacuum determines whether position or
momentum squeezing occurs. Our proposed scheme not only provides a feasible
experimental method to detect and characterize squeezed light by optomechanical
systems, but also suggests a way for controllable transfer of squeezing from an
optical field to a mechanical oscillator.
","[{""version"":""v1"",""created"":""Tue, 14 Jun 2016 07:30:55 GMT""}]","2016-06-15"
"1606.04230","Francois-Xavier Vialard","Rabah Tahraoui, Fran\c{c}ois-Xavier Vialard (Ceremade, Mokaplan)","Riemannian cubics on the group of diffeomorphisms and the Fisher-Rao
  metric","34 pages, comments welcome",,,,"math.OC","http://arxiv.org/licenses/nonexclusive-distrib/1.0/","  We study a second-order variational problem on the group of diffeomorphisms
of the interval [0, 1] endowed with a right-invariant Sobolev metric of order
2, which consists in the minimization of the acceleration. We compute the
relaxation of the problem which involves the so-called Fisher-Rao functional a
convex functional on the space of measures. This relaxation enables the
derivation of several optimality conditions and, in particular, a sufficient
condition which guarantees that a given path of the initial problem is also a
minimizer of the relaxed one. This sufficient condition is related to the
existence of a solution to a Riccati equation involving the path acceleration.
","[{""version"":""v1"",""created"":""Tue, 14 Jun 2016 07:31:10 GMT""},{""version"":""v2"",""created"":""Wed, 7 Sep 2016 09:28:06 GMT""}]","2016-09-08"
"1606.04231","Tomohiro Hayashi","Tomohiro Hayashi","On the conjecture of the norm Schwarz inequality","9 pages","Ann. Funct. Anal. 8, no. 3 (2017), 377-385","10.1215/20088752-2017-0003",,"math.FA","http://arxiv.org/licenses/nonexclusive-distrib/1.0/","  For any positive invertible matrix $A$ and any normal matrix $B$ in
$M_{n}({\Bbb C})$, we investigate whether the inequality $ ||A\sharp
(B^{*}A^{-1}B)||\geq ||B|| $ is true or not, where $\sharp$ denotes the
geometric mean and $||\cdot||$ denotes the operator norm. We will solve this
problem negatively. The related topics are also discussed.
","[{""version"":""v1"",""created"":""Tue, 14 Jun 2016 07:36:32 GMT""}]","2017-10-18"
"1606.04232","Maya Kabkab","Maya Kabkab, Azadeh Alavi, Rama Chellappa","DCNNs on a Diet: Sampling Strategies for Reducing the Training Set Size",,,,,"cs.CV cs.LG","http://arxiv.org/licenses/nonexclusive-distrib/1.0/","  Large-scale supervised classification algorithms, especially those based on
deep convolutional neural networks (DCNNs), require vast amounts of training
data to achieve state-of-the-art performance. Decreasing this data requirement
would significantly speed up the training process and possibly improve
generalization. Motivated by this objective, we consider the task of adaptively
finding concise training subsets which will be iteratively presented to the
learner. We use convex optimization methods, based on an objective criterion
and feedback from the current performance of the classifier, to efficiently
identify informative samples to train on. We propose an algorithm to decompose
the optimization problem into smaller per-class problems, which can be solved
in parallel. We test our approach on standard classification tasks and
demonstrate its effectiveness in decreasing the training set size without
compromising performance. We also show that our approach can make the
classifier more robust in the presence of label noise and class imbalance.
","[{""version"":""v1"",""created"":""Tue, 14 Jun 2016 07:38:13 GMT""}]","2016-06-15"
"1606.04233","Daniel Tanr\'e","David Chataur and Martintxo Saralegi-Aranguren and Daniel Tanr\'e","Singular decompositions of a cap product",,"Proceedings AMS 145 (2017), 3645-3656",,,"math.AT","http://arxiv.org/licenses/nonexclusive-distrib/1.0/","  In the case of a compact orientable pseudomanifold, a well-known theorem of
M. Goresky and R. MacPherson says that the cap product with a fundamental class
factorizes through the intersection homology groups. In this work, we show that
this classical cap product is compatible with a cap product in intersection
(co)-homology, that we have previously introduced. If the pseudomanifold is
also normal, for any commutative ring of coefficients, the existence of a
classical Poincar\'e duality isomorphism is equivalent to the existence of an
isomorphism between the intersection homology groups corresponding to the zero
and the top perversities.
","[{""version"":""v1"",""created"":""Tue, 14 Jun 2016 07:39:31 GMT""},{""version"":""v2"",""created"":""Wed, 21 Sep 2016 13:29:14 GMT""}]","2017-05-22"
"1606.04234","Vadim Kolesnikov","NA49 Collaboration: T. Anticic, B. Baatar, J. Bartke, H. Beck, L.
  Betev, H. Bia{\l}kowska, C. Blume, B. Boimska, J. Book, M. Botje, P.
  Bun\v{c}i\'c, P. Christakoglou, P. Chung, O. Chvala, J.G. Cramer, V. Eckardt,
  Z. Fodor, P. Foka, V. Friese, M. Ga\'zdzicki, K. Grebieszkow, C. H\""ohne, K.
  Kadija, A. Karev, V.I. Kolesnikov, M. Kowalski, D. Kresan, A. Laszlo, R.
  Lacey, M. van Leeuwen, M. Ma\'ckowiak-Paw{\l}owska, M. Makariev, A.I.
  Malakhov, G.L. Melkumov, M. Mitrovski, St. Mr\'owczy\'nski, G. P\'alla, A.D.
  Panagiotou, D. Prindle, F. P\""uhlhofer, R. Renfordt, C. Roland, G. Roland, A.
  Rustamov, M. Rybczy\'nski, A. Rybicki, A. Sandoval, N. Schmitz, T. Schuster,
  P. Seyboth, F. Sikl\'er, E. Skrzypczak, M. Slodkowski, G. Stefanek, R. Stock,
  H. Str\""obele, T. Susa, M. Szuba, D. Varga, M. Vassiliou, G.I. Veres, G.
  Vesztergombi, D. Vrani\'c, Z. W{\l}odarczyk, A. Wojtaszek-Szwarc","Production of deuterium, tritium, and $^3$He in central Pb+Pb collisions
  at 20A, 30A, 40A, 80A, and 158A GeV at the CERN SPS","22 pages, 29 figures, 8 tables, for submission to Phys. Rev. C","Phys. Rev. C 94, 044906 (2016)","10.1103/PhysRevC.94.044906",,"nucl-ex","http://arxiv.org/licenses/nonexclusive-distrib/1.0/","  Production of $d$, $t$, and $^3$He nuclei in central Pb+Pb interactions was
studied at five collision energies ($\sqrt{s_{NN}}=$ 6.3, 7.6, 8.8, 12.3, and
17.3 GeV) with the NA49 detector at the CERN SPS. Transverse momentum spectra,
rapidity distributions, and particle ratios were measured. Yields are compared
to predictions of statistical models. Phase-space distributions of light nuclei
are discussed and compared to those of protons in the context of a coalescence
approach. The coalescence parameters $B_2$ and $B_3$, as well as coalescence
radii for $d$ and $^3$He were determined as a function of transverse mass at
all energies.
","[{""version"":""v1"",""created"":""Tue, 14 Jun 2016 07:40:51 GMT""},{""version"":""v2"",""created"":""Wed, 15 Jun 2016 12:11:42 GMT""}]","2016-10-19"
"1606.04235","Johannes Carmesin","Nathan Bowler, Johannes Carmesin, Luke Postle","Reconstruction of infinite matroids from their 3-connected minors",,,,,"math.CO","http://arxiv.org/licenses/nonexclusive-distrib/1.0/","  We show that any infinite matroid can be reconstructed from the torsos of a
tree-decomposition over its 2-separations, together with local information at
the ends of the tree. We show that if the matroid is tame then this local
information is simply a choice of whether circuits are permitted to use that
end. The same is true if each torso is planar, with all gluing elements on a
common face.
","[{""version"":""v1"",""created"":""Tue, 14 Jun 2016 07:47:32 GMT""}]","2016-06-15"
"1606.04236","Sabrina M\""uller","Sabrina M\""uller, Onur Atan, Mihaela van der Schaar, Anja Klein","Context-Aware Proactive Content Caching with Service Differentiation in
  Wireless Networks","32 pages, 9 figures, to appear in IEEE Transactions on Wireless
  Communications, see http://doi.org/10.1109/TWC.2016.2636139","IEEE Transactions on Wireless Communications, vol. 16, no. 2, pp.
  1024-1036, Feb. 2017","10.1109/TWC.2016.2636139",,"cs.NI cs.LG","http://arxiv.org/licenses/nonexclusive-distrib/1.0/","  Content caching in small base stations or wireless infostations is considered
to be a suitable approach to improve the efficiency in wireless content
delivery. Placing the optimal content into local caches is crucial due to
storage limitations, but it requires knowledge about the content popularity
distribution, which is often not available in advance. Moreover, local content
popularity is subject to fluctuations since mobile users with different
interests connect to the caching entity over time. Which content a user prefers
may depend on the user's context. In this paper, we propose a novel algorithm
for context-aware proactive caching. The algorithm learns context-specific
content popularity online by regularly observing context information of
connected users, updating the cache content and observing cache hits
subsequently. We derive a sublinear regret bound, which characterizes the
learning speed and proves that our algorithm converges to the optimal cache
content placement strategy in terms of maximizing the number of cache hits.
Furthermore, our algorithm supports service differentiation by allowing
operators of caching entities to prioritize customer groups. Our numerical
results confirm that our algorithm outperforms state-of-the-art algorithms in a
real world data set, with an increase in the number of cache hits of at least
14%.
","[{""version"":""v1"",""created"":""Tue, 14 Jun 2016 07:53:47 GMT""},{""version"":""v2"",""created"":""Fri, 16 Dec 2016 15:03:53 GMT""}]","2017-05-11"
"1606.04237","Hyeok-Jung Kwon","Hyeok-Jung Kwon","Study on the microwave ion source of 100-MeV proton linac",,,"10.3938/jkps.69.967",,"physics.acc-ph","http://arxiv.org/licenses/nonexclusive-distrib/1.0/","  A microwave ion source is used as an ion source of 100-MeV proton accelerator
at Korea Multipurpose Accelerator Complex (KOMAC). The specifications of the
ion source are 50 keV in energy and 20 mA in peak current. The plasma is
operated in CW mode using magnetron and the pulse beam is extracted using
semiconductor switch located in the extraction power supply. The beam
characteristics were measured based on the pulse voltage and current. A test
stand was also installed to study the beam characteristics of the ion source in
off-line. In this paper, the pulse beam characteristics of the ion source are
presented and the installation of the test stand is reported.
","[{""version"":""v1"",""created"":""Tue, 14 Jun 2016 08:02:06 GMT""}]","2016-11-03"
"1606.04238","Frantisek Maca","F. Maca, J. Kudrnovsky, V. Drchal, I. Turek, O. Stelmakhovych, P.
  Beran, A. Llobet and X. Marti","Defect-induced magnetic structure of CuMnSb","9 pages, 6 figures",,"10.1103/PhysRevB.94.094407",,"cond-mat.mtrl-sci","http://arxiv.org/licenses/nonexclusive-distrib/1.0/","  Ab initio total energy calculations show that the antiferromagnetic (111)
order is not the ground state for the ideal CuMnSb Heusler alloy in contrast to
the results of neutron diffraction experiments. It is known, that Heusler
alloys usually contain various defects depending on the sample preparation. We
have therefore investigated magnetic phases of CuMnSb assuming the most common
defects which exist in real experimental conditions. The full-potential
supercell approach and a Heisenberg model approach using the coherent potential
approximation are adopted. The results of the total energy supercell
calculations indicate that defects that bring Mn atoms close together promote
the antiferromagnetic (111) structure already for a low critical defect
concentrations ($\approx$ 3%). A detailed study of exchange interactions
between Mn-moments further supports the above stabilization mechanism. Finally,
the stability of the antiferromagnetic (111) order is enhanced by inclusion of
electron correlations in narrow Mn-bands. The present refinement structure
analysis of neutron scattering experiment supports theoretical conclusions.
","[{""version"":""v1"",""created"":""Tue, 14 Jun 2016 08:02:25 GMT""}]","2016-09-21"
"1606.04239","Federico Carollo","Fabio Benatti, Federico Carollo","A non-Markovian Dissipative Maryland Model","14 pages, 6 figures","Open Syst. Inf. Dyn. 20, 1340001 (2013)","10.1142/S1230161213400015",,"quant-ph","http://arxiv.org/licenses/nonexclusive-distrib/1.0/","  The so-called Maryland model is a linear version of the quantum kicked rotor;
it exhibits Anderson localization in momentum space. By turning the kicks into
a Markovian stochastic process, the dynamics becomes a dissipative quantum
process described by a discrete family of completely positive maps that allows
to explicitly study the relation between divisibility of the maps and the
degree of memory of the process.
","[{""version"":""v1"",""created"":""Tue, 14 Jun 2016 08:03:45 GMT""}]","2016-06-15"
"1606.04240","Keehang Kwon","Keehang Kwon","For-loops in Logic Programming","5 pages. slightly revised from my previous Korean paper (KIPS
  transactions, part A, vol 19, no.1, 2012.)",,,,"cs.PL","http://arxiv.org/licenses/nonexclusive-distrib/1.0/","  Logic programming has traditiLogic programming has traditionally lacked
devices for expressing iterative tasks. To overcome this problem, this paper
proposes iterative goal formulas of the form $\seqandq{x}{L} G$ where $G$ is a
goal, $x$ is a variable, and $L$ is a list. $\seqandq{x}{L}$ is called a
parallel bounded quantifier. These goals allow us to specify the following
task: iterate $G$ with $x$ ranging over all the elements of $L$. onally lacked
devices for expressing iterative tasks. To overcome this problem, this paper
proposes iterative goal formulas of the form $\seqandq{x}{L} G$ where $G$ is a
goal, $x$ is a variable, and $L$ is a list. $\seqandq{x}{L}$ is called a
parallel bounded quantifier. These goals allow us to specify the following
task: iterate $G$ with $x$ ranging over all the elements of $L$.
","[{""version"":""v1"",""created"":""Tue, 14 Jun 2016 08:06:01 GMT""}]","2016-06-15"
"1606.04241","G\'erald Gurtner","G\'erald Gurtner and Christian Bongiorno and Marco Ducci and Salvatore
  Miccich\`e","An Empirically grounded Agent Based simulator for the Air Traffic
  Management in the SESAR scenario",,"JATM, 59, 26-43, (2017)","10.1016/j.jairtraman.2016.11.004",,"physics.soc-ph","http://arxiv.org/licenses/nonexclusive-distrib/1.0/","  In this paper we present a simulator allowing to perform policy experiments
relative to the air traffic management. Different SESAR solutions can be
implemented in the model to see the reaction of the different stakeholders as
well as other relevant metrics (delays, safety, etc). The model describes both
the strategic phase associated to the planning of the flight trajectories and
the tactical modifications occurring in the en-route phase. An implementation
of the model is available as open-source and freely accessible by any user.
  More specifically, different procedures related to business trajectories and
free-routing are tested and we illustrate the capabilities of the model on
airspace implementing these concepts. After performing numerical simulations
with the model, we show that in a free-routing scenario the controllers perform
less operations although they are dispersed over a larger portion of the
airspace. This can potentially increase the complexity of conflict detection
and resolution for controllers.
  In order to investigate this specific aspect, we consider some metrics used
to measure traffic complexity. We first show that in non-free-routing
situations our simulator deals with complexity in a way similar to what humans
would do. This allows us to be confident that the results of our numerical
simulations relative to the free-routing can reasonably forecast how human
controllers would behave in this new situation. Specifically, our numerical
simulations show that most of the complexity metrics decrease with
free-routing, while the few metrics which increase are all linked to the flight
level changes. This is a non-trivial result since intuitively the complexity
should increase with free-routing because of problematic geometries and more
dispersed conflicts over the airspace.
","[{""version"":""v1"",""created"":""Tue, 14 Jun 2016 08:08:37 GMT""}]","2021-08-30"
"1606.04242","Nimisha Kantharia","N. G. Kantharia (National Centre for Radio Astrophysics, Tata
  Institute of Fundamental Research, Pune)","Torques and angular momentum: Counter-rotation in galaxies and ring
  galaxies","12 pages, 4 figures",,,,"astro-ph.GA","http://arxiv.org/licenses/nonexclusive-distrib/1.0/","  We present an alternate origin scenario to explain the observed phenomena of
(1) counter-rotation between different galaxy components and (2) the formation
of ring galaxies. We suggest that these are direct consequences of the galaxy
being acted upon by a torque which causes a change in its primordial spin
angular momentum first observed as changes in the gas kinematics or
distribution. We suggest that this torque is exerted by the gravitational force
between nearby galaxies. This origin requires the presence of at least one
companion galaxy in the vicinity - we find a companion galaxy within 750 kpc
for 51/57 counter-rotating galaxies and literature indicates that all ring
galaxies have a companion galaxy thus giving observable credence to this
origin. Moreover in these 51 galaxies, we find a kinematic offset between
stellar and gas heliocentric velocities $>50$ kms$^{-1}$ for several galaxies
if the separation between the galaxies $<$ 100 kpc. This, we suggest, indicates
a change in the orbital angular momentum of the torqued galaxies. A major
difference between the torque origin suggested here and the existing model of
gas accretion/galaxy collision, generally used to explain the above two
phenomena, is that the torque acts on the matter of the same galaxy whereas in
the latter case gas, with different properties, is brought in from outside. An
important implication of our study is that mutual gravity torques acting on the
galaxy can explain the formation of warps, polar ring galaxies and lenticular
galaxies. We conclude that mutual gravity torques play an important role in the
dynamical evolution of galaxies and that they naturally explain several galaxy
observables.
","[{""version"":""v1"",""created"":""Tue, 14 Jun 2016 08:14:26 GMT""}]","2016-06-15"
