"1606.04315","Ammar Daskin","Ammar Daskin and Sabre Kais","An Ancilla Based Quantum Simulation Framework for Non-Unitary Matrices",,,"10.1007/s11128-016-1452-3",,"quant-ph cs.CC","http://arxiv.org/licenses/nonexclusive-distrib/1.0/","  The success probability in an ancilla based circuit generally decreases
exponentially in the number of qubits consisted in the ancilla. Although the
probability can be amplified through the amplitude amplification process, the
input dependence of the amplitude amplification makes difficult to sequentially
combine two or more ancilla based circuits. A new version of the amplitude
amplification known as the oblivious amplitude amplification runs independently
of the input to the system register. This allow us to to sequentially combine
two or more ancilla based circuits. However, this type of the amplification
only works when the considered system is unitary or non-unitary but somehow
close to a unitary.
  In this paper, we present a general framework to simulate non-unitary
matrices on ancilla based quantum circuits in which the success probability is
maximized by using the oblivious amplitude amplification. In particular, we
show how to extend a non-unitary matrix to an almost unitary matrix. We then
simulate the extended matrix by using an ancilla based circuit design along
with the oblivious amplitude amplification. Measuring the distance of the
produced matrix to the closest unitary unitary matrix, a lower bound for the
fidelity of the final state obtained from the oblivious amplitude amplification
process is presented. Numerical simulations for random matrices of different
sizes show that independent of the system size, the final amplified
probabilities are generally around 0.75 and the fidelity of the final state is
mostly high and around 0.95. Furthermore, we discuss the complexity analysis
and show that combining two such ancilla based circuits, a matrix product can
be implemented. This may lead us to efficiently implement matrix functions
represented as infinite matrix products on quantum computers.
","[{""version"":""v1"",""created"":""Tue, 14 Jun 2016 11:32:06 GMT""},{""version"":""v2"",""created"":""Sat, 10 Dec 2016 12:27:35 GMT""}]","2016-12-13"
"1606.04316","Alessio Benavoli","Alessio Benavoli, Giorgio Corani, Janez Demsar, Marco Zaffalon","Time for a change: a tutorial for comparing multiple classifiers through
  Bayesian analysis","This paper has been published in the Journal of Machine Learning
  Research (JMLR) vol.18, 2017",,,,"stat.ML cs.LG","http://arxiv.org/licenses/nonexclusive-distrib/1.0/","  The machine learning community adopted the use of null hypothesis
significance testing (NHST) in order to ensure the statistical validity of
results. Many scientific fields however realized the shortcomings of
frequentist reasoning and in the most radical cases even banned its use in
publications. We should do the same: just as we have embraced the Bayesian
paradigm in the development of new machine learning methods, so we should also
use it in the analysis of our own results. We argue for abandonment of NHST by
exposing its fallacies and, more importantly, offer better - more sound and
useful - alternatives for it.
","[{""version"":""v1"",""created"":""Tue, 14 Jun 2016 11:35:35 GMT""},{""version"":""v2"",""created"":""Fri, 24 Jun 2016 11:16:35 GMT""},{""version"":""v3"",""created"":""Sat, 15 Jul 2017 15:16:48 GMT""}]","2017-07-18"
"1606.04317","David van Leeuwen","David A. van Leeuwen and Joost van Doremalen","Calibration of Phone Likelihoods in Automatic Speech Recognition","Rejected by Interspeech 2016. I would love to include the reviews,
  but there is no space for that here (400 characters)",,,,"stat.ML cs.LG cs.SD","http://arxiv.org/licenses/nonexclusive-distrib/1.0/","  In this paper we study the probabilistic properties of the posteriors in a
speech recognition system that uses a deep neural network (DNN) for acoustic
modeling. We do this by reducing Kaldi's DNN shared pdf-id posteriors to phone
likelihoods, and using test set forced alignments to evaluate these using a
calibration sensitive metric. Individual frame posteriors are in principle
well-calibrated, because the DNN is trained using cross entropy as the
objective function, which is a proper scoring rule. When entire phones are
assessed, we observe that it is best to average the log likelihoods over the
duration of the phone. Further scaling of the average log likelihoods by the
logarithm of the duration slightly improves the calibration, and this
improvement is retained when tested on independent test data.
","[{""version"":""v1"",""created"":""Tue, 14 Jun 2016 11:44:31 GMT""}]","2016-06-15"
"1606.04318","Ralf Launhardt","N. Lippok, R. Launhardt, Th. Henning, Z. Balog. H. Beuther, J.
  Kainulainen, O. Krause, H. Linz, M. Nielbock, S. E. Ragan, T. P. Robitaille,
  S. I. Sadavoy and A. Schmiedeke","Earliest phases of star formation (EPoS): Dust temperature distributions
  in isolated starless cores","16 pages, 12 figures, accepted for publication in A&A","A&A 592, A61 (2016)","10.1051/0004-6361/201525792",,"astro-ph.GA","http://arxiv.org/licenses/nonexclusive-distrib/1.0/","  Constraining the temperature and density structure of dense molecular cloud
cores is fundamental for understanding the initial conditions of star
formation. We use Herschel observations of the thermal FIR dust emission from
nearby isolated molecular cloud cores and combine them with ground-based
submillimeter continuum data to derive observational constraints on their
temperature and density structure. The aim of this study is to verify the
validity of a ray-tracing inversion technique developed to derive the dust
temperature and density structure of isolated starless cores directly from the
dust emission maps and to test if the resulting temperature and density
profiles are consistent with physical models. Using this ray-tracing inversion
technique, we derive the dust temperature and density structure of six isolated
starless cloud cores. We employ self-consistent radiative transfer modeling to
the derived density profiles, treating the ISRF as the only heating source. The
best-fit values of local strength of the ISRF and the extinction by the outer
envelope are derived by comparing the self-consistently calculated temperature
profiles with those derived by the ray-tracing method. We find that all
starless cores are significantly colder inside than outside, with the core
temperatures showing a strong negative correlation with peak column density.
This suggests that their thermal structure is dominated by external heating
from the ISRF and shielding by dusty envelopes. The temperature profiles
derived with the ray-tracing inversion method can be well-reproduced with
self-consistent radiative transfer models.
","[{""version"":""v1"",""created"":""Tue, 14 Jun 2016 11:44:38 GMT""}]","2016-07-27"
"1606.04319","Matus Medo","Matus Medo, Giulio Cimini","Model-based evaluation of scientific impact indicators","12 pages, 8 figures","Phys. Rev. E 94, 032312 (2016)","10.1103/PhysRevE.94.032312",,"physics.soc-ph cs.DL cs.SI","http://arxiv.org/licenses/nonexclusive-distrib/1.0/","  Using bibliometric data artificially generated through a model of citation
dynamics calibrated on empirical data, we compare several indicators for the
scientific impact of individual researchers. The use of such a controlled setup
has the advantage of avoiding the biases present in real databases, and allows
us to assess which aspects of the model dynamics and which traits of individual
researchers a particular indicator actually reflects. We find that the simple
citation average performs well in capturing the intrinsic scientific ability of
researchers, whatever the length of their career. On the other hand, when
productivity complements ability in the evaluation process, the notorious $h$
and $g$ indices reveal their potential, yet their normalized variants do not
always yield a fair comparison between researchers at different career stages.
Notably, the use of logarithmic units for citation counts allows us to build
simple indicators with performance equal to that of $h$ and $g$. Our analysis
may provide useful hints for a proper use of bibliometric indicators.
Additionally, our framework can be extended by including other aspects of the
scientific production process and citation dynamics, with the potential to
become a standard tool for the assessment of impact metrics.
","[{""version"":""v1"",""created"":""Tue, 14 Jun 2016 11:45:41 GMT""}]","2016-09-21"
"1606.04320","Takuma Hayashi","Takuma Hayashi","Dg analogues of the Zuckerman functors and the dual Zuckerman functors
  II","19 pages",,,,"math.CT math.RT","http://arxiv.org/licenses/nonexclusive-distrib/1.0/","  In the first part of this series of papers we constructed dg analogues of the
Zuckerman functors over commutative rings and the dual Zuckerman functors over
the field of complex numbers. In this paper we construct their derived functors
in view of the theory of model categories.
","[{""version"":""v1"",""created"":""Tue, 14 Jun 2016 11:50:06 GMT""}]","2016-06-15"
"1606.04321","Sandra Unruh","Sandra Unruh and Peter Schneider and Dominique Sluse","Ambiguities in gravitational lens models: the density field from the
  source position transformation","13 pages, 16 figures, submitted to A&A","A&A 601, A77 (2017)","10.1051/0004-6361/201629048",,"astro-ph.CO","http://arxiv.org/licenses/nonexclusive-distrib/1.0/","  Strong gravitational lensing is regarded as the most precise technique to
measure the mass in the inner region of galaxies or galaxy clusters. In
particular, the mass within one Einstein radius can be determined with an
accuracy of order of a few percent or better, depending on the image
configuration. For other radii, however, degeneracies exist between galaxy
density profiles, precluding an accurate determination of the enclosed mass.
The source position transformation (SPT), which includes the well-known
mass-sheet transformation (MST) as a special case, describes this degeneracy of
the lensing observables in a more general way. In this paper we explore
properties of an SPT, removing the MST to leading order, i.e., we consider
degeneracies which have not been described before. The deflection field
$\boldsymbol{\hat{\alpha}}(\boldsymbol{\theta})$ resulting from an SPT is not
curl-free in general, and thus not a deflection that can be obtained from a
lensing mass distribution. Starting from a variational principle, we construct
lensing potentials that give rise to a deflection field
$\boldsymbol{\tilde{\alpha}}$, which differs from $\boldsymbol{\hat{\alpha}}$
by less than an observationally motivated upper limit. The corresponding mass
distributions from these 'valid' SPTs are studied: their radial profiles are
modified relative to the original mass distribution in a significant and
non-trivial way, and originally axi-symmetric mass distributions can obtain a
finite ellipticity. These results indicate a significant effect of the SPT on
quantitative analyses of lens systems. We show that the mass inside the
Einstein radius of the original mass distribution is conserved by the SPT;
hence, as is the case for the MST, the SPT does not affect the mass
determination at the Einstein radius. [...]
","[{""version"":""v1"",""created"":""Tue, 14 Jun 2016 11:51:28 GMT""}]","2017-05-10"
"1606.04322","Junyu Liu","Junyu Liu and Min Sheng and Lei Liu and Yan Shi and Jiandong Li","Modeling and Analysis of SCMA Enhanced D2D and Cellular Hybrid Network","submitted to IEEE Trans. Commun",,"10.1109/TCOMM.2016.2597282",,"cs.IT math.IT","http://arxiv.org/licenses/nonexclusive-distrib/1.0/","  Sparse code multiple access (SCMA) has been recently proposed for the future
wireless networks, which allows non-orthogonal spectrum resource sharing and
enables system overloading. In this paper, we apply SCMA into device-to-device
(D2D) communication and cellular hybrid network, targeting at using the
overload feature of SCMA to support massive device connectivity and expand
network capacity. Particularly, we develop a stochastic geometry based
framework to model and analyze SCMA, considering underlaid and overlaid mode.
Based on the results, we analytically compare SCMA with orthogonal
frequency-division multiple access (OFDMA) using area spectral efficiency (ASE)
and quantify closed-form ASE gain of SCMA over OFDMA. Notably, it is shown that
system ASE can be significantly improved using SCMA and the ASE gain scales
linearly with the SCMA codeword dimension. Besides, we endow D2D users with an
activated probability to balance cross-tier interference in the underlaid mode
and derive the optimal activated probability. Meanwhile, we study resource
allocation in the overlaid mode and obtain the optimal codebook allocation
rule. It is interestingly found that the optimal SCMA codebook allocation rule
is independent of cellular network parameters when cellular users are densely
deployed. The results are helpful in the implementation of SCMA in the hybrid
system.
","[{""version"":""v1"",""created"":""Tue, 14 Jun 2016 11:51:40 GMT""}]","2016-11-17"
"1606.04323","Ross McKenzie","Bijyalaxmi Athokpam and Sai G. Ramesh and Ross H. McKenzie","Effect of hydrogen bonding on infrared absorption intensity","12 pages, 10 figures","Chemical Physics 488 & 489 (2017) Page 43","10.1016/j.chemphys.2017.03.006",,"physics.chem-ph","http://arxiv.org/licenses/nonexclusive-distrib/1.0/","  We consider how the infrared intensity of an O-H stretch in a hydrogen bonded
complex varies as the strength of the H-bond varies from weak to strong. We
obtain trends for the fundamental and overtone transitions as a function of
donor-acceptor distance R, which is a common measure of H-bond strength. Our
calculations use a simple two-diabatic state model that permits symmetric and
asymmetric bonds, i.e. where the proton affinity of the donor and acceptor are
equal and unequal, respectively. The dipole moment function uses a Mecke form
for the free OH dipole moment, associated with the diabatic states. The
transition dipole moment is calculated using one-dimensional vibrational
eigenstates associated with the H-atom transfer coordinate on the ground state
adiabatic surface of our model. Over 20-fold intensity enhancements for the
fundamental are found for strong H-bonds, where there are significant
non-Condon effects. The isotope effect on the intensity yields a non-monotonic
H/D intensity ratio as a function of R, and is enhanced by the secondary
geometric isotope effect. The first overtone intensity is found to vary
non-monotonically with H-bond strength; strong enhancements are possible for
strong H-bonds. Modifying the dipole moment through the Mecke parameters is
found to have a stronger effect on the overtone than the fundamental. We
compare our findings with those for specific molecular systems analysed through
experiments and theory in earlier works. Our model results compare favourably
for strong and medium strength symmetric H-bonds. However, for weak asymmetric
bonds we find much smaller effects than in earlier work.
","[{""version"":""v1"",""created"":""Tue, 14 Jun 2016 11:59:08 GMT""}]","2017-03-30"
"1606.04324","Santanu Maiti K.","Madhumita Saha, Santanu K. Maiti","Magnetic response of non-interacting and interacting electrons in a
  M\""{o}bius strip","9 pages, 14 figures (Accepted for Publication in Superlattices and
  Microstructures)","Superlattices and Microstructures, Volume 100, December 2016,
  Pages 1081-1093","10.1016/j.spmi.2016.10.080",,"cond-mat.mes-hall","http://creativecommons.org/licenses/by/4.0/","  We investigate characteristic features of both non-interacting and
interacting electrons in a M\""{o}bius strip, the simplest possible one-sided
topological system, in presence of an Aharonov-Bohm flux $\phi$. Using
Hartree-Fock mean field theory we determine energy eigenvalues for the
interacting model, while for the non-interacting system an analytical
prescription is given. The interplay between longitudinal and vertical motions
of electrons along with on-site Hubbard interaction yield several anomalous
features of persistent current associated with energy-flux characteristics. The
variation of current with system size and its temperature dependences are also
critically examined. Current is highly sensitive to both these two factors, and
we find that for a particular system size it decreases exponentially with
temperature. Our analysis can be helpful in investigating electronic transport
through any non-trivial topological material.
","[{""version"":""v1"",""created"":""Tue, 14 Jun 2016 12:23:41 GMT""},{""version"":""v2"",""created"":""Fri, 21 Oct 2016 12:40:23 GMT""}]","2016-12-20"
"1606.04325","Joseph Shomberg","Joseph L. Shomberg","Well-posedness and global attractors for a non-isothermal viscous
  relaxation of nonlocal Cahn-Hilliard equations","To appear in AIMS Mathematics, Nonlinear Evolution PDEs, Interfaces
  and Applications",,,,"math.AP","http://arxiv.org/licenses/nonexclusive-distrib/1.0/","  We investigate a non-isothermal viscous relaxation of some nonlocal
Cahn-Hilliard equations. This perturbation problem generates a family of
solution operators, exhibiting dissipation and conservation. The solution
operators admit a family of compact global attractors that are bounded in a
more regular phase-space.
","[{""version"":""v1"",""created"":""Tue, 14 Jun 2016 12:23:48 GMT""},{""version"":""v2"",""created"":""Thu, 16 Jun 2016 16:18:07 GMT""},{""version"":""v3"",""created"":""Tue, 28 Jun 2016 01:47:21 GMT""},{""version"":""v4"",""created"":""Mon, 11 Jul 2016 16:39:53 GMT""}]","2016-07-12"
"1606.04326","J\""urgen Stockburger","J\""urgen T. Stockburger and Thomas Motz","Thermodynamic deficiencies of some simple Lindblad operators","7 pages, 3 figures, invited contribution to special volume ""FQMT'15:
  Frontiers of Quantum and Mesoscopic Thermodynamics (Prague, Czech Republic,
  27 July - 1 August 2015)"". v2: minor corrections, one additional reference","Fortschr. Phys.65, No. 6--8, 1600067 (2017)","10.1002/prop.201600067",,"cond-mat.stat-mech quant-ph","http://arxiv.org/licenses/nonexclusive-distrib/1.0/","  Master equations of Lindblad type have attained prominent status in the
fields of quantum optics and quantum information since they are guaranteed to
satisfy fundamental notions of quantum dynamics such as complete positivity.
When Lindblad operators are used to describe thermal reservoirs in contact with
an open quantum system, the fundamental laws of thermodynamics and the
fluctuation-dissipation theorem provide additional mandatory criteria. We show
several examples of innocent-looking Lindblad operators which have questionable
properties in this regard. Compatibility criteria between Hamiltonian and
Lindblad terms as well as consequences of their violation are discussed. An
alternative stochastic approach to dissipative quantum dynamics is outlined and
illustrated through a harmonic-chain model for which the approach of local
Lindblad operators fails.
","[{""version"":""v1"",""created"":""Tue, 14 Jun 2016 12:30:11 GMT""},{""version"":""v2"",""created"":""Fri, 7 Oct 2016 12:54:38 GMT""}]","2019-09-04"
"1606.04327","Pawel Foremski","Pawel Foremski, David Plonka, Arthur Berger","Entropy/IP: Uncovering Structure in IPv6 Addresses","Paper presented at the ACM IMC 2016 in Santa Monica, USA
  (https://dl.acm.org/citation.cfm?id=2987445). Live Demo site available at
  http://www.entropy-ip.com/","IMC '16 Proceedings of the 2016 ACM on Internet Measurement
  Conference, pp. 167-181","10.1145/2987443.2987445",,"cs.NI cs.AI cs.IT math.IT","http://arxiv.org/licenses/nonexclusive-distrib/1.0/","  In this paper, we introduce Entropy/IP: a system that discovers Internet
address structure based on analyses of a subset of IPv6 addresses known to be
active, i.e., training data, gleaned by readily available passive and active
means. The system is completely automated and employs a combination of
information-theoretic and machine learning techniques to probabilistically
model IPv6 addresses. We present results showing that our system is effective
in exposing structural characteristics of portions of the IPv6 Internet address
space populated by active client, service, and router addresses.
  In addition to visualizing the address structure for exploration, the system
uses its models to generate candidate target addresses for scanning. For each
of 15 evaluated datasets, we train on 1K addresses and generate 1M candidates
for scanning. We achieve some success in 14 datasets, finding up to 40% of the
generated addresses to be active. In 11 of these datasets, we find active
network identifiers (e.g., /64 prefixes or `subnets') not seen in training.
Thus, we provide the first evidence that it is practical to discover subnets
and hosts by scanning probabilistically selected areas of the IPv6 address
space not known to contain active hosts a priori.
","[{""version"":""v1"",""created"":""Tue, 14 Jun 2016 12:38:26 GMT""},{""version"":""v2"",""created"":""Mon, 21 Nov 2016 12:43:00 GMT""}]","2016-11-22"
"1606.04328","Marian Stanishkov","Marian Stanishkov","Second Order RG Flow in General su(2) Coset Models","29 pages, references added. arXiv admin note: text overlap with
  arXiv:1404.7628",,"10.1007/JHEP09(2016)040",,"hep-th","http://arxiv.org/licenses/nonexclusive-distrib/1.0/","  We consider a RG flow in a general su(2) coset model perturbed by the least
relevant field. The perturbing field as well as some particular fields of
dimension close to one are constructed recursively in terms of lower level
fields. Using this construction we obtain the structure constants and the
four-point correlation functions in the leading order. This allows us to
compute the mixing coefficients among the fields in the UV and the IR theory.
It turns out that they are in agreement with those found recently using the
domain wall construction up to this order.
","[{""version"":""v1"",""created"":""Tue, 14 Jun 2016 12:43:09 GMT""},{""version"":""v2"",""created"":""Wed, 22 Jun 2016 12:54:55 GMT""},{""version"":""v3"",""created"":""Mon, 4 Jul 2016 10:48:14 GMT""}]","2016-10-12"
"1606.04329","Kazushi Iwasawa","K. Iwasawa, A. C. Fabian, E. Kara, C. S. Reynolds, G. Miniutti, F.
  Tombesi","Highly ionized disc and transient outflows in the Seyfert galaxy IRAS
  18325-5926","10 pages, 8 figures, Accepted for publication in A&A","A&A 592, A98 (2016)","10.1051/0004-6361/201528030",,"astro-ph.GA astro-ph.HE","http://arxiv.org/licenses/nonexclusive-distrib/1.0/","  We report on strong X-ray variability and the Fe K band spectrum of the
Seyfert galaxy IRAS 18325-5926 obtained from the 2001 XMM-Newton EPIC pn
observation of a 120 ks duration. While the X-ray source is highly variable,
the 8-10 keV band shows larger variability than that of the lower energies.
Amplified 8-10 keV flux variations are associated with two prominent flares of
the X-ray source during the observation. The Fe K emission is peaked at 6.6 keV
with moderate broadening. It is likely to originate from a highly ionized disc
with the ionization parameter of log xi ~3. The Fe K line flux responds to the
major flare, supporting its disc origin. There is a short burst of the Fe line
flux with no relation to the continuum brightness for which we have no clear
explanation. We also find transient, blueshifted Fe K absorption features,
which can be identified with high-velocity (~0.2 c) outflows of highly ionized
gas, as found in other active galaxies. The deepest absorption feature appears
only briefly (~1 hr) at the onset of the major flare and disappears when the
flare is declining. The rapid evolution of the absorption spectrum makes this
source peculiar among the active galaxies with high velocity outflows. Another
detection of the absorption feature also precedes the other flare. The
variability of the absorption feature partly accounts for the excess
variability in the 8-10 keV band where the absorption feature appears. Although
no reverberation measurement is available, the black hole mass of 2e6 Msun is
inferred from the X-ray variability. When this mass is assumed, the black hole
is accreting at around the Eddington limit, which may fit the highly ionized
disc and strong outflows observed in this galaxy.
","[{""version"":""v1"",""created"":""Tue, 14 Jun 2016 12:44:49 GMT""},{""version"":""v2"",""created"":""Mon, 20 Jun 2016 13:21:21 GMT""}]","2016-08-10"
