"1601.01840","Christoph S\""urgers","C. S\""urgers, W. Kittler, T. Wolf, H. v. Loehneysen","Anomalous Hall effect in the noncollinear antiferromagnet Mn5Si3","7 pages, 4 figures","AIP Advances Vol. 6, 055604 (2016)","10.1063/1.4943759",,"cond-mat.mtrl-sci cond-mat.mes-hall","http://arxiv.org/licenses/nonexclusive-distrib/1.0/","  Metallic antiferromagnets with noncollinear orientation of magnetic moments
provide a playground for investigating spin-dependent transport properties by
analysis of the anomalous Hall effect. The intermetallic compound Mn5Si3 is an
intinerant antiferromagnet with collinear and noncollinear magnetic structures
due to Mn atoms on two inequivalent lattice sites. Here, magnetotransport
measurements on polycrystalline thin films and a single crystal are reported.
In all samples, an additional contribution to the anomalous Hall effect
attributed to the noncollinear arrangment of magnetic moments is observed.
Furthermore, an additional magnetic phase between the noncollinear and
collinear regimes above a metamagnetic transition is resolved in the single
crystal by the anomalous Hall effect.
","[{""version"":""v1"",""created"":""Fri, 8 Jan 2016 12:01:26 GMT""}]","2016-03-10"
"1601.01841","Hendrik Flasche","Hendrik Flasche","Expected number of real roots of random trigonometric polynomials","15 pages",,,,"math.PR","http://arxiv.org/licenses/nonexclusive-distrib/1.0/","  We investigate the asymptotics of the expected number of real roots of random
trigonometric polynomials $$ X_n(t)=u+\frac{1}{\sqrt{n}}\sum_{k=1}^n
(A_k\cos(kt)+B_k\sin(kt)), \quad t\in [0,2\pi],\quad u\in\mathbb{R} $$ whose
coefficients $A_k, B_k$, $k\in\mathbb{N}$, are independent identically
distributed random variables with zero mean and unit variance. If $N_n[a, b]$
denotes the number of real roots of $X_n$ in an interval $[a,b]\subseteq
[0,2\pi]$, we prove that $$ \lim_{n\rightarrow\infty} \frac{\mathbb{E}
N_n[a,b]}{n}=\frac{b-a}{\pi\sqrt{3}} e^{-\frac{u^2}{2}}. $$
","[{""version"":""v1"",""created"":""Fri, 8 Jan 2016 12:02:22 GMT""}]","2016-01-11"
"1601.01842","Rana Nandi","Rana Nandi and Stefan Schramm","Low density nuclear matter with quantum molecular dynamics : The role of
  the symmetry energy","19 pages, 9 figures","Phys. Rev. C 94, 025806 (2016)","10.1103/PhysRevC.94.025806",,"nucl-th astro-ph.SR","http://arxiv.org/licenses/nonexclusive-distrib/1.0/","  We study the effect of isospin-dependent nuclear forces on the pasta phase in
the inner crust of neutron stars. To this end we model the crust within the
framework of quantum molecular dynamics (QMD). For maximizing the numerical
performance, a newly developed code has been implemented on GPU processors. As
a first application of the crust studies we investigate the dependence of the
particular pasta phases on the isospin dependence of the interaction, including
non-linear terms in this sector of the interactions. Our results indicate that
in contrast to earlier studies the phase diagram of the pasta phase is not very
sensitive to isospin effects. We show that the extraction of the isospin
parameters like asymmetry energy and slope from numerical data is affected by
higher-order terms in the asymmetry dependence of the energies per particle.
Furthermore, a rapid transition from the pasta to a homogeneous phase is
observed even for proton-to-neutron ratios typical for a supernova environment.
","[{""version"":""v1"",""created"":""Fri, 8 Jan 2016 12:05:10 GMT""},{""version"":""v2"",""created"":""Thu, 25 Aug 2016 20:59:22 GMT""}]","2016-08-29"
"1601.01843","Xueliang Li","Xueliang Li, Yongtang Shi","Derivatives and real roots of graph polynomials","14 pages. This will appear as a chapter in a book: Graph Polynomials,
  Edited by M. Dehmer et al., CRC Press/Taylor & Francis Group, LLC",,,,"math.CO","http://arxiv.org/licenses/nonexclusive-distrib/1.0/","  Graph polynomials are polynomials assigned to graphs. Interestingly, they
also arise in many areas outside graph theory as well. Many properties of graph
polynomials have been widely studied. In this paper, we survey some results on
the derivative and real roots of graph polynomials, which have applications in
chemistry, control theory and computer science. Related to the derivatives of
graph polynomials, polynomial reconstruction of the matching polynomial is also
introduced.
","[{""version"":""v1"",""created"":""Fri, 8 Jan 2016 12:08:51 GMT""},{""version"":""v2"",""created"":""Tue, 12 Jan 2016 03:57:23 GMT""}]","2016-01-13"
"1601.01844","Carlos Mejia-Monasterio","Stephan De Bi\`evre, Carlos Mej\'ia-Monasterio, Paul E. Parris","Dynamical mechanisms leading to equilibration in two-component gases","5 pages, 5 figures","Phys. Rev. E 93, 050103 (2016)","10.1103/PhysRevE.93.050103",,"cond-mat.stat-mech","http://arxiv.org/licenses/nonexclusive-distrib/1.0/","  Demonstrating how microscopic dynamics cause large systems to approach
thermal equilibrium remains an elusive, longstanding, and actively-pursued goal
of statistical mechanics. We identify here a dynamical mechanism for
thermalization in a general class of two-component dynamical Lorentz gases, and
prove that each component, even when maintained in a non-equilibrium state
itself, can drive the other to a thermal state with a well-defined effective
temperature.
","[{""version"":""v1"",""created"":""Fri, 8 Jan 2016 12:11:59 GMT""}]","2016-06-01"
"1601.01845","Marcella Di Criscienzo","P. Ventura, A. I. Karakas, F. Dell'Agli, D. A. Garc\'ia-Hern\'andez,
  M. L. Boyer and M. Di Criscienzo","On the nature of the most obscured C-rich AGB stars in the Magellanic
  Clouds","14 pages, 5 figures, 1 table; accepted for publication in MNRAS Main
  Journal",,"10.1093/mnras/stw074",,"astro-ph.SR astro-ph.GA","http://arxiv.org/licenses/nonexclusive-distrib/1.0/","  The stars in the Magellanic Clouds with the largest degree of obscuration are
used to probe the highly uncertain physics of stars in the asymptotic giant
branch (AGB) phase of evolution. Carbon stars in particular, provide key
information on the amount of third dredge-up (TDU) and mass loss. We use two
independent stellar evolution codes to test how a different treatment of the
physics affects the evolution on the AGB. The output from the two codes are
used to determine the rates of dust formation in the circumstellar envelope,
where the method used to determine the dust is the same for each case. The
stars with the largest degree of obscuration in the LMC and SMC are identified
as the progeny of objects of initial mass $2.5-3~M_{\odot}$ and $\sim
1.5~M_{\odot}$, respectively. This difference in mass is motivated by the
difference in the star formation histories of the two galaxies, and offers a
simple explanation of the redder infrared colours of C-stars in the LMC
compared to their counterparts in the SMC. The comparison with the Spitzer
colours of C-rich AGB stars in the SMC shows that a minimum surface carbon mass
fraction $X(C) \sim 5\times 10^{-3}$ must have been reached by stars of initial
mass around $1.5~M_{\odot}$. Our results confirm the necessity of adopting
low-temperature opacities in stellar evolutionary models of AGB stars. These
opacities allow the stars to obtain mass-loss rates high enough ($\gtrsim
10^{-4}M_{\odot}/yr$) to produce the amount of dust needed to reproduce the
Spitzer colours
","[{""version"":""v1"",""created"":""Fri, 8 Jan 2016 12:12:43 GMT""}]","2016-02-17"
"1601.01846","Jean Philippe Beaulieu R","J.P. Beaulieu, D.P. Bennett, V. Batista, A. Fukui, J.-B. Marquette, S.
  Brillant, A.A. Cole, L.A. Rogers, T. Sumi, F. Abe, A. Bhattacharya, N.
  Koshimoto, D. Suzuki, P.J. Tristram, C. Han, A. Gould, R. Pogge and J. Yee","Revisiting the microlensing event OGLE 2012-BLG-0026: A solar mass star
  with two cold giant planets","6 pages, 4 figures, submitted to ApJ",,"10.3847/0004-637X/824/2/83",,"astro-ph.EP","http://arxiv.org/licenses/nonexclusive-distrib/1.0/","  Two cold, gas giant planets orbiting a G-type main sequence star in the
galactic disk have previously been discovered in the high magnification
microlensing event OGLE-2012-BLG-0026 (Han et al. 2013). Here we present
revised host star flux measurements and a refined model for the two-planet
system using additional light curve data. We performed high angular resolution
adaptive optics imaging with the Keck and Subaru telescopes at two epochs while
the source star was still amplified. We detected the lens flux, $H=16.39 \pm
0.08$. The lens, a disk star, is brighter than predicted from the modeling in
the original study. We revisited the light curve modeling using additional
photometric data from the B\&C telescope in New Zealand and CTIO 1.3m H band
light curve. We then include the Keck and Subaru adaptive optic observation
constraints. The system is composed of a $\sim 4-9$ Gyr lens star of $\rm
M_{lens} = 1.06 \pm 0.05~\,M_\odot$ at a distance of $\rm D_{lens} = 4.0 \pm
0.3~$kpc, orbited by two giant planets of $\rm 0.145 \pm 0.008\ M_{\rm Jup}$
and $0.86 \pm 0.06~\rm M_{\rm Jup}$ with projected separations of $4.0 \pm 0.5
$ AU and $4.8 \pm 0.7$ AU respectively. Since the lens is brighter than the
source star by $16 \pm 8 \%$ in H, with no other blend within one arcsec, it
will be possible to estimate its metallicity by subsequent IR spectroscopy with
8--10~m class telescopes. By adding a constraint on the metallicity it will be
possible to refine the age of the system.
","[{""version"":""v1"",""created"":""Fri, 8 Jan 2016 12:13:50 GMT""}]","2016-06-22"
"1601.01847","Yunkyu Bang","Yunkyu Bang","The Origin of Condensation Energy Scaling of the Fe-based
  superconductors","7 pages, 4 figures","EPL 115 (2016) 27002","10.1209/0295-5075/115/27002",,"cond-mat.supr-con","http://arxiv.org/licenses/nonexclusive-distrib/1.0/","  Motivated by the recent experiment of the non-BCS scaling relation of the
condensation energy $\Delta CE$ vs. $T_c$ ($\Delta CE \sim T_c ^{\beta},
\beta\approx 3.5$) [PRB 89 140503 (2014)] for the Fe-based superconductors, we
studied the CE and $T_c$ of the multiband BCS superconductors. We showed that
the experimentally observed anomalous scaling relation $\Delta CE \sim T_c
^{3.5}$ is well reproduced by the two-band BCS superconductor paired by a
dominant interband interaction ($V_{inter} > V_{intra}$). Our result implies
that this seemingly non-BCS-like scaling behavior, on the contrary to the
common expectation, is in fact a strong experimental evidence that the pairing
mechanism of the Fe-based superconductors is genuinely a BCS mechanism, meaning
that ""the Cooper pairs are formed by the itinerant carriers glued by a pairing
interaction.""
","[{""version"":""v1"",""created"":""Fri, 8 Jan 2016 12:13:58 GMT""},{""version"":""v2"",""created"":""Thu, 18 Aug 2016 06:34:17 GMT""}]","2016-08-24"
"1601.01848","Tiago Botari T.B.","Tiago Botari, Ricardo Paupitz, Pedro Alves da Silva Autreto, Douglas S
  Galvao","Graphene healing mechanisms: A theoretical investigation","21 pages, 7 figures","Carbon Volume 99, April 2016, Pages 302-309","10.1016/j.carbon.2015.11.070",,"cond-mat.mes-hall cond-mat.mtrl-sci physics.chem-ph physics.comp-ph","http://arxiv.org/licenses/nonexclusive-distrib/1.0/","  Large holes in graphene membranes were recently shown to heal, either at room
temperature during a low energy STEM experiment, or by annealing at high
temperatures. However, the details of the healing mechanism remain unclear. We
carried out fully atomistic reactive molecular dynamics simulations in order to
address these mechanisms under different experimental conditions. Our results
show that, if a carbon atom source is present, high temperatures can provide
enough energy for the carbon atoms to overcome the potential energy barrier and
to produce perfect reconstruction of the graphene hexagonal structure. At room
temperature, this perfect healing is only possible if the heat effects of the
electron beam from STEM experiment are explicitly taken into account. The
reconstruction process of a perfect or near perfect graphene structure involves
the formation of linear carbon chains, as well as rings containing 5, 6, 7 and
8 atoms with planar (Stone-Wales) and non-planar (lump like) structures. These
results shed light on the healing mechanism of graphene when subjected to
different experimental conditions. Additionally, the methodology presented here
can be useful for investigating the tailoring and manipulations of other
nano-structures.
","[{""version"":""v1"",""created"":""Fri, 8 Jan 2016 12:14:55 GMT""}]","2016-01-11"
"1601.01849","Matteo Fasiolo","Matteo Fasiolo, Simon N. Wood, Florian Hartig, Mark V. Bravington","An Extended Empirical Saddlepoint Approximation for Intractable
  Likelihoods",,,,,"stat.ME stat.AP","http://arxiv.org/licenses/nonexclusive-distrib/1.0/","  The challenges posed by complex stochastic models used in computational
ecology, biology and genetics have stimulated the development of approximate
approaches to statistical inference. Here we focus on Synthetic Likelihood
(SL), a procedure that reduces the observed and simulated data to a set of
summary statistics, and quantifies the discrepancy between them through a
synthetic likelihood function. SL requires little tuning, but it relies on the
approximate normality of the summary statistics. We relax this assumption by
proposing a novel, more flexible, density estimator: the Extended Empirical
Saddlepoint approximation. In addition to proving the consistency of SL, under
either the new or the Gaussian density estimator, we illustrate the method
using two examples. One of these is a complex individual-based forest model for
which SL offers one of the few practical possibilities for statistical
inference. The examples show that the new density estimator is able to capture
large departures from normality, while being scalable to high dimensions, and
this in turn leads to more accurate parameter estimates, relative to the
Gaussian alternative. The new density estimator is implemented by the esaddle R
package, which can be found on the Comprehensive R Archive Network (CRAN).
","[{""version"":""v1"",""created"":""Fri, 8 Jan 2016 12:20:46 GMT""},{""version"":""v2"",""created"":""Mon, 25 Jan 2016 15:31:47 GMT""},{""version"":""v3"",""created"":""Tue, 12 Apr 2016 20:34:46 GMT""},{""version"":""v4"",""created"":""Thu, 1 Dec 2016 14:52:31 GMT""},{""version"":""v5"",""created"":""Thu, 8 Jun 2017 16:44:11 GMT""}]","2017-06-09"
"1601.01850","Georges Comte","Raf Cluckers, Georges Comte, Daniel J. Miller, Jean-Philippe Rolin,
  Tamara Servi","Integration of Oscillatory and Subanalytic Functions","Final version. Accepted for publication in Duke Math. Journal.
  Changes in proofs: from Section 6 to the end, we now use the theory of
  continuously uniformly distributed modulo 1 functions that provides a uniform
  technical point of view in the proofs of limit statements","Duke Math. J. 167, no. 7 (2018), 1239-1309","10.1215/00127094-2017-0056",,"math.AG math.CA math.LO","http://arxiv.org/licenses/nonexclusive-distrib/1.0/","  We prove the stability under integration and under Fourier transform of a
concrete class of functions containing all globally subanalytic functions and
their complex exponentials. This paper extends the investigation started in
[J.-M. Lion, J.-P. Rolin: ""Volumes, feuilles de Rolle de feuilletages
analytiques et th\'eor\`eme de Wilkie"" Ann. Fac. Sci. Toulouse Math. (6) 7
(1998), no. 1, 93-112] and [R. Cluckers, D. J. Miller: ""Stability under
integration of sums of products of real globally subanalytic functions and
their logarithms"" Duke Math. J. 156 (2011), no. 2, 311-348] to an enriched
framework including oscillatory functions. It provides a new example of
fruitful interaction between analysis and singularity theory.
","[{""version"":""v1"",""created"":""Fri, 8 Jan 2016 12:22:21 GMT""},{""version"":""v2"",""created"":""Mon, 11 Dec 2017 11:33:41 GMT""}]","2018-05-23"
"1601.01851","Khoa Vo","Khoa Vo, Adrian Muntean","A Note on Iterations-based Derivations of High-order Homogenization
  Correctors for Multiscale Semi-linear Elliptic Equations","1 figure",,"10.1016/j.aml.2016.02.009",,"math.AP math.FA","http://arxiv.org/licenses/nonexclusive-distrib/1.0/","  This Note aims at presenting a simple and efficient procedure to derive the
structure of high-order corrector estimates for the homogenization limit
applied to a semi-linear elliptic equation posed in perforated domains. Our
working technique relies on monotone iterations combined with formal two-scale
homogenization asymptotics. It can be adapted to handle more complex scenarios
including for instance nonlinearities posed at the boundary of perforations and
the vectorial case, when the model equations are coupled only through the
nonlinear production terms.
","[{""version"":""v1"",""created"":""Fri, 8 Jan 2016 12:24:48 GMT""}]","2016-03-15"
"1601.01852","Na Zhang","Qia Li, Yuesheng Xu and Na Zhang","Two-step Fixed-point proximity algorithms for multi-block separable
  convex problems","22 pages, 6 figues",,,,"math.OC","http://arxiv.org/licenses/nonexclusive-distrib/1.0/","  Multi-block separable convex problems recently received considerable
attention. This class of optimization problems minimizes a separable convex
objective function with linear constraints. The algorithmic challenges come
from the fact that the classic alternating direction method of multipliers
(ADMM) for the problem is not necessarily convergent. However, it is observed
that ADMM outperforms numerically many of its variants with guaranteed
theoretical convergence. The goal of this paper is to develop convergent and
computationally efficient algorithms for solving multi-block separable convex
problems. We first characterize the solutions of the optimization problems by
proximity operators of the convex functions involved in their objective
function. We then design a two-step fixed-point iterative scheme for solving
these problems based on the characterization. We further prove convergence of
the iterative scheme and show that it has O(1/k) convergence rate in the
ergodic sense and the sense of the partial primal-dual gap, where k denotes the
iteration number. Moreover, we derive specific two-step fixed-point proximity
algorithms (2SFPPA) from the proposed iterative scheme and establish their
global convergence. Numerical experiments for solving the sparse MRI problem
demonstrate the numerical efficiency of the proposed 2SFPPA.
","[{""version"":""v1"",""created"":""Fri, 8 Jan 2016 12:25:31 GMT""},{""version"":""v2"",""created"":""Wed, 17 Aug 2016 06:34:36 GMT""}]","2016-08-18"
"1601.01853","Richard Rand","Si Mohamed Sah and Richard H. Rand","Delay Terms in the Slow Flow",,,,,"math.DS","http://arxiv.org/licenses/nonexclusive-distrib/1.0/","  This work concerns the dynamics of nonlinear systems that are subjected to
delayed self-feedback. Perturbation methods applied to such systems give rise
to slow flows which characteristically contain delayed variables. We consider
two approaches to analyzing Hopf bifurcations in such slow flows. In one
approach, which we refer to as approach I, we follow many researchers in
replacing the delayed variables in the slow flow with non-delayed variables,
thereby reducing the DDE slow flow to an ODE. In a second approach, which we
refer to as approach II, we keep the delayed variables in the slow flow. By
comparing these two approaches we are able to assess the accuracy of making the
simplifying assumption which replaces the DDE slow flow by an ODE. We apply
this comparison to two examples, Duffing and van der Pol equations with
self-feedback.
","[{""version"":""v1"",""created"":""Fri, 8 Jan 2016 12:29:24 GMT""}]","2016-01-11"
"1601.01854","Zolt\'an Scher\""ubl","Zolt\'an Scher\""ubl, Gerg\H{o} F\""ul\""op, Morten Hannibal Madsen,
  Jesper Nyg\r{a}rd, Szabolcs Csonka","Electrical tuning of Rashba spin-orbit interaction in multigated InAs
  nanowires","7 pages, 3 figures","Phys. Rev. B 94, 035444 (2016)","10.1103/PhysRevB.94.035444",,"cond-mat.mes-hall","http://arxiv.org/licenses/nonexclusive-distrib/1.0/","  Indium arsenide (InAs) nanowires (NWs) are a promising platform to fabricate
quantum electronic devices, among others they have strong spin-orbit
interaction (SOI). The controlled tuning of the SOI is desired in spin based
quantum devices. In this study we investigate the possibility of tuning the SOI
by electrostatic field, which is generated by a back gate and two side gates
placed on the opposite sides of the NW. The strength of the SOI is analyzed by
weak anti-localization effect. We demonstrate that the strength of SOI can be
strongly tuned by a factor of 2 with the electric field across the NW, while
the average electron density is kept constant. Furthermore a simple
electrostatic model is introduced to calculate the expected change of SOI. Good
agreement is found between the experimental results and the estimated Rashba
type SOI generated by the gate-induced electric field.
","[{""version"":""v1"",""created"":""Fri, 8 Jan 2016 12:29:35 GMT""}]","2016-08-03"
"1601.01855","Zazralt Magic","Zazralt Magic","Scaling of the asymptotic entropy jump in the superadiabatic layers of
  stellar atmospheres","6 pages, 6 figures, accepted for publication in A&A","A&A 586, A88 (2016)","10.1051/0004-6361/201527438",,"astro-ph.SR","http://arxiv.org/licenses/nonexclusive-distrib/1.0/","  Stellar structure calculations are able to predict precisely the properties
of stars during their evolution. However, convection is still modelled by the
mixing length theory; therefore, the upper boundary conditions near the optical
surface do not agree with asteroseismic observations. We want to improve how
the outer boundary conditions are determined in stellar structure calculations.
We study realistic 3D stellar atmosphere models to find alternative properties.
We find that the asymptotic entropy run of the superadiabatic convective
surface layers exhibit a distinct universal stratification when normalised by
the entropy minimum and jump. The normalised entropy can be represented by a
5th order polynomial very accurately, and a 3rd order polynomial also yields
accurate coefficients. This generic entropy stratification or the solar
stratification, when scaled by the entropy jump and minimum, can be used to
improve the modelling of superadiabatic surface layers in stellar structure
calculations. Furthermore, this finding indicates that surface convection
operates in the same way for all cool stars, but requires further scrutiny in
order to improve our understanding of stellar atmospheres.
","[{""version"":""v1"",""created"":""Fri, 8 Jan 2016 12:32:32 GMT""}]","2016-02-03"
"1601.01856","Carsten Schneider","Jakob Ablinger and Johannes Bluemlein and Abilio de Freitas and
  Carsten Schneider","A toolbox to solve coupled systems of differential and difference
  equations",,,,"DESY 16-003, DO-TH 16/01","cs.SC hep-ph hep-th math-ph math.MP","http://arxiv.org/licenses/nonexclusive-distrib/1.0/","  We present algorithms to solve coupled systems of linear differential
equations, arising in the calculation of massive Feynman diagrams with local
operator insertions at 3-loop order, which do {\it not} request special choices
of bases. Here we assume that the desired solution has a power series
representation and we seek for the coefficients in closed form. In particular,
if the coefficients depend on a small parameter $\ep$ (the dimensional
parameter), we assume that the coefficients themselves can be expanded in
formal Laurent series w.r.t.\ $\ep$ and we try to compute the first terms in
closed form. More precisely, we have a decision algorithm which solves the
following problem: if the terms can be represented by an indefinite nested
hypergeometric sum expression (covering as special cases the harmonic sums,
cyclotomic sums, generalized harmonic sums or nested binomial sums), then we
can calculate them. If the algorithm fails, we obtain a proof that the terms
cannot be represented by the class of indefinite nested hypergeometric sum
expressions. Internally, this problem is reduced by holonomic closure
properties to solving a coupled system of linear difference equations. The
underlying method in this setting relies on decoupling algorithms, difference
ring algorithms and recurrence solving. We demonstrate by a concrete example
how this algorithm can be applied with the new Mathematica package
\texttt{SolveCoupledSystem} which is based on the packages \texttt{Sigma},
\texttt{HarmonicSums} and \texttt{OreSys}. In all applications the
representation in $x$-space is obtained as an iterated integral representation
over general alphabets, generalizing Poincar\'{e} iterated integrals.
","[{""version"":""v1"",""created"":""Fri, 8 Jan 2016 12:34:28 GMT""}]","2016-01-11"
"1601.01857","Olof Bergvall","Olof Bergvall","Cohomology of Complements of Toric Arrangements Associated to Root
  Systems","18 pages. Added information about the $E_8$ root system. The part
  about $A_n$ has been moved to its own paper (Cohomology of the toric
  arrangement associated with An)",,,,"math.AG math.CO","http://arxiv.org/licenses/nonexclusive-distrib/1.0/","  We compute the cohomology of the complement of toric arrangements associated
to root systems as representations of the corresponding Weyl groups.
Specifically, we develop an algorithm for computing the cohomology of the
complement of toric arrangements associated to general root systems and we
carry out this computation for the exceptional root systems $G_2$, $F_4$, $E_6$
and $E_7$. We also compute the total cohomology of the complement of the toric
arrangement associated to $A_n$ as a representation of the Weyl group and give
a formula for its Poincar\'e polynomial.
","[{""version"":""v1"",""created"":""Fri, 8 Jan 2016 12:36:36 GMT""},{""version"":""v2"",""created"":""Fri, 31 Jul 2020 11:12:24 GMT""}]","2020-08-03"
