"1601.01579","J\""urgen Koslowski","Florent Jacquemard, Luc Segoufin, Jer\'emie Dimino","FO2(<,+1,~) on data trees, data tree automata and branching vector
  addition systems",,"Logical Methods in Computer Science, Volume 12, Issue 2 (April 26,
  2016) lmcs:1635","10.2168/LMCS-12(2:3)2016",,"cs.FL","http://arxiv.org/licenses/nonexclusive-distrib/1.0/","  A data tree is an unranked ordered tree where each node carries a label from
a finite alphabet and a datum from some infinite domain. We consider the two
variable first order logic FO2(<,+1,~) over data trees. Here +1 refers to the
child and the next sibling relations while < refers to the descendant and
following sibling relations. Moreover, ~ is a binary predicate testing data
equality. We exhibit an automata model, denoted DAD# that is more expressive
than FO2(<,+1,~) but such that emptiness of DAD# and satisfiability of
FO2(<,+1,~) are inter-reducible. This is proved via a model of counter tree
automata, denoted EBVASS, that extends Branching Vector Addition Systems with
States (BVASS) with extra features for merging counters. We show that, as
decision problems, reachability for EBVASS, satisfiability of FO2(<,+1,~) and
emptiness of DAD# are equivalent.
","[{""version"":""v1"",""created"":""Thu, 7 Jan 2016 16:01:31 GMT""},{""version"":""v2"",""created"":""Sat, 23 Apr 2016 23:16:22 GMT""}]","2019-03-14"
"1601.01580","Ran Levi","Pawe Dotko, Kathryn Hess, Ran Levi, Max Nolte, Michael Reimann,
  Martina Scolamiero, Katharine Turner, Eilif Muller, Henry Markram","Topological analysis of the connectome of digital reconstructions of
  neural microcircuits",,,"10.3389/fncom.2017.00048",,"q-bio.NC math.AT","http://arxiv.org/licenses/nonexclusive-distrib/1.0/","  A recent publication provides the network graph for a neocortical
microcircuit comprising 8 million connections between 31,000 neurons (H.
Markram, et al., Reconstruction and simulation of neocortical microcircuitry,
Cell, 163 (2015) no. 2, 456-492). Since traditional graph-theoretical methods
may not be sufficient to understand the immense complexity of such a biological
network, we explored whether methods from algebraic topology could provide a
new perspective on its structural and functional organization. Structural
topological analysis revealed that directed graphs representing connectivity
among neurons in the microcircuit deviated significantly from different
varieties of randomized graph. In particular, the directed graphs contained in
the order of $10^7$ simplices {\DH} groups of neurons with all-to-all directed
connectivity. Some of these simplices contained up to 8 neurons, making them
the most extreme neuronal clustering motif ever reported. Functional
topological analysis of simulated neuronal activity in the microcircuit
revealed novel spatio-temporal metrics that provide an effective classification
of functional responses to qualitatively different stimuli. This study
represents the first algebraic topological analysis of structural connectomics
and connectomics-based spatio-temporal activity in a biologically realistic
neural microcircuit. The methods used in the study show promise for more
general applications in network science.
","[{""version"":""v1"",""created"":""Thu, 7 Jan 2016 16:02:05 GMT""}]","2017-06-13"
"1601.01581","Damir Yeliussizov","Damir Yeliussizov","Duality and deformations of stable Grothendieck polynomials","Journal of Algebraic Combinatorics, 2016",,"10.1007/s10801-016-0708-4",,"math.CO","http://arxiv.org/licenses/nonexclusive-distrib/1.0/","  Stable Grothendieck polynomials can be viewed as a K-theory analog of Schur
polynomials. We extend stable Grothendieck polynomials to a two-parameter
version, which we call canonical stable Grothendieck functions. These functions
have the same structure constants (with scaling) as stable Grothendieck
polynomials, and (composing with parameter switching) are self-dual under the
standard involutive ring automorphism. We study various properties of these
functions, including combinatorial formulas, Schur expansions, Jacobi-Trudi
type identities, and associated Fomin-Greene operators.
","[{""version"":""v1"",""created"":""Thu, 7 Jan 2016 16:06:47 GMT""},{""version"":""v2"",""created"":""Fri, 9 Sep 2016 21:11:43 GMT""}]","2016-09-13"
"1601.01582","Manolis Antonoyiannakis","Manolis Antonoyiannakis","Highlighting Impact and the Impact of Highlighting: PRB Editors'
  Suggestions","Editorial","Physical Review B 92, 210001 (2015)","10.1103/PhysRevB.92.210001",,"physics.soc-ph cs.DL","http://arxiv.org/licenses/nonexclusive-distrib/1.0/","  Associate Editor Manolis Antonoyiannakis discusses the highlighting, as
Editors' Suggestions, of a small percentage of the papers published each week.
We highlight papers primarily for their importance and impact in their
respective fields, or because we find them particularly interesting or elegant.
It turns out that the additional layer of scrutiny involved in the selection of
papers as Editors' Suggestions is associated with a significantly elevated and
sustained citation impact.
","[{""version"":""v1"",""created"":""Thu, 7 Jan 2016 16:20:18 GMT""}]","2016-01-08"
"1601.01583","Paul Chesler","Paul M. Chesler","How big are the smallest drops of quark-gluon plasma?","21 pages, 7 figures, typos corrected",,"10.1007/JHEP03(2016)146",,"hep-th gr-qc hep-ph nucl-th","http://arxiv.org/licenses/nonexclusive-distrib/1.0/","  Using holographic duality, we present results for both head-on and off-center
collisions of Gaussian shock waves in strongly coupled $\mathcal N = 4$
supersymmetric Yang-Mills theory. The shock waves superficially resemble
Lorentz contracted colliding protons. The collisions results in the formation
of a plasma whose evolution is well described by viscous hydrodynamics. The
size of the produced droplet is $R \sim 1/T_{\rm eff}$ where $T_{\rm eff}$ is
the effective temperature, which is the characteristic microscopic scale in
strongly coupled plasma. These results demonstrate the applicability of
hydrodynamics to microscopically small systems and bolster the notion that
hydrodynamics can be applied to heavy-light ion collisions as well as some
proton-proton collisions.
","[{""version"":""v1"",""created"":""Thu, 7 Jan 2016 16:22:53 GMT""},{""version"":""v2"",""created"":""Mon, 22 Feb 2016 00:49:23 GMT""}]","2016-04-20"
"1601.01584","Cristian  Cirac\`i","Cristian Cirac\`i and Fabio Della Sala","Quantum Hydrodynamic Theory for Plasmonics: Impact of the Electron
  Density Tail",,"Phys. Rev. B 93, 205405 (2016)","10.1103/PhysRevB.93.205405",,"cond-mat.mes-hall","http://arxiv.org/licenses/nonexclusive-distrib/1.0/","  Multiscale plasmonic systems e.g. extended metallic nanostructures with
sub-nanometer inter-distances) play a key role in the development of
next-generation nano-photonic devices.
  An accurate modeling of the optical interactions in these systems requires an
accurate description of both quantum effects and far-field properties.
  Classical electromagnetism can only describe the latter, while Time-Dependent
Density Functional Theory (TD-DFT) can provide a full first-principles quantum
treatment.
  However, TD-DFT becomes computationally prohibitive for sizes that exceed few
nanometers, which are irrelevant for practical applications. In this article,
we introduce a method based on the quantum hydrodynamic theory (QHT), which
includes non-local contributions of the kinetic energy and the correct
asymptotic description of the electron density.
  We show that our QHT method can predict both plasmon energy and spill-out
effects in metal nanoparticles in excellent agreement with TD-DFT predictions,
thus allowing a reliable and efficient calculations of both quantum and
far-field properties in multiscale plasmonic systems.
","[{""version"":""v1"",""created"":""Thu, 7 Jan 2016 16:25:22 GMT""},{""version"":""v2"",""created"":""Mon, 9 May 2016 10:23:03 GMT""}]","2016-05-11"
"1601.01585","Bowen Xiao","Yoshitaka Hatta, Bo-Wen Xiao, Feng Yuan","Probing the Small-$x$ Gluon Tomography in Correlated Hard Diffractive
  Dijet Production in DIS","6 pages, 1 figure","Phys. Rev. Lett. 116, 202301 (2016)","10.1103/PhysRevLett.116.202301","YITP-16-1","hep-ph nucl-th","http://arxiv.org/licenses/nonexclusive-distrib/1.0/","  We investigate the close connection between the quantum phase space Wigner
distribution of small-$x$ gluons and the color dipole scattering amplitude, and
propose to study it experimentally in the hard diffractive dijet production at
the planned electron-ion collider. The angular correlation between the nucleon
recoiled momentum and the dijet transverse momentum will probe the nontrivial
correlation in the phase space Wigner distribution. This experimental study
will not only provide us with three-dimensional tomographic pictures of gluons
inside high energy proton, but also give a unique and interesting signal for
the small-$x$ dynamics with QCD evolution effects.
","[{""version"":""v1"",""created"":""Thu, 7 Jan 2016 16:25:49 GMT""}]","2016-05-25"
"1601.01586","Ranald Clouston","Ale\v{s} Bizjak, Hans Bugge Grathwohl, Ranald Clouston, Rasmus E.
  M{\o}gelberg, Lars Birkedal","Guarded Dependent Type Theory with Coinductive Types","This is the technical report version of a paper to appear in the
  proceedings of FoSSaCS 2016",,,,"cs.LO cs.PL","http://arxiv.org/licenses/nonexclusive-distrib/1.0/","  We present guarded dependent type theory, gDTT, an extensional dependent type
theory with a `later' modality and clock quantifiers for programming and
proving with guarded recursive and coinductive types. The later modality is
used to ensure the productivity of recursive definitions in a modular, type
based, way. Clock quantifiers are used for controlled elimination of the later
modality and for encoding coinductive types using guarded recursive types. Key
to the development of gDTT are novel type and term formers involving what we
call `delayed substitutions'. These generalise the applicative functor rules
for the later modality considered in earlier work, and are crucial for
programming and proving with dependent types. We show soundness of the type
theory with respect to a denotational model.
","[{""version"":""v1"",""created"":""Thu, 7 Jan 2016 16:26:14 GMT""}]","2016-01-08"
"1601.01587","Jan Kr\v{c}\'al","Holger Hermanns, Jan Kr\v{c}\'al, Steen Vester","Distributed Synthesis in Continuous Time",,,,,"cs.DC cs.LO","http://arxiv.org/licenses/nonexclusive-distrib/1.0/","  We introduce a formalism modelling communication of distributed agents
strictly in continuous-time. Within this framework, we study the problem of
synthesising local strategies for individual agents such that a specified set
of goal states is reached, or reached with at least a given probability. The
flow of time is modelled explicitly based on continuous-time randomness, with
two natural implications: First, the non-determinism stemming from interleaving
disappears. Second, when we restrict to a subclass of non-urgent models, the
quantitative value problem for two players can be solved in EXPTIME. Indeed,
the explicit continuous time enables players to communicate their states by
delaying synchronisation (which is unrestricted for non-urgent models). In
general, the problems are undecidable already for two players in the
quantitative case and three players in the qualitative case. The qualitative
undecidability is shown by a reduction to decentralized POMDPs for which we
provide the strongest (and rather surprising) undecidability result so far.
","[{""version"":""v1"",""created"":""Thu, 7 Jan 2016 16:30:11 GMT""}]","2016-01-08"
"1601.01588","G\""oran Wahnstr\""om","Sven A. E. Johansson and G. Wahnstr\""om","First-principles derived complexion diagrams for phase boundaries in
  doped cemented carbides",,,"10.1016/j.cossms.2016.05.009",,"cond-mat.mtrl-sci","http://arxiv.org/licenses/nonexclusive-distrib/1.0/","  This article reviews a method for calculating an equilibrium interfacial
phase diagram depicting regions of stability for different interface structures
as function of temperature and chemical potentials. Density functional theory
(DFT) is used for interfacial energies, Monte Carlo simulations together with
cluster expansions based on DFT results for obtaining configurational free
energies, and CALPHAD-type modeling for describing the thermodynamic properties
of the adjoining bulk phases. An explicit case, vanadium doped cemented
carbides, is chosen to illustrate the progress in the research field and the
interfacial diagram, a complexion diagram, for the phase boundary WC(0001)/Co
is constructed as function of temperature and chemical potentials.
","[{""version"":""v1"",""created"":""Thu, 7 Jan 2016 16:31:24 GMT""}]","2016-11-23"
"1601.01589","Georges Kordopatis","G. Kordopatis, N.C. Amorisco, N.W. Evans, G. Gilmore, S.E. Koposov","Chemodynamic subpopulations of the Carina dwarf galaxy","9 pages, 9 figures, accepted for publication in MNRAS",,"10.1093/mnras/stw073",,"astro-ph.GA","http://arxiv.org/licenses/nonexclusive-distrib/1.0/","  We study the chemodynamical properties of the Carina dwarf spheroidal by
combining an intermediate spectroscopic resolution dataset of more than 900 red
giant and red clump stars, with high-precision photometry to derive the
atmospheric parameters, metallicities and age estimates for our targets. Within
the red giant branch population, we find evidence for the presence of three
distinct stellar sub-populations with different metallicities, spatial
distributions, kinematics and ages. As in the Fornax and Sculptor dwarf
spheroidals, the subpopulation with the lowest average metallicity is more
extended and kinematically hotter than all other populations. However, we
identify an inversion in the parallel ordering of metallicity, kinematics and
characteristic length scale in the two most metal rich subpopulations, which
therefore do not contribute to a global negative chemical gradient. Contrary to
common trends in the chemical properties with radius, the metal richest
population is more extended and mildly kinematically hotter than the main
component of intermediate metallicity. More investigations are required to
ascertain the nature of this inversion, but we comment on the mechanisms that
might have caused it.
","[{""version"":""v1"",""created"":""Thu, 7 Jan 2016 16:33:34 GMT""}]","2016-02-17"
"1601.01590","Zoran Skoda","Jerzy Lukierski, Zoran \v{S}koda, Mariusz Woronowicz","On Hopf algebroid structure of kappa-deformed Heisenberg algebra","11 pages, RevTeX4, to appear in Proceedings of IX-th International
  Symposium ""Quantum Theory and Symmetries"" (QTS-9), held July 13-18, 2015,
  Yerevan; to be published in ""Physics of Atomic Nuclei"" (English Version of
  ""Jadernaja Fizika""), ed. G. Pogosyan",,"10.1134/S1063778817030188",,"math-ph hep-th math.MP math.QA","http://creativecommons.org/licenses/by/4.0/","  The $(4+4)$-dimensional $\kappa$-deformed quantum phase space as well as its
$(10+10)$-dimensional covariant extension by the Lorentz sector can be
described as Heisenberg doubles: the $(10+10)$-dimensional quantum phase space
is the double of $D=4$ $\kappa$-deformed Poincar\'e Hopf algebra $\mathbb{H}$
and the standard $(4+4)$-dimensional space is its subalgebra generated by
$\kappa$-Minkowski coordinates $\hat{x}_\mu$ and corresponding commuting
momenta $\hat{p}_\mu$. Every Heisenberg double appears as the total algebra of
a Hopf algebroid over a base algebra which is in our case the coordinate
sector. We exhibit the details of this structure, namely the corresponding
right bialgebroid and the antipode map. We rely on algebraic methods of
calculation in Majid-Ruegg bicrossproduct basis. The target map is derived from
a formula by J-H. Lu. The coproduct takes values in the bimodule tensor product
over a base, what is expressed as the presence of coproduct gauge freedom.
","[{""version"":""v1"",""created"":""Thu, 7 Jan 2016 16:33:38 GMT""}]","2017-08-02"
"1601.01591","Christopher Boon","C. M. Boon, A. J. Bird, A. B. Hill, L. Sidoli, V. Sguera, M. E.
  Goossens, M. Fiocchi, V. A. McBride, S. P. Drave","Spectral variation in the supergiant fast X-ray transient SAX
  J1818.6-1703 observed by XMM-Newton and INTEGRAL","11 pages, 8 figures, Accepted for publication in MNRAS",,"10.1093/mnras/stv2975",,"astro-ph.HE","http://arxiv.org/licenses/nonexclusive-distrib/1.0/","  We present the results of a 30ks XMM-Newton observation of the supergiant
fast X-ray transient (SFXT) SAX J1818.6-1703 - the first in-depth soft X-ray
study of this source around periastron. INTEGRAL observations shortly before
and after the XMM-Newton observation show the source to be in an atypically
active state. Over the course of the XMM-Newton observation, the source shows a
dynamic range of ~100 with a luminosity greater than 1$\times$10$^{35}$ erg
s$^{-1}$ for the majority of the observation. After an ~6 ks period of low
luminosity (~10$^{34}$ erg s$^{-1}$) emission, SAX J1818.6-1703 enters a phase
of fast flaring activity, with flares 250 s long, separated by ~2ks. The source
then enters a larger flare event of higher luminosity and ~8 ks duration.
Spectral analysis revealed evidence for a significant change in spectral shape
during the observation with a photon index varying from {\Gamma} ~ 2.5 during
the initial low luminosity emission phase, to {\Gamma} ~ 1.9 through the fast
flaring activity, and a significant change to {\Gamma} ~ 0.3 during the main
flare. The intrinsic absorbing column density throughout the observation (n$_H$
~ 5$\times$10$^{23}$ cm$^{-2}$) is among the highest measured from an SFXT, and
together with the XMM-Newton and INTEGRAL luminosities, consistent with the
neutron star encountering an unusually dense wind environment around
periastron. Although other mechanisms cannot be ruled out, we note that the
onset of the brighter flares occurs at 3$\times$10$^{35}$ erg s$^{-1}$, a
luminosity consistent with the threshold for the switch from a
radiative-dominated to Compton cooling regime in the quasi-spherical settling
accretion model.
","[{""version"":""v1"",""created"":""Thu, 7 Jan 2016 16:35:59 GMT""}]","2016-01-20"
"1601.01592","Tadeusz Domanski","T. Domanski","Quasiparticle states driven by a scattering on the preformed electron
  pairs","11 pages, 7 figures","Condens. Matter Phys., 2016, vol. 19, No. 1, 13701","10.5488/CMP.19.13701",,"cond-mat.supr-con cond-mat.str-el","http://arxiv.org/licenses/nonexclusive-distrib/1.0/","  We analyze evolution of the single particle excitation spectrum of the
underdoped cuprate superconductors near the anti-nodal region, considering
temperatures below and and above the phase transition. We inspect the
phenomenological self-energy that reproduces the
angle-resolved-photoemission-spectroscopy (ARPES) data and we show that above
the critical temperature, such procedure implies a transfer of the spectral
weight from the Bogoliubov-type quasiparticles towards the in-gap damped
states. We also discuss some possible microscopic arguments explaining this
process.
","[{""version"":""v1"",""created"":""Thu, 7 Jan 2016 16:39:01 GMT""},{""version"":""v2"",""created"":""Mon, 14 Mar 2016 19:35:27 GMT""}]","2016-03-15"
"1601.01593","Christophe De Beule","Christophe De Beule, Niccolo T. Ziani, Mohammad Zarenia, Bart
  Partoens, and Bjoern Trauzettel","Correlation and current anomalies in helical quantum dots","5 pages, 4 figures","Phys. Rev. B 94, 155111 (2016)","10.1103/PhysRevB.94.155111",,"cond-mat.mes-hall cond-mat.str-el","http://arxiv.org/licenses/nonexclusive-distrib/1.0/","  We theoretically investigate the ground-state properties of a quantum dot
defined on the surface of a strong three-dimensional time-reversal invariant
topological insulator. Confinement is realized by ferromagnetic barriers and
Coulomb interaction is treated numerically for up to seven electrons in the
dot. Experimentally relevant intermediate interaction strengths are considered.
The topological nature of the dot has interesting consequences: i) spin
polarization increases and the ground state exhibits quantum phase transitions
at specific angular momenta as a function of interaction strength ii) the onset
of Wigner correlations takes place mainly in one spin channel, iii) the ground
state is characterized by a persistent current which changes sign as a function
of the radius of the dot.
","[{""version"":""v1"",""created"":""Thu, 7 Jan 2016 16:40:25 GMT""},{""version"":""v2"",""created"":""Wed, 20 Apr 2016 15:05:05 GMT""}]","2016-10-12"
"1601.01594","Paulo Silva","P. J. Silva, O. Oliveira","Gluon Dynamics, Center Symmetry and the deconfinement phase transition
  in SU(3) pure Yang-Mills theory","17 pages, 12 figures","Phys. Rev. D 93, 114509 (2016)","10.1103/PhysRevD.93.114509",,"hep-lat","http://arxiv.org/licenses/nonexclusive-distrib/1.0/","  The correlations between the modulus of the Polyakov loop, its phase $\theta$
and the Landau gauge gluon propagator at finite temperature are investigated in
connection with the center symmetry for pure Yang-Mills SU(3) theory. In the
deconfined phase, where the center symmetry is spontaneously broken, the phase
of the Polyakov loop per configuration is close to $\theta = 0$, $\pm \, 2 \pi
/3$. We find that the gluon propagator form factors associated with $\theta
\approx 0$ differs quantitatively and qualitatively from those associated to
$\theta \approx \pm \, 2 \pi /3$. This difference between the form factors is a
property of the deconfined phase and a sign of the spontaneous breaking of the
center symmetry. Furthermore, given that this difference vanishes in the
confined phase, it can be used as an order parameter associated to the
deconfinement transition. For simulations near the critical temperature $T_c$,
the difference between the propagators associated to $\theta \approx 0$ and
$\theta \approx \pm \, 2 \pi /3$ allows to classify the configurations as
belonging to the confined or deconfined phase. This establishes a selection
procedure which has a measurable impact in the gluon form factors. Our results
also show that the absence of the selection procedure can be erroneously taken
as lattice artifacts.
","[{""version"":""v1"",""created"":""Thu, 7 Jan 2016 16:46:13 GMT""}]","2016-06-22"
"1601.01595","Juan B. Gil","Daniel Birmajer, Juan B. Gil, Michael D. Weiner","Compositions colored by simplicial polytopic numbers","9 pages. Improved version accepted for publication","Journal of Combinatorics 9 (2018), no. 2, 221-232",,,"math.CO math.NT","http://arxiv.org/licenses/nonexclusive-distrib/1.0/","  For a given integer $d\ge 1$, we consider $\binom{n+d-1}{d}$-color
compositions of a positive integer $\nu$ for which each part of size $n$ admits
$\binom{n+d-1}{d}$ colors. We give explicit formulas for the enumeration of
such compositions, generalizing existing results for $n$-color compositions
(case $d=1$) and $\binom{n+1}{2}$-color compositions (case $d=2$). In addition,
we give bijections from the set of $\binom{n+d-1}{d}$-color compositions of
$\nu$ to the set of compositions of $(d+1)\nu - 1$ having only parts of size
$1$ and $d+1$, the set of compositions of $(d+1)\nu$ having only parts of size
congruent to $1$ modulo $d+1$, and the set of compositions of $(d+1)\nu + d$
having no parts of size less than $d+1$. Our results rely on basic properties
of partial Bell polynomials and on a suitable adaptation of known bijections
for $n$-color compositions.
","[{""version"":""v1"",""created"":""Thu, 7 Jan 2016 16:50:33 GMT""},{""version"":""v2"",""created"":""Tue, 20 Mar 2018 22:27:08 GMT""}]","2018-03-22"
"1601.01596","Raquel Queiroz","Raquel Queiroz, Eslam Khalaf, and Ady Stern","Dimensional hierarchy of fermionic interacting topological phases","4 pages, 2 figures","Phys. Rev. Lett. 117, 206405 (2016)","10.1103/PhysRevLett.117.206405",,"cond-mat.str-el cond-mat.supr-con","http://arxiv.org/licenses/nonexclusive-distrib/1.0/","  We present a dimensional reduction argument to derive the classification
reduction of fermionic symmetry protected topological phases in the presence of
interactions. The dimensional reduction proceeds by relating the topological
character of a $d$-dimensional system to the number of zero-energy bound states
localized at zero-dimensional topological defects present at its surface. This
correspondence leads to a general condition for symmetry preserving
interactions that render the system topologically trivial, and allows us to
explicitly write a quartic interaction to this end. Our reduction shows that
all phases with topological invariant smaller than $n$ are topologically
distinct, thereby reducing the non-interacting $\mathbb{Z}$ classification to
$\mathbb{Z}_n$.
","[{""version"":""v1"",""created"":""Thu, 7 Jan 2016 16:52:58 GMT""},{""version"":""v2"",""created"":""Mon, 14 Nov 2016 13:57:00 GMT""}]","2016-11-15"
