"1601.01747","Vineet Pandey","Tianyin Xu, Vineet Pandey, and Scott Klemmer","An HCI View of Configuration Problems","9 pages of exploratory research on understanding system configuration
  problems using Human-Computer Interaction principles",,,,"cs.HC cs.SE","http://arxiv.org/licenses/nonexclusive-distrib/1.0/","  In recent years, configuration problems have drawn tremendous attention
because of their increasing prevalence and their big impact on system
availability. We believe that many of these problems are attributable to
today's configuration interfaces that have not evolved to accommodate the
enormous shift of the system administrator group. Plain text files, as the de
facto configuration interfaces, assume administrators' understanding of the
system under configuration. They ask administrators to directly edit the
corresponding entries with little guidance or assistance. However, this
assumption no longer holds for todays administrator group which has expanded
greatly to include non- and semi-professional administrators. In this paper, we
provide an HCI view of today's configuration problems, and articulate system
configuration as a new HCI problem. Moreover, we present the top obstacles to
correctly and efficiently configuring software systems, and most importantly
their implications on the design and implementation of new-generation
configuration interfaces.
","[{""version"":""v1"",""created"":""Fri, 8 Jan 2016 02:07:47 GMT""}]","2016-01-11"
"1601.01748","Jianming Zhao","Yuechun Jiao, Zhiwei Yang, Jingkui Li, Georg Raithel, Jianming Zhao
  and Suotang Jia","Spectroscopy of cesium Rydberg atoms in strong radio-frequency fields","6 pages, 5 figures","Physical Review A 94, 023832 (2016)","10.1103/PhysRevA.94.023832",,"physics.atom-ph","http://arxiv.org/licenses/nonexclusive-distrib/1.0/","  We study Rydberg atoms modulated by strong radio-frequency (RF) fields with a
frequency of 70 MHz. The Rydberg atoms are prepared in a room temperature
cesium cell, and their level structure is probed using electromagnetically
induced transparency (EIT). As the RF field increases from the weak- into the
strong-field regime, the range of observed RF-induced phenomena progresses from
AC level shifts through increasingly pronounced and numerous RF-modulation
sidebands to complex state-mixing and level-crossings with high-l hydrogen-like
states. Weak anharmonic admixtures in the RF field generate clearly visible
modifications in the Rydberg-EIT spectra. A Floquet analysis is employed to
model the Rydberg spectra, and good agreement with the experimental
observations is found. Our results show that all-optical spectroscopy of
Rydberg atoms in vapor cells can serve as an antenna-free, atom-based and
calibration-free technique to measure and map RF electric fields and to analyze
their higher-harmonic contents.
","[{""version"":""v1"",""created"":""Fri, 8 Jan 2016 02:21:49 GMT""}]","2017-07-31"
"1601.01749","Christene Lynch","C. Lynch, T. Murphy, V. Ravi, G. Hobbs, K. Lo, C. Ward","Radio detections of southern ultracool dwarfs","10 pages, 7 figures",,"10.1093/mnras/stw050",,"astro-ph.SR","http://arxiv.org/licenses/nonexclusive-distrib/1.0/","  We report the results of a volume-limited survey using the Australia
Telescope Compact Array to search for transient and quiescent radio emission
from 15 southern hemisphere ultracool dwarfs. We detect radio emission from
2MASSW J0004348-404405 increasing the number of radio loud ultracool dwarfs to
22. We also observe radio emission from 2MASS J10481463-3956062 and 2MASSI
J0339352-352544, two sources with previous radio detections. The radio emission
from the three detected sources shows no variability or flare emission.
Modelling this quiescent emission we find that it is consistent with optically
thin gyrosynchrotron emission from a magnetosphere with an emitting region
radius of (1 - 2)$R_*$, magnetic field inclination 20$^{\circ}$ - 80$^{\circ}$,
field strength $\sim$10 - 200 G, and power-law electron density $\sim$10$^4$ -
10$^8$ cm$^{-3}$. Additionally, we place upper limits on four ultracool dwarfs
with no previous radio observations. This increases the number of ultracool
dwarfs studied at radio frequencies to 222. Analysing general trends of the
radio emission for this sample of 15 sources, we find that the radio activity
increases for later spectral types and more rapidly rotating objects.
Furthermore, comparing the ratio of the radio to X-ray luminosities for these
sources, we find 2MASS J10481463-3956062 and 2MASSI J0339352-352544 violate the
Guedel-Benz relation by more than two orders of magnitude.
","[{""version"":""v1"",""created"":""Fri, 8 Jan 2016 02:23:47 GMT""}]","2016-01-11"
"1601.01750","Kilho Son","Kilho Son, Ming-Yu Liu, Yuichi Taguchi","Learning to Remove Multipath Distortions in Time-of-Flight Range Images
  for a Robotic Arm Setup","8 pages, 11 figures, will be presented to ICRA 2016",,,,"cs.CV cs.RO","http://arxiv.org/licenses/nonexclusive-distrib/1.0/","  Range images captured by Time-of-Flight (ToF) cameras are corrupted with
multipath distortions due to interaction between modulated light signals and
scenes. The interaction is often complicated, which makes a model-based
solution elusive. We propose a learning-based approach for removing the
multipath distortions for a ToF camera in a robotic arm setup. Our approach is
based on deep learning. We use the robotic arm to automatically collect a large
amount of ToF range images containing various multipath distortions. The
training images are automatically labeled by leveraging a high precision
structured light sensor available only in the training time. In the test time,
we apply the learned model to remove the multipath distortions. This allows our
robotic arm setup to enjoy the speed and compact form of the ToF camera without
compromising with its range measurement errors. We conduct extensive
experimental validations and compare the proposed method to several baseline
algorithms. The experiment results show that our method achieves 55% error
reduction in range estimation and largely outperforms the baseline algorithms.
","[{""version"":""v1"",""created"":""Fri, 8 Jan 2016 02:25:10 GMT""},{""version"":""v2"",""created"":""Wed, 17 Feb 2016 21:56:48 GMT""},{""version"":""v3"",""created"":""Tue, 23 Feb 2016 18:47:17 GMT""}]","2016-02-24"
"1601.01751","Vincent Mathieu","Vincent Mathieu","The Joint Physics Analysis Center Website","contribution to the Hadron 2015 conference ; url:
  http://www.indiana.edu/~jpac/index.html",,,,"hep-ph","http://arxiv.org/licenses/nonexclusive-distrib/1.0/","  The Joint Physics Analysis Center is a collaboration between theorists and
experimentalists working in hadronic physics. In order to facilitate the
exchange of information between the different actors in hadron spectroscopy, we
created an interactive website. In this note, I summarize the first projects
available on the website.
","[{""version"":""v1"",""created"":""Fri, 8 Jan 2016 02:44:18 GMT""}]","2016-01-11"
"1601.01752","Rhorom Priyatikanto","R. Priyatikanto and M. B. N. Kouwenhoven and M. I. Arifyanto and H. R.
  T. Wulandari and S. Siregar","The dynamical fate of binary star clusters in the Galactic tidal field","14 pages, 7 figures, accepted for publication in MNRAS",,"10.1093/mnras/stw060",,"astro-ph.GA","http://arxiv.org/licenses/nonexclusive-distrib/1.0/","  Fragmentation and fission of giant molecular clouds occasionally results in a
pair of gravitationally bound star clusters that orbit their mutual centre of
mass for some time, under the influence of internal and external perturbations.
We investigate the evolution of binary star clusters with different orbital
configurations, with a particular focus on the Galactic tidal field. We carry
out $N$-body simulations of evolving binary star clusters and compare our
results with estimates from our semi-analytic model. The latter accounts for
mass loss due to stellar evolution and two-body relaxation, and for evolution
due to external tides. Using the semi-analytic model we predict the long-term
evolution for a wide range of initial conditions. It accurately describes the
global evolution of such systems, until the moment when a cluster merger is
imminent. $N$-body simulations are used to test our semi-analytic model and
also to study additional features of evolving binary clusters, such as the
kinematics of stars, global cluster rotation, evaporation rates, and the
cluster merger process. We find that the initial orientation of a binary star
cluster with respect to the Galactic field, and also the initial orbital phase,
are crucial for its fate. Depending on these properties, the binaries may
experience orbital reversal, spiral-in, or vertical oscillation about the
Galactic plane before they actually merge at $t\approx100$~Myr, and produce
rotating star clusters with slightly higher evaporation rates. The merger
process of a binary cluster induces an outburst that ejects $\sim10\%$ of the
stellar members into the Galactic field.
","[{""version"":""v1"",""created"":""Fri, 8 Jan 2016 02:46:34 GMT""}]","2016-02-17"
"1601.01753","Tian Qiu","Xing Li, Tian Qiu, Guang Chen, Li-Xin Zhong, Xiong-Fei Jiang","Geography and distance effect on financial dynamics in the Chinese stock
  market",,,"10.1016/j.physa.2016.03.058",,"physics.soc-ph q-fin.ST","http://arxiv.org/licenses/nonexclusive-distrib/1.0/","  Geography effect is investigated for the Chinese stock market including the
Shanghai and Shenzhen stock markets, based on the daily data of individual
stocks. The Shanghai city and the Guangdong province can be identified in the
stock geographical sector. By investigating a geographical correlation on a
geographical parameter, the stock location is found to have an impact on the
financial dynamics, except for the financial crisis time of the Shenzhen
market. Stock distance effect is further studied, with a crossover behavior
observed for the stock distance distribution. The probability of the short
distance is much greater than that of the long distance. The average stock
correlation is found to weakly decay with the stock distance for the Shanghai
stock market, but stays nearly stable for different stock distance for the
Shenzhen stock market.
","[{""version"":""v1"",""created"":""Fri, 8 Jan 2016 02:46:52 GMT""},{""version"":""v2"",""created"":""Mon, 28 Mar 2016 08:08:21 GMT""}]","2016-05-04"
"1601.01754","Shizuo Kaji","Genki Matsuda, Shizuo Kaji, Hiroyuki Ochiai","Anti-commutative Dual Complex Numbers and 2D Rigid Transformation",,,,,"cs.GR cs.CG","http://arxiv.org/licenses/nonexclusive-distrib/1.0/","  We introduce a new presentation of the two dimensional rigid transformation
which is more concise and efficient than the standard matrix presentation. By
modifying the ordinary dual number construction for the complex numbers, we
define the ring of the anti-commutative dual complex numbers, which
parametrizes two dimensional rotation and translation all together. With this
presentation, one can easily interpolate or blend two or more rigid
transformations at a low computational cost. We developed a library for C++
with the MIT-licensed source code and demonstrate its facility by an
interactive deformation tool developed for iPad.
","[{""version"":""v1"",""created"":""Fri, 8 Jan 2016 02:56:57 GMT""}]","2016-01-11"
"1601.01755","Xiuping Su","Bernt Tore Jensen and Xiuping Su","Existence of Richardson elements in seaweed Lie algebras of type
  $\mathbb{B}$, $\mathbb{C}$ and $\mathbb{D}$",,,"10.1112/jlms.12269",,"math.RT math.RA","http://arxiv.org/licenses/nonexclusive-distrib/1.0/","  Seaweed Lie algebras are a natural generalisation of parabolic subalgebras of
reductive Lie algebras. The well-known Richardson Theorem says that the adjoint
action of a parabolic group has a dense open orbit in the nilpotent radical of
its Lie algebra \cite{richardson}. We call elements in the open orbit
Richardson elements. In \cite{JSY} together with Yu, we generalized
Richardson's Theorem and showed that Richardson elements exist for seaweed Lie
algebras of type $\mathbb{A}$. Using GAP, we checked that Richardson elements
exist for all exceptional simple Lie algebras except $\mathbb{E}_8$, where we
found a counterexample.
  In this paper, we complete the story on Richardson elements for seaweeds of
finite type, by showing that they exist for any seaweed Lie algebra of type
$\mathbb{B}$, $\mathbb{C}$ and $\mathbb{D}$. By decomposing a seaweed into a
sum of subalgebras and analysing their stabilisers, we obtain a sufficient
condition for the existence of Richarson elements. The sufficient condition is
then verified using quiver representation theory. More precisely, using the
categorical construction of Richardson elements in type $\mathbb{A}$, we prove
that the sufficient condition is satisfied for all seaweeds of type
$\mathbb{B}$, $\mathbb{C}$ and $\mathbb{D}$, except in two special cases, where
we give a directproof.
","[{""version"":""v1"",""created"":""Fri, 8 Jan 2016 03:07:28 GMT""},{""version"":""v2"",""created"":""Tue, 13 Sep 2016 14:11:34 GMT""},{""version"":""v3"",""created"":""Tue, 13 Jun 2017 14:39:16 GMT""},{""version"":""v4"",""created"":""Sun, 9 Dec 2018 14:00:58 GMT""}]","2019-08-14"
"1601.01756","Qian-Sheng Zhang","Q. S. Zhang","A simple scheme to implement a nonlocal turbulent convection model for
  the convective overshoot mixing","20 pages, 10 figures, accepted for publication in ApJ",,"10.3847/0004-637X/818/2/146",,"astro-ph.SR","http://arxiv.org/licenses/nonexclusive-distrib/1.0/","  The classical 'ballistic' overshoot models show some contradictions and are
not consistence with numerical simulations and asteroseismic studies.
Asteroseismic studies imply that overshoot is a weak mixing process. Diffusion
model is suitable to deal with it. The form of diffusion coefficient in a
diffusion model is crucial. Because the overshoot mixing is related to the
convective heat transport (i.e., entropy mixing), there should be a similarity
between them. A recent overshoot mixing model shows consistence between
composition mixing and entropy mixing in overshoot region. A prerequisite to
apply the model is to know the dissipation rate of turbulent kinetic energy.
The dissipation rate can be worked out by solving turbulent convection models
(TCMs). But it is difficult to apply TCMs because of some numerical problems
and the enormous time cost. In order to find a convenient way, we have used the
asymptotical solution and simplified the TCM to be a single linear equation for
turbulent kinetic energy. This linear model is easy to be implemented in the
calculations of stellar evolution with ignorable extra time cost. We have
tested the linear model in stellar evolution, and have found that the linear
model can well reproduce the turbulent kinetic energy profile of full TCM, as
well as the diffusion coefficient, abundance profile and the stellar
evolutionary tracks. We have also studied the effects of different values of
the model parameters and have found that the effect due to the modification of
temperature gradient in the overshoot region is slight.
","[{""version"":""v1"",""created"":""Fri, 8 Jan 2016 03:09:58 GMT""}]","2016-03-09"
"1601.01757","Nasir Ganikhodjaev","Nasir Ganikhodjaev, Mansoor Saburov, Ramazon Muhitdinov","On the Lebesgue nonlinear transformations","11 pages",,,,"math.DS","http://arxiv.org/licenses/nonexclusive-distrib/1.0/","  In this paper, we introduce a quadratic stochastic operators on the set of
all probability measures of a measurable space. We study the dynamics of the
Lebesgue quadratic stochastic operator on the set of all Lebesgue measures of
the set [0,1]. Namely, we prove the regularity of the Lebesgue quadratic
stochastic operators
","[{""version"":""v1"",""created"":""Fri, 8 Jan 2016 03:15:01 GMT""}]","2016-01-11"
"1601.01758","Ming-Jian Zhang","Ming-Jian Zhang, Hong Li, Jun-Qing Xia","What do we know about cosmography","12 pages, 10 figures, 1 table, accepted by EPJC","Eur. Phys. J. C (2017) 77:434","10.1140/epjc/s10052-017-5005-4",,"astro-ph.CO","http://arxiv.org/licenses/nonexclusive-distrib/1.0/","  In the present paper, we investigate the cosmographic problem using the
bias-variance trade-off. We find that both the z-redshift and the
$y=z/(1+z)$-redshift can present a small bias estimation. It means that the
cosmography can describe the supernova data more accurately. Minimizing risk,
it suggests that cosmography up to the second order is the best approximation.
Forecasting the constraint from future measurements, we find that future
supernova and redshift drift can significantly improve the constraint, thus
having the potential to solve the cosmographic problem. We also exploit the
values of cosmography on the deceleration parameter and equation of state of
dark energy $w(z)$. We find that supernova cosmography cannot give stable
estimations on them. However, much useful information was obtained, such as
that the cosmography favors a complicated dark energy with varying $w(z)$, and
the derivative $dw/dz<0$ for low redshift. The cosmography is helpful to model
the dark energy.
","[{""version"":""v1"",""created"":""Fri, 8 Jan 2016 03:16:54 GMT""},{""version"":""v2"",""created"":""Wed, 12 Jul 2017 03:13:07 GMT""}]","2017-07-13"
"1601.01759","Michael Gibson","Michael A. Gibson and Christopher A Schuh","A survey of ab-initio calculations shows that segregation-induced grain
  boundary embrittlement is predicted by bond-breaking arguments",,"Scripta Materialia, Volume 113, 1 March 2016, Pages 55-58","10.1016/j.scriptamat.2015.09.041",,"cond-mat.mtrl-sci","http://arxiv.org/licenses/nonexclusive-distrib/1.0/","  The segregation of solute atoms to grain boundaries can have a large
influence on the mechanical behavior of polycrystals, particularly in metallic
alloys. An overview of 400 calculations of solute-induced changes in grain
boundary cohesion from 77 separate studies quantitatively demonstrates that the
majority of the variation in solute-induced changes in boundary cohesion is
explained by simple bond-breaking arguments. This trend is robust to changes in
crystal structure and computational methods. The secondary contributions to
embrittlement from other mechanisms, such as atomic size effects and charge
transfer, are quantified and discussed as well.
","[{""version"":""v1"",""created"":""Fri, 8 Jan 2016 03:16:59 GMT""}]","2016-01-11"
"1601.01760","Marie-Jean Thoraval","Marie-Jean Thoraval, Yangfan Li, Sigurdur T. Thoroddsen","Vortex ring induced large bubble entrainment during drop impact","Main text: 11 pages, 15 figures; Supplemental Material: 3 pages, 4
  figures","Phys. Rev. E 93, 033128 (2016)","10.1103/PhysRevE.93.033128",,"physics.flu-dyn","http://arxiv.org/licenses/nonexclusive-distrib/1.0/","  For a limited set of impact conditions, a drop impacting onto a pool can
entrap an air bubble as large as its own size. The subsequent rise and rupture
of this large bubble plays an important role in aerosol formation and gas
transport at the air-sea interface. The large bubble is formed when the impact
crater closes up near the pool surface and is known to occur only for drops
which are prolate at impact. Herein we use experiments and numerical
simulations to show that a concentrated vortex ring, produced in the neck
between the drop and pool, controls the crater deformations and pinch-off.
However, it is not the strongest vortex rings which are responsible for the
large bubbles, as they interact too strongly with the pool surface and
self-destruct. Rather, it is somewhat weaker vortices which can deform the
deeper craters, which manage to pinch off the large bubbles. These observations
also explain why the strongest and most penetrating vortex rings emerging from
drop impacts, are not produced by oblate drops but by more prolate drop shapes,
as had been observed in previous experiments.
","[{""version"":""v1"",""created"":""Fri, 8 Jan 2016 03:21:20 GMT""}]","2016-04-06"
"1601.01761","Leon Harding Ph.D.","Leon K. Harding, Richard T. Demers, Michael Hoenk, Pavani Peddada,
  Bijan Nemati, Michael Cherng, Darren Michaels, Leo S. Neat, Anthony Loc,
  Nathan Bush, David Hall, Neil Murray, Jason Gow, Ross Burgon, Andrew Holland,
  Alice Reinheimer, Paul R. Jorden and Douglas Jordand","Technology advancement of the CCD201-20 EMCCD for the WFIRST coronagraph
  instrument: sensor characterization and radiation damage","Published in the J. Astron. Telesc. Instrum. Syst. 2(1), 011007
  (2016), 31 pages, 18 figures, 9 tables","J. Astron. Telesc. Instrum. Syst. 2(1), 011007 (2016)","10.1117/1.JATIS.2.1.011007",,"astro-ph.IM","http://arxiv.org/licenses/nonexclusive-distrib/1.0/","  The Wide Field InfraRed Survey Telescope-Astrophysics Focused Telescope Asset
(WFIRST-AFTA) mission is a 2.4-m class space telescope that will be used across
a swath of astrophysical research domains. JPL will provide a high-contrast
imaging coronagraph instrument - one of two major astronomical instruments. In
order to achieve the low noise performance required to detect planets under
extremely low flux conditions, the electron multiplying charge-coupled device
(EMCCD) has been baselined for both of the coronagraph's sensors - the imaging
camera and integral field spectrograph. JPL has established an EMCCD test
laboratory in order to advance EMCCD maturity to technology readiness level-6.
This plan incorporates full sensor characterization, including read noise, dark
current, and clock-induced charge. In addition, by considering the unique
challenges of the WFIRST space environment, degradation to the sensor's charge
transfer efficiency will be assessed, as a result of damage from high-energy
particles such as protons, electrons, and cosmic rays. Science-grade CCD201-20
EMCCDs have been irradiated to a proton fluence that reflects the projected
WFIRST orbit. Performance degradation due to radiation displacement damage is
reported, which is the first such study for a CCD201-20 that replicates the
WFIRST conditions. In addition, techniques intended to identify and mitigate
radiation-induced electron trapping, such as trap pumping, custom clocking, and
thermal cycling, are discussed.
","[{""version"":""v1"",""created"":""Fri, 8 Jan 2016 03:23:40 GMT""}]","2016-01-11"
"1601.01762","Teppei Yoshida","T. Yoshida, M. Kobayashi, K. Yoshimatsu, H. Kumigashira, A. Fujimori","Correlated electronic states of SrVO3 revealed by angle-resolved
  photoemission spectroscopy","13 pages, 9 figures","J. Electron. Spectrosc. Relat. Phenom. 208, 11 (2016)","10.1016/j.elspec.2015.11.012",,"cond-mat.str-el","http://arxiv.org/licenses/nonexclusive-distrib/1.0/","  In this article, we review recent progress in angle-resolved photoemission
(ARPES) studies of the Mott-Hubbard-type correlated electron systems SrVO3. It
has the d1 electron configuration and is an ideal model compound to study
electron correlation effects in normal metal. ARPES studies of bulk
single-crystal SrVO3 and CaVO3 have revealed the difference in the mass
renormalization of electrons between them. In-situ ARPES studies of thin films
fabricated by the pulsed laser deposition method have clarified not only
quasi-particle dispersions, which show a kink like high-Tc cuprates, but also
finite dispersions in the incoherent part. Self-energy in a wide energy range
has been deduced from the ARPES spectral weight using Kramers-Kronig
transformation. The obtained self-energy has several structures which yield the
incoherent feature and a pseudogap-like dip similar to the high-Tc cuprates.
Quantum-well states in ultrathin films of SrVO3 have revealed sub-bands with
correlated electrons. These findings of electron correlation effects outlined
in the present article would provide a starting point not only for fundamental
condensed-matter physics but also for the development of new devices with
correlated electrons.
","[{""version"":""v1"",""created"":""Fri, 8 Jan 2016 03:32:26 GMT""}]","2016-08-31"
"1601.01763","Patrick J. Laub","S{\o}ren Asmussen, Pierre-Olivier Goffard, Patrick J. Laub","Orthonormal polynomial expansions and lognormal sum densities",,,,,"math.PR","http://arxiv.org/licenses/nonexclusive-distrib/1.0/","  Approximations for an unknown density $g$ in terms of a reference density
$f_\nu$ and its associated orthonormal polynomials are discussed. The main
application is the approximation of the density $f$ of a sum $S$ of lognormals
which may have different variances or be dependent. In this setting, $g$ may be
$f$ itself or a transformed density, in particular that of $\log S$ or an
exponentially tilted density. Choices of reference densities $f_\nu$ that are
considered include normal, gamma and lognormal densities. For the lognormal
case, the orthonormal polynomials are found in closed form and it is shown that
they are not dense in $L_2(f_\nu)$, a result that is closely related to the
lognormal distribution not being determined by its moments and provides a
warning to the most obvious choice of taking $f_\nu$ as lognormal. Numerical
examples are presented and comparisons are made to established approaches such
as the Fenton--Wilkinson method and skew-normal approximations. Also extensions
to density estimation for statistical data sets and non-Gaussian copulas are
outlined.
","[{""version"":""v1"",""created"":""Fri, 8 Jan 2016 03:41:10 GMT""}]","2016-01-11"
