"1601.01655","Serguei Krasnikov","S. Krasnikov","Finite energy quantization on a topology changing spacetime","v.2 The zeroth mode is abandoned. The presentation is simplified and
  clarified v.3 Title has changed. A few typos are corrected, etc","Physical Review D 94 (2016) 044055","10.1103/PhysRevD.94.044055",,"gr-qc","http://arxiv.org/licenses/nonexclusive-distrib/1.0/","  The ""trousers"" spacetime is a pair of flat 2D cylinders (""legs"") merging into
into a single one (""trunk""). In spite of its simplicity this spacetime has a
few features (including, in particular, a naked singularity in the ""crotch"")
each of which is presumably unphysical, but for none of which a mechanism is
known able to prevent its occurrence. Therefore it is interesting and important
to study the behavior of the quantum fields in such a space. Anderson and
DeWitt were the first to consider the free scalar field in the trousers
spacetime. They argued that the crotch singularity produces an infinitely
bright flash, which was interpreted as evidence that the topology of space is
dynamically preserved. Similar divergencies were later discovered by Manogue,
Copeland and Dray who used a more exotic quantization scheme. Later yet the
same result obtained within a somewhat different approach led Sorkin to the
conclusion that the topological transition in question is suppressed in quantum
gravity.
  In this paper I show that the Anderson--DeWitt divergence is an artifact of
their choice of the Fock space. By choosing a different one-particle Hilbert
space one gets a quantum state in which the components of the stress-energy
tensor (SET) are bounded in the frame of a free-falling observer.
","[{""version"":""v1"",""created"":""Thu, 7 Jan 2016 20:16:41 GMT""},{""version"":""v2"",""created"":""Tue, 24 May 2016 11:06:20 GMT""},{""version"":""v3"",""created"":""Wed, 24 Aug 2016 13:55:39 GMT""}]","2016-09-21"
"1601.01656","Ayan Bhattacharya","Ayan Bhattacharya, Rajat Subhra Hazra and Parthanil Roy","Branching Random Walks, Stable Point Processes and Regular Variation","30 pages. 2 figures. Typos fixed thanks to a detailed and careful
  reading by Frank den Hollander",,,,"math.PR","http://arxiv.org/licenses/nonexclusive-distrib/1.0/","  Using the language of regular variation, we give a sufficient condition for a
point process to be in the superposition domain of attraction of a strictly
stable point process. This sufficient condition is then used to obtain an
explicit representation of the weak limit of a sequence of point processes
induced by a branching random walk with jointly regularly varying
displacements. As a consequence, we extend the main result of Durrett (1983)
and verify that two related predictions of Brunet and Derrida (2011) remain
valid for this model.
","[{""version"":""v1"",""created"":""Thu, 7 Jan 2016 20:19:30 GMT""},{""version"":""v2"",""created"":""Tue, 26 Jan 2016 19:20:48 GMT""}]","2016-01-27"
"1601.01657","Bertrand Berche","Fernando Santos, S\'ebastien Fumeron, Bertrand Berche, Fernando Moraes","Geometric effects in the electronic transport of deformed nanotubes","Maple code available in pdf format upon request","Nanotechnology 27 (2016) 135302","10.1088/0957-4484/27/13/135302",,"cond-mat.mes-hall","http://arxiv.org/licenses/nonexclusive-distrib/1.0/","  Quasi-two-dimensional systems may exibit curvature, which adds
three-dimensional influence to their internal properties. As shown by da Costa
\cite{dacosta}, charged particles moving on a curved surface experience a
curvature-dependent potential which greatly influence their dynamics. In this
paper, we study the electronic ballistic transport in deformed nanotubes. The
one-electron Schr\""odinger equation with open boundary conditions is solved
numerically with a flexible MAPLE code made available as Supplementary Data. We
find that the curvature of the deformations have indeed strong effects on the
electron dynamics suggesting its use in the design of nanotube-based electronic
devices.
","[{""version"":""v1"",""created"":""Thu, 7 Jan 2016 20:24:02 GMT""}]","2017-11-03"
"1601.01658","P. S. Bhupal Dev","P. S. Bhupal Dev, Alejandro Ibarra","Heavy Neutrinos at Future Colliders","8 pages, 1 figure; prepared for the proceedings of the LFC15
  Workshop, Trento, Italy (September 7-11, 2015)",,,,"hep-ph hep-ex","http://arxiv.org/licenses/nonexclusive-distrib/1.0/","  We discuss the current status and future prospects of heavy neutrino searches
at the energy frontier, which might play an important role in vindicating the
simplest seesaw paradigm as the new physics responsible for neutrino mass
generation. After summarizing the current search limits and potential
improvements at hadron colliders, we highlight the unparalleled sensitivities
achievable in the clean environment of future lepton colliders.
","[{""version"":""v1"",""created"":""Thu, 7 Jan 2016 20:24:23 GMT""}]","2016-01-08"
"1601.01659","Patricia Salas","P. Salas, M. Fortes, M. A. Sol\'is and F. J. Sevilla","Specific heat of underdoped cuprate superconductors from a
  phenomenological layered Boson-Fermion model","13 pages, 6 figures",,"10.1016/j.physc.2016.03.002",,"cond-mat.supr-con","http://arxiv.org/licenses/nonexclusive-distrib/1.0/","  We adapt the Boson-Fermion superconductivity model to include layered systems
such as underdoped cuprate superconductors. These systems are represented by an
infinite layered structure containing a mixture of paired and unpaired
fermions. The former, which stand for the superconducting carriers, are
considered as noninteracting zero spin composite-bosons with a linear
energy-momentum dispersion relation in the CuO$_2$ planes where superconduction
is predominant, coexisting with the unpaired fermions in a pattern of stacked
slabs. The inter-slab, penetrable, infinite planes are generated by a Dirac
comb potential, while paired and unpaired electrons (or holes) are free to move
parallel to the planes. Composite-bosons condense at a critical temperature at
which they exhibit a jump in their specific heat. These two values are assumed
to be equal to the superconducting critical temperature $T_c$ and the specific
heat jump reported for YBa$_{2}$Cu$_{3}$O$_{6.80}$ to fix our model parameters
namely, the plane impenetrability and the fraction of superconducting charge
carriers. We then calculate the isochoric and isobaric electronic specific
heats for temperatures lower than $T_c$ of both, the composite-bosons and the
unpaired fermions, which matches recent experimental curves. From the latter,
we extract the linear coefficient ($\gamma_n$) at $T_c$, as well as the
quadratic ($\alpha T^2$) term for low temperatures. We also calculate the
lattice specific heat from the ARPES phonon spectrum, and add it to the
electronic part, reproducing the experimental total specific heat at and below
$T_c$ within a $5 \%$ error range, from which the cubic ($\ss T^3$) term for
low temperatures is obtained. In addition, we show that this model reproduces
the cuprates mass anisotropies.
","[{""version"":""v1"",""created"":""Thu, 7 Jan 2016 20:34:55 GMT""}]","2016-05-04"
"1601.01660","Daniel Neider","Daniel Neider, Ufuk Topcu","An Automaton Learning Approach to Solving Safety Games over Infinite
  Graphs",,,,,"cs.FL cs.LG cs.LO","http://arxiv.org/licenses/nonexclusive-distrib/1.0/","  We propose a method to construct finite-state reactive controllers for
systems whose interactions with their adversarial environment are modeled by
infinite-duration two-player games over (possibly) infinite graphs. The
proposed method targets safety games with infinitely many states or with such a
large number of states that it would be impractical---if not impossible---for
conventional synthesis techniques that work on the entire state space. We
resort to constructing finite-state controllers for such systems through an
automata learning approach, utilizing a symbolic representation of the
underlying game that is based on finite automata. Throughout the learning
process, the learner maintains an approximation of the winning region
(represented as a finite automaton) and refines it using different types of
counterexamples provided by the teacher until a satisfactory controller can be
derived (if one exists). We present a symbolic representation of safety games
(inspired by regular model checking), propose implementations of the learner
and teacher, and evaluate their performance on examples motivated by robotic
motion planning in dynamic environments.
","[{""version"":""v1"",""created"":""Thu, 7 Jan 2016 20:42:19 GMT""}]","2016-01-08"
"1601.01661","Rafail Abramov","Rafail V. Abramov","Diffusive Boltzmann equation, its fluid dynamics, Couette flow and
  Knudsen layers","39 pages, 12 figures","Physica A, 2017, 484:532-557","10.1016/j.physa.2017.04.149",,"physics.flu-dyn math-ph math.MP","http://arxiv.org/licenses/nonexclusive-distrib/1.0/","  In the current work we construct a multimolecule random process which leads
to the Boltzmann equation in the appropriate limit, and which is different from
the deterministic real gas dynamics process. We approximate the statistical
difference between the two processes via a suitable diffusion process, which is
obtained in the multiscale homogenization limit. The resulting Boltzmann
equation acquires a new spatially diffusive term, which subsequently manifests
in the corresponding fluid dynamics equations. We test the Navier-Stokes and
Grad closures of the diffusive fluid dynamics equations in the numerical
experiments with the Couette flow for argon and nitrogen, and compare the
results with the corresponding Direct Simulation Monte Carlo (DSMC)
computations. We discover that the full-fledged Knudsen velocity boundary
layers develop with all tested closures when the viscosity and diffusivity are
appropriately scaled in the vicinity of the walls. Additionally, we find that
the component of the heat flux parallel to the direction of the flow is
comparable in magnitude to its transversal component near the walls, and that
the nonequilibrium Grad closure approximates this parallel heat flux with good
accuracy.
","[{""version"":""v1"",""created"":""Thu, 7 Jan 2016 20:44:10 GMT""},{""version"":""v2"",""created"":""Wed, 3 Feb 2016 20:55:51 GMT""},{""version"":""v3"",""created"":""Thu, 7 Apr 2016 16:46:33 GMT""},{""version"":""v4"",""created"":""Sat, 13 Aug 2016 21:00:05 GMT""},{""version"":""v5"",""created"":""Thu, 26 Jan 2017 18:54:04 GMT""}]","2017-05-30"
"1601.01662","Ali Masoumi","Ali Masoumi and Alexander Vilenkin","Vacuum statistics and stability in axionic landscapes","37 pages, 19 figures. (References and one paragraph added. )",,"10.1088/1475-7516/2016/03/054",,"gr-qc hep-th","http://arxiv.org/licenses/nonexclusive-distrib/1.0/","  We investigate vacuum statistics and stability in random axionic landscapes.
For this purpose we developed an algorithm for a quick evaluation of the
tunneling action, which in most cases is accurate within 10%. We find that
stability of a vacuum is strongly correlated with its energy density, with
lifetime rapidly growing as the energy density is decreased. The probability
$P(B)$ for a vacuum to have a tunneling action $B$ greater than a given value
declines as a slow power law in $B$. This is in sharp contrast with the studies
of random quartic potentials, which found a fast exponential decline of $P(B)$.
Our results suggest that the total number of relatively stable vacua (say, with
$B> 100$) grows exponentially with the number of fields $N$ and can get
extremely large for $N\gtrsim 100$. The problem with this kind of model is that
the stable vacua are concentrated near the absolute minimum of the potential,
so the observed value of the cosmological constant cannot be explained without
fine-tuning. To address this difficulty, we consider a modification of the
model, where the axions acquire a quadratic mass term, due to their mixing with
4-form fields. This results in a larger landscape with a much broader
distribution of vacuum energies. The number of relatively stable vacua in such
models can still be extremely large.
","[{""version"":""v1"",""created"":""Thu, 7 Jan 2016 20:46:41 GMT""},{""version"":""v2"",""created"":""Sun, 24 Jan 2016 02:04:50 GMT""}]","2016-04-13"
"1601.01663","Jonas Schou Neergaard-Nielsen","Ulrich B. Hoff, Johann Kollath-B\""onig, Jonas S. Neergaard-Nielsen,
  Ulrik L. Andersen","Measurement-induced macroscopic superposition states in cavity
  optomechanics","7 pages, 5 figures","Phys. Rev. Lett. 117, 143601 (2016)","10.1103/PhysRevLett.117.143601",,"quant-ph physics.optics","http://arxiv.org/licenses/nonexclusive-distrib/1.0/","  We present a novel proposal for generating quantum superpositions of
macroscopically distinct states of a bulk mechanical oscillator, compatible
with existing optomechanical devices operating in the readily achievable
bad-cavity limit. The scheme is based on a pulsed cavity optomechanical quantum
non-demolition (QND) interaction, driven by displaced non-Gaussian states, and
measurement-induced feedback, avoiding the need for strong single-photon
optomechanical coupling. Furthermore, we show that single-quadrature cooling of
the mechanical oscillator is sufficient for efficient state preparation, and we
outline a three-pulse protocol comprising a sequence of QND interactions for
squeezing-enhanced cooling, state preparation, and tomography.
","[{""version"":""v1"",""created"":""Thu, 7 Jan 2016 20:48:51 GMT""}]","2016-10-05"
"1601.01664","Andrew Goodwin","Andrew B. Cairns, Matthew J. Cliffe, Joseph A. M. Paddison, Dominik
  Daisenberger, Matthew G. Tucker, Fran\c{c}ois-Xavier Coudert and Andrew L.
  Goodwin","Encoding Complexity within Supramolecular Analogues of Frustrated
  Magnets","22 pages, 3 figures. Submitted to Nature Chemistry","Nature Chemistry, 2016, 8, 442-447","10.1038/nchem.2462",,"cond-mat.mtrl-sci","http://arxiv.org/licenses/nonexclusive-distrib/1.0/","  At the heart of systems chemistry lies the idea that supramolecular
interactions can give rise to complex and unexpected collective states that
emerge on a fundamentally different lengthscale to that of the interactions
themselves. While in certain cases - e.g. the self-assembly of virus-like
polyhedral cages from coordination building blocks - it is possible to control
emergence in a systematic manner, the development of general approaches remains
a fundamental challenge in the field. In the conceptually-related domain of
frustrated magnetism - where collective states give rise to exotic physics of
relevance to data storage and spintronics - the task of predicting emergent
behaviour is simplified through control over the geometry and form of the
magnetic interactions from which complexity arises. Seeking to combine
approaches from these two fields, we study here the solid phases of inorganic
polymer chains assembled from non-magnetic gold(I)/silver(I) cations and
cyanide anions. We show the periodic inter-chain potential encodes a
supramolecular interaction that can be tuned to mimic different magnetic
interactions between XY spins (""spin rotors""). Because the chains pack on a
triangular lattice, the crystal structures of gold(I)/silver(I) cyanides can be
interpreted in terms of the phase behaviour of triangular XY magnets. Complex
magnetic states predicted for this family - including hidden quadrupolar order
and emergent spin-vortex quasiparticles - are realised for the first time in
the structural chemistry of these cyanide polymers. In this way we demonstrate
both how simple inorganic materials might behave as structural analogues of
otherwise-unrealisable ""toy"" spin models, and also how a theoretical
understanding of those models might be used to predict and control emergent
phenomena in chemical systems.
","[{""version"":""v1"",""created"":""Thu, 7 Jan 2016 20:52:26 GMT""}]","2016-05-27"
"1601.01665","Baiying Liu","Dihua Jiang and Baiying Liu","On cuspidality of global Arthur packets for symplectic groups","37 pages. Submitted",,,,"math.NT math.RT","http://arxiv.org/licenses/nonexclusive-distrib/1.0/","  In [Ar13], Arthur classifies the automorphic discrete spectrum of symplectic
groups up to global Arthur packets, based on the theory of endoscopy. It is an
interesting and basic question to ask: which global Arthur packets contain no
cuspidal automorphic representations? The investigation on this question can be
regarded as a further development of the topics originated from the classical
theory of singular automorphic forms. The results obtained yield a better
understanding of global Arthur packets and of the structure of local unramified
components of the cuspidal spectrum, and hence are closely related to the
generalized Ramanujan problem as posted by Sarnak in [Sar05].
","[{""version"":""v1"",""created"":""Thu, 7 Jan 2016 20:53:59 GMT""}]","2016-01-08"
"1601.01666","Nikolaos Kidonakis","Nikolaos Kidonakis","Three-loop cusp anomalous dimension and a conjecture for $n$ loops","16 pages, 5 figures; a new section has been added and several other
  additions/changes made in v2","Int. J. Mod. Phys. A 31, 1650076 (2016)","10.1142/S0217751X16500767",,"hep-ph hep-th","http://arxiv.org/licenses/nonexclusive-distrib/1.0/","  I present analytical expressions for the cusp anomalous dimension in QCD
through three loops in terms of elementary functions and ordinary
polylogarithms. I observe interesting relations between the results at
different loops and provide a conjecture for the $n$-loop cusp anomalous
dimension in terms of the lower-loop results. I also present numerical results
and simple approximate formulas for the cusp anomalous dimension relevant to
top-quark production.
","[{""version"":""v1"",""created"":""Thu, 7 Jan 2016 20:56:44 GMT""},{""version"":""v2"",""created"":""Thu, 18 Feb 2016 20:46:43 GMT""}]","2016-05-25"
"1601.01667","Adetunmise Dada","Adetunmise C. Dada, Ted S. Santana, Ralph N. E. Malein, Antonios
  Koutroumanis, Yong Ma, Joanna M. Zajac, Ju Y. Lim, Jin D. Song and Brian D.
  Gerardot","Indistinguishable single photons with flexible electronic triggering",,"Optica 3, 493-498 (2016)","10.1364/OPTICA.3.000493",,"quant-ph cond-mat.mes-hall physics.atom-ph physics.optics","http://arxiv.org/licenses/nonexclusive-distrib/1.0/","  A key ingredient for quantum photonic technologies is an on-demand source of
indistinguishable single photons. State-of-the-art indistinguishable
single-photon sources typically employ resonant excitation pulses with fixed
repetition rates, creating a string of single photons with predetermined
arrival times. However, in future applications, an independent electronic
signal from a larger quantum circuit or network will trigger the generation of
an indistinguishable photon. Further, operating the photon source up to the
limit imposed by its lifetime is desirable. Here, we report on the application
of a true on-demand approach in which we can electronically trigger the precise
arrival time of a single photon as well as control the excitation pulse
duration based on resonance fluorescence from a single InAs/GaAs quantum dot.
We investigate in detail the effect of the finite duration of an excitation
$\pi$ pulse on the degree of photon antibunching. Finally, we demonstrate that
highly indistinguishable single photons can be generated using this on-demand
approach, enabling maximum flexibility for future applications.
","[{""version"":""v1"",""created"":""Thu, 7 Jan 2016 20:57:57 GMT""},{""version"":""v2"",""created"":""Fri, 6 May 2016 11:15:27 GMT""}]","2016-07-11"
"1601.01668","Joan Sola","Joan Sola","Running Vacuum in the Universe: current phenomenological status","9 pages, 3 Figures, references added",,,,"gr-qc astro-ph.CO hep-ph hep-th","http://arxiv.org/licenses/nonexclusive-distrib/1.0/","  I review the excellent phenomenological status of a class of dynamical vacuum
models in which the vacuum energy density, $\rho_{\Lambda}=\rho_{\Lambda}(H)$,
as a function of the Hubble rate, evolves through its interaction with dark
matter and/or through the accompanying running of the gravitational coupling
$G$, including the possibility of being self-conserved with a nontrivial
effective equation of state. Some of these models have been used to incorporate
into a single vacuum structure the rapid stage of inflation, followed by the
standard radiation and cold dark matter epochs all the way down until the dark
energy era. Remarkably, the running vacuum models (RVM's) render an outstanding
phenomenological description of the main cosmological data at a level that is
currently challenging the concordance $\Lambda$CDM model, thereby implying that
present observations seem to point to a running vacuum rather than to a rigid
cosmological constant $\Lambda$ in our Universe.
","[{""version"":""v1"",""created"":""Thu, 7 Jan 2016 20:58:08 GMT""},{""version"":""v2"",""created"":""Wed, 13 Jan 2016 23:30:55 GMT""}]","2016-01-15"
"1601.01669","Baiying Liu","Baiying Liu","Model transition under local theta correspondence","14 pages. To appear in J. Algebra",,,,"math.RT","http://arxiv.org/licenses/nonexclusive-distrib/1.0/","  We study model transition for representations occurring in the local theta
correspondence between split even special orthogonal groups and symplectic
groups, over a non-archimedean local field of characteristic zero.
","[{""version"":""v1"",""created"":""Thu, 7 Jan 2016 20:58:13 GMT""}]","2016-01-08"
"1601.01670","Claudio Benedito Silva Furtado","B. Farias and Claudio Furtado","de Haas van Alphen oscillations for neutral atoms in electric fields","5 pagres, 4 figures","Eur. Phys. J. Plus (2016) 131: 237","10.1140/epjp/i2016-16237-9",,"quant-ph","http://arxiv.org/licenses/nonexclusive-distrib/1.0/","  In this work we study the de Haas van Alfhen (dHvA) effect for neutral atoms
with a nonvanishing magnetic moment interacting with an electric field.
Considering the particles confined in a two dimensional (2D) atomic cloud and
using the Landau-Aharonov-Casher (LAC) theory, we obtain the effective magnetic
field as well as the energy eigenfunctions and eigenvalues of the system.
Assuming the neutral atoms as being $ ^{87}\mathrm{Rb} $ ultracold Rydberg
atoms we calculate the degeneracy of the energy levels. Under a strong
effective magnetic field regime we present the quantum oscillations in the
energy and effective magnetization of the atomic gas. From the dHvA period we
determine the area of the Fermi circle of the atomic cloud.
","[{""version"":""v1"",""created"":""Thu, 7 Jan 2016 20:59:39 GMT""},{""version"":""v2"",""created"":""Tue, 19 Jul 2016 09:56:08 GMT""}]","2016-07-20"
"1601.01677","Francesco Dalla Piazza","F. Belgiorno, S.L. Cacciatori, F. Dalla Piazza and M. Doronzo","Path integral quantization of the relativistic Hopfield model","16 pages",,"10.1103/PhysRevD.93.065020",,"hep-th math-ph math.MP quant-ph","http://arxiv.org/licenses/nonexclusive-distrib/1.0/","  The path integral quantization method is applied to a relativistically
covariant version of the Hopfield model, which represents a very interesting
mesoscopic framework for the description of the interaction between quantum
light and dielectric quantum matter, with particular reference to the context
of analogue gravity. In order to take into account the constraints occurring in
the model, we adopt the Faddeev-Jackiw approach to constrained quantization in
the path integral formalism. In particular we demonstrate that the propagator
obtained with the Faddeev-Jackiw approach is equivalent to the one which, in
the framework of Dirac canonical quantization for constrained systems, can be
directly computed as the vacuum expectation value of the time ordered product
of the fields. Our analysis also provides an explicit example of quantization
of the electromagnetic field in a covariant gauge and coupled with the
polarization field, which is a novel contribution to the literature on the
Faddeev-Jackiw procedure.
","[{""version"":""v1"",""created"":""Thu, 7 Jan 2016 17:11:39 GMT""}]","2016-03-23"
