"1610.09827","Matteo Focardi","Matteo Focardi, Francesco Geraci, Emanuele Spadaro","The classical obstacle problem for nonlinear variational energies",,,,,"math.AP","http://arxiv.org/licenses/nonexclusive-distrib/1.0/","  We develop the complete free boundary analysis for solutions to classical
obstacle problems related to nondegenerate nonlinear variational energies. The
key tools are optimal $C^{1,1}$ regularity, which we review more generally for
solutions to variational inequalities driven by nonlinear coercive smooth
vector fields, and the results in \cite{FocGelSp15} concerning the obstacle
problem for quadratic energies with Lipschitz coefficients.
  Furthermore, we highlight similar conclusions for locally coercive vector
fields having in mind applications to the area functional, or more generally to
area-type functionals, as well.
","[{""version"":""v1"",""created"":""Mon, 31 Oct 2016 08:48:39 GMT""}]","2016-11-01"
"1610.09828","Jun Zhang","Tianhuan Lu (1), Jun Zhang (1), Fuyu Dong (1), Yingke Li (1), Dezi Liu
  (2), Liping Fu (3), Guoliang Li (4), Zuhui Fan (2) ((1) Shanghai Jiao Tong
  University, (2) Peking University, (3) Shanghai Normal University, (4) Purple
  Mountain Observatory)","Testing PSF Interpolation In Weak Lensing With Real Data","13 pages, 15 figures","The Astronomical Journal, Volume 153, Issue 4, article id. 197, 13
  pp. (2017)","10.3847/1538-3881/aa661e",,"astro-ph.CO","http://arxiv.org/licenses/nonexclusive-distrib/1.0/","  Reconstruction of the point spread function (PSF) is a critical process in
weak lensing measurement. We develop a real-data based and galaxy-oriented
pipeline to compare the performances of various PSF reconstruction schemes.
Making use of a large amount of the CFHTLenS data, the performances of three
classes of interpolating schemes - polynomial, Kriging, and Shepard - are
evaluated. We find that polynomial interpolations with optimal orders and
domains perform the best. We quantify the effect of the residual PSF
reconstruction error on shear recovery in terms of the multiplicative and
additive biases, and their spatial correlations using the shear measurement
method of Zhang et al. (2015). We find that the impact of PSF reconstruction
uncertainty on the shear-shear correlation can be significantly reduced by
cross correlating the shear estimators from different exposures. It takes only
0.2 stars (SNR > 100) per square arcmin on each exposure to reach the best
performance of PSF interpolation, a requirement that is generally satisfied in
the CFHTlenS data.
","[{""version"":""v1"",""created"":""Mon, 31 Oct 2016 08:51:33 GMT""},{""version"":""v2"",""created"":""Fri, 21 Apr 2017 13:20:53 GMT""}]","2017-04-24"
"1610.09829","Andrei Zavarnitsine","Andrei V. Zavarnitsine","On the embedding of central extensions into wreath products",,,,,"math.GR","http://arxiv.org/licenses/nonexclusive-distrib/1.0/","  We find a necessary condition for the embedding of a central extension of a
group $G$ with elementary abelian kernel into the wreath product that
corresponds to a permutation action of $G$. The proof uses purely
group-theoretic methods.
","[{""version"":""v1"",""created"":""Mon, 31 Oct 2016 08:54:14 GMT""}]","2016-11-01"
"1610.09830","Adrian-Maria Scheerer","Michael A. Bennett, Adrian-Maria Scheerer","Squares with three nonzero digits","19 pages. Festschrift in honour of Robert F. Tichy's 60th birthday,
  to appear",,,,"math.NT","http://arxiv.org/licenses/nonexclusive-distrib/1.0/","  We determine all integers $n$ such that $n^2$ has at most three base-$q$
digits for $q \in \{2, 3, 4, 5, 8, 16 \}$. More generally, we show that all
solutions to equations of the shape $$ Y^2 = t^2 + M \cdot q^m + N \cdot q^n,
$$ where $q$ is an odd prime, $n > m > 0$ and $t^2, |M|, N < q$, either arise
from ""obvious"" polynomial families or satisfy $m \leq 3$. Our arguments rely
upon Pad\'e approximants to the binomial function, considered $q$-adically.
","[{""version"":""v1"",""created"":""Mon, 31 Oct 2016 08:56:28 GMT""}]","2016-11-01"
"1610.09831","Lang Zeng","Lang Zeng, Tianqi Gao, Deming Zhang, Shouzhong Peng, Fanghui Gong,
  Xiaowan Qin, Mingzhi Long, Youguang Zhang, and Weisheng Zhao","Amplicification of Voltage Controlled Magnetic Anisotropy Effect with
  Negative Capacitance",,,,,"cond-mat.mes-hall","http://arxiv.org/licenses/nonexclusive-distrib/1.0/","  The high current density required by Magnetic Tunneling Junction (MTJ)
switching driven by Spin Transfer Torque (STT) effect leads to large power
consumption and severe reliability issues therefore hinder the timetable for
STT Magnetic Random Access Memory (STT-MRAM) to mass market. By utilizing
Voltage Controlled Magnetic Anisotropy (VCMA) effect, the MTJ can be switched
by voltage effect and is postulated to achieve ultra-low power (fJ). However,
the VCMA coefficient measured in experiments is far too small for MTJ dimension
below 100 nm. Here in this work, a novel approach for the amplification of VCMA
effect which borrow ideas from negative capacitance is proposed. The
feasibility of the proposal is proved by physical simulation and in-depth
analysis.
","[{""version"":""v1"",""created"":""Mon, 31 Oct 2016 08:56:34 GMT""}]","2016-11-01"
"1610.09832","Benoit Claudon","Beno\^it Claudon, Stefan Kebekus, Behrouz Taji","Generic positivity and applications to hyperbolicity of moduli spaces","30 pages. To appear as a chapter of a book about complex
  hyperbolicity",,,,"math.AG","http://arxiv.org/licenses/nonexclusive-distrib/1.0/","  The proof of the celebrated Viehweg's hyperbolicity conjecture is a
consequence of two remarkable results: Viehweg and Zuo's existence results for
global pluri-differential forms induced by variation in a family of canonically
po-larised manifolds and Campana and P\v{a}un's vast generalisation of
Miyaoka's generic semipositivity result for non-uniruled varieties to the
context of pairs. The aim of this chapter is an exposition of
Campana-P\v{a}un's generic semipositivity theorem .
","[{""version"":""v1"",""created"":""Mon, 31 Oct 2016 09:03:15 GMT""}]","2016-11-01"
"1610.09833","Jose Espinar","Jos\'e M. Espinar and Laurent Mazet","Characterization of $f$-extremal disks","The main modification is on page 17 (Corollary 4.5 and the paragraph
  before) where we explain that our result applies to the Allen-Cahn non
  linearity",,,,"math.AP math.DG","http://arxiv.org/licenses/nonexclusive-distrib/1.0/","  We show uniqueness for overdetermined elliptic problems defined on
topological disks $\Omega$ with $C^2$ boundary, i.e., positive solutions $u$ to
$\Delta u + f(u)=0$ in $\Omega \subset (M^2,g)$ so that $u = 0$ and
$\frac{\partial u}{\partial \vec\eta} = cte $ along $\partial \Omega$,
$\vec\eta$ the unit outward normal along $\partial\Omega$ under the assumption
of the existence of a candidate family. To do so, we adapt the G\'alvez-Mira
generalized Hopf-type Theorem to the realm of overdetermined elliptic problem.
  When $(M^2,g)$ is the standard sphere $\mathbb S^2$ and $f$ is a $C^1$
function so that $f(x)>0$ and $f(x)\ge x \, f'(x)$ for any $x\in\mathbb R_+^*$,
we construct such candidate family considering rotationally symmetric
solutions. This proves the Berestycki-Caffarelli-Nirenberg conjecture in
$\mathbb S^2$ for this choice of $f$. More precisely, this shows that if $u$ is
a positive solution to $\Delta u + f(u) = 0$ on a topological disk $\Omega
\subset \mathbb S^2$ with $C^2$ boundary so that $u = 0$ and $\frac{\partial
u}{\partial \vec\eta} = cte $ along $\partial \Omega$, then $\Omega$ must be a
geodesic disk and $u$ is rotationally symmetric. In particular, this gives a
positive answer to the Schiffer conjecture D for the first Dirichlet eigenvalue
and classifies simply-connected harmonic domains, also called {\it Serrin
Problem}) in $\mathbb S ^2$.
","[{""version"":""v1"",""created"":""Mon, 31 Oct 2016 09:04:47 GMT""},{""version"":""v2"",""created"":""Wed, 30 Nov 2016 05:08:19 GMT""},{""version"":""v3"",""created"":""Tue, 26 Sep 2017 12:47:38 GMT""}]","2017-09-27"
"1610.09834","Igor Potapov","Sang-Ki Ko and Igor Potapov","Matrix Semigroup Freeness Problems in $\mathrm{SL}(2,\mathbb{Z})$",,,,,"cs.CC cs.FL","http://arxiv.org/licenses/nonexclusive-distrib/1.0/","  In this paper we study decidability and complexity of decision problems on
matrices from the special linear group $\mathrm{SL}(2,\mathbb{Z})$. In
particular, we study the freeness problem: given a finite set of matrices $G$
generating a multiplicative semigroup $S$, decide whether each element of $S$
has at most one factorization over $G$. In other words, is $G$ a code? We show
that the problem of deciding whether a matrix semigroup in
$\mathrm{SL}(2,\mathbb{Z})$ is non-free is NP-hard. Then, we study questions
about the number of factorizations of matrices in the matrix semigroup such as
the finite freeness problem, the recurrent matrix problem, the unique
factorizability problem, etc. Finally, we show that some factorization problems
could be even harder in $\mathrm{SL}(2,\mathbb{Z})$, for example we show that
to decide whether every prime matrix has at most $k$ factorizations is
PSPACE-hard.
","[{""version"":""v1"",""created"":""Mon, 31 Oct 2016 09:06:53 GMT""}]","2016-11-01"
"1610.09835","Gabriela Barenboim","Gabriela Barenboim","Neutrinos: Fast & Curious","22 pages, contribution to the 2016 European School of High-Energy
  Physics, Skeikampen, Norway , 15 - 28 June 2016, to appear as a CERN Yellow
  Report. arXiv admin note: substantial text overlap with arXiv:1504.07037",,,,"hep-ph","http://arxiv.org/licenses/nonexclusive-distrib/1.0/","  The Standard Model has been effective way beyond expectations in foreseeing
the result of almost all the experimental tests done up so far. In it,
neutrinos are massless. Nonetheless, in recent years we have collected solid
proofs indicating little but non zero masses for the neutrinos (when contrasted
with those of the charged leptons). These masses permit neutrinos to change
their flavor and oscillate, indeed a unique treat. In these lectures, I discuss
the properties and the amazing potential of neutrinos in and beyond the
Standard Model.
","[{""version"":""v1"",""created"":""Mon, 31 Oct 2016 09:11:19 GMT""}]","2016-11-01"
"1610.09836","Dominic Joyce","Dominic Joyce","Conjectures on counting associative 3-folds in $G_2$-manifolds","74 pages. (v2) Section 8 on Donaldson-Segal programme rewritten","Pages 97-160 in V. Munoz, I. Smith and R.P. Thomas, editors,
  'Modern Geometry: A Celebration of the Work of Simon Donaldson', Proceedings
  of Symposia in Pure Math. 99, A.M.S., Providence, RI, 2018",,,"math.DG hep-th","http://arxiv.org/licenses/nonexclusive-distrib/1.0/","  There is a strong analogy between compact, torsion-free $G_2$-manifolds
$(X,\varphi,*\varphi)$ and Calabi-Yau 3-folds $(Y,J,g,\omega)$. We can also
generalize $(X,\varphi,*\varphi)$ to 'tamed almost $G_2$-manifolds'
$(X,\varphi,\psi)$, where we compare $\varphi$ with $\omega$ and $\psi$ with
$J$. Associative 3-folds in $X$, a special kind of minimal submanifold, are
analogous to $J$-holomorphic curves in $Y$.
  Several areas of Symplectic Geometry -- Gromov-Witten theory, Quantum
Cohomology, Lagrangian Floer cohomology, Fukaya categories -- are built using
'counts' of moduli spaces of $J$-holomorphic curves in $Y$, but give an answer
depending only on the symplectic manifold $(Y,\omega)$, not on the (almost)
complex structure $J$.
  We investigate whether it may be possible to define interesting invariants of
tamed almost $G_2$-manifolds $(X,\varphi,\psi)$ by 'counting' compact
associative 3-folds $N\subset X$, such that the invariants depend only on
$\varphi$, and are independent of the 4-form $\psi$ used to define associative
3-folds.
  We conjecture that one can define a superpotential $\Phi_\psi:{\mathcal
U}\to\Lambda_{>0}$ 'counting' associative $\mathbb Q$-homology 3-spheres
$N\subset X$ which is deformation-invariant in $\psi$ for $\varphi$ fixed, up
to certain reparametrizations $\Upsilon:{\mathcal U}\to{\mathcal U}$ of the
base ${\mathcal U}=$Hom$(H_3(X;{\mathbb Z}),1+\Lambda_{>0})$, where
$\Lambda_{>0}$ is a Novikov ring. Using this we define a notion of '$G_2$
quantum cohomology'. These ideas may be relevant to String Theory or M-Theory
on $G_2$-manifolds.
  We also discuss Donaldson and Segal's proposal in arXiv:0902.3239, section
6.2, to define invariants 'counting' $G_2$-instantons on tamed almost
$G_2$-manifolds $(X,\varphi,\psi)$, with 'compensation terms' counting weighted
pairs of a $G_2$-instanton and an associative 3-fold, and suggest some
modifications to it.
","[{""version"":""v1"",""created"":""Mon, 31 Oct 2016 09:14:18 GMT""},{""version"":""v2"",""created"":""Tue, 30 May 2017 20:44:10 GMT""}]","2018-07-26"
"1610.09837","Claire Pennarun","Nicolas Bonichon (LaBRI), Mireille Bousquet-M\'elou (CNRS, LaBRI),
  Paul Dorbec (LaBRI), Claire Pennarun (LaBRI)","On the number of planar Eulerian orientations",,,,,"math.CO","http://arxiv.org/licenses/nonexclusive-distrib/1.0/","  The number of planar Eulerian maps with n edges is well-known to have a
simple expression. But what is the number of planar Eulerian orientations with
n edges? This problem appears to be difficult. To approach it, we define and
count families of subsets and supersets of planar Eulerian orientations,
indexed by an integer k, that converge to the set of all planar Eulerian
orientations as k increases. The generating functions of our subsets can be
characterized by systems of polynomial equations, and are thus algebraic. The
generating functions of our supersets are characterized by polynomial systems
involving divided differences, as often occurs in map enumeration. We prove
that these series are algebraic as well. We obtain in this way lower and upper
bounds on the growth rate of planar Eulerian orientations, which appears to be
around 12.5.
","[{""version"":""v1"",""created"":""Mon, 31 Oct 2016 09:23:07 GMT""},{""version"":""v2"",""created"":""Mon, 12 Dec 2016 14:23:39 GMT""}]","2016-12-13"
"1610.09838","Luca Ambrogioni","Luca Ambrogioni and Eric Maris","Analysis of Nonstationary Time Series Using Locally Coupled Gaussian
  Processes",,,,,"stat.ML","http://arxiv.org/licenses/nonexclusive-distrib/1.0/","  The analysis of nonstationary time series is of great importance in many
scientific fields such as physics and neuroscience. In recent years, Gaussian
process regression has attracted substantial attention as a robust and powerful
method for analyzing time series. In this paper, we introduce a new framework
for analyzing nonstationary time series using locally stationary Gaussian
process analysis with parameters that are coupled through a hidden Markov
model. The main advantage of this framework is that arbitrary complex
nonstationary covariance functions can be obtained by combining simpler
stationary building blocks whose hidden parameters can be estimated in
closed-form. We demonstrate the flexibility of the method by analyzing two
examples of synthetic nonstationary signals: oscillations with time varying
frequency and time series with two dynamical states. Finally, we report an
example application on real magnetoencephalographic measurements of brain
activity.
","[{""version"":""v1"",""created"":""Mon, 31 Oct 2016 09:24:28 GMT""}]","2016-11-01"
"1610.09839","Shengli Liu","Jie Cheng, Xuanyong Sun, Shengli Liu, Bin Li, Haiyun Wang, Peng Dong,
  Yu Wang and Wei Xu","La-doping effect on spin-orbit coupled Sr2IrO4 probed by x-ray
  absorption spectroscopy","14 pages, 6 figures. arXiv admin note: text overlap with
  arXiv:1610.09817","New J. Phys. 18(2016) 093019","10.1088/1367-2630/18/9/093019",,"cond-mat.str-el","http://arxiv.org/licenses/nonexclusive-distrib/1.0/","  Sr2IrO4 was predicted to be an unconventional superconductor upon carrier
doping since it highly resembles the high-temperature cuprates. Here, to
understand carrier doping effect on spin-orbit coupled Mott insulator Sr2IrO4,
the electronic structure and local structure distortion for Sr2-xLaxIrO4 system
have been investigated by x-ray absorption spectroscopy (XAS). By comparing the
intensity of white-line features at the Ir L2,3 absorption edges, we observe
remarkably large branching ratios in La-doped compounds, greater than that of
the parent material Sr2IrO4, suggesting a strong spin-orbit interaction (SOI)
for Sr2IrO4-based system. Moreover, extended x-ray absorption fine structure
(EXAFS) spectra demonstrate more regular IrO6 octahedra, i.e. the weakened
crystal electric field (CEF) versus La-doping. By theoretical calculations, the
synergistic effect of regular IrO6 octahedra and electron doping is
established, which accounts for the transition from a Mott insulator to a
conductive state in Sr2-xLaxIrO4-based system.
","[{""version"":""v1"",""created"":""Mon, 31 Oct 2016 09:30:57 GMT""}]","2017-01-05"
"1610.09840","Ran Ding","Bin Zhu, Ran Ding, Tianjun Li","Higgs Mass and Muon $g-2$ Anomaly in MSSM with Gauge-Gravity hybrid
  Mediation","19 pages, add discussions and figures about the model","Phys. Rev. D 96, 035029 (2017)","10.1103/PhysRevD.96.035029",,"hep-ph","http://arxiv.org/licenses/nonexclusive-distrib/1.0/","  In general, we can propose the hybrid supersymmetry breakings and hybrid
mediations in the Supersymmetric Standard Models (SSMs). In this paper, we
study the hybrid mediation for supersymmetry (SUSY) breaking. In particular, we
study how to keep the good properties of gravity mediation, gauge mediation,
and anomaly mediation, while solve their problems simultaneously. As an
example, we consider the anomaly-gravity mediation, where all the
supersymmetric particles (sparticles) obtain the SUSY breaking soft terms from
the traditional gravity mediation while gauge mediation gives dominant
contributions to the soft terms in the colored sector due to the splitted
messengers. Thus, we can realize the electroweak supersymmetry naturally where
the sleptons, sneutrinos, and electroweakinos are light within one TeV while
the squarks and gluino are heavy around a few TeVs. And then we can explain 125
GeV Higgs mass, satisfy the LHC SUSY search bounds, and explain the anomalous
magnetic momement of muon, etc. Moreover, the gluino and squarks are well
beyond the current LHC Run II searches.
","[{""version"":""v1"",""created"":""Mon, 31 Oct 2016 09:32:37 GMT""},{""version"":""v2"",""created"":""Wed, 18 Jan 2017 15:53:10 GMT""},{""version"":""v3"",""created"":""Sun, 23 Apr 2017 14:39:22 GMT""}]","2017-09-06"
"1610.09841","Enrico Kotze","Enrico J. Kotze, Stephen B. Potter and Vanessa A. McBride","Exploring inside-out Doppler tomography: magnetic cataclysmic variables","12 pages, 7 figures, published in A&A","A&A 595, A47 (2016)","10.1051/0004-6361/201629120",,"astro-ph.SR","http://arxiv.org/licenses/nonexclusive-distrib/1.0/","  We present the results of applying our inside-out velocity projection and
flux modulation mapping techniques to the Doppler tomography of magnetic
cataclysmic variables. The inside-out tomogram is constructed by directly
projecting phase-resolved spectra onto the inside-out framework. In addition,
our flux modulation mapping technique extracts any information related to the
modulation of the line flux by utilising consecutive half-phase tomograms. We
apply this to both the standard and the inside-out techniques. Our test cases,
the polars HU Aqr and V834 Cen, and the intermediate polar PQ Gem, were chosen
because of their known accretion characteristics, namely ballistic, magnetic
and curtain dominated accretion, respectively. In all three cases the
inside-out tomogram better exposes low-velocity emission details which are
overly compacted in the standard tomogram. This is especially apparent for the
mid-inclination V834 Cen where the almost blob-like blended lower velocity
emission in the standard tomogram is more exposed in the inside-out tomogram,
making it easier to distinguish between the ballistic and magnetically confined
accretion flows that are evident in the trailed spectra. Similarly, the
inside-out tomogram enhances high velocity emission details which are washed
out in the standard tomogram. This is particularly effective in revealing the
high velocity magnetic accretion flows in the polars HU Aqr and V834 Cen. The
addition of our flux modulation technique gives a significant improvement in
reproducing the trailed input spectra adding more confidence to the
interpretation of the Doppler maps. Furthermore, amplitude and phase maps are
constructed that further reveal amplitude and phasing characteristics of the
emission components in the three test cases.
","[{""version"":""v1"",""created"":""Mon, 31 Oct 2016 09:42:32 GMT""}]","2016-11-01"
"1610.09842","Kosuke Nagashio","Yoshiaki Hattori, Takashi Taniguchi, Kenji Watanabe and Kosuke
  Nagashio","Anisotropic Dielectric Breakdown Strength of Single Crystal Hexagonal
  Boron Nitride",,"ACS appl. mater. interfaces, 2016, 8, 27877","10.1021/acsami.6b06425",,"cond-mat.mtrl-sci","http://arxiv.org/licenses/nonexclusive-distrib/1.0/","  Dielectric breakdown has historically been of great interest from the
perspectives of fundamental physics and electrical reliability. However, to
date, the anisotropy in the dielectric breakdown has not been discussed. Here,
we report an anisotropic dielectric breakdown strength (EBD) for h-BN, which is
used as an ideal substrate for two-dimensional (2D) material devices. Under a
well-controlled relative humidity, EBD values in the directions both normal and
parallel to the c axis (EBD+c & EBD//c) were measured to be 3 and 12 MV/cm,
respectively. When the crystal structure is changed from sp3 of cubic-BN (c-BN)
to sp2 of h-BN, EBD+c for h-BN becomes smaller than that for c-BN, while EBD//c
for h-BN drastically increases. Therefore, h-BN can possess a relatively high
EBD concentrated only in the direction parallel to the c axis by conceding a
weak bonding direction in the highly anisotropic crystal structure. This
explains why the EBD//c for h-BN is higher than that for diamond. Moreover, the
presented EBD value obtained from the high quality bulk h-BN crystal can be
regarded as the standard for qualifying the crystallinity of h-BN layers grown
via chemical vapor deposition for future electronic applications.
","[{""version"":""v1"",""created"":""Mon, 31 Oct 2016 09:42:41 GMT""}]","2016-11-01"
"1610.09843","David Goz Dr","David Goz, Pierluigi Monaco, Gian Luigi Granato, Giuseppe Murante,
  Rosa Dom\'inguez-Tenreiro, Aura Obreja, Marianna Annunziatella and Edoardo
  Tescari","Panchromatic Spectral Energy Distributions of simulated galaxies:
  results at redshift $z=0$","18 pages, 11 figures, Submitted to MNRAS",,"10.1093/mnras/stx869",,"astro-ph.GA","http://arxiv.org/licenses/nonexclusive-distrib/1.0/","  We present predictions of Spectral Energy Distributions (SEDs), from the UV
to the FIR, of simulated galaxies at $z=0$. These were obtained by
post-processing the results of an N-body+hydro simulation of a small
cosmological volume, that uses the Multi-Phase Particle Integrator (MUPPI) for
star formation and stellar feedback, with the GRASIL-3D radiative transfer
code, that includes reprocessing of UV light by dust. Physical properties of
galaxies resemble observed ones, though with some tension at small and large
stellar masses. Comparing predicted SEDs of simulated galaxies with different
samples of local galaxies, we find that these resemble observed ones, when
normalised at 3.6 $\mu$m. A comparison with the Herschel Reference Survey shows
that, when binning galaxies in Star Formation Rate (SFR), average SEDs are
reproduced to within a factor of $\sim2$ even in normalization, while binning
in stellar mass highlights the same tension that is present in the stellar mass
-- SFR plane. We use our sample to investigate the correlation of IR luminosity
in Spitzer and Herschel bands with several galaxy properties. SFR is the
quantity that best correlates with IR light up to $160\ \mu$m, while at longer
wavelengths better correlations are found with molecular mass and, at $500\
\mu$m, with dust mass. However, using the position of the FIR peak as a proxy
for cold dust temperature, we assess that heating of cold dust is mostly
determined by SFR, with stellar mass giving only a minor contribution. We
finally show how our sample of simulated galaxies can be used as a guide to
understand the physical properties and selection biases of observed samples.
","[{""version"":""v1"",""created"":""Mon, 31 Oct 2016 09:44:16 GMT""}]","2017-06-28"
