"1610.09368","Kazem Azizi","K. Azizi, N. Er, H. Sundu","Impact of finite density on spectroscopic parameters of decuplet baryons","12 Pages, 9 Figures and 3 Tables","Phys. Rev. D 94, 114002 (2016)","10.1103/PhysRevD.94.114002",,"nucl-th hep-ph","http://arxiv.org/licenses/nonexclusive-distrib/1.0/","  The decuplet baryons, $\Delta$, $\Sigma^{*}$, $\Xi^{*}$ and $\Omega^{-}$, are
studied in nuclear matter by using the in-medium QCD sum rules. By fixing the
three momentum of the particles under consideration at the rest frame of the
medium, the negative energy contributions are removed. It is obtained that the
parameters of the $\Delta$ baryon are more affected by the medium against the
$\Omega^{-}$ state, containing three strange quarks, whose mass and residue do
not affected by the medium, considerably. We also find the vector and scalar
self energies of these baryons in nuclear matter. By the recent progresses at
$\bar{P}$ANDA experiment at FAIR and NICA facility it may be possible to study
the in-medium properties of such states even the multi-strange $\Xi^{*}$ and
$\Omega^{-}$ systems in near future.
","[{""version"":""v1"",""created"":""Sun, 30 Oct 2016 20:19:25 GMT""},{""version"":""v2"",""created"":""Thu, 17 Nov 2016 06:39:42 GMT""}]","2016-12-07"
"1610.09667","Ryan Cloutier","Ryan Cloutier, Ren\'e Doyon, Kristen Menou, Xavier Delfosse, Xavier
  Dumusque, \'Etienne Artigau","On the radial velocity detection of additional planets in transiting,
  slowly rotating M-dwarf systems: the case of GJ 1132","19 pages (15 pages before appendices), 12 figures, 2 tables, accepted
  for publication in The Astronomical Journal",,"10.3847/1538-3881/153/1/9",,"astro-ph.EP","http://arxiv.org/licenses/nonexclusive-distrib/1.0/","  M-dwarfs are known to commonly host high-multiplicity planetary systems.
Therefore M-dwarf planetary systems with a known transiting planet are expected
to contain additional small planets ($r_p \le 4$ R$_{\oplus}$, $m_p \lesssim
20$ M$_{\oplus}$) that are not seen in transit. In this study we investigate
the effort required to detect such planets using precision velocimetry around
the sizable subset of M-dwarfs which are slowly rotating ($P_{\mathrm{rot}}
\gtrsim 40$ days) and hence more likely to be inactive. We focus on the test
case of GJ 1132. Specifically, we perform a suite of Monte-Carlo simulations of
the star's radial velocity signal featuring astrophysical contributions from
stellar jitter due to rotationally modulated active regions and keplarian
signals from the known transiting planet and hypothetical additional planets
not seen in transit. We then compute the detection completeness of
non-transiting planets around GJ 1132 and consequently estimate the number of
RV measurements required to detect those planets. We show that with 1 m
s$^{-1}$ RV precision per measurement, only $\sim 50$ measurements are required
to achieve a 50\% detection completeness to all non-transiting planets in the
system and to planets which are potentially habitable. Throughout we advocate
the use of Gaussian process regression as an effective tool for mitigating the
effects of stellar jitter including stars with high activity. Given that GJ
1132 is representative of a large population of slowly rotating M-dwarfs, we
conclude with a discussion of how our results may be extended to other systems
with known transiting planets such as those which will be discovered with TESS.
","[{""version"":""v1"",""created"":""Sun, 30 Oct 2016 16:02:49 GMT""}]","2016-12-28"
"1610.09668","Silvano Simula","V. Lubicz, G. Martinelli, C.T. Sachrajda, F. Sanfilippo, S. Simula, N.
  Tantalo, C. Tarantino","Electromagnetic corrections to the leptonic decay rates of charged
  pseudoscalar mesons: lattice results","7 pages, 4 figures, 1 table, proceedings of the 34th annual
  International Symposium on Lattice Field Theory, 24-30 July 2016, University
  of Southampton (UK)",,,,"hep-lat hep-ph","http://arxiv.org/licenses/nonexclusive-distrib/1.0/","  Electromagnetic effects in the leptonic decay rates $\pi^+ \to \mu^+ \nu$ and
$K^+ \to \mu^+ \nu$ are evaluated for the first time on the lattice. Following
a method recently proposed in Ref. [1] the emission of virtual photons at
leading order in the electromagnetic coupling is evaluated on the lattice and
the infrared divergence computed for a point-like meson at finite lattice
volume is subtracted. The physical decay rate is then obtained by adding the
emission of real and virtual photons regularised with a photon mass. Using the
gauge ensembles produced by the European Twisted Mass Collaboration with $N_f =
2 + 1 + 1$ dynamical quarks the feasibility of our approach is demonstrated.
Preliminary results for the electromagnetic corrections to charged (neutral)
pion and kaon masses as well as to the leptonic decay rates of charged pions
and kaons are presented.
","[{""version"":""v1"",""created"":""Sun, 30 Oct 2016 16:11:45 GMT""}]","2016-11-01"
"1610.09669","Pietro Menotti","Pietro Menotti","On the solution of Liouville equation","10 pages",,"10.1088/1751-8121/aa832e","IFUP--TH/2016","math-ph hep-th math.MP","http://arxiv.org/licenses/nonexclusive-distrib/1.0/","  We give a short and rigorous proof of the existence and uniqueness of the
solution of Liouville equation with sources, both elliptic and parabolic, on
the sphere and on all higher genus compact Riemann surfaces.
","[{""version"":""v1"",""created"":""Sun, 30 Oct 2016 16:18:15 GMT""}]","2017-09-13"
"1610.09670","Xiaochen Zheng","Xiaochen Zheng, Douglas N.C. Lin and M.B.N. Kouwenhoven","Planetesimal clearing and size-dependent asteroid retention by secular
  resonance sweeping during the depletion of the solar nebula","26 pages, 18figures, accepted for publication in the ApJ",,"10.3847/1538-4357/836/2/207",,"astro-ph.EP","http://arxiv.org/licenses/nonexclusive-distrib/1.0/","  The distribution of heavy elements is anomalously low in the asteroid main
belt region compared with elsewhere in the solar system. Observational surveys
also indicate a deficit in the number of small ($ \le 50$~km size) asteroids
that is two orders of magnitude lower than what is expected from the single
power-law distribution that results from a collisional coagulation and
fragmentation equilibrium. Here, we consider the possibility that a major
fraction of the original asteroid population may have been cleared out by
Jupiter's secular resonance, as it swept through the main asteroid belt during
the depletion of the solar nebula. This effect leads to the excitation of the
asteroids' orbital eccentricities. Concurrently, hydrodynamic drag and
planet-disk tidal interaction effectively damp the eccentricities of sub-100
km-size and of super-lunar-size planetesimals, respectively. These combined
effects lead to the asteroids' orbital decay and clearing from the present-day
main belt region ($\sim 2.1-3.3$~AU). The intermediate-size (50 to several
hundreds of kilometers) planetesimals therefore preferentially remain as main
belt asteroids near their birthplaces, with modest asymptotic eccentricities.
The smaller asteroids are the fragments of subsequent disruptive collisions at
later times as suggested by the present-day asteroid families. This scenario
provides a natural explanation for both the observed low surface density and
the size distribution of asteroids in the main belt. It also offers an
explanation for the confined spatial extent of the terrestrial planet building
blocks without the requirement of extensive migration of Jupiter.
","[{""version"":""v1"",""created"":""Sun, 30 Oct 2016 16:19:15 GMT""}]","2017-03-08"
"1610.09671","Silvano Simula","V. Lubicz, A. Melis, S. Simula","Masses and decay constants of $D_{(s)}^*$ and $B_{(s)}^*$ mesons in
  Lattice QCD with $N_f = 2 + 1 + 1$ twisted-mass fermions","7 pages, 4 figures, in proceedings of 34th annual International
  Symposium on Lattice Field Theory, 24-30 July 2016, University of Southampton
  (UK). In version v2 the quality of the figures is improved","Phys. Rev. D 96, 034524 (2017)","10.1103/PhysRevD.96.034524","preprint RM3-TH/16-11","hep-lat hep-ph","http://arxiv.org/licenses/nonexclusive-distrib/1.0/","  We present a lattice calculation of the decay constants and masses of
$D_{(s)}^*$ and $B_{(s)}^*$ mesons using the gauge configurations produced by
the European Twisted Mass Collaboration (ETMC) with $N_f = 2 + 1 + 1$ dynamical
quarks and at three values of the lattice spacing $a \sim 0.06 - 0.09$ fm. Pion
masses are simulated in the range $m_{\pi} \sim 210 - 450$ MeV, while the
strange and charm quark masses are close to their physical values. We computed
the ratios of vector to pseudoscalar decay constants or masses for various
values of the heavy-quark mass $m_h$ in the range $0.7 m_c^{phys} \lesssim m_h
\lesssim 3 m_c^{phys}$. In order to reach the physical b-quark mass, we
exploited the HQET prediction that, in the static limit of infinite heavy-quark
mass, all the considered ratios are equal to one. We obtain: $ f_{D^*}/f_{D} =
1.078(36),$ $m_{D^*}/m_{D} = 1.0769(79)$, $f_{D^*_{s}}/f_{D_{s}} = 1.087(20)$,
$m_{D^*_{s}}m_{D_{s}} = 1.0751(56)$, $f_{B^*}/f_{B} = 0.958(22)$,
$m_{B^*}/m_{B} = 1.0078(15)$, $f_{B^*_{s}}/f_{B_{s}} = 0.974(10)$ and
$m_{B^*_{s}}/m_{B_{s}} = 1.0083(10)$. Combining them with the corresponding
experimental masses from the PDG and the pseudoscalar decay constants
calculated by ETMC, we get: $f_{D^*} = 223.5(8.4)~\mathrm{MeV}$, $m_{D^*} =
2013(14)~\mathrm{MeV}$, $f_{D^*_{s}} = 268.8(6.6)~\mathrm{MeV}$, $ m_{D^*_{s}}
= 2116(11)~\mathrm{MeV}$, $f_{B^*} = 185.9(7.2)~\mathrm{MeV}$, $m_{B^*} =
5320.5(7.6)~\mathrm{MeV}$, $f_{B^*_{s}} = 223.1(5.4)~\mathrm{MeV}$ and
$m_{B^*_{s}}= 5411.36(5.3)~\mathrm{MeV}$.
","[{""version"":""v1"",""created"":""Sun, 30 Oct 2016 16:23:20 GMT""},{""version"":""v2"",""created"":""Thu, 24 Nov 2016 11:19:47 GMT""}]","2017-09-06"
"1610.09672","Jiro Adachi","Jiro Adachi","Generalizations of twists of contact structures to higher-dimensions via
  round surgery",,,,,"math.GT","http://arxiv.org/licenses/nonexclusive-distrib/1.0/","  Twists of contact structures in dimension 3 and higher are studied in this
paper from a viewpoint of contact round surgery. Three kinds of new
modifications of contact structures which are higher-dimensional
generalizations of the $3$-dimensional Lutz twists are introduced. One of the
operations makes a contact manifold overtwisted in any dimension. Another one
makes it weakly symplectically non-fillable. And the other one makes it
strongly symplectically non-fillable. In other words, they make the overtwisted
disc, the bordered Legendrian open books, and the Giroux domains, respectively.
The first two modifications can be realized by sequences of contact round
surgeries. The first operation can be applied anywhere of any contact manifold
easily. Further, a version of the first operation keeps the homotopy classes of
contact structures as almost contact structures, and the other version
contributes to the Euler classes of contact structures.
","[{""version"":""v1"",""created"":""Sun, 30 Oct 2016 16:25:18 GMT""}]","2016-11-01"
"1610.09673","Wojciech Broniowski","Wojciech Broniowski, Piotr Bozek","Longitudinal correlations in the initial stages of ultra-relativistic
  nuclear collisions","6 pages, talk presented by WB at ISMD 2016",,"10.1051/epjconf/201714105003",,"nucl-th nucl-ex","http://arxiv.org/licenses/nonexclusive-distrib/1.0/","  In this talk we review some of our results for the longitudinal correlations
in connection with recent experimental data, in particular for the {\em torque}
effect and for the two-particle correlations in pseudorapidity,
$C(\eta_1,\eta_2)$. The model framework involves event-by-event fluctuations of
the initial conditions, followed with 3D viscous hydrodynamic evolution and
statistical hadronization.
","[{""version"":""v1"",""created"":""Sun, 30 Oct 2016 16:34:05 GMT""}]","2017-04-26"
"1610.09674","Davide Lombardo","Davide Lombardo","Computing the geometric endomorphism ring of a genus 2 Jacobian","Comments very welcome! v2. Updated to match published version","Math. Comp. 88 (2019), 889-929","10.1090/mcom/3358",,"math.NT math.AG","http://creativecommons.org/licenses/by-nc-nd/4.0/","  We describe an algorithm, based on the properties of the characteristic
polynomials of Frobenius, to compute $\operatorname{End}_{\overline{K}}(A)$
when $A$ is the Jacobian of a nice genus-2 curve over a number field $K$. We
use this algorithm to confirm that the description of the structure of the
geometric endomorphism ring of $\operatorname{Jac}(C)$ given in the LMFDB
($L$-functions and modular forms database) is correct for all the genus 2
curves $C$ currently listed in it. We also discuss the determination of the
field of definition of the endomorphisms in some special cases.
","[{""version"":""v1"",""created"":""Sun, 30 Oct 2016 16:47:57 GMT""},{""version"":""v2"",""created"":""Tue, 1 Jun 2021 10:17:56 GMT""}]","2021-06-02"
"1610.09675","Martha {\L}\k{a}cka","Martha {\L}\k{a}cka and Marta Straszak","Quasi-uniform Convergence in Dynamical Systems Generated by an Amenable
  Group Action",,,"10.1112/jlms.12157",,"math.DS","http://arxiv.org/licenses/nonexclusive-distrib/1.0/","  We study properties of the Weyl pseudometric associated with an action of a
countable amenable group on a compact metric space. We prove that the
topological entropy and the number of minimal subsets of the closure of an
orbit are both lower semicontinuous with respect to the Weyl pseudometric.
Furthermore, the simplex of invariant measures supported on the orbit closure
varies continuously. We apply the Weyl pseudometric to Toeplitz sequences for
amenable residually finite groups. We introduce the notion of a regular
Toeplitz sequence for an arbitrary amenable residually finite group and
demonstrate that all regular Toeplitz sequences define minimal and uniquely
ergodic systems. We prove path-connectivity of this family with respect to the
Weyl pseudometric. This leads to a new proof of a theorem of Fabrice Krieger,
which says that the values of entropy of Toeplitz sequences can have arbitrary
finite entropy.
","[{""version"":""v1"",""created"":""Sun, 30 Oct 2016 16:48:15 GMT""},{""version"":""v2"",""created"":""Sun, 6 Nov 2016 09:47:01 GMT""},{""version"":""v3"",""created"":""Wed, 24 Jan 2018 10:29:53 GMT""},{""version"":""v4"",""created"":""Sun, 28 Jan 2018 09:46:21 GMT""}]","2018-08-01"
"1610.09676","Wojciech Broniowski","Wojciech Broniowski","Limits on hadron spectrum from bulk medium properties","6 pages, lecture at Mini-Workshop Bled 2016, Bled (Slovenia), 3-10
  July 2016",,,,"nucl-th hep-ph","http://arxiv.org/licenses/nonexclusive-distrib/1.0/","  We bring up the fact that the bulk thermal properties of the hadron gas, as
measured on the lattice, preclude a very fast rising of the number of resonance
states in the QCD spectrum, as assumed by the Hagedorn hypothesis, unless a
substantial repulsion between hadronic resonances is present. If the Hagedorn
growth continued above masses ~1.8 GeV, then the thermodynamic functions would
noticeably depart from the measured lattice values at temperatures above 140
MeV, just below the transition temperature to quark-gluon plasma.
","[{""version"":""v1"",""created"":""Sun, 30 Oct 2016 16:57:32 GMT""}]","2016-11-01"
"1610.09677","Yakov Azimov","Ya.I. Azimov","Legendre Analysis of Hadronic Reactions","Talk at the Conference ""Hadron Structure and Quantum Chromodynamics""
  (HSQCD2016), Gatchina, 27 June - 1 July, 2016. To appear in the Proceedings",,,,"hep-ph hep-ex nucl-ex nucl-th","http://arxiv.org/licenses/nonexclusive-distrib/1.0/","  Expansions over Legendre functions are suggested as a model-independent way
of compact presentation of modern precise and high-statistics data for
two-hadron reactions. Some properties of the expansions are described.
","[{""version"":""v1"",""created"":""Sun, 30 Oct 2016 16:58:46 GMT""}]","2016-11-01"
"1610.09678","Edivaldo Lopes Dos Santos","Denise de Mattos, Edivaldo L. dos Santos and Taciana O. Souza","$(H,G)$-coincidence theorems for manifolds and a topological Tverberg
  type theorem for any natural number $r$","13 pages",,,,"math.AT","http://arxiv.org/licenses/nonexclusive-distrib/1.0/","  Let $X$ be a paracompact space, let $G$ be a finite group acting freely on
$X$ and let $H$ a cyclic subgroup of $G$ of prime order $p$. Let
$f:X\rightarrow M$ be a continuous map where $M$ is a connected $m$-manifold
(orientable if $p>2$) and $f^* (V_k) = 0$, for $k\geq 1$, where $V_k$ are the
$Wu$ classes of $M$. Suppose that ${\rm{ind}}\, X\geq n> (|G|-r)m$, where
$r=\frac{|G|}{p}$. In this work, we estimate the cohomological dimension of the
set $A(f,H,G)$ of $(H,G)$-coincidence points of $f$. Also, we estimate the
index of a $(H, G)$-coincidence set in the case that $H$ is a $p$-torus
subgroup of a particular group $G$ and as application we prove a topological
Tverberg type theorem for any natural number $r$. Such result is a weak version
of the famous topological Tverberg conjecture, which was proved recently, fail
for all $r$ that are not prime powers. Moreover, we obtain a generalized Van
Kampen-Flores type theorem for any natural number $r$.
","[{""version"":""v1"",""created"":""Sun, 30 Oct 2016 17:09:49 GMT""}]","2016-11-01"
"1610.09679","Carlo Comin","Carlo Comin, Romeo Rizzi","Linear-Time Safe-Alternating DFS and SCCs",,,,,"cs.DS","http://arxiv.org/licenses/nonexclusive-distrib/1.0/","  An alternating graph is a directed graph whose vertex set is partitioned into
two classes, existential and universal. This forms the basic arena for a
plethora of infinite duration two-player games where Player~$\square$
and~$\ocircle$ alternate in a turn-based sliding of a pebble along the arcs
they control. We study alternating strongly-connectedness as a generalization
of strongly-connectedness in directed graphs, aiming at providing a linear time
decomposition and a sound structural graph characterization. For this a refined
notion of alternating reachability is introduced: Player~$\square$ attempts to
reach vertices without leaving a prescribed subset of the vertices, while
Player~$\ocircle$ works against. This is named \emph{safe alternating
reachability}. It is shown that every arena uniquely decomposes into safe
alternating strongly-connected components where Player~$\square$ can visit each
vertex within a given component infinitely often, without having to ever leave
out the component itself. Our main result is a linear time algorithm for
computing this alternating graph decomposition. Both the underlying graph
structures and the algorithm generalize the classical decomposition of a
directed graph into strongly-connected components. The algorithm builds on a
linear time generalization of the depth-first search on alternation, taking
inspiration from Tarjan 1972 machinery. Our theory has direct applications in
solving well-known infinite duration pebble games faster. Dinneen and
Khoussainov showed in 1999 that deciding a given Update Game costs $O(mn)$
time, where $n$ is the number of vertices and $m$ is that of arcs. We solve the
task in $\Theta(m+n)$ linear~time. The complexity of Explicit
McNaughton-M\""uller Games also improves from cubic to quadratic.
","[{""version"":""v1"",""created"":""Sun, 30 Oct 2016 17:22:00 GMT""},{""version"":""v2"",""created"":""Sat, 19 Nov 2016 20:23:11 GMT""},{""version"":""v3"",""created"":""Tue, 22 Nov 2016 13:07:27 GMT""},{""version"":""v4"",""created"":""Mon, 28 Nov 2016 11:01:58 GMT""},{""version"":""v5"",""created"":""Sun, 9 Jun 2019 10:18:10 GMT""},{""version"":""v6"",""created"":""Fri, 5 Jun 2020 21:19:02 GMT""},{""version"":""v7"",""created"":""Wed, 10 Jun 2020 16:46:03 GMT""},{""version"":""v8"",""created"":""Sat, 5 Dec 2020 16:40:48 GMT""},{""version"":""v9"",""created"":""Sun, 13 Feb 2022 17:07:15 GMT""}]","2022-02-15"
"1610.09680","Glenn D. Starkman","David Cyncynates, Joshua Chiel, Jagjit Sidhu and Glenn D. Starkman","Reconsidering seismological constraints on the available parameter space
  of macroscopic dark matter","9 pages, 3 color figures","Phys. Rev. D 95, 063006 (2017)","10.1103/PhysRevD.95.063006",,"astro-ph.CO astro-ph.EP hep-ph","http://arxiv.org/licenses/nonexclusive-distrib/1.0/","  Using lunar seismological data, constraints have been proposed on the
available parameter space of macroscopic dark matter (macros). We show that
actual limits are considerably weaker by considering in greater detail the
mechanism through which macro impacts generate detectable seismic waves, which
have wavelengths considerably longer than the diameter of the macro. We show
that the portion of the macro parameter space that can be ruled out by current
seismological evidence is considerably smaller than previously reported, and
specifically that candidates with greater than or equal to nuclear density are
not excluded by lunar seismology.
","[{""version"":""v1"",""created"":""Sun, 30 Oct 2016 17:26:34 GMT""}]","2017-03-15"
"1610.09681","Borut Bajc","Borut Bajc and Francesco Sannino","Asymptotically Safe Grand Unification","1 figure, section on the doublet-triplet problem added, new
  references, accepted in JHEP",,"10.1007/JHEP12(2016)141","CP3-Origins-2016-046 DNRF90","hep-th hep-lat hep-ph","http://arxiv.org/licenses/nonexclusive-distrib/1.0/","  Phenomenologically appealing supersymmetric grand unified theories have large
gauge representations and thus are not asymptotically free. Their ultraviolet
validity is limited by the appearance of a Landau pole well before the Planck
scale. One could hope that these theories save themselves, before the inclusion
of gravity, by generating an interacting ultraviolet fixed point, similar to
the one recently discovered in non-supersymmetric gauge-Yukawa theories.
Employing a-maximization, a-theorem, unitarity bounds, as well as positivity of
other central charges we nonperturbatively rule out this possibility for a
broad class of prime candidates of phenomenologically relevant supersymmetric
grand unified theories. We also uncover candidates passing these tests, which
have either exotic matter or contain one field decoupled from the
superpotential. The latter class of theories contains a model with the minimal
matter content required by phenomenology.
","[{""version"":""v1"",""created"":""Sun, 30 Oct 2016 17:31:20 GMT""},{""version"":""v2"",""created"":""Wed, 21 Dec 2016 16:58:38 GMT""}]","2017-02-01"
"1610.09682","Mohamed Boucetta","Sa\""id Benayadi and Mohamed Boucetta","On para-K\""ahler Lie algebroids and generalized pseudo-Hessian
  structures","23 pages",,,,"math.DG","http://arxiv.org/licenses/nonexclusive-distrib/1.0/","  In this paper, we generalize all the results obtained on para-K\""ahler Lie
algebras in Journal of Algebra {\bf 436} (2015) 61-101 to para-K\""ahler Lie
algebroids. In particular, we study exact para-K\""ahler Lie algebroids as a
generalization of exact para-K\""ahler Lie algebras. This study leads to a
natural generalization of pseudo-Hessian manifolds. Generalized pseudo-Hessian
manifolds have many similarities with Poisson manifolds. We explore these
similarities which, among others, leads to a powerful machinery to build
examples of non trivial pseudo-Hessian structures. Namely, we will show that
given a finite dimensional commutative and associative algebra
$(\mathcal{A},.)$, the orbits of the action $\Phi$ of $(\mathcal{A},+)$ on
$\mathcal{A}^*$ given by $\Phi(a,\mu)=\exp(L_a^*)(\mu)$ are pseudo-Hessian
manifolds, where $L_a(b)=a.b$. We illustrate this result by considering many
examples of associative commutative algebras an show that the pseudo-Hessian
manifolds obtained are very interesting.
","[{""version"":""v1"",""created"":""Sun, 30 Oct 2016 17:44:31 GMT""}]","2016-11-01"
"1610.09683","Arman Shojaeifard","Jie Tang, Daniel K. C. So, Emad Alsusa, Khairi Ashour Hamdi, Arman
  Shojaeifard, Kai-Kit Wong","Energy-Efficient Heterogeneous Cellular Networks with Spectrum Underlay
  and Overlay Access",,,,,"cs.IT math.IT","http://arxiv.org/licenses/nonexclusive-distrib/1.0/","  In this paper, we provide joint subcarrier assignment and power allocation
schemes for quality-of-service (QoS)-constrained energy-efficiency (EE)
optimization in the downlink of an orthogonal frequency division multiple
access (OFDMA)-based two-tier heterogeneous cellular network (HCN). Considering
underlay transmission, where spectrum-efficiency (SE) is fully exploited, the
EE solution involves tackling a complex mixed-combinatorial and non-convex
optimization problem. With appropriate decomposition of the original problem
and leveraging on the quasi-concavity of the EE function, we propose a
dual-layer resource allocation approach and provide a complete solution using
difference-of-two-concave-functions approximation, successive convex
approximation, and gradient-search methods. On the other hand, the inherent
inter-tier interference from spectrum underlay access may degrade EE
particularly under dense small-cell deployment and large bandwidth utilization.
We therefore develop a novel resource allocation approach based on the concepts
of spectrum overlay access and resource efficiency (RE) (normalized EE-SE
trade-off). Specifically, the optimization procedure is separated in this case
such that the macro-cell optimal RE and corresponding bandwidth is first
determined, then the EE of small-cells utilizing the remaining spectrum is
maximized. Simulation results confirm the theoretical findings and demonstrate
that the proposed resource allocation schemes can approach the optimal EE with
each strategy being superior under certain system settings.
","[{""version"":""v1"",""created"":""Sun, 30 Oct 2016 17:49:58 GMT""}]","2016-11-01"
