"1610.09917","Alessandro Cresti","Alessandro Cresti, Branislav K. Nikoli\'c, Jose Hugo Garc\'ia and
  Stephan Roche","Charge, Spin and Valley Hall Effects in Disordered Graphene","to be published in La Rivista del Nuovo Cimento","Riv. Nuovo Cimento 39, 587 (2016)","10.1393/ncr/i2016-10130-6",,"cond-mat.mes-hall","http://arxiv.org/licenses/nonexclusive-distrib/1.0/","  The discovery of the integer quantum Hall effect in the early eighties of the
last century, with highly precise quantization values for the Hall conductance
in multiples of $e^2/h$, has been the first fascinating manifestation of the
topological state of matter driven by magnetic field and disorder, and related
to the formation of non-dissipative current flow. In 2005, several new
phenomena such as the spin Hall effect and the quantum spin Hall effect were
predicted in the presence of strong spin-orbit coupling and vanishing external
magnetic field. More recently, the Zeeman spin Hall effect and the formation of
valley Hall topological currents have been introduced for graphene-based
systems, under time-reversal or inversion symmetry-breaking conditions,
respectively. This review presents a comprehensive coverage of all these Hall
effects in disordered graphene from the perspective of numerical simulations of
quantum transport in two-dimensional bulk systems (by means of the Kubo
formalism) and multiterminal nanostructures (by means of the
Landauer-B\""{u}ttiker scattering and nonequilibrium Green function approaches).
In contrast to usual two-dimensional electron gases, the presence of defects in
graphene generates more complex electronic features such as electron-hole
asymmetry, defect resonances or percolation effect between localized impurity
states, which, together with extra degrees of freedom (sublattice pseudospin,
valley isospin), bring a higher degree of complexity and enlarge the transport
phase diagram.
","[{""version"":""v1"",""created"":""Mon, 31 Oct 2016 13:38:36 GMT""}]","2017-01-10"
"1610.09918","Yuto Miyatake","Yuto Miyatake, Geonsik Eom, Tomohiro Sogabe, Shao-Liang Zhang","Energy-preserving $H^1$-Galerkin schemes for the Hunter--Saxton equation",,,,,"math.NA","http://arxiv.org/licenses/nonexclusive-distrib/1.0/","  We consider the numerical integration of the Hunter--Saxton equation, which
models the propagation of weakly nonlinear orientation waves. For the equation,
we present two weak forms and their Galerkin discretizations. The Galerkin
schemes preserve the Hamiltonian of the equation and can be implemented with
cheap $H^1$ elements. Numerical experiments confirm the effectiveness of the
schemes.
","[{""version"":""v1"",""created"":""Mon, 31 Oct 2016 13:42:19 GMT""}]","2016-11-01"
"1610.09919","Victor L'vov S","D. Khomenko, V. S. L'vov, A. Pomyalov, and I. Procaccia","Reply to Comment on ""Dynamics of the Density of Quantized Vortex-Lines
  in Superfluid Turbulence""","4 pages, 4 figures","Phys. Rev. B 94, 146502 (2016)","10.1103/PhysRevB.94.146502",,"cond-mat.other cond-mat.quant-gas","http://arxiv.org/licenses/nonexclusive-distrib/1.0/","  This is a Reply to Nemirovskii Comment [Phys. Rev. B 94, 146501 (2016)] on
the Khomenko et al, [Phys.Rev. B v.91, 180504(2016)], in which a new form of
the production term in Vinen's equation for the evolution of the vortex-line
density $\cal L$ in the thermal counterflow of superfluid $^4$He in a channel
was suggested. To further substantiate the suggested form which was questioned
in the Comment, we present a physical explanation for the improvement of the
closure suggested in Khomenko et al [Phys.Rev. B v. 91, 180504(2016)] in
comparison to the form proposed by Vinen. We also discuss the closure for the
flux term, which agrees well with the numerical results without any fitting
parameters.
","[{""version"":""v1"",""created"":""Mon, 31 Oct 2016 13:46:54 GMT""}]","2016-11-01"
"1610.09920","Rebecca Bellovin","Rebecca Bellovin and Otmar Venjakob","Wach modules, regulator maps, and epsilon-isomorphisms in families","Revised. To appear in IMRN",,,,"math.NT","http://arxiv.org/licenses/nonexclusive-distrib/1.0/","  We prove the local epsilon-isomorphism conjecture of Fukaya and Kato [FK06]
for certain crystalline families of G_Qp-representations. This conjecture can
be regarded as a local analogue of the Iwasawa main conjecture for families.
Our work extends earlier work of Kato for rank-1 modules (cf. [Ven13]), of
Benois and Berger for crystalline G_Qp-representations with respect to the
cyclotomic extension (cf. [BB08]), as well as of Loeffler, Venjakob, and Zerbes
(cf. [LVZ13]) for crystalline G_Qp- representations with respect to abelian
p-adic Lie extensions of Qp. Nakamura [Nak13, Nak14] has also formulated a
version of the epsilon-conjecture for affinoid families of (phi,Gamma)-modules
over the Robba ring, and proved his conjecture in the rank-1 case. He used this
case to construct an epsilon-isomorphism for families of trianguline
(phi,Gamma)-modules, depending on a fixed triangulation. Our results imply that
this epsilon-isomorphism is independent of the chosen triangulation for certain
crystalline families. The main ingredient of our proof consists of the
construction of families of Wach modules generalizing work of Wach and Berger
[Ber04] and following the approach of Kisin to the construction of potentially
semi-stable deformation rings [Kisa].
","[{""version"":""v1"",""created"":""Mon, 31 Oct 2016 13:47:47 GMT""},{""version"":""v2"",""created"":""Mon, 23 Oct 2017 17:17:28 GMT""}]","2017-10-24"
"1610.09922","Zhang-qi Yin Dr","Kang Cai, Rui-Xia Wang, Zhang-Qi Yin, Gui-lu Long","The second order magnetic field gradient induced strong coupling between
  nitrogen-vacancy centers and a mechanical oscillator","7 pages, 5 figures",,,,"quant-ph","http://arxiv.org/licenses/nonexclusive-distrib/1.0/","  We consider a cantilever mechanical oscillator(MO) made of diamond. There is
a nitrogen-vacancy(NV) center at the end of the cantilever. Two magnetic tips
induce strong second order magnetic field gradient near the NV center. Under a
coherent driving on MO, we find that the coupling between the MO and the NV
center can be greatly enhanced. We studied how to realize quantum state
transfer between MO and NV center and generate entanglement between them. We
also proposed a scheme to generate the two-mode squeezing between different MO
modes by coupling them to the same NV center. The decoherence and dissipation
effects for both MO and NV center are numerically calculated by taking the
present experimental parameters. It is found that high fidelity quantum state
transfer, entanglement generation, and large two-mode squeezing could be
achieved.
","[{""version"":""v1"",""created"":""Mon, 31 Oct 2016 13:51:08 GMT""}]","2016-11-01"
"1610.09923","Jorge Lucero","Jorge C. Lucero","On the elementary single-fold operations of origami: reflections and
  incidence constraints on the plane","16 pages, minor rewordings and corrections, one theorem added","Forum Geometricorum 17 (2017) 207-221",,,"math.HO","http://arxiv.org/licenses/nonexclusive-distrib/1.0/","  This article reviews the so-called ""axioms"" of origami (paper folding), which
are elementary single-fold operations to achieve incidences between points and
lines in a sheet of paper. The geometry of reflections is applied, and
exhaustive analysis of all possible incidences reveals a set of eight
elementary operations. The set includes the previously known seven ""axioms"",
plus the operation of folding along a given line. This operation has been
ignored in past studies because it does not create a new line. However,
completeness of the set and its regular application in practical origami
dictate its inclusion. Formal definitions and conditions of existence of
solutions are given for all the operations.
","[{""version"":""v1"",""created"":""Mon, 31 Oct 2016 13:51:12 GMT""},{""version"":""v2"",""created"":""Sun, 28 May 2017 20:06:31 GMT""}]","2017-06-09"
"1610.09924","Avirup Shaw","Anindya Datta (University of Calcutta) and Avirup Shaw (Indian
  Association for the Cultivation of Science)","Effects of non-minimal Universal Extra Dimension on $B\rightarrow
  X_s\gamma$","Typos corrected, published version","Phys. Rev. D 95, 015033 (2017)","10.1103/PhysRevD.95.015033",,"hep-ph","http://arxiv.org/licenses/nonexclusive-distrib/1.0/","  We estimate contributions from Kaluza-Klein excitations of third generation
quarks and gauge bosons to the branching ratio of $B\rightarrow X_s\gamma$
decay process in 5-Dimensional Universal Extra Dimensional scenario with
non-vanishing boundary localised terms. This model is conventionally known as
non-minimal Universal Extra Dimensional model. We have derived the lower limit
on the size of the extra dimension by comparing our theoretical estimation of
the branching ratio which includes next-to-next-to leading order QCD
corrections with its experimentally measured value. Coefficients of the
boundary localised terms have also been constrained. 95 \% C.L. lower limit on
inverse of radius of compactification ($R^{-1}$) can be as large as 670 GeV for
some choice of the value of coefficients of boundary localised terms.
","[{""version"":""v1"",""created"":""Mon, 31 Oct 2016 13:52:07 GMT""},{""version"":""v2"",""created"":""Thu, 2 Feb 2017 08:16:03 GMT""}]","2017-02-03"
"1610.09925","Robert Denk","Robert Denk and Felix Hummel","Dispersive mixed-order systems in $L^p$-Sobolev spaces and application
  to the thermoelastic plate equation",,"Adv. Differential Equations 24 (2019), 377-406",,,"math.AP","http://arxiv.org/licenses/nonexclusive-distrib/1.0/","  We study dispersive mixed-order systems of pseudodifferential operators in
the setting of $L^p$-Sobolev spaces. Under the weak condition of
quasi-hyperbolicity, these operators generate a semigroup in the space of
tempered distributions. However, if the basic space is a tuple of $L^p$-Sobolev
spaces, a strongly continuous semigroup is in many cases only generated if
$p=2$ or $n=1$. The results are applied to the linear thermoelastic plate
equation inertial term and with Fourier's or Maxwell-Cattaneo's law of heat
conduction.
","[{""version"":""v1"",""created"":""Mon, 31 Oct 2016 13:53:25 GMT""},{""version"":""v2"",""created"":""Fri, 2 Feb 2018 12:29:10 GMT""}]","2020-08-20"
"1610.09927","Karl Petersen","Terrence Adams, S\'ebastien Ferenczi, and Karl Petersen","Constructive symbolic presentations of rank one measure-preserving
  systems","Updated historical remarks and added some references",,,,"math.DS","http://arxiv.org/licenses/nonexclusive-distrib/1.0/","  Given a rank one measure-preserving system defined by cutting and stacking
with spacers, we produce a rank one binary sequence such that its orbit closure
under the shift transformation, with its unique {nonatomic} invariant
probability, is isomorphic to the given system. In particular, the classical
dyadic odometer is presented in terms of a recursive sequence of blocks on the
two-symbol alphabet $\{0,1\}$. The construction is accomplished using a
definition of rank one in the setting of adic, or Bratteli-Vershik, systems.
","[{""version"":""v1"",""created"":""Mon, 31 Oct 2016 13:57:44 GMT""},{""version"":""v2"",""created"":""Mon, 14 Nov 2016 15:33:06 GMT""}]","2016-11-15"
"1610.09928","Airton Deppman","Airton Deppman and Eugenio Megias","Fractal aspects of hadrons","7 pages, ISMD2016 conference",,"10.1051/epjconf/201714101011",,"hep-ph","http://arxiv.org/licenses/nonexclusive-distrib/1.0/","  The non extensive aspects of $p_T$ distributions obtained in high energy
collisions are discussed in relation to possible fractal structure in hadrons,
in the sense of the thermofractal structure recently introduced. The evidences
of self-similarity in both theoretical and experimental works in High Energy
and in Hadron Physics are discussed, to show that the idea of fractal structure
of hadrons and fireballs have being under discussion for decades. The non
extensive self-consistent thermodynamics and the thermofractal structure allow
one to connect non extensivity to intermittence and possibly to parton
distribution functions in a single theoretical framework.
","[{""version"":""v1"",""created"":""Mon, 31 Oct 2016 14:01:56 GMT""}]","2017-04-26"
"1610.09929","Rakshith Jagannath","Rakshith Jagannath, Radha Krishna Ganti and Neelesh S Upadhye","Maximal Packing with Interference Constraints",,,,,"cs.IT math.IT stat.AP","http://arxiv.org/licenses/nonexclusive-distrib/1.0/","  In this work, we study the problem of scheduling a maximal set of
transmitters subjected to an interference constraint across all the nodes.
Given a set of nodes, the problem reduces to finding the maximum cardinality of
a subset of nodes that can concurrently transmit without violating interference
constraints. The resulting packing problem is a binary optimization problem and
is NP hard. We propose a semi-definite relaxation (SDR) for this problem and
provide bounds on the relaxation.
","[{""version"":""v1"",""created"":""Mon, 31 Oct 2016 14:04:00 GMT""}]","2016-11-01"
"1610.09930","Hans Van Winckel","M. Hillen, H. Van Winckel, J. Menu, R. Manick, J. Debosscher, M. Min,
  W.-J. de Wit, T. Verhoelst, D. Kamath, L.B.F.M Waters","A mid-IR interferometric survey with MIDI/VLTI: resolving the
  second-generation protoplanetary disks around post-AGB binaries","30 pages, 21 figures, in press in Astronomy and Astrophysics","A&A 599, A41 (2017)","10.1051/0004-6361/201629161",,"astro-ph.SR","http://arxiv.org/licenses/nonexclusive-distrib/1.0/","  We present a mid-IR interferometric survey of the circumstellar environment
of a specific class of post-Asymptotic Giant Branch (post-AGB) binaries. For
this class the presence of a compact dusty disk has been postulated on the
basis of various spatially unresolved measurements. Our interferometric survey
was performed with the MIDI instrument on the VLTI. In total 19 different
systems were observed using variable baseline configurations. Combining all the
visibilities at a single wavelength at 10.7 micron, we fitted two parametric
models to the data: a uniform disk (UD) and a ring model mimicking a
temperature gradient. We compared our observables of the whole sample, with
synthetic data computed from a grid of radiative transfer models of passively
irradiated disks in hydrostatic equilibrium. These models are computed with a
Monte Carlo code that has been widely applied to describe the structure of
protoplanetary disks around young stellar objects (YSO). The spatially resolved
observations show that the majority of our targets cluster closely together in
the distance-independent size-colour diagram, and have extremely compact N-band
emission regions. The typical uniform disk diameter of the N-band emission
region is about 40 mass which corresponds to a typical brightness temperature
of 400-600~K. The resolved objects display very similar characteristics in the
interferometric observables and in the spectral energy distributions.
Therefore, the physical properties of the disks around our targets must be
similar. The grid of protoplanetary disk models covers very well the observed
objects. Much like for young stars, the spatially resolved N-band emission
region is determined by the hot inner rim of the disk. Continued comparisons
between post-AGB and protoplanetary disks will help to understand grain growth
and disk evolution processes,
","[{""version"":""v1"",""created"":""Mon, 31 Oct 2016 14:12:17 GMT""}]","2017-03-01"
"1610.09934","Abdul-Lateef Haji-Ali","Abdul-Lateef Haji-Ali, Raul Tempone","Multilevel and Multi-index Monte Carlo methods for the McKean-Vlasov
  equation",,,,,"math.NA","http://arxiv.org/licenses/nonexclusive-distrib/1.0/","  We address the approximation of functionals depending on a system of
particles, described by stochastic differential equations (SDEs), in the
mean-field limit when the number of particles approaches infinity. This problem
is equivalent to estimating the weak solution of the limiting McKean-Vlasov
SDE. To that end, our approach uses systems with finite numbers of particles
and a time-stepping scheme. In this case, there are two discretization
parameters: the number of time steps and the number of particles. Based on
these two parameters, we consider different variants of the Monte Carlo and
Multilevel Monte Carlo (MLMC) methods and show that, in the best case, the
optimal work complexity of MLMC, to estimate the functional in one typical
setting with an error tolerance of $\mathrm{TOL}$, is $\mathcal
O\left({\mathrm{TOL}^{-3}}\right)$ when using the partitioning estimator and
the Milstein time-stepping scheme. We also consider a method that uses the
recent Multi-index Monte Carlo method and show an improved work complexity in
the same typical setting of $\mathcal
O\left(\mathrm{TOL}^{-2}\log(\mathrm{TOL}^{-1})^2\right)$. Our numerical
experiments are carried out on the so-called Kuramoto model, a system of
coupled oscillators.
","[{""version"":""v1"",""created"":""Mon, 31 Oct 2016 14:24:32 GMT""},{""version"":""v2"",""created"":""Mon, 1 May 2017 10:07:27 GMT""}]","2017-05-02"
"1610.09935","Dominic Seyler","Dominic Seyler, Mohamed Yahya, Klaus Berberich","Knowledge Questions from Knowledge Graphs",,"ICTIR (2017) 11-18","10.1145/3121050.3121073",,"cs.CL","http://arxiv.org/licenses/nonexclusive-distrib/1.0/","  We address the novel problem of automatically generating quiz-style knowledge
questions from a knowledge graph such as DBpedia. Questions of this kind have
ample applications, for instance, to educate users about or to evaluate their
knowledge in a specific domain. To solve the problem, we propose an end-to-end
approach. The approach first selects a named entity from the knowledge graph as
an answer. It then generates a structured triple-pattern query, which yields
the answer as its sole result. If a multiple-choice question is desired, the
approach selects alternative answer options. Finally, our approach uses a
template-based method to verbalize the structured query and yield a natural
language question. A key challenge is estimating how difficult the generated
question is to human users. To do this, we make use of historical data from the
Jeopardy! quiz show and a semantically annotated Web-scale document collection,
engineer suitable features, and train a logistic regression classifier to
predict question difficulty. Experiments demonstrate the viability of our
overall approach.
","[{""version"":""v1"",""created"":""Mon, 31 Oct 2016 14:27:07 GMT""},{""version"":""v2"",""created"":""Tue, 1 Nov 2016 05:39:25 GMT""}]","2019-04-17"
"1610.09937","Sourya Bhattacharyya","Sourya Bhattacharyya and Jayanta Mukhopadhyay","COSPEDTree-II: Improved Couplet based Phylogenetic Supertree","8 page detailed manuscript corresponding to the short paper (of the
  same title) accepted for the proceedings of IEEE BIBM 2016",,,,"q-bio.PE","http://arxiv.org/licenses/nonexclusive-distrib/1.0/","  A Supertree synthesizes the topologies of a set of phylogenetic trees
carrying overlapping taxa set. In process, conflicts in the tree topologies are
aimed to be resolved with the consensus clades. Such a problem is proved to be
NP-hard. Various heuristics on local search, maximum parsimony, graph cut, etc.
lead to different supertree approaches, of which the most popular methods are
based on analyzing fixed size subtree topologies (such as triplets or
quartets). Time and space complexities of these methods, however, depend on the
subtree size considered. Our earlier proposed supertree method COSPEDTree, uses
evolutionary relationship among individual couplets (taxa pair), to produce
slightly conservative (not fully resolved) supertrees. Here we propose its
improved version COSPEDTree-II, which produces better resolved supertree with
lower number of missing branches, and incurs much lower running time. Results
on biological datasets show that COSPEDTree-II belongs to the category of high
performance and computationally efficient supertree methods.
","[{""version"":""v1"",""created"":""Mon, 31 Oct 2016 14:29:21 GMT""}]","2016-11-01"
"1610.09938","Fu-Guo Deng","Hao Zhang, Xue-Ke Song, Qing Ai, Mei Zhang, Fu-Guo Deng","Transitionless intra-cavity quantum state transfer in optomechanical
  systems","7 pages, 6 figures. Comments are welcome to fgdeng@bnu.edu.cn",,,,"quant-ph","http://arxiv.org/licenses/nonexclusive-distrib/1.0/","  Quantum state transfer between cavities is crucial for quantum information
processing and quantum computation in optomechanical systems. Here, we present
the first scheme for the transitionless intra-cavity quantum state transfer
based on transitionless quantum driving (TQD) algorithm in optomechanical
systems. We also present a physically feasible system for the TQD process based
on largely detuned optomechanical cavity. With the Gaussian time-dependence
coupling strengths, our scheme can achieve the perfect quantum state transfer
with no undesired transition and reduce the dependence of accurately
controlling evolution time and interval of coupling strengths. Our
computational results show that the TQD process can be accomplished with no
need of the mechanical oscillator in its ground state and is also robust to the
mechanical dissipation.
","[{""version"":""v1"",""created"":""Mon, 31 Oct 2016 14:31:20 GMT""},{""version"":""v2"",""created"":""Tue, 1 Nov 2016 02:11:11 GMT""},{""version"":""v3"",""created"":""Tue, 8 Nov 2016 00:50:33 GMT""}]","2016-11-09"
"1610.09939","Jose Fontanari","Sandro M. Reia, Sebastian Herrmann and Jos\'e F. Fontanari","Impact of centrality on cooperative processes",,"Phys. Rev. E 95, 022305 (2017)","10.1103/PhysRevE.95.022305",,"physics.soc-ph cs.SI","http://arxiv.org/licenses/nonexclusive-distrib/1.0/","  The solution of today's complex problems requires the grouping of task forces
whose members are usually connected remotely over long physical distances and
different time zones. Hence, understanding the effects of imposed communication
patterns (i.e., who can communicate with whom) on group performance is
important. Here, we use an agent-based model to explore the influence of the
betweenness centrality of the nodes on the time the group requires to find the
global maxima of NK-fitness landscapes. The agents cooperate by broadcasting
messages, informing on their fitness to their neighbors, and use this
information to copy the more successful agents in their neighborhood. We find
that for easy tasks (smooth landscapes), the topology of the communication
network has no effect on the performance of the group, and that the more
central nodes are the most likely to find the global maximum first. For
difficult tasks (rugged landscapes), however, we find a positive correlation
between the variance of the betweenness among the network nodes and the group
performance. For these tasks, the performances of individual nodes are strongly
influenced by the agents dispositions to cooperate and by the particular
realizations of the rugged landscapes.
","[{""version"":""v1"",""created"":""Mon, 31 Oct 2016 14:34:16 GMT""},{""version"":""v2"",""created"":""Mon, 23 Jan 2017 18:00:12 GMT""}]","2017-02-15"
"1610.09940","Vaibhav Rawoot","Vaibhav S. Rawoot, Rashidul Islam, Mukesh Kumar","Differential cross section for the Higgs boson production in 4-lepton
  channel and $k_T$-factorization","Talk given at the QCD Evolution 2016 Workshop, Nikhef, Amsterdam, May
  30-June 3, 2016",,,,"hep-ph","http://arxiv.org/licenses/nonexclusive-distrib/1.0/","  We present our study of the differential cross section for the Higgs boson
production in $k_T$-factorization framework. The $k_T$-factorization formalism
includes a convolution over unintegrated parton distribution functions (uPDF)
and off-shell parton level matrix element. The off-shell matrix element
calculated considering initial gluons to be off-shell. We have considered only
gluon fusion process which is dominant production mechanism for the Higgs boson
production at LHC. We have used Ciafaloni-Catani-Fiorani-Marchesini (CCFM) uPDF
based on CCFM evolution equations. We have compared our results with fixed
order estimates up to NNLO+NNLL obtained using HRes tool within collinear
factorization framework as well as with the ATLAS and CMS measurements of the
corresponding differential distributions. This study will play an important
role in understanding differential cross section within $k_T$-factorization
framework.
","[{""version"":""v1"",""created"":""Mon, 31 Oct 2016 14:35:35 GMT""}]","2016-11-01"
