"1610.09738","Michal Jozwikowski","Micha{\l} J\'o\'zwikowski and Witold Respondek","Why are normal sub-Riemannian extremals locally minimizing?","Small corrections. Watch on YT: https://youtu.be/K3HApRo-V_s 14
  pages, 1 figure. Comments are wellcome","Differential Geom. Appl. 60 (2018) pp. 174-189","10.1016/j.difgeo.2018.06.005",,"math.DG math.OC","http://arxiv.org/licenses/nonexclusive-distrib/1.0/","  It is well-known that normal extremals in sub-Riemannian geometry are curves
which locally minimize the energy functional. Most proofs of this fact do not
make, however, an explicit use of relations between local optimality and the
geometry of the problem. In this paper, we provide a new proof of that
classical result, which gives insight into direct geometric reasons of local
optimality. Also the relation of the regularity of normal extremals with their
optimality becomes apparent in our approach.
","[{""version"":""v1"",""created"":""Mon, 31 Oct 2016 00:07:27 GMT""},{""version"":""v2"",""created"":""Sat, 21 Jan 2017 22:39:55 GMT""},{""version"":""v3"",""created"":""Mon, 3 Apr 2017 08:36:44 GMT""}]","2018-07-26"
"1610.09739","Maciej Jaromin","Maciej Jaromin","RKFD Methods - a short review",,,,,"math.NA","http://arxiv.org/licenses/nonexclusive-distrib/1.0/","  In this paper, a recently published method [Hussain, Ismail, Senua, Solving
directly special fourth-order ordinary differential equations using Runge-Kutta
type method, J. Comput. Appl. Math. 306 (2016) 179-199] for solving
fourth-order ordinary differential equations is summarized and reviewed. An
independant implementation of one of the published methods is also tested and
benchmarked against the RK4 method.
","[{""version"":""v1"",""created"":""Mon, 31 Oct 2016 00:10:22 GMT""}]","2016-11-01"
"1610.09740","Xuefang Sui","Xuefang Sui, Paolo Gondolo (University of Utah)","A New Polar Decomposition in a Scalar Product Space","22 pages",,,,"math.RA math.NA","http://arxiv.org/licenses/nonexclusive-distrib/1.0/","  There are various definitions of right and left polar decompositions of an
$m\times n$ matrix $F \in \mathbb{K}^{m\times n}$ (where
$\mathbb{K}=\mathbb{C}$ or $\mathbb{R}$) with respect to bilinear or
sesquilinear products defined by nonsingular matrices $M\in \mathbb{K}^{m\times
m}$ and $N\in \mathbb{K}^{n\times n}$. The existence and uniqueness of such
decompositions under various assumptions on $F$, $M$, and $N$ have been
studied. Here we introduce a new form of right and left polar decompositions,
$F=WS$ and $F=S'W'$, respectively, where the matrix $W$ has orthonormal columns
($W'$ has orthonormal rows) with respect to suitably defined scalar products
which are functions of $M$, $N$, and $F$, and the matrix $S$ is selfadjoint
with respect to the same suitably defined scalar products and has eigenvalues
only in the open right half-plane. We show that our right and left
decompositions exist and are unique for any nonsingular matrices $M$ and $N$
when the matrix $F$ satisfies $(F^{[M,N]})^{[N,M]}=F$ and $F^{[M,N]}F$
($FF^{[M,N]}$, respectively) is nonsingular, where $F^{[M,N]}=N^{-1} F^\# M$
with $F^\#=F^T$ for real or complex bilinear forms and $F^\#=\bar{F}^T$ for
sesquilinear forms. When $M=N$, our results apply to nonsingular square
matrices $F$. Our assumptions on $F$, $M$, and $N$ are in some respects weaker
and in some respects stronger than those of previous work on polar
decompositions.
","[{""version"":""v1"",""created"":""Mon, 31 Oct 2016 00:10:28 GMT""}]","2016-11-01"
"1610.09741","Valerio Toledano-Laredo","Andrea Appel, Valerio Toledano-Laredo","Coxeter categories and quantum groups","Substantial revision. Changes include 1) greatly expanded
  introduction 2) Section 8 split into the new sections 8 (Universal Algebras)
  and 9 (Universal pre-Coxeter Structures) 3) more thorough account of the
  PROPic nature of transferred structure (Sect. 10) 4) notion of Upsilon and
  a-strict pre-Coxeter structures (Sect. 3, 9 and 10). Final version. To appear
  in Selecta Math. 81 pages","Selecta Mathematica 25 (2019)","10.1007/s00029-019-0490-y",,"math.QA math.CT math.RT","http://arxiv.org/licenses/nonexclusive-distrib/1.0/","  We define the notion of braided Coxeter category, which is informally a
tensor category carrying compatible, commuting actions of a generalised braid
group B_W and Artin's braid groups B_n on the tensor powers of its objects. The
data which defines the action of B_W bears a formal similarity to the
associativity constraints in a monoidal category, but is related to the
coherence of a family of fiber functors. We show that the quantum Weyl group
operators of a quantised Kac-Moody algebra U_h(g), together with the universal
R-matrices of its Levi subalgebras, give rise to a braided Coxeter structure on
integrable, category O-modules for U_h(g). By relying on the 2-categorical
extension of Etingof-Kazhdan quantisation obtained in arXiv:1610.09744, we then
prove that this structure can be transferred to integrable, category
O-representations of g. These results are used in arXiv:1512.03041 to give a
monodromic description of the quantum Weyl group operators of U_h(g) which
extends the one obtained by the second author for a semisimple Lie algebra.
","[{""version"":""v1"",""created"":""Mon, 31 Oct 2016 00:15:11 GMT""},{""version"":""v2"",""created"":""Wed, 2 Nov 2016 12:41:36 GMT""},{""version"":""v3"",""created"":""Wed, 18 Jul 2018 22:29:49 GMT""},{""version"":""v4"",""created"":""Wed, 26 Jun 2019 14:55:42 GMT""}]","2019-09-04"
"1610.09742","Xuefang Sui","Xuefang Sui, Paolo Gondolo (University of Utah)","Factorizations into Normal Matrices in Indefinite Inner Product Spaces","30 pages",,,,"math.RA math.NA","http://arxiv.org/licenses/nonexclusive-distrib/1.0/","  We show that any nonsingular (real or complex) square matrix can be
factorized into a product of at most three normal matrices, one of which is
unitary, another selfadjoint with eigenvalues in the open right half-plane, and
the third one is normal involutory with a neutral negative eigenspace (we call
the latter matrices normal neutral involutory). Here the words normal, unitary,
selfadjoint and neutral are understood with respect to an indefinite inner
product.
","[{""version"":""v1"",""created"":""Mon, 31 Oct 2016 00:17:02 GMT""}]","2016-11-01"
"1610.09743","Hala Assal","Hala Assal, Ahsan Imran, Sonia Chiasson","An Exploration of Graphical Password Authentication for Children",,,,,"cs.HC","http://arxiv.org/licenses/nonexclusive-distrib/1.0/","  In this paper, we explore graphical passwords as a child-friendly alternative
for user authentication. We evaluate the usability of three variants of the
PassTiles graphical password scheme for children, and explore the similarities
and differences in performance and preferences between children and adults
while using these schemes. Children were most successful at recalling passwords
containing images of distinct objects. Both children and adults prefer
graphical passwords to their existing schemes, but password memorization
strategies differ considerably between the two groups. Based on our findings,
we provide recommendations for designing more child-friendly authentication
schemes.
","[{""version"":""v1"",""created"":""Mon, 31 Oct 2016 00:19:00 GMT""}]","2016-11-01"
"1610.09744","Valerio Toledano-Laredo","Andrea Appel, Valerio Toledano-Laredo","A 2-categorical extension of Etingof-Kazhdan quantisation","Small revisions in Sections 2 and 6. An appendix added on the
  equivalence between admissible Drinfeld-Yetter modules over a QUE and modules
  over its quantum double. To appear in Selecta Math. 71 pages","Selecta Mathematica 24 (2018), 3529-3617","10.1007/s00029-017-0381-z",,"math.QA math.RT","http://arxiv.org/licenses/nonexclusive-distrib/1.0/","  Let k be a field of characteristic zero. Etingof and Kazhdan constructed a
quantisation U_h(b) of any Lie bialgebra b over k, which depends on the choice
of an associator Phi. They prove moreover that this quantisation is functorial
in b. Remarkably, the quantum group U_h(b) is endowed with a Tannakian
equivalence F_b from the braided tensor category of Drinfeld-Yetter modules
over b, with deformed associativity constraints given by Phi, to that of
Drinfeld-Yetter modules over U_h(b). In this paper, we prove that the
equivalence F_b is functorial in b.
","[{""version"":""v1"",""created"":""Mon, 31 Oct 2016 00:22:19 GMT""},{""version"":""v2"",""created"":""Wed, 2 Nov 2016 12:38:16 GMT""},{""version"":""v3"",""created"":""Fri, 7 Jul 2017 21:06:37 GMT""},{""version"":""v4"",""created"":""Mon, 11 Dec 2017 17:33:00 GMT""}]","2018-08-31"
"1610.09745","Qiang Yao","Sai Song, Qiang Yao","A new method for computing the expected hitting time between arbitrary
  different configurations of the multiple-urn Ehrenfest model","14 pages","Journal of Mathematical Study, Vol. 55, No. 3, pp. 254-270 (2022)","10.4208/jms.v55n3.22.03",,"math.PR math.CO","http://arxiv.org/licenses/nonexclusive-distrib/1.0/","  We study a multiple-urn version of the Ehrenfest model. In this setting, we
denote the n urns by Urn 1 to Urn n, where n>=2. Initially, M balls are
randomly placed in the n urns. At each subsequent step, a ball is selected and
put into the other n-1 urns with equal probability. The expected hitting time
leading to a change of the M balls' status is computed using the method of
stopping times. As a corollary, we obtain the expected hitting time of moving
all the M balls from Urn 1 to Urn 2. This proves a conjecture which was
recently made in Chen et al.(2017).
","[{""version"":""v1"",""created"":""Mon, 31 Oct 2016 00:22:26 GMT""},{""version"":""v2"",""created"":""Tue, 25 Apr 2017 14:17:07 GMT""},{""version"":""v3"",""created"":""Sun, 3 Dec 2017 16:48:45 GMT""},{""version"":""v4"",""created"":""Thu, 1 Mar 2018 13:35:44 GMT""},{""version"":""v5"",""created"":""Thu, 11 Oct 2018 17:43:16 GMT""},{""version"":""v6"",""created"":""Tue, 9 Apr 2019 05:23:26 GMT""},{""version"":""v7"",""created"":""Sat, 26 Jun 2021 09:15:01 GMT""}]","2022-12-07"
"1610.09746","Evgeni Kolomeitsev","E.E. Kolomeitsev, K.A. Maslov, and D.N. Voskresensky","Delta isobars in relativistic mean-field models with $\sigma$-scaled
  hadron masses and couplings","46 pages, 21 figures",,"10.1016/j.nuclphysa.2017.02.004",,"nucl-th astro-ph.HE","http://arxiv.org/licenses/nonexclusive-distrib/1.0/","  We extend the relativistic mean-field models with hadron masses and
meson-baryon coupling constants dependent on the scalar $\sigma$ field, studied
previously to incorporate $\Delta(1232)$ baryons. Available empirical
information is analyzed to put constraints on the couplings of $\Delta$s with
meson fields. Conditions for the appearance of $\Delta$s are studied. We
demonstrate that with inclusion of the $\Delta$s our equations of state
continue to fulfill majority of known empirical constraints including the
pressure-density constraint from heavy-ion collisions, the constraint on the
maximum mass of the neutron stars, the direct Urca and the gravitational-baryon
mass ratio constraints.
","[{""version"":""v1"",""created"":""Mon, 31 Oct 2016 00:31:06 GMT""}]","2017-04-05"
"1610.09747","Jingrui Wang","Jingrui Wang, Keyan Wang","Almost Sure Existence of Global Weak Solutions to the 3D Incompressible
  Navier-Stokes Equation","15 pages, submitted in 2015",,,,"math.AP","http://arxiv.org/licenses/nonexclusive-distrib/1.0/","  In this paper we prove the almost sure existence of global weak solution to
the 3D incompressible Navier-Stokes Equation for a set of large data in
$\dot{H}^{-\alpha}(\mathbb{R}^{3})$ or $\dot{H}^{-\alpha}(\mathbb{T}^{3})$ with
$0<\alpha\leq 1/2$. This is achieved by randomizing the initial data and
showing that the energy of the solution modulus the linear part keeps finite
for all $t\geq0$. Moreover, the energy of the solutions is also finite for all
$t>0$. This improves the recent result of Nahmod, Pavlovi\'{c} and Staffilani
on (SIMA, [1])in which $\alpha$ is restricted to $0<\alpha<\frac{1}{4}$.
","[{""version"":""v1"",""created"":""Mon, 31 Oct 2016 00:38:43 GMT""}]","2016-11-01"
"1610.09748","Evgeni Kolomeitsev","E.E. Kolomeitsev and D.N. Voskresensky","Scalar quanta in Fermi liquids: zero sounds, instabilities, Bose
  condensation, and a metastable state in dilute nuclear matter","version accepted in Eur. Phys. J. A. arXiv admin note: substantial
  text overlap with arXiv:1505.03884",,"10.1140/epja/i2016-16362-0",,"nucl-th cond-mat.quant-gas","http://arxiv.org/licenses/nonexclusive-distrib/1.0/","  Spectrum of bosonic scalar-mode excitations in a normal Fermi liquid with a
local scalar interaction is investigated for various values and momentum
dependence of the scalar Landau parameter $f_0$ in the particle-hole channel.
For $f_0 >0$ the conditions are found when the phase velocity on the spectrum
of the zero sound acquires a minimum at a non-zero momentum. For $-1<f_0 <0$
there are only damped excitations, and for $f_0<-1$ the spectrum becomes
unstable against a growth of scalar-mode excitations. An effective Lagrangian
for the scalar excitation modes is derived after performing a bosonization
procedure. We demonstrate that the instability may be tamed by the formation of
a static Bose condensate of the scalar modes. The condensation may occur in a
homogeneous or inhomogeneous state relying on the momentum dependence of the
scalar Landau parameter. We show that in the isospin-symmetric nuclear matter
there may appear a metastable state at a subsaturation nuclear density owing to
the condensate. Then we consider a possibility of the condensation of the
zero-sound-like excitations in a state with a non-zero momentum in Fermi
liquids moving with overcritical velocities, provided an appropriate momentum
dependence of the Landau parameter $f_0 (k)>0$. We also argue that in
peripheral heavy-ion collisions the Pomeranchuk instability may occur already
for $f_0 >-1$.
","[{""version"":""v1"",""created"":""Mon, 31 Oct 2016 00:43:09 GMT""},{""version"":""v2"",""created"":""Mon, 28 Nov 2016 11:05:13 GMT""}]","2017-01-04"
"1610.09749","Franz Herling","F. Herling, C. Morrison, C.S. Knox, S. Zhang, O. Newell, M. Myronov,
  E.H. Linfield and C.H. Marrows","Spin-orbit interaction in InAs/GaSb heterostructures quantified by weak
  antilocalization",,"Phys. Rev. B 95, 155307 (2017)","10.1103/PhysRevB.95.155307",,"cond-mat.mes-hall","http://arxiv.org/licenses/nonexclusive-distrib/1.0/","  We study the spin-orbit interaction (SOI) in InAs/ GaSb and InAs quantum
wells. We show through temperature- and gate-dependent magnetotransport
measurements of weak antilocalization that the dominant spin-orbit relaxation
mechanism in our low-mobility heterostructures is Elliott-Yafet and not
Dyakonov-Perel in the form of the Rashba or Dresselhaus SOI as previously
suggested. We compare our findings with recent work on this material system and
show that the SOI length lies within the same range. The SOI length may be
controlled using an electrostatic gate, opening up prospects for developing
spintronic applications.
","[{""version"":""v1"",""created"":""Mon, 31 Oct 2016 00:52:36 GMT""},{""version"":""v2"",""created"":""Thu, 2 Mar 2017 20:52:05 GMT""}]","2017-04-19"
"1610.09750","Vadim Sokolov","Eric Jacquier and Nicholas Polson and Vadim Sokolov","Sequential Bayesian Learning for Merton's Jump Model with Stochastic
  Volatility",,,,,"stat.AP","http://arxiv.org/licenses/nonexclusive-distrib/1.0/","  Jump stochastic volatility models are central to financial econometrics for
volatility forecasting, portfolio risk management, and derivatives pricing.
Markov Chain Monte Carlo (MCMC) algorithms are computationally unfeasible for
the sequential learning of volatility state variables and parameters, whereby
the investor must update all posterior and predictive densities as new
information arrives. We develop a particle filtering and learning algorithm to
sample posterior distribution in Merton's jump stochastic volatility. This
allows to filter spot volatilities and jump times, together with sequentially
updating (learning) of jump and volatility parameters. We illustrate our
methodology on Google's stock return. We conclude with directions for future
research.
","[{""version"":""v1"",""created"":""Mon, 31 Oct 2016 00:53:08 GMT""}]","2016-11-01"
"1610.09751","Shuwen Lou Dr.","Shuwen Lou","Brownian Motion with Drift on Spaces with Varying Dimension","40 pages",,,,"math.PR","http://arxiv.org/licenses/nonexclusive-distrib/1.0/","  Many properties of Brownian motion on spaces with varying dimension (BMVD in
abbreviation) have been explored in [5]. In this paper, we study Brownian
motion with drift on spaces with varying dimension (BMVD with drift in
abbreviation). Such a process can be conveniently defined by a regular
Dirichlet form that is not necessarily symmetric. The drift term is in some
type of $L^{p}$ space with $p$ depending on the region of the state space. We
show BMVD with drift can be related to a BMVD without drift via Girsanov
transform. Through the method of Duhamel's principle, it is established in this
paper that the transition density of BMVD with drift has the same type of sharp
two-sided Gaussian bounds as that for BMVD (without drift). As a corollary, we
derive Green function estimate for BMVD with drift.
","[{""version"":""v1"",""created"":""Mon, 31 Oct 2016 00:53:51 GMT""},{""version"":""v2"",""created"":""Tue, 1 Nov 2016 19:49:19 GMT""},{""version"":""v3"",""created"":""Mon, 7 Nov 2016 04:13:30 GMT""},{""version"":""v4"",""created"":""Mon, 9 Oct 2017 16:01:55 GMT""},{""version"":""v5"",""created"":""Sun, 1 Jul 2018 04:43:46 GMT""}]","2018-07-03"
"1610.09752","Bobo Wei","Bo-Bo Wei and Liang Jin","Universal Critical Behaviors in Non-Hermitian Phase Transitions","5 pages,2 Figures","Scientific Reports 7, 7165 (2017)","10.1038/s41598-017-07344-z",,"quant-ph cond-mat.stat-mech","http://arxiv.org/licenses/nonexclusive-distrib/1.0/","  Quantum phase transitions also occur in non-Hermitian systems. In this work
we show that density functional theory, for the first time, uncovers universal
behaviors for phase transitions in non-Hermitian many-body systems. To be
specific, we first prove that the non-degenerate steady state of a
non-Hermitian quantum many-body system is a universal function of the first
derivative of the steady state energy with respect to the control parameter.
This finding has far-reaching consequences for non-Hermitian systems: (i) It
bridges the nonanalytic behavior in physical observable and nonanalytic
behavior of steady state energy, which explains why the quantum phase
transitions in non-Hermitian systems occur for finite systems. (ii) It predicts
universal scaling behaviors of any physical observable at non-Hermitian phase
transition point with scaling exponent being
$(1-1/p),2(1-1/p),\cdots,n(1-1/p),\cdots$ with $p$ being the number of
coalesced states at the exceptional point and $n$ being a positive integer.
(iii). It reveals that quantum entanglement in non-Hermitian phase transition
point presents universal scaling behaviors with critical exponents being
$(1-1/p),2(1-1/p),\cdots,n(1-1/p),\cdots$. These results uncover universal
critical behaviors in non-Hermitian phase transitions and provide profound
connections between entanglement and phase transition in non-Hermitian quantum
many-body physics and establish foundations for quantum metrology in
non-Hermitian systems.
","[{""version"":""v1"",""created"":""Mon, 31 Oct 2016 01:02:03 GMT""}]","2017-08-10"
"1610.09753","Panagiotis Gianniotis","Panagiotis Gianniotis and Felix Schulze","Ricci flow from spaces with isolated conical singularities","Final version, to appear in Geometry & Topology","Geom. Topol. 22 (2018) 3925-3977","10.2140/gt.2018.22.3925",,"math.DG","http://arxiv.org/licenses/nonexclusive-distrib/1.0/","  Let $(M,g_0)$ be a compact $n$-dimensional Riemannian manifold with a finite
number of singular points, where the metric is asymptotic to a non-negatively
curved cone over $(\mathbb{S}^{n-1},g)$. We show that there exists a smooth
Ricci flow starting from such a metric with curvature decaying like C/t. The
initial metric is attained in Gromov-Hausdorff distance and smoothly away from
the singular points. In the case that the initial manifold has isolated
singularities asymptotic to a non-negatively curved cone over
$(\mathbb{S}^{n-1}/\Gamma,g)$, where $\Gamma$ acts freely and properly
discontinuously, we extend the above result by showing that starting from such
an initial condition there exists a smooth Ricci flow with isolated orbifold
singularities.
","[{""version"":""v1"",""created"":""Mon, 31 Oct 2016 01:16:16 GMT""},{""version"":""v2"",""created"":""Mon, 9 Jul 2018 15:00:47 GMT""}]","2018-12-19"
"1610.09754","Heidi Goodson","Heidi Goodson","A Complete Hypergeometric Point Count Formula for Dwork Hypersurfaces","Typos corrected and references updated. To appear in Journal of
  Number Theory, Volume 179, October 2017",,,,"math.NT","http://arxiv.org/licenses/nonexclusive-distrib/1.0/","  We extend our previous work on hypergeometric point count formulas by proving
that we can express the number of points on families of Dwork hypersurfaces
$$X_{\lambda}^d: \hspace{.1in} x_1^d+x_2^d+\ldots+x_d^d=d\lambda x_1x_2\cdots
x_d$$ over finite fields of order $q\equiv 1\pmod d$ in terms of Greene's
finite field hypergeometric functions. We prove that when $d$ is odd, the
number of points can be expressed as a sum of hypergeometric functions plus
$(q^{d-1}-1)/(q-1)$ and conjecture that this is also true when $d$ is even. The
proof rests on a result that equates certain Gauss sum expressions with finite
field hypergeometric functions. Furthermore, we discuss the types of
hypergeometric terms that appear in the point count formula and give an
explicit formula for Dwork threefolds.
","[{""version"":""v1"",""created"":""Mon, 31 Oct 2016 01:24:48 GMT""},{""version"":""v2"",""created"":""Thu, 29 Jun 2017 15:49:48 GMT""}]","2017-06-30"
"1610.09755","Jonas Kindervater","Jonas Kindervater and Steffen S\""aubert and Peter B\""oni","Dipolar effects on the critical fluctuations in Fe: Investigation by
  MIEZE","6 pages, 6 figures","Phys. Rev. B 95, 014429 (2017)","10.1103/PhysRevB.95.014429",,"cond-mat.str-el","http://arxiv.org/licenses/nonexclusive-distrib/1.0/","  Iron is one of the archetypical ferromagnets to study the critical
fluctuations at a continuous phase transition thus serving as a model system
for the application of scaling theory. We report a comprehensive study of the
critical dynamics at the transition from the ferro- to the paramagnetic phase
in Fe, employing the high-resolution neutron spin echo technique MIEZE. The
results show that the dipolar interactions lead to an additional damping of the
critical spin fluctuations at small momentum transfers $\bf q$. The results
agree essentially with scaling theory if the dipolar interactions are taken
into account by means of the mode-coupling equations. However, in contrast to
expectations, the dipolar wavenumber $q_D$ that plays a central role in the
scaling function $f(\kappa/q,q_D/\kappa)$ becomes temperature dependent. In the
limit of small $\bf q$ the critical exponent $z$ crosses over from 2.5 to 2.0.
","[{""version"":""v1"",""created"":""Mon, 31 Oct 2016 01:26:42 GMT""}]","2017-02-01"
"1610.09756","Vinayak Athavale","Vinayak Athavale, Shreenivas Bharadwaj, Monik Pamecha, Ameya Prabhu
  and Manish Shrivastava","Towards Deep Learning in Hindi NER: An approach to tackle the Labelled
  Data Scarcity","7 pages",,,"https://aclweb.org/anthology/W/W16/W16-6320.pdf","cs.CL cs.LG","http://arxiv.org/licenses/nonexclusive-distrib/1.0/","  In this paper we describe an end to end Neural Model for Named Entity
Recognition NER) which is based on Bi-Directional RNN-LSTM. Almost all NER
systems for Hindi use Language Specific features and handcrafted rules with
gazetteers. Our model is language independent and uses no domain specific
features or any handcrafted rules. Our models rely on semantic information in
the form of word vectors which are learnt by an unsupervised learning algorithm
on an unannotated corpus. Our model attained state of the art performance in
both English and Hindi without the use of any morphological analysis or without
using gazetteers of any sort.
","[{""version"":""v1"",""created"":""Mon, 31 Oct 2016 01:31:52 GMT""},{""version"":""v2"",""created"":""Wed, 16 Nov 2016 17:15:14 GMT""}]","2017-11-13"
