"1608.01130","Denis Arcon","J. Srpcic, P. Jeglic, I. Felner, Bing Lv, C.W. Chu, and D. Arcon","Nearly ferromagnetic metal state in the collapsed tetragonal phase of
  YFe$_2$(Ge,Si)$_2$","5 pages, 4 figures","Phys. Rev. B 96, 174430 (2017)","10.1103/PhysRevB.96.174430",,"cond-mat.str-el","http://arxiv.org/licenses/nonexclusive-distrib/1.0/","  The surprising discovery of tripling the superconducting critical temperature
of KFe$_2$As$_2$ at high pressures issued an intriguing question of how the
superconductivity in the collapsed tetragonal phase differs from that in the
non-collapsed phases of Fe-based superconductors. Here we report $^{89}$Y
nuclear magnetic resonance study of YFe$_2$Ge$_{x}$Si$_{2-x}$ compounds whose
electronic structure is similar to that of iron-pnictide collapsed tetragonal
phases already at ambient pressure. Fe(Ge,Si) layers show strong ferromagnetic
spin fluctuations whereas layers are coupled antiferromagnetically -- both
positioning the studied family close to a quantum critical point. Next,
localized moments attributed either to Fe interstitial or antisite defects may
account for magnetic impurity pair-breaking effects thus explaining the
substantial variation of superconductivity among different YFe$_2$Ge$_2$
samples.
","[{""version"":""v1"",""created"":""Wed, 3 Aug 2016 09:54:42 GMT""}]","2017-11-29"
"1608.01131","Peter Horvathy","M. Elbistan, C. Duval, P. A. Horvathy, P.-M. Zhang","Duality and helicity: a symplectic viewpoint","10 pages, no figures",,"10.1016/j.physletb.2016.08.041",,"math-ph hep-th math.MP","http://arxiv.org/licenses/nonexclusive-distrib/1.0/","  The theorem which says that helicity is the conserved quantity associated
with the duality symmetry of the vacuum Maxwell equations is proved by viewing
electromagnetism as an infinite dimensional symplectic system. In fact, it is
shown that helicity is the moment map of duality acting as an $SO(2)$ group of
canonical transformations on the symplectic space of all solutions of the
vacuum Maxwell equations.
","[{""version"":""v1"",""created"":""Wed, 3 Aug 2016 09:57:58 GMT""}]","2016-08-31"
"1608.01132","Alexei Pevtsov","Yury A. Nagovitsyn, Alexei A. Pevtsov, and Aleksandra A. Osipova","Long-term variations in sunspot magnetic field - area relation","8 pages, 7 figures, accepted for publication in Astron. Nachrichten",,"10.1002/asna.201613035",,"astro-ph.SR","http://arxiv.org/licenses/nonexclusive-distrib/1.0/","  Using observations of sunspot magnetic field strengths (H) from the Crimean
Astrophysical Observatory (CrAO) and area (S) of sunspots from the Kislovodsk
Mountain Astronomical Station of Pulkovo Observatory, we investigate the
changes in the relation between H and S over the period of about two solar
cycles (1994-2013). The data were fitted by H = A + B log S, where A =
(778+/-46) and B = (778+/-25). We show that the correlation between H and S
varies with the phase of solar cycle, and $A$ coefficient decreases
significantly after year 2001, while B coefficient does not change
significantly. Furthermore, our data confirm the presence of two distinct
populations in distribution of sunspots (small sunspots with weaker field
strength and large sunspots with stronger field). We show that relative
contribution of each component to the distribution of sunspots by their area
changes with the phase of solar cycle and on longer-then-cycle periods. We
interpret these changes as a signature of a long-term (centennial) variations
in properties of sunspots.
","[{""version"":""v1"",""created"":""Wed, 3 Aug 2016 09:58:43 GMT""}]","2017-05-10"
"1608.01133","Pingjin Deng","Pingjin Deng","The boundary non-Crossing probabilities for Slepian process",,,,,"math.PR math.ST q-fin.MF q-fin.RM stat.TH","http://arxiv.org/licenses/nonexclusive-distrib/1.0/","  In this contribution we derive an explicit formula for the boundary
non-crossing probabilities for Slepian processes associated with the piecewise
linear boundary function. This formula is used to develop an approximation
formula to the boundary non-crossing probabilities for general continuous
boundaries. The formulas we developed are easy to implement in calculation the
boundary non-crossing probabilities.
","[{""version"":""v1"",""created"":""Wed, 3 Aug 2016 10:04:25 GMT""}]","2016-08-04"
"1608.01134","Estelle Pons","Estelle Pons, Mike G. Watson","A new sample of X-ray selected narrow emission-line galaxies. II.
  Looking for True Seyfert 2","10 pages, 10 figures, accepted for publication in A&A","A&A 594, A72 (2016)","10.1051/0004-6361/201629194",,"astro-ph.HE astro-ph.GA","http://arxiv.org/licenses/nonexclusive-distrib/1.0/","  A sample of X-ray and optically selected narrow emission-line galaxies (769
sources) from the 3XMM catalogue cross-correlated with SDSS (DR9) catalogue has
been studied. Narrow-emission line active galactic nuclei (AGN; type-2) have
been selected on the basis of their emission line ratios and/or X-ray
luminosity. We have looked for X-ray unobscured type-2 AGN. As X-ray spectra
were not available for our whole sample, we have checked the reliability of
using the X-ray hardness ratio (HR) as a probe of the level of obscuration and
we found a very good agreement with full spectral fitting results, with only 2%
of the sources with apparently unobscured HR turning out to have an obscured
spectrum. Despite the fact that type-2 AGN are supposed to be absorbed based on
the Unified Model, about 60% of them show no sign or very low level of X-ray
obscuration. After subtraction of contaminants to the sample, that is
Narrow-Line Seyfert 1 and Compton-thick AGN, the fraction of unobscured Sy2
drops to 47%. For these sources, we were able to rule out dust reddening and
variability for most of them as an explanation of the absence of optical broad
emission-lines. The main explanations remaining are the dilution of weak/very
broad emission-lines by the host galaxy and the intrinsic absence of the
broad-line region (BLR) due to low accretion rates (i.e. True Sy2). However,
the number of True Sy2 strongly depends on the method used to verify the
intrinsic lack of broad lines. Indeed using the optical continuum luminosity to
predict the BLR properties gives a much larger fraction of True Sy2 (about 90\%
of the unobscured Sy2 sample) than the use of the X-ray 2 keV luminosity (about
20%). Nevertheless the number of AGN we securely detected as True Sy2 is at
least three times larger that the previously confirmed number of True Sy2.
","[{""version"":""v1"",""created"":""Wed, 3 Aug 2016 10:05:07 GMT""}]","2016-10-19"
"1608.01135","Jean Baptiste Patenou","Marcel Dossa, Jean Baptiste Patenou","Cauchy problem on two characteristic hypersurfaces for the
  Einstein-Vlasov-Scalar field equations in temporal gauge","9 pages, to appear at C. R. Math. Rep. Acad. Sci. Canada",,,,"math-ph math.MP","http://arxiv.org/licenses/nonexclusive-distrib/1.0/","  In this paper, we consider the initial value problem for the
Einstein-Vlasov-Scalar field equations in temporal gauge, where the initial
data are prescribed on two characteristic smooth intersecting hypersurfaces.
From a suitable choice of some free data, the initial data constraints's
problem is solved globally, then the evolution problem relative to the deduced
initial data is solved locally in time.
","[{""version"":""v1"",""created"":""Wed, 3 Aug 2016 10:06:27 GMT""}]","2016-08-04"
"1608.01136","Denis Arcon","D. Arcon, L. M. Schoop, R. J. Cava, and C. Felser","Evolution of magnetic fluctuations through the Fe-induced paramagnetic
  to ferromagnetic transition in Cr$_2$B","8 pages, 7 figures","Phys. Rev. B 93, 104413 (2016)","10.1103/PhysRevB.93.104413",,"cond-mat.str-el","http://arxiv.org/licenses/nonexclusive-distrib/1.0/","  In itinerant ferromagnets, the quenched disorder is predicted to dramatically
affect the ferromagnetic to paramagnetic quantum phase transition driven by
external control parameters at zero temperature. Here we report a study on
Fe-doped Cr$_2$B, which, starting from the paramagnetic parent, orders
ferromagnetically for Fe-doping concentrations $x$ larger than $x_{\rm
c}=2.5$\%. In parent Cr$_2$B, $^{11}$B nuclear magnetic resonance data reveal
the presence of both ferromagnetic and antiferromagnetic fluctuations. The
latter are suppressed with Fe-doping, before the ferromagnetic ones finally
prevail for $x>x_{\rm c}$. Indications for non-Fermi liquid behavior, usually
associated with the proximity of a quantum critical point, were found for all
samples, including undoped Cr$_2$B. The sharpness of the ferromagnetic-like
transition changes on moving away from $x_{\rm c}$, indicating significant
changes in the nature of the magnetic transitions in the vicinity of the
quantum critical point. Our data provide constraints for understanding quantum
phase transitions in itinerant ferromagnets in the limit of weak quenched
disorder.
","[{""version"":""v1"",""created"":""Wed, 3 Aug 2016 10:13:49 GMT""}]","2016-08-04"
"1608.01137","Enrique S\'anchez Lozano","Enrique S\'anchez-Lozano and Brais Martinez and Georgios Tzimiropoulos
  and Michel Valstar","Cascaded Continuous Regression for Real-time Incremental Face Tracking","ECCV 2016 accepted paper, with supplementary material included as
  appendices. References to Equations fixed",,,,"cs.CV","http://arxiv.org/licenses/nonexclusive-distrib/1.0/","  This paper introduces a novel real-time algorithm for facial landmark
tracking. Compared to detection, tracking has both additional challenges and
opportunities. Arguably the most important aspect in this domain is updating a
tracker's models as tracking progresses, also known as incremental (face)
tracking. While this should result in more accurate localisation, how to do
this online and in real time without causing a tracker to drift is still an
important open research question. We address this question in the cascaded
regression framework, the state-of-the-art approach for facial landmark
localisation. Because incremental learning for cascaded regression is costly,
we propose a much more efficient yet equally accurate alternative using
continuous regression. More specifically, we first propose cascaded continuous
regression (CCR) and show its accuracy is equivalent to the Supervised Descent
Method. We then derive the incremental learning updates for CCR (iCCR) and show
that it is an order of magnitude faster than standard incremental learning for
cascaded regression, bringing the time required for the update from seconds
down to a fraction of a second, thus enabling real-time tracking. Finally, we
evaluate iCCR and show the importance of incremental learning in achieving
state-of-the-art performance. Code for our iCCR is available from
http://www.cs.nott.ac.uk/~psxes1
","[{""version"":""v1"",""created"":""Wed, 3 Aug 2016 10:17:22 GMT""},{""version"":""v2"",""created"":""Sat, 6 Aug 2016 21:03:34 GMT""}]","2016-08-09"
"1608.01138","Tiago Campante","T. L. Campante, M. Schofield, J. S. Kuszlewicz, L. Bouma, W. J.
  Chaplin, D. Huber, J. Christensen-Dalsgaard, H. Kjeldsen, D. Bossini, T. S.
  H. North, T. Appourchaux, D. W. Latham, J. Pepper, G. R. Ricker, K. G.
  Stassun, R. Vanderspek, J. N. Winn","The asteroseismic potential of TESS: exoplanet-host stars","Accepted for publication in ApJ; 31 pages, 12 figures",,"10.3847/0004-637X/830/2/138",,"astro-ph.SR","http://arxiv.org/licenses/nonexclusive-distrib/1.0/","  New insights on stellar evolution and stellar interiors physics are being
made possible by asteroseismology. Throughout the course of the Kepler mission,
asteroseismology has also played an important role in the characterization of
exoplanet-host stars and their planetary systems. The upcoming NASA Transiting
Exoplanet Survey Satellite (TESS) will be performing a near all-sky survey for
planets that transit bright nearby stars. In addition, its excellent
photometric precision, combined with its fine time sampling and long intervals
of uninterrupted observations, will enable asteroseismology of solar-type and
red-giant stars. Here we develop a simple test to estimate the detectability of
solar-like oscillations in TESS photometry of any given star. Based on an
all-sky stellar and planetary synthetic population, we go on to predict the
asteroseismic yield of the TESS mission, placing emphasis on the yield of
exoplanet-host stars for which we expect to detect solar-like oscillations.
This is done for both the target stars (observed at a 2-min cadence) and the
full-frame-image stars (observed at a 30-min cadence). A similar exercise is
also conducted based on a compilation of known host stars. We predict that TESS
will detect solar-like oscillations in a few dozen target hosts (mainly
subgiant stars but also in a smaller number of F dwarfs), in up to 200
low-luminosity red-giant hosts, and in over 100 solar-type and red-giant known
hosts, thereby leading to a threefold improvement in the asteroseismic yield of
exoplanet-host stars when compared to Kepler's.
","[{""version"":""v1"",""created"":""Wed, 3 Aug 2016 10:23:41 GMT""}]","2016-10-21"
"1608.01139","Anna Morozovska Nickolaevna","Anatolii I. Kurchak, Anna N. Morozovska, and Maksym V. Strikha","Hysteretic phenomena in GFET: general theory and experiment","main paper : 28 pages, 10 figures, supplementary materials with 3
  figures",,"10.1063/1.4996095",,"cond-mat.mes-hall","http://arxiv.org/licenses/nonexclusive-distrib/1.0/","  We propose a general theory for the analytical description of versatile
hysteretic phenomena in a graphene field effect transistor (GFET) allowing for
the existence of the external dipoles on graphene free surface and the
localized states at the graphene-surface interface. We demonstrated that the
absorbed dipole molecules (e.g. dissociated or highly polarized water
molecules) can cause hysteretic form of carrier concentration as a function of
gate voltage and corresponding dependence of graphene conductivity in GFET on
the substrate of different types, including the most common SiO2 and
ferroelectric ones. It was shown that the increase of the gate voltage sweeping
rate leads to the complete vanishing of hysteresis for GFET on SiO2 substrate,
as well as for GFET on ferroelectric substrate for applied electric fields E
less than the critical value Ec. For E>Ec the crossover from the hysteresis to
antihysteresis takes place. These results well correlate with the available
experimental data up to the quantitative agreement. Proposed model takes into
consideration the carriers trapping from the graphene channel by the interface
states and describes the antihysteresis in GFET on PZT substrate well enough.
Obtained results clarify the fundamental principles of GFET operation as well
as can be directly applied to describe the basic characteristics of advanced
nonvolatile ultra-fast memory devices using GFET on versatile substrates.
","[{""version"":""v1"",""created"":""Wed, 3 Aug 2016 10:32:55 GMT""}]","2017-09-13"
"1608.01140","Gary Pui-Tung Choi","Gary Pui-Tung Choi, Mandy Hiu-Ying Man, Lok Ming Lui","Fast Spherical Quasiconformal Parameterization of Genus-0 Closed
  Surfaces with Application to Adaptive Remeshing",,"Geometry, Imaging and Computing 3, 1-29 (2016)","10.4310/GIC.2016.v3.n1.a1",,"cs.CG cs.GR math.DG","http://arxiv.org/licenses/nonexclusive-distrib/1.0/","  In this work, we are concerned with the spherical quasiconformal
parameterization of genus-0 closed surfaces. Given a genus-0 closed
triangulated surface and an arbitrary user-defined quasiconformal distortion,
we propose a fast algorithm for computing a spherical parameterization of the
surface that satisfies the prescribed distortion. The proposed algorithm can be
effectively applied to adaptive surface remeshing for improving the
visualization in computer graphics and animations. Experimental results are
presented to illustrate the effectiveness of our algorithm.
","[{""version"":""v1"",""created"":""Wed, 3 Aug 2016 10:33:21 GMT""}]","2020-02-10"
"1608.01141","Fabio Sciarrino","Fulvio Flamini, Niko Viggianiello, Taira Giordani, Marco Bentivegna,
  Nicol\'o Spagnolo, Andrea Crespi, Giacomo Corrielli, Roberto Osellame, Miguel
  Angel Martin-Delgado, and Fabio Sciarrino","Observation of Majorization Principle for quantum algorithms via 3-D
  integrated photonic circuits","6 pages, 4 figures + 2 pages Supplementary Information",,,,"quant-ph physics.optics","http://arxiv.org/licenses/nonexclusive-distrib/1.0/","  The Majorization Principle is a fundamental statement governing the dynamics
of information processing in optimal and efficient quantum algorithms. While
quantum computation can be modeled to be reversible, due to the unitary
evolution undergone by the system, these quantum algorithms are conjectured to
obey a quantum arrow of time dictated by the Majorization Principle: the
probability distribution associated to the outcomes gets ordered step-by-step
until achieving the result of the computation. Here we report on the
experimental observation of the effects of the Majorization Principle for two
quantum algorithms, namely the quantum fast Fourier transform and a recently
introduced validation protocol for the certification of genuine many-boson
interference. The demonstration has been performed by employing integrated 3-D
photonic circuits fabricated via femtosecond laser writing technique, which
allows to monitor unambiguously the effects of majorization along the execution
of the algorithms. The measured observables provide a strong indication that
the Majorization Principle holds true for this wide class of quantum
algorithms, thus paving the way for a general tool to design new optimal
algorithms with a quantum speedup.
","[{""version"":""v1"",""created"":""Wed, 3 Aug 2016 10:49:07 GMT""}]","2016-08-04"
"1608.01142","Prasad Perlekar","Rayan Chatterjee, Abhijeet A. Joshi, and Prasad Perlekar","Front structure and dynamics in dense colonies of motile bacteria: Role
  of active turbulence","9 pages, 8 figures","Phys. Rev. E 94, 022406 (2016)","10.1103/PhysRevE.94.022406",,"physics.flu-dyn cond-mat.soft nlin.CD physics.bio-ph","http://arxiv.org/licenses/nonexclusive-distrib/1.0/","  We study the spreading of a bacterial colony undergoing turbulent like
collective motion. We present two minimalistic models to investigate the
interplay between population growth and coherent structures arising from
turbulence. Using Direct Numerical Simulation (DNS) of the proposed models we
find that turbulence has two prominent effects on the spatial growth of the
colony: (a) the front speed is enhanced, and (b) the front gets crumpled. Both
these effects, which we highlight by using statistical tools, are markedly
different in our two models. We also show that the crumpled front structure and
the passive scalar fronts in random flows are related in certain regimes.
","[{""version"":""v1"",""created"":""Wed, 3 Aug 2016 10:51:56 GMT""}]","2017-04-06"
"1608.01143","Olga Izyumtseva","Olga Izyumtseva","On local time for the solution to a white noise driven heat equation",,,,,"math.PR","http://arxiv.org/licenses/nonexclusive-distrib/1.0/","  In this article we discuss the existence of local time for a class of
Gaussian processes which appears as the solutions to some stochastic evolution
equations. We show that on small intervals such processes are Gaussian
integrators generated by a continuously invertible operators. This allows us to
conclude that the considered processes have a local time on any finite interval
with respect to spatial variable.
","[{""version"":""v1"",""created"":""Wed, 3 Aug 2016 10:52:43 GMT""}]","2016-08-04"
"1608.01144","Wei Wang","Wei Wang and Tao Yu","Square-free Discriminants of Matrices and the Generalized Spectral
  Characterizations of Graphs",,,,,"math.CO","http://arxiv.org/licenses/nonexclusive-distrib/1.0/","  Let $S_n(\mathbb{Z})$ and $O_n(\mathbb{Q})$ denote the set of all $n\times n$
symmetric matrices over the ring of integers $\mathbb{Z}$ and the set of all
$n\times n$ orthogonal matrices over the field of rational numbers
$\mathbb{Q}$, respectively. The paper is mainly concerned with the following
problem: Given a matrix $A\in {S_n(\mathbb{Z})}$. How can one find all rational
orthogonal matrices $Q\in{O_n(\mathbb{Q})}$ such that $Q^TAQ\in
{S_n(\mathbb{Z})}$, and in particular, when does $Q^TAQ\in {S_n(\mathbb{Z})}$
with $Q\in{O_n(\mathbb{Q})}$ imply that $Q$ is \emph{a signed permutation
matrix} (i.e., the matrix obtained from a permutation matrix $P$ by replacing
each 1 in $P$ with 1 or $-1$)?
  A surprisingly simple answer was given in terms of whether the discriminant
of the characteristic polynomial of $A$ is odd and square-free, which partially
answers the above questions. More precisely, let $\Delta_A=\pm
\res(\phi,\phi')$ be \emph{the discriminant of matrix $A$}, where
$\res(\phi,\phi')$ is \emph{the resultant} of the characteristic polynomial
$\phi$ of $A$ and its derivative $\phi'$. We show that if $\Delta_A$ is odd and
square-free, then $Q^TAQ\in {S_n(\mathbb{Z})}$ with $Q\in{O_n(\mathbb{Q})}$
implies that $Q$ is a signed permutation matrix. As an application, we present
a simple and efficient method for testing whether a graph is determined by the
generalized spectrum, which significantly extends our previous work.
","[{""version"":""v1"",""created"":""Wed, 3 Aug 2016 10:54:14 GMT""}]","2016-08-04"
"1608.01145","Olga Izyumtseva","Andrey Dorogovtsev, Olga Izyumtseva, Georgii Riabov, Naoufel Salhi","Clark formula for local time for one class of Gaussian processes",,,,,"math.PR","http://arxiv.org/licenses/nonexclusive-distrib/1.0/","  In the article we present chaotic decomposition and analog of the Clark
formula for the local time of Gaussian integrators. Since the integral with
respect to Gaussian integrator is understood in Skorokhod sense, then there
exist more than one Clark representation for the local time. We present
different representations and discuss the representation with the minimal
L_2-norm.
","[{""version"":""v1"",""created"":""Wed, 3 Aug 2016 11:04:02 GMT""}]","2016-08-04"
"1608.01146","Stefan Heun","Keisuke Takahashi, Shigehito Isobe, Kengo Omori, Torge Mashoff,
  Domenica Convertino, Vaidotas Miseikis, Camilla Coletti, Valentina Tozzini,
  and Stefan Heun","Revealing the multi-bonding state between hydrogen and
  graphene-supported Ti clusters",,"J. Phys. Chem. C 2016, 120, 12974-12979","10.1021/acs.jpcc.6b05207",,"physics.chem-ph cond-mat.mes-hall","http://arxiv.org/licenses/nonexclusive-distrib/1.0/","  Hydrogen adsorption on graphene-supported metal clusters has brought much
controversy due to the complex nature of the bonding between hydrogen and metal
clusters. The bond types of hydrogen and graphene-supported Ti clusters are
experimentally and theoretically investigated. Transmission electron microscopy
shows that Ti clusters of nanometer-size are formed on graphene. Thermal
desorption spectroscopy captures three hydrogen desorption peaks from
hydrogenated graphene-supported Ti clusters. First principle calculations also
found three types of interaction: Two types of bonds with different partial
ionic character and physisorption. The physical origin for this rests on the
charge state of the Ti clusters: when Ti clusters are neutral, H2 is
dissociated, and H forms bonds with the Ti cluster. On the other hand, H2 is
adsorbed in molecular form on positively charged Ti clusters, resulting in
physisorption. Thus, this work clarifies the bonding mechanisms of hydrogen on
graphene-supported Ti clusters.
","[{""version"":""v1"",""created"":""Wed, 3 Aug 2016 11:04:51 GMT""}]","2016-08-04"
"1608.01147","Mohammad Hossein Zarei","Mohammad Hossein Zarei, Yahya Khalili","Systematic study of the completeness of two-dimensional classical
  $\phi^4$ theory","15 pages, 11 figures, abstract and introduction revised, accepted for
  publication in Int. J. Quantum Information(IJQI)","Int. J. Quantum Inform. 15, 1750051 (2017)","10.1142/S0219749917500514",,"hep-lat cond-mat.stat-mech quant-ph","http://arxiv.org/licenses/nonexclusive-distrib/1.0/","  The completeness of some classical statistical mechanical (SM) models is a
recent result that has been developed by quantum formalism for the partition
functions. In this paper, we consider a 2D classical $\phi^4$ filed theory
whose completeness has been proved in [V. Karimipour and et al, Phys. Rev. A
85, 032316]. We give a general systematic proof for the completeness of such a
model where, by a few simple steps, we show how the partition function of an
arbitrary classical field theory can be derived from a 2D classical $\phi^4$
model. To this end, we start from various classical field theories containing
models on arbitrary lattices and also $U(1)$ lattice gauge theories. Then we
convert them to a new classical field model on a non-planar bipartite graph
with imaginary kinetic terms. After that, we show that any polynomial function
of the field in the corresponding Hamiltonian can approximately be converted to
a $\phi^4$ term by adding enough numbers of vertices to the bipartite graph. In
the next step, we give a few graphical transformations to convert the final
non-planar graph to a 2D rectangular lattice. We also show that the number of
vertices which should be added grows polynomially with the number of vertices
in the original model.
","[{""version"":""v1"",""created"":""Wed, 3 Aug 2016 11:08:15 GMT""},{""version"":""v2"",""created"":""Mon, 3 Oct 2016 06:28:30 GMT""},{""version"":""v3"",""created"":""Tue, 10 Oct 2017 11:06:49 GMT""}]","2017-12-12"
