"1608.00973","Brian Lemaux","Brian C. Lemaux, Adam R. Tomczak, Lori M. Lubin, Po-Feng Wu, Roy R.
  Gal, Nicholas Rumbaugh, Dale D. Kocevski, and Gordon K. Squires","Chronos and Kairos: Mosfire Observations of Post-Starburst Galaxies in
  z~1 Clusters and Groups","20 pages, seven figures, four tables, accepted to MNRAS after minor
  changes to v1, v3 fixes a rendering issue present in v2",,"10.1093/mnras/stx1579",,"astro-ph.GA","http://arxiv.org/licenses/nonexclusive-distrib/1.0/","  In this study we present the exploration of $\sim$500 spectroscopically
confirmed galaxies in and around two large scale structures at $z\sim1$ drawn
from the ORELSE survey. A sub-sample of these galaxies ($\sim$150) were
targeted for the initial phases of a near-infrared MOSFIRE spectroscopic
campaign investigating the differences in selections of galaxies which had
recently ended a burst of star formation or had rapidly quenched (i.e.,
post-starburst or K+A galaxies). Selection with MOSFIRE resulted in a
post-starburst sample more than double that selected by traditional $z\sim1$
(observed-frame optical) methods even after the removal of the relatively large
fraction of dusty starburst galaxies selected through traditional methods.
While the traditional post-starburst fraction increased with increased global
density, the MOSFIRE-selected post-starburst fraction was found to be constant
in field, group, and cluster environments. However, this fraction relative to
the number of galaxies with ongoing star formation was observed to elevate in
the cluster environment. Post-starbursts selected with MOSFIRE were
predominantly found to exhibit moderately strong [OII] emission originating
from activity other than star formation. Such galaxies, termed K+A with
ImposteR [OII]-derived Star formation (KAIROS) galaxies, were found to be
considerably younger than traditionally-selected post-starbursts and likely
undergoing some form of feedback absent or diminished in traditional
post-starbursts. A comparison between the environments of the two types of
post-starbursts suggests a picture in which the evolution of a post-starburst
galaxy is considerably different in cluster environments than in the more
rarefied environments of a group or the field.
","[{""version"":""v1"",""created"":""Tue, 2 Aug 2016 20:00:02 GMT""},{""version"":""v2"",""created"":""Thu, 28 Sep 2017 23:38:25 GMT""},{""version"":""v3"",""created"":""Mon, 30 Apr 2018 20:27:55 GMT""}]","2018-05-02"
"1608.00974","John Chisholm","John Chisholm and Satoki Matsushita","The Molecular Baryon Cycle of M82","14 pages, 15 figures, accepted for publication in ApJ",,"10.3847/0004-637X/830/2/72",,"astro-ph.GA","http://arxiv.org/licenses/nonexclusive-distrib/1.0/","  Baryons cycle into galaxies from the inter-galactic medium, are converted
into stars, and a fraction of the baryons are ejected out of galaxies by
stellar feedback. Here we present new high resolution (3.9""; 68 pc) CO(2-1) and
CO(3-2) images that probe these three stages of the baryon cycle in the nearby
starburst M 82. We combine these new observations with previous CO(1-0) and [Fe
II] images to study the physical conditions within the molecular gas. Using a
Bayesian analysis and the radiative transfer code RADEX, we model molecular
Hydrogen temperatures and densities, as well as CO column densities. Besides
the disc, we concentrate on two regions within the galaxy: an expanding
super-bubble and the base of a molecular streamer. Shock diagnostics,
kinematics, and optical extinction suggest that the streamer is an inflowing
filament, with a molecular gas mass inflow rate of 3.5 M$_\odot$ yr$^{-1}$. We
measure the molecular gas mass outflow rate of the expanding super-bubble to be
17 M$_\odot$ yr$^{-1}$, 5 times higher than the inferred inflow rate, and 1.3
times the star formation rate of the galaxy. The high mass outflow rate and
large star formation rate will deplete the galaxy of molecular gas within eight
million years, unless there are additional sources of molecular gas.
","[{""version"":""v1"",""created"":""Tue, 2 Aug 2016 20:00:03 GMT""}]","2016-10-19"
"1608.00975","Andreas Crivellin","Andreas Crivellin, Margherita Ghezzi and Massimiliano Procura","Effective Field Theory with Two Higgs Doublets","19 pages, 8 tables, minor modifications, redundant operator in Table
  4 removed",,"10.1007/JHEP09(2016)160","CERN-TH-2016-157, PSI-16-09","hep-ph","http://arxiv.org/licenses/nonexclusive-distrib/1.0/","  In this article we extend the effective field theory framework describing new
physics effects to the case where the underlying low-energy theory is a
Two-Higgs-Doublet model. We derive a complete set of independent operators up
to dimension six assuming a $Z_2$-invariant CP-conserving Higgs potential. The
effects on Higgs and gauge boson masses, mixing angles in the Higgs sector as
well as couplings to fermions and gauge bosons are computed. At variance with
the case of a single Higgs doublet, we find that pair production of SM-like
Higgses, arising through dimension-six operators, is not fixed by
fermion-fermion-Higgs couplings and can therefore be sizable.
","[{""version"":""v1"",""created"":""Tue, 2 Aug 2016 20:00:04 GMT""},{""version"":""v2"",""created"":""Mon, 30 Mar 2020 15:27:03 GMT""}]","2020-03-31"
"1608.00976","Murad Tovmasyan","Murad Tovmasyan, Sebastiano Peotta, P\""aivi T\""orm\""a and Sebastian D.
  Huber","Effective theory and emergent $SU(2)$ symmetry in the flat bands of
  attractive Hubbard models",,"Phys. Rev. B 94, 245149 (2016)","10.1103/PhysRevB.94.245149",,"cond-mat.str-el cond-mat.quant-gas cond-mat.supr-con quant-ph","http://arxiv.org/licenses/nonexclusive-distrib/1.0/","  In a partially filled flat Bloch band electrons do not have a well defined
Fermi surface and hence the low-energy theory is not a Fermi liquid.
Neverethless, under the influence of an attractive interaction, a
superconductor well described by the Bardeen-Cooper-Schrieffer (BCS) wave
function can arise. Here we study the low-energy effective Hamiltonian of a
generic Hubbard model with a flat band. We obtain an effective Hamiltonian for
the flat band physics by eliminating higher lying bands via perturbative
Schrieffer-Wolff transformation. At first order in the interaction energy we
recover the usual procedure of projecting the interaction term onto the flat
band Wannier functions. We show that the BCS wave function is the exact ground
state of the projected interaction Hamiltonian and that the compressibility is
diverging as a consequence of an emergent $SU(2)$ symmetry. This symmetry is
broken by second order interband transitions resulting in a finite
compressibility, which we illustrate for a one-dimensional ladder with two
perfectly flat bands. These results motivate a further approximation leading to
an effective ferromagnetic Heisenberg model. The gauge-invariant result for the
superfluid weight of a flat band can be obtained from the ferromagnetic
Heisenberg model only if the maximally localized Wannier functions in the
Marzari-Vanderbilt sense are used. Finally, we prove an important inequality $D
\geq \mathcal{W}^2$ between the Drude weight $D$ and the winding number
$\mathcal{W}$, which guarantees ballistic transport for topologically
nontrivial flat bands in one dimension.
","[{""version"":""v1"",""created"":""Tue, 2 Aug 2016 20:00:05 GMT""}]","2017-01-05"
"1608.00977","Ennio Salvioni","Aleksandr Azatov, Christophe Grojean, Ayan Paul and Ennio Salvioni","Resolving gluon fusion loops at current and future hadron colliders","17 pages + appendices and references; v2: reference list extended and
  note added. Version published in JHEP; v3: mistake corrected in double Higgs
  production contours of Fig. 1. Minor modifications to the related discussion,
  conclusions unchanged","JHEP 1609 (2016) 123","10.1007/JHEP09(2016)123",,"hep-ph hep-ex","http://arxiv.org/licenses/nonexclusive-distrib/1.0/","  Inclusive Higgs measurements at the LHC have limited resolution on the gluon
fusion loops, being unable to distinguish the long-distance contributions
mediated by the top quark from possible short-distance new physics effects.
Using an Effective Field Theory (EFT) approach we compare several proposed
methods to lift this degeneracy, including $t\bar{t}h$ and boosted, off-shell
and double Higgs production, and perform detailed projections to the
High-Luminosity LHC and a future hadron collider. In addition, we revisit
off-shell Higgs production. Firstly, we point out its sensitivity to
modifications of the top-$Z$ couplings, and by means of a general analysis we
show that the reach is comparable to that of tree-level processes such as
$t\bar{t}Z$ production. Implications for composite Higgs models are also
discussed. Secondly, we assess the regime of validity of the EFT, performing an
explicit comparison for a simple extension of the Standard Model containing one
vector-like quark.
","[{""version"":""v1"",""created"":""Tue, 2 Aug 2016 20:00:05 GMT""},{""version"":""v2"",""created"":""Wed, 21 Sep 2016 05:23:04 GMT""},{""version"":""v3"",""created"":""Mon, 30 Apr 2018 12:52:12 GMT""}]","2018-05-01"
"1608.00978","Erin Kado-Fong","Erin Kado-Fong, Peter K.G. Williams, Andrew W. Mann, Edo Berger,
  William S. Burgett, Kenneth C. Chambers, Mark E. Huber, Nicholas Kaiser,
  Rolf-Peter Kudritzki, Eugene A. Magnier, Richard J. Wainscoat, Christopher
  Waters","M Dwarf Activity in the Pan-STARRS 1 Medium-Deep Survey: First Catalog
  and Rotation Periods","20 pages, 11 figures. Submitted to ApJ",,"10.3847/1538-4357/833/2/281",,"astro-ph.SR","http://arxiv.org/licenses/nonexclusive-distrib/1.0/","  We report on an ongoing project to investigate activity in the M dwarf
stellar population observed by the Pan-STARRS 1 Medium Deep Survey (PS1-MDS).
Using a custom-built pipeline, we refine an initial sample of $\approx$ 4
million sources in PS1-MDS to a sample of 184,148 candidate cool stars using
color cuts. Motivated by the well-known relationship between rotation and
stellar activity, we use a multi-band periodogram analysis and visual vetting
to identify 271 sources that are likely rotating M dwarfs. We derive a new set
of polynomials relating M dwarf PS1 colors to fundamental stellar parameters
and use them to estimate the masses, distances, effective temperatures, and
bolometric luminosities of our sample. We present a catalog containing these
values, our measured rotation periods, and cross-matches to other surveys. Our
final sample spans periods of $\lesssim$1-130 days in stars with estimated
effective temperatures of $\approx$ 2700-4000 K. Twenty-two of our sources have
X-ray cross-matches, and they are found to be relatively X-ray bright as would
be expected from selection effects. Our data set provides evidence that
Kepler-based searches have not been sensitive to very slowly-rotating stars
($P_{\rm rot} \gtrsim 70$ d), implying that the observed emergence of very slow
rotators in studies of low-mass stars may be a systematic effect. We also see a
lack of low-amplitude ($<$2%) variability in objects with intermediate (10-40
d) rotation periods, which, considered in conjunction with other observational
results, may be a signpost of a loss of magnetic complexity associated with a
phase of rapid spin-down in intermediate-age M dwarfs. This work represents
just a first step in exploring stellar variability in data from the PS1-MDS
and, in the farther future, LSST.
","[{""version"":""v1"",""created"":""Tue, 2 Aug 2016 20:00:06 GMT""}]","2016-12-28"
"1608.00979","Christoph Adam","C. Adam, J. Sanchez-Guillen, A. Wereszczynski","On the spin excitation energy of the nucleon in the Skyrme model","Latex, 8 pages, no figures",,"10.1142/S021830131650097X",,"nucl-th hep-ph","http://arxiv.org/licenses/nonexclusive-distrib/1.0/","  In the Skyrme model of nucleons and nuclei, the spin excitation energy of the
nucleon is traditionally calculated by a fit of the rigid rotor quantization of
spin/isospin of the fundamental Skyrmion (the hedgehog) to the masses of the
nucleon and the Delta resonance. The resulting, quite large spin excitation
energy of the nucleon of about $ 73\, \mbox{MeV}$ is, however, rather difficult
to reconcile with the small binding energies of physical nuclei, among other
problems. Here we argue that a more reliable value for the spin excitation
energy of the nucleon, compatible with many physical constraints, is about $
16\, \mbox{MeV}$. The fit of the rigid rotor to the Delta, on the other hand,
is problematic in any case, because it implies the use of a nonrelativistic
method for a highly relativistic system.
","[{""version"":""v1"",""created"":""Tue, 2 Aug 2016 20:00:07 GMT""}]","2016-12-21"
"1608.00980","Sujit Kumar Nath","Sujit Kumar Nath, Banibrata Mukhopadhyay","A pure hydrodynamic instability in shear flows and its application to
  astrophysical accretion disks","14 pages including 10 figures; accepted for publication in ApJ",,"10.3847/0004-637X/830/2/86",,"astro-ph.HE cond-mat.soft physics.flu-dyn","http://arxiv.org/licenses/nonexclusive-distrib/1.0/","  We provide the possible resolution for the century old problem of
hydrodynamic shear flows, which are apparently stable in linear analysis but
shown to be turbulent in astrophysically observed data and experiments. This
mismatch is noticed in a variety of systems, from laboratory to astrophysical
flows. There are so many uncountable attempts made so far to resolve this
mismatch, beginning with the early work of Kelvin, Rayleigh, and Reynolds
towards the end of the nineteenth century. Here we show that the presence of
stochastic noise, whose inevitable presence should not be neglected in the
stability analysis of shear flows, leads to pure hydrodynamic linear
instability therein. This explains the origin of turbulence, which has been
observed/interpreted in astrophysical accretion disks, laboratory experiments
and direct numerical simulations. This is, to the best of our knowledge, the
first solution to the long standing problem of hydrodynamic instability of
Rayleigh stable flows.
","[{""version"":""v1"",""created"":""Tue, 2 Aug 2016 20:00:15 GMT""}]","2016-10-26"
"1608.00981","Sarang Gopalakrishnan","S. A. Parameswaran, Sarang Gopalakrishnan","Non-Fermi glasses: fractionalizing electrons at finite energy density","4 pages, 2 figures, plus supplemental material","Phys. Rev. Lett. 119, 146601 (2017)","10.1103/PhysRevLett.119.146601",,"cond-mat.dis-nn cond-mat.str-el","http://arxiv.org/licenses/nonexclusive-distrib/1.0/","  Non-Fermi liquids are metals that cannot be adiabatically deformed into free
fermion states. We argue for the existence of ""non-Fermi glasses,"" which are
phases of interacting disordered fermions that are fully many-body localized,
yet cannot be deformed into an Anderson insulator without an eigenstate phase
transition. We explore the properties of such non-Fermi glasses, focusing on a
specific solvable example. At high temperature, non-Fermi glasses have
qualitatively similar spectral features to Anderson insulators. We identify a
diagnostic, based on ratios of correlation functions, that sharply
distinguishes between the two phases even at infinite temperature. We argue
that our results and diagnostic should generically apply to the
high-temperature behavior of the many-body localized descendants of
fractionalized phases.
","[{""version"":""v1"",""created"":""Tue, 2 Aug 2016 20:01:08 GMT""}]","2017-10-11"
"1608.00982","Vladimir Skokov","Vladimir Skokov, Paul Sorensen, Volker Koch, Soeren Schlichting, Jim
  Thomas, Sergei Voloshin, Gang Wang and Ho-Ung Yee","Chiral Magnetic Effect Task Force Report","28 pages, 7 figures; Task Force Report on Chiral Magnetic Effect; v2:
  references added, minor corrections","Chin.Phys. C41 (2017) no.7, 072001","10.1088/1674-1137/41/7/072001",,"nucl-th hep-ph nucl-ex","http://arxiv.org/licenses/nonexclusive-distrib/1.0/","  In this report, we briefly examine the current status of the study of the
chiral magnetic effect including theory and experimental progress. We recommend
future strategies for resolving uncertainties in interpretation including
recommendations for theoretical work, recommendations for measurements based on
data collected in the past five years, and recommendations for beam use in the
coming years of RHIC. We have specifically investigated the case for colliding
nuclear isobars (nuclei with the same mass but different charge) and find the
case compelling. We recommend that a program of nuclear isobar collisions to
isolate the chiral magnetic effect from background sources be placed as a high
priority item in the strategy for completing the RHIC mission.
","[{""version"":""v1"",""created"":""Tue, 2 Aug 2016 20:01:43 GMT""},{""version"":""v2"",""created"":""Fri, 12 Aug 2016 22:36:35 GMT""}]","2018-02-27"
"1608.00983","James Wurster Dr","James Wurster","NICIL: A stand alone library to self-consistently calculate non-ideal
  magnetohydrodynamic coefficients in molecular cloud cores","13 pgs; accepted to PASA; source code for NICIL:
  https://bitbucket.org/jameswurster/nicil ; Corrected typos in eqn 47 and in
  initial conditions of section 4",,"10.1017/pasa.2016.34",,"astro-ph.IM astro-ph.SR","http://arxiv.org/licenses/nonexclusive-distrib/1.0/","  In this paper, we introduce Nicil: Non-Ideal magnetohydrodynamics
Coefficients and Ionisation Library. Nicil is a stand-alone Fortran90 module
that calculates the ionisation values and the coefficients of the non-ideal
magnetohydrodynamics terms of Ohmic resistivity, the Hall effect, and ambipolar
diffusion. The module is fully parameterised such that the user can decide
which processes to include and decide upon the values of the free parameters,
making this a versatile and customisable code. The module includes both cosmic
ray and thermal ionisation; the former includes two ion species and three
species of dust grains (positively charged, negatively charged and neutral),
and the latter includes five elements which can be doubly ionised. We
demonstrate tests of the module, and then describe how to implement it into an
existing numerical code.
","[{""version"":""v1"",""created"":""Tue, 2 Aug 2016 20:02:28 GMT""},{""version"":""v2"",""created"":""Tue, 6 Sep 2016 13:29:26 GMT""}]","2016-09-21"
"1608.00984","Farzad Mahfouzi","Farzad Mahfouzi, Nicholas Kioussis","Ferromagnetic Damping/Anti-damping in a Periodic 2D Helical surface; A
  Non-Equilibrium Keldysh Green Function Approach","6 pages, 0 figures",,,,"cond-mat.mes-hall","http://arxiv.org/licenses/nonexclusive-distrib/1.0/","  In this paper, we investigate theoretically the spin-orbit torque as well as
the Gilbert damping for a two band model of a 2D helical surface state with a
Ferromagnetic (FM) exchange coupling. We decompose the density matrix into the
Fermi sea and Fermi surface components and obtain their contributions to the
electronic transport as well as the spin-orbit torque (SOT). Furthermore, we
obtain the expression for the Gilbert damping due to the surface state of a 3D
Topological Insulator (TI) and predicted its dependence on the direction of the
magnetization precession axis.
","[{""version"":""v1"",""created"":""Tue, 2 Aug 2016 20:05:18 GMT""},{""version"":""v2"",""created"":""Sat, 13 Aug 2016 01:27:39 GMT""}]","2016-08-16"
"1608.00985","Artem Kaznatcheev","Artem Kaznatcheev, Robert Vander Velde, Jacob G. Scott, David Basanta","Cancer treatment scheduling and dynamic heterogeneity in social dilemmas
  of tumour acidity and vasculature","14 main pages (+10 pg appendix), 3 figures",,,,"q-bio.PE q-bio.TO","http://arxiv.org/licenses/nonexclusive-distrib/1.0/","  Background: Tumours are diverse ecosystems with persistent heterogeneity in
various cancer hallmarks like self-sufficiency of growth factor production for
angiogenesis and reprogramming of energy-metabolism for aerobic glycolysis.
This heterogeneity has consequences for diagnosis, treatment, and disease
progression.
  Methods: We introduce the double goods game to study the dynamics of these
traits using evolutionary game theory. We model glycolytic acid production as a
public good for all tumour cells and oxygen from vascularization via VEGF
production as a club good benefiting non-glycolytic tumour cells. This results
in three viable phenotypic strategies: glycolytic, angiogenic, and aerobic
non-angiogenic.
  Results: We classify the dynamics into three qualitatively distinct regimes:
(1) fully glycolytic, (2) fully angiogenic, or (3) polyclonal in all three cell
types. The third regime allows for dynamic heterogeneity even with linear
goods, something that was not possible in prior public good models that
considered glycolysis or growth-factor production in isolation.
  Conclusion: The cyclic dynamics of the polyclonal regime stress the
importance of timing for anti-glycolysis treatments like lonidamine. The
existence of qualitatively different dynamic regimes highlights the order
effects of treatments. In particular, we consider the potential of vascular
renormalization as a neoadjuvant therapy before follow up with interventions
like buffer therapy.
","[{""version"":""v1"",""created"":""Tue, 2 Aug 2016 20:07:48 GMT""}]","2016-08-04"
"1608.00986","Sean Brittain","Sean D. Brittain, Joan R. Najita, John S. Carr, M\'at\'e
  \'Ad\'amkovics, and Nickalas Reynolds","A Study of Ro-vibrational OH Emission from Herbig Ae/Be Stars","15 pages, 7 figures, to be published in The Astrophysical Journal",,"10.3847/0004-637X/830/2/112",,"astro-ph.SR","http://arxiv.org/licenses/nonexclusive-distrib/1.0/","  We present a study of ro-vibrational OH and CO emission from 21 disks around
Herbig Ae/Be stars. We find that the OH and CO luminosities are proportional
over a wide range of stellar ultraviolet luminosities. The OH and CO line
profiles are also similar, indicating that they arise from roughly the same
radial region of the disk. The CO and OH emission are both correlated with the
far-ultraviolet luminosity of the stars, while the PAH luminosity is correlated
with the longer wavelength ultraviolet luminosity of the stars. Although disk
flaring affects the PAH luminosity, it is not a factor in the luminosity of the
OH and CO emission. These properties are consistent with models of
UV-irradiated disk atmospheres. We also find that the transition disks in our
sample, which have large optically thin inner regions, have lower OH and CO
luminosities than non-transition disk sources with similar ultraviolet
luminosities. This result, while tentative given the small sample size, is
consistent with the interpretation that transition disks lack a gaseous disk
close to the star.
","[{""version"":""v1"",""created"":""Tue, 2 Aug 2016 20:10:33 GMT""}]","2016-10-26"
"1608.00987","Eric Pop","Kirby K.H. Smithe, Chris D. English, Saurabh V. Suryavanshi, and Eric
  Pop","Intrinsic Electrical Transport and Performance Projections of Synthetic
  Monolayer MoS2 Devices","to be published in 2D Materials","2D Materials (Dec 2016)","10.1088/2053-1583/4/1/011009",,"cond-mat.mtrl-sci cond-mat.mes-hall","http://arxiv.org/licenses/nonexclusive-distrib/1.0/","  We demonstrate monolayer MoS2 grown by chemical vapor deposition (CVD) with
transport properties comparable to those of the best exfoliated devices over a
wide range of carrier densities (up to ~10^13 1/cm^2) and temperatures (80-500
K). Transfer length measurements reveal monolayer mobility of ~20 cm2/V/s on
SiO2 substrates at 300 K and practical carrier densities (>2x10^12 1/cm^2). We
also demonstrate the highest current density reported to date (~270 uA/um or 44
MA/cm^2) at 300 K for an 80 nm device from CVD-grown monolayer MoS2. Using
simulations, we discuss what improvements of monolayer MoS2 are still required
to meet technology roadmap requirements for low power (LP) and high performance
(HP) applications. Such results are an important step towards large-area
electronics based on monolayer semiconductors.
","[{""version"":""v1"",""created"":""Tue, 2 Aug 2016 20:10:59 GMT""},{""version"":""v2"",""created"":""Mon, 21 Nov 2016 22:32:21 GMT""}]","2016-12-01"
"1608.00988","Eric Pop","Michal J. Mleczko, Runjie (Lily) Xu, Kye Okabe, Hsueh-Hui Kuo, Ian R.
  Fisher, H.-S. Philip Wong, Yoshio Nishi, Eric Pop","High Current Density and Low Thermal Conductivity of Atomically Thin
  Semimetallic WTe2",,"ACS Nano, July 2016","10.1021/acsnano.6b02368",,"cond-mat.mtrl-sci cond-mat.mes-hall","http://arxiv.org/licenses/nonexclusive-distrib/1.0/","  Two-dimensional (2D) semimetals beyond graphene have been relatively
unexplored in the atomically-thin limit. Here we introduce a facile growth
mechanism for semimetallic WTe2 crystals, then fabricate few-layer test
structures while carefully avoiding degradation from exposure to air. Low-field
electrical measurements of 80 nm to 2 um long devices allow us to separate
intrinsic and contact resistance, revealing metallic response in the thinnest
encapsulated and stable WTe2 devices studied to date (3 to 20 layers thick).
High-field electrical measurements and electro-thermal modeling demonstrate
that ultra-thin WTe2 can carry remarkably high current density (approaching 50
MA/cm2, higher than most common interconnect metals) despite a very low thermal
conductivity (of the order ~3 W/m/K). These results suggest several pathways
for air-stable technological viability of this layered semimetal.
","[{""version"":""v1"",""created"":""Tue, 2 Aug 2016 20:11:12 GMT""}]","2016-08-04"
