"1608.01058","Ryo Nouchi","Ryo Nouchi and Takaaki Tanimoto","Substituent-Controlled Reversible Switching of Charge-Injection-Barrier
  Heights at Metal/Organic-Semiconductor Contacts Modified with Disordered
  Molecular Monolayers","This document is the unedited Author's version of a Submitted Work
  that was subsequently accepted for publication in ACS Nano, copyright
  \c{opyright} American Chemical Society after peer review. To access the final
  edited and published work see the link below","ACS Nano 9 (2015) 7429","10.1021/acsnano.5b02473",,"cond-mat.mtrl-sci","http://arxiv.org/licenses/nonexclusive-distrib/1.0/","  Electrically stimulated switching of a charge injection barrier at the
interface between an organic semiconductor and an electrode modified with a
disordered monolayer (DM) is studied by using various benzenethiol derivatives
as DM molecules. The switching behavior is induced by a structural change in
the DM molecules, and is manifested as a reversible inversion of the polarity
of DM-modified Au electrode/rubrene/DM-modified Au electrode diodes. The
switching direction is found to be dominantly determined by the push-back
effect of the thiol bonding group, while the terminal group modulates the
switching strength. A device with 1,2-benzenedithiol DMs exhibited the highest
switching ratios of 20, 100, and 1000 for the switching voltages of 3, 5, and 7
V, respectively. A variation in the tilt angle of benzenethiol DMs owing to the
application of 7 V is estimated to be smaller than 23.6 degrees by model
calculations. This study offers an understanding for obtaining highly stable
operations of organic electronic devices, especially with molecular
modification layers.
","[{""version"":""v1"",""created"":""Wed, 3 Aug 2016 02:43:59 GMT""}]","2016-08-04"
"1608.01059","Wenbing Huang","Wenbing Huang, Fuchun Sun, Lele Cao and Mehrtash Harandi","Analyzing Linear Dynamical Systems: From Modeling to Coding and Learning","38 pages",,,,"cs.CV","http://arxiv.org/licenses/nonexclusive-distrib/1.0/","  Encoding time-series with Linear Dynamical Systems (LDSs) leads to rich
models with applications ranging from dynamical texture recognition to video
segmentation to name a few. In this paper, we propose to represent LDSs with
infinite-dimensional subspaces and derive an analytic solution to obtain stable
LDSs. We then devise efficient algorithms to perform sparse coding and
dictionary learning on the space of infinite-dimensional subspaces. In
particular, two solutions are developed to sparsely encode an LDS. In the first
method, we map the subspaces into a Reproducing Kernel Hilbert Space (RKHS) and
achieve our goal through kernel sparse coding. As for the second solution, we
propose to embed the infinite-dimensional subspaces into the space of symmetric
matrices and formulate the sparse coding accordingly in the induced space. For
dictionary learning, we encode time-series by introducing a novel concept,
namely the two-fold LDSs. We then make use of the two-fold LDSs to derive an
analytical form for updating atoms of an LDS dictionary, i.e., each atom is an
LDS itself. Compared to several baselines and state-of-the-art methods, the
proposed methods yield higher accuracies in various classification tasks
including video classification and tactile recognition.
","[{""version"":""v1"",""created"":""Wed, 3 Aug 2016 02:44:57 GMT""},{""version"":""v2"",""created"":""Mon, 27 Feb 2017 02:42:26 GMT""}]","2017-02-28"
"1608.01060","Siqing Yu","Gregory Gabadadze and Siqing Yu","Nonlocal Galileons and Self-Acceleration","15 latex pages","Physics Letters B 768 (2017) 397-403","10.1016/j.physletb.2017.03.027","NYU-TH-01/26/2016","hep-th gr-qc","http://arxiv.org/licenses/nonexclusive-distrib/1.0/","  A certain class of nonlocal theories eliminates an arbitrary cosmological
constant (CC) from a universe that can be perceived as our world. Dark energy
then cannot be explained by a CC; it could however be due to massive gravity.
We calculate the new corrections, which originate from the nonlocal terms that
eliminate the CC, to the decoupling limit Lagrangian of massive gravity. The
new nonlocal terms also have internal field space Galilean symmetry and are
referred here as ""nonlocal Galileons."" We then study a self-accelerated
solution and show that the new nonlocal terms change the perturbative stability
analysis. In particular, small fluctuations are now stable and non-superluminal
for some simple parameter choices, whereas for the same choices the pure
massive gravity fluctuations are unstable. We also study stable spherically
symmetric solutions on this background.
","[{""version"":""v1"",""created"":""Wed, 3 Aug 2016 02:55:09 GMT""}]","2017-03-22"
"1608.01061","Ryo Nouchi","Ryo Nouchi","Edge-induced Schottky barrier modulation at metal contacts to exfoliated
  molybdenum disulfide flakes","Accepted for publication in Journal of Applied Physics","J. Appl. Phys. 120, 064503 (2016)","10.1063/1.4960703",,"cond-mat.mtrl-sci","http://arxiv.org/licenses/nonexclusive-distrib/1.0/","  Ultrathin two-dimensional semiconductors obtained from layered
transition-metal dichalcogenides such as molybdenum disulfide (MoS2) are
promising for ultimately scaled transistors beyond Si. Although the shortening
of the semiconductor channel is widely studied, the narrowing of the channel,
which should also be important for scaling down the transistor, has been
examined to a lesser degree thus far. In this study, the impact of narrowing on
mechanically exfoliated MoS2 flakes was investigated according to the
channel-width-dependent Schottky barrier heights at Cr/Au contacts. Narrower
channels were found to possess a higher Schottky barrier height, which is
ascribed to the edge-induced band bending in MoS2. The higher barrier heights
degrade the transistor performance as a higher electrode-contact resistance.
Theoretical analyses based on Poisson's equation showed that the edge-induced
effect can be alleviated by a high dopant impurity concentration, but this
strategy should be limited to channel widths of roughly 0.7 micrometers because
of the impurity-induced charge-carrier mobility degradation. Therefore, proper
termination of the dangling bonds at the edges should be necessary for
aggressive scaling with layered semiconductors.
","[{""version"":""v1"",""created"":""Wed, 3 Aug 2016 02:55:37 GMT""}]","2016-08-15"
"1608.01062","Lars English","L.Q. English, David Mertens, Saidou Abdoulkary, C.B. Fritz, K.
  Skowronski, P.G. Kevrekidis","The emergence and analysis of Kuramoto-Sakaguchi-like models as an
  effective description for the dynamics of coupled Wien-bridge oscillators","13 pages, 7 figures",,"10.1103/PhysRevE.94.062212",,"nlin.PS","http://arxiv.org/licenses/nonexclusive-distrib/1.0/","  We derive the Kuramoto-Sakaguchi model from the basic circuit equations
governing two coupled Wien-bridge oscillators. A Wien-bridge oscillator is a
particular realization of a tunable autonomous oscillator that makes use of
frequency filtering (via a RC band-pass filter) and positive feedback (via an
Op-Amp). In the last few years, such oscillators have started to be utilized in
synchronization studies. We first show that the Wien-bridge circuit equations
can be cast in the form of a coupled pair of Duffing - Van der Pol equations.
Subsequently, by applying the method of multiple time scales, we derive the
differential equations that govern the slow evolution of the oscillator phases
and amplitudes. These equations are directly reminiscent of the
Kuramoto-Sakaguchi type models for the study of synchronization. We analyze the
resulting system in terms of existence and stability of various coupled
oscillator solutions and explain on that basis how their synchronization
emerges. The phase-amplitude equations are also compared numerically to the
original circuit equations, and good agreement is found. Finally, we report on
experimental measurements on two coupled Wien-bridge oscillators and relate the
results back to the theoretical predictions.
","[{""version"":""v1"",""created"":""Wed, 3 Aug 2016 02:57:56 GMT""}]","2017-01-04"
"1608.01063","Shunsuke Kondo","S. Kondo, T. Karino, T. Iinuma, K. Kubo, H. Kato, S. Kawata, A. I.
  Ogoyski","Researches on a reactor core in heavy ion inertial fusion","15 pages, 11figures, submitted to a fournal. arXiv admin note:
  substantial text overlap with arXiv:1511.06508",,"10.1017/S0263034616000665",,"physics.plasm-ph","http://arxiv.org/licenses/nonexclusive-distrib/1.0/","  In this paper a study on a fusion reactor core is presented in heavy ion
inertial fusion (HIF), including the heavy ion beam (HIB) transport in a fusion
reactor, a HIB interaction with a background gas, reactor cavity gas dynamics,
the reactor gas backflow to the beam lines, and a HIB fusion reactor design.
The HIB has remarkable preferable features to release the fusion energy in
inertial fusion: in particle accelerators HIBs are generated with a high driver
efficiency of ~30-40%, and the HIB ions deposit their energy inside of
materials. Therefore, a requirement for the fusion target energy gain is
relatively low, that would be ~50 to operate a HIF fusion reactor with a
standard energy output of 1GW of electricity. In a fusion reactor the HIB
charge neutralization is needed for a ballistic HIB transport. Multiple
mechanical shutters would be installed at each HIB port at the reactor wall to
stop the blast waves and the chamber gas backflow, so that the accelerator
final elements would be protected from the reactor gas contaminant. The
essential fusion reactor components are discussed in this paper.
","[{""version"":""v1"",""created"":""Wed, 3 Aug 2016 02:58:33 GMT""}]","2017-05-24"
"1608.01064","Takuya Iinuma","T. Iinuma, T. Karino, S. Kondo, T. Kubo, H. Kato, T. Suzuki, S.
  Kawata, A. I. Ogoyski","Control of fuel target implosion non-uniformity in heavy ion inertial
  fusion","10 pages, 10 figures, 2 tables, submitted to a journal",,"10.1017/S0263034616000677",,"physics.plasm-ph","http://arxiv.org/licenses/nonexclusive-distrib/1.0/","  In inertial fusion, one of scientific issues is to reduce an implosion
non-uniformity of a spherical fuel target. The implosion non-uniformity is
caused by several factors, including the driver beam illumination
non-uniformity, the Rayleigh-Taylor instability (RTI) growth, etc. In this
paper we propose a new control method to reduce the implosion non-uniformity;
the oscillating implosion acceleration dg(t) is created by pulsating and
dephasing heavy ion beams (HIBs) in heavy ion inertial fusion (HIF). The dg(t)
would reduce the RTI growth effectively. The original concept of the non-
uniformity control in inertial fusion was proposed in (Kawata, et al., 1993).
In this paper it was found that the pulsating and dephasing HIBs illumination
provide successfully the controlled dg(t) and that dg(t) induced by the
pulsating HIBs reduces well the implosion non-uniformity. Consequently the
pulsating HIBs improve a pellet gain remarkably in HIF.
","[{""version"":""v1"",""created"":""Wed, 3 Aug 2016 03:04:24 GMT""}]","2017-05-24"
"1608.01065","Farrukh Mukhamedov M.","Ameur Dhahri, Farrukh Mukhamedov","Open Quantum Random Walks, Quantum Markov Chains and Recurrence","22 pages",,,,"math.FA math-ph math.MP math.PR quant-ph","http://arxiv.org/licenses/nonexclusive-distrib/1.0/","  In the present paper, we construct QMCs associated with Open Quantum Random
Walks such that the transition operator of the chain is defined by OQRW and the
restriction of QMC to the commutative subalgebra coincides with the
distribution $P_\rho$ of OQRW. This sheds new light on some properties of the
measure $P_\rho$. As an example, we simply mention that the measure can be
considered as a distribution of some functions of certain Markov process.
Furthermore, we study several properties of QMC and associated measure. A new
notion of $\f$-recurrence of QMC is studied, and it is established relations
between the defined recurrence and the existing ones.
","[{""version"":""v1"",""created"":""Wed, 3 Aug 2016 03:37:10 GMT""},{""version"":""v2"",""created"":""Tue, 12 Sep 2017 06:19:29 GMT""}]","2017-09-13"
"1608.01066","Tatsuya Yanagisawa","S. Mombetsu, T. Murazumi, H. Hidaka, T. Yanagisawa, H. Amitsuka, P.-C.
  Ho, and M. B. Maple","Study of Localized Character of 4f Electrons and Ultrasonic Dispersions
  in SmOs4Sb12 by High-Pressure High-Frequency Ultrasonic Measurements","7 pages, 4 figures","Phys. Rev. B 94, 085142 (2016)","10.1103/PhysRevB.94.085142",,"cond-mat.str-el","http://arxiv.org/licenses/nonexclusive-distrib/1.0/","  We present high-frequency ultrasonic measurements on the filled skutterudite
SmOs$_4$Sb$_{12}$ under hydrostatic pressure. The results clarify that the 4$f$
electrons in this compound transform from delocalized at ambient pressure to
localized at high pressures with a crossover pressure of approximately 0.7 GPa.
This drastic change in the 4$f$ electrons under pressure is apparently related
to the non-Fermi liquid state, which appears in an intermediate-pressure range
of 0.5-1.5 GPa. The results or our analysis strongly suggest that the
ferro-octupolar interaction becomes dominant at high pressure. Moreover, we
report the pressure dependence of the ultrasonic dispersion, which is due to
rattling, over a wide range of ultrasonic frequencies up to 323 MHz. The
drastic change in the ultrasonic dispersions and the frequency dependent
elastic anomaly in the $C_{11}$ mode at lower temperatures imply a possible
coupling between rattling phonons and 4$f$ electrons.
","[{""version"":""v1"",""created"":""Wed, 3 Aug 2016 03:42:19 GMT""}]","2016-09-07"
"1608.01067","Wang Rui","Rui Wang, Ying D. Liu, Ivan Zimovets, Huidong Hu, Xinghua Dai, and
  Zhongwei Yang","Sympathetic Solar Filament Eruptions on 2015 March 15","19 pages, 5 figures, accepted for publication in ApJ Lett",,"10.3847/2041-8205/827/1/L12",,"astro-ph.SR","http://arxiv.org/licenses/nonexclusive-distrib/1.0/","  The 2015 March 15 coronal mass ejection as one of the two that together drove
the largest geomagnetic storm of solar cycle 24 so far was associated with
sympathetic filament eruptions. We investigate the relations between the
different filaments involved in the eruption. A surge-like small-scale filament
motion is confirmed as the trigger that initiated the erupting filament with
multi-wavelength observations and using a forced magnetic field extrapolation
method. When the erupting filament moved to an open magnetic field region, it
experienced an obvious acceleration process and was accompanied by a C-class
flare and the rise of another larger filament that eventually failed to erupt.
We measure the decay index of the background magnetic field, which presents a
critical height of 118 Mm. Combining with a potential field source surface
extrapolation method, we analyze the distributions of the large-scale magnetic
field, which indicates that the open magnetic field region may provide a
favorable condition for F2 rapid acceleration and have some relation with the
largest solar storm. The comparison between the successful and failed filament
eruptions suggests that the confining magnetic field plays an important role in
the preconditions for an eruption.
","[{""version"":""v1"",""created"":""Wed, 3 Aug 2016 03:42:42 GMT""},{""version"":""v2"",""created"":""Thu, 4 Aug 2016 07:55:45 GMT""}]","2016-08-17"
"1608.01068","Xiao-Bo Jin","Xiao-Bo Jin and Guang-Gang Geng and Kaizhu Huang and Zhi-Wei Yan","Ranking Entity Based on Both of Word Frequency and Word Sematic Features","The paper decribes the apporoaches that help us to achieve the first
  place in Baidu Cup 2016 NLP Challenge",,,,"cs.IR","http://arxiv.org/licenses/nonexclusive-distrib/1.0/","  Entity search is a new application meeting either precise or vague
requirements from the search engines users. Baidu Cup 2016 Challenge just
provided such a chance to tackle the problem of the entity search. We achieved
the first place with the average MAP scores on 4 tasks including movie, tvShow,
celebrity and restaurant. In this paper, we propose a series of similarity
features based on both of the word frequency features and the word semantic
features and describe our ranking architecture and experiment details.
","[{""version"":""v1"",""created"":""Wed, 3 Aug 2016 03:49:54 GMT""}]","2016-08-04"
"1608.01069","Michael Poulshock","Michael Poulshock","An Abstract Model of Historical Processes",,,,,"cs.SI physics.soc-ph","http://arxiv.org/licenses/nonexclusive-distrib/1.0/","  A theoretical model is presented which provides a way to simulate, at a very
abstract level, power struggles in the social world. In the model, agents can
benefit or harm each other, to varying degrees and with differing levels of
influence. The agents interact over time, using the power they have to try to
get more of it, while being constrained in their strategic choices by social
inertia. The outcomes of the model are probabilistic. More research is needed
to determine whether the model has any empirical validity.
","[{""version"":""v1"",""created"":""Wed, 3 Aug 2016 03:58:14 GMT""},{""version"":""v2"",""created"":""Wed, 14 Dec 2016 03:03:12 GMT""}]","2016-12-15"
"1608.01070","Shun Uchino","Shun Uchino, Masahito Ueda","Anomalous Transport in the Superfluid Fluctuation Regime","5 pages, 3 figures","Phys. Rev. Lett. 118, 105303 (2017)","10.1103/PhysRevLett.118.105303",,"cond-mat.quant-gas","http://arxiv.org/licenses/nonexclusive-distrib/1.0/","  Motivated by a recent experiment in ultracold atoms [ S. Krinner et al.,
Proc. Natl. Acad. Sci. U.S.A 113, 8144 (2016)], we analyze transport of
attractively interacting fermions through a one-dimensional wire near the
superfluid transition. We show that in a ballistic regime where the conductance
is quantized in the absence of interaction, the conductance is renormalized by
superfluid fluctuations in reservoirs. In particular, the particle conductance
is strongly enhanced and the plateau is blurred by emergent bosonic pair
transport. For spin transport, in addition to the contact resistance the wire
itself is resistive, leading to a suppression of the measured spin conductance.
Our results are qualitatively consistent with the experimental observations.
","[{""version"":""v1"",""created"":""Wed, 3 Aug 2016 04:23:57 GMT""},{""version"":""v2"",""created"":""Thu, 11 May 2017 06:44:17 GMT""}]","2017-05-12"
"1608.01071","Do-Hyun Kim","Do-Hyun Kim, Jinha Park, and B. Kahng","Enhanced storage capacity with errors in scale-free Hopfield neural
  networks: an analytical study",,"PLoS ONE 12(10): e0184683 (2017)","10.1371/journal.pone.0184683",,"cond-mat.dis-nn","http://arxiv.org/licenses/nonexclusive-distrib/1.0/","  The Hopfield model is a pioneering neural network model with associative
memory retrieval. The analytical solution of the model in mean field limit
revealed that memories can be retrieved without any error up to a finite
storage capacity of $O(N)$, where $N$ is the system size. Beyond the threshold,
they are completely lost. Since the introduction of the Hopfield model, the
theory of neural networks has been further developed toward realistic neural
networks using analog neurons, spiking neurons, etc. Nevertheless, those
advances are based on fully connected networks, which are inconsistent with
recent experimental discovery that the number of connections of each neuron
seems to be heterogeneous, following a heavy-tailed distribution. Motivated by
this observation, we consider the Hopfield model on scale-free networks and
obtain a different pattern of associative memory retrieval from that obtained
on the fully connected network: the storage capacity becomes tremendously
enhanced but with some error in the memory retrieval, which appears as the
heterogeneity of the connections is increased. Moreover, the error rates are
also obtained on several real neural networks and are indeed similar to that on
scale-free model networks.
","[{""version"":""v1"",""created"":""Wed, 3 Aug 2016 04:25:47 GMT""},{""version"":""v2"",""created"":""Sat, 28 Oct 2017 06:57:49 GMT""}]","2017-10-31"
"1608.01072","Fateme Fahiman Mrs","Fateme Fahiman, Jame C.Bezdek, Sarah M.Erfani, Christopher Leckie,
  Marimuthu Palaniswami","Fuzzy c-Shape: A new algorithm for clustering finite time series
  waveforms","12 pages, 3 figures, submitted at IEEE Transaction on Fuzzy Systems",,,,"cs.LG","http://arxiv.org/licenses/nonexclusive-distrib/1.0/","  The existence of large volumes of time series data in many applications has
motivated data miners to investigate specialized methods for mining time series
data. Clustering is a popular data mining method due to its powerful
exploratory nature and its usefulness as a preprocessing step for other data
mining techniques. This article develops two novel clustering algorithms for
time series data that are extensions of a crisp c-shapes algorithm. The two new
algorithms are heuristic derivatives of fuzzy c-means (FCM). Fuzzy c-Shapes
plus (FCS+) replaces the inner product norm in the FCM model with a shape-based
distance function. Fuzzy c-Shapes double plus (FCS++) uses the shape-based
distance, and also replaces the FCM cluster centers with shape-extracted
prototypes. Numerical experiments on 48 real time series data sets show that
the two new algorithms outperform state-of-the-art shape-based clustering
algorithms in terms of accuracy and efficiency. Four external cluster validity
indices (the Rand index, Adjusted Rand Index, Variation of Information, and
Normalized Mutual Information) are used to match candidate partitions generated
by each of the studied algorithms. All four indices agree that for these finite
waveform data sets, FCS++ gives a small improvement over FCS+, and in turn,
FCS+ is better than the original crisp c-shapes method. Finally, we apply two
tests of statistical significance to the three algorithms. The Wilcoxon and
Friedman statistics both rank the three algorithms in exactly the same way as
the four cluster validity indices.
","[{""version"":""v1"",""created"":""Wed, 3 Aug 2016 04:42:02 GMT""}]","2016-08-04"
"1608.01073","Annapurni Subramaniam","Annapurni Subramaniam, Shyam N. Tandon, John Hutchings, Swarna K.
  Ghosh, Koshy George, V. Girish, P.U. Kamath, S. Kathiravan, Amit Kumar, J.
  Paul Lancelot, P.K. Mahesh, Rekhesh Mohan, Jayant Murthy, S. Nagabhushana,
  Ashok K. Pati, Joe Postma, N. Kameswara Rao, Kasiviswanathan
  Sankarasubramanian, P. Sreekumar, S. Sriram, Chelliah S. Stalin, Firoza
  Sutaria, Yuvraj Harsha Sreedhar, Indrajit V. Barve, Chayan Mondal, and
  Snehalata Sahu","In-orbit Performance of UVIT on ASTROSAT","10 pages, To appear in SPIE conference proceedings, SPIE conference
  paper, 2016",,"10.1117/12.2235271",,"astro-ph.IM","http://arxiv.org/licenses/nonexclusive-distrib/1.0/","  We present the in-orbit performance and the first results from the
ultra-violet Imaging telescope (UVIT) on ASTROSAT. UVIT consists of two
identical 38cm coaligned telescopes, one for the FUV channel (130-180nm) and
the other for the NUV (200-300nm) and VIS (320-550nm) channels, with a field of
view of 28 $arcmin$. The FUV and the NUV detectors are operated in the high
gain photon counting mode whereas the VIS detector is operated in the low gain
integration mode. The FUV and NUV channels have filters and gratings, whereas
the VIS channel has filters. The ASTROSAT was launched on 28th September 2015.
The performance verification of UVIT was carried out after the opening of the
UVIT doors on 30th November 2015, till the end of March 2016 within the
allotted time of 50 days for calibration. All the on-board systems were found
to be working satisfactorily. During the PV phase, the UVIT observed several
calibration sources to characterise the instrument and a few objects to
demonstrate the capability of the UVIT. The resolution of the UVIT was found to
be about 1.4 - 1.7 $arcsec$ in the FUV and NUV. The sensitivity in various
filters were calibrated using standard stars (white dwarfs), to estimate the
zero-point magnitudes as well as the flux conversion factor. The gratings were
also calibrated to estimate their resolution as well as effective area. The
sensitivity of the filters were found to be reduced up to 15\% with respect to
the ground calibrations. The sensitivity variation is monitored on a monthly
basis. UVIT is all set to roll out science results with its imaging capability
with good resolution and large field of view, capability to sample the UV
spectral region using different filters and capability to perform variability
studies in the UV.
","[{""version"":""v1"",""created"":""Wed, 3 Aug 2016 04:42:31 GMT""}]","2016-11-23"
