"1608.05079","Yi-Fu Cai","Minxi He, Junyu Liu, Shiyun Lu, Siyi Zhou, Yi-Fu Cai, Yi Wang, Robert
  Brandenberger","Differentiating G-inflation from String Gas Cosmology using the
  Effective Field Theory Approach",,"JCAP 1612 (2016) 040","10.1088/1475-7516/2016/12/040",,"astro-ph.CO hep-th","http://arxiv.org/licenses/nonexclusive-distrib/1.0/","  A characteristic signature of String Gas Cosmology is primordial power
spectra for scalar and tensor modes which are almost scale-invariant but with a
red tilt for scalar modes but a blue tilt for tensor modes. This feature,
however, can also be realized in the so-called G-inflation model, in which
Horndeski operators are introduced which leads to a blue tensor tilt by softly
breaking the Null Energy Condition. In this article we search for potential
observational differences between these two cosmologies by performing detailed
perturbation analyses based on the Effective Field Theory approach. Our results
show that, although both two models produce blue tilted tensor perturbations,
they behave differently in three aspects. Firstly, String Gas Cosmology
predicts a specific consistency relation between the index of the scalar modes
ns and that of tensor ones nt, which is hard to be reproduced by G-inflation.
Secondly, String Gas Cosmology typically predicts non-Gaussianities which are
highly suppressed on observable scales, while G-inflation gives rise to
observationally large non-Gaussianities because the kinetic terms in the action
become important during inflation. However, after finely tuning the model
parameters of G-inflation it is possible to obtain a blue tensor spectrum and
negligible non-Gaussianities with a degeneracy between the two models. This
degeneracy can be broken by a third observable, namely the scale dependence of
the nonlinearity parameter, which vanishes for G-inflation but has a blue tilt
in the case of String Gas Cosmology. Therefore, we conclude that String Gas
Cosmology is in principle observationally distinguishable from the single field
inflationary cosmology, even allowing for modifications such as G-inflation.
","[{""version"":""v1"",""created"":""Wed, 17 Aug 2016 20:00:03 GMT""},{""version"":""v2"",""created"":""Tue, 27 Dec 2016 13:50:51 GMT""}]","2017-03-08"
"1608.05080","James Geach","M. P. Koprowski (Hertfordshire), K. E. K. Coppin, J. E. Geach, N. K.
  Hine, M. Bremer, S. C. Chapman, L. J. M. Davies, T. Hayashino, K. K. Knudsen,
  M. Kubo, B. D. Lehmer, Y. Matsuda, D. J. B. Smith, P. P. van der Werf, G.
  Violino, T. Yamada","A resolved map of the infrared excess in a Lyman Break Galaxy at z=3","Accepted in The Astrophysical Journal Letters",,"10.3847/2041-8205/828/2/L21",,"astro-ph.GA astro-ph.CO","http://arxiv.org/licenses/nonexclusive-distrib/1.0/","  We have observed the dust continuum of ten z=3.1 Lyman Break Galaxies with
the Atacama Large Millimeter/Submillimeter Array at ~450 mas resolution in Band
7. We detect and resolve the 870um emission in one of the targets with an
integrated flux density of S(870)=(192+/-57) uJy, and measure a stacked 3-sigma
signal of S(870)=(67+/-23) uJy for the remaining nine. The total infrared
luminosities estimated from full spectral energy distribution fits are
L(8-1000um)=(8.4+/-2.3)x10^10 Lsun for the detection and
L(8-1000um)=(2.9+/-0.9)x10^10 Lsun for the stack. With HST ACS I-band imaging
we map the rest-frame UV emission on the same scale as the dust, effectively
resolving the 'infrared excess' (IRX=L_FIR/L_UV) in a normal galaxy at z=3.
Integrated over the galaxy we measure IRX=0.56+/-0.15, and the galaxy-averaged
UV slope is beta=-1.25+/-0.03. This puts the galaxy a factor of ~10 below the
IRX-beta relation for local starburst nuclei of Meurer et al. (1999). However,
IRX varies by more than a factor of 3 across the galaxy, and we conclude that
the complex relative morphology of the dust relative to UV emission is largely
responsible for the scatter in the IRX-beta relation at high-z. A naive
application of a Meurer-like dust correction based on the UV slope would
dramatically over-estimate the total star formation rate, and our results
support growing evidence that when integrated over the galaxy, the typical
conditions in high-z star-forming galaxies are not analogous to those in the
local starburst nuclei used to establish the Meurer relation.
","[{""version"":""v1"",""created"":""Wed, 17 Aug 2016 20:00:04 GMT""}]","2016-09-21"
"1608.05081","Zachary Lipton","Zachary C. Lipton, Xiujun Li, Jianfeng Gao, Lihong Li, Faisal Ahmed,
  Li Deng","BBQ-Networks: Efficient Exploration in Deep Reinforcement Learning for
  Task-Oriented Dialogue Systems","13 pages, 9 figures",,,,"cs.LG cs.NE stat.ML","http://arxiv.org/licenses/nonexclusive-distrib/1.0/","  We present a new algorithm that significantly improves the efficiency of
exploration for deep Q-learning agents in dialogue systems. Our agents explore
via Thompson sampling, drawing Monte Carlo samples from a Bayes-by-Backprop
neural network. Our algorithm learns much faster than common exploration
strategies such as $\epsilon$-greedy, Boltzmann, bootstrapping, and
intrinsic-reward-based ones. Additionally, we show that spiking the replay
buffer with experiences from just a few successful episodes can make Q-learning
feasible when it might otherwise fail.
","[{""version"":""v1"",""created"":""Wed, 17 Aug 2016 20:00:04 GMT""},{""version"":""v2"",""created"":""Mon, 19 Sep 2016 18:20:55 GMT""},{""version"":""v3"",""created"":""Fri, 26 May 2017 18:01:04 GMT""},{""version"":""v4"",""created"":""Thu, 23 Nov 2017 10:24:17 GMT""}]","2017-11-29"
"1608.05082","Yasna Ver\'onica Ordenes Brice\~no Miss","Yasna Ordenes-Brice\~no, Matthew A. Taylor, Thomas H. Puzia, Roberto
  P. Mu\~noz, Paul Eigenthaler, Iskren Y. Georgiev, Paul Goudfrooij, Michael
  Hilker, Ariane Lan\c{c}on, Gary Mamon, Steffen Mieske, Bryan W. Miller, Eric
  W. Peng and Rub\'en S\'anchez-Janssen","Faint Dwarf Galaxies in Hickson Compact Group 90","Accepted by MNRAS. 7 pages, 5 figures, 2 tables",,"10.1093/mnras/stw2066",,"astro-ph.GA","http://arxiv.org/licenses/nonexclusive-distrib/1.0/","  We report the discovery of a very diverse set of five low-surface brightness
(LSB) dwarf galaxy candidates in Hickson Compact Group 90 (HCG 90) detected in
deep U- and I-band images obtained with VLT/VIMOS. These are the first LSB
dwarf galaxy candidates found in a compact group of galaxies. We measure
spheroid half-light radii in the range $0.7\!\lesssim\! r_{\rm eff}/{\rm kpc}\!
\lesssim\! 1.5$ with luminosities of $-11.65\!\lesssim\! M_U\! \lesssim\!
-9.42$ and $-12.79\!\lesssim\! M_I\! \lesssim\! -10.58$ mag, corresponding to a
color range of $(U\!-\!I)_0\!\simeq\!1.1\!-\!2.2$ mag and surface brightness
levels of $\mu_U\!\simeq\!28.1\,{\rm mag/arcsec^2}$ and
$\mu_I\!\simeq\!27.4\,{\rm mag/arcsec^2}$. Their colours and luminosities are
consistent with a diverse set of stellar population properties. Assuming solar
and 0.02 Z$_\odot$ metallicities we obtain stellar masses in the range
$M_*|_{Z_\odot} \simeq 10^{5.7-6.3} M_{\odot}$ and
$M_*|_{0.02\,Z_\odot}\!\simeq\!10^{6.3-8}\,M_{\odot}$. Three dwarfs are older
than 1 Gyr, while the other two significantly bluer dwarfs are younger than
$\sim 2$ Gyr at any mass/metallicity combination. Altogether, the new LSB dwarf
galaxy candidates share properties with dwarf galaxies found throughout the
Local Volume and in nearby galaxy clusters such as Fornax. We find a pair of
candidates with $\sim\!2$ kpc projected separation, which may represent one of
the closest dwarf galaxy pairs found. We also find a nucleated dwarf candidate,
with a nucleus size of $r_{\rm eff}\!\simeq\!46\!-\!63$ pc and magnitude
M$_{U,0}=-7.42$ mag and $(U\!-\!I)_0\!=\!1.51$ mag, which is consistent with a
nuclear stellar disc with a stellar mass in the range $10^{4.9-6.5}\,M_\odot$.
","[{""version"":""v1"",""created"":""Wed, 17 Aug 2016 20:00:08 GMT""}]","2016-08-31"
"1608.05083","Thomas Schaefer","Thomas Schaefer (North Carolina State University)","A generalized Theory of Diffusion based on Kinetic Theory","26 pages, 9 figures; revised version (one figure added), to appear in
  Phys Rev A","Phys. Rev. A 94, 043644 (2016)","10.1103/PhysRevA.94.043644",,"cond-mat.quant-gas nucl-th physics.flu-dyn","http://arxiv.org/licenses/nonexclusive-distrib/1.0/","  We propose to use spin hydrodynamics, a two-fluid model of spin propagation,
as a generalization of the diffusion equation. We show that in the dense limit
spin hydrodynamics reduces to Fick's law and the diffusion equation. In the
opposite limit spin hydrodynamics is equivalent to a collisionless Boltzmann
treatment of spin propagation. Spin hydrodynamics avoids unphysical effects
that arise when the diffusion equation is used to describe to a strongly
interacting gas with a dilute corona. We apply spin hydrodynamics to the
problem of spin diffusion in a trapped atomic gas. We find that the observed
spin relaxation rate in the high temperature limit [Sommer et al., Nature 472,
201 (2011)] is consistent with the diffusion constant predicted by kinetic
theory.
","[{""version"":""v1"",""created"":""Wed, 17 Aug 2016 20:00:14 GMT""},{""version"":""v2"",""created"":""Fri, 7 Oct 2016 15:50:13 GMT""}]","2016-11-02"
"1608.05084","Angela Berti","Angela M. Berti, Alison L. Coil, Peter S. Behroozi, Daniel J.
  Eisenstein, Aaron D. Bray, Richard J. Cool, and John Moustakas","PRIMUS: One- and Two-Halo Galactic Conformity at $0.2 < z < 1$","19 pages, 12 figures","The Astrophysical Journal, 834:87 (18pp), 2017 January 1","10.3847/1538-4357/834/1/87",,"astro-ph.GA","http://arxiv.org/licenses/nonexclusive-distrib/1.0/","  We test for galactic conformity at $0.2<z<1.0$ to a projected distance of 5
Mpc using spectroscopic redshifts from the PRism MUlti-object Survey (PRIMUS).
Our sample consists of $\sim60,000$ galaxies in five separate fields covering a
total of $\sim5.5$ square degrees, which allows us to account for cosmic
variance. We identify star-forming and quiescent ""isolated primary"" (i.e.,
central) galaxies using isolation criteria and cuts in specific star formation
rate. We match the redshift and stellar mass distributions of these samples, to
control for correlations between quiescent fraction and redshift and stellar
mass. We detect a significant $(>3\sigma)$ one-halo conformity signal, or an
excess of star-forming neighbors around star-forming central galaxies, of
$\sim5$% on scales of 0-1 Mpc and a $2.5\sigma$ two-halo signal of $\sim1$% on
scales of 1-3 Mpc. These signals are weaker than those detected in SDSS and are
consistent with galactic conformity being the result of large-scale tidal
fields and reflecting assembly bias. We also measure the star-forming fraction
of central galaxies at fixed stellar mass as a function of large-scale
environment and find that central galaxies are more likely to be quenched in
overdense environments, independent of stellar mass. However, we find that
environment does not affect the star formation efficiency of central galaxies,
as long as they are forming stars. We test for redshift and stellar mass
dependence of the conformity signal within our sample and show that large
volumes and multiple fields are required at intermediate redshift to adequately
account for cosmic variance.
","[{""version"":""v1"",""created"":""Wed, 17 Aug 2016 20:00:30 GMT""},{""version"":""v2"",""created"":""Fri, 4 Nov 2016 20:21:01 GMT""}]","2019-10-15"
"1608.05085","Andreas K\""upper","Andreas H.W. K\""upper, Kathryn V. Johnston, Steffen Mieske, Michelle
  L.M. Collins, Erik J. Tollerud","Exploding Satellites -- The Tidal Debris of the Ultra-Faint Dwarf Galaxy
  Hercules","17 pages, 12 figures, submitted to AAS, comments welcome",,"10.3847/1538-4357/834/2/112",,"astro-ph.GA astro-ph.SR","http://arxiv.org/licenses/nonexclusive-distrib/1.0/","  The ultra-faint satellite galaxy Hercules has a strongly elongated and
irregular morphology with detections of tidal features up to 1.3 deg (3 kpc)
from its center. This suggests that Hercules may be dissolving under the Milky
Way's gravitational influence, and hence could be a tidal stream in formation
rather than a bound, dark-matter dominated satellite. Using Bayesian inference
in combination with N-body simulations, we show that Hercules has to be on a
very eccentric orbit (epsilon~0.95) within the Milky Way in this scenario. On
such an orbit, Hercules ""explodes"" as a consequence of the last tidal shock at
pericenter 0.5 Gyr ago. It is currently decelerating towards apocenter of its
orbit with a velocity of V=157 km/s -- of which 99% is directed radially
outwards. Due to differential orbital precession caused by the non-spherical
nature of the Galactic potential, its debris fans out nearly perpendicular to
its orbit. This explains why Hercules has an elongated shape without showing a
distance gradient along its main body: it is in fact a stream that is
significantly broader than it is long. In other words, it is moving
perpendicular to its apparent major axis. In this scenario, there is a spike in
the radial velocity profile created by the dominant debris component that
formed through the last pericenter passage. This is similar to kinematic
substructure that is observed in the real Hercules. Modeling a satellite on
such a highly eccentric orbit is strongly dependent on the form of the Galactic
potential. We therefore propose that detailed kinematic investigation of
Hercules and other exploding satellite candidates can yield strong constraints
on the potential of the Milky Way.
","[{""version"":""v1"",""created"":""Wed, 17 Aug 2016 20:01:06 GMT""}]","2017-01-18"
"1608.05086","S.H. Lim","Seunghwan Lim, Houjun Mo, Ting-Wen Lan, Brice M\'enard","Testing galaxy formation models with galaxy stellar mass functions","17 pages, 10 figures, accepted for publication in MNRAS",,"10.1093/mnras/stw2553",,"astro-ph.GA","http://arxiv.org/licenses/nonexclusive-distrib/1.0/","  We compare predictions of a number of empirical models and numerical
simulations of galaxy formation to the conditional stellar mass functions
(CSMF)of galaxies in groups of different masses obtained recently by Lan et al.
to test how well different models accommodate the data. The observational data
clearly prefer a model in which star formation in low-mass halos changes
behavior at a characteristic redshift $z_c\sim 2$. There is also tentative
evidence that this characteristic redshift depends on environment, becoming
$z_c\sim 4$ in regions that eventually evolve into rich clusters of galaxies.
The constrained model is used to understand how galaxies form and evolve in
dark matter halos, and to make predictions for other statistical properties of
the galaxy population, such as the stellar mass functions of galaxies at high
$z$, the star formation and stellar mass assembly histories in dark matter
halos. A comparison of our model predictions with those of other empirical
models shows that different models can make vastly different predictions, even
though all of them are tuned to match the observed stellar mass functions of
galaxies.
","[{""version"":""v1"",""created"":""Wed, 17 Aug 2016 20:01:10 GMT""},{""version"":""v2"",""created"":""Sun, 9 Oct 2016 18:35:16 GMT""}]","2016-10-12"
"1608.05087","Debmalya Chakraborty","Debmalya Chakraborty, Rajdeep Sensarma, Amit Ghosal","From immunity to sudden death: Effects of strong disorder in strongly
  correlated superconductors","5 pages, 3 figures + Supplementary Material","Phys. Rev. B 95, 014516 (2017)","10.1103/PhysRevB.95.014516",,"cond-mat.supr-con cond-mat.dis-nn cond-mat.str-el","http://arxiv.org/licenses/nonexclusive-distrib/1.0/","  We investigate the effect of strong disorder on a system with strong
electronic repulsion. In absence of disorder, the system has a d-wave
superconducting ground-state with strong non-BCS features due to its proximity
to a Mott insulator. We find that, while strong correlations make
superconductivity in this system immune to weak disorder, superconductivity is
destroyed efficiently when disorder strength is comparable to the effective
bandwidth. The suppression of charge motion in regions of strong potential
fluctuation leads to formation of Mott insulating patches, which anchor a
larger non-superconducting region around them. The system thus breaks into
islands of Mott insulating and superconducting regions, with Anderson
insulating regions occurring along the boundary of these regions. Thus,
electronic correlation and disorder, when both are strong, aid each other in
destroying superconductivity, in contrast to their competition at weak
disorder. Our results shed light on why Zinc impurities are efficient in
destroying superconductivity in cuprates, even though it is robust to weaker
impurities.
","[{""version"":""v1"",""created"":""Wed, 17 Aug 2016 20:01:13 GMT""}]","2017-02-01"
"1608.05088","Steven Carlip","S. Carlip","The Dynamics of Supertranslations and Superrotations in 2+1 Dimensions","11 pages; v2: discussion of relation to other work; v3: major
  revision, errors in discussion of dynamics fixed, crucial ""corner terms""
  added",,,,"gr-qc hep-th","http://arxiv.org/licenses/nonexclusive-distrib/1.0/","  Supertranslations, and at least in 2+1 dimensions superrotations, are
asymptotic symmetries of the metric in asymptotically flat spacetimes. They are
not, however, symmetries of the boundary term of the Einstein-Hilbert action,
which therefore induces an action for the Goldstone-like fields that
parametrize these symmetries. I show that in 2+1 dimensions, this action is
closely related to a chiral Liouville action, as well as the ""Schwarzian""
action that appears in two-dimensional near-AdS physics.
","[{""version"":""v1"",""created"":""Wed, 17 Aug 2016 20:03:13 GMT""},{""version"":""v2"",""created"":""Fri, 7 Oct 2016 18:54:21 GMT""},{""version"":""v3"",""created"":""Fri, 28 Jul 2017 19:26:59 GMT""}]","2017-08-01"
"1608.05089","Matthew Hastings","M. B. Hastings","Quantum Codes from High-Dimensional Manifolds","19 pages",,,,"quant-ph math-ph math.MP","http://arxiv.org/licenses/nonexclusive-distrib/1.0/","  We construct toric codes on various high-dimensional manifolds. Assuming a
conjecture in geometry we find families of quantum CSS stabilizer codes on $N$
qubits with logarithmic weight stabilizers and distance $N^{1-\epsilon}$ for
any $\epsilon>0$. The conjecture is that there is a constant $C>0$ such that
for any $n$-dimensional torus ${\mathbb T}^n={\mathbb R}^n/\Lambda$, where
$\Lambda$ is a lattice, the least volume unoriented $n/2$-dimensional surface
(using the Euclidean metric) representing nontrivial homology has volume at
least $C^n$ times the volume of the least volume $n/2$-dimensional hyperplane
representing nontrivial homology; in fact, it would suffice to have this result
for $\Lambda$ an integral lattice with the surface restricted to faces of a
cubulation by unit hypercubes. The main technical result is an estimate of
Rankin invariants\cite{rankin} for certain random lattices, showing that in a
certain sense they are optimal. Additionally, we construct codes with
square-root distance, logarithmic weight stabilizers, and inverse
polylogarithmic soundness factor (considered as quantum locally testable
codes\cite{qltc}). We also provide an short, alternative proof that the
shortest vector in the exterior power of a lattice may be
non-split\cite{coulangeon}.
","[{""version"":""v1"",""created"":""Wed, 17 Aug 2016 20:04:27 GMT""}]","2016-08-19"
"1608.05090","Sean A. Hartnoll","Sean A. Hartnoll, Liza Huijse and Edward A. Mazenc","Matrix Quantum Mechanics from Qubits","28 pages + Appendices and References. 3 Figures",,"10.1007/JHEP01(2017)010",,"hep-th cond-mat.stat-mech","http://arxiv.org/licenses/nonexclusive-distrib/1.0/","  We introduce a transverse field Ising model with order N^2 spins interacting
via a nonlocal quartic interaction. The model has an O(N,Z), hyperoctahedral,
symmetry. We show that the large N partition function admits a saddle point in
which the symmetry is enhanced to O(N). We further demonstrate that this
`matrix saddle' correctly computes large N observables at weak and strong
coupling. The matrix saddle undergoes a continuous quantum phase transition at
intermediate couplings. At the transition the matrix eigenvalue distribution
becomes disconnected. The critical excitations are described by large N matrix
quantum mechanics. At the critical point, the low energy excitations are waves
propagating in an emergent 1+1 dimensional spacetime.
","[{""version"":""v1"",""created"":""Wed, 17 Aug 2016 20:06:58 GMT""}]","2017-02-01"
"1608.05091","Michael Megrelishvili","Eli Glasner and Michael Megrelishvili","Circularly ordered dynamical systems","21 pages",,,,"math.DS math.FA math.GN","http://arxiv.org/licenses/nonexclusive-distrib/1.0/","  We study topological properties of circularly ordered dynamical systems and
prove that every such system is representable on a Rosenthal Banach space,
hence, is also tame. We derive some consequences for topological groups. We
show that several Sturmian like symbolic $\mathbb{Z}^k$-systems are circularly
ordered. Using some old results we characterize circularly ordered minimal
cascades.
","[{""version"":""v1"",""created"":""Wed, 17 Aug 2016 20:11:17 GMT""},{""version"":""v2"",""created"":""Tue, 30 Aug 2016 15:01:41 GMT""}]","2016-08-31"
"1608.05092","Marcus Dantz","M. Dantz, J. Pelliciari, D. Samal, V. Bisogni, Y. Huang, P.
  Olalde-Velasco, V. N. Strocov, G. Koster, and T. Schmitt","Quenched Magnon excitations by oxygen sublattice reconstruction in
  (SrCuO$_2$)$_n$/(SrTiO$_3$)$_2$ superlattices","Accepted for publication in Scientific Reports",,"10.1038/srep32896",,"cond-mat.str-el","http://arxiv.org/licenses/nonexclusive-distrib/1.0/","  The recently discovered structural reconstruction in the cuprate superlattice
(SrCuO$_2$)$_n$/(SrTiO$_3$)$_2$ has been investigated across the critical value
of $n=5$ using resonant inelastic x-ray scattering (RIXS). We find that at the
critical value of $n$, the cuprate layer remains largely in the bulk-like
two-dimensional structure with a minority of Cu plaquettes being reconstructed.
The partial reconstruction leads to quenching of the magnons starting at the
$\Gamma$-point due to the minority plaquettes acting as scattering points.
Although comparable in relative abundance, the doped charge impurities in
electron-doped cuprate superconductors do not show this quenching of magnetic
excitations.
","[{""version"":""v1"",""created"":""Wed, 17 Aug 2016 20:11:37 GMT""}]","2016-09-13"
"1608.05093","Scott A. Crooker","Andreas V. Stier, Nathan P. Wilson, Genevieve Clark, Xiaodong Xu,
  Scott A. Crooker","Probing the influence of dielectric environment on excitons in monolayer
  WSe2: Insight from high magnetic fields","7 pages, 4 figures","Nano Letters 16, 7054 (2016)","10.1021/acs.nanolett.6b03276",,"cond-mat.mes-hall cond-mat.mtrl-sci","http://arxiv.org/licenses/nonexclusive-distrib/1.0/","  Excitons in atomically-thin semiconductors necessarily lie close to a
surface, and therefore their properties are expected to be strongly influenced
by the surrounding dielectric environment. However, systematic studies
exploring this role are challenging, in part because the most readily
accessible exciton parameter -- the exciton's optical transition energy -- is
largely \textit{un}affected by the surrounding medium. Here we show that the
role of the dielectric environment is revealed through its systematic influence
on the \textit{size} of the exciton, which can be directly measured via the
diamagnetic shift of the exciton transition in high magnetic fields. Using
exfoliated WSe$_2$ monolayers affixed to single-mode optical fibers, we tune
the surrounding dielectric environment by encapsulating the flakes with
different materials, and perform polarized low-temperature magneto-absorption
studies to 65~T. The systematic increase of the exciton's size with dielectric
screening, and concurrent reduction in binding energy (also inferred from these
measurements), is quantitatively compared with leading theoretical models.
These results demonstrate how exciton properties can be tuned in future 2D
optoelectronic devices.
","[{""version"":""v1"",""created"":""Wed, 17 Aug 2016 20:15:36 GMT""}]","2016-12-06"
"1608.05094","Tobias Birnbaum","Tobias Birnbaum, Yonina C. Eldar, Deanna Needell","Tolerant Compressed Sensing With Partially Coherent Sensing Matrices","15 pages, 13 figures",,,,"cs.IT math.IT","http://arxiv.org/licenses/nonexclusive-distrib/1.0/","  Most of compressed sensing (CS) theory to date is focused on incoherent
sensing, that is, columns from the sensing matrix are highly uncorrelated.
However, sensing systems with naturally occurring correlations arise in many
applications, such as signal detection, motion detection and radar. Moreover,
in these applications it is often not necessary to know the support of the
signal exactly, but instead small errors in the support and signal are
tolerable.
  Despite the abundance of work utilizing incoherent sensing matrices, for this
type of tolerant recovery we suggest that coherence is actually beneficial. We
promote the use of coherent sampling when tolerant support recovery is
acceptable, and demonstrate its advantages empirically. In addition, we provide
a first step towards theoretical analysis by considering a specific
reconstruction method for selected signal classes.
","[{""version"":""v1"",""created"":""Wed, 17 Aug 2016 20:21:24 GMT""},{""version"":""v2"",""created"":""Thu, 6 Apr 2017 16:18:55 GMT""},{""version"":""v3"",""created"":""Mon, 10 Jul 2017 08:54:08 GMT""},{""version"":""v4"",""created"":""Mon, 28 Aug 2017 09:37:47 GMT""}]","2017-08-29"
