"1608.05164","Yao Wang","Yao Wang, Shan-Shan Wang, Yunhao Lu, Jianzhong Jiang, Shengyuan A.
  Yang","Strain-induced Isostructural and Magnetic Phase Transitions in Monolayer
  MoN$_2$","21 pages,5 figures","Nano Lett.,2016, 16(7),pp 4576-4582","10.1021/acs.nanolett.6b01841",,"cond-mat.mtrl-sci","http://arxiv.org/licenses/nonexclusive-distrib/1.0/","  The change of bonding status, typically occurring only in chemical processes,
could dramatically alter the material properties. Here, we show that a tunable
breaking and forming of a diatomic bond can be achieved through physical means,
i.e., by a moderate biaxial strain, in the newly discovered MoN$_2$
two-dimensional (2D) material. Based on first-principles calculations, we
predict that as the lattice parameter is increased under strain, there exists
an isostructural phase transition at which the N-N distance has a sudden drop,
corresponding to the transition from a N-N nonbonding state to a N-N single
bond state. Remarkably, the bonding change also induces a magnetic phase
transition, during which the magnetic moments transfer from the N(2p)
sublattice to the Mo(4d) sublattice, meanwhile the type of magnetic coupling is
changed from ferromagnetic to anti-ferromagnetic. We provide a physical picture
for understanding these striking effects. The discovery is not only of great
scientific interest in exploring unusual phase transitions in low-dimensional
systems, but it also reveals the great potential of the 2D MoN$_2$ material in
the nanoscale mechanical, electronic, and spintronic applications.
","[{""version"":""v1"",""created"":""Thu, 18 Aug 2016 03:36:13 GMT""},{""version"":""v2"",""created"":""Wed, 22 Feb 2017 02:09:00 GMT""}]","2017-02-23"
"1608.05165","Fang Li","Min Huang and Fang Li","On Structure of cluster algebras of geometric type, II: Green's
  equivalences and paunched surfaces","26 pages, 7 figures",,,,"math.RA math.AC math.AT math.RT","http://arxiv.org/licenses/nonexclusive-distrib/1.0/","  Following our previous work [18], we introduce the notions of partial seed
homomorphisms and partial ideal rooted cluster morphisms. Related to the theory
of Green's equivalences, the isomorphism classes of sub-rooted cluster algebras
of a rooted cluster algebra are corresponded one-by-one to the regular
$\mathcal D$-classes of the semigroup consisting of partial seed endomorphisms
of the initial seed. Moreover, for a rooted cluster algebra from a Riemannian
surface, they are also corresponded to the isomorphism classes of the so-called
paunched surfaces.
","[{""version"":""v1"",""created"":""Thu, 18 Aug 2016 03:46:21 GMT""}]","2016-08-19"
"1608.05166","Tobias Galla","Tobias Galla, Vicente P\'erez-Mu\~nuzuri","Time scales and species coexistence in chaotic flows","5 pages, 4 figures","EPL, 117 (2017) 68001","10.1209/0295-5075/117/68001",,"q-bio.PE cond-mat.stat-mech physics.ao-ph","http://arxiv.org/licenses/nonexclusive-distrib/1.0/","  Empirical observations in marine ecosystems have suggested a balance of
biological and advection time scales as a possible explanation of species
coexistence. To characterise this scenario, we measure the time to fixation in
neutrally evolving populations in chaotic flows. Contrary to intuition the
variation of time scales does not interpolate straightforwardly between the
no-flow and well-mixed limits; instead we find that fixation is the slowest at
intermediate Damk\""ohler numbers, indicating long-lasting coexistence of
species. Our analysis shows that this slowdown is due to spatial organisation
on an increasingly modularised network. We also find that diffusion can either
slow down or speed up fixation, depending on the relative time scales of flow
and evolution.
","[{""version"":""v1"",""created"":""Thu, 18 Aug 2016 04:14:44 GMT""}]","2018-04-09"
"1608.05167","Gui-Song Xia","Gui-Song Xia, Jingwen Hu, Fan Hu, Baoguang Shi, Xiang Bai, Yanfei
  Zhong, Liangpei Zhang","AID: A Benchmark Dataset for Performance Evaluation of Aerial Scene
  Classification",,"IEEE Transactions on Geoscience and Remote Sensing, Vol. 55, No.7,
  pp.3965-3981 (July 2017)","10.1109/TGRS.2017.2685945",,"cs.CV","http://arxiv.org/licenses/nonexclusive-distrib/1.0/","  Aerial scene classification, which aims to automatically label an aerial
image with a specific semantic category, is a fundamental problem for
understanding high-resolution remote sensing imagery. In recent years, it has
become an active task in remote sensing area and numerous algorithms have been
proposed for this task, including many machine learning and data-driven
approaches. However, the existing datasets for aerial scene classification like
UC-Merced dataset and WHU-RS19 are with relatively small sizes, and the results
on them are already saturated. This largely limits the development of scene
classification algorithms. This paper describes the Aerial Image Dataset (AID):
a large-scale dataset for aerial scene classification. The goal of AID is to
advance the state-of-the-arts in scene classification of remote sensing images.
For creating AID, we collect and annotate more than ten thousands aerial scene
images. In addition, a comprehensive review of the existing aerial scene
classification techniques as well as recent widely-used deep learning methods
is given. Finally, we provide a performance analysis of typical aerial scene
classification and deep learning approaches on AID, which can be served as the
baseline results on this benchmark.
","[{""version"":""v1"",""created"":""Thu, 18 Aug 2016 04:20:45 GMT""}]","2017-07-18"
"1608.05168","Cory James Kleinheksel","Cory J. Kleinheksel and Arun K. Somani","Optical quorum cycles for efficient communication","arXiv admin note: substantial text overlap with arXiv:1608.05170,
  arXiv:1608.05172","Photon Netw Commun (2016) 31: 196","10.1007/s11107-015-0561-8",,"cs.NI","http://arxiv.org/licenses/nonexclusive-distrib/1.0/","  Many optical networks face heterogeneous communication requests requiring
topologies to be efficient and fault tolerant. For efficiency and distributed
control, it is common in distributed systems and algorithms to group nodes into
intersecting sets referred to as quorum sets. We show efficiency and
distributed control can also be accomplished in optical network routing by
applying the same established quorum set theory. Cycle-based optical network
routing, whether using SONET rings or p-cycles, provides the sufficient
reliability in the network. Light-trails forming a cycle allow broadcasts
within a cycle to be used for efficient multicasts. Cyclic quorum sets also
have all pairs of nodes occurring in one or more quorums, so efficient,
arbitrary unicast communication can occur between any two nodes. Efficient
broadcasts to all network nodes are possible by a node broadcasting to all
quorum cycles to which it belongs (O(sqrt(N))). In this paper, we propose
applying the distributed efficiency of the quorum sets to routing optical
cycles based on light-trails. With this new method of topology construction,
unicast and multicast communication requests do not need to be known or even
modeled a priori. Additionally, in the presence of network link faults, greater
than 99 % average coverage enables the continued operation of nearly all
arbitrary unicast and multicast requests in the network. Finally, to further
improve the fault coverage, an augmentation to the ECBRA cycle finding
algorithm is proposed.
","[{""version"":""v1"",""created"":""Thu, 18 Aug 2016 04:28:47 GMT""}]","2016-08-20"
"1608.05169","Hsiang-Hsuan Liu","Wing-Kai Hon, Ton Kloks, Fu-Hong Liu, Hsiang-Hsuan Liu, Tao-Ming Wang","P_3-Games",,,,,"cs.DM","http://arxiv.org/licenses/nonexclusive-distrib/1.0/","  Without further ado, we present the P_3-game. The P_3-game is decidable for
elementary classes of graphs such as paths and cycles. From an algorithmic
point of view, the connected P_3-game is fascinating. We show that the
connected P_3-game is polynomially decidable for classes such as trees, chordal
graphs, ladders, cacti, outerplanar graphs and circular arc graphs.
","[{""version"":""v1"",""created"":""Thu, 18 Aug 2016 04:31:00 GMT""}]","2016-08-19"
"1608.05170","Cory James Kleinheksel","Cory J. Kleinheksel and Arun K. Somani","Resource efficient redundancy using quorum-based cycle routing in
  optical networks","17th International Conference on Transparent Optical Networks
  (ICTON), 5-9 July 2015. arXiv admin note: substantial text overlap with
  arXiv:1608.05172, arXiv:1608.05168","2015 17th International Conference on Transparent Optical Networks
  (ICTON), Budapest, 2015, pp. 1-4","10.1109/ICTON.2015.7193340",,"cs.NI","http://arxiv.org/licenses/nonexclusive-distrib/1.0/","  In this paper we propose a cycle redundancy technique that provides optical
networks almost fault-tolerant point-to-point and multipoint-to-multipoint
communications. The technique more importantly is shown to approximately halve
the necessary light-trail resources in the network while maintaining the
fault-tolerance and dependability expected from cycle-based routing. For
efficiency and distributed control, it is common in distributed systems and
algorithms to group nodes into intersecting sets referred to as quorum sets.
Optimal communication quorum sets forming optical cycles based on light-trails
have been shown to flexibly and efficiently route both point-to-point and
multipoint-to-multipoint traffic requests. Commonly cycle routing techniques
will use pairs of cycles to achieve both routing and fault-tolerance, which
uses substantial resources and creates the potential for underutilization.
Instead, we intentionally utilize redundancy within the quorum cycles for
fault-tolerance such that almost every point-to-point communication occurs in
more than one cycle. The result is a set of cycles with 96.60% - 99.37% fault
coverage, while using 42.9% - 47.18% fewer resources.
","[{""version"":""v1"",""created"":""Thu, 18 Aug 2016 04:35:50 GMT""}]","2016-08-20"
"1608.05171","Yachao Liu","Y. C. Liu, V. Wang, M. G. Xia, S. L. Zhang","First-principles Study on Structural, Thermal, Mechanical and Dynamic
  Stability of T'-MoS$_2$","10 pages, 12 figures, 3 tables","J. Phys.: Condens. Matter 29 (2017) 095702","10.1088/1361-648X/aa5213",,"cond-mat.mes-hall","http://arxiv.org/licenses/nonexclusive-distrib/1.0/","  Using first-principles density functional theory calculations, we investigate
the structure, stability, optical modes and electronic band gap of a distorted
tetragonal MoS$_2$ monolayer (T'-MoS$_2$). Our simulated scanning tunnel
microscopy (STM) images of T'-MoS$_2$ are dramatically similar with those STM
images which were identified as K$_{x}$(H$_{2}$O)$_{y}$MoS$_{2}$ from a
previous experimental study. This similarity suggests that T'-MoS$_2$ might
have already been observed in experiment but was unexpectedly misidentified.
Furthermore, we verify the stability of T'-MoS$_2$ from thermal, mechanical and
dynamic aspects, by \emph{ab initio} molecular dynamics simulation, elastic
constants evaluation and phonon band structure calculation based on density
functional perturbation theory, respectively. In addition, we calculate the
eigenfrequencies and eigenvectors of the optical modes of T'-MoS$_2$ at
$\Gamma$ point and distinguish their Raman and infrared activity by pointing
out their irreducible representations using group theory; at the same time, we
compare the Raman modes of T'-MoS$_2$ with those of H-MoS$_2$ and T-MoS$_2$.
Our results provide a useful guidance for further experimental identification
and characterization of T'-MoS$_2$.
","[{""version"":""v1"",""created"":""Thu, 18 Aug 2016 04:43:45 GMT""},{""version"":""v2"",""created"":""Thu, 3 Aug 2017 02:57:55 GMT""}]","2017-08-04"
"1608.05172","Cory James Kleinheksel","Cory J. Kleinheksel and Arun K. Somani","Enhancing fault tolerance capabilities in quorum-based cycle routing","7th International Workshop on Reliable Networks Design and Modeling,
  5-7 Oct. 2015. arXiv admin note: substantial text overlap with
  arXiv:1608.05170, arXiv:1608.05168","Reliable Networks Design and Modeling (RNDM), 2015 7th
  International Workshop on, Munich, 2015, pp. 27-33","10.1109/RNDM.2015.7324305",,"cs.NI","http://arxiv.org/licenses/nonexclusive-distrib/1.0/","  In this paper we propose a generalized R redundancy cycle technique that
provides optical networks almost fault-tolerant communications. More
importantly, when applied using only single cycles rather than the standard
paired cycles, the generalized R redundancy technique is shown to almost halve
the necessary light-trail resources in the network while maintaining the
fault-tolerance and dependability expected from cycle-based routing. For
efficiency and distributed control, it is common in distributed systems and
algorithms to group nodes into intersecting sets referred to as quorum sets.
Optimal communication quorum sets forming optical cycles based on light-trails
have been shown to flexibly and efficiently route both point-to-point and
multipoint-to-multipoint traffic requests. Commonly cycle routing techniques
will use pairs of cycles to achieve both routing and fault-tolerance, which
uses substantial resources and creates the potential for underutilization.
Instead, we intentionally utilize R redundancy within the quorum cycles for
fault-tolerance such that every point-to-point communication pairs occur in at
least R cycles. The result is a set of R = 3 redundant cycles with 93.23-99.34%
fault coverage even with two simultaneous faults all while using 38.85-42.39%
fewer resources.
","[{""version"":""v1"",""created"":""Thu, 18 Aug 2016 04:44:11 GMT""}]","2016-08-20"
"1608.05173","Xiaolong Zhong","Xiaolong Zhong and Malay Ghosh","Approximate Bayesian Computation via Sufficient Dimension Reduction",,,,,"stat.CO","http://arxiv.org/licenses/nonexclusive-distrib/1.0/","  Approximate Bayesian computation (ABC) has gained popularity in recent years
owing to its easy implementation, nice interpretation and good performance. Its
advantages are more visible when one encounters complex models where maximum
likelihood estimation as well as Bayesian analysis via Markov chain Monte Carlo
demand prohibitively large amount of time. This paper examines properties of
ABC both from a theoretical as well as from a computational point of view.We
consolidate the ABC theory by proving theorems related to its limiting
behaviour. In particular, we consider partial posteriors, which serve as the
first step towards approximating the full posteriors. Also, a new
semi-automatic algorithm of ABC is proposed using sufficient dimension
reduction (SDR) method. SDR has primarily surfaced in the frequentist
literature. But we have demonstrated in this paper that it has connections with
ABC as well.
","[{""version"":""v1"",""created"":""Thu, 18 Aug 2016 04:46:00 GMT""}]","2016-08-19"
"1608.05174","Cory James Kleinheksel","Cory J. Kleinheksel and Arun K. Somani","Scaling Distributed All-Pairs Algorithms: Manage Computation and Limit
  Data Replication with Quorums","Chapter Information Science and Applications (ICISA) 2016 Volume 376
  of the series Lecture Notes in Electrical Engineering pp 247-257 Date: 16
  February 2016","Kleinheksel, Cory J., and Arun K. Somani. ""Scaling Distributed
  All-Pairs Algorithms."" Information Science and Applications (ICISA) 2016.
  Springer Singapore, 2016. 247-257","10.1007/978-981-10-0557-2_25",,"cs.DC","http://arxiv.org/licenses/nonexclusive-distrib/1.0/","  In this paper we propose and prove that cyclic quorum sets can efficiently
manage all-pairs computations and data replication. The quorums are
O(N/sqrt(P)) in size, up to 50% smaller than the dual N/sqrt(P) array
implementations, and significantly smaller than solutions requiring all data.
Implementation evaluation demonstrated scalability on real datasets with a 7x
speed up on 8 nodes with 1/3rd the memory usage per process. The all-pairs
problem requires all data elements to be paired with all other data elements.
These all-pair problems occur in many science fields, which has led to their
continued interest. Additionally, as datasets grow in size, new methods like
these that can reduce memory footprints and distribute work equally across
compute nodes will be demanded.
","[{""version"":""v1"",""created"":""Thu, 18 Aug 2016 04:51:38 GMT""}]","2016-08-19"
"1608.05175","Sebastian Mentemeier","Jeffrey F. Collamore and Sebastian Mentemeier","Large excursions and conditioned laws for recursive sequences generated
  by random matrices","59 pages",,,,"math.PR","http://arxiv.org/licenses/nonexclusive-distrib/1.0/","  We determine the large exceedance probabilities and large exceedance paths
for the matrix recursive sequence $V_n = M_n V_{n-1} + Q_n, \: n=1,2,\ldots,$
where $\{M_n\}$ is an i.i.d. sequence of $d \times d$ random matrices and $\{
Q_n\}$ is an i.i.d. sequence of random vectors, both with nonnegative entries.
Early work on this problem dates to Kesten's (1973) seminal paper, motivated by
an application to multi-type branching processes. Other applications arise in
financial time series modeling (connected to the study of the GARCH($p,q$)
processes) and in physics, and this recursive sequence has also been the focus
of extensive work in the recent probability literature. In this work, we
characterize the distribution of the first passage time $T_u^A := \inf \{n: V_n
\in u A \}$, where $A$ is a subset of the nonnegative quadrant in ${\mathbb
R}^d$, showing that $T_u^A/u^\alpha$ converges to an exponential law. In the
process, we also revisit and refine Kesten's classical estimate, showing that
if $V$ has the stationary distribution of $\{ V_n \}$, then ${\mathbb P} \left(
V \in uA \right) \sim C_A u^{-\alpha}$ as $u \to \infty$, providing, most
importantly, a new characterization of the constant $C_A$. Finally, we describe
the large exceedance paths via two conditioned limit laws. In the first, we
show that conditioned on a large exceedance, the process $\{ V_n\}$ follows an
exponentially-shifted Markov random walk, which we identify, thereby
generalizing results for classical random walk to matrix recursive sequences.
In the second, we characterize the empirical distribution of $\{ \log |V_n| -
\log |V_{n-1}| \}$ prior to a large exceedance, showing that this distribution
converges to the stationary law of the exponentially-shifted Markov random
walk.
","[{""version"":""v1"",""created"":""Thu, 18 Aug 2016 05:01:26 GMT""}]","2016-08-19"
"1608.05176","Sudarshan Guruacharya","Tachporn Sanguanpuak, Sudarshan Guruacharya, Nandana Rajatheva, Mehdi
  Bennis, Matti Latva-Aho","Multi-Operator Spectrum Sharing for Small Cell Networks : A Matching
  Game Perspective",,,,,"cs.IT math.IT","http://arxiv.org/licenses/nonexclusive-distrib/1.0/","  One of the many problems faced by current cellular network technology is the
under utilization of the dedicated, licensed spectrum of network operators. An
emerging paradigm to solve this issue is to allow multiple operators to share
some parts of each others' spectrum. Previous works on spectrum sharing have
failed to integrate the theoretical insights provided by recent developments in
stochastic geometrical approaches to cellular network analysis with the
objectives of network resource allocation problems. In this paper, we study the
non-orthogonal spectrum assignment with the goal of maximizing the social
welfare of the network, defined as the expected weighted sum rate of the
operators. We adopt the many-to-one stable matching game framework to tackle
this problem. Moreover, using the stochastic geometrical approach, we show that
its solution can be both stable as well as socially optimal. This allows for
computation of the game theoretical solution using generic Markov Chain Monte
Carlo method. We also investigate the role of power allocation schemes using
Q-learning, and we numerically show that the effect of resource allocation
scheme is much more significant than the effect of power allocation for the
social welfare of the system.
","[{""version"":""v1"",""created"":""Thu, 18 Aug 2016 05:03:48 GMT""}]","2016-08-19"
"1608.05177","Youbao Tang","Youbao Tang, Xiangqian Wu, and Wei Bu","Deeply-Supervised Recurrent Convolutional Neural Network for Saliency
  Detection","5 pages, 5 figures, accepted by ACMMM 2016",,,,"cs.CV","http://arxiv.org/licenses/nonexclusive-distrib/1.0/","  This paper proposes a novel saliency detection method by developing a
deeply-supervised recurrent convolutional neural network (DSRCNN), which
performs a full image-to-image saliency prediction. For saliency detection, the
local, global, and contextual information of salient objects is important to
obtain a high quality salient map. To achieve this goal, the DSRCNN is designed
based on VGGNet-16. Firstly, the recurrent connections are incorporated into
each convolutional layer, which can make the model more powerful for learning
the contextual information. Secondly, side-output layers are added to conduct
the deeply-supervised operation, which can make the model learn more
discriminative and robust features by effecting the intermediate layers.
Finally, all of the side-outputs are fused to integrate the local and global
information to get the final saliency detection results. Therefore, the DSRCNN
combines the advantages of recurrent convolutional neural networks and
deeply-supervised nets. The DSRCNN model is tested on five benchmark datasets,
and experimental results demonstrate that the proposed method significantly
outperforms the state-of-the-art saliency detection approaches on all test
datasets.
","[{""version"":""v1"",""created"":""Thu, 18 Aug 2016 05:08:16 GMT""}]","2016-08-19"
"1608.05178","Mahender Singh","Valeriy G. Bardakov, Pinka Dey and Mahender Singh","Automorphism groups of quandles arising from groups","11 pp, minor typo corrected","Monatshefte fur Mathematik 184 (2017), 519--530","10.1007/s00605-016-0994-x",,"math.GR math.GT","http://arxiv.org/licenses/nonexclusive-distrib/1.0/","  Let $G$ be a group and $\varphi \in \Aut(G)$. Then the set $G$ equipped with
the binary operation $a*b=\varphi(ab^{-1})b$ gives a quandle structure on $G$,
denoted by $\Alex(G, \varphi)$ and called the generalised Alexander quandle.
When $G$ is additive abelian and $\varphi = -\id_G$, then $\Alex(G, \varphi)$
is the well-known Takasaki quandle. In this paper, we determine the group of
automorphisms and inner automorphisms of Takasaki quandles of abelian groups
with no 2-torsion, and Alexander quandles of finite abelian groups with respect
to fixed-point free automorphisms. As an application, we prove that if $G\cong
(\mathbb{Z}/p \mathbb{Z})^n$ and $\varphi$ is multiplication by a non-trivial
unit of $\mathbb{Z}/p \mathbb{Z}$, then $\Aut\big(\Alex(G, \varphi)\big)$ acts
doubly transitively on $\Alex(G, \varphi)$. This generalises a recent result of
\cite{Ferman} for quandles of prime order.
","[{""version"":""v1"",""created"":""Thu, 18 Aug 2016 05:08:39 GMT""},{""version"":""v2"",""created"":""Sun, 21 Aug 2016 15:00:32 GMT""},{""version"":""v3"",""created"":""Mon, 3 Oct 2016 11:57:47 GMT""},{""version"":""v4"",""created"":""Tue, 5 Dec 2017 17:52:08 GMT""}]","2021-07-22"
"1608.05179","Wei Ma","Wei Ma and Xun Liu","Improving the Efficiency of DAMAS for Sound Source Localization via
  Wavelet Compression Computational Grid","15 pages, 6 figures, 2 tables, 23 conferences",,"10.1016/j.jsv.2017.02.005",,"cs.SD","http://arxiv.org/licenses/nonexclusive-distrib/1.0/","  Phased microphone arrays are used widely in the applications for acoustic
source localization. Deconvolution approaches such as DAMAS successfully
overcome the spatial resolution limit of the conventional delay-and-sum (DAS)
beamforming method. However deconvolution approaches require high computational
effort compared to conventional DAS beamforming method. This paper presents a
novel method that serves to improve the efficiency of DAMAS via wavelet
compression computational grid rather than via optimizing DAMAS algorithm. In
this method, the efficiency of DAMAS increases with compression ratio. This
method can thus save lots of run time in industrial applications for sound
source localization, particularly when sound sources are just located in a
small extent compared with scanning plane and a band of angular frequency needs
to be calculated. In addition, this method largely retains the spatial
resolution of DAMAS on original computational grid, although with a minor
deficiency that the occurrence probability of aliasing increasing slightly for
complicated sound source.
","[{""version"":""v1"",""created"":""Thu, 18 Aug 2016 05:16:38 GMT""},{""version"":""v2"",""created"":""Mon, 29 Aug 2016 14:31:34 GMT""}]","2017-02-14"
